published_at,source,title,url
,kamcity.com,Unilever Gives Acting CFO Permanent Role,https://www.kamcity.com/namnews/uk-and-ireland/manufacturers/unilever-gives-acting-cfo-permanent-role/
,welt.de,Landkreistag : Bleiben auf 170 Millionen Euro sitzen,https://www.welt.de/regionales/thueringen/article68c95f3e5edc9510719a9be9/Landkreistag-Bleiben-auf-170-Millionen-Euro-sitzen.html
,gazetteherald.co.uk,Sky plans to cut 600 united kingdom roles as it trims tech team after new launches,https://www.gazetteherald.co.uk/news/national/25470828.sky-plans-cut-600-uk-roles-trims-tech-team-new-launches/
,africa-newsroom.com,APO Group - Africa Newsroom / Press release | Transforming Grant Funding to Accelerate Energy Access in Africa - ENGIE Energy Access Publishes New White Paper,https://www.africa-newsroom.com/press/transforming-grant-funding-to-accelerate-energy-access-in-africa-engie-energy-access-publishes-new-white-paper
,xanthitimes.gr,ΕΘΕΛΟΝΤΙΚΗ ΑΙΜΟΔΟΣΙΑ ΣΤΗΝ ΑΓΙΑ ΦΩΤΕΙΝΗ ΤΗΣ ΝΕΑΣ ΧΡΥΣΑΣ - Xanthitimes . gr - Νέα και Ειδήσεις από την Ξάνθη,https://www.xanthitimes.gr/2025/09/16/ethelontiki-aimodosia-stin-agia-foteini-tis-neas-chrysas/
,adgully.com,Affinity acquires Affilizz to strengthen AI - powered affiliate monetization worldwide,https://www.adgully.com/post/6569/affinity-acquires-affilizz-to-strengthen-ai-powered-affiliate-monetization-worldwide
,nypost.com,"Arsenal vs . Athletic Club prediction : Best bet , odds , picks for Tuesday Champions League match",https://nypost.com/2025/09/16/betting/arsenal-vs-athletic-club-prediction-best-bet-odds-picks-for-tuesdays-champions-league-match/
,710keel.com,Louisiana Breakfast Lovers : IHOP Launches $6 Everyday Value Menu,https://710keel.com/ixp/36/p/ihop-6-dollar-value-meals-louisiana/
,thoibaotaichinhvietnam.vn,KienlongBank chuẩn bị niêm yết trên HOSE với hơn 365 triệu cổ phiếu,https://thoibaotaichinhvietnam.vn/kienlongbank-chuan-bi-niem-yet-tren-hose-voi-hon-365-trieu-co-phieu-183341.html
,tickerreport.com,"Henrickson Nauta Wealth Advisors Inc . Invests $268 , 000 in Texas Instruments Incorporated $TXN",https://www.tickerreport.com/banking-finance/13153482/henrickson-nauta-wealth-advisors-inc-invests-268000-in-texas-instruments-incorporated-txn.html
,french.peopledaily.com.cn,Services et innovation : les entreprises chinoises et françaises tracent de nouvelles routes commerciales,http://french.peopledaily.com.cn/Economie/n3/2025/0916/c31355-20366600.html
,baomoi.com,Luật Quản lý thuế ( sửa đổi ): Chuyển từ tư duy  quản lý  sang  phục vụ,https://baomoi.com/luat-quan-ly-thue-sua-doi-chuyen-tu-tu-duy-quan-ly-sang-phuc-vu-c53255033.epi
,forbes.kz,Teniz Capital об экспансии OTP Group на рынок Центральной Азии,https://forbes.kz/articles/teniz-capital-obekspansii-otp-group-na-rynok-tsentralnoy-azii
,focus.ua,Перший електромотоцикл Honda представлено подробитці та фото,https://focus.ua/uk/auto/724359-pershiy-elektromotocikl-honda-predstavleno
,motortrend.com,2026 Volvo Car Lineup Changes : Does Volvo Still Make Wagons ?,https://www.motortrend.com/features/2026-volvo-car-lineup-updates-changes
,inews.hket.com,分析｜為何英偉達為CoreWeave算力收入包底 ？,https://inews.hket.com/article/4009974/%E5%88%86%E6%9E%90%EF%BD%9C%E7%82%BA%E4%BD%95%E8%8B%B1%E5%81%89%E9%81%94%E7%82%BACoreWeave%E7%AE%97%E5%8A%9B%E6%94%B6%E5%85%A5%E5%8C%85%E5%BA%95%EF%BC%9F?mtc=80023
,haberradikal.com,Akışlı Medya Cihazları Pazarı Bölgesel Trendler ve Pazar Payı Tahmini 2025 – 2032 – Haber Radikal,http://www.haberradikal.com/2025/09/16/akisli-medya-cihazlari-pazari-bolgesel-trendler-ve-pazar-payi-tahmini-2025-2032/
,n-tv.de,Henkel stellt Produktion ein : Die Fa - Seife verschwindet aus den Regalen,https://www.n-tv.de/wirtschaft/Die-Fa-Seife-verschwindet-aus-den-Regalen-article26035984.html
,4investors.de,Zinssenkungsfantasie : Kupfer steigt sechs Tage in Folge,https://www.4investors.de/nachrichten/goldinvest.php?sektion=goldinvest&ID=7897
,asahi.com,"U . S . cuts tariff on Japanese autos to 15 % as makers try to trim losses | The Asahi Shimbun : Breaking News , Japan News and Analysis",https://www.asahi.com/ajw/articles/16031108
,es.investing.com,9 joyas de dividendos del S & P 500 que destacarán en un repunte tras la Fed,https://es.investing.com/analysis/9-joyas-de-dividendos-del-sp-500-que-destacaran-en-un-repunte-tras-la-fed-200478711
,es.investing.com,Nvidia : Fundamentales e impulso de crecimiento superan los riesgos geopolíticos,https://es.investing.com/analysis/nvidia-fundamentales-e-impulso-de-crecimiento-superan-los-riesgos-geopoliticos-200478712
,german.china.org.cn,Ausländische Investoren finden „ zahlreiche Möglichkeiten  in China _ China . org . cn,http://german.china.org.cn/txt/2025-09/16/content_118081588.htm
,eldiario.es,El engaño de los  falsos productos canarios,https://www.eldiario.es/canariasahora/opinion/engano-falsos-productos-canarios_132_12605789.html
,thoibaotaichinhvietnam.vn,Những Ngân hàng đầu tiên đăng ký áp dụng sớm tỷ lệ an toàn vốn theo Thông tư 14,https://thoibaotaichinhvietnam.vn/nhung-ngan-hang-dau-tien-dang-ky-ap-dung-som-ty-le-an-toan-von-theo-thong-tu-14-183329.html
,navbharattimes.indiatimes.com,"India Us Free Trade Agreement Talks , भारत - अमेरिका व्यापार वार्ता सिर्फ दिखावा ? क्या 2026 का इंतजार कर रहे ट्रंप , जानें किन मुद्दों पर उलझेगी बात - india - us trade talks know disputed issues trump waiting for us midterm elections amid tariff war",https://navbharattimes.indiatimes.com/world/america/india-us-trade-talks-know-disputed-issues-trump-waiting-for-us-midterm-elections-amid-tariff-war/articleshow/123922681.cms
,vnexpress.net,Thủ tướng : Doanh nghiệp Việt đã trưởng thành hơn,https://vnexpress.net/thu-tuong-doanh-nghiep-viet-da-truong-thanh-hon-4939896.html
,neuquenalinstante.com.ar,Extienden el plazo de convocatoria a empresas internacionales para la compra de agua pesada | Neuquén Al Instante,https://www.neuquenalinstante.com.ar/noticias/2025/09/16/120729-extienden-el-plazo-de-convocatoria-a-empresas-internacionales-para-la-compra-de-agua-pesada
,dailypolitical.com,Henrickson Nauta Wealth Advisors Inc . Acquires Shares of 311 Parker - Hannifin Corporation $PH,https://www.dailypolitical.com/2025/09/16/henrickson-nauta-wealth-advisors-inc-acquires-shares-of-311-parker-hannifin-corporation-ph.html
,themarketsdaily.com,"Woodstock Corp Sells 2 , 182 Shares of iShares Russell Mid - Cap ETF $IWR",https://www.themarketsdaily.com/2025/09/16/woodstock-corp-sells-2182-shares-of-ishares-russell-mid-cap-etf-iwr.html
,economy.okezone.com,KB Valbury Sekuritas - MNC Asset Management Sinergi Perkuat Ekosistem Pasar Modal Indonesia : Okezone Economy,https://economy.okezone.com/read/2025/09/16/278/3170355/kb-valbury-sekuritas-mnc-asset-management-sinergi-perkuat-ekosistem-pasar-modal-indonesia
,dwell.com,How They Pulled It Off : A Record - Breaking Passive House Behind a Refreshed Bungalow,https://www.dwell.com:443/article/forge-craft-architecture-austin-passive-house-a84d9f34
,winnipegfreepress.com,Here a list of August inflation rates for Canadian provinces – Winnipeg Free Press,https://www.winnipegfreepress.com/business/2025/09/16/heres-a-list-of-august-inflation-rates-for-canadian-provinces-3
,defenseworld.net,Plum Street Advisors LLC Buys 146 Shares of Microsoft Corporation $MSFT,https://www.defenseworld.net/2025/09/16/plum-street-advisors-llc-buys-146-shares-of-microsoft-corporation-msft.html
,finanzas.com,El foro de ETF más esperado en España ya tiene fecha : 9 de octubre,https://www.finanzas.com/inversion/foros/etf-20250916/
,fr.allafrica.com,Madagascar : Agriculture biologique - Le pays est en bonne voie pour devenir le leader mondial,https://fr.allafrica.com/stories/202509160459.html
,ilgiornaledelmolise.it,Urso :  Entro fine ottobre il futuro di Stellantis sarà più chiaro,https://www.ilgiornaledelmolise.it/2025/09/16/urso-entro-fine-ottobre-il-futuro-di-stellantis-sara-piu-chiaro/
,finanznachrichten.de,"Form 8 . 3 - The Vanguard Group , Inc .: Qualcomm Incorporated",https://www.finanznachrichten.de/nachrichten-2025-09/66449623-form-8-3-the-vanguard-group-inc-qualcomm-incorporated-015.htm
,vanityfair.it,Temptation Island e poi e poi : come fare una prima serata a budget zero,https://www.vanityfair.it/article/temptation-island-e-poi-e-poi-prima-serata-budget-zero-successo
,defenseworld.net,"Geneos Wealth Management Inc . Has $327 , 000 Holdings in Robinhood Markets , Inc . $HOOD",https://www.defenseworld.net/2025/09/16/geneos-wealth-management-inc-has-327000-holdings-in-robinhood-markets-inc-hood.html
,zonebourse.com,Le taux dinflation annuel du Canada progresse moins que prévu en août,https://www.zonebourse.com/actualite-bourse/le-taux-d-inflation-annuel-du-canada-progresse-moins-que-prevu-en-aout-ce7d58dbdb8ef722
,mittelstandcafe.de,"Humanoid Global sichert sich strategische Beteiligung an Agility Robotics , dem Entwickler eines der weltweit ersten kommerziell eingesetzten humanoiden Roboter",https://www.mittelstandcafe.de/humanoid-global-sichert-sich-strategische-beteiligung-an-agility-robotics-dem-entwickler-eines-der-weltweit-ersten-kommerziell-eingesetzten-humanoiden-roboter-2198202.html
,n.yam.com,蔥價高掛每公斤逾300元 民眾驚呼 ： 吃麵不敢加蔥,https://n.yam.com/Article/20250916253845
,defenseworld.net,"Geneos Wealth Management Inc . Acquires 267 Shares of MetLife , Inc . $MET",https://www.defenseworld.net/2025/09/16/geneos-wealth-management-inc-acquires-267-shares-of-metlife-inc-met.html
,bzi.ro,"Deputatul Silviu Gurlui , despre dronele căzute în România și Polonia : „ Nu sunt inteligente , pot devia zeci de kilometri . Sunt vulnerabile la bruiaj  • Buna Ziua Iasi • BZI . ro",https://www.bzi.ro/deputatul-silviu-gurlui-despre-dronele-cazute-in-romania-si-polonia-nu-sunt-inteligente-pot-devia-zeci-de-kilometri-sunt-vulnerabile-la-bruiaj-5350830
,defenseworld.net,"Jones Financial Companies Lllp Buys 279 , 426 Shares of Microsoft Corporation $MSFT",https://www.defenseworld.net/2025/09/16/jones-financial-companies-lllp-buys-279426-shares-of-microsoft-corporation-msft.html
,news18.com,From GenAI To ESG : New MBA Specialisations Shaping Future Business Leaders,https://www.news18.com/education-career/from-genai-to-esg-new-mba-specialisations-shaping-future-business-leaders-9576263.html
,agronews.gr,"Πλημμύρες και ξηρασίες παραλύουν αλυσίδες εφοδιασμού και γεωργία , τρύπα 43 δις άνοιξαν φέτος στην τσέπη της Ευρώπης",https://www.agronews.gr/oikonomia-kai-politiki/diethni/224463/plimmures-kai-xirasies-paraluoun-alusides-efodiasmou-kai-georgia-fetos-anoixan-trupa-43-dis-stin-tsepi-tis-europis/
,benzinga.com,"Top 2 Energy Stocks That Are Ticking Portfolio Bombs - American Resources ( NASDAQ : AREC ), Equinox Gold ( AMEX : EQX )",https://www.benzinga.com/trading-ideas/short-ideas/25/09/47689854/top-2-energy-stocks-that-are-ticking-portfolio-bombs-5
,haberradikal.com,Konuşma Analitiği Pazarı Yatırım Görünümü ve Trend Tahmini 2025 – 2032 – Haber Radikal,http://www.haberradikal.com/2025/09/16/konusma-analitigi-pazari-yatirim-gorunumu-ve-trend-tahmini-2025-2032/
,southwalesargus.co.uk,DWP State Pension set to rise by more than £500 from April,https://www.southwalesargus.co.uk/news/25470498.dwp-state-pension-set-rise-500-april/
,eldiario.es,Drones en Polonia : la sobreactuación europea como cortina de humo,https://www.eldiario.es/canariasahora/opinion/drones-polonia-sobreactuacion-europea-cortina-humo_132_12605839.html
,themarketsdaily.com,Livforsakringsbolaget Skandia Omsesidigt Boosts Stock Holdings in Caterpillar Inc . $CAT,https://www.themarketsdaily.com/2025/09/16/livforsakringsbolaget-skandia-omsesidigt-boosts-stock-holdings-in-caterpillar-inc-cat.html
,dailypolitical.com,"IAM Advisory LLC Buys 18 , 871 Shares of First Trust Nasdaq Cybersecurity ETF $CIBR",https://www.dailypolitical.com/2025/09/16/iam-advisory-llc-buys-18871-shares-of-first-trust-nasdaq-cybersecurity-etf-cibr.html
,thehardtackle.com,Manchester United considering Yehor Yarmolyuk swoop,https://thehardtackle.com/transfer-news/2025/09/16/manchester-united-considering-yehor-yarmolyuk-swoop/
,cfi.net.cn,天地数码 ( 300743 ): 持股5 % 以上股东及其一致行动人减持股份预披露公告 - CFi . CN 中财网,http://www.cfi.net.cn/p20250916002901.html
,varesenews.it,Il Mils riapre le sue porte per una mostra che racconta la storia civile e industriale di Saronno,https://www.varesenews.it/2025/09/il-mils-riapre-le-sue-porte-per-una-mostra-che-racconta-la-storia-civile-e-industriale-di-saronno/2344012/
,dailypolitical.com,Bank of New Hampshire Lowers Stake in Vanguard FTSE All - World ex - US ETF $VEU,https://www.dailypolitical.com/2025/09/16/bank-of-new-hampshire-lowers-stake-in-vanguard-ftse-all-world-ex-us-etf-veu.html
,20minutes.fr,"Transition écologique :  Le statu quo nest pas une option  , la Cour des comptes dénonce les résultats  insuffisants",https://www.20minutes.fr/planete/environnement/4173417-20250916-transition-ecologique-statu-quo-option-cour-comptes-denonce-resultats-insuffisants
,teleborsa.it,Export agroalimentare italiano +6 % nel 1° semestre 2025,https://www.teleborsa.it/News/2025/09/16/export-agroalimentare-italiano-6percent-nel-1-semestre-2025-103.html
,dostor.org,أسعار الذهب اليوم الثلاثاء 16 سبتمبر 2025 في السوقين المصري والعالمي,https://www.dostor.org/5219958
,dw.com,Is Europe winter - ready despite lower gas stocks ? – DW – 09 / 16 / 2025,https://www.dw.com/en/is-europe-winter-ready-despite-lower-gas-stocks/a-73995118
,finanznachrichten.de,GlobeTrotters Resource Group Inc . Announces Filing of Updated Early Warning Report,https://www.finanznachrichten.de/nachrichten-2025-09/66449798-globetrotters-resource-group-inc-announces-filing-of-updated-early-warning-report-296.htm
,thejakartapost.com,Former navy top brass warns on inflation of generals in TNI - Society,https://www.thejakartapost.com/indonesia/2025/09/16/former-navy-top-brass-warns-on-inflation-of-generals-in-tni.html
,megapolitan.kompas.com,"Kacab Bank BUMN Belum Tewas Saat Dibuang ke Sawah Bekasi , tapi Lemas Akibat Dianiaya",https://megapolitan.kompas.com/read/2025/09/16/20041441/kacab-bank-bumn-belum-tewas-saat-dibuang-ke-sawah-bekasi-tapi-lemas
,teleborsa.it,Eni e partner progetto OCTP firmano accordo con Governo Ghana,https://www.teleborsa.it/News/2025/09/16/eni-e-partner-progetto-octp-firmano-accordo-con-governo-ghana-107.html
,tass.ru,"Котяков : потери из - за несчастных случаев на работе оцениваются в 1 , 3 трлн рублей",https://tass.ru/ekonomika/25072747
,teleborsa.it,C  è Posto per Te  arriva a Campobasso : opportunità di lavoro per il Molise,https://www.teleborsa.it/News/2025/09/16/c-e-posto-per-te-arriva-a-campobasso-opportunita-di-lavoro-per-il-molise-105.html
,autonews.fr,Panneau de signalisation retourné : mais quelle est exactement la signification de ce geste insolite ?,https://www.autonews.fr/actualite/panneau-de-signalisation-retourne-mais-quelle-est-exactement-la-signification-de-ce-geste-insolite-139577
,fool.com,Is ASML a Buy ? | The Motley Fool,https://www.fool.com/investing/2025/09/16/is-asml-a-buy/
,tsn.ca,NBA Future Power Rankings : New three - year outlooks for all 30 teams,https://www.tsn.ca/nba/article/nba-future-power-rankings-new-three-year-outlooks-for-all-30-teams-n1-46271632/
,vita.it,"Milano , al via la decima edizione di  Cascina Aperta : incontri e testimonianze per raccontare la cooperazione",https://www.vita.it/comitato-editoriale/milano-al-via-la-decima-edizione-di-cascina-aperta-incontri-e-testimonianze-per-raccontare-la-cooperazione/
,rushlane.com,Ola Electric Production Hits a Million Now What ?,https://www.rushlane.com/ola-electric-production-million-units-milestone-roadster-x-12530393.html
,thoibaotaichinhvietnam.vn,"Chứng khoán phái sinh ngày 16 / 9 : Các hợp đồng tương lai rung lắc mạnh , thanh khoản cải thiện",https://thoibaotaichinhvietnam.vn/chung-khoan-phai-sinh-ngay-169-cac-hop-dong-tuong-lai-rung-lac-manh-thanh-khoan-cai-thien-183347.html
,wiadomosci.radiozet.pl,Nowy wakacyjny trend wśród Polaków . Pokazali liczby .  Coraz śmielej,https://wiadomosci.radiozet.pl/biznes/nowy-wakacyjny-trend-wsrod-polakow-pokazali-liczby-coraz-smielej
,africa-newsroom.com,"APO Group - Africa Newsroom / Press release | CS OILFIELD Joins African Energy Week as Silver Sponsor , Showcasing Performance - Driven Chemical Solutions",https://www.africa-newsroom.com/press/cs-oilfield-joins-african-energy-week-as-silver-sponsor-showcasing-performancedriven-chemical-solutions
,thethaovanhoa.vn,"Phó Thủ tướng Hồ Đức Phớc chủ trì cuộc họp về điều hành chính sách tiền tệ , quản lý thị trường vàng",https://thethaovanhoa.vn/pho-thu-tuong-ho-duc-phoc-chu-tri-cuoc-hop-ve-dieu-hanh-chinh-sach-tien-te-quan-ly-thi-truong-vang-20250916192127427.htm
,wacotrib.com,Loopholes may allow sports betting alternatives in Texas,https://wacotrib.com/news/state-regional/government-politics/article_e753e731-1930-42fe-a907-4455ebd042a7.html
,riminitoday.it,"Riciclaggio e gestione rifiuti , 760mila euro per i Comuni del riminese da Atersir",https://www.riminitoday.it/cronaca/atersir-fondi-comuni-rimini-riciclaggio-rifiuti.html
,mittelstandcafe.de,Millennial Potash durchteufet 220 m Kalimineralisierung in Bohrloch BA - 001 - EXT auf seinem Banio - Kaliprojekt in Gabun,https://www.mittelstandcafe.de/millennial-potash-durchteufet-220-m-kalimineralisierung-in-bohrloch-ba-001-ext-auf-seinem-banio-kaliprojekt-in-gabun-2198215.html
,kristeligt-dagblad.dk,EU - Kommissionen vil fremlægge sanktioner mod Israel onsdag,https://www.kristeligt-dagblad.dk/udland/eu-kommissionen-vil-fremlaegge-sanktioner-mod-israel-onsdag
,critica.com.pa,Unachi :  La universidad no funciona con $72 millones,https://www.critica.com.pa/nacional/unachi-la-universidad-no-funciona-con-72-millones-497474
,sundayworld.com,"First Taco Bell in Ireland comes to Meath service station , helping to create over 100 new jobs",https://www.sundayworld.com/news/irish-news/first-taco-bell-in-ireland-to-open-today-with-close-to-100-jobs-created/a551235685.html
,en.antaranews.com,Indonesia targets food self - sufficiency by December 2025,https://en.antaranews.com/news/380297/indonesia-targets-food-self-sufficiency-by-december-2025
,borsaitaliana.it,"Canada : inflazione Cpi +1 , 9 % annuale , stime al 2 %",https://www.borsaitaliana.it/borsa/notizie/radiocor/economia/dettaglio/canada-inflazione-cpi-19-annuale-stime-al-2-nRC_16092025_1445_466146569.html
,dw.com,Ukraine : Zelenskyy calls for air defense amid fresh strikes – DW – 09 / 16 / 2025,https://www.dw.com/en/ukraine-zelenskyy-calls-for-air-defense-amid-fresh-strikes/live-74009497
,ridus.ru,Евросоюз планирует задействовать 51 млн человек для рынка труда,https://www.ridus.ru/evrosoyuz-planiruet-zadejstvovat-51-mln-chelovek-dlya-rynka-truda-694829.html
,ipsnews.net,Awaza Declaration Could Rewrite Future for Landlocked Nations,https://www.ipsnews.net/2025/09/why-the-awaza-declaration-could-rewrite-the-future-for-the-worlds-landlocked-nations/
,memurlar.net,Akretimden  Dünyasýna Yön Veren Programlar,https://www.memurlar.net/haber/1146401/acikogretim-den-is-dunyasina-yon-veren-programlar.html
,www.rcnradio.com,"Bogota, Cundinamarca, Colombia",https://www.rcnradio.com/bogota/manicure-en-bogota-cuidado-con-quimicos-potencialmente-cancerigenos-en-esmaltes-semipermanentes
,www.rcnradio.com,Colombia,https://www.rcnradio.com/bogota/manicure-en-bogota-cuidado-con-quimicos-potencialmente-cancerigenos-en-esmaltes-semipermanentes
,www.rcnradio.com,Sweden,https://www.rcnradio.com/bogota/manicure-en-bogota-cuidado-con-quimicos-potencialmente-cancerigenos-en-esmaltes-semipermanentes
,indianexpress.com,Nepal,https://indianexpress.com/article/opinion/columns/nepal-king-rpp-karki-gen-z-10253487/
,www.mittelstandcafe.de,Germany,https://www.mittelstandcafe.de/openbank-startet-angebot-zum-handel-mit-kryptow-hrungen-2198180.html
,www.munhwa.com:443,"Seocho, Soul-T'ukpyolsi, South Korea",https://www.munhwa.com:443/article/11533544
,www.munhwa.com:443,"Seoul, Soul-T'ukpyolsi, South Korea",https://www.munhwa.com:443/article/11533544
,www.omanobserver.om,Oman,https://www.omanobserver.om/article/1176625/business/markets/gold-surges-to-another-record-high-of-3690-on-tuesday
,www.thelocal.it,Italy,https://www.thelocal.it/20220516/reader-question-can-i-buy-a-car-in-italy-if-im-not-a-resident
,muz-tv.ru,"Moscow, Moskva, Russia",https://muz-tv.ru/news/stas-peha-gotov-podarit-kvartiru-devushke-v-moskve-posle-treh-let-otnosheniy/
,www.gazetteherald.co.uk,United Kingdom,https://www.gazetteherald.co.uk/news/national/25470828.sky-plans-cut-600-uk-roles-trims-tech-team-new-launches/
,demokracija.si,"Celje, Celje, Slovenia",https://demokracija.si/nasi-kraji/povezujemo-prihodnost-ko-dogodki-postanejo-vec-kot-sejem/
,demokracija.si,Slovenia,https://demokracija.si/nasi-kraji/povezujemo-prihodnost-ko-dogodki-postanejo-vec-kot-sejem/
,www.africa-newsroom.com,Benin,https://www.africa-newsroom.com/press/transforming-grant-funding-to-accelerate-energy-access-in-africa-engie-energy-access-publishes-new-white-paper
,www.africa-newsroom.com,Uganda,https://www.africa-newsroom.com/press/transforming-grant-funding-to-accelerate-energy-access-in-africa-engie-energy-access-publishes-new-white-paper
,www.africa-newsroom.com,Mozambique,https://www.africa-newsroom.com/press/transforming-grant-funding-to-accelerate-energy-access-in-africa-engie-energy-access-publishes-new-white-paper
,www.africa-newsroom.com,Rwanda,https://www.africa-newsroom.com/press/transforming-grant-funding-to-accelerate-energy-access-in-africa-engie-energy-access-publishes-new-white-paper
,www.africa-newsroom.com,Tanzania,https://www.africa-newsroom.com/press/transforming-grant-funding-to-accelerate-energy-access-in-africa-engie-energy-access-publishes-new-white-paper
,www.africa-newsroom.com,Zambia,https://www.africa-newsroom.com/press/transforming-grant-funding-to-accelerate-energy-access-in-africa-engie-energy-access-publishes-new-white-paper
,www.africa-newsroom.com,Nigeria,https://www.africa-newsroom.com/press/transforming-grant-funding-to-accelerate-energy-access-in-africa-engie-energy-access-publishes-new-white-paper
,www.africa-newsroom.com,Kenya,https://www.africa-newsroom.com/press/transforming-grant-funding-to-accelerate-energy-access-in-africa-engie-energy-access-publishes-new-white-paper
,www.finanzen.ch,Estonia,https://www.finanzen.ch/nachrichten/zinsen/eurozone-industrial-production-recovers-in-july-1035152179
,www.finanzen.ch,Croatia,https://www.finanzen.ch/nachrichten/zinsen/eurozone-industrial-production-recovers-in-july-1035152179
,www.finanzen.ch,Hungary,https://www.finanzen.ch/nachrichten/zinsen/eurozone-industrial-production-recovers-in-july-1035152179
,www.finanzen.ch,Malta,https://www.finanzen.ch/nachrichten/zinsen/eurozone-industrial-production-recovers-in-july-1035152179
,www.xanthitimes.gr,"Xanthi, Perifereia Anatolikis Makedonias Kai Thrakis, Greece",https://www.xanthitimes.gr/2025/09/16/ethelontiki-aimodosia-stin-agia-foteini-tis-neas-chrysas/
,www.schwaebische-post.de,Ukraine,http://www.schwaebische-post.de/welt/politik/energiekrieg-eskaliert-ukraine-trifft-oelraffinerie-deutsche-politiker-schliessen-sich-trump-forderungen-an-zr-93938167.html
,www.schwaebische-post.de,"Kiev, Ukraine (General), Ukraine",http://www.schwaebische-post.de/welt/politik/energiekrieg-eskaliert-ukraine-trifft-oelraffinerie-deutsche-politiker-schliessen-sich-trump-forderungen-an-zr-93938167.html
,www.schwaebische-post.de,China,http://www.schwaebische-post.de/welt/politik/energiekrieg-eskaliert-ukraine-trifft-oelraffinerie-deutsche-politiker-schliessen-sich-trump-forderungen-an-zr-93938167.html
,www.schwaebische-post.de,"Beijing, Beijing, China",http://www.schwaebische-post.de/welt/politik/energiekrieg-eskaliert-ukraine-trifft-oelraffinerie-deutsche-politiker-schliessen-sich-trump-forderungen-an-zr-93938167.html
,www.schwaebische-post.de,Russia,http://www.schwaebische-post.de/welt/politik/energiekrieg-eskaliert-ukraine-trifft-oelraffinerie-deutsche-politiker-schliessen-sich-trump-forderungen-an-zr-93938167.html
,www.schwaebische-post.de,Turkey,http://www.schwaebische-post.de/welt/politik/energiekrieg-eskaliert-ukraine-trifft-oelraffinerie-deutsche-politiker-schliessen-sich-trump-forderungen-an-zr-93938167.html
,dailyausaf.com,"Tel Aviv, Tel Aviv, Israel",https://dailyausaf.com/world/2025/09/16/180322/
,www.adgully.com,France,https://www.adgully.com/post/6569/affinity-acquires-affilizz-to-strengthen-ai-powered-affiliate-monetization-worldwide
,www.belfastlive.co.uk,"Belfast, Belfast, United Kingdom",https://www.belfastlive.co.uk/news/northern-ireland/major-belfast-city-airport-extension-32485512
,www.belfastlive.co.uk,Ireland,https://www.belfastlive.co.uk/news/northern-ireland/major-belfast-city-airport-extension-32485512
,www.belfastlive.co.uk,"Northern Ireland, Craigavon, United Kingdom",https://www.belfastlive.co.uk/news/northern-ireland/major-belfast-city-airport-extension-32485512
,www.orientaldaily.com.my,Taiwan,https://www.orientaldaily.com.my/news/north/2025/09/16/762029
