published_at,source,title,url
,mp.cnfol.com,诺皓论金 ： 黄金周评 ， 100美金中线多已兑现 ！_ 中金在线财经号,http://mp.cnfol.com/58042/article/1756643367-141988026.html
,eldiariodechihuahua.mx,De los senadores del PAN y sus compromisos con Chihuahua,https://www.eldiariodechihuahua.mx/opinion/2025/aug/30/de-los-senadores-del-pan-y-sus-compromisos-con-chihuahua-727549.html
,investor.bg,"Оли Рен счита , че рискът от инфлация в еврозоната намалява",https://www.investor.bg/a/515-ikonomika-i-makrodanni/418602-oli-ren-schita-che-riskat-ot-inflatsiya-v-evrozonata-namalyava
,elchubut.com.ar,"Marcelo Mou :  Hay muchas herramientas legales que nosotros vamos a hacer para proteger la empresa , las inversiones y la gente de Red Chamber",https://www.elchubut.com.ar/puerto-madryn/2025-8-30-21-31-0-marcelo-mou-hay-muchas-herramientas-legales-que-nosotros-vamos-a-hacer-para-proteger-la-empresa-las-inversiones-y-la-gente-de-red-chamber
,11alive.com,"Atlanta traffic column | Gridlock Guy on Georgia EV toll , HOV perks ending",https://www.11alive.com/article/traffic/georgias-ev-toll-hov-perks-end-sept-30/85-9ff80006-fa23-4c1d-adf2-e9934ba942ca
,indianexpress.com,"UPSC Key : Modi - Xi meeting , Swadeshi and DIGIPIN",https://indianexpress.com/article/upsc-current-affairs/upsc-key-modi-xi-meeting-swadeshi-digipin-10222024/
,southwalesargus.co.uk,Torfaen leader Anthony Hunt makes Labour Senedd shortlist,https://www.southwalesargus.co.uk/news/25426326.torfaen-leader-anthony-hunt-makes-labour-senedd-shortlist/
,bankerandtradesman.com,Dont Mess with the Market – Please ! - Banker & Tradesman,https://bankerandtradesman.com/dont-mess-with-the-market-please/
,victorygirlsblog.com,Sunday Morning Cafe Cocktails - Victory Girls Blog,https://victorygirlsblog.com/sunday-morning-cafe-cocktails-153/
,southwalesargus.co.uk,Sir Fynwy Torfaen Labour Senedd candidate shortlist,https://www.southwalesargus.co.uk/news/25426199.sir-fynwy-torfaen-labour-senedd-candidate-shortlist/
,otempo.com.br,XP apresenta perspectivas para o mercado financeiro em BH,https://www.otempo.com.br/minas-sa/2025/8/31/xp-apresenta-perspectivas-para-o-mercado-financeiro-durante-evento-em-belo-horizonte
,allkharkov.ua,"Німеччина заморозить соцвиплати Bürgergeld та посилить санкції для безробітних | Новости в Харькове , Украине . Весь Харьков",http://allkharkov.ua/news/other/nmechchina-zamorozit-socviplati-brgergeld-ta-posilit-sankc-dlia-bezrobtnih.html
,eldiariodechihuahua.mx,- Agrietan morenos el escudo de Sheinbaum y la 4T,https://www.eldiariodechihuahua.mx/opinion/2025/aug/30/agrietan-morenos-el-escudo-de-sheinbaum-y-la-4t-727533.html
,eldiariodechihuahua.mx,Mariposas tecnócratas,https://www.eldiariodechihuahua.mx/opinion/2025/aug/30/mariposas-tecnocratas-727545.html
,come-on.de,Milliarden - Investition : Verpufft das Sondervermögen für Infrastrukturprojekte ?,http://www.come-on.de/wirtschaft/verpufft-das-sondervermoegen-fuer-infrastrukturprojekte-zr-93909764.html
,cz.de,Weinfest in Höfer verabschiedet sich vom Thieshof - zwischen Tradition und Wandel,https://www.cz.de/lokales/celle-lk/eschede/tradition-und-wandel-weinfest-in-hoefer-verabschiedet-sich-vom-thieshof-VVSUHV5URZCUFF26OKWCWGNHJY.html
,phunutoday.vn,"20 ngày cuối cùng tháng 7 Cô Hồn : 3 tuổi Con Cưng Diêm Vương , Mưa Tiền Tài giàu số 2 không ai số 1",https://phunutoday.vn/20-ngay-cuoi-cung-thang-7-co-hon-3-tuoi-con-cung-diem-vuong-mua-tien-tai-giau-so-2-khong-ai-so-1-d468254.html
,news.iqilu.com,物流运行稳中有进 ， 物流总额保持增长 透视前7个月我国物流发展 _ 大陆 _ 国内新闻 _ 新闻 _ 齐鲁网,https://news.iqilu.com/china/gedi/2025/0831/5846437.shtml
,sabah.com.tr,"Gençlerbirliği Fenerbahçe maçı ne zaman , saat kaçta , hangi kanalda ? İşte muhtemel 11  ler",https://www.sabah.com.tr/spor/futbol/2025/08/31/genclerbirligi-fenerbahce-maci-ne-zaman-saat-kacta-hangi-kanalda-iste-muhtemel-11ler
,jagranjosh.com,List of Top 10 Richest Airlines 2025 : Check Global Rankings !,https://www.jagranjosh.com/general-knowledge/top-10-richest-airlines-2025-market-cap-revenue-world-1820002085-1
,akronnewsreporter.com,4 key decisions for early retirement,https://www.akronnewsreporter.com/2025/08/31/early-retirement/
,yangtse.com,@ 内容创作者 明起AI生成内容必须  亮明身份,https://www.yangtse.com/news/txs/202508/t20250831_257673.html
,milwaukeesun.com,India forex reserves dip $4 . 4 billion to $690 . 7 billion in latest week : RBI,http://www.milwaukeesun.com/news/278543618/india-forex-reserves-dip-44-billion-to-6907-billion-in-latest-week-rbi
,cz.de,Deutsche Autozulieferer verlieren Marktanteile an China,https://www.cz.de/wirtschaft/deutsche-autozulieferer-verlieren-marktanteile-an-china-7JY7E53WCJNZZHVABXT3727UA4.html
,umbriacronaca.it,"Movida sicura : maxi controlli a Terni , ritirata una patente per guida in stato di ebbrezza",https://www.umbriacronaca.it/2025/08/31/movida-sicura-maxi-controlli-a-terni-ritirata-una-patente-per-guida-in-stato-di-ebbrezza/
,correiobraziliense.com.br,Estudante com 10 aprovaes em medicina é premiado por redao do Enem,https://www.correiobraziliense.com.br/euestudante/trabalho-e-formacao/2025/08/7236917-estudante-com-10-aprovacoes-em-medicina-e-premiado-por-redacao-do-enem.html
,telegrafonline.ro,"Bursa de Valori București a pierdut aproape 6 , 5 miliarde de lei la capitalizare , în ultima săptămână",https://www.telegrafonline.ro/bursa-de-valori-bucuresti-a-pierdut-aproape-65-miliarde-de-lei-la-capitalizare-in-ultima-saptamana
,spravy.pravda.sk,Huliak plánuje v rámci konsolidácie riešiť prenájom budovy jeho rezortu,https://spravy.pravda.sk/domace/clanok/765187-huliak-planuje-v-ramci-konsolidacie-riesit-prenajom-budovy-jeho-rezortu/
,tsn.ua,Місячний календар 1 вересня - які можливості та попередження готує день Астрологія,https://tsn.ua/lady/astrologiya/misiachnyy-horoskop-shcho-mozna-i-choho-ne-mozna-robyty-1-veresnia-2897927.html
,presstv.ir,Iran charts new course with Shanghai bloc partnership,https://www.presstv.ir/Detail/2025/08/31/754106/Iran-charts-new-course-with-Shanghai-bloc-partnership-
,tienphong.vn,Gần 5 . 700 tỷ đồng quà Quốc khánh đã đến tay người dân,https://tienphong.vn/gan-5700-ty-dong-qua-quoc-khanh-da-den-tay-nguoi-dan-post1774513.tpo
,finance.yahoo.com,Pump . fun Buybacks Fuel PUMP Token Revival Amid Broader Crypto Downturn,https://finance.yahoo.com/news/pump-fun-buybacks-fuel-pump-120000355.html
,finance.sina.com.cn,全新岚图知音上市 搭载华为乾崑智驾ADS4与鸿蒙座舱HarmonySpace5,https://finance.sina.com.cn/roll/2025-08-31/doc-infnwrny3548979.shtml
,sierraleonetimes.com,UAE leads global solar energy growth in 2025,http://www.sierraleonetimes.com/news/278543627/uae-leads-global-solar-energy-growth-in-2025
,eluniversal.com.mx,Guerra en Gaza : testimonio de una catástrofe anunciada,https://www.eluniversal.com.mx/cultura/confabulario/guerra-en-gaza-testimonio-de-una-catastrofe-anunciada/
,bankerandtradesman.com,Central Mass . Residential Real Estate Market Now Balanced,https://bankerandtradesman.com/central-mass-residential-real-estate-market-now-balanced/
,antaranews.com,Prabowo perintahkan aparat tegas lindungi aset negara dan pejabat,https://www.antaranews.com/berita/5077393/prabowo-perintahkan-aparat-tegas-lindungi-aset-negara-dan-pejabat
,ambito.com,Tercera sección electoral : el peronismo pone en juego el dominio en su bastión histórico,https://www.ambito.com/ambito-nacional/tercera-seccion-electoral-el-peronismo-pone-juego-el-dominio-su-bastion-historico-n6183504
,fool.co.uk,"Up 60 %, but this investment trust is still packed with value stocks !",https://www.fool.co.uk/2025/08/31/up-60-but-this-investment-trust-is-still-packed-with-value-stocks/
,iha.com.tr,"Laboratuvarın dış cephe kaplamaları ktü , ortalık savaş alanına döndü İhlas Haber Ajansı",https://www.iha.com.tr/antalya-haberleri/laboratuvarin-dis-cephe-kaplamalari-coktu-ortalik-savas-alanina-dondu-293215804
,vedomosti.ru,Bild : правительство Германии отложит отправку своих военных на Украину,https://www.vedomosti.ru/politics/news/2025/08/31/1135378-bild-pravitelstvo-germanii
,eldiariodechihuahua.mx,¿ Con Mayø pasará lo mismo que con  El Chapø  y  El Vicerøy ?,https://www.eldiariodechihuahua.mx/opinion/2025/aug/30/con-mayo-pasara-lo-mismo-que-con-el-chapo-y-el-viceroy-727538.html
,sozcu.com.tr,Otomobillerde vazgeçilmez sanılan o özellik tarih oluyor,https://www.sozcu.com.tr/manuel-vitesler-tarih-oluyor-yeni-araclarin-yalnizca-1-7-si-manuel-p218341
,tageszeitung.it,In Teilzeitmodellen gefangen – Die Neue Südtiroler Tageszeitung,https://www.tageszeitung.it/2025/08/31/in-teilzeitmodellen-gefangen/
,filmweb.pl,Eojjeolsuga eobsda ( 2025 ) - recenzja filmu,https://www.filmweb.pl/reviews/recenzja-filmu-Eojjeolsuga+eobsda-26594
,wlky.com,There may soon be a new approach to treat high blood pressure,https://www.wlky.com/article/baxdrostat-high-blood-pressure-treatment-trial-results/65941339
,eluniversal.com.mx,"Cannabis , activismo por la regulación ;  estos espacios eran inimaginables",https://www.eluniversal.com.mx/metropoli/cannabis-activismo-por-la-regulacion-estos-espacios-eran-inimaginables/
,correiobraziliense.com.br,Como a cannabis pode influenciar nos cuidados dos pets,https://www.correiobraziliense.com.br/revista-do-correio/2025/08/7234017-como-a-cannabis-pode-influenciar-nos-cuidados-dos-pets.html
,star.com.tr,Futbolda milli mesai yarýn baþlayacak,https://www.star.com.tr/spor/futbolda-milli-mesai-yarin-baslayacak-haber-1962780/
,losandes.com.ar,Nuevos televisores : entre la calidad de los puntos cuánticos y el cambio de hábito al mirar TV,https://www.losandes.com.ar/tecno/nuevos-televisores-la-calidad-los-puntos-cuanticos-y-el-cambio-habito-al-mirar-tv-n5961155
,ilpiacenza.it,"« Garage ostruito dai rifiuti dopo il mercato in via Pace , qualcuno intervenga »",https://www.ilpiacenza.it/social/segnalazioni/garage-ostruito-dai-rifiuti-dopo-il-mercato-in-via-pace-qualcuno-intervenga.html
,arabnews.com,S & P maintains Jordan credit rating at  BB -,https://www.arabnews.com/node/2613636/business-economy
,az-online.de,Merz - Regierung zu Bürgergeld : So viel wird 2026 ausgezahlt,http://www.az-online.de/wirtschaft/merz-regierung-zu-buergergeld-so-viel-wird-2026-ausgezahlt-zr-93909798.html
,istoe.com.br,Protestos violentos prosseguem na Indonésia ; presidente denuncia  terrorrimo,https://istoe.com.br/protestos-violentos-prosseguem-na-indonesia-presidente-denuncia-terrorrimo
,163.com,百度19亿美元天价收购将成历史 ： 91助手下月全面停服,https://www.163.com/dy/article/K8ANOPF40519DDQ2.html
,eluniversal.com.mx,"Cannabis , activismo por la regulación ; primero los derechos , luego el mercado : Víctor Noboa",https://www.eluniversal.com.mx/metropoli/cannabis-activismo-por-la-regulacion-primero-los-derechos-luego-el-mercado-victor-noboa/
,farmer.pl,Miały być zmiany w L4 i likwidacja wynagrodzenia chorobowego . Są dwie przeszkody,"https://www.farmer.pl/finanse/mialy-byc-zmiany-w-l4-i-likwidacja-wynagrodzenia-chorobowego-sa-dwie-przeszkody,165589.html"
,wfae.org,"NC teachers among the biggest spenders on classrooms , despite low pay",https://www.wfae.org/education/2025-08-31/nc-teachers-among-the-biggest-spenders-on-classrooms-despite-low-pay
,t-online.de,Proteste eskalieren in Indonesien : Demonstranten plündern Minister - Haus,https://www.t-online.de/nachrichten/ausland/id_100893392/proteste-eskalieren-in-indonesien-demonstranten-pluendern-minister-haus.html
,ziarulevenimentul.ro,Afacerea nunților,https://www.ziarulevenimentul.ro/stiri/Moldova/afacerea-nuntilor--217587082.html
,sun-sentinel.com,"In the sustainable age , how can batteries be safer ? A company says it has the answer",https://www.sun-sentinel.com/2025/08/31/in-the-sustainable-age-how-can-batteries-be-safer-a-company-opening-its-hq-in-alameda-says-it-has-the-answer/
,dw.com,Тунберг пояснила участь у новій акції для Сектора Гази – DW – 31 . 08 . 2025,https://www.dw.com/uk/tunberg-poasnila-ucast-u-novij-akcii-dla-sektora-gazi/a-73825860
,nwzonline.de,Viele Fragen offen nach Tod von 16 - Jähriger in Friedland,"https://www.nwzonline.de/panorama-meldungen/ermittlungen-laufen-viele-fragen-offen-nach-tod-von-16-jaehriger-in-friedland_a_4,2,1885419249.html"
,news.dayoo.com,China Travel  持续升温 家庭组团游中国成暑期新热门 _ 广州日报大洋网,https://news.dayoo.com/world/202508/31/139998_54868127.htm
,tomshw.it,Samsung non migliorerà significativamente la batteria dei prossimi  Edge,https://www.tomshw.it/smartphone/samsung-niente-galaxy-s26-edge-con-batteria-xl-2025-08-31
,smh.com.au,Pony Soprano primed for winning return at Port Macquarie after horror fall,https://www.smh.com.au/sport/racing/pony-soprano-primed-for-winning-return-at-port-macquarie-after-horror-fall-20250831-p5mr8o.html
,investopedia.com,"What To Expect in Markets : Jobs Report , Broadcom Earnings Lead Holiday - Shortened Week",https://www.investopedia.com/what-to-expect-in-markets-jobs-report-broadcom-earnings-lead-holiday-shortened-week-11799384
,biztoc.com,There a housing market shift afoot just ask Realtors,https://biztoc.com/x/dd49b0d41bbf9561
,prokerala.com,"Indians travelling to US fall for 1st time in over 20 years , June numbers down 8 pc",https://www.prokerala.com/news/articles/a1669699.html
,antaranews.com,Prabowo perintahkan tindak tegas pelaku penjarahan rumah pejabat,https://www.antaranews.com/berita/5077365/prabowo-perintahkan-tindak-tegas-pelaku-penjarahan-rumah-pejabat
,wiadomosci.onet.pl,Żółwi kryzys wyniszcza wakacyjny raj . Czyli mroczna strona naszej turystyki,https://wiadomosci.onet.pl/swiat/zolwi-kryzys-wyniszcza-wakacyjny-raj-czyli-mroczna-strona-naszej-turystyki/dwg9eg5
,panampost.com,Votantes y mercados : buenas noticias desde Bolivia,https://panampost.com/fee-panampost/2025/08/31/votantes-y-mercados-buenas-noticias-desde-bolivia/
,repubblica.it,"Smalti senza Tpo e Dmta , tutto quello che c  è da sapere",https://www.repubblica.it/salute/2025/08/29/news/smalti_senza_tpo_e_dmta_tutto_quello_che_c_e_da_sapere-424814899/
,mp.cnfol.com,孔明直播 ：《 9月1日热点信息+个股公告 》_ 中金在线财经号,http://mp.cnfol.com/32038/article/1756640035-141987983
,lasicilia.it,"Sbarchi a Lampedusa , e per 18 richiedenti asilo scatta la  procedura accelerata di frontiera",https://www.lasicilia.it/cronaca/sbarchi-a-lampedusa-e-per-18-richiedenti-asilo-scatta-la-procedura-accelerata-di-frontiera-2599238/
,t-online.de,"Bürgergeld :  Merz würde nicht gefallen , was ich mache",https://www.t-online.de/nachrichten/deutschland/gesellschaft/id_100698670/buergergeld-merz-wuerde-nicht-gefallen-was-ich-mache-.html
,bankerandtradesman.com,Scam Artists Flogging Real Estate Get - Rich Schemes,https://bankerandtradesman.com/scam-artists-flogging-real-estate-get-rich-schemes/
,transfermarkt.at,"Fußball - Transfers , Gerüchte , Marktwerte und News",https://www.transfermarkt.at/?newsupdate=459586&time=2025-08-31_15-15
,gazetteandherald.co.uk,Education Secretary Bridget Phillipson  ashamed  of child poverty levels | The Wiltshire Gazette and Herald,https://www.gazetteandherald.co.uk/news/national/25429250.education-secretary-bridget-phillipson-ashamed-child-poverty-levels/
,siamevent.com,"NIA จัดอีเว้นท์เสิร์ฟผลิตภัณฑ์นวัตกรรมอาหารและเครื่องดื่มไทยถึงมือผู้บริโภค พร้อมเปิดโต๊ะจับคู่ธุรกิจสร้างโอกาสส่งเสริมสินค้าไทยเข้าสู่ตลาดทั้งไทยและสากล มุ่งสร้างรายได้ใหม่กว่า 5 , 000 ลบ .",http://siamevent.com/all-event/?p=228069
,mp.cnfol.com,09 . 01 恒指 、 國期 、 黃金 、 道期 、 納期期貨實戰技術交易策 _ 中金在线财经号,http://mp.cnfol.com/27651/article/1756625590-141987873
,eluniversal.com.mx,"La cerrada de Andrómaco en Polanco , de zona industrial a lujos y cine",https://www.eluniversal.com.mx/opinion/mochilazo-en-el-tiempo/la-cerrada-de-andromaco-en-polanco-de-zona-industrial-a-lujos-y-cine/
,mlive.com,New housing study reveals pressures impacting affordability in Washtenaw County,https://www.mlive.com/news/ann-arbor/2025/08/new-housing-study-reveals-pressures-impacting-affordability-in-washtenaw-county.html
,offalyindependent.ie,Sunday briefing : Man Utd finally win and Newcastle sign new striker,https://www.offalyindependent.ie/2025/08/31/sundays-briefing-man-utd-finally-win-and-newcastle-sign-new-striker/
,tokfm.pl,Mieszkańcy Krakowa złapią się za portfele . Od poniedziałku znaczny wzrost opłat,https://www.tokfm.pl/polska/malopolskie/mieszkancy-krakowa-zlapia-sie-za-portfele-od-poniedzialku-znaczny-wzrost-oplat-za-smieci
,leicestermercury.co.uk,See how much your energy bills will rise amid the new energy price cap,https://www.leicestermercury.co.uk/news/cost-of-living/see-how-much-your-energy-10460022
,correiobraziliense.com.br,Liberdade que veste : o sucesso e conforto da calça aladim,https://www.correiobraziliense.com.br/revista-do-correio/2025/08/7235678-liberdade-que-veste-o-sucesso-e-conforto-da-calca-aladim.html
,presstv.ir,Hundreds stage Night March in Santiago to support Gaza,https://www.presstv.ir/Detail/2025/08/31/754097/Night-March-Santiago-Gaza-solidarity-
,bankerandtradesman.com,Inventory Upswing Triggers Optimism for Mass . Buyers,https://bankerandtradesman.com/inventory-upswing-triggers-optimism-for-mass-buyers/
,itbear.com.cn,英伟达Jetson Thor ： 引领机器人进入高性能AI计算新时代 - 智能汽车 - ITBear科技资讯,https://www.itbear.com.cn/html/2025-08/939483.html
,es.vietnamplus.vn,Vietnam distribuye obsequios del Día Nacional en más del 58 % de comunas,https://es.vietnamplus.vn/vietnam-entrega-casi-seis-billones-de-vnd-en-obsequios-a-ciudadanos-por-dia-nacional-post225069.vnp
,nacion.com,"Feliz aniversario , Chirripó : esto ocurre cuando el parque cumple 50 años y una se atreve a subirlo",https://www.nacion.com/revista-dominical/feliz-aniversario-chirripo-esto-ocurre-cuando-el/EOEPONAI4JFI7BCQLJKMYMIZ7I/story/
,divany.hu,Megőrülnek a gyűjtők ezekért az autókért : 135 másodperc alatt 999 kelt el belőlük,https://divany.hu/offline/auto-gyujto/
,elmundo.es,Los suplementos de proteína : ¿ Una moda o algo necesario ?,https://www.elmundo.es/ciencia-y-salud/salud/2025/08/31/68b3176ce9cf4a795b8b4596.html
,gazeta.ua,РФ готує масштабні атаки на енергетику : Росія готується до нової хвилі ударів по Україні - ISW,https://gazeta.ua/articles/life/_rosiya-gotuyetsya-do-novoyi-hvili-udariv-po-ukrayini-isw/1228721
,aljazeera.com,How a children chocolate drink became a symbol of French colonialism | Features,https://www.aljazeera.com/features/2025/8/31/how-a-childrens-chocolate-drink-became-a-symbol-of-french-colonialism
,dagospia.com,Giorgio armani parla al financial times della sua successione :  vorrei non fosse un momento ...,https://www.dagospia.com/business/giorgio-armani-parla-financial-times-sua-successione-vorrei-non-fosse-445705
,ksta.de,Köln : Hofflohmärkte dürfen nun doch sonntags stattfinden,https://www.ksta.de:443/koeln/koeln-hofflohmaerkte-duerfen-nun-doch-sonntags-stattfinden-1095950
,kauno.diena.lt,Įsismarkavę protestuotojai Indonezijoje nusiaubė finansų ministrės namus,https://kauno.diena.lt/naujienos/pasaulis/konfliktai-nelaimes/isismarkave-protestuotojai-indonezijoje-nusiaube-finansu-ministres-namus-1717553
,tarunbharat.com,"Soybean prices rise , only disappointment in hand !",https://www.tarunbharat.com/soybean-prices-rise-only-disappointment-in-hand/
,almasryalyoum.com,رسميًا .. موعد تظلمات الدور الثاني لطلاب الثانوية العامة 2025,https://www.almasryalyoum.com/news/details/3538030
,finanznachrichten.de,Bitcoin - Bewertung erreicht historischen Tiefpunkt - Neue Layer - 2 - Lösung verspricht Durchbruch,https://www.finanznachrichten.de/nachrichten-2025-08/66314849-bitcoin-bewertung-erreicht-historischen-tiefpunkt-neue-layer-2-loesung-verspricht-durchbruch-303.htm
,foot01.com,ASSE : Au tour de Paris de vouloir acheter Stassin,https://www.foot01.com/equipe/st-etienne/asse-au-tour-de-paris-de-vouloir-acheter-stassin-459418
,verkkouutiset.fi,Ekonomistin mukaan veroale voi rahoittaa itsensä,https://www.verkkouutiset.fi/a/ekonomistin-mukaan-veroale-voi-rahoittaa-itsensa/
,soester-anzeiger.de,Bauernmarkt lockt in historische Kurstadt – es gibt sogar einen verkaufsoffenen Sonntag,http://www.soester-anzeiger.de/nordrhein-westfalen/bauernmarkt-lockt-in-historische-kurstadt-es-gibt-sogar-einen-verkaufsoffenen-sonntag-93909691.html
,zazoom.it,Un pezzo ... di torrone [ Soluzione 2 lettere ],https://www.zazoom.it/soluzioni-cruciverba/definizione/2025-08-31-un-pezzo-di-torrone-15-00/876972/
,cretalive.gr,"ΟΠΕΚΕΠΕ : Έρχονται πληρωμές , τι θα γίνει με το Μ23",https://www.cretalive.gr/kriti/opekepe-erhontai-pliromes-ti-tha-ginei-me-m23
,voh.com.vn,Điểm tin chiều 31 / 8 : Ấn tượng với người dân đón lễ 2 / 9 | Cảnh báo mưa lớn ở nhiều vùng miền Bắc,https://voh.com.vn/chinh-tri-xa-hoi/diem-tin-chieu-318-an-tuong-voi-nguoi-dan-don-le-29-canh-bao-mua-lon-o-nhieu-vung-mien-bac-613596.html
,foxnews.com,East Coast beaches face fecal contamination warnings for Labor Day,https://www.foxnews.com/us/east-coast-beaches-hit-fecal-contamination-warnings-ahead-labor-day-weekend
,radiosvoboda.org,ISW : Росія найближчими тижнями може посилити свої атаки для погіршення стану енергетики України,https://www.radiosvoboda.org/a/news-isw-enerhetyka-ataky-rf-viyna/33517776.html
,tiemposur.com.ar,Los argentinos viajan cada vez más al exterior,https://www.tiemposur.com.ar/info-general/los-argentinos-viajan-cada-vez-mas-al-exterior
,hoy.com.do,10 trabajos más demandados en las zonas francas 2024 - 2028,https://hoy.com.do/10-trabajos-mas-demandados-en-las-zonas-francas-2024-2028/
,unternehmen-heute.de,BERSICHT - Rückschlag für Trump : Gericht erklärt Großteil seiner Zölle für unrechtmig,https://unternehmen-heute.de/news.php?newsid=6670885
,foot01.com,"Rennes récupère 10 ME , le mercato bouleversé",https://www.foot01.com/equipe/rennes/rennes-recupere-10-me-le-mercato-bouleverse-459404
,vietnamplus.vn,Tổng Bí thư : Làm sâu sắc hơn nữa hợp tác giữa hai cơ quan lập pháp Việt - Trung,https://www.vietnamplus.vn/tong-bi-thu-lam-sau-sac-hon-nua-hop-tac-giua-hai-co-quan-lap-phap-viet-trung-post1059116.vnp
,rynekzdrowia.pl,Wojna płci w chirurgii ? Organizatorzy kongresu zmienili tytuł sesji . Prof . Banasiewicz : liczą się kompetencje,"https://www.rynekzdrowia.pl/Polityka-zdrowotna/Wojna-plci-w-chirurgii-Organizatorzy-kongresu-zmienili-tytul-sesji-Prof-Banasiewicz-licza-sie-kompetencje,275139,14.html"
,en.people.cn,How a little - known county quietly captures China functional film market and takes it global,http://en.people.cn/n3/2025/0831/c90000-20359745.html
,cn24tv.it,Vibo . Sequestrate due tonnellate di frutta e verdura : donate in beneficenza,https://cn24tv.it/italia/news/vibo-sequestrate-due-tonnellate-di-frutta-e-verdura-donate-in-beneficenza/
,naslovi.net,Milojević : Gostovanje u Novom Pazaru jedno je od najtežih,https://naslovi.net/2025-08-31/rtv-novi-pazar/milojevic-gostovanje-u-novom-pazaru-jedno-je-od-najtezih/40384492
,f5haber.com,Türkiyenin en değerli markası belli oldu,https://www.f5haber.com/ekonomi/turkiyenin-en-degerli-markasi-belli-oldu-6816305
,almasryalyoum.com,ما هي قيمة رسوم السحب النقدي من ماكينات الـ ATM لجميع البنوك ؟,https://www.almasryalyoum.com/news/details/3538036
,livehindustan.com,"Saiyaara Ahaan Panday Reveals Real Hindu Name of him and sister Alaana सैयारा वाले अहान पांडे ने बताया अपनी असली हिंदू नाम , बॉलीवुड से है खास कनेक्शन , Bollywood Hindi News",https://www.livehindustan.com/entertainment/bollywood/saiyaara-ahaan-panday-reveals-real-hindu-name-of-him-and-sister-alaana-201756642354679.html
,dailytribune.com,Oakland County community calendar Aug . 31 and beyond,https://www.dailytribune.com/2025/08/31/oakland-county-community-calendar-aug-31-and-beyond/
,t-a.no,"Åsen - raset , Levanger | Politiet : Kan være flere måneder til E6 i Levanger åpner igjen",https://www.t-a.no/politiet-kan-vare-flere-maneder-til-e6-i-levanger-apner-igjen/s/5-116-2211027
,diregiovani.it,Lascia la Juve e si trasferisce subito al Napoli : che sgarbo !,https://www.diregiovani.it/2025/08/31/469619-lascia-la-juve-e-si-trasferisce-subito-al-napoli-che-sgarbo.dg/
,e-noticies.cat,Lincreïble oferta que va rebutjar el Reial Madrid per Fede Valverde,https://e-noticies.cat/futbol/oferta-increible-que-rebutjar-real-madrid-fede-valverde
,unternehmen-heute.de,Politik - Merz bekräftigt Forderung nach Einschnitten im Sozialsystem,https://unternehmen-heute.de/news.php?newsid=6670901
