published_at,source,title,url
,schwaebische-post.de,7 Events Ostalbkreis 26 .– 28 . September 2025 trotz Regen,http://www.schwaebische-post.de/ostalb/ostalbkreis/events-ostalbkreis-aalen-ellwangen-gmuend-26-28-september-2025-93951890.html
,felvidek.ma,Nyugat - Európában is „ betelt a pohár  a migráció kapcsán,https://felvidek.ma/2025/09/25/nyugat-europaban-is-betelt-a-pohar-a-migracio-kapcsan/
,baohatinh.vn,Nông dân hối hả xuống đồng sản xuất vụ đông,https://baohatinh.vn/nong-dan-hoi-ha-xuong-dong-san-xuat-vu-dong-post296223.html
,shqipmedia.com,"ADMINISTRATA PUBLIKE : Probleme të vjetra , paralajmërime të reja",https://www.shqipmedia.com/administrata-publike-probleme-te-vjetra-paralajmerime-te-reja/
,ara.cat,La Boqueria posa límits a la venda de productes elaborats,https://www.ara.cat/societat/barcelona/boqueria-posa-limits-venda-productes-elaborats_1_5508215.html
,mirror.co.uk,Martine McCutheon poses for topless snap as she shares plea with fans,https://www.mirror.co.uk/3am/celebrity-news/martine-mccutheon-poses-topless-snap-35964172
,kulturegeek.fr,Nothing fait de sa marque CMF une filiale indépendante avec lInde comme base mondiale,https://kulturegeek.fr/news-339527/nothing-marque-cmf-filiale-independante-linde-base-mondiale
,manilatimes.net,JUICE Co - Founder Troy Osinoff Joins ONAR as Chief Growth Officer to Accelerate Post - Acquisition Expansion,https://www.manilatimes.net/2025/09/25/tmt-newswire/globenewswire/juice-co-founder-troy-osinoff-joins-onar-as-chief-growth-officer-to-accelerate-post-acquisition-expansion/2190495
,hna.de,35 Milliarden für deutsche „ Sicherheitsarchitektur  im All,https://www.hna.de/politik/35-milliarden-fuer-deutsche-sicherheitsarchitektur-im-all-zr-93954261.html
,timesofoman.com,Oman hosts high - level UN event to strengthen global efforts against NCDs in New York,https://timesofoman.com/article/163171-oman-hosts-high-level-un-event-to-strengthen-global-efforts-against-ncds-in-new-york
,tribunnews.com,"Leony Bedah Anggaran Pemkot Tangerang Selatan , Benyamin Davnie Hargai Partisipasi Aktif Masyarakat",https://www.tribunnews.com/metropolitan/7733598/leony-bedah-anggaran-pemkot-tangerang-selatan-benyamin-davnie-hargai-partisipasi-aktif-masyarakat
,teleborsa.it,"Friends , primo semestre in perdita di 871 euro coerente con fase pre - operativa del veicolo",https://www.teleborsa.it/News/2025/09/25/friends-primo-semestre-in-perdita-di-871-euro-coerente-con-fase-pre-operativa-del-veicolo-173.html
,thedrinksbusiness.com,Portman Group issues ban on  Premium Strong Beer  brand,https://www.thedrinksbusiness.com/2025/09/portman-group-issues-ban-on-premium-strong-beer-brand/
,graphic.com.gh,Malawi ex - president wins election in comeback at age 85,https://www.graphic.com.gh/international/international-news/malawis-ex-president-wins-election-in-comeback-at-age-85.html
,tz.de,Ukraine - Krieg : Selenskyj deutet möglichen Rücktritt an – und warnt Moskau vor Angriffen,http://www.tz.de/politik/luftraum-abschiessen-lage-im-ukraine-krieg-polen-will-kuenftig-russlands-jets-im-eigenen-zr-93948744.html
,motor1.uol.com.br,McLaren se rende e também terá SUV híbrido para 2027,https://motor1.uol.com.br/news/773472/mclaren-tambem-fara-suv-hibrido/
,bursadabugun.com,Turistlerin akın akın geldiği pazar kapatıldı !,https://www.bursadabugun.com/haber/turistlerin-akin-akin-geldigi-pazar-kapatildi-1847358.html
,t3n.de,KI im Gesundheitswesen : Sam Altman will Ärzte und ChatGPT enger zusammenbringen,https://t3n.de/news/ki-im-gesundheitswesen-sam-altman-will-aerzte-und-chatgpt-enger-zusammenbringen-1709360/
,diariodelaltoaragon.es,La Diputación de Huesca duplica su ayuda a los pueblos más pequeños en materia de empleo,https://www.diariodelaltoaragon.es/noticias/comarcas/2025/09/25/la-diputacion-duplica-su-ayuda-a-los-pueblos-mas-pequenos-en-materia-de-empleo-1856742-daa.html
,leinsterexpress.ie,"It not just about money , it about mindset : Leah McMahon on financial well - being",https://www.leinsterexpress.ie/news/national-news/1903186/its-not-just-about-money-its-about-mindset-leah-mcmahon-on-financial-well-being.html
,cincodias.elpais.com,Nuevo calendario de la opa : el plazo terminará el 10 de octubre tras la mejora de la oferta,https://cincodias.elpais.com/mercados-financieros/2025-09-25/nuevo-calendario-de-la-opa-el-plazo-terminara-el-10-de-octubre-tras-mejora-de-la-oferta.html
,thoibaotaichinhvietnam.vn,Thứ trưởng Bộ Tài chính : Từng bước đưa Việt Nam thành điểm đến hấp dẫn trên bản đồ tài chính quốc tế,https://thoibaotaichinhvietnam.vn/thu-truong-bo-tai-chinh-tung-buoc-dua-viet-nam-thanh-diem-den-hap-dan-tren-ban-do-tai-chinh-quoc-te-183856.html
,dunya.com,Yabancı yatırımcı hissede alım yaptı - Dünya Gazetesi,https://www.dunya.com/ekonomi/yabanci-yatirimci-hissede-alim-yapti-haberi-795624
,yankton.net,Wall Street points toward losses in premarket as recent red - hot rally appears to be petering out,https://www.yankton.net/news/national_ap/article_4920f2d8-1d2d-551b-a2cf-ae14a0bda49e.html
,laosnews.net,India Scales Up in Innovation and Technology for a New Healthcare Ecosystem,http://www.laosnews.net/news/278600015/india-scales-up-in-innovation-and-technology-for-a-new-healthcare-ecosystem
,biztoc.com,"BXP , Inc . Stock : Is BXP Underperforming the Real Estate Sector ?",https://biztoc.com/x/e758b23a06d3c875
,calgarysun.com,"Varcoe : BoC governor says Canada can benefit from TMX , LNG lessons",https://calgarysun.com/opinion/columnists/varcoe-bank-canada-governor-benefit-lessons-tmx-lng-boost-economy
,goal.pl,Yamal ma stworzyć duet marzeń . Barcelona chce światową gwiazdę,https://www.goal.pl/transfery/yamal-ma-stworzyc-duet-marzen-barcelona-chce-swiatowa-gwiazde/
,cityam.com,Heseltine - founded media giant snaps up trio of marketing titles,https://www.cityam.com/heseltine-founded-media-giant-snaps-up-trio-of-marketing-titles/
,tribunnews.com,"Kasus Aborsi Ilegal Gegerkan Kendari , Polisi Sita 10 Janin dan Ringkus Mahasiswa",https://www.tribunnews.com/regional/7733576/kasus-aborsi-ilegal-gegerkan-kendari-polisi-sita-10-janin-dan-ringkus-mahasiswa
,vedomosti.ru,Стоимость бензина АИ - 92 на бирже вновь обновила рекорд,https://www.vedomosti.ru/business/news/2025/09/25/1142003-stoimost-benzina
,romatoday.it,Corsi dinglese gratuiti nelle scuole dinfanzia : il municipio lancia il progetto  Exploring,https://www.romatoday.it/zone/arvalia/inglese-scuole-infanzia-partono-corsi-municipio-xi.html
,globenewswire.com,Sunrise New Energy Reports Strong Turnaround : Over USD 0 . 57,https://www.globenewswire.com/news-release/2025/09/25/3156382/0/en/Sunrise-New-Energy-Reports-Strong-Turnaround-Over-USD-0-57-Million-Profit-Achieved-in-July-August-2025.html
,leak.pt,Huawei domina o mercado dos dobráveis ! Samsung para trás,https://www.leak.pt/huawei-domina-o-mercado-dos-dobraveis-samsung-para-tras/
,channelbuzz.ca,Intelligent operations platform provider Sumo Logic brings agentic AI into enterprise security stack with launch of Dojo AI on AWS,https://channelbuzz.ca/2025/09/intelligent-operations-platform-provider-sumo-logic-brings-agentic-ai-into-enterprise-security-stack-with-launch-of-dojo-ai-on-aws-44656/
,timesofindia.indiatimes.com,US economy growth : GDP expands at surprising 3 . 8 % pace in April - June quarter ; trade shifts drive Q2 upgrade,https://timesofindia.indiatimes.com/business/international-business/us-economy-growth-gdp-expands-at-surprising-3-8-pace-in-april-june-quarter-trade-shifts-drive-second-quarter-upgrade/articleshow/124120240.cms
,wrfalp.com,"Proposed 2026 County Budget Totals $309 . 7 Million , Reduces Taxes By 54 Cents",https://www.wrfalp.com/proposed-2026-county-budget-totals-309-7-million-reduces-taxes-by-54-cents/
,hulldailymail.co.uk,Half of united kingdom adults living with parents frustrated by lack of independence,https://www.hulldailymail.co.uk/news/uk-world-news/15-biggest-frustrations-brits-tendendo-10525221
,armtimes.com,Պետբյուջեի եկամուտները նախատեսվում են 3 տրիլիոն 91 միլիարդ դրամ . Կառավարությունը հավանություն տվեց նախագծին,https://armtimes.com/hy/article/322609
,proplanta.de,Bosch schrumpft sich gesund - Stellenabbau ohne Ende,https://www.proplanta.de/agrar-nachrichten/unternehmen/bosch-schrumpft-sich-gesund-stellenabbau-ohne-ende_article1758806463.html
,thelocal.it,Why are Europe residents being advised to keep €100 in cash at home ?,https://www.thelocal.it/20250925/why-are-europes-residents-being-advised-to-keep-e100-in-cash-at-home
,polityka.pl,Masaj z komórką . Najbardziej znane plemię Afryki mierzy się z nowoczesnością,"https://www.polityka.pl/tygodnikpolityka/klasykipolityki/1510498,1,masaj-z-komorka-najbardziej-znane-plemie-afryki-mierzy-sie-z-nowoczesnoscia.read"
,n.yam.com,iPhone 17上市換機潮 全台首家碳中和回收商創宇通訊讓你換機零風險,https://n.yam.com/Article/20250925396781
,udn.com,房貸活水增 ！ 國銀不動產比率跌破26 % 寫九年新低 | 金融要聞 | 產經,https://udn.com/news/story/7239/9029959
,torresette.news,"Università , con Unicredit nasce rete tra atenei Sud per nuova figura social change manager",https://www.torresette.news/24-news/2025/09/25/universita-con-unicredit-nasce-rete-tra-atenei-sud-per-nuova-figura-social-change-manager
,wgme.com,"Anthem , Northern Light Health publicly feud as contract deadline looms",https://wgme.com/news/local/anthem-northern-light-health-publicly-feud-as-contract-deadline-looms-negotiate-new-deal-maine-health-care-insurance-hospitals-anthem-blue-cross-blue-shield
,channelbuzz.ca,Akamai restructures partner program with unified Akamai Partner Connect,https://channelbuzz.ca/2025/09/akamai-restructures-partner-program-with-unified-akamai-partner-connect-44661/
,myjoyonline.com,Nicolas Sarkozy found guilty of criminal conspiracy in Libya case,https://www.myjoyonline.com/nicolas-sarkozy-found-guilty-of-criminal-conspiracy-in-libya-case/
,meinbezirk.at,Brunnen versorgt Dorf in Kenia : Sauberes Wasser dank Salzburger Projekt,https://www.meinbezirk.at/flachgau/c-lokales/sauberes-wasser-dank-salzburger-projekt_a7649140
,schwaebische-post.de,Ukraine - Krieg : Selenskyj kündigt Rücktritt nach Kriegsende an – und droht Putins Russland,http://www.schwaebische-post.de/welt/politik/un-ukraine-krieg-trumps-wende-ueberrascht-skeptische-europaeer-putin-new-york-zr-93951580.html
,biztoc.com,"Stitch Fix Posts Q4 Results , Joins Transocean , MBX Biosciences And Other Big Stocks Moving Lower In Thursday Pre - Market Session",https://biztoc.com/x/35278cfa7af204e9
,boainformacao.com.br,É possível cancelar um Pix ? Entenda os limites e alternativas disponíveis,https://boainformacao.com.br/2025/09/e-possivel-cancelar-um-pix-entenda-os-limites-e-alternativas-disponiveis/
,nairametrics.com,"Infinix HOT 60 Pro+ sets new Guinness World Record , reinforces brand among global youth",https://nairametrics.com/2025/09/25/infinix-hot-60-pro-sets-new-guinness-world-record-reinforces-brand-among-global-youth/
,diariodelaltoaragon.es,El PSOE critica la política de vivienda de  lujo y especulación  de Aragón,https://www.diariodelaltoaragon.es/noticias/aragon/2025/09/25/el-psoe-critica-la-politica-de-vivienda-de-lujo-y-especulacion-de-aragon-1856731-daa.html
,cnnindonesia.com,"Bareskrim Buru Sosok D , Pemberi Informasi Rekening Dormant Rp204 M",https://www.cnnindonesia.com/nasional/20250925161516-12-1277723/bareskrim-buru-sosok-d-pemberi-informasi-rekening-dormant-rp204-m
,graphic.com.gh,Ese ne Tekrema : The united kingdom and Ghana partnership in a new global era,https://www.graphic.com.gh/features/opinion/ese-ne-tekrema-the-uk-and-ghanas-partnership-in-a-new-global-era.html
,thoibaotaichinhvietnam.vn,"Ô tô nhập khẩu tăng mạnh , hơn 29 % so với cùng kỳ",https://thoibaotaichinhvietnam.vn/o-to-nhap-khau-tang-manh-hon-29-so-voi-cung-ky-183855.html
,lanzadigital.com,Tres fundaciones suman esfuerzos en La Solana para impulsar el futuro del medio rural,https://www.lanzadigital.com/provincia/la-solana/tres-fundaciones-suman-esfuerzos-en-la-solana-para-impulsar-el-futuro-del-medio-rural/
,motor1.uol.com.br,M1 Numbers : como a Fiat se tornou mais brasileira do que italiana,https://motor1.uol.com.br/news/773476/m1-numbers-fiat-vendas-brasil/
,dunya.com,"AB , Alman şirketi SAP hakkında rekabet soruşturması başlattı",https://www.dunya.com/dunya/ab-alman-sirketi-sap-hakkinda-rekabet-sorusturmasi-baslatti-haberi-795632
,finance.sina.com.cn,AI将成新用户界面 ！ 高通CEO定义AI六大趋势 ： 体验从  以手机为中心  转向  以智能体为中心,https://finance.sina.com.cn/jjxw/2025-09-25/doc-infrtptx8331125.shtml
,dailynews.co.th,เฟทโก้ ชง4มาตรการ  Quick – Big Win  ฟื้นตลาดทุน,https://www.dailynews.co.th/news/5146798/
,finanznachrichten.de,"Finma sieht bei UBS - Notfallplan Fortschritte , aber noch Probleme",https://www.finanznachrichten.de/nachrichten-2025-09/66535921-finma-sieht-bei-ubs-notfallplan-fortschritte-aber-noch-probleme-015.htm
,newsone.com,Trump Obsession With And War Against Black Women In Power,https://newsone.com/6487112/trump-obsession-with-war-against-black-women-power/
,europapress.es,Una empresa en Laviana transformará biorresiduos en materias primas de alto valor añadido mediante el uso de insectos,https://www.europapress.es/asturias/noticia-empresa-laviana-transformara-biorresiduos-materias-primas-alto-valor-anadido-uso-insectos-20250925143331.html
,riviera24.it,"Imperia , doppio consiglio comunale su bilancio , ex stazioni ferroviarie e premi Nobel",https://www.riviera24.it/2025/09/imperia-doppio-consiglio-comunale-su-bilancio-ex-stazioni-ferroviarie-e-premi-nobel-933511
,interfax.ru,"ВВП США во II квартале вырос на 3 , 8 % - максимум за семь кварталов",https://www.interfax.ru/business/1049292
,russian.rt.com,Экономист Балынин рассказал о правилах расчёта больничных в 2025 году,https://russian.rt.com/russia/news/1538611-bolnichnyi-raschet-ekspert
,ktbs.com,Swiss central bank keeps zero - rate as tariffs take their toll,https://www.ktbs.com/news/national/swiss-central-bank-keeps-zero-rate-as-tariffs-take-their-toll/article_ced4a36f-1a2b-5d8e-af9f-0807fe8bed7a.html
,cityam.com,Watch : Is the united kingdom at risk of recession ?,https://www.cityam.com/is-the-uk-economy-at-risk-of-recession/
,nordschleswiger.dk,Sarkozy zu fünf Jahren Haft verurteilt,https://www.nordschleswiger.dk/de/deutschland-international/sarkozy-zu-fuenf-jahren-haft-verurteilt
,pcwelt.de,Qualcomm Snapdragon X2 Elite : Mehr Kerne und KI für Windows on Arm,https://www.pcwelt.de/article/2920798/qualcomm-snapdragon-x2-elite-mehr-kerne-und-ki-fuer-windows-on-arm.html
,euractiv.com,"Once you break it , it broken : Brussels rebuffs calls to seize Russian assets",https://www.euractiv.com/news/once-you-break-it-its-broken-brussels-rebuffs-calls-to-seize-russian-assets/
,vol.at,Bund und Ländern beraten zu Reform der Sozialhilfe,https://www.vol.at/bund-und-laendern-beraten-zu-reform-der-sozialhilfe/9695789
,dailypolitical.com,Palumbo Wealth Management LLC Makes New Investment in Columbia Research Enhanced Core ETF $RECS,https://www.dailypolitical.com/2025/09/25/palumbo-wealth-management-llc-makes-new-investment-in-columbia-research-enhanced-core-etf-recs.html
,insidebitcoins.com,"PrimeXBT Rewards Program Offers Trading Bonuses up to $3 , 390 in 2025",https://insidebitcoins.com/press-releases/primexbt-rewards-program-offers-trading-bonuses-up-to-3390-in-2025
,teleborsa.it,"Powersoft , utile semestrale cala a 5 , 2 milioni con oneri di cambio e M & A . Ricavi +11 %",https://www.teleborsa.it/News/2025/09/25/powersoft-utile-semestrale-cala-a-5-2-milioni-con-oneri-di-cambio-e-m-a-ricavi-11percent-133.html
,news-medical.net,AI will soon have a say in approving or denying Medicare treatments,https://www.news-medical.net/news/20250925/AI-will-soon-have-a-say-in-approving-or-denying-Medicare-treatments.aspx
,interfax.ru,Pony AI планирует запустить тысячу роботакси на Ближнем Востоке в течение 3 лет,https://www.interfax.ru/world/1049290
,economictimes.indiatimes.com,"India set for busiest IPO month in nearly three decades , leaving investors wide - eyed",https://economictimes.indiatimes.com/markets/ipos/fpos/india-set-for-busiest-ipo-month-in-nearly-three-decades-leaving-investors-wide-eyed/articleshow/124115770.cms
,baritoday.it,A Pane e Pomodoro il terzo aperitivo ecologico per ripulire la spiaggia,https://www.baritoday.it/eventi/aperitivo-ecologico-ripulire-spiaggia-pane-omodoro-26-settembre-2025.html
,finanznachrichten.de,"CXApp Inc .: CXAI Showcasing Agentic AI based Employee Experience Platform at Industry Events in October in New York , San Francisco , and Southern California",https://www.finanznachrichten.de/nachrichten-2025-09/66536019-cxapp-inc-cxai-showcasing-agentic-ai-based-employee-experience-platform-at-industry-events-in-october-in-new-york-san-francisco-and-southern-calif-200.htm
,t3n.de,Deal zwischen OpenAI und SAP : Echte digitale Souveränität sieht anders aus,https://t3n.de/news/deal-zwischen-openai-und-sap-echte-digitale-souveraenitaet-sieht-anders-aus-1709363/
,bozemanskissfm.com,Check Out These Cheap Homes For Sale In Montana,https://bozemanskissfm.com/ixp/12/p/cheap-montana-homes-for-sale/
,ambito.com,"Con el respaldo de EEUU y el agro , el BCRA bajó las tasas y el dólar apunta a profundizar la caída",https://www.ambito.com/finanzas/con-el-respaldo-eeuu-y-el-agro-el-bcra-las-tasas-y-el-dolar-apunta-profundizar-la-caida-n6194710
,vneconomy.vn,Đăng ký doanh nghiệp 8 tháng : Tín hiệu phục hồi tích cực,https://vneconomy.vn/tinh-hinh-dang-ky-doanh-nghiep-8-thang-cai-thien-ca-chat-va-luong.htm
,freiepresse.de,Die Häuser von Chemnitz werden immer bunter : Schon wieder zwei neue Wandbilder entdeckt,https://www.freiepresse.de/chemnitz-kulturhauptstadt-2025/die-haeuser-von-chemnitz-werden-immer-bunter-schon-wieder-zwei-neue-wandbilder-entdeckt-artikel13968701
,ansa.it,"Iva non applicata , società bellunese evade 670mila euro - Notizie",https://www.ansa.it/sito/notizie/cronaca/2025/09/25/iva-non-applicata-societa-bellunese-evade-670mila-euro_6938891f-2962-4061-a5ce-4f75588084dc.html
,ansa.it,"Assosistema , nasce losservatorio sulla sicurezza sul lavoro - Notizie",https://www.ansa.it/sito/notizie/economia/2025/09/25/assosistema-nasce-losservatorio-sulla-sicurezza-sul-lavoro_e26b7fb7-7057-47db-914c-84e023ae9972.html
,www.mdzol.com,Argentina,https://www.mdzol.com/dinero/la-tormenta-que-se-fue-como-sigue-el-plan-bessent-y-el-temor-del-mercado-octubre-n1345891
,www.mdzol.com,Spain,https://www.mdzol.com/dinero/la-tormenta-que-se-fue-como-sigue-el-plan-bessent-y-el-temor-del-mercado-octubre-n1345891
,www.mdzol.com,"Washington, Washington, United States",https://www.mdzol.com/dinero/la-tormenta-que-se-fue-como-sigue-el-plan-bessent-y-el-temor-del-mercado-octubre-n1345891
,www.pcmag.com,"New York, United States",https://www.pcmag.com/articles/watch-while-you-can-everything-leaving-netflix-in-october-2025
,www.film-news.co.uk,"Hollywood, California, United States",https://www.film-news.co.uk/news/UK/121237/Timothy-Olyphant-addresses-his-Once-Upon-A-Time-In-Hollywood-sequel-casting
,www.dailypolitical.com,"Nevada, United States",https://www.dailypolitical.com/2025/09/25/perigon-wealth-management-llc-has-8-11-million-holdings-in-jpmorgan-income-etf-jpie.html
,www.jagonews24.com,Bangladesh,https://www.jagonews24.com/economy/news/1054785
,www.so-co-it.com,Switzerland,https://www.so-co-it.com/post/727058/plan-b-net-zero-ag-successfully-completes-chf-4-5-million-capital-raise.html
,www.almasryalyoum.com,Israel,https://www.almasryalyoum.com/news/details/3558742
,www.almasryalyoum.com,France,https://www.almasryalyoum.com/news/details/3558742
,www.almasryalyoum.com,"Tel Aviv, Tel Aviv, Israel",https://www.almasryalyoum.com/news/details/3558742
,www.almasryalyoum.com,"Rome, Lazio, Italy",https://www.almasryalyoum.com/news/details/3558742
,jd.zol.com.cn,"Jingdong, Guangdong, China",https://jd.zol.com.cn/1052/10527239.html
,jd.zol.com.cn,"Guan Cun, Guangdong, China",https://jd.zol.com.cn/1052/10527239.html
,www.forbes.ro,Romania,https://www.forbes.ro/federatiile-si-patronatele-din-horeca-se-unesc-pentru-a-sustine-pastrarea-cotei-tva-la-11-467060
,www.mirror.co.uk,"Greater Manchester, United Kingdom (General), United Kingdom",https://www.mirror.co.uk/news/politics/liz-truss-internet-stitches-ill-35964726
,www.stern.de,"Munich, Bayern, Germany",https://www.stern.de/gesellschaft/regional/bayern/spd-herbstklausur--spd-fordert-mehr-geld-fuer-kitas---angst-vor-pleitewelle-36080130.html
,www.diariocordoba.com,"Penarroya, Murcia, Spain",https://www.diariocordoba.com/cordoba/2025/09/25/siete-guardias-civiles-reforzaran-puesto-121942579.html
,tr.euronews.com,Taiwan,https://tr.euronews.com/2025/09/25/tayvan-ve-filipinlerde-24-kisinin-olumune-yol-acan-ragasa-tayfunu-tropik-firtinaya-donustu
,tr.euronews.com,"Guangzhou, Guangdong, China",https://tr.euronews.com/2025/09/25/tayvan-ve-filipinlerde-24-kisinin-olumune-yol-acan-ragasa-tayfunu-tropik-firtinaya-donustu
,www.aajsamaaj.com,India,https://www.aajsamaaj.com/pms-rajasthan-visit-during-congress-rule-there-was-only-looting-under-bjp-rule-there-are-only-savings/
,www.aajsamaaj.com,"Banswara, Rajasthan, India",https://www.aajsamaaj.com/pms-rajasthan-visit-during-congress-rule-there-was-only-looting-under-bjp-rule-there-are-only-savings/
,www.swindonadvertiser.co.uk,Austria,https://www.swindonadvertiser.co.uk/news/national/25494806.starbucks-close-uk-coffee-shops-amid-global-cuts/
,www.swindonadvertiser.co.uk,United Kingdom,https://www.swindonadvertiser.co.uk/news/national/25494806.starbucks-close-uk-coffee-shops-amid-global-cuts/
,www.thejakartapost.com,Canada,https://www.thejakartapost.com/business/2025/09/25/ri-canada-ink-trade-pact-amid-us-pressure.html
,www.thejakartapost.com,"Jakarta, Jakarta Raya, Indonesia",https://www.thejakartapost.com/business/2025/09/25/ri-canada-ink-trade-pact-amid-us-pressure.html
,www.thejakartapost.com,Indonesia,https://www.thejakartapost.com/business/2025/09/25/ri-canada-ink-trade-pact-amid-us-pressure.html
,hotnews.ro,"Chisinau, Chisinau, Moldova",https://hotnews.ro/maia-sandu-dupa-extradarea-lui-vladimir-plahotniuc-daca-nu-renunti-cand-e-greu-si-continui-sa-lupti-pana-si-infractorii-care-pareau-invincibili-ajung-in-fata-justitiei-2073165
,hotnews.ro,"Dubai, Dubayy, United Arab Emirates",https://hotnews.ro/maia-sandu-dupa-extradarea-lui-vladimir-plahotniuc-daca-nu-renunti-cand-e-greu-si-continui-sa-lupti-pana-si-infractorii-care-pareau-invincibili-ajung-in-fata-justitiei-2073165
,hotnews.ro,Moldova,https://hotnews.ro/maia-sandu-dupa-extradarea-lui-vladimir-plahotniuc-daca-nu-renunti-cand-e-greu-si-continui-sa-lupti-pana-si-infractorii-care-pareau-invincibili-ajung-in-fata-justitiei-2073165
,www.hipersuper.pt,Portugal,https://www.hipersuper.pt/2025/09/25/mimosa-proteina-lanca-novo-sabor-caramelo-salgado
,www.hipersuper.pt,"Lisbon, Lisboa, Portugal",https://www.hipersuper.pt/2025/09/25/mimosa-proteina-lanca-novo-sabor-caramelo-salgado
,www.forbes.ro,"Racaciuni, Romania (General), Romania",https://www.forbes.ro/stadiul-lucrarilor-pe-lotul-2-al-autostrazii-focsani-bacau-a-depasit-80-467058
,www.npr.org,"Wyoming, United States",https://www.npr.org/2025/09/25/nx-s1-5552684/medical-debt-credit-report-state-laws
,www.npr.org,"Minnesota, United States",https://www.npr.org/2025/09/25/nx-s1-5552684/medical-debt-credit-report-state-laws
,www.npr.org,"Colorado, United States",https://www.npr.org/2025/09/25/nx-s1-5552684/medical-debt-credit-report-state-laws
,www.npr.org,"Indiana, United States",https://www.npr.org/2025/09/25/nx-s1-5552684/medical-debt-credit-report-state-laws
,www.npr.org,"South Dakota, United States",https://www.npr.org/2025/09/25/nx-s1-5552684/medical-debt-credit-report-state-laws
,www.npr.org,"California, United States",https://www.npr.org/2025/09/25/nx-s1-5552684/medical-debt-credit-report-state-laws
,www.npr.org,"Maine, United States",https://www.npr.org/2025/09/25/nx-s1-5552684/medical-debt-credit-report-state-laws
,www.npr.org,"Ohio, United States",https://www.npr.org/2025/09/25/nx-s1-5552684/medical-debt-credit-report-state-laws
,www.npr.org,"Texas, United States",https://www.npr.org/2025/09/25/nx-s1-5552684/medical-debt-credit-report-state-laws
,www.npr.org,"Montana, United States",https://www.npr.org/2025/09/25/nx-s1-5552684/medical-debt-credit-report-state-laws
,www.npr.org,"Vermont, United States",https://www.npr.org/2025/09/25/nx-s1-5552684/medical-debt-credit-report-state-laws
,www.npr.org,"Virginia, United States",https://www.npr.org/2025/09/25/nx-s1-5552684/medical-debt-credit-report-state-laws
,www.npr.org,"Connecticut, United States",https://www.npr.org/2025/09/25/nx-s1-5552684/medical-debt-credit-report-state-laws
,deshonnati.com,"Ladakh, Jammu And Kashmir, India",https://deshonnati.com/ladakh-gen-z-protest-situation-of-arson-and-stone-pelting/
,deshonnati.com,"Sonam, Uttaranchal, India",https://deshonnati.com/ladakh-gen-z-protest-situation-of-arson-and-stone-pelting/
,www.southernstar.ie,"Clonakilty, Cork, Ireland",https://www.southernstar.ie/business/couple-who-quit-rat-race-now-busier-than-ever-with-food-firm-4341146
,www.finanzen.net,China,https://www.finanzen.net/nachricht/aktien/pistorius-russen-verfolgen-zwei-deutsche-satelliten-im-all-14893193
,www.finanzen.net,Russia,https://www.finanzen.net/nachricht/aktien/pistorius-russen-verfolgen-zwei-deutsche-satelliten-im-all-14893193
