published_at,source,title,url
,dailypolitical.com,AbbVie Inc . $ABBV Stake Raised by Everpar Advisors LLC,https://www.dailypolitical.com/2025/09/16/abbvie-inc-abbv-stake-raised-by-everpar-advisors-llc.html
,oilprice.com,Global Headwinds Hit Australian Wind Energy,https://oilprice.com/Latest-Energy-News/World-News/Global-Headwinds-Hit-Australian-Wind-Energy.html
,larepublica.es,Valorizan en 90 millones de dólares los humedales de Virginia por su impacto ecológico y económico,http://larepublica.es/2025/09/16/valorizan-en-90-millones-de-dolares-los-humedales-de-virginia-por-su-impacto-ecologico-y-economico/
,postandcourier.com,2025 Sweet Tea Festival Schedule,https://www.postandcourier.com/journal-scene/journal-scene/news/2025-sweet-tea-festival-schedule/article_ce3e932c-0381-4b59-8673-4c835ad881fd.html
,cantechletter.com,Canadian Investment Regulatory Organization Trading Halt - NCLR,https://www.cantechletter.com/newswires/canadian-investment-regulatory-organization-trading-halt-nclr-2/
,dogruhaber.com.tr,İranda yapay zeka dönemi : Son kararı meclis verecek !,https://dogruhaber.com.tr/iranda-yapay-zeka-donemi-son-karari-meclis-verecek
,dawnnews.tv,عالمی پیمانے کے مطابق قرضوں کے لحاظ سے پاکستان کی پوزیشن بہتر ہوئی ہے ، وزارت خزانہ - Pakistan,https://www.dawnnews.tv/news/1269380
,theobserver.ca,"Cost of social services continuing to rise in Brantford , Brant",https://www.theobserver.ca:443/news/local-news/cost-of-social-services-continuing-to-rise-in-brantford-brant/wcm/66fcd040-644c-4043-87e2-0caf8d5758f7
,chinapress.com.my,4年狂开18家公司 ！ 狮城毒枭商业版图曝光 | 中國報 China Press,https://www.chinapress.com.my/20250916/4%E5%B9%B4%E7%8B%82%E5%BC%8018%E5%AE%B6%E5%85%AC%E5%8F%B8%EF%BC%81-%E7%8B%AE%E5%9F%8E%E6%AF%92%E6%9E%AD%E5%95%86%E4%B8%9A%E7%89%88%E5%9B%BE%E6%9B%9D%E5%85%89/
,computing.co.uk,Google hit with lawsuit over AI Overviews,https://www.computing.co.uk/news/2025/ai/google-hit-with-lawsuit-over-ai-overviews
,jo24.net,جو 24 : البلقاء التطبيقية تحصل على 5 نجوم في التعليم والحوكمة والأثر البيئي,https://jo24.net/article/544024
,dostor.org,محافظ بني سويف يوجه بحصر دقيق لكافة الوحدات التابعة لصندوق الإسكان الاقتصادي,https://www.dostor.org/5219964
,express.co.uk,Morrison huge boost for customers -  biggest range reset in decade  | united kingdom | News,https://www.express.co.uk/news/uk/2109218/morrisons-boost-customers-range-reset
,sardanews.it,Gianni Gallucci :  Il Giappone rappresenta un mercato chiave per il settore delle calzature,https://sardanews.it/notizie/gianni-gallucci-il-giappone-rappresenta-un-mercato-chiave-per-il-settore-delle-calzature
,maliweb.net,"Deux ans après la création de lAlliance des États du Sahel : Des acquis à consolider pour un sahel pacifique , libre et prospère",https://www.maliweb.net/economie/cooperation/deux-ans-apres-la-creation-de-lalliance-des-etats-du-sahel-des-acquis-a-consolider-pour-un-sahel-pacifique-libre-et-prospere-3109306.html
,printweek.com,Printweek - Very Displays launches fence banner and poster frame,https://www.printweek.com/content/product-news/very-displays-launches-fence-banner-and-poster-frame
,beursduivel.be,Industriele productie VS herstelt licht,https://www.beursduivel.be/Nieuws/833243/Industriele-productie-VS-herstelt-licht.aspx
,beursduivel.be,Europese beurzen overwegend rood gekleurd,https://www.beursduivel.be/Nieuws/833211/Europese-beurzen-overwegend-rood-gekleurd.aspx
,stapravda.ru,Остановочные павильоны с Wi - Fi установят в Кисловодске,https://www.stapravda.ru/20250916/ostanovochnye_pavilony_s_wifi_ustanovyat_v_kislovodske_237039.html
,dailypolitical.com,Alliance Mining ( CVE : ALM ) Trading Up 137 . 5 % – Here What Happened,https://www.dailypolitical.com/2025/09/16/alliance-mining-cvealm-trading-up-137-5-heres-what-happened.html
,index.hr,"Lalovac : Inflacija ubrzava , to je strašno",https://www.index.hr/vijesti/clanak/lalovac-inflacija-ubrzava-to-je-strasno/2710365.aspx?index_tid=778239&index_ref=naslovnica_vijesti_ostalo_d_1
,baystreet.ca,Baystreet . ca - TSX Flat Ahead of BoC Decision,http://baystreet.ca/articles/marketupdates/114724/TSX-Flat-Ahead-of-BoC-Decision
,ledburyreporter.co.uk,State pensioners  certain  to go into tax threshold in 2027,https://www.ledburyreporter.co.uk/news/25470986.state-pensioners-certain-go-tax-threshold-2027/
,elvocero.com,Acusan joven que habría agredido a su padre con un cuchillo | Ley y orden,https://www.elvocero.com/ley-y-orden/fianza-millonaria-contra-joven-que-habr-a-agredido-a-su-padre-con-un-cuchillo-en/article_b0965f65-9005-4507-9ab5-1b319653e21e.html
,dinamani.com,டாலருக்கு நிகரான ரூபாய் மதிப்பு 8 காசுகள் உயர்ந்து ரூ . 88 . 08 ஆக நிறைவு !,https://www.dinamani.com/trade/2025/Sep/16/rupee-rises-8-paise-to-close-at-8808-against-us-dollar
,downtoearth.org.in,"World faces steeper oil , gas declines ; import - heavy India vulnerable : IEA",https://www.downtoearth.org.in/energy/world-faces-steeper-oil-gas-declines-import-heavy-india-vulnerable-iea
,ixbt.com,"Продажи люксовых авто в России растут несмотря на то , что рынок падает . Россияне раскупают Rolls - Royce и Bentley",https://www.ixbt.com/news/2025/09/16/rolls-royce-bentley.html
,dynamicbusiness.com,Reztune : AI Resume Tailoring for Job Seekers - Dynamic Business,https://dynamicbusiness.com/ai-tools/reztune-ai-resume-tailoring-for-job-seekers.html
,centralmoinfo.com,Trump races to reshape Fed days before interest rate decision,https://www.centralmoinfo.com/syndicated-article/?id=1637067
,diario.mx,El desaire de China a la soya estadounidense es una crisis para los agricultores de EU,https://diario.mx/estados-unidos/2025/sep/16/el-desaire-de-china-a-la-soya-estadounidense-es-una-crisis-para-los-agricultores-de-eu-1084898.html
,index.hr,Jedna stvar koju trebate napraviti s povrćem čim ga donesete kući,https://www.index.hr/food/clanak/jedna-stvar-koju-trebate-napraviti-s-povrcem-cim-ga-donesete-kuci/2710228.aspx?index_tid=777892&index_ref=naslovnica_food_d
,themarketsdaily.com,"Sarver Vrooman Wealth Advisors Trims Stake in The PNC Financial Services Group , Inc $PNC",https://www.themarketsdaily.com/2025/09/16/sarver-vrooman-wealth-advisors-trims-stake-in-the-pnc-financial-services-group-inc-pnc.html
,project-syndicate.org,How Off - Grid Solar Can Transform an Economy,https://www.project-syndicate.org/commentary/off-grid-solar-transform-an-economy-malawi-by-ibrahim-matola-2025-09
,pagalguy.com,MBA at Middlesex University Dubai,https://www.pagalguy.com/articles/study-in-dubai-lead-the-world-evaluating-the-mba-advantage-at-middlesex-university-dubai
,kabar24.bisnis.com,Terkuak ! 2 Oknum Anggota Kopassus TNI Terlibat Pembunuhan Kacab BRI,https://kabar24.bisnis.com/read/20250916/16/1911752/terkuak-2-oknum-anggota-kopassus-tni-terlibat-pembunuhan-kacab-bri
,finans.mynet.com,İstanbulda ev almak isteyenler için rakamla açıkladı !  Faizin düşmesi ...,https://finans.mynet.com/haber/detay/emlak/istanbul-da-ev-almak-isteyenler-icin-rakamla-acikladi-faizin-dusmesi/514462/
,boersennews.de,Dax – Index macht sich für den Showdown bereit : E . ON – Ist das endlich die Trendwende ?,https://www.boersennews.de/nachrichten/artikel/boersennews/dax-index-macht-sich-fuer-den-showdown-bereit-e-on-ist-das-endlich-die-trendwende/4890959/
,highlandcountypress.com,"On the Moraine , Part XXIX | The Highland County Press",https://highlandcountypress.com/opinions-jim-thompson/moraine-part-xxix
,tuoitre.vn,"Tổ chức đồng loạt bán ròng , cá nhân  cân  tất phiên chứng khoán như  tàu lượn",https://tuoitre.vn/to-chuc-dong-loat-ban-rong-ca-nhan-can-tat-phien-chung-khoan-nhu-tau-luon-20250916155128157.htm
,bignewsnetwork.com,China to issue commemorative coins for Xinjiang Uygur Autonomous Region 70th anniversary,http://www.bignewsnetwork.com/news/278580443/china-to-issue-commemorative-coins-for-xinjiang-uygur-autonomous-region-70th-anniversary
,cnn.com,"What to know about RFK Jr ., the MAHA movement and vaccines in a pivotal week : Analysis",https://www.cnn.com/2025/09/16/politics/rfk-vaccines-covid-maha-cassidy-explainer
,mansheet.net,انخفاض جديد .. أسعار الذهب اليوم الثلاثاء | مفاجأة غير متوقعة في مستوى عيار 21 – جريدة مانشيت,https://mansheet.net/304363/%D8%A7%D9%86%D8%AE%D9%81%D8%A7%D8%B6-%D8%AC%D8%AF%D9%8A%D8%AF-%D8%A3%D8%B3%D8%B9%D8%A7%D8%B1-%D8%A7%D9%84%D8%B0%D9%87%D8%A8-%D8%A7%D9%84%D9%8A%D9%88%D9%85-%D8%A7%D9%84%D8%AB%D9%84%D8%A7%D8%AB%D8%A7/
,phys.org,Study calculates value of Virginia coastal wetlands at $90 million,https://phys.org/news/2025-09-virginia-coastal-wetlands-million.html
,marinij.com,"Robert Redford , actor , director , environmentalist , dead at 89",https://www.marinij.com/2025/09/16/robert-redford-actor-director-environmentalist-dead-at-89/
,tuttoggi.info,Parte il conto alla rovescia per la 26ª edizione de I Primi dItalia : Foligno torna capitale della pasta,https://tuttoggi.info/parte-il-conto-alla-rovescia-per-la-26a-edizione-de-i-primi-ditalia-foligno-torna-capitale-della-pasta/939019/
,prabhatkhabar.com,"Mirai Worldwide Box Office : वर्ल्डवाइड तेजा सज्जा की फिल्म का धमाका , 4 दिन में 100 करोड़ क्लब के पहुंची करीब",https://www.prabhatkhabar.com/entertainment/bollywood/mirai-worldwide-box-office-collection-of-teja-sajja-film
,lgcplus.com,County remains split over LGR plans,https://www.lgcplus.com/politics/devolution-and-economic-growth/county-remains-split-over-lgr-plans-16-09-2025/
,pordenoneoggi.it,"Pordenone ArtAndFood , dal 3 al 5 ottobre il Friuli Occidentale  Capitale del Gusto",https://pordenoneoggi.it/pordenone/pordenone-artandfood-dal-3-al-5-ottobre-il-friuli-occidentale-capitale-del-gusto/
,techz.vn,"OPPO K12s đẹp như iPhone 17 , giá chưa đầy 4 triệu , pin 7000 mAh ăn đứt Galaxy S25 5G",https://www.techz.vn/189-925-1-oppo-k12s-dep-nhu-iphone-17-gia-chua-day-4-trieu-pin-7000-mah-an-dut-galaxy-s25-5g-ylt661415.html
,english.news.cn,Across China : Intangible heritage rides digital wave as mini - dramas go global - Xinhua,https://english.news.cn/20250916/3aa04be998004bae968d9728f3adb0a7/c.html
,aktiencheck.de,Vonovia : Barclays bremst – zu Recht ? (),https://www.aktiencheck.de/analysen/Artikel-Vonovia_Barclays_bremst_Recht-19014697
,tribuneonlineng.com,Google owner to invest £5bn in united kingdom AI ahead of Trump visit,https://tribuneonlineng.com/googles-owner-to-invest-5bn-in-uk-ai-ahead-of-trumps-visit/
,tickerreport.com,Key Client Fiduciary Advisors LLC Boosts Holdings in SPDR Portfolio S & P 500 ETF $SPLG,https://www.tickerreport.com/banking-finance/13153514/key-client-fiduciary-advisors-llc-boosts-holdings-in-spdr-portfolio-sp-500-etf-splg.html
,24tv.ua,"Бюджет на 2026 рік - на реформу БЕБ не заклали коштів у бюджеті , які видатки ДБР",https://24tv.ua/economy/byudzhet-2026-rik-reformu-beb-ne-zaklali-koshtiv-byudzheti-yaki_n2915556
,puntonoticias.com,"El Gobierno espera una inflación de 10 , 1 % en 2026 y que el dólar oficial cierre el año a $1 . 423",https://puntonoticias.com/el-gobierno-espera-una-inflacion-de-101-en-2026-y-que-el-dolar-oficial-cierre-el-ano-a-1-423/
,profile.ru,АвтоВАЗ работает над запуском в производство Lada Azimut,https://profile.ru/news/cars/avtovaz-rabotaet-nad-zapuskom-v-proizvodstvo-lada-azimut-1755684/
,zazoom.it,Lultima apparizione di Robert Redford | ci ha lasciati così quella scena che rimarrà nella storia,https://www.zazoom.it/2025-09-16/lultima-apparizione-di-robert-redford-ci-ha-lasciati-cosi-quella-scena-che-rimarra-nella-storia/17760103/
,beursduivel.be,Amerikaanse detailhandelsverkopen stijgen harder dan verwacht,https://www.beursduivel.be/Nieuws/833233/Amerikaanse-detailhandelsverkopen-stijgen-harder-dan-verwacht.aspx
,thedrum.com,"All I see is opportunities , says Kantar new CEO , Paul Zwillenberg",https://www.thedrum.com/news/2025/09/16/all-i-see-opportunities-says-kantar-s-new-ceo-paul-zwillenberg
,dailypolitical.com,Riversedge Advisors LLC Has $8 . 87 Million Position in Vanguard Value ETF $VTV,https://www.dailypolitical.com/2025/09/16/riversedge-advisors-llc-has-8-87-million-position-in-vanguard-value-etf-vtv.html
,wort.lu,Darum finden die arabischen Staaten keine gemeinsame Linie gegen Israel,https://www.wort.lu/international/darum-finden-die-arabischen-staaten-keine-gemeinsame-linie-gegen-israel/90799737.html
,cantechletter.com,Canadian Investment Regulatory Organization Trade Resumption - RUSH,https://www.cantechletter.com/newswires/canadian-investment-regulatory-organization-trade-resumption-rush/
,nordschleswiger.dk,Herbststurm im Norden - mehr als 100 Feuerwehreinsätze,https://www.nordschleswiger.dk/de/schleswig-holstein-hamburg/herbststurm-im-norden-mehr-als-100-feuerwehreinsaetze
,finance.yahoo.com,Wayfair ( W ): The Tide Is Finally Turning,https://finance.yahoo.com/news/wayfair-w-tide-finally-turning-125612444.html
,californiatelegraph.com,Vega Raises $65 Million in Funding to Redefine the Boundaries of Security Analytics,http://www.californiatelegraph.com/news/278580374/vega-raises-65-million-in-funding-to-redefine-the-boundaries-of-security-analytics
,finance.yahoo.com,Here Why Carvana ( CVNA ) Management Reiterated Their Outlook,https://finance.yahoo.com/news/why-carvana-cvna-management-reiterated-130037954.html
,vedomosti.ru,Марина Ляшенко рассказала о применении ИИ в службах клиентской поддержки – скорость обработки запросов растет более чем на 15 %,https://www.vedomosti.ru/press_releases/2025/09/16/marina-lyashenko-rasskazala-o-primenenii-ii-v-sluzhbah-klientskoi-podderzhki--skorost-obrabotki-zaprosov-rastet-bolee-chem-na-15
,allure.com,The Allure Best of Beauty 2025 Splurges and Luxury Winners to Add to Your Shopping Wishlist,https://www.allure.com/story/best-of-beauty-luxury-makeup-skin-care-hair-winners-2025
,oilprice.com,Iran Oil Discount to China Widens Amid Record - High Stocks at Teapots,https://oilprice.com/Latest-Energy-News/World-News/Irans-Oil-Discount-to-China-Widens-Amid-Record-High-Stocks-at-Teapots.html
,dailystar.co.uk,Real meaning behind numbers on toaster and it not how long your bread is toasting,https://www.dailystar.co.uk/news/weird-news/real-meaning-behind-numbers-toaster-35911070
,themarketsdaily.com,"Brokerages Set Intuitive Surgical , Inc . ( NASDAQ : ISRG ) Price Target at $595 . 95",https://www.themarketsdaily.com/2025/09/16/brokerages-set-intuitive-surgical-inc-nasdaqisrg-price-target-at-595-95.html
,thehindu.com,Kaushik Reddy alleges cross - voting from TG Congress MPs in V - P polling,https://www.thehindu.com/news/national/telangana/kaushik-reddy-alleges-cross-voting-from-tg-congress-mps-in-v-p-polling/article70056835.ece
,toscananews.net,"Firenze , un nuovo progetto di Aisla in occasione della Giornata Nazionale Sla",https://toscananews.net/firenze-un-nuovo-progetto-di-aisla-in-occasione-della-giornata-nazionale-sla/
,ecoticias.com,Just for citizens in this state ― $400 checks paid for those who meet this criteria,https://www.ecoticias.com/en/checks-for-those-who-meet-this-criteria/20421/
,themarketsdaily.com,Emprise Bank Sells 105 Shares of AbbVie Inc . $ABBV,https://www.themarketsdaily.com/2025/09/16/emprise-bank-sells-105-shares-of-abbvie-inc-abbv.html
,californiatelegraph.com,Spoiler Alert Expands Leadership Team by Hiring Matt Greene as SVP of Sales,http://www.californiatelegraph.com/news/278580274/spoiler-alert-expands-leadership-team-by-hiring-matt-greene-as-svp-of-sales
,thehindubusinessline.com,Broker Call : Vedant Fashions ( Buy ) - The Hindu BusinessLine,https://www.thehindubusinessline.com/markets/brokers-call-vedant-fashions-buy/article70056344.ece
,californiatelegraph.com,RedChip Companies Announces Platinum Sponsorship of the NIBA Annual Convention,http://www.californiatelegraph.com/news/278580395/redchip-companies-announces-platinum-sponsorship-of-the-niba-annual-convention
,leconomistemaghrebin.com,LAfrique tire le tourisme mondial au premier semestre 2025,https://www.leconomistemaghrebin.com/2025/09/16/tourisme-mondial-afrique-en-tete-de-la-reprise-au-premier-semestre-2025/
,star.com.tr,Casperdan rencilerden profesyonellere yeni nesil tablet deneyimi,https://www.star.com.tr/teknoloji/casperdan-ogrencilerden-profesyonellere-yeni-nesil-tablet-deneyimi-haber-1965652/
,ots.at,"Medit Link Express für iPad feiert Premiere , während Medit i900 Mobility in den Versand geht",https://www.ots.at/presseaussendung/OTS_20250916_OTS0144/medit-link-express-fuer-ipad-feiert-premiere-waehrend-medit-i900-mobility-in-den-versand-geht
,estadiodeportivo.com,Lío con Renan Lodi,https://www.estadiodeportivo.com/futbol/futbol-internacional/lio-con-renan-lodi-20250916-512286.html
,timeturk.com,Konut satışları ile ilgili son rakamlar açıklandı,https://www.timeturk.com/ekonomi/konut-satislari-ile-ilgili-son-rakamlar-aciklandi-haber-1820650
,themarketsdaily.com,"Range Financial Group LLC Sells 2 , 125 Shares of SPDR Portfolio S & P 400 Mid Cap ETF $SPMD",https://www.themarketsdaily.com/2025/09/16/range-financial-group-llc-sells-2125-shares-of-spdr-portfolio-sp-400-mid-cap-etf-spmd.html
,ixbt.com,Европейские лидеры ИИ и полупроводников объединяются : ASML и Mistral AI объявили об интеграции ИИ в производство микрочипов,https://www.ixbt.com/news/2025/09/16/asml-mistral-ai.html
,franceguyane.fr,"Un an après , lEurope peine à appliquer l  électrochoc prescrit par Mario Draghi",https://www.franceguyane.fr/actualite/economie-consommation/un-an-apres-leurope-peine-a-appliquer-lelectrochoc-prescrit-par-mario-draghi-1050426.php
,persinfo.org,Autovrije zondag op 21 september,https://www.persinfo.org/nl/nieuws/artikel/autovrije-zondag-op-21-september/63915
,inewsgr.com,Μητσοτάκης : Δημιουργείται το νέο Ελληνικό Ταμείο Καινοτομίας και Υποδομών ( pics ),https://www.inewsgr.com/286/mitsotakis-dimiourgeitai-to-neo-elliniko-tameio-kainotomias-kai-ypodomon-pics.htm
,chinapress.com.my,飞韩设公司  招兵买马  狮城毒枭图建分销网 | 中國報 China Press,https://www.chinapress.com.my/20250916/%E9%A3%9E%E9%9F%A9%E8%AE%BE%E5%85%AC%E5%8F%B8%E6%8B%9B%E5%85%B5%E4%B9%B0%E9%A9%AC-%E7%8B%AE%E5%9F%8E%E6%AF%92%E6%9E%AD%E5%9B%BE%E5%BB%BA%E5%88%86%E9%94%80%E7%BD%91/
,themarketsdaily.com,Krilogy Financial LLC Has $3 . 27 Million Holdings in Honeywell International Inc . $HON,https://www.themarketsdaily.com/2025/09/16/krilogy-financial-llc-has-3-27-million-holdings-in-honeywell-international-inc-hon.html
,baystreet.ca,"Baystreet . ca - Electric Vehicle Selloff Warning As $7 , 500 Credits Expire",http://baystreet.ca/stockstowatch/21650/Electric-Vehicle-Selloff-Warning-As-7500-Credits-Expire
,astroawani.com,Bonsai daripada hobi kepada punca rezeki tambahan,https://www.astroawani.com/berita-malaysia/bonsai-daripada-hobi-kepada-punca-rezeki-tambahan-538727
,observador.pt,"Moçambique . Balança comercial melhora 9 , 8 % apesar de défice – Observador",https://observador.pt/2025/09/16/balanca-comercial-mocambicana-melhora-98-apesar-de-defice-de-465-milhoes-de-euros-em-tres-meses/
,portalspozywczy.pl,MF planuje objęcie akcyzą elektromagnetycznych e - papierosów,"https://www.portalspozywczy.pl/alkohole-uzywki/wiadomosci/mf-planuje-objecie-akcyza-elektromagnetycznych-e-papierosow,280754.html"
,thehindu.com,Senior citizen duped of ₹14 . 35 lakh in online investment scam using Finance Minister photo,https://www.thehindu.com/news/cities/Hyderabad/senior-citizen-duped-of-1435-lakh-in-online-investment-scam-using-finance-ministers-photo/article70056548.ece
,minutouno.com,Patricia Bullrich tomó distancia de la cadena nacional de Javier Milei : No dije lo peor ya pasó,https://www.minutouno.com/politica/patricia-bullrich-tomo-distancia-la-cadena-nacional-javier-milei-no-dije-lo-peor-ya-paso-n6190831
,newspim.com,나스닥 상장 네이버웹툰  디즈니와 제휴  발표에 주가 일시 40 % 폭등,https://www.newspim.com/news/view/20250916001175
,ansa.it,"Borsa : Milano in calo dello 0 , 4 % con Mps , Tim , Leonardo - Notizie",https://www.ansa.it/sito/notizie/economia/2025/09/16/borsa-milano-in-calo-dello-04-con-mps-tim-leonardo_69cfe1d3-2676-4fc9-932a-635cf302446a.html
,businessinsider.com,A New Israeli Cybersecurity Startup Is Already Valued at $400 Million .,https://www.businessinsider.com/new-israeli-cybersecurity-startup-is-already-valued-at-400-million-2025-9
,phoenixherald.com,"Seoul , Washington struggle to finalize trade deal as talks resume",http://www.phoenixherald.com/news/278579318/seoul-washington-struggle-to-finalize-trade-deal-as-talks-resume
,livemint.com,DRI seizes over 108 kg of hydroponic weed in pan - India operations,https://www.livemint.com/companies/news/dri-seizes-over-108-kg-of-hydroponic-weed-in-pan-india-operations-11758027506796.html
,tickerreport.com,"Triumph Capital Management Has $733 , 000 Stake in Vanguard S & P 500 ETF $VOO",https://www.tickerreport.com/banking-finance/13153515/triumph-capital-management-has-733000-stake-in-vanguard-sp-500-etf-voo.html
,finance.yahoo.com,How CarriersSource transforms shipper data into sales gold,https://finance.yahoo.com/news/carrierssource-transforms-shipper-data-sales-130000373.html
,eleconomista.com.ar,Qué nos está diciendo Milei - quizás sin darse cuenta - a los 47 millones de argentinos,https://eleconomista.com.ar/politica/se-rompio-hechizo-milei-gobierno-mas-todos-demas-n88582
,market.bisnis.com,Barisan Wamen dan Pejabat Pemerintah di Komisaris Telkom ( TLKM ),https://market.bisnis.com/read/20250916/192/1911915/barisan-wamen-dan-pejabat-pemerintah-di-komisaris-telkom-tlkm
,afr.com,Australian university graduates get pay boost of 34pc in three years,https://www.afr.com/policy/health-and-education/graduates-get-pay-boost-of-34pc-in-three-years-20250916-p5mvd2
,edition.cnn.com,Offshore wind was supposed to save power - starved New England . Trump blew up that plan,https://edition.cnn.com/2025/09/16/climate/offshore-wind-trump-new-england
,observador.pt,UE quer mais imigrantes e deficientes no mercado de trabalho – Observador,https://observador.pt/2025/09/16/comissao-europeia-quer-mais-imigrantes-e-deficientes-no-mercado-de-trabalho/
,neimagazine.com,Hungary defies EU court ruling on Paks - Nuclear Engineering International,https://www.neimagazine.com/news/hungary-defies-eu-court-ruling-on-paks/
,finans.dk,Fynske Bank lover snarlig afklaring om fusionsdrama,https://finans.dk/finans/ECE18541154/fynske-bank-lover-snarlig-afklaring-om-fusionsdrama/?fp-exp=70740000&fp-alg=707400001
,pt.euronews.com,Operao Influencer : Ministério Público arquiva inquérito a violao do segredo de Estado,https://pt.euronews.com/my-europe/2025/09/16/operacao-influencer-ministerio-publico-arquiva-inquerito-a-violacao-do-segredo-de-estado
,finance.yahoo.com,Revolve ( RVLV ) Declined Due to Management Comments,https://finance.yahoo.com/news/revolve-rvlv-declined-due-management-125403981.html
,finanzen.net,Alibaba - Aktie steigt 2025 an der NYSE kräftig - KI und Jack Ma im Blick,https://www.finanzen.net/nachricht/aktien/im-aufwind-alibaba-aktie-weist-kursplus-aus-ki-strategie-und-rueckkehr-von-jack-ma-im-fokus-00-14835744
,sermitsiaq.ag,"Milliard - aftale : Danmark vil finansiere ny lufthavn , en dybvandshavn og visse sundhedsudgifter i Grønland",https://www.sermitsiaq.ag/samfund/milliard-aftale-danmark-vil-finansiere-ny-lufthavn-en-dybvandshavn-og-visse-sundhedsudgifter-i-gronland/2282420
,163.com,神了 ！ 营收1毛钱没有 ， 股价3个月翻了50倍,https://www.163.com/dy/article/K9JUTL960552K0CA.html
,index.hr,Terapeuti i psiholozi podijelili savjete kako popraviti odnos s odraslom djecom,https://www.index.hr/mame/clanak/terapeuti-i-psiholozi-podijelili-savjete-kako-popraviti-odnos-s-odraslom-djecom/2710356.aspx?index_tid=778199&index_ref=naslovnica_magazin_najnovije_d
,pda.chel.kp.ru,Банк Уралсиб вошел в топ - 10 рейтинга по объемам ипотечного кредитования за 7 месяцев,https://pda.chel.kp.ru/online/news/6573513/
,mittelstandcafe.de,Openbank startet Angebot zum Handel mit Kryptowährungen,https://www.mittelstandcafe.de/openbank-startet-angebot-zum-handel-mit-kryptow-hrungen-2198180.html
,defenseworld.net,Microsoft Corporation $MSFT is Silicon Valley Capital Partner 6th Largest Position,https://www.defenseworld.net/2025/09/16/microsoft-corporation-msft-is-silicon-valley-capital-partners-6th-largest-position.html
,munhwa.com,[ 속보 ] 권성동 구속심사 4시간반만에 종료 … 이르면 오늘 밤 결정,https://www.munhwa.com:443/article/11533544
,omanobserver.om,"Gold surges to another record high of $3 , 690 on Tuesday",https://www.omanobserver.om/article/1176625/business/markets/gold-surges-to-another-record-high-of-3690-on-tuesday
,tennesseedaily.com,"Recognizing the Transformative Power of Technology , Alpine Mar Launches Comprehensive Managed IT and IT Consulting Services Offering",http://www.tennesseedaily.com/news/278580371/recognizing-the-transformative-power-of-technology-alpine-mar-launches-comprehensive-managed-it-and-it-consulting-services-offering
