published_at,source,title,url
,citizen.co.za,South African health sector rocked by controversies in 2025,https://www.citizen.co.za/news/south-africa/south-african-health-sector-rocked-by-controversies-in-2025/
,valledaostaglocal.it,La Valle dAosta che costa più di quanto rende  - Valledaostaglocal . it,https://www.valledaostaglocal.it/2025/12/28/leggi-notizia/argomenti/economia/articolo/la-valle-daosta-che-costa-piu-di-quanto-rende.html
,jo24.net,جو 24 : يان الصناعية التجارية تؤكد متانة شراكتها مع الملكية الأردنية بعد اعتماد حقائب Samsonite لطاقم الطائرات,https://jo24.net/article/554243
,themarketsdaily.com,"World Investment Advisors Sells 16 , 500 Shares of iShares MSCI Intl Value Factor ETF $IVLU",https://www.themarketsdaily.com/2025/12/28/world-investment-advisors-sells-16500-shares-of-ishares-msci-intl-value-factor-etf-ivlu.html
,risingbd.com,ডিএসইর প্রথম নারী ব্যবস্থাপনা পরিচালক নুজহাত আনোয়ার,https://www.risingbd.com/economics/stock-market/633775
,dunya.com,Trump : 2026 seçimleri  fiyatlar  etrafında şekillenecek,https://www.dunya.com/ekonomi/trump-2026-secimleri-fiyatlar-etrafinda-sekillenecek-haberi-809117
,themarketsdaily.com,Voya Investment Management LLC Increases Position in ESCO Technologies Inc . $ESE,https://www.themarketsdaily.com/2025/12/28/voya-investment-management-llc-increases-position-in-esco-technologies-inc-ese.html
,navbharattimes.indiatimes.com,"Tarot Card Reading , 29 December 2025 | Tarot Horoscope : बुधादित्य राजयोग से वृषभ सहित 7 राशियों की चमकेगी किस्मत , मिलेगा बड़ा धन लाभ , जानें टैरो कार्ड्स से कल का राशिफल",https://navbharattimes.indiatimes.com/astro/rashifal/tarot-card-prediction/tarot-card-reading-29-december-2025-budhaditya-rajyog-auspicious-for-vrisabha-mithun-and-other-7-rashi-get-big-money-profits/articleshow/126215683.cms
,tickerreport.com,"World Investment Advisors Sells 10 , 272 Shares of Affirm Holdings , Inc . $AFRM",https://www.tickerreport.com/banking-finance/13303242/world-investment-advisors-sells-10272-shares-of-affirm-holdings-inc-afrm.html
,niagarathisweek.com,2025 Ontario house listing staged dolls all over the home,https://www.niagarathisweek.com/news/doll-house-listing-richmond-hill/article_5e538d80-f24f-5f36-aadb-810239078799.html
,dailypolitical.com,"Yousif Capital Management LLC Reduces Position in Halozyme Therapeutics , Inc . $HALO",https://www.dailypolitical.com/2025/12/28/yousif-capital-management-llc-reduces-position-in-halozyme-therapeutics-inc-halo.html
,birgun.net,İktidarın  Aile Yılı  ilan ettiği 2025  te kadın cinayetleri : 260 kadın katledildi !,https://www.birgun.net/haber/iktidarin-aile-yili-ilan-ettigi-2025-te-kadin-cinayetleri-260-kadin-katledildi-679967%20class=slide-link%20target=_blank
,economictimes.indiatimes.com,U . S . Stock Market prediction : S & P 500 to hit 7000 - mark on Monday as Nasdaq investors expect year ending bonanza,https://economictimes.indiatimes.com/news/international/us/u-s-stock-market-prediction-sp-500-to-hit-7000-mark-on-monday-as-nasdaq-investors-expect-year-ending-bonanza/articleshow/126215704.cms
,dailypolitical.com,Vontobel Holding Ltd . Reduces Holdings in Global X Uranium ETF $URA,https://www.dailypolitical.com/2025/12/28/vontobel-holding-ltd-reduces-holdings-in-global-x-uranium-etf-ura.html
,economictimes.indiatimes.com,Office assets anchor private equity investments into Indian realty,https://economictimes.indiatimes.com/industry/services/property-/-cstruction/office-assets-anchor-private-equity-investments-into-indian-realty/articleshow/126215812.cms
,k.sina.com.cn,极石汽车闫枫 ： 2026年极石全球销量目标3万辆,https://k.sina.com.cn/article_5953189932_162d6782c06703ltco.html
,americanrifleman.org,I Have This Old Gun : Ruger Mini - 14 GB | An Official Journal Of The NRA,https://www.americanrifleman.org/content/i-have-this-old-gun-ruger-mini-14-gb/
,haberler.com,"Marmaris Yat Marin MFK , Beymelek Belediyesporu 6 - 2 mağlup etti",https://www.haberler.com/spor/marmaris-yat-marin-mfk-beymelek-belediyespor-u-6-2-maglup-etti-19400573-haberi/
,anglocelt.ie,Ireland EU Council Presidency : What does it mean ? What are the costs ?,https://www.anglocelt.ie/2025/12/28/irelands-eu-council-presidency-what-does-it-mean-what-are-the-costs/
,dgabc.com.br,Greve na Petrobras : 80 % dos funcionários devem retomar atividades - 28 / 12 / 2025,https://www.dgabc.com.br/Noticia/4276680/greve-na-petrobras-80-dos-funcionarios-devem-retomar-atividades
,charentelibre.fr,"Paris , des truffes fraîches comme ça et à ce prix , cest introuvable  : après le rush de Noël , le marché aux truffes de Mainxe - Gondeville se met sur son 31",https://www.charentelibre.fr:443/charente/a-paris-des-truffes-fraiches-comme-ca-et-a-ce-prix-c-est-introuvable-apres-le-rush-de-noel-le-marche-aux-truffes-de-mainxe-gondeville-se-met-sur-son-31-27231286.php
,haberler.com,TCMB 2026 Yılı Para Politikası  nı yayımladı Açıklaması,https://www.haberler.com/ekonomi/tcmb-2026-yili-para-politikasi-ni-yayimladi-19400527-haberi/
,propertynews.pl,Rok 2025 upłynął pod znakiem obniżek stóp procentowych,"https://www.propertynews.pl/finanse/rok-2025-uplynal-pod-znakiem-obnizek-stop-procentowych,195188.html"
,finance.yahoo.com,"Mortgage and refinance interest rates today , December 28 , 2025 : Threatening to slip below 6 %",https://finance.yahoo.com/personal-finance/mortgages/article/mortgage-refinance-interest-rates-today-sunday-december-28-2025-110052512.html
,1prime.ru,Глава  КамАЗа  усомнился в необходимости возвращения Mercedes в Россию,https://1prime.ru/20251228/mercedes-866000004.html
,borbabg.com,Тръмп 2025 : Мита за война и мир ( обзор и прогнози ),https://www.borbabg.com/2025/12/28/trmp-2025-mita-za-voyna-i-mir-obzor-i-prognozi/
,elsol.com.ar,Alfredo Cornejo :  Me siento un gobernante con mala suerte,https://www.elsol.com.ar/mendoza/alfredo-cornejo-me-siento-un-gobernante-con-mala-suerte/
,mavikocaeli.com.tr,Fındık fiyatları patladı ! O tarihte rekor,https://www.mavikocaeli.com.tr/findik-fiyatlari-patladi-o-tarihte-rekor/230873/
,dailypolitical.com,"Vontobel Holding Ltd . Boosts Position in NRG Energy , Inc . $NRG",https://www.dailypolitical.com/2025/12/28/vontobel-holding-ltd-boosts-position-in-nrg-energy-inc-nrg.html
,theconversation.com,Avatar : la réincarnation néo - colonialiste du  bon sauvage  et ses impasses écologiques,https://theconversation.com/avatar-la-reincarnation-neo-colonialiste-du-bon-sauvage-et-ses-impasses-ecologiques-272572
,jagonews24.com,"Polls countdown : 2 , 780 pick nomination forms , 31 submit as deadline ends Monday",https://www.jagonews24.com/en/politics/news/88470
,capital.ba,Bugarska od 1 . januara uvodi evro,https://capital.ba/bugarska-od-1-januara-uvodi-evro/
,aydinses.com,Bursa İnegölde karla mücadele teyakkuzu,https://www.aydinses.com/bursa-inegolde-karla-mucadele-teyakkuzu
,genbeta.com,"Ubuntu es la distribución Linux más exitosa , pero hasta ellos tuvieron que cancelar estos ocho proyectos",https://www.genbeta.com/linux/ubuntu-distribucion-linux-exitosa-ellos-tuvieron-que-cancelar-estos-ocho-proyectos
,stock-world.de,SAP Aktie : Cloud - Panne drückt Stimmung,https://www.stock-world.de/sap-aktie-cloud-panne-drueckt-stimmung/
,dailypolitical.com,"PineStone Asset Management Inc . Sells 15 , 575 Shares of S & P Global Inc . $SPGI",https://www.dailypolitical.com/2025/12/28/pinestone-asset-management-inc-sells-15575-shares-of-sp-global-inc-spgi.html
,finance.yahoo.com,What Does Ford $19 . 5 Billion Bombshell Mean for Investors ?,https://finance.yahoo.com/news/does-fords-19-5-billion-131300273.html
,timesofindia.indiatimes.com,"Abbot : etymology , origin , and the  abba  of cross - cultural authority |",https://timesofindia.indiatimes.com/life-style/books/features/abbot-etymology-origin-and-the-abba-of-cross-cultural-authority/articleshow/126215341.cms
,themarketsdaily.com,ZWJ Investment Counsel Inc . Raises Stock Holdings in Exxon Mobil Corporation $XOM,https://www.themarketsdaily.com/2025/12/28/zwj-investment-counsel-inc-raises-stock-holdings-in-exxon-mobil-corporation-xom.html
,republicoftogo.com,Direct du producteur au consommateur,https://www.republicoftogo.com/toutes-les-rubriques/societe/direct-du-producteur-au-consommateur
,stock.finance.sina.com.cn,电子行业 ： 从智谱华章与MINIMAX招股书看端侧AI机会 __ 新浪财经 _ 新浪网,http://stock.finance.sina.com.cn/stock/go.php/vReport_Show/kind/lastest/rptid/820268011297/index.phtml
,eluniversal.com.mx,"Un año de incertidumbre y sin crecimiento ( económico ), escribe José Pablo Viñas",https://www.eluniversal.com.mx/opinion/jose-pablo-vinas-maguey/un-ano-de-incertidumbre-y-sin-crecimiento-economico/
,eluniversal.com.mx,Diferencia entre tenencias de motos en CDMX y Edomex,https://www.eluniversal.com.mx/opinion/el-caballito/diferencia-entre-tenencias-de-motos-en-cdmx-y-edomex/
,webradio.hu,Az év végi biztosítási határidőkre figyelmeztet a biztosítási alkuszok szövetsége,https://webradio.hu/hirek/gazdasag/az-ev-vegi-biztositasi-hataridokre-figyelmeztet-a-biztositasi-alkuszok-szovetsege
,dgabc.com.br,Caso Master : Toffoli nega recurso e diz que BC e diretor não são investigados - 28 / 12 / 2025,https://www.dgabc.com.br/Noticia/4276693/caso-master-toffoli-nega-recurso-e-diz-que-bc-e-diretor-nao-sao-investigados
,haitisun.com,"From child labor to trafficking , U . S . children under fire",http://www.haitisun.com/news/278776729/from-child-labor-to-trafficking-u-s-children-under-fire
,eldebate.com.ar,"Playa , descanso y pagos digitales : la nueva postal del verano",https://eldebate.com.ar/playa-descanso-y-pagos-digitales-la-nueva-postal-del-verano/
,caifuhao.eastmoney.com,全A唯一 ， 三家社保新进卫星导航龙头 ， 市盈率20倍 ， 暴跌20 % 被套 _ 财富号 _ 东方财富网,https://caifuhao.eastmoney.com/news/20251228160637887075460
,reporter.gr,Σταθεροποιητικές τάσεις στην αγορά crypto – Στη ζώνη των $87 . 000 το Bitcoin,https://www.reporter.gr/diethnh/%CE%BDomismata/661752-statheropoiitikes-taseis-stin-agora-crypto-sti-zoni-ton-87-000-to-bitcoin
,onlinekhabar.com,वैकल्पिक धारभित्र पनि दुई - तीन पार्टी हुनसक्छन्  – Online Khabar,https://www.onlinekhabar.com/2025/12/1837115/there-may-be-two-or-three-parties-within-the-alternative-stream
,tickerreport.com,World Investment Advisors Takes $1 . 70 Million Position in Royalty Pharma PLC $RPRX,https://www.tickerreport.com/banking-finance/13303241/world-investment-advisors-takes-1-70-million-position-in-royalty-pharma-plc-rprx.html
,dailypolitical.com,"Valley National Advisers Inc . Purchases 25 , 843 Shares of Merck & Co ., Inc . $MRK",https://www.dailypolitical.com/2025/12/28/valley-national-advisers-inc-purchases-25843-shares-of-merck-co-inc-mrk.html
,tickerreport.com,Vontobel Holding Ltd . Has $1 . 55 Million Holdings in Credo Technology Group Holding Ltd . $CRDO,https://www.tickerreport.com/banking-finance/13303227/vontobel-holding-ltd-has-1-55-million-holdings-in-credo-technology-group-holding-ltd-crdo.html
,igen.fr,Un iPhone à Noël ? Voici les accessoires quil lui faut,https://www.igen.fr/accessoires/2025/12/un-iphone-noel-voici-les-accessoires-quil-lui-faut-154061
,tickerreport.com,Sunburst Financial Group LLC Takes Position in iShares Core Dividend ETF $DIVB,https://www.tickerreport.com/banking-finance/13303234/sunburst-financial-group-llc-takes-position-in-ishares-core-dividend-etf-divb.html
,libe.ma,"Baisse de 8 , 6 % des levées brutes du Trésor à fin novembre 2025",https://www.libe.ma/Baisse-de-86-des-levees-brutes-du-Tresor-a-fin-novembre-2025_a158276.html
,dailypolitical.com,JPMorgan Chase & Co . $JPM Shares Sold by Yousif Capital Management LLC,https://www.dailypolitical.com/2025/12/28/jpmorgan-chase-co-jpm-shares-sold-by-yousif-capital-management-llc.html
,outoftownblog.com,"The Ultimate Bagan Travel Guide : Temples , Hot Air Balloons , Hotels & Local Secrets",https://outoftownblog.com/bagan-travel-guide/
,itbear.com.cn,欧盟2028年新规 ： 外置电源适配器统一用USB - C接口 ， 线缆可拆卸更环保省钱 - 手机快报 - ITBear科技资讯,https://www.itbear.com.cn/html/2025-12/1070086.html
,baodautu.vn,Doanh nghiệp dệt may báo lãi lớn,https://baodautu.vn/doanh-nghiep-det-may-bao-lai-lon-d471426.html
,trend.az,Weekly review of Azerbaijan currency market,https://www.trend.az/business/4135426.html
,libe.ma,"Le dirham sapprécie de 0 , 5 % face au dollar du 18 au 24 décembre",https://www.libe.ma/Le-dirham-s-apprecie-de-05-face-au-dollar-du-18-au-24-decembre_a158272.html
,news.mail.ru,Der Spiegel : противоречия между Макроном и Мерцем обострились из - за Путина,https://news.mail.ru/politics/69268136/
,vecernji.hr,Od novog europskog paketa za konkurentnost automobila profitirala samo - Kina ?  Ovo im je božićni poklon,https://www.vecernji.hr/barkod/od-novog-europskog-paketa-za-konkurentnost-automobila-profitirala-samo-kina-ovo-im-je-bozicni-poklon-1919743
,globorural.globo.com,Jumentos reprodutores chegam a valer até R$ 600 mil . Saiba os motivos,https://globorural.globo.com/pecuaria/noticia/2025/12/jumentos-reprodutores-chegam-a-valer-ate-r-600-mil-saiba-os-motivos.ghtml
,pagina24.com.mx,Aparatosa Volcadura en el Puente Bicentenario,https://pagina24.com.mx/2025/12/28/policia/aparatosa-volcadura-en-el-puente-bicentenario/
,baodautu.vn,"Lãi suất tiết kiệm tăng dần , lãi vay có sớm tăng theo ?",https://baodautu.vn/lai-suat-tiet-kiem-tang-dan-lai-vay-co-som-tang-theo-d470968.html
,vetogate.com,العمل تطلق الدفعة الأولى من برنامج  سفراء  بمشاركة 50 شابًا وفتاة من مختلف المحافظات,https://www.vetogate.com/5562391
,unternehmen-heute.de,Politik - CDU - Arbeitnehmer fordern rasch Klarheit über Kurs bei Sozialreformen,https://unternehmen-heute.de/news.php?newsid=6683425
,laopiniondemurcia.es,Lluvias Murcia | La lluvia obliga a cortar varias carretera en la Región,https://www.laopiniondemurcia.es/comunidad/2025/12/28/lluvia-obliga-cortar-carretera-region-125193130.html
,standartnews.com,Пророческото есе на Дивак Турлак . 4 часа преди смърта - Общество Новини Стандарт,https://www.standartnews.com/balgariya-obshtestvo/prorocheskoto-ese-na-divak-turlak-4-chasa-predi-smarta-618765.html
,tgrthaber.com,Denizlide indirim çılgınlığı ! Metrelerce uzunluktaki kuyruk havadan görüntülendi,https://www.tgrthaber.com/yasam/denizlide-indirim-cilginligi-metrelerce-uzunluktaki-kuyruk-havadan-goruntulendi-3273333
,finance.sina.com.cn,NVIDIA花200亿美元收购Grop ： 补足GPU短板 未来市值看上7 . 5万亿,https://finance.sina.com.cn/tech/roll/2025-12-28/doc-inhekhim0960498.shtml
,clubic.com,"Mailo ,  contre le pillage des données individuelles des IA",https://www.clubic.com/actualite-590158-interview-mailo.html
,sapo.pt,Os sonhos do jovem  caça - talentos,https://sapo.pt/artigo/os-sonhos-do-jovem-caca-talentos-695128f152dc24aee9fc7dce
,dunya.com,Bakan Bolat : Asgari ücreti bahane eden fırsatçılara izin vermeyeceğiz,https://www.dunya.com/ekonomi/bakan-bolat-asgari-ucreti-bahane-eden-firsatcilara-izin-vermeyecegiz-haberi-809112
,neindia.com,TCSA to Protest Dehradun Attack on Chakma Students,https://neindia.com/tcsa-to-protest-dehradun-attack-on-chakma-students/
,boerse-express.com,Börse Express - Strategy Aktie : Marktanteilsveränderungen analysiert,https://www.boerse-express.com/news/articles/strategy-aktie-marktanteilsveraenderungen-analysiert-852518
,firstpost.com,Bulgaria set to join Eurozone as Hopes of Economic Gains Clash With Public Division – Firstpost,https://www.firstpost.com/world/bulgaria-set-to-join-eurozone-but-fears-and-division-loom-large-13963497.html
,baodautu.vn,"HHV khẳng định vị thế nhà đầu tư hạ tầng , triển vọng lợi nhuận năm 2025 tích cực",https://baodautu.vn/hhv-khang-dinh-vi-the-nha-dau-tu-ha-tang-trien-vong-loi-nhuan-nam-2025-tich-cuc-d475512.html
,guncelgazete.com,800 bin TL değerinde kaçak telefon ele geçirildi,https://www.guncelgazete.com/asayis/800-bin-tl-degerinde-kacak-telefon-ele-gecirildi-60357
,stock-world.de,Coinbase Aktie : Die Superapp - Offensive,https://www.stock-world.de/coinbase-aktie-die-superapp-offensive/
,dgabc.com.br,Veja a Palavra do Leitor do  Diário  deste dia 28 de dezembro de 2025 - 28 / 12 / 2025,https://www.dgabc.com.br/Noticia/4276722/veja-a-palavra-do-leitor-do-diario-deste-dia-28-de-dezembro-de-2025
,finance.gxnews.com.cn,明年1月1日起 ， 这种房贷利率自动下调 - 广西新闻网,http://finance.gxnews.com.cn/staticpages/20251228/newgx6950f040-21888851.shtml
,rawstory.com,The GOP health care onslaught is horrifying but the way they got us here is worse,https://www.rawstory.com/raw-investigates/national-debt-2674830916/
,divyamarathi.bhaskar.com,Superstar Thalapathy Vijay retires from acting | सुपरस्टार थलापती विजयने अभिनयातून निवृत्ती घेतली : शेवटचा चित्रपट  जन नायकन  च्या ऑडिओ लाँचवेळी केली घोषणा,https://divyamarathi.bhaskar.com/entertainment/bollywood/news/superstar-thalapathy-vijay-retires-from-acting-136796349.html
,valledaostaglocal.it,Sequestrati oltre un milione di euro agli indagati per finanziamenti ad Hamas,https://www.valledaostaglocal.it/2025/12/28/leggi-notizia/argomenti/top-news-1/articolo/sequestrati-oltre-un-milione-di-euro-agli-indagati-per-finanziamenti-ad-hamas.html
,finance.yahoo.com,Investors in Artemis Gold ( CVE : ARTG ) have seen enviable returns of 755 % over the past three years,https://finance.yahoo.com/news/investors-artemis-gold-cve-artg-131119248.html
,finance.ifeng.com,汇源重整  罗生门 ： 8 . 5亿资金缺位 ， 资本博弈陷入僵局 _ 凤凰网,https://finance.ifeng.com/c/8pSVDYFTMrC
,eluniversal.com.mx,Las máquinas para hacer tortillas tienen más de un inventor,https://www.eluniversal.com.mx/opinion/mochilazo-en-el-tiempo/las-maquinas-para-hacer-tortillas-tienen-mas-de-un-inventor/
,zazoom.it,Perché Nkunku esulta sempre gonfiando un palloncino dopo ogni gol,https://www.zazoom.it/2025-12-28/perche-nkunku-esulta-sempre-gonfiando-un-palloncino-dopo-ogni-gol-e-una-tenera-dedica/18379924/
,ynet.co.il,אחרי חודשים של הכחשות : התשובות של ChatGPT יכללו פרסומות,https://www.ynet.co.il/digital/technews/article/rkltk5r711l
,ypradio.org,"Memory loss : As AI gobbles up chips , prices for devices may rise",https://www.ypradio.org/npr-news/2025-12-28/memory-loss-as-ai-gobbles-up-chips-prices-for-devices-may-rise
,kauppalehti.fi,Venäjn eliitti rikastui entisestn – Joukossa myös jättipudotus,https://www.kauppalehti.fi/uutiset/a/bf2bb79d-ae89-443c-b10a-1a97237c119a
,jornada.com.mx,La Jornada : Se aglomeran familias en feria de Reyes Magos en avenida Hidalgo,https://www.jornada.com.mx/2025/12/28/capital/030n2cap
,afghanistansun.com,Jefferies shifts weightage from China and Indonesia to India and Taiwan,http://www.afghanistansun.com/news/278778660/jefferies-shifts-weightage-from-china-and-indonesia-to-india-and-taiwan
,14ymedio.com,"Opinión : La dictadura cubana admite la catástrofe , pero no reconoce sus culpas",https://www.14ymedio.com/opinion/dictadura-cubana-admite-catastrofe-no_1_1121848.html
,tickerreport.com,"Hologic , Inc . $HOLX Shares Sold by Yousif Capital Management LLC",https://www.tickerreport.com/banking-finance/13303226/hologic-inc-holx-shares-sold-by-yousif-capital-management-llc.html
,dailypolitical.com,"Voya Investment Management LLC Buys Shares of 832 , 985 Bitfarms Ltd . $BITF",https://www.dailypolitical.com/2025/12/28/voya-investment-management-llc-buys-shares-of-832985-bitfarms-ltd-bitf.html
,levante-emv.com,NAVIDAD | El vino caliente de los mercadillos navideños europeos conquista también España :  Vendemos mucho desde la mañana,https://www.levante-emv.com/sociedad/2025/12/28/vino-caliente-mercadillos-navidenos-europeos-espana-125197797.html
,technotoday.com.tr,RGB Mini - LED Teknolojisi Premium TVlerde Devrim Yaratacak,https://technotoday.com.tr/rgb-mini-led-teknolojisi-premium-tvlerde-devrim-yaratacak/
,themarketsdaily.com,"Voya Investment Management LLC Sells 24 , 563 Shares of Lantheus Holdings , Inc . $LNTH",https://www.themarketsdaily.com/2025/12/28/voya-investment-management-llc-sells-24563-shares-of-lantheus-holdings-inc-lnth.html
,eldebate.com.ar,Las reservas subieron casi US$ 600 millones y son récord en la era Milei,https://eldebate.com.ar/las-reservas-subieron-casi-us-600-millones-y-son-record-en-la-era-milei/
,tickerreport.com,"Valley National Advisers Inc . Makes New Investment in AMETEK , Inc . $AME",https://www.tickerreport.com/banking-finance/13303231/valley-national-advisers-inc-makes-new-investment-in-ametek-inc-ame.html
,baodautu.vn,"Đảng , Nhà nước tặng quà nhân dịp chào mừng Đại hội Đảng XIV và Tết Bính Ngọ 2026",https://baodautu.vn/dang-nha-nuoc-tang-qua-nhan-dip-chao-mung-dai-hoi-dang-xiv-va-tet-binh-ngo-2026-d475557.html
,milliyet.com.tr,Son dakika haberi : Ne altın ne dolar ne de borsa ... Getiride hepsini solladı : İşte bu yılın en çok kazandıranı,https://www.milliyet.com.tr/ekonomi/ne-altin-ne-dolar-ne-de-borsa-getiride-hepsini-solladi-iste-bu-yilin-en-cok-kazandirani-7510941
,yeniakit.com.tr,Çadır kurup bekleyenler bile var ! Bu da çekilişli kuralı otomobil satışı,https://www.yeniakit.com.tr/haber/cadir-kurup-bekleyenler-bile-var-bu-da-cekilisli-kurali-otomobil-satisi-1973390.html
,finance.eastmoney.com,龙头8连板 本周披露并购重组进展的A股名单一览 _ 东方财富网,https://finance.eastmoney.com/a/202512283603764566.html
,dailypolitical.com,World Investment Advisors Has $1 . 92 Million Stock Holdings in Invesco S & P 500 GARP ETF $SPGP,https://www.dailypolitical.com/2025/12/28/world-investment-advisors-has-1-92-million-stock-holdings-in-invesco-sp-500-garp-etf-spgp.html
,rts.ch,La science suisse renoue avec ses succès passés en Europe,https://www.rts.ch/info/suisse/2025/article/la-suisse-reintegre-avec-succes-le-programme-de-recherche-europeen-horizon-29101950.html
,itbear.com.cn,领益智造成五大科技巨头供应商 ， 多股获机构调研近一周平均上涨近5 %- 业界动态 - ITBear科技资讯,https://www.itbear.com.cn/html/2025-12/1070070.html
,themarketsdaily.com,Sapient Capital LLC Raises Stock Holdings in Invesco S & P 500 Equal Weight ETF $RSP,https://www.themarketsdaily.com/2025/12/28/sapient-capital-llc-raises-stock-holdings-in-invesco-sp-500-equal-weight-etf-rsp.html
,aydinses.com,Manisada Perşembe Pazarı yeni yüzüne kavuşuyor,https://www.aydinses.com/manisada-persembe-pazari-yeni-yuzune-kavusuyor
,southwalesargus.co.uk,Grade II - listed pub Cross Keys Inn in Usk hits market,https://www.southwalesargus.co.uk/news/25721496.grade-ii-listed-pub-cross-keys-inn-usk-hits-market/
,moneycontrol.com,"Sweeping tariffs , H1 - B visa fees , travel bans : How Trump policies jolted the world and reshaped 2025",https://www.moneycontrol.com/world/sweeping-tariffs-h1-b-visa-fees-travel-bans-how-trump-s-policies-jolted-the-world-and-reshaped-2025-article-13745628.html
,hampshirechronicle.co.uk,Stockbridge farm Lusso Leaf secures major London contract,https://www.hampshirechronicle.co.uk/news/25708888.stockbridge-farm-lusso-leaf-secures-major-london-contract/
,163.com,深蓝汽车邓承浩 ： 下一代车型全部都有L3级自动驾驶功能,https://www.163.com/dy/article/KHT6F6B605199DKK.html
,rnz.de,Landtagswahl 2026 : Rülke schließt Regierung mit Grünen und SPD aus - Südwest - Nachrichten und Aktuelles,"https://www.rnz.de/politik/suedwest_artikel,-Landtagswahl-2026-Ruelke-schliesst-Regierung-mit-Gruenen-und-SPD-aus-_arid,1848181.html"
,themarketsdaily.com,Voya Investment Management LLC Boosts Stock Holdings in Hecla Mining Company $HL,https://www.themarketsdaily.com/2025/12/28/voya-investment-management-llc-boosts-stock-holdings-in-hecla-mining-company-hl.html
,jp.se,JIK dalar i tabellen efter ny förlust :  Får se var vi hamnar  – Jönköpings - Posten,https://www.jp.se/2025-12-27/jik-dalar-i-tabellen-efter-ny-forlust-far-se-var-vi-hamnar/
,jagonews24.com,Bangladeshi IT frm Betopia opens subsidiary in Manila,https://www.jagonews24.com/en/business/news/88471
,tgrthaber.com,"Netanyahunun sırlarının bekçisinin telefonu hacklendi : Gizli anlaşmalar , utanç verici ahlaki ve mali kaçamaklar",https://www.tgrthaber.com/dunya/netanyahunun-sirlarinin-bekcisinin-telefonu-hacklendi-gizli-anlasmalar-utanc-verici-a-3273359
,dailypolitical.com,"Vontobel Holding Ltd . Acquires 38 , 898 Shares of C3 . ai , Inc . $AI",https://www.dailypolitical.com/2025/12/28/vontobel-holding-ltd-acquires-38898-shares-of-c3-ai-inc-ai.html
,charentelibre.fr,"De 100  % à 85 , 71  % : pourquoi le taux de conformité de leau potable sest détérioré à Ruffec entre 2023 et 2024",https://www.charentelibre.fr:443/environnement/de-100-a-85-71-pourquoi-le-taux-de-conformite-de-l-eau-potable-s-est-deteriore-a-ruffec-entre-2023-et-2024-27121098.php
