published_at,source,title,url
,finanzen.net,"GNW - News : Assaia sammelt 26 , 6 Millionen US - Dollar in Serie - B - Finanzierungsrunde , um seine globale Führungsposition im Bereich KI für den Flughafenbetrieb aus ...",https://www.finanzen.net/nachricht/aktien/gnw-news-assaia-sammelt-26-6-millionen-us-dollar-in-serie-b-finanzierungsrunde-um-seine-globale-fuehrungsposition-im-bereich-ki-fuer-den-flughafenbetrieb-aus-15349013
,shasha.ps,المالية : رواتب الموظفين يوم غدٍ الخميس بنسبة 60 % وبحد أدناه 2000 شيكل,https://shasha.ps/home/%D8%A7%D9%84%D9%85%D8%A7%D9%84%D9%8A%D8%A9-%D8%B1%D9%88%D8%A7%D8%AA%D8%A8-%D8%A7%D9%84%D9%85%D9%88%D8%B8%D9%81%D9%8A%D9%86-%D9%8A%D9%88%D9%85-%D8%BA%D8%AF
,bernerzeitung.ch,FuW - Börsenspiel : Das sind die Gewinner des Börsenspiels,https://www.bernerzeitung.ch/fuw-boersenspiel-das-sind-die-gewinner-des-boersenspiels-903046822987
,european-coatings.com,European Coatings Podcast : Analysis of the merger between Axalta and Akzo Nobel,https://www.european-coatings.com/news/markets-companies/european-coatings-podcast-analysis-of-the-merger-between-axalta-and-akzo-nobel/
,money.it,"Riunione Fed oggi , in DIRETTA . Il mercato attende il taglio tassi e le parole di Powell",https://www.money.it/riunione-fed-oggi-in-diretta-il-mercato-attende-il-taglio-tassi-e-le-parole-di-powell
,dailysabah.com,"TUI posts strong 2025 results , sees Türkiye among popular destinations",https://www.dailysabah.com/business/tourism/tui-posts-strong-2025-results-sees-turkiye-among-popular-destinations
,iphonesoft.fr,Linévitable domination américaine sur lintelligence artificielle,https://iphonesoft.fr/2025/12/10/inevitable-domination-americaine-intelligence-artificielle
,libero.pe,Fichajes 2026 | Cusco FC sacude el mercado y busca la firma de jugador tricampeón con Universitario,https://libero.pe:443/futbol-peruano/liga-1/2025/12/10/fichajes-2026-cusco-fc-sacude-mercado-busca-firma-de-jugador-tricampeon-universitario-585460
,hospitalitynet.org,Riccardo Bortolotti has been appointed Area General Manager at R Collection Hotels Lake Como,https://www.hospitalitynet.org/appointment/79031314.html
,ipsnoticias.net,La ONU80 es menos una reforma que un manual de sobrevivencia,https://ipsnoticias.net/2025/12/la-onu80-es-menos-una-reforma-que-un-manual-de-sobrevivencia/
,komputerswiat.pl,ARM wkracza do centrów danych . Czy Intel i AMD odchodzą do przeszłości ?,https://www.komputerswiat.pl/artykuly/redakcyjne/arm-wkracza-do-centrow-danych-czy-intel-i-amd-odchodza-do-przeszlosci/ty3xs2y
,bursa.ro,Sondaj eToro : Investitorii individuali sunt încrezători că piaţa bull va continua în 2026,https://www.bursa.ro/sondaj-etoro-investitorii-individuali-sunt-increzatori-ca-piata-bull-va-continua-in-2026-05198755
,themarketsdaily.com,"13 , 416 Shares in Twilio Inc . $TWLO Purchased by WINTON GROUP Ltd",https://www.themarketsdaily.com/2025/12/10/13416-shares-in-twilio-inc-twlo-purchased-by-winton-group-ltd.html
,netzwelt.de,"Fernseher - Adapter im Überblick : HDMI , Scart und USB",https://www.netzwelt.de/fernseher/adapter-fernseher-anpassen.html
,iphonesoft.fr,Pebble Index 01 : La bague intelligente à 75 $ qui capture vos idées fugaces,https://iphonesoft.fr/2025/12/10/pebble-index-01-bague-intelligente-75-dollar-capture-idees-fugaces
,whatson.ae,5 festive things to do in Dubai this weekend : December 12 to 14,https://whatson.ae/2025/12/things-to-do-in-dubai-this-weekend-december-12-to-14-2025/
,jabar.jpnn.com,Pemkab Karawang Siapkan Rp10 Miliar untuk Penataan Besar - Besaran Kawasan Perkotaan Cikampek,https://jabar.jpnn.com/jabar-terkini/28481/pemkab-karawang-siapkan-rp10-miliar-untuk-penataan-besar-besaran-kawasan-perkotaan-cikampek
,fr.euronews.com,"Le monde est conquis par le Pastel de Belém , mais les Portugais débattent encore : où fabrique - t - on la meilleure  nata    ?",https://fr.euronews.com/culture/2025/12/10/le-monde-est-conquis-par-le-pastel-de-belem-mais-les-portugais-debattent-encore-ou-fabriqu
,bordertelegraph.com,Selkirk celebrated during annual Christmas lights switch - on,https://www.bordertelegraph.com/news/25682198.selkirk-celebrated-annual-christmas-lights-switch-on/
,investireoggi.it,Codice tributo 3912 per il saldo IMU : il dettaglio che separa esenzione e tassazione sulle prime case,https://www.investireoggi.it/codice-tributo-3912-per-il-saldo-imu-il-dettaglio-che-separa-esenzione-e-tassazione-sulle-prime-case/
,tz.de,Aufschrei aus Russlands Wirtschaft : Sektor warnt vor massivem Kollaps,http://www.tz.de/wirtschaft/aufschrei-aus-russlands-wirtschaft-sektor-warnt-vor-massivem-kollaps-zr-94060957.html
,muypymes.com,Sage cierra su año fiscal con resultados robustos y refuerza su apuesta por la nube y la IA,https://www.muypymes.com/2025/12/10/sage-ano-fiscal-resultados-apuesta-nube-ia
,m.kauno.diena.lt,Merkurijus Šaulyje : ko tikėtis gruodžio 12 – sausio 1 d .,https://m.kauno.diena.lt/naujienos/ivairenybes/horoskopai/merkurijus-saulyje-ko-tiketis-gruodzio-12-sausio-1-d-1732674
,themarketsdaily.com,Integrated Investment Consultants LLC Trims Position in Bank of America Corporation $BAC,https://www.themarketsdaily.com/2025/12/10/integrated-investment-consultants-llc-trims-position-in-bank-of-america-corporation-bac.html
,tamindir.com,Microsoft Flight Simulator ve Stranger Things İş Birliği Başladı,https://www.tamindir.com/haber/microsoft-flight-simulator-stranger-things-is-birligi_102642/
,news.cyol.com,书写温暖的民生答卷,http://news.cyol.com/gb/articles/2025-12/10/content_AjRBPGCzLM.html
,agrarheute.com,Landwirtschaft auf dem Weltmarkt : Agrarexportstrategie soll Märkte öffnen,https://www.agrarheute.com/politik/landwirtschaft-weltmarkt-agrarexportstrategie-maerkte-oeffnen-638079
,regio7.cat,Els comerciants omplen Berga dactivitats nadalenques i impulsen una baixada de torxes solidària,https://www.regio7.cat/bergueda/2025/12/10/els-comerciants-omplen-berga-d-124631892.html
,indianexpress.com,"US Trade Representative Jamieson Greer says India  very difficult nut to crack , gives update on trade deal | World News",https://indianexpress.com/article/world/very-difficult-nut-to-crack-us-trade-representative-jamieson-greer-on-trade-deal-with-india-10413277/
,lahora.gt,696 días en los que el MP ratifica su protección oficiosa a Miguel Martínez,https://lahora.gt/nacionales/smorales/2025/12/10/van-dias-en-los-que-el-mp-ratifica-su-proteccion-oficiosa-a-miguel-martinez/
,sol.de,Einkaufen an Heiligabend und Weihnachten 2025 im Saarland : Das sind die Öffnungszeiten und Regeln,"https://www.sol.de/saarland/heiligabend-und-weihnachten-im-saarland-wo-man-einkaufen-kann-und-wo-nicht,663577.html"
,aktiencheck.de,InTiCa Systems Aktie : Alarmsignal voraus ? (),https://www.aktiencheck.de/analysen/Artikel-InTiCa_Systems_Aktie_Alarmsignal_voraus-19291119
,themarketsdaily.com,WINTON GROUP Ltd Has $2 . 31 Million Stock Position in The Charles Schwab Corporation $SCHW,https://www.themarketsdaily.com/2025/12/10/winton-group-ltd-has-2-31-million-stock-position-in-the-charles-schwab-corporation-schw.html
,br.ign.com,Assinante da HBO Max processa Netflix por possível aquisio da Warner Bros .,https://br.ign.com/netflix/149122/news/assinante-da-hbo-max-processa-netflix-por-possivel-aquisicao-da-warner-bros
,tass.ru,"Размер госдолга Ульяновской области снизится на 2 , 6 млрд рублей",https://tass.ru/ekonomika/25872351
,liputan6.com,"12 Rekomendasi Tempat Makan Soto di Malang , Kuah Kaldunya Bikin Nagih dan Wajib Dicoba",https://www.liputan6.com/lifestyle/read/6233177/12-rekomendasi-tempat-makan-soto-di-malang-kuah-kaldunya-bikin-nagih-dan-wajib-dicoba
,freshplaza.com,"Oranges take center stage at Food Africa , Egypt",https://www.freshplaza.com/north-america/article/9793343/oranges-take-center-stage-at-food-africa-egypt/
,biztoc.com,"Fed meeting live coverage : Federal Reserve set to cut interest rates for third time this year , 2026 forecast in focus",https://biztoc.com/x/c0013e766f56fa3a
,radio.wpsu.org,A divided Fed is expected to cut rates for a 3rd straight time,https://radio.wpsu.org/2025-12-10/a-divided-fed-is-expected-to-cut-rates-for-a-3rd-straight-time
,agrigentonotizie.it,"Laeroporto di Agrigento , un sogno che prende quota : Pendolino fa il bilancio dei primi mesi alla guida del Libero consorzio",https://www.agrigentonotizie.it/politica/aeroporto-prende-quota-pendolino-bilancio-viabilita-edilizia-.html
,sol.de,Bewaffnete Soldaten auf Weihnachtsmarkt in Zweibrücken,"https://www.sol.de/saarland/bewaffnete-soldaten-auf-weihnachtsmarkt-in-zweibruecken-polizei-prueft-re-2,663533.html"
,ictjournal.ch,Sandra Hürlimann devient CTO pour la Suisse au sein de la nouvelle entité Helvetia Baloise ( update ),https://www.ictjournal.ch/news/2025-12-10/sandra-hurlimann-devient-cto-pour-la-suisse-au-sein-de-la-nouvelle-entite-helvetia
,allafrica.com,Uganda : Prau Lifetime Achievement Award for Sarah Kagingo,https://allafrica.com/stories/202512100400.html
,biztoc.com,IMF revises China growth forecast,https://biztoc.com/x/17062ba5c91aa4e2
,aol.co.uk,Lidl : Budget supermarket launches croissant - scented perfume for Christmas,https://www.aol.co.uk/articles/lidl-budget-supermarket-launches-croissant-133438690.html
,antigojournal.com,"A great turn out . Goodrich - Gonzalez Christmas House Tour raises $2 , 000 for veterans",https://www.antigojournal.com/news/a-great-turn-out-goodrich-gonzalez-christmas-house-tour-raises-2-000-for-veterans/article_61bec5ab-30d4-45b6-a730-cff614c81d1a.html
,notizie.tiscali.it,Cini ( Niq ):  Largo consumo in crescita anche nel 2026,https://notizie.tiscali.it/economia/articoli/cini-niq-largo-consumo-in-crescita-anche-nel-2026/
,theitem.com,"So much to enjoy : Backcountry Christmas and JingleFest on Saturday , and Sumter Civic Chorale free Christmas concert and Summerton Christmas Parade on Sunday","http://www.theitem.com/stories/so-much-to-enjoy-backcountry-christmas-and-jinglefest-on-saturday-and-sumter-civic-chorales-free,437128"
,cdapress.com,Kootenai median home price rises,https://cdapress.com/news/2025/dec/10/kootenai-median-home-price-rises/
,laopiniondemurcia.es,Programa Navidad Murcia | Menús de calidad para todos en la Plaza de la Merced de Murcia : las actividades programadas para hoy,https://www.laopiniondemurcia.es/murcia/2025/12/10/menus-calidad-plaza-merced-murcia-124629973.html
,leo-mosk.livejournal.com,Принят законопроект первого чтения Д1 10755S7 - 8  О внесении изменений в Федеральный закон  Об исполн,https://leo-mosk.livejournal.com/11572894.html
,regio7.cat,"Navarra , Madrid i Catalunya tenen les universitats públiques més cares",https://www.regio7.cat/societat/2025/12/10/desigualtat-preus-taxes-universitat-publica-124640591.html
,persoenlich.com,Advertorial : Mit der adconsole crossmediale Werbung effizient managen,https://www.persoenlich.com/digital/mit-der-adconsole-crossmediale-werbung-effizient-managen
,startupcafe.ro,"GDPR 2025 : Firmă care operează mai multe platforme online de jocuri de noroc , cu afaceri de zeci de milioane EUR în 2024 , amendată de statul român cu 15 . 000 EUR",https://startupcafe.ro/gdpr-2025-firma-care-opereaza-mai-multe-platforme-online-de-jocuri-de-noroc-cu-afaceri-de-zeci-de-milioane-eur-in-2024-amendata-de-statul-roman-cu-15-000-eur-91345
,express.co.uk,UK  most beautiful city  is most likely to get snowfall this winter | Travel News | Travel,https://www.express.co.uk/travel/articles/2144621/uks-most-beautiful-city-most
,bssnews.net,"Stocks on DSE down , up on CSE",https://www.bssnews.net/business/340731
,fr.euronews.com,"Selon Perplexity , la plupart utilisent des agents dIA pour la productivité et lapprentissage",https://fr.euronews.com/next/2025/12/10/selon-perplexity-la-plupart-utilisent-des-agents-dia-pour-la-productivite-et-lapprentissag
,ambito.com,"Bitcoin alcanza los u$s91 . 000 , mientras se mantiene la expectativa por la decisión de la Fed sobre las tasas",https://www.ambito.com/finanzas/bitcoin-alcanza-los-us91000-mientras-se-mantiene-la-expectativa-la-decision-la-fed-las-tasas-n6222553
,applesfera.com,"En plena crisis de memorias RAM disparándose de precio , la posición de Apple parece privilegiada . De momento",https://www.applesfera.com/general/plena-crisis-memorias-ram-disparandose-precio-posicion-apple-parece-privilegiada-momento
,manilatimes.net,24 / 7 Market News - Kraig Labs Breakthrough Science is Pivoting to Scalable Business,https://www.manilatimes.net/2025/12/10/tmt-newswire/globenewswire/247-market-news-kraig-labs-breakthrough-science-is-pivoting-to-scalable-business/2240810
,thanhtra.com.vn,"Phê duyệt Đề án đào tạo nguồn nhân lực chất lượng cao ở Nga , Trung Quốc , các nước Đông Âu và các nước thuộc Liên Xô cũ",https://thanhtra.com.vn/doi-ngoai-97D2D2A31/phe-duyet-de-an-dao-tao-nguon-nhan-luc-chat-luong-cao-o-nga-trung-quoc-cac-nuoc-dong-au-va-cac-nuoc-thuoc-lien-xo-cu-fd59f9956.html
,chronicle.lu,Charity Art Event  Brings 2 - Day Art Market & Workshops to Hotel Royal,https://www.chronicle.lu/category/things-to-see-do/58435-charity-art-event-brings-2-day-art-market-workshops-to-hotel-royal
,goal.pl,Kolejny chętny na Huję . Trop prowadzi do Krakowa [ NASZ NEWS ],https://www.goal.pl/transfery/kolejny-chetny-na-huje-trop-prowadzi-do-krakowa-nasz-news/
,oxfordmail.co.uk,Will Evri couriers be  removed  in Oxfordshire after united kingdom issues ?,https://www.oxfordmail.co.uk/news/25687148.will-evri-couriers-removed-oxfordshire-uk-issues/
,marketscreener.com,US labor costs growth slows in third quarter,https://www.marketscreener.com/news/us-labor-costs-growth-slows-in-third-quarter-ce7d50dad98bf32c
,manilatimes.net,Mosaic Capital Partners Announces New Hire,https://www.manilatimes.net/2025/12/10/tmt-newswire/globenewswire/mosaic-capital-partners-announces-new-hire/2240801
,english.news.cn,"Economic Watch : China CPI picks up , PPI stabilizes on demand recovery - Xinhua",https://english.news.cn/20251210/98d0a43194504bada51344da3e909b7a/c.html
,mlive.com,"Michigan craft beer boom is over , but these survivors arent tapped out",https://www.mlive.com/news/grand-rapids/2025/12/michigans-craft-beer-boom-is-over-but-these-survivors-arent-tapped-out.html
,prnewswire.com,"SpotOn Unveils 2026 Restaurant Outlook Focused on Profit , Not Hype",https://www.prnewswire.com/news-releases/spoton-unveils-2026-restaurant-outlook-focused-on-profit-not-hype-302637394.html
,briefingwire.com,Argentina Military Wearable Market Soars,https://www.briefingwire.com/pr/argentina-military-wearable-market-soars
,a24.com.tr,Genel Şirket Haberleri,https://www.a24.com.tr/genel-sirket-haberleri-haberi-40231080h.html
,tech.ifeng.com,大疆 Pocket 4 爆料汇总 ： 下个月发布 ， 更强也更难抢 ？,https://tech.ifeng.com/c/8oybSKkWKkP
,diariamenteneuquen.com.ar,Cayó delincuente escurridizo : por fin está preso | Diariamente Neuquén,https://www.diariamenteneuquen.com.ar/noticias/2025/12/10/21115-cayo-delincuente-escurridizo-por-fin-esta-preso
,vf.is,Rödd mín fyrir betri Reykjanesbæ,https://www.vf.is/adsent/rodd-min-fyrir-betri-reykjanesbae
,oplanetatv.clickgratis.com.br,Globo reage à queda do  Domingão com Huck  com novos formatos,https://oplanetatv.clickgratis.com.br/noticias/audiencia-da-tv/globo-reage-a-queda-do-domingao-com-huck-com-novos-formatos.html
,defenseworld.net,"Flow Traders U . S . LLC Takes $938 , 000 Position in Zscaler , Inc . $ZS",https://www.defenseworld.net/2025/12/10/flow-traders-u-s-llc-takes-938000-position-in-zscaler-inc-zs.html
,themarketsdaily.com,"McCormick & Company , Incorporated $MKC Shares Sold by WINTON GROUP Ltd",https://www.themarketsdaily.com/2025/12/10/mccormick-company-incorporated-mkc-shares-sold-by-winton-group-ltd.html
,finanznachrichten.de,Copper Quest schließt positive Due - Diligence - Prüfung für Alpine ab und stockt Privatplatzierung auf,https://www.finanznachrichten.de/nachrichten-2025-12/67197659-copper-quest-schliesst-positive-due-diligence-pruefung-fuer-alpine-ab-und-stockt-privatplatzierung-auf-248.htm
,biztoc.com,Three Surprising Stocks Have Outpaced All Aerospace Peers This Year,https://biztoc.com/x/367ea93527352a14
,hkcna.hk,從 《 哪吒2 》、 Labubu火爆看中國  文化軍團  崛起 | 頭條,https://www.hkcna.hk/docDetail.jsp?id=101187768&channel=2803
,notizie.tiscali.it,Bonelli ( Avs ): Governo alza tetto al contante a 10 mila invece di aiutare i più poveri,https://notizie.tiscali.it/politica/articoli/bonelli-avs-governo-alza-tetto-contante-10-mila-invece-aiutare-pia-poveri-00001/
,bordertelegraph.com,UK will  keep close eye  on Australia under - 16s social media ban – Lisa Nandy,https://www.bordertelegraph.com/news/national/25686287.uk-will-keep-close-eye-australias-under-16s-social-media-ban---lisa-nandy/
,hindustantimes.com,"US received  best offer ever  from India , says Trump trade official amid deal negotiations",https://www.hindustantimes.com/world-news/us-received-best-offer-ever-from-india-says-trump-official-amid-trade-deal-negotiations-101765371907911.html
,heraldo.es,Los Porches del Audiorama continúa con su programación navideña con talleres infantiles y mercados,https://www.heraldo.es/noticias/aragon/zaragoza/2025/12/10/porches-audiorama-navidad-talleres-infantiles-mercados-1877443.html
,stockbiz.vn,Chuyện lạ thế giới Người Việt 4 phương Nga vẫn hưởng lợi khi EU chật vật tìm lối thoát năng lượng,https://stockbiz.vn/tin-tuc/chuyen-la-the-gioi-nguoi-viet-4-phuong-nga-van-huong-loi-khi-eu-chat-vat-tim-loi-thoat-nang-luong/37184751
,journaldugeek.com,Pornographie en ligne : pourquoi la loi SREN met les travailleuses du sexe en danger ?,https://www.journaldugeek.com/2025/12/10/pornographie-en-ligne-pourquoi-la-loi-sren-met-les-travailleuses-du-sexe-en-danger/
,hospitalitynet.org,"What JW Marriott and Hilton can teach us about culture , data , and success in modern hotel openings",https://www.hospitalitynet.org/news/4130124.html
,finanzen.ch,MÄRKTE united states / Börsen dürften erst mit Fed - Entscheid Fahrt aufnehmen,https://www.finanzen.ch/nachrichten/aktien/maerkte-usa-boersen-duerften-erst-mit-fed-entscheid-fahrt-aufnehmen-1035632989
,briefingwire.com,Global Digital Patient Monitoring Devices Market 2035,https://www.briefingwire.com/pr/global-digital-patient-monitoring-devices-market-2035
,diagonales.com,La actividad industrial volvió a caer y acumula cuatro meses consecutivos en picada,https://www.diagonales.com/nacion/la-actividad-industrial-volvio-a-caer-y-acumula-cuatro-meses-consecutivos-en-picada_a69395fb91d1c6929ea3b7b89
,curierulnational.ro,"Prețurile proprietăților din stațiunile de schi continuă să crească , cu Aspen , Val dIsère și Gstaadt în Top 3",https://curierulnational.ro/preturile-proprietatilor-din-statiunile-de-schi-continua-sa-creasca-cu-aspen-val-disere-si-gstaadt-in-top-3/
,briefingwire.com,"Global Concentrated Solar Power Market to Hit USD 15 , 007 . 76 Million by 2035",https://www.briefingwire.com/pr/global-concentrated-solar-power-market-to-hit-usd-1500776-million-by-2035
,nashvilleherald.com,Ryde Accelerates Growth with Strategic Expansion into Electric Vehicle Rental Market,http://www.nashvilleherald.com/news/278747234/ryde-accelerates-growth-with-strategic-expansion-into-electric-vehicle-rental-market
,ecologistasenaccion.org,O ecoloxismo articulado coas comunidades locais ha desmontado nos últimos anos numerosos proxectos mineiros e as súas tramas corruptas  • Ecologistas en Acción,https://www.ecologistasenaccion.org/353366/o-ecoloxismo-articulado-coas-comunidades-locais-ha-desmontado-nos-ultimos-anos-numerosos-proxectos-mineiros-e-as-suas-tramas-corruptas/
,bitacora.com.uy,El cobre reanuda ganancias en torno a un récord en presencia de perspectivas de ofrecimiento ajustadas,https://bitacora.com.uy/el-cobre-reanuda-ganancias-en-torno-a-un-record-en-presencia-de-perspectivas-de-ofrecimiento-ajustadas/
,koimoi.com,Zootopia 2 North America Box Office : Is The Sequel On Track To Surpass The First Film ?,https://www.koimoi.com/box-office/zootopia-2-north-america-box-office-is-the-sequel-on-track-to-surpass-the-first-film/
,ambito.com,"La ley de Inocencia Fiscal no es un nuevo blanqueo , pero sí limita las facultades de control de ARCA",https://www.ambito.com/opiniones/la-ley-inocencia-fiscal-no-es-un-nuevo-blanqueo-pero-si-limita-las-facultades-control-arca-n6222531
,orf.at,Israel genehmigt Bau Hunderter Wohneinheiten in Westbank,https://orf.at/stories/3413993/
,koran-jakarta.com,"Jakarta, Jakarta Raya, Indonesia",https://koran-jakarta.com/2025-12-10/program-magang-nasional-dan-penyiapan-pekerja-migran-katrol-penyerapan-sdm-industri
,koran-jakarta.com,Indonesia,https://koran-jakarta.com/2025-12-10/program-magang-nasional-dan-penyiapan-pekerja-migran-katrol-penyerapan-sdm-industri
,www.radioagricultura.cl,Venezuela,https://www.radioagricultura.cl/noticias/politica/es-absolutamente-mentira-german-codina-desmiente-fin-a-las-40-horas-en-propuesta-de-jose-antonio-kast_20251210/
,www.tpr.org,"California, United States",https://www.tpr.org/news/2025-12-10/useful-tips-from-nprs-most-popular-self-help-stories-of-the-year
,www.tpr.org,"Finger Lakes, New York, United States",https://www.tpr.org/news/2025-12-10/useful-tips-from-nprs-most-popular-self-help-stories-of-the-year
,www.tpr.org,"New York, United States",https://www.tpr.org/news/2025-12-10/useful-tips-from-nprs-most-popular-self-help-stories-of-the-year
,www.waldnet.nl,"Bekkum, Overijssel, Netherlands",https://www.waldnet.nl/includes/show/nieuws.php?id=50251
,www.waldnet.nl,"Leeuwarden, Friesland, Netherlands",https://www.waldnet.nl/includes/show/nieuws.php?id=50251
,www.interfax.ru,Russia,https://www.interfax.ru/pressreleases/1062496
,www.pravda.com.ua,"Beijing, Beijing, China",https://www.pravda.com.ua/rus/news/2025/12/10/8011236/
,www.pravda.com.ua,Ukraine,https://www.pravda.com.ua/rus/news/2025/12/10/8011236/
,www.pravda.com.ua,China,https://www.pravda.com.ua/rus/news/2025/12/10/8011236/
,www.riotimesonline.com,"Mato Grosso, Estado Do Rio, Brazil",https://www.riotimesonline.com/sao-paulos-industrial-engine-falters-as-brazils-recovery-loses-steam/
,www.riotimesonline.com,Brazil,https://www.riotimesonline.com/sao-paulos-industrial-engine-falters-as-brazils-recovery-loses-steam/
,www.riotimesonline.com,"Rio Grande Do Sul, Rio Grande Do Sul, Brazil",https://www.riotimesonline.com/sao-paulos-industrial-engine-falters-as-brazils-recovery-loses-steam/
,www.riotimesonline.com,"Amazonas, Bahia, Brazil",https://www.riotimesonline.com/sao-paulos-industrial-engine-falters-as-brazils-recovery-loses-steam/
,www.riotimesonline.com,"Minas Gerais, Acre, Brazil",https://www.riotimesonline.com/sao-paulos-industrial-engine-falters-as-brazils-recovery-loses-steam/
,www.riotimesonline.com,"Rio Grande Do Norte, Rio Grande Do Norte, Brazil",https://www.riotimesonline.com/sao-paulos-industrial-engine-falters-as-brazils-recovery-loses-steam/
,www.riotimesonline.com,"Rio De Janeiro, Estado Do Rio, Brazil",https://www.riotimesonline.com/sao-paulos-industrial-engine-falters-as-brazils-recovery-loses-steam/
,www.negocios.com,"Bucaramanga, Santander, Colombia",https://www.negocios.com/articulo/ultima-hora/terremoto-magnitud-55-sacude-norte-colombia-dejar-danos/20251210111937474668.html
,www.negocios.com,Colombia,https://www.negocios.com/articulo/ultima-hora/terremoto-magnitud-55-sacude-norte-colombia-dejar-danos/20251210111937474668.html
,islam-today.ru,"Volga, Yaroslavskaya Oblast', Russia",https://islam-today.ru/foto-dna/permskaa-sobornaa-mecet-simvol-very-i-istorii-islama-na-urale-foto/
,www.volksstimme.de,Germany,https://www.volksstimme.de/panorama/entrumpeln-und-vereinfachen-land-will-weniger-burokratie-4163487
,www.yeniazerbaycan.com,Azerbaijan,https://www.yeniazerbaycan.com/YAPxeber_e133268_az.html
,navabharat.com,"Anantapur, Andhra Pradesh, India",https://navabharat.com/?p=355582
,www.balcanicaucaso.org,Romania,https://www.balcanicaucaso.org/cp_article/ciprian-ciucu-il-nuovo-sindaco-di-bucarest/
,www.balcanicaucaso.org,"Georgia, United States",https://www.balcanicaucaso.org/cp_article/ciprian-ciucu-il-nuovo-sindaco-di-bucarest/
,www.balcanicaucaso.org,"Bucharest, Bucuresti, Romania",https://www.balcanicaucaso.org/cp_article/ciprian-ciucu-il-nuovo-sindaco-di-bucarest/
,www.sofokleousin.gr,Greece,https://www.sofokleousin.gr/epikairotita/ellada/ypethoo-diethnis-prosklisi-gia-epilogi-proedrou-stin-elstat
,www.sofokleousin.gr,"Athens, AttikíR, Greece",https://www.sofokleousin.gr/epikairotita/ellada/ypethoo-diethnis-prosklisi-gia-epilogi-proedrou-stin-elstat
,www.zeit.de,"Saxony, Sachsen, Germany",https://www.zeit.de/news/2025-12/10/guenther-schlaegt-beteiligung-sachsens-an-vw-vor
,www.zeit.de,"Lower Saxony, Niedersachsen, Germany",https://www.zeit.de/news/2025-12/10/guenther-schlaegt-beteiligung-sachsens-an-vw-vor
,navabharat.com,"New Delhi, Delhi, India",https://navabharat.com/?p=355616
,navabharat.com,"Delhi, Delhi, India",https://navabharat.com/?p=355616
,www.wesh.com,"Orange County, Florida, United States",https://www.wesh.com/article/orange-county-schools-consider-closures-enrollment-drop/69680325
,www.wesh.com,"Florida, United States",https://www.wesh.com/article/orange-county-schools-consider-closures-enrollment-drop/69680325
,www.cityam.com,United Kingdom,https://www.cityam.com/environment-secretary-i-will-fix-the-water-sector/
,thepoint.gm,"Lagos, Lagos, Nigeria",https://thepoint.gm/africa/gambia/editorial/sea-level-rise-on-africas-coast
,thepoint.gm,"Dar Es Salaam, Dar Es Salaam, Tanzania",https://thepoint.gm/africa/gambia/editorial/sea-level-rise-on-africas-coast
