published_at,source,title,url
,laprensaaustral.cl,Magallánica Pamela Mansilla se lució con las mejores del mundo en prestigioso torneo brasileño,https://laprensaaustral.cl/2025/12/08/magallanica-pamela-mansilla-se-lucio-con-las-mejores-del-mundo-en-prestigioso-torneo-brasileno/
,spidersweb.pl,Seniorzy też czekają na Mikołaja . Oto propozycje prezentów,https://spidersweb.pl/2025/12/prezent-dla-seniora-jaki-wybrac-najlepszy-prezent-dla-starszej-osoby.html
,finance.sina.com.cn,603023 ， 重大资产重组 ！,https://finance.sina.com.cn/stock/marketresearch/2025-12-08/doc-inhacaaw3433726.shtml
,hameensanomat.fi,VM : Valtio kykenee kantamaan riskejä aiempaa huonommin,https://www.hameensanomat.fi/uutissuomalainen/9059626
,oplanetatv.clickgratis.com.br,Record escala Giovanna Abbud como Raquel na superproduo  Ben - Hur,https://oplanetatv.clickgratis.com.br/noticias/bastidores/record-escala-giovanna-abbud-como-raquel-na-superproducao-ben-hur.html
,drapersonline.com,"What leading independents learned in 2025 : The Dressing Room , Morleys , Costume",https://www.drapersonline.com/companies/independents/what-leading-independents-learned-in-2025-the-dressing-room-morleys-costume
,greekherald.com,Learning by Doing : The Experiential Edge at Jio Institute,http://www.greekherald.com/news/278743287/learning-by-doing-the-experiential-edge-at-jio-institute
,baoxaydung.vn,Cuộc chạy đua bên trong nhà ga  trái tim  sân bay Long Thành,https://baoxaydung.vn/cuoc-chay-dua-ben-trong-nha-ga-trai-tim-san-bay-long-thanh-19225120817081753.htm
,mignews.com.ua,Монобанк запускає Monoбазар : як зробити свій онлайн - магазин і продавати товари через новий сервіс,https://mignews.com.ua/ekonomika/shho-take-monobazar-vid-monobank-i-chomu-varto-prodavaty-svoyi-tovary-same-tut.html
,thehindu.com,Survey flags alarming rise of otters in lower Meenachil,https://www.thehindu.com/news/national/kerala/survey-flags-alarming-rise-of-otters-in-lower-meenachil/article70369294.ece
,billboard.com,TWICE Break K - Pop Touring Record in Australia and New Zealand,https://www.billboard.com/business/touring/twice-tour-record-rise-kpop-australia-1236131055/
,vm.ru,Екатерина Драгунова : Каждый из нас в ритме города может делать добрые дела,https://vm.ru/society/1284352-predsedatel-komiteta-obshestvennyh-svyazej-i-molodezhnoj-politiki-moskvy-ekaterina-dragunova-kazhdyj-iz-nas-v-ritme-goroda-mozhet-delat-dobrye-dela
,podcast.canaltech.com.br,"O que muda com a IA no Brasil : cases reais , maturidade e o PL 2338 - Podcasts",https://podcast.canaltech.com.br/podcast/podcast-canaltech/o-que-muda-com-a-ia-no-brasil-cases-reais-maturidade-e-o-pl-2338-6235/
,manilatimes.net,"Navitas , Cyient Semiconductors Enter into a Strategic Partnership to Accelerate GaN Adoption in India  AI , Mobility , Industrial ,  and Energy Markets",https://www.manilatimes.net/2025/12/08/tmt-newswire/globenewswire/navitas-cyient-semiconductors-enter-into-a-strategic-partnership-to-accelerate-ganadoption-in-indiasai-mobility-industrialand-energy-markets/2239019
,cruiseindustrynews.com,SpecTec Cruise Rebrands as Veridian - Cruise Industry News,https://cruiseindustrynews.com/cruise-news/2025/12/spectec-cruise-rebrands-as-veridian/
,odatv.com,Bağımsız Türkiye Partisi ( BTP ) kongresi ... Hüseyi Baş yeniden seçildi,https://www.odatv.com/guncel/bagimsiz-turkiye-partisi-btp-kongresi-huseyi-bas-yeniden-secildi-120126470
,niagarafallsreview.ca,New restaurant on Six Nations is entirely diabetic - friendly,https://www.niagarafallsreview.ca/news/ontario/diabetic-cafe-on-six-nations/article_9007efc6-db6d-54b9-a22e-3b6388f2ab4c.html
,bitacora.com.uy,Más de 200 grupos ecologistas exigen el cese de nuevos centros de datos en EE . UU .,https://bitacora.com.uy/mas-de-200-grupos-ecologistas-exigen-el-cese-de-nuevos-centros-de-datos-en-ee-uu/
,ryt9.com,ทีทีบี ส่งสรุปข้อมูลพฤติกรรมการเงินปี 68 เจาะลึกรายบุคคลผ่าน ttb touch,https://www.ryt9.com/s/prg/12772058
,kamatica.com,Garaže u Beogradu skuplje od pojedinih stanova - Evo gde je najpovoljniji kvadrat,https://www.kamatica.com/vest/garaze-u-beogradu-skuplje-od-pojedinih-stanova-evo-gde-je-najpovoljniji-kvadrat/76728
,finance.yahoo.com,India Tata signs up Intel as first major customer for $14 billion chip foray,https://finance.yahoo.com/news/indias-tata-signs-intel-first-132639361.html
,bignewsnetwork.com,Chinese yuan weakens to 7 . 0764 against USD Monday,http://www.bignewsnetwork.com/news/278744098/chinese-yuan-weakens-to-70764-against-usd-monday
,nationalmortgagenews.com,Inside the brewing battle over regional Fed bank leadership,https://www.nationalmortgagenews.com/news/inside-the-brewing-battle-over-regional-fed-bank-leadership
,malatyaguncel.com,Corendon Airlines iki ödül aldı,https://www.malatyaguncel.com/corendon-airlines-iki-odul-aldi-3013450h.htm
,dagensps.se,3 700 kronor mer i plånboken – flytta billigt till solen,https://www.dagensps.se/privatekonomi/3-700-kronor-mer-i-planboken-flytta-billigt-till-solen/
,zonebourse.com,La BRI met en garde contre les tensions sur lor et valeurs liées à lIA,https://www.zonebourse.com/actualite-bourse/la-bri-met-en-garde-contre-les-tensions-sur-l-or-et-valeurs-liees-a-l-ia-ce7d51ddd18ef625
,dw.com,围绕欧盟的乌克兰  赔偿贷款  方案的呼吁与阻碍 – DW – 2025年12月8日,https://www.dw.com/zh/%E5%9B%B4%E7%BB%95%E6%AC%A7%E7%9B%9F%E7%9A%84%E4%B9%8C%E5%85%8B%E5%85%B0%E8%B5%94%E5%81%BF%E8%B4%B7%E6%AC%BE%E6%96%B9%E6%A1%88%E7%9A%84%E5%91%BC%E5%90%81%E4%B8%8E%E9%98%BB%E7%A2%8D/a-75060878
,abladvisor.com,Jefferies to Acquire 50 % Interest in Hildene Holding Company - News,https://www.abladvisor.com/news/42038/jefferies-to-acquire-50-interest-in-hildene-holding-company
,loksatta.com,"Troubled by Painful , Incomplete Urination ? This Ayurvedic Spinach Juice Formula Could Ease Burning Sensation Without Medicines | लघवीचे त्रास वाढलेत ? जळजळ , टपकणे आणि वेदना दूर करण्यासाठी १० रुपयांची ही भाजी पुरेशी ! आचार्य बालकृष्णांचा उपाय जाणून...",https://www.loksatta.com/lifestyle/frequent-urination-burning-and-dribbling-acharya-balkrishna-shares-a-natural-home-treatment-using-spinach-juice-pdb-95-5559134/
,prabhatkhabar.com,Gur ki Gajak Recipe : घर पर बनाएं बाजार जैसी सॉफ्ट और कुरकुरी गुड़ की गजक,https://www.prabhatkhabar.com/life-and-style/gur-ki-gajak-recipe-soft-and-crispy-homemade
,worldcoal.com,Smithers announces AsiaCoke 2026 details and location,https://www.worldcoal.com/coal/08122025/smithers-announces-asiacoke-2026-details-and-location/
,163.com,布局多金属引重估 ， 这家铜锂龙头较年内低点涨181 %,https://www.163.com/dy/article/KG9LTFS90519L38V.html
,derbund.ch,Netflix Übernahme von Warner Brothers : Trump will mitreden,https://www.derbund.ch/netflix-uebernahme-von-warner-brothers-trump-will-mitreden-709556804108
,163.com,深圳楼市12月迎来  开门红  |新房|购房|深圳市|二手住房|市场热度,https://www.163.com/dy/article/KG9NE1J7053469RG.html
,finance.yahoo.com,Suze Orman : This Medicare Mistake Can Cost You Thousands,https://finance.yahoo.com/news/suze-orman-medicare-mistake-cost-131144602.html
,merkur.de,"Pressestimmen zu Trumps Sicherheitsstrategie : „ Sind keine Verbündeten mehr , sondern Gegner",https://www.merkur.de/politik/pressestimmen-zu-trumps-sicherheitsstrategie-sind-keine-verbuendeten-mehr-sondern-gegner-94073917.html
,ua.korrespondent.net,Китайські продажі авто демонструють найбільший спад за 10 місяців,https://ua.korrespondent.net/business/auto/4838686-kytaiski-prodazhi-avto-demonstruuit-naibilshyi-spad-za-10-misiatsiv
,novinky.cz,Prodej aut v Číně se prudce propadl,https://www.novinky.cz/clanek/auto-prodej-aut-v-cine-se-prudce-propadl-40552409
,oplanetatv.clickgratis.com.br,Globoplay lança  Jogada de Risco  com erotismo e bastidores do futebol,https://oplanetatv.clickgratis.com.br/noticias/bastidores/globoplay-lanca-jogada-de-risco-com-erotismo-e-bastidores-do-futebol.html
,nowjakarta.co.id,Inside Bakerman New Plaza Indonesia Open - Concept Bakery,https://www.nowjakarta.co.id/inside-bakermans-new-plaza-indonesia-open-concept-bakery/
,drapersonline.com,Anthropologie MD :  There are still many more locations where our stores can thrive,https://www.drapersonline.com/insight/comment/anthropologie-md-there-are-still-many-more-locations-where-our-stores-can-thrive
,navabharat.com,"शेयर बाजारों में भारी गिरावट , सेंसेक्स 610 अंक लुढ़का",https://navabharat.com/?p=354117
,haberturk.com,"Yılın son faiz kararı için geri sayım : Fed Aralık faiz kararını ne zaman açıklayacak , bu ay faiz indirimi olur mu ?",https://www.haberturk.com/yilin-son-faiz-karari-icin-geri-sayim-fed-aralik-faiz-kararini-ne-zaman-aciklayacak-bu-ay-faiz-indirimi-olur-mu-3843870
,pravda.ru,"Geely и GAC загнали себя в угол : как китайские автогиганты могут потерять Россию , если не решатся на большой шаг",https://www.pravda.ru/news/auto/2318541-production_localization/
,proactiveinvestors.com,"Leading bank tips AstraZeneca as 2026 standout united kingdom pharma , with GSK left trailing",https://www.proactiveinvestors.com/companies/news/1083960/leading-bank-tips-astrazeneca-as-2026-s-standout-uk-pharma-with-gsk-left-trailing-1083960.html
,ksat.com,The Supreme Court weighs Trump bid to fire independent agency board members,https://www.ksat.com/news/politics/2025/12/08/the-supreme-court-weighs-trumps-bid-to-fire-independent-agency-board-members/
,finance.eastmoney.com,12月8日晚间上市公司利好消息一览 ( 附名单 ) _ 东方财富网,https://finance.eastmoney.com/a/202512083585523677.html
,actualno.com,След протестите и изтеглянето : Правителството одобри новия бюджет за 2026 г .,https://www.actualno.com/finance/sled-protestite-i-iztegljaneto-pravitelstvoto-odobri-novija-budjet-za-2026-g-news_2530013.html
,yakimaherald.com,Health board gets update on unlicensed food vendors in Yakima County,https://www.yakimaherald.com/news/local/health-board-gets-update-on-unlicensed-food-vendors-in-yakima-county/article_6670c467-56ab-4eee-86a9-aedd34b3cb27.html
,focus-news.net,МС одобри проектозакона за Бюджет 2026,https://www.focus-news.net/novini/Bylgaria/MS-odobri-proektozakona-za-Byudzhet-2026-2813747
,lancashiretelegraph.co.uk,Dont buy these popular Christmas present says expert,https://www.lancashiretelegraph.co.uk/news/national/uk-today/25680582.dont-buy-popular-christmas-presents-says-expert/
,slobodna-bosna.ba,OBJAVLJENE NOVE BROJKE : Sada se vidi pravi učinak Trumpovih carina - totalni su promašaj !,https://www.slobodna-bosna.ba/vijest/452197/objavljene_nove_brojke_sada_se_vidi_pravi_uchinak_trumpovih_carina_totalni_su_promasaj.html
,newelectronics.co.uk,Advanced cooling technology for high - power applications,https://www.newelectronics.co.uk/content/news/onsemi-introduces-advanced-cooling-technology-for-high-power-applications
,24kurier.pl,"24Kurier . pl - „ Otyłość , Zdrowie , Zrównoważony Rozwój  - pierwsze w Polsce interdyscyplinarne kompendium wiedzy o otyłości",https://24kurier.pl/rozne/otylosc-zdrowie-zrownowazony-rozwoj-pierwsze-w-polsce-interdyscyplinarne-kompendium-wiedzy-o-otylosci/
,prnewswire.com,Primis Financial Corp . Announces Sale - Leaseback Transaction,http://www.prnewswire.com/news-releases/primis-financial-corp-announces-sale-leaseback-transaction-302634549.html
,suedtirolnews.it,Deutsche Milchbauern : Butterpreis wirtschaftliches Desaster,https://www.suedtirolnews.it/wirtschaft/deutsche-milchbauern-butterpreis-wirtschaftliches-desaster
,baochinhphu.vn,Hiệp hội An ninh mạng quốc gia ra mắt Chi hội phía nam,https://baochinhphu.vn/hiep-hoi-an-ninh-mang-quoc-gia-ra-mat-chi-hoi-phia-nam-102251208183142709.htm
,confirmado.net,La crisis de salud en Ecuador toca fondo con cadáveres entregados en cajas de cartón y un sistema al borde del colapso,https://confirmado.net/la-crisis-de-salud-en-ecuador-toca-fondo-con-cadaveres-entregados-en-cajas-de-carton-y-un-sistema-al-borde-del-colapso/
,hoy.es,Una segunda vida para la capota de almendra,https://www.hoy.es/agro/segunda-vida-capota-almendra-20251208134330-nt.html
,finance.sina.com.cn,8亿周活 、 Token消耗量激增320倍 …… OpenAI最新报告 ： 企业AI已进入  深水区,https://finance.sina.com.cn/stock/hkstock/ggscyd/2025-12-08/doc-inhacacc1632377.shtml
,correiobraziliense.com.br,Mercado reduz projeo de inflao e eleva PIB em 2025,https://www.correiobraziliense.com.br/economia/2025/12/7308992-mercado-reduz-projecao-de-inflacao-e-eleva-pib-em-2025.html
,radio.wpsu.org,"How China , not the U . S ., became the main climate solution story in 2025",https://radio.wpsu.org/2025-12-08/how-china-not-the-u-s-became-the-main-climate-solution-story-in-2025
,tech.wp.pl,Wyjątkowe spotkanie . Miało miejsce u wybrzeży Antarktydy,"https://tech.wp.pl/s/portalstoczniowy-pl/wyjatkowe-spotkanie-mialo-miejsce-u-wybrzezy-antarktydy,7230040634369665a"
,finance.eastmoney.com,适度宽松+跨周期调节的2026 ： 降准降息仍有可能 但频次低幅度小 _ 东方财富网,https://finance.eastmoney.com/a/202512083585443987.html
,bbc.com,"More than 100 people killed in attack on hospital in Sudan , WHO chief says",https://www.bbc.com/news/articles/c23e7kyl9myo
,cjme.com,"Bank of Canada expected to hold key rate , move to sidelines after an uncertain 2025",https://www.cjme.com/2025/12/08/bank-of-canada-expected-to-hold-key-rate-move-to-sidelines-after-an-uncertain-2025/
,tuko.co.ke,Nairobi : Grateful Graduate Returns to Thank Uncle Who Hired Her in Eatery for K Sh 300 Wages,https://www.tuko.co.ke/people/family/612005-nairobi-grateful-graduate-returns-uncle-hired-eatery-ksh-300-wages/
,panamericana.pe,"Vecinos pagan su propia seguridad , pero igual los ...",https://panamericana.pe/buenosdiasperu/locales/460594-vecinos-pagan-propia-seguridad-igual-asaltan-delincuentes-encanonan-pareja-smp
,finance.eastmoney.com,11月出口增速回升超市场预期 ！ 最新解读来了 _ 东方财富网,https://finance.eastmoney.com/a/202512083585442190.html
,gordonua.com,Франція захищає €18 млрд російських активів від  репараційного кредиту  – Financial Times,https://gordonua.com/ukr/news/worldnews/frantsija-zakhishchaje-18-mlrd-rosijskikh-aktiviv-vid-reparatsijnoho-kreditu-financial-times-1766256.html
,parkiet.com,Sytuacja na rynkach 8 grudnia - czekamy na FED,https://www.parkiet.com/waluty/art43468821-sytuacja-na-rynkach-8-grudnia-czekamy-na-fed
,eenadu.net,IndiGo : ప్రణాళిక లేకపోవడమే ఇండిగో సంక్షోభానికి కారణం : మూడీస్‌,https://www.eenadu.net/telugu-news/business/flight-cancellations-credit-negative-says-moodys/0101/125226490
,freiepresse.de,Weihnachtsmarkt in Glauchau : Wieviele Besucher da waren und wie es um die Sicherheit bestellt war,https://www.freiepresse.de/zwickau/glauchau/weihnachtsmarkt-in-glauchau-wieviele-besucher-da-waren-und-wie-es-um-die-sicherheit-bestellt-war-artikel14058887
,winnipegfreepress.com,The Latest : The Supreme Court weighs Trump bid to fire independent agency board members – Winnipeg Free Press,https://www.winnipegfreepress.com/world/2025/12/08/the-latest-the-supreme-court-weighs-trumps-bid-to-fire-independent-agency-board-members
,dagensps.se,AI vid jobbansökningar : Dubbelmoral när rekryterare klagar,https://www.dagensps.se/karriar/ai-vid-jobbansokningar-dubbelmoral-nar-rekryterare-klagar/
,respublika.lt,Lietuva iš EK prašo dar 388 mln . eurų RRF lėšų,https://www.respublika.lt/lt/naujienos/lietuva/lietuvos_politika/lietuva-is-ek-praso-dar-388-mln-euru-rrf-lesu/
,baoxaydung.vn,"Ủng hộ cơ chế đặc thù bồi thường giải phóng mặt bằng , đẩy mạnh xây dựng sân bay Gia Bình",https://baoxaydung.vn/ung-ho-co-che-dac-thu-boi-thuong-giai-phong-mat-bang-day-manh-xay-dung-san-bay-gia-binh-192251208165518364.htm
,firstpost.com,Where is my bag ? How the IndiGo crisis has led to passenger luggage going missing – Firstpost,https://www.firstpost.com/explainers/where-is-my-bag-how-the-indigo-crisis-has-led-to-passenger-luggage-going-missing-13957798.html
,fr.allafrica.com,"Sénégal : El hadj Ibrahima Sall , économiste , ancien ministre sur l  économie sénégalaise - Lheure des choix : Changer de cap avant lorage",https://fr.allafrica.com/stories/202512080414.html
,nra.lv,Ungārija bloķē Eiropas Komisijas rezerves plānu Ukrainas atbalstam,https://nra.lv/pasaule/508609-ungarija-bloke-eiropas-komisijas-rezerves-planu-ukrainas-atbalstam.htm
,novosti.rs,"RADI SE IZ TOPLINE DOMA , A ZARADA JE VRTOGLAVA : Ovaj biznis plane pred Novu godinu",https://www.novosti.rs/ekonomija/vesti/1553471/radi-topline-doma-zarada-vrtoglava-ovaj-biznis-plane-pred-novu-godinu
,cnbc.com,Why the Holiday Season Is A Great Time to Buy A Home,https://www.cnbc.com/select/holiday-homebuying/
,gulfcoastnewsnow.com,Collier County detours begin for bridge beam installation,https://www.gulfcoastnewsnow.com/article/collier-county-detours-bridge-installation/69660318
,tech.wp.pl,Nowe Nintendo Switch – czy konsola odniesie sukces ?,"https://tech.wp.pl/nowe-nintendo-switch-czy-konsola-odniesie-sukces,7230230685700673v"
,vol.at,Seit Jahren abgestelltes Auto auf Hohenemser Supermarktparkplatz wirft Fragen auf - Hohenems,https://www.vol.at/seit-jahren-abgestelltes-auto-auf-hohenemser-supermarktparkplatz-wirft-fragen-auf/9850736
,clickorlando.com,Florida homeowners fight rising lot rents as park owners avoid mediation,https://www.clickorlando.com/news/local/2025/12/08/florida-homeowners-fight-rising-lot-rents-as-park-owners-avoid-mediation/
,autocarindia.com,Harley Davidson CVO Street Glide launched at Rs 63 . 03 lakh - Introduction,https://www.autocarindia.com:443/bike-news/harley-davidson-cvo-street-glide-launched-at-rs-6303-lakh-438583
,prokerala.com,"Haryana Cabinet sets age limits for tourist vehicles , clears unified Municipal Bill for 2025",https://www.prokerala.com/news/articles/a1705378.html
,stockbiz.vn,Các đối thủ Trung Quốc tận dụng  khoảng trống  AI của Apple để giành thị phần,https://stockbiz.vn/tin-tuc/cac-doi-thu-trung-quoc-tan-dung-khoang-trong-ai-cua-apple-de-gianh-thi-phan/37135136
,nayaindia.com,"सीएम नीतीश बक्सर पहुंचे - Naya India - Hindi News , Latest Hindi News , Breaking News , Hindi Samachar",https://www.nayaindia.com/india/bihar/cm-nitish-reached-buxar/508544.html
,ksat.com,Trump says Netflix deal to buy Warner Bros .  could be a problem  because of size of market share,https://www.ksat.com/business/2025/12/08/trump-says-netflix-deal-to-buy-warner-bros-could-be-a-problem-because-of-size-of-market-share/
,la1ere.franceinfo.fr,Un début de haute saison prometteur pour laéroport Martinique Aimé Césaire,https://la1ere.franceinfo.fr/martinique/un-debut-de-haute-saison-prometteur-pour-l-aeroport-martinique-aime-cesaire-1650683.html
,manilatimes.net,Syntec ( Nasdaq : OPTX ) Receives a New $1 . 9 Million Space Optics Order for Delivery in Next 3 Months ; Building upon $2 . 6 Million Shipments in 2025,https://www.manilatimes.net/2025/12/08/tmt-newswire/globenewswire/syntec-nasdaq-optx-receives-a-new-19-million-space-optics-order-for-delivery-in-next-3-months-building-upon-26-million-shipments-in-2025/2239002
,inewsgr.com,"« Υγεία πάνω απ  όλα 2025 »: Το νέο παγκόσμιο υγειονομικό τοπίο – Καινοτομία , ελλείψεις και το στοίχημα του Εθνικού Συστήματος Υγείας - « ygeia pano ap  ola 2025 »: to neo pagkosmio ygeionomiko topio – kainotomia , elleipseis kai to stoichima tou e...",https://www.inewsgr.com/182/ygeia-pano-ap-ola-2025-to-neo-pagkosmio-ygeionomiko-topio--kainotomia-elleipseis-kai-to-stoichima-tou-ethnikou-systimatos-ygeias.htm
,24matins.fr,La crise silencieuse qui va faire exploser le prix de vos PC,https://www.24matins.fr/la-crise-silencieuse-qui-va-faire-exploser-le-prix-de-vos-pc-1399623
,panampost.com,Niños convertidos en sicarios : así reclutan a menores en Europa para encargos violentos,https://panampost.com/efe-panampost/2025/12/08/ninos-convertidos-en-sicarios-asi-reclutan-a-menores-en-europa-para-encargos-violentos/
,thedickinsonpress.com,"North Dakota - based candy company Get Coffeed has closed - InForum | Fargo , Moorhead and West Fargo news , weather and sports",https://www.thedickinsonpress.com/business/north-dakota-based-candy-company-get-coffeed-has-closed
,prnewswire.com,"Agiloft Launches Enterprise - Grade Obligation Management , Pioneering the AI - Native Era of Contract Lifecycle Management",https://www.prnewswire.com/news-releases/agiloft-launches-enterprise-grade-obligation-management-pioneering-the-ai-native-era-of-contract-lifecycle-management-302635020.html
,autocarindia.com,New Kia Seltos interior uncovered ahead of official reveal - Introduction,https://www.autocarindia.com:443/car-news/new-kia-seltos-interior-uncovered-ahead-of-official-reveal-438587
,ekonomi.haber7.com,Türkiye ve Macaristan arasında imzalar atıldı ! Bakan Bolat duyurdu,https://ekonomi.haber7.com/ekonomi/haber/3586206-turkiye-ve-macaristan-arasinda-imzalar-atildi-bakan-bolat-duyurdu
,hindi.webdunia.com,"stock market : शेयर बाजार में हाहाकार , सेंसेक्स 610 अंक लुढ़का , निफ्टी 26000 के नीचे आया , क्यों आ रही है बाजार में गिरावट",https://hindi.webdunia.com/share-market-news/8th-december-2025-share-market-news-bse-sensex-and-nse-nifty-update-125120800058_1.html
,siliconrepublic.com,"Plan , plan , plan  and other tips for avoiding chaos amid transformation",https://www.siliconrepublic.com/careers/plan-tips-avoiding-chaos-amid-transformation-jobs-skills-working-life
,deshbandhu.co.in,"केरल स्थानीय निकाय चुनाव : 9 दिसंबर को सात जिलों में मतदान , राजनीतिक दलों के लिए  अग्निपरीक्षा  | Kerala local body elections : Voting in the first phase will be held on December 9 in seven districts , a crucial test for political parties",https://www.deshbandhu.co.in/kerla/kerala-local-body-elections-voting-in-the-first-phase-will-be-held-on-december-9-in-seven-districts-a-crucial-test-for-political-parties-278593
,namibian.com.na,Standard Bank trains 40 MSMEs on entrepreneurship,https://www.namibian.com.na/standard-bank-trains-40-msmes-on-entrepreneurship/
,thenews.coop,CBH Group sells 50 % Interflour stake for $169m,https://www.thenews.coop/cbh-group-sells-50-interflour-stake-for-169m/
,investmentnews.com,Netflix down 3 % after Warner Bros . announcement as some investors decide to chill,https://www.investmentnews.com/equities/netflix-down-3-as-some-investors-decide-to-chill-for-now/263433
,haberler.com,Başkan Dumandağ :  Ticaret Borsası olarak üreticimizin sesini en doğru şekilde duyurmaya devam edeceğiz,https://www.haberler.com/ekonomi/elazig-ticaret-borsasi-baskani-dumandag-ureticimizin-sesini-duyurmaya-devam-edecegiz-19336056-haberi/
,dailydispatch.co.za,The ANC a party at odds with itself,https://www.dailydispatch.co.za/news/opinion/2025-12-08-the-anc-a-party-at-odds-with-itself/
,mix1069.com,Trump says hell be involved in review of Netflix - Warner Brothers deal,https://www.mix1069.com/2025/12/07/trump-says-hell-be-involved-in-review-of-netflix-warner-brothers-deal/
,finanznachrichten.de,Refined Energy Corp . erhält formellen Vorschlag für Bohrprogramm bei Projekt Dufferin,https://www.finanznachrichten.de/nachrichten-2025-12/67173548-refined-energy-corp-erhaelt-formellen-vorschlag-fuer-bohrprogramm-bei-projekt-dufferin-248.htm
,bursahakimiyet.com.tr,Metal sektöründe uyuşmazlık ; sendika masayı terk etti - Namık GÖZ,https://www.bursahakimiyet.com.tr/yazarlar/namik-goz-76/metal-sektorunde-uyusmazlik-sendika-masayi-terk-etti-29561
,manilatimes.net,SS Innovations Submits 510 ( k ) Premarket Notification to the FDA for the Company SSi Mantra Surgical Robotic System,https://www.manilatimes.net/2025/12/08/tmt-newswire/globenewswire/ss-innovations-submits-510k-premarket-notification-to-the-fda-for-the-companys-ssi-mantra-surgical-robotic-system/2239022
,theaccountant-online.com,Hong Kong survey highlights steady growth outlook,https://www.theaccountant-online.com/news/hong-kong-business-growth-2026/
,pembinavalleyonline.com,"Bank of Canada expected to hold key rate , move to sidelines after an uncertain 2025 - PembinaValleyOnline . com - Local news , Weather , Sports , Free Classifieds and Business Listings for the Pembina Valley , Manitoba",https://pembinavalleyonline.com/articles/bank-of-canada-expected-to-hold-key-rate-move-to-sidelines-after-an-uncertain-2025
,klcc.org,"SCOTUS case could expand presidential powers . And , Dems pitch plan for ACA subsidies",https://www.klcc.org/npr-news/2025-12-08/scotus-case-could-expand-presidential-powers-and-dems-pitch-plan-for-aca-subsidies
