published_at,source,title,url
,manilatimes.net,Adeia Initiates Patent Infringement Litigation Against AMD,https://www.manilatimes.net/2025/11/03/tmt-newswire/globenewswire/adeia-initiates-patent-infringement-litigation-against-amd/2214403
,kommersant.ru,Как бизнес относится к идее компенсации за неотгулянный отпуск,https://www.kommersant.ru/doc/8179417
,inside-digital.de,Nothing Ear ( 3 ) Datenblatt | alle technischen Daten,https://www.inside-digital.de/in-ear-kopfhoerer/nothing-ear-3
,cna.com.tw,世界12強棒球冠軍紀念銀幣 11 / 12起開放領取 | 產經,https://www.cna.com.tw:443/news/afe/202511030287.aspx
,kurier.at,Caritas und Volkshilfe fordern Ausbildungspflicht für Geflüchtete,https://kurier.at/politik/inland/caritas-und-volkshilfe-fordern-ausbildungspflicht-fuer-gefluechtete/403099445
,irishtimes.com,Michael OLeary attacks DAA over departure of CEO Kenny Jacobs – The Irish Times,https://www.irishtimes.com/business/work/2025/11/03/ryanair-boss-attacks-daa-over-departure-of-ceo-kenny-jacobs/
,zdnet.co.kr,"AI 자동화 공포 , 과장됐다 … 실제 업무 중 2 . 5 % 만 해결",https://zdnet.co.kr/view/?no=20251103214446
,praca.egospodarka.pl,Warszawa => International Freight Forwarder <= - Grupy dyskusyjne w eGospodarka . pl,"https://www.praca.egospodarka.pl/grupy/Warszawa-International-Freight-Forwarder,t,642756,8.html"
,ennaharonline.com,360 ألف سكن مبرمج في قانون المالية 2026 – النهار أونلاين,https://www.ennaharonline.com/360-%D8%A3%D9%84%D9%81-%D8%B3%D9%83%D9%86-%D9%85%D8%A8%D8%B1%D9%85%D8%AC-%D9%81%D9%8A-%D9%82%D8%A7%D9%86%D9%88%D9%86-%D8%A7%D9%84%D9%85%D8%A7%D9%84%D9%8A%D8%A9-2026/
,pb.pl,Złoty może kontynuować osłabienie wobec euro,https://www.pb.pl/zloty-moze-kontynuowac-oslabienie-wobec-euro-1251525
,en.vietnamplus.vn,Autumn Fair 2025 : new gathering point of global enterprises,https://en.vietnamplus.vn/autumn-fair-2025-new-rendezvous-of-global-enterprises-post331819.vnp
,southwalesguardian.co.uk,Ukraine gets more Patriot air defence systems to counter deadly Russian attacks,https://www.southwalesguardian.co.uk/news/national/25591558.ukraine-gets-patriot-air-defence-systems-counter-deadly-russian-attacks/
,manilatimes.net,Atlantica Announces Private Offering of Additional $285 Million of 6 . 375 % Green Senior Notes due 2032,https://www.manilatimes.net/2025/11/03/tmt-newswire/globenewswire/atlantica-announces-private-offering-of-additional-285-million-of-6375-green-senior-notes-due-2032/2214401
,cafebiz.vn,"Hệ thống quán Trung Nguyên Legend liên tục phát triển , khẳng định vị thế hàng đầu",https://cafebiz.vn/he-thong-quan-trung-nguyen-legend-lien-tuc-phat-trien-khang-dinh-vi-the-hang-dau-176251103173110594.chn
,maz-online.de,Polizeiticker Havelland : Aktuelle Blaulicht - Meldungen vom 03 . 11 . 2025,https://www.maz-online.de/lokales/havelland/polizeiticker-havelland-aktuelle-blaulicht-meldungen-vom-03-11-2025-2DLPT42GH5FIJPNUTURKIV4ULU.html
,klcc.org,"Judge says Trump administration must fund SNAP . And , what to know about NYC election",https://www.klcc.org/npr-politics/2025-11-03/judge-says-trump-administration-must-fund-snap-and-what-to-know-about-nycs-election
,mynbc5.com,Kimberly - Clark to buy Tylenol parent Kenvue in $48 . 7 billion deal,https://www.mynbc5.com/article/kimberly-clark-tylenol-kenvue-merger/69234697
,channelstv.com,Spain Top Prosecutor Ortiz Goes On Unprecedented Trial,https://www.channelstv.com/2025/11/03/spains-top-prosecutor-ortiz-goes-on-unprecedented-trial/
,portal.sina.com.hk,The Ensign Group Adds Operation in Alabama,https://portal.sina.com.hk/finance/finance-globenewswire/globenewswire/2025/11/03/1366178/the-ensign-group-adds-operation-in-alabama/
,merkur.de,Geschenk aus Scheuring : Der Landsberger Christbaum steht,https://www.merkur.de/lokales/landsberg-kreisbote/geschenk-aus-scheuring-der-landsberger-christbaum-steht-94019013.html
,dailypolitical.com,Short Interest in Vanguard Energy ETF ( NYSEARCA : VDE ) Drops By 42 . 5 %,https://www.dailypolitical.com/2025/11/03/short-interest-in-vanguard-energy-etf-nysearcavde-drops-by-42-5.html
,dostor.org,معرفة مخالفات المرور 2025 باستخدام الرقم القومي فقط بخطوات سهلة,https://www.dostor.org/5291785
,medyaloji.net,FLORMAR ÜST DÜZEY İKİ YENİ ATAMA İLE YÖNETİM KADROSUNU GLENDİRİYOR,https://www.medyaloji.net/son-haber/flormar-ust-duzey-iki-yeni-atama-ile-yonetim-kadrosunu-guclendiriyor_23684021.html
,tickerreport.com,Robert W . Baird Issues Positive Forecast for MasTec ( NYSE : MTZ ) Stock Price,https://www.tickerreport.com/banking-finance/13225835/robert-w-baird-issues-positive-forecast-for-mastec-nysemtz-stock-price.html
,tickerreport.com,"Jabil , Inc . $JBL Shares Bought by Corton Capital Inc .",https://www.tickerreport.com/banking-finance/13225834/jabil-inc-jbl-shares-bought-by-corton-capital-inc.html
,alagoas24horas.com.br,Lyon lidera corrida por Endrick junto ao Real Madrid,https://www.alagoas24horas.com.br/1701858/lyon-lidera-corrida-por-endrick-junto-ao-real-madrid/
,forbes.com,Forbes Daily : Food Stamp Benefits In Limbo For 42 Million Americans,https://www.forbes.com/sites/daniellechemtob/2025/11/03/forbes-daily-food-stamp-benefits-in-limbo-for-42-million-americans/
,radioiasi.ro,"# StareaEducației : ( INTERVIU ) Prof . Mircea Bertea , președinte ANCLP :  Plata practicii pedagogice pentru profesorii care îndrumă viitorii învățători și educatori este o bătaie de joc . / Prof . Adriana Robu , director adjunct Colegiul Pedagogic...",https://www.radioiasi.ro/emisiuni/stareaeducatiei-interviu-prof-mircea-bertea-presedinte-anclp-plata-practicii-pedagogice-pentru-profesorii-care-indruma-viitorii-invatatori-si-educatori-este-o-bataie-de-joc/
,investireoggi.it,"Obbligazione convertibile Campari e sequestro 1 , 3 miliardi di euro",https://www.investireoggi.it/obbligazione-convertibile-campari-sequestro-13-miliardi-euro/
,mikrometoxos.gr,Metlen : Νέα αγορά μετοχών από εταιρεία συνδεδεμένη με τον Ευάγγελο Μυτιληναίο,https://www.mikrometoxos.gr/metlen-nea-agora-metochon-apo-etaireia-syndedemeni-me-ton-evangelo-mytilinaio/
,zonebourse.com,PostNL confirme ses prévisions annuelles malgré un 3ème trimestre décevant,https://www.zonebourse.com/actualite-bourse/postnl-confirme-ses-previsions-annuelles-malgre-un-3eme-trimestre-decevant-ce7d5cd9dc8cf123
,yakimaherald.com,Yakima Basin water leaders emphasize cooperation amid unprecedented shutoff,https://www.yakimaherald.com/news/local/business/yakima-basin-water-leaders-emphasize-cooperation-amid-unprecedented-shutoff/article_e1d1dcbe-c30c-485f-a2cd-613e65fd95cf.html
,vz.lt,Pradedama platinti 14 - oji gynybos obligacijų emisija,https://www.vz.lt/rinkos/2025/11/03/pradedama-platinti-14-oji-gynybos-obligaciju-emisija-575227
,insidermonkey.com,"Is Amazon . com Inc . ( AMZN ) One of the Best Stocks to Invest in , According to Billionaire D . E . Shaw",https://www.insidermonkey.com/blog/is-amazon-com-inc-amzn-one-of-the-best-stocks-to-invest-in-according-to-billionaire-d-e-shaw-1639158/
,zazoom.it,Il Vallo di Diano grande protagonista alla Borsa del Turismo Archelogico a Paestum,https://www.zazoom.it/2025-11-03/il-vallo-di-diano-grande-protagonista-alla-borsa-del-turismo-archelogico-a-paestum-tante-visite-allo-stand/18062667/
,autorevue.cz,Toyota představila modulární nákladní auto . Zákazník si ho bude muset dodělat,https://www.autorevue.cz/toyota-predstavila-modularni-nakladni-auto-zakaznik-si-ho-bude-muset-dodelat
,connect.de,"XGIMI Horizon 20 Max im Test : Der beste Beamer , den Gamer aktuell kaufen können",https://www.connect.de/testbericht/xgimi-horizon-20-max-test-review-4k-beamer-vrr-input-lag-maximale-helligkeit-3211021.html
,zazoom.it,A23 Udine - Tarvisio autostrada chiusa per lavori nelle gallerie,https://www.zazoom.it/2025-11-03/a23-udine-tarvisio-autostrada-chiusa-per-lavori-nelle-gallerie/18062672/
,clickorlando.com,"Here is every new Florida law passed this year , explained",https://www.clickorlando.com/news/florida/2025/11/03/here-is-every-new-florida-law-passed-this-year-explained/
,pda.kp.ru,В Петербурге назвали профессии с зарплатой до 400 тысяч рублей,https://pda.kp.ru/online/news/6652387/
,echopress.com,"With little change in market fundamentals , cattle industry questions big drop on the futures boards",https://www.echopress.com/business/with-little-change-in-market-fundamentals-cattle-industry-questions-big-drop-on-the-futures-boards
,el-balad.com,Fed Reduces Rates ; Expert Warns Against Timing Mortgage Moves,https://www.el-balad.com/6754242
,digitimes.com,Humanoid robots and AI drive smart factory transformation in auto industry,https://www.digitimes.com/news/a20251103PD224/market-vehicle-growth-auto-industry-automakers.html
,pottsmerc.com,Berks County restaurant and food safety inspections found,https://www.pottsmerc.com/2025/11/03/berks-food-safety-inspections-found-ice-machines-with-residue-cold-water-in-bathroom-sink/
,diariosigloxxi.com,"Economistas , expertos y líderes políticos alertan de que la desigualdad aumenta el riesgo y el coste de pandemias",https://www.diariosigloxxi.com/texto-ep/mostrar/20251103133343/economistas-expertos-lideres-politicos-alertan-desigualdad-aumenta-riesgo-coste-pandemias
,puntobiz.com.ar,Verano 2026 : lanzan promo para volar con 10 % de descuento y en 12 cuotas,https://puntobiz.com.ar/negocios/verano-2026-lanzan-promo-para-volar-con-10-de-descuento-y-en-12-cuotas-202511310120
,insidermonkey.com,Merck & Co . Inc . ( MRK ) Reports Solid Q3 with Strong Drug Sales and Pipeline Progress,https://www.insidermonkey.com/blog/merck-co-inc-mrk-reports-solid-q3-with-strong-drug-sales-and-pipeline-progress-1639155/
,hellenicshippingnews.com,Singapore MPA signals determination to press on with maritime decarbonization,https://www.hellenicshippingnews.com/singapores-mpa-signals-determination-to-press-on-with-maritime-decarbonization/
,hellenicshippingnews.com,Challenges and Opportunities in the Revitalization of US Shipbuilding in Focus at the ABS North America Regional Committee Meeting,https://www.hellenicshippingnews.com/challenges-and-opportunities-in-the-revitalization-of-us-shipbuilding-in-focus-at-the-abs-north-america-regional-committee-meeting/
,auto.24tv.ua,Scout Motors : 80 % покупців обрали гібридний варіант EREV замість електричного,https://auto.24tv.ua/scout_motors_ponad_80_pokuptsiv_obraly_neochikuvanyi_sylovyi_ahrehat_n67295
,ilfattonisseno.it,"Controlli interforze a Centuripe , violazioni e sanzioni",https://www.ilfattonisseno.it/2025/11/controlli-interforze-a-centuripe-violazioni-e-sanzioni/
,wbjournal.com,Running out of retail : Second - generation restaurant spaces are driving demand in Central Mass . retail real estate,https://wbjournal.com/article/running-out-of-retail-second-generation-restaurant-spaces-are-driving-demand-in-central-mass-retail-real-estate/
,news.yam.md,Guvernatoarea Anca Dragu subliniază rolul BNM în dezvoltarea economică a Republicii Moldova la „ Bucharest Leader Summit,https://news.yam.md/ro/story/18059002
,hna.de,Ende einer Ära : Warum Atomkraft in Deutschland zum toten Diskurs wurde,http://www.hna.de/welt/ende-einer-aera-warum-atomkraft-in-deutschland-zum-toten-diskurs-wurde-zr-94013700.html
,ekonomi.haber7.com,Rekabet Kurumu Başkanı Küle : Ferreronun taahhütlerini yerine getirmesi zorunluluk !,https://ekonomi.haber7.com/ekonomi/haber/3576704-rekabet-kurumu-baskani-kule-ferreronun-taahhutlerini-yerine-getirmesi-zorunluluk
,senzacolonnenews.it,"Brindisi , violenza contro i sanitari : firmato protocollo tra Prefettura e ASL - Senza Colonne News",https://www.senzacolonnenews.it/citta/item/brindisi-violenza-contro-i-sanitari-firmato-protocollo-tra-prefettura-e-asl.html
,wgospodarce.pl,Dwa testy dla złotego w tym tygodniu,https://wgospodarce.pl/informacje/153198-dwa-testy-dla-zlotego-w-tym-tygodniu
,jn.pt,"Do bacalhau ao azeite , eventos gastronómicos para os próximos dias",https://www.jn.pt/evasoes/artigo/do-bacalhau-ao-azeite-eventos-gastronomicos-para-os-proximos-dias/18015669
,haberler.com,CHPli Yıldız : Turizmdeki Gelir Artışı  Kağıt Üzerinde  Kalıyor,http://www.haberler.com/guncel/chp-li-yildiz-turizmdeki-gelir-artisi-kagit-uzerinde-kaliyor-19214678-haberi/
,insidermonkey.com,Apollo Global Management ( APO ) Eyeing $1 . 5B on Heritage Grocers Group Divestment,https://www.insidermonkey.com/blog/apollo-global-management-apo-eyeing-1-5b-on-heritage-grocers-group-divestment-1639112/
,modena2000.it,"Rave party a Campogalliano , le parole di Braglia",https://www.modena2000.it/2025/11/03/rave-party-a-campogalliano-le-parole-di-braglia/
,tz.de,Palast bestätigt : Kronprinzessin Mette - Marits Sohn lebt jetzt in Italien,http://www.tz.de/stars/marits-sohn-lebt-jetzt-in-italien-palast-bestaetigt-kronprinzessin-mette-zr-93988815.html
,londonmercury.com,Market Logic Software and Euromonitor International Announce New Data Integration : DeepSights ( TM ) to Enhance AI - Driven Insights for Customers,http://www.londonmercury.com/news/278671347/market-logic-software-and-euromonitor-international-announce-new-data-integration-deepsightstm-to-enhance-ai-driven-insights-for-customers
,biztoc.com,Russia economy slows as sanctions bite,https://biztoc.com/x/55bcc5464177b0a4
,brf.be,Arbeitsmarkt in Ostbelgien leidet weiter unter Fachkräftemangel - Arbeitslosenzahlen bleiben stabil,https://brf.be/regional/2021364/
,thisismoney.co.uk,M & C Saatchi rejects £50m offer for Performance unit from Murdoch - backed marketing rival,https://www.thisismoney.co.uk/money/markets/article-15252395/M-C-Saatchi-rejects-50m-offer-Performance-unit-Murdoch-backed-marketing-rival.html
,zazoom.it,Eni accordo con Petronas sul gas,https://www.zazoom.it/2025-11-03/eni-accordo-con-petronas-sul-gas/18062674/
,wgospodarce.pl,Polkomtel z zarzutami od UOKiK,https://wgospodarce.pl/informacje/153199-polkomtel-z-zarzutami-od-uokik
,observatorulph.ro,Ministerul Sănătății aa nunțat stocurile de vaccinuri gratuite,https://www.observatorulph.ro/sanatate/2769595-ministerul-sanatatii-aa-nuntat-stocurile-de-vaccinuri-gratuite
,dailystar.co.uk,Emmerdale Ryan actor inundated with support after emotional marriage announcement,https://www.dailystar.co.uk/tv/emmerdale-ryan-actor-inundated-support-36181119
,andhrajyothy.com,Rain In Chityala : అకాల వర్షంతో తడిసిన ధాన్యం .. రైతులు విలవిల ..,https://www.andhrajyothy.com/2025/photogallery/telangana/rain-in-chityala-village-market-yard-soaks-maize-crops-bvr-4172.html
,antaranews.com,Ketua Dewan Komisioner OJK : Kinerja bank Himbara dalam kondisi baik,https://www.antaranews.com/berita/5217293/ketua-dewan-komisioner-ojk-kinerja-bank-himbara-dalam-kondisi-baik
,enfieldindependent.co.uk,"UK university halted forced labour research after China pressure , lawyers claim",https://www.enfieldindependent.co.uk/news/national/25591826.uk-university-halted-forced-labour-research-china-pressure-lawyers-claim/
,thepeterboroughexaminer.com,Liberals restored some faith in fixing immigration : Poll,https://www.thepeterboroughexaminer.com/news/canada/majority-of-canadians-say-immigration-level-still-too-high-but-confidence-growing-in-carney-fixing/article_25446ba3-9120-5905-b7e3-7a6362b343ae.html
,jornalpequeno.com.br,"Mercado de carros elétricos avança e já representa 9 , 4 % das vendas nacionais",https://jornalpequeno.com.br/2025/11/03/mercado-de-carros-eletricos-avanca-e-ja-representa-94-das-vendas-nacionais/
,i38.ru,HeadHunter : работодатели стали прощать кандидатам отсутствие диплома и опыта,https://i38.ru/obichnie-ekonomika/headhunter-rabotodateli-stali-proschat-kandidatam-otsutstvie-diploma-i-opita
,baochinhphu.vn,"Nền tảng để Nhà nước điều hành giá cả linh hoạt , minh bạch",https://baochinhphu.vn/nen-tang-de-nha-nuoc-dieu-hanh-gia-ca-linh-hoat-minh-bach-102251103181055598.htm
,m.kauno.diena.lt,"Lietuvos banko vadovas : labai norėtųsi , kad tai nebūtų pravalgoma",https://m.kauno.diena.lt/naujienos/verslas/ekonomika/lietuvos-banko-vadovas-labai-noretusi-kad-tai-nebutu-pravalgoma-1727109
,baochinhphu.vn,MISA đồng hành 60 ngày đêm cao điểm hỗ trợ hộ kinh doanh chuyển đổi bỏ thuế khoán,https://baochinhphu.vn/misa-dong-hanh-60-ngay-dem-cao-diem-ho-tro-ho-kinh-doanh-chuyen-doi-bo-thue-khoan-102251103194102372.htm
,noticiasdelacalle.com.ar,Financial Times asegura que Trump impulsa la dolarización global y ve a Argentina como  candidato principal,https://www.noticiasdelacalle.com.ar/noticias/2025/11/03/147788-financial-times-asegura-que-trump-impulsa-la-dolarizacion-global-y-ve-a-argentina-como-candidato-principal
,anf-news.com,"ANF | Gire Spî  de halk , okul yöneticisine yönelik saldırıyı protesto etti",https://anf-news.com/rojava-surIye/gire-spi-de-halk-okul-yoneticisine-yonelik-saldiriyi-protesto-etti-218977
,wbjournal.com,"Money on the sidelines : Real estate is having a rough year , but premium properties are still catching the attention of investors",https://wbjournal.com/article/money-on-the-sidelines-real-estate-is-having-a-rough-year-but-premium-properties-are-still-catching-the-attention-of-investors/
,riasv.ru,"Трамп заявив , що Nvidia не постачатиме топові ШІ - чіпи до інших країн",https://riasv.ru/ekonomika/2025/11/03/tramp-zaiaviv-sho-nvidia-ne-postachatime-topovi-shi-chipi-do-inshih-krain/
,vz.lt,Pagrindinės OPEC+ narės nuo gruodžio dar padidins naftos gavybą,https://www.vz.lt/rinkos/2025/11/03/pagrindines-opec-nares-nuo-gruodzio-dar-padidins-naftos-gavyba-575222
,tecnoandroid.it,Esselunga : iPhone e buonumore con un carrello extra pieno,https://www.tecnoandroid.it/2025/11/03/esselunga-iphone-e-buonumore-con-un-carrello-extra-pieno-1652606/
,news.finance.ua,Пишний анонсував запуск інноваційного хабу для фінансового сектору Finance . ua,https://news.finance.ua/ua/pyshnyy-anonsuvav-zapusk-innovaciynoho-habu-dlya-finansovoho-sektoru
,finance.yahoo.com,Who gets paid and who pays ? The FCA car finance crackdown,https://finance.yahoo.com/news/gets-paid-pays-fca-car-132208028.html
,syri.net,Blerja e votave - 6 ditë para zgjedhjeve në disa - Syri,https://www.syri.net/politike/835065/blerja-e-votave-6-dite-para-zgjedhjeve-ne-disa-bashki-rama-prezanton-bonusin-e-fundvitit-per-pensionistet/
,news.yam.md,"( stop cadru ) Gonța : „ Doamna Sandu , așa arată 100 mii lei , dar nu vă uitați la ei . I - am împrumutat pentru o oră . Eventual , pentru dvs . voi lua de la Gușan",https://news.yam.md/ro/story/18058924
,insidermonkey.com,Here Why Alamos Gold ( AGI ) Surged in Q3,https://www.insidermonkey.com/blog/heres-why-alamos-gold-agi-surged-in-q3-1639122/
,labelsandlabeling.com,Epson opens India demo center | Labels & Labeling,http://www.labelsandlabeling.com/features/digital-printing/epson-opens-india-demo-center
,insidermonkey.com,Should You Invest in Pinnacle West Capital ( PNW )?,https://www.insidermonkey.com/blog/should-you-invest-in-pinnacle-west-capital-pnw-1639156/
,kiev.vgorode.ua,Курс валют в Україні 3 листопада 2025 року : скільки коштує долар та євро,https://kiev.vgorode.ua/ukr/news/sobytyia/a1283584-kurs-valjut-v-ukrajini-3-listopada-2025-roku-skilki-koshtuje-dolar-ta-jevro
,adnkronos.com,"Nautica , industria italiana diporto protagonista a Fort Lauderdale International Boat Show",https://www.adnkronos.com/economia/nautica-industria-italiana-diporto-protagonista-a-fort-lauderdale-international-boat-show_7CI8JgWvSOZd5FohzJoq0x
,memleket.com.tr,Marmarabirlikten Sofralık Zeytine 160 TL Tavan Fiyat,https://www.memleket.com.tr/marmarabirlikten-sofralik-zeytine-160-tl-tavan-fiyat-2348839h.htm
,puntobiz.com.ar,Milei encabezó una reunión de trabajo con el nuevo Gabinete,https://puntobiz.com.ar/politica/milei-encabezo-una-reunion-de-trabajo-con-el-nuevo-gabinete-202511310190
,thisismoney.co.uk,Please dont hit us again : Cinema chain boss pleads with Chancellor ahead of Budget tax blizzard,https://www.thisismoney.co.uk/money/markets/article-15252733/Please-dont-hit-Cinema-chain-boss-pleads-Chancellor-ahead-Budget-tax-blizzard.html
,coventryobserver.co.uk,Enhanced Digital Entertainment Platform Revolutionises Online Gaming Experience for united kingdom Players Seeking Premium Options,https://coventryobserver.co.uk/lifestyle/enhanced-digital-entertainment-platform-revolutionises-online-gaming-experience-for-uk-players-seeking-premium-options/
,bin.ua,BMW першою в Німеччині отримала міжнародне схвалення на систему водіння « без рук »,https://bin.ua/news/interesting/auto/343392-bmw-pershoyu-v-nimechchini-otrimala-mizhnarodne.html
,webtretho.com,KHỞI NGHIỆP VỚI NGÀNH PHỤ KIỆN DA - HƯỚNG ĐI ỔN ĐỊNH & DỄ BẮT ĐẦU,https://www.webtretho.com/f/bi-quyet-khoi-nghiep-thanh-cong/khoi-nghiep-voi-nganh-phu-kien-da-huong-di-on-dinh-amp-de-bat-dau
,semana.com,La hora de la verdad,https://www.semana.com/opinion/articulo/la-hora-de-la-verdad/202500/
,lanacion.com.ar,Cuándo se cobra la jubilación en noviembre 2025,https://www.lanacion.com.ar/economia/cuando-se-cobra-la-jubilacion-en-noviembre-2025-nid03112025/
,riasv.ru,СБУ задержала 18 - летнего информатора РФ : помогал отслеживать перемещение эшелонов ВСУ в двух областях,https://riasv.ru/politics/2025/11/03/sby-zaderjala-18-letnego-informatora-rf-pomogal-otslejivat-peremeshenie-eshelonov-vsy-v-dvyh-oblastiah/
,insidermonkey.com,LP Building Solutions ( LPX ) Declares Quarterly Dividend Amid Steady Global Operations,https://www.insidermonkey.com/blog/lp-building-solutions-lpx-declares-quarterly-dividend-amid-steady-global-operations-1639110/
,diariosigloxxi.com,Tecnología invisible : el nuevo mapa del capital inteligente,https://www.diariosigloxxi.com/texto-diario/mostrar/5568080/tecnologia-invisible-nuevo-mapa-capital-inteligente
,zazoom.it,Ununica autorità di vigilanza e una Borsa europea | la Ue studia la nuova strategia finanziaria,https://www.zazoom.it/2025-11-03/ununica-autorita-di-vigilanza-e-una-borsa-europea-la-ue-studia-la-nuova-strategia-finanziaria/18062964/
,topontiki.gr,Η προπώληση για τις παραγωγές Ιανουαρίου – Μαρτίου 2026 της Εθνικής Λυρικής Σκηνής ξεκινάει στις 5 Νοεμβρίου 2025,https://www.topontiki.gr/2025/11/03/i-advertorial-propolisi-gia-tis-paragoges-ianouariou-martiou-2026-tis-ethnikis-lirikis-skinis-xekinai-stis-5-noemvriou-2025/
,agenciabrasil.ebc.com.br,"Mercado financeiro reduz previsão da inflao para 4 , 55 % no Brasil",https://agenciabrasil.ebc.com.br/economia/noticia/2025-11/mercado-financeiro-reduz-previsao-da-inflacao-para-455-no-brasil
,infranken.de,Weihnachtsmarkt in Bamberg 2025 : Veränderungen für Besucher,https://www.infranken.de/lk/bamberg/ausflug/weihnachtsmarkt-bamberg-2025-mit-veraenderungen-was-besucher-wissen-muessen-art-6282041
,gentedigital.es,El PP critica que los socialistas anteponen  el seguidismo a Sánchez  a la defensa de los riojanos en dependencia,http://www.gentedigital.es/logrono/noticia/4188849/el-pp-critica-que-los-socialistas-anteponen-el-seguidismo-a-sanchez-a-la-defensa-de-los-riojanos-en-dependencia/
,journaldemontreal.com,Glencore envisagerait la fermeture de la fonderie Horne,https://www.journaldemontreal.com/2025/11/03/glencore-envisagerait-la-fermeture-de-la-fonderie-horne
,noticiasdelacalle.com.ar,ÉXITO EN LA GESTIÓN DE PASSALACQUA CON MILEI,https://www.noticiasdelacalle.com.ar/noticias/2025/11/03/147786-xito-en-la-gestin-de-passalacqua-con-milei
,insidermonkey.com,Here What Supports Essential Utilitie ( WTRG ) Stability and Dividend Growth ?,https://www.insidermonkey.com/blog/heres-what-supports-essential-utilities-wtrg-stability-and-dividend-growth-1639130/
,goettinger-tageblatt.de,Eistee - Rückruf bei Rewe und Penny : Gesundheitsrisiko wegen Plastikteilen,https://www.goettinger-tageblatt.de/wirtschaft/eistee-rueckruf-bei-rewe-und-penny-gesundheitsrisiko-wegen-plastikteilen-7SOFC5OZIVFUXJYWRBZRN3SSSQ.html
,demokrata.hu,Kína elutasítja az amerikai nukleáris vádakat,https://demokrata.hu/vilag/kina-elutasitja-az-amerikai-nuklearis-vadakat-1084277/
,tz.de,Winter - Wetter könnte zu Extrem - Szenario führen : Das kommt bei einem Jahrhundertwinter auf Deutschland zu,http://www.tz.de/welt/jahrhundertwinter-auf-deutschland-zu-winter-wetter-koennte-zu-extrem-szenario-fuehren-das-kommt-bei-einem-zr-94016612.html
,pv-magazine.com,Europe faces surge in negative power prices as solar output grows,https://www.pv-magazine.com/2025/11/03/europe-faces-surge-in-negative-power-prices-as-solar-output-grows/
,finance.yahoo.com,"Restaurant recession rears its head as Chipotle , Sweetgreen hit hard",https://finance.yahoo.com/news/restaurant-recession-rears-head-chipotle-131026936.html
,myrb.net,绵阳市新闻传媒中心关于  广电大楼10KV电气设备预防性试验项目  遴选采购代理机构的询价公告 _ 绵阳新闻网,http://www.myrb.net/html/2025/news/11/431564.html
,haberaktuel.com,Kabine Toplantısı Terörsüz Türkiye ve Ekonomi Gündemiyle Toplandı,https://www.haberaktuel.com/kabine-toplantisi-terorsuz-turkiye-ve-ekonomi-gundemiyle-toplandi-3379654
