published_at,source,title,url
,repubblica.it,Algoritmi e analisi del suolo :  Così salviamo lagricoltura da siccità e alluvioni,https://www.repubblica.it/green-and-blue/2025/10/31/news/greenant_agricoltura_siccita_e_alluvioni-424950874/
,navbharattimes.indiatimes.com,"Tarot Card Reading , 1 November 2025 | Tarot Horoscope : धन लक्ष्मी योग से वृषभ सहित 5 राशियां होंगी मालामाल , पाएंगे लाभ और सफलता , जानें टैरो कार्ड्स से कल का राशिफल",https://navbharattimes.indiatimes.com/astro/rashifal/tarot-card-prediction/tarot-card-reading-1-november-2025-dhan-lakshmi-yog-auspicious-for-vrisabha-and-other-5-rashi-get-success-money-and-profits/articleshow/124995435.cms
,news.day.az,Турецкая деревообрабатывающая компания планирует выход на рынок Азербайджана,https://news.day.az/economy/1792243.html
,orissadiary.com,IIT Bhubaneswar Hosts Workshop on Mainstreaming Low - Carbon Building Materials for a Sustainable Built Environment in Odisha,https://orissadiary.com/iit-bhubaneswar-hosts-workshop-on-mainstreaming-low-carbon-building-materials-for-a-sustainable-built-environment-in-odisha/
,milanofinanza.it,"Auto , la produzione europea è a rischio immediato : le scorte di chip stanno finendo",https://www.milanofinanza.it/news/auto-la-produzione-europea-e-a-rischio-immediato-le-scorte-di-chip-stanno-finendo-202510311359309419
,manilatimes.net,Bavarian Nordic shareholders are reminded of expiry of the offer period regarding the takeover offer from consortium consisting of Nordic Capital and Permira,https://www.manilatimes.net/2025/10/31/tmt-newswire/globenewswire/bavarian-nordic-shareholders-are-reminded-of-expiry-of-the-offer-period-regarding-the-takeover-offer-from-consortium-consisting-of-nordic-capital-and-permira/2213196
,ibtimes.com,XOM Stock Update : Exxon Shares Open Under Pressure of Dropping Cash Flow,https://www.ibtimes.com/xom-stock-update-exxon-shares-open-under-pressure-dropping-cash-flow-3789074
,marketscreener.com,AutoNation Board Authorizes Additional $1 Billion for Share Repurchase,https://www.marketscreener.com/news/autonation-board-authorizes-additional-1-billion-for-share-repurchase-ce7d5cdbd181f42c
,yahoo.com,Whole Hog Politics : What at stake for Trump agenda on Tuesday,https://www.yahoo.com/news/articles/whole-hog-politics-stake-trump-111001349.html
,mynorthwest.com,Americans staying put : US home turnover rate at lowest level in decades as housing slump drags on,https://mynorthwest.com/national/americans-staying-put-us-home-turnover-rate-at-lowest-level-in-decades-as-housing-slump-drags-on/4149422
,mittelstandcafe.de,UMT United Mobility Technology AG : UMT baut KI - Lösungen weiter aus und prüft strategische Optionen für Anwendungen im Bereich Sicherheit und Verteidigung,https://www.mittelstandcafe.de/umt-united-mobility-technology-ag-umt-baut-ki-l-sungen-weiter-aus-und-pr-ft-strategische-optionen-f-r-anwendungen-im-bereich-sicherheit-und-verteidigung-2208707.html
,businesstoday.in,"Bank of Baroda Q2 results : Profit declines 8 % to Rs 4 , 809 crore ; asset quality improves",https://www.businesstoday.in/markets/stocks/story/bank-of-baroda-q2-results-profit-declines-8-to-rs-4809-crore-asset-quality-improves-500408-2025-10-31
,singaporestar.com,JA Solar and 5B Sign Strategic Module Supply Agreement for 100MW+ Project in Western Australia,http://www.singaporestar.com/news/278666309/ja-solar-and-5b-sign-strategic-module-supply-agreement-for-100mw-project-in-western-australia
,maalaimalar.com,Read all Latest Updates on and about தமிழ்நாடு சட்டசபை,https://www.maalaimalar.com/tags/slug-203234
,tarunmitra.in,"भारतरत्न , लौहपुरूष सरदार बल्लभभाई पटेल की 150वीं जयन्ती धूमधाम से मनायी गयी ।",https://www.tarunmitra.in/state/uttar-pradesh/the-150th-birth-anniversary-of-bharat-ratna-iron-man-sardar/article-111011
,laosnews.net,Kissht : Redefining Customer - Centricity in India Fintech Space,http://www.laosnews.net/news/278666214/kissht-redefining-customer-centricity-in-india-fintech-space
,bankinfosecurity.com,How Big Banks Are Turning AI Into a Workforce Advantage,https://www.bankinfosecurity.com/how-big-banks-are-turning-ai-into-workforce-advantage-a-29883
,shorouknews.com,تجهيز 22 شاشة عرض كبرى في مدن جنوب سيناء لمتابعة افتتاح المتحف المصري الكبير,https://www.shorouknews.com/news/view.aspx?cdate=31102025&id=cc56270e-5bab-43d8-a6be-d44ba03cc76a
,livemint.com,Safecure Services IPO : Issue booked 1 . 81x on Day 3 Check latest GMP and other details about SME offer,https://www.livemint.com/market/ipo/safecure-services-ipo-issue-booked-1-2x-so-far-on-day-2-check-latest-gmp-and-other-details-about-sme-offer-11761817315290.html
,boersennews.de,Webinar – US - Tech vs . DAX : Chancen und Risiken im Jahresendspurt,https://www.boersennews.de/nachrichten/partner/dzBank/webinar-us-tech-vs-dax-chancen-und-risiken-im-jahresendspurt/4936248/
,antaranews.com,Ajinomoto tegaskan  Pork Savor  tak diproduksi dan dijual di RI,https://www.antaranews.com/berita/5212185/ajinomoto-tegaskan-pork-savor-tak-diproduksi-dan-dijual-di-ri
,turkiyegazetesi.com.tr,Tel Aviv - Washington hattında doğal gaz krizi ! ABDli bakan anlaşma imzalanmayınca böyle rest çekti,https://www.turkiyegazetesi.com.tr/dunya/tel-aviv-washington-hattinda-dogal-gaz-krizi-abdli-bakan-anlasma-imzalanmayinca-boyle-rest-cekti-1156748
,businesstoday.in,"Narayana Health enters united kingdom market with ₹2 , 200 crore acquisition of Practice Plus Group Hospitals",https://www.businesstoday.in/latest/corporate/story/narayana-health-enters-uk-market-with-rs2200-crore-acquisition-of-practice-plus-group-hospitals-500410-2025-10-31
,italiachiamaitalia.it,"MANOVRA | Vecchi ( Pd ):  Italiani allestero penalizzati , il governo Meloni li ha abbandonati",https://www.italiachiamaitalia.it/manovra-vecchi-pd-italiani-allestero-penalizzati-il-governo-meloni-li-ha-abbandonati/
,belegger.nl,UBS verhoogt koersdoel ING,https://www.belegger.nl/Nieuws/839035/UBS-verhoogt-koersdoel-ING.aspx
,jornadaonline.com,"El cuidado de personas , un servicio en expansión y sostenible",https://www.jornadaonline.com/sociedad/el-cuidado-de-personas-un-servicio-en-expansion-y-sostenible-3341/
,kreiszeitung.de,Milchbauern schlagen Alarm : Betriebsaufgaben drohen,https://www.kreiszeitung.de/wirtschaft/milchbauern-schlagen-alarm-betriebsaufgaben-drohen-zr-94015580.html
,eldiariomontanes.es,El euríbor no da tregua y encarece por primera vez en dos años las hipotecas con revisión semestral,https://www.eldiariomontanes.es/economia/euribor-tregua-encarece-primera-vez-dos-anos-20251031133801-ntrc.html
,kreiszeitung.de,7 eindrucksvolle Schluchten in Baden - Württemberg – nicht nur im Schwarzwald,https://www.kreiszeitung.de/leben/eindrucksvolle-schluchten-in-baden-wuerttemberg-nicht-nur-im-schwarzwald-zr-94015545.html
,ideastream.org,The haunting of Cleveland Fire Engine House No . 6 and other forgotten cemeteries,https://www.ideastream.org/community/2025-10-31/the-haunting-of-clevelands-fire-engine-house-no-6-and-other-forgotten-cemeteries
,bzi.ro,A renunțat la televiziune pentru a - și urma visul în digital marketing ! Roxana Niculae dezvăluie cum a construit Viral Ideea !,https://www.bzi.ro/a-renuntat-la-televiziune-pentru-a-si-urma-visul-in-digital-marketing-roxana-niculae-dezvaluie-cum-a-construit-viral-ideea-5389751
,latina-press.com,Neue Informationsarchitektur : Die wachsende Macht der Influencer und der Niedergang des professionellen Journalismus » latinapress Nachrichten,https://latina-press.com/news/339071-neue-informationsarchitektur-die-wachsende-macht-der-influencer-und-der-niedergang-des-professionellen-journalismus/
,chinatimes.com,黃仁勳盼川普點頭讓Blackwell銷陸 示警 「 華為不可小覷 」 - 趨勢,https://www.chinatimes.com/realtimenews/20251031004187-260408
,marketpulse.com,Nasdaq 100 : Short - term bullish trend remains intact despite a less dovish Powell,https://www.marketpulse.com/markets/nasdaq-100-short-term-bullish-trend-remains-intact-despite-a-less-dovish-powell/
,bzi.ro,"Prim - vicepreședintele Marius Lulea ( AUR ) lovește în politica externă a Guvernului : „ România trebuie să - și apere interesele , nu să stea în genunchi ! • Buna Ziua Iasi • BZI . ro",https://www.bzi.ro/prim-vicepresedintele-marius-lulea-aur-loveste-in-politica-externa-a-guvernului-romania-trebuie-sa-si-apere-interesele-nu-sa-stea-in-genunchi-5389702
,melty.fr,"Coup dur pour les épargnants : la flat tax grimpe à 31 , 4 %, le PEA perd son avantage fiscal",https://www.melty.fr/divers/coup-dur-pour-les-epargnants-la-flat-tax-grimpe-a-314-le-pea-perd-son-avantage-fiscal-2272486.html
,modena2000.it,Bella ( Confcommercio )  Sostenere le imprese giovanili per spingere la crescita,https://www.modena2000.it/2025/10/31/bella-confcommercio-sostenere-le-imprese-giovanili-per-spingere-la-crescita/
,ole.com.ar,"La otra elección : famosos , ex jugadores e hinchas de River se pronuncian sobre el futuro de Gallardo en medio de la crisis",https://www.ole.com.ar/river-plate/river-marcelo-gallardo-hinchas-famosos-opinion-ciclo-aguante_0_kyRnNpOkOA.html
,air-journal.fr,"Groupe Lufthansa : bénéfice opérationnel de 1 , 3 milliard deuros au troisième trimestre 2025 et perspectives positives pour 2025",https://www.air-journal.fr/2025-10-31-groupe-lufthansa-benefice-operationnel-de-13-milliard-deuros-au-troisieme-trimestre-2025-et-perspectives-positives-pour-2025-5266904.html
,brasil247.com,O capitalismo e seus filhos esquecidos,https://www.brasil247.com:443/blog/o-capitalismo-e-seus-filhos-esquecidos
,numerama.com,Boulanger profite du Black Friday pour baisser le prix du Google Pixel 10,https://www.numerama.com/tech/2106755-boulanger-profite-du-black-friday-pour-baisser-le-prix-du-google-pixel-10.html
,viva.co.id,"Tanggul Baswedan Jebol , Rumah di RW 06 Jati Padang Terendam Banjir",https://www.viva.co.id/berita/metro/1858321-tanggul-baswedan-jebol-rumah-di-rw-06-jati-padang-terendam-banjir
,el-balad.com,Nvidia Stock Rally Stalls Amid Continued China Sales Ban and AI Investment,https://www.el-balad.com/6750662
,finanznachrichten.de,"SRH Total Return Fund , Inc . Section 19a Notice",https://www.finanznachrichten.de/nachrichten-2025-10/66851801-srh-total-return-fund-inc-section-19a-notice-200.htm
,dsnews.ua,Напад на працівників ТЦК в Одесі : підозрюваним загрожує до 15 років ув  язнення DSnews . ua,https://www.dsnews.ua/ukr/politics/napad-na-pracivnikiv-tck-v-odesi-pidozryuvanim-zagrozhuye-do-15-rokiv-uv-yaznennya-31102025-531312
,themarketsdaily.com,FWG Investments LLC . Sells 121 Shares of iShares MSCI EAFE Growth ETF $EFG,https://www.themarketsdaily.com/2025/10/31/fwg-investments-llc-sells-121-shares-of-ishares-msci-eafe-growth-etf-efg.html
,fortuneturkey.com,İşten Çıkarmalarda Yapay Zeka Etkisi Düşük Ama Asıl Şok Yolda,https://www.fortuneturkey.com/isten-cikarmalarda-yapay-zeka-etkisi-dusuk-ama-asil-sok-yolda
,koran-jakarta.com,Xi Jinping Tekankan Pentingnya Sistem Perdagangan Multilateral yang Adil di Forum APEC,https://koran-jakarta.com/2025-10-31/xi-jinping-tekankan-pentingnya-sistem-perdagangan-multilateral-yang-adil-di-forum-apec
,estrategiasdeinversion.com,Telefónica cae más del 2 %. El mercado da por hecho recorte en su dividendo,https://www.estrategiasdeinversion.com/actualidad/noticias/bolsa-espana/telefonica-cae-mas-del-2-el-mercado-da-por-hecho-n-859715
,catanzaroinforma.it,Evasione fiscale a Catanzaro : annullato sequestro per equivalente da mezzo milione di euro,https://www.catanzaroinforma.it/cronaca/2025/10/31/evasione-fiscale-a-catanzaro-annullato-sequestro-per-equivalente-da-mezzo-milione-di-euro/391825/
,eprice.com.tw,OPPO Find X9 Pro 價格 、 評價 、 規格 | ePrice 比價王,https://www.eprice.com.tw/mobile/intro/c01-p7248-oppo-find-x9-pro/
,eprice.com.tw,vivo S50 Pro mini 將改採用高通驍龍處理器 - 手機品牌新聞,https://www.eprice.com.tw/mobile/talk/4902/5818057/1
,lejournaldejoliette.ca,,https://www.lejournaldejoliette.ca/actualites-nationale/l%E2%80%99economie-canadienne-s%E2%80%99est-contractee-de-03--en-aout/33993
,finanznachrichten.de,Jamie Coleman ( MFS ): Moderate Inflation macht Zinssenkung möglich,https://www.finanznachrichten.de/nachrichten-2025-10/66851857-jamie-coleman-mfs-moderate-inflation-macht-zinssenkung-moeglich-404.htm
,finanza.repubblica.it,"Vino , Frescobaldi ( Uiv ): Bene incontro con Sefcovic , coltivare alleanza con trade americano - Economia e Finanza",https://finanza.repubblica.it/News/2025/10/31/vino_frescobaldi_uiv_bene_incontro_con_sefcovic_coltivare_alleanza_con_trade_americano-107/
,sol.de,Aktueller Rückruf bei dm : Krankheitserreger in beliebtem Produkt möglich,"https://www.sol.de/deutschland-und-welt/aktueller-rueckruf-bei-dm-krankheitserreger-in-beliebtem-produkt-moeglich-re-16,649107.html"
,moea.gov.tw,"本部新聞 - 新聞與公告 - 中華民國經濟部 ( Ministry of Economic Affairs , R . O . C .) 全球資訊網",https://www.moea.gov.tw/MNS/populace/news/News.aspx?kind=1&menu_id=40&news_id=120953
,italiachiamaitalia.it,MADE IN ITALY | Da Napoli parte la sfida della qualità e dei nuovi mercati esteri,https://www.italiachiamaitalia.it/made-in-italy-da-napoli-parte-la-sfida-della-qualita-e-dei-nuovi-mercati-esteri/
,hoy.com.do,El precio del dólar de este viernes 31 de octubre del 2025,https://hoy.com.do/precio-del-dolar-de-este-viernes-31-de-octubre-del-2025/
,antaranews.com,Pasar Tumbuh jadi wadah edukasi penggiat urban farming di Jaktim,https://www.antaranews.com/berita/5212193/pasar-tumbuh-jadi-wadah-edukasi-penggiat-urban-farming-di-jaktim
,newsx.com,"Not Getting Salary Pay Checks ? You Work Hard , But Are You Financially Free",https://www.newsx.com/finance/not-getting-salary-pay-checks-you-work-hard-but-are-you-financially-free-103239/
,iz.ru,В ЦБ назвали условие для курса в 50 рублей за доллар,https://iz.ru/1982686/2025-10-31/v-tcb-nazvali-uslovie-dlia-kursa-v-50-rublei-za-dollar
,publituris.pt,APG Airlines integra Volotea,https://www.publituris.pt/2025/10/31/apg-airlines-integra-volotea
,mittelstandcafe.de,Warum Handwerker in Ungarn plötzlich so teuer sind,https://www.mittelstandcafe.de/warum-handwerker-in-ungarn-pl-tzlich-so-teuer-sind-2208714.html
,elcaribe.com.do,Realizan congreso de turismo de salud y bienestar,https://www.elcaribe.com.do/panorama/pais/realizan-congreso-de-turismo-de-salud-y-bienestar/
,latina-press.com,"Pornografie des Todes : Brasilien , das Bilder rassistischer Gewalt naturalisiert und zelebriert » latinapress Nachrichten",https://latina-press.com/news/339082-pornografie-des-todes-brasilien-das-bilder-rassistischer-gewalt-naturalisiert-und-zelebriert/
,999thepoint.com,Colorado Rocket Engine Maker Expands with 400 - Acre Testing Site,https://999thepoint.com/ixp/49/p/ursa-major-briggsdale-colorado/
,wnmufm.org,The Trump administration move to study aluminum in vaccines worries scientists,https://www.wnmufm.org/2025-10-31/the-trump-administration-move-to-study-aluminum-in-vaccines-worries-scientists
,turkiyegazetesi.com.tr,3 Kasımda açıklanacak ! İşte ekonomistlerin enflasyon beklentisi,https://www.turkiyegazetesi.com.tr/ekonomi/3-kasimda-aciklanacak-iste-ekonomistlerin-enflasyon-beklentisi-1156750
,circuitomt.com.br,Fechamento do mercado financeiro – CircuitoMT,https://circuitomt.com.br/fechamento-do-mercado-financeiro-255/
,memleket.com.tr,Ziraat Katılım Halka Arz İçin Gün Sayıyor !,https://www.memleket.com.tr/ziraat-katilim-halka-arz-icin-gun-sayiyor-2348699h.htm
,noticel.com,Cierre del gobierno federal de EE . UU . se prolongará al menos hasta el 3 de noviembre - NotiCel - La verdad como es - Noticias de Puerto Rico,https://noticel.com/noticias/estados-unidos/20251031/cierre-del-gobierno-federal-de-ee-uu-se-prolongara-al-menos-hasta-el-3-de-noviembre/
,fr.allafrica.com,"Tunisie : Demain , entrée en vigueur de lobligation des caisses enregistreuses pour cafés et restaurants",https://fr.allafrica.com/stories/202510310382.html
,boursorama.com,Wall Street au rebond grâce aux géants Apple et Amazon - 31 / 10 / 2025 à 14 : 07,https://www.boursorama.com/bourse/actualites/wall-street-au-rebond-grace-aux-geants-apple-et-amazon-bb95f1e107c2cb4869b31d8c894f10a0
,m24.ru,"Внезапные перемены : может ли банк пересмотреть условия кредита без предупреждения – Москва 24 , 31 . 10 . 2025",https://www.m24.ru/articles/ehkonomika/31102025/843134
,themarketsdaily.com,FWG Investments LLC . Decreases Position in iShares MSCI EAFE Value ETF $EFV,https://www.themarketsdaily.com/2025/10/31/fwg-investments-llc-decreases-position-in-ishares-msci-eafe-value-etf-efv.html
,investopedia.com,5 Things to Know Before the Stock Market Opens,https://www.investopedia.com/5-things-to-know-before-the-markets-open-october-31-2025-11840958
,daidoanket.vn,"Số người chết do bão Melissa tăng lên 44 , vùng Caribe cần viện trợ khẩn cấp",https://daidoanket.vn/so-nguoi-chet-do-bao-melissa-tang-len-44-vung-caribe-can-vien-tro-khan-cap.html
,nasional.kompas.com,Prabowo Jadi Muslim Paling Berpengaruh Urutan ke - 15 Dunia,https://nasional.kompas.com/read/2025/10/31/20201191/prabowo-jadi-muslim-paling-berpengaruh-urutan-ke-15-dunia
,singaporestar.com,Fox ESS and OSW Ink Strategic Partnership for 2GWh Energy Storage Projects at All Energy 2025,http://www.singaporestar.com/news/278666295/fox-ess-and-osw-ink-strategic-partnership-for-2gwh-energy-storage-projects-at-all-energy-2025
,singaporestar.com,Trane Technologies Reports Strong Third Quarter Results,http://www.singaporestar.com/news/278666287/trane-technologies-reports-strong-third-quarter-results
,yangtse.com,习近平出席亚太经合组织第三十二次领导人非正式会议并发表重要讲话,https://www.yangtse.com/news/tt/202510/t20251031_284211.html
,fnweb.de,Merz lädt zu « Stahlgipfel » am 6 . November ein,"https://www.fnweb.de/wirtschaft_artikel,-wirtschaft-merz-laedt-zu-stahlgipfel-am-6-november-ein-_arid,2337786.html"
,themarketsdaily.com,"Kovack Advisors Inc . Acquires 51 , 411 Shares of iShares MSCI EAFE ETF $EFA",https://www.themarketsdaily.com/2025/10/31/kovack-advisors-inc-acquires-51411-shares-of-ishares-msci-eafe-etf-efa.html
,jornada.com.mx,La Jornada : La debilidad del PIB no es generalizada : SHCP,https://www.jornada.com.mx/2025/10/31/economia/020n2eco
,internethaber.com,12 soruda  elektrik tarifesinde yeni limit  2026  da yıllık elektrik tüketim sınırı belli oldu !,https://www.internethaber.com/12-soruda-elektrik-tarifesinde-yeni-limit-2026da-yillik-elektrik-tuketim-siniri-belli-oldu-foto-galerisi-2417676.htm
,boursorama.com,"Face à lendettement massif des géants de lintelligence artificielle , les marchés ne sinquiètent pas , éblouis par leurs bénéfices mirobolants - 31 / 10 / 2025 à 13 : 30",https://www.boursorama.com/actualite-economique/actualites/face-a-l-endettement-massif-des-geants-de-l-intelligence-artificielle-les-marches-ne-s-inquietent-pas-eblouis-par-leurs-benefices-mirobolants-dad4f4e923491f1ea614cce0ae43923c
,ekonomi.haber7.com,Bank of Americadan yatırımcılara altın tavsiyesi,https://ekonomi.haber7.com/ekonomi/haber/3575944-bank-of-americadan-yatirimcilara-altin-tavsiyesi
,gigwise.com,Turning Your Used Car into Cash : How to Sell It the Right Way,https://www.gigwise.com/turning-your-used-car-into-cash-how-to-sell-it-the-right-way/
,baomoi.com,GELEX kiến tạo tầm nhìn chiến lược cho một giai đoạn phát triển mới,https://baomoi.com/gelex-kien-tao-tam-nhin-chien-luoc-cho-mot-giai-doan-phat-trien-moi-c53640102.epi
,businesstoday.in,Gold demand falls 16 % after Diwali as record prices hit jewellery sales ; what lies ahead,https://www.businesstoday.in/personal-finance/investment/story/indias-gold-demand-falls-16-after-diwali-as-record-prices-hit-jewellery-sales-what-lies-ahead-500409-2025-10-31
,laosnews.net,Ace Investor Sunil Singhania Family Office Backs SPC ( Swapnil Patni Classes ) India Leading CA Coaching Brand Enters Pre - IPO Growth Phase,http://www.laosnews.net/news/278666745/ace-investor-sunil-singhania-family-office-backs-spc-swapnil-patni-classes-india-leading-ca-coaching-brand-enters-pre-ipo-growth-phase
,jdsupra.com,FDA Operations During the FY 2026 Government Shutdown | Gardner Law,https://www.jdsupra.com/legalnews/fda-operations-during-the-fy-2026-4823215/
,antaranews.com,"Kasus jual beli gas , KPK pelajari peluang adanya tersangka korporasi",https://www.antaranews.com/berita/5212197/kasus-jual-beli-gas-kpk-pelajari-peluang-adanya-tersangka-korporasi
,elmundo.es,Nadie quiere dormir en la habitación 712 : el oscuro secreto del Parador de Cardona,https://www.elmundo.es/cataluna/2025/10/31/6904807421efa01e198b456d.html
,viva.co.id,Tindakan Menkeu Purbaya Tau Peserta Upacara Pingsan Saat Dirinya Berpidato Jadi Sorotan Netizen,https://www.viva.co.id/berita/nasional/1858291-tindakan-menkeu-purbaya-tau-peserta-upacara-pingsan-saat-dirinya-berpidato-jadi-sorotan-netizen
,iz.ru,В Госдуме назвали неактуальной идею перехода на 12 - летнее школьное обучение,https://iz.ru/1982659/2025-10-31/v-gosdume-nazvali-neaktualnoi-ideiu-perekhoda-na-12-letnee-shkolnoe-obuchenie
,tmtpost.com,习近平会见日本首相高市早苗,https://www.tmtpost.com/nictation/7745736.html
,fortuneturkey.com,Türk Tersaneciliğine Alman Desteği | Fortune Turkey,https://www.fortuneturkey.com/turk-tersaneciligine-alman-destegi
,businesstoday.in,"Vedanta Q2 results : Profit falls 59 % to Rs 1 , 798 crore on one time cost",https://www.businesstoday.in/markets/stocks/story/vedanta-q2-results-profit-falls-59-to-rs-1798-crore-on-one-time-cost-500401-2025-10-31
,dunyanews.tv,Samsung Electronics in talks with Nvidia to supply next - generation HBM4 chips,https://dunyanews.tv/en/Technology/915231-samsung-electronics-in-talks-with-nvidia-to-supply-nextgeneration-hbm
,youm7.com,سعر الدولار اليوم الجمعة 31 - 10 - 2025 أمام الجنيه .. 47 . 15 فى البنك المركزي,https://www.youm7.com/story/2025/10/31/%D8%B3%D8%B9%D8%B1-%D8%A7%D9%84%D8%AF%D9%88%D9%84%D8%A7%D8%B1-%D8%A7%D9%84%D9%8A%D9%88%D9%85-%D8%A7%D9%84%D8%AC%D9%85%D8%B9%D8%A9-31-10-2025-%D8%A3%D9%85%D8%A7%D9%85-%D8%A7%D9%84%D8%AC%D9%86%D9%8A%D9%87-47/7179091
,catanzaroinforma.it,"Guardia di Finanza Catanzaro , arrivano 15 nuovi ispettori per rafforzare i reparti territoriali",https://www.catanzaroinforma.it/cronaca/2025/10/31/guardia-di-finanza-catanzaro-arrivano-15-nuovi-ispettori-per-rafforzare-i-reparti-territoriali/391733/
,finance.yahoo.com,Market analysts react to Trump - Xi meet,https://finance.yahoo.com/news/market-analysts-react-trump-xi-052407181.html
,en.chessbase.com,Kenneth Baker : Politician and chess enthusiast,https://en.chessbase.com/post/kenneth-baker-politician-and-chess-enthusiast
,horseshoeheroes.com,Stunning Daniel Jones statistic might be the key to Colt long - term success,https://horseshoeheroes.com/stunning-daniel-jones-statistic-key-indianapolis-colts-long-term-success
,lavozdegalicia.es,CaixaBank se apunta un nuevo récord y alcanza los 4 . 397 millones de beneficio hasta septiembre,https://www.lavozdegalicia.es/noticia/economia/2025/10/31/caixabank-apunta-nuevo-record-alcanza-4397-millones-beneficio-septiembre/00031761911794021654228.htm
,singaporestar.com,Powering What Next : Sungrow Showcases Next - Gen Energy Innovation at All - Energy Australia 2025,http://www.singaporestar.com/news/278666291/powering-what-next-sungrow-showcases-next-gen-energy-innovation-at-all-energy-australia-2025
,dailymail.co.uk,How life will look for Andrew Mountbatten Windsor,https://www.dailymail.co.uk/news/article-15245681/How-life-look-Andrew-Mountbatten-Windsor-ordinary-member-public-home-finances-royal-privileges-stripped-away.html
,prospect.org,How Do We Rebuild After Trump ? - The American Prospect,https://prospect.org/2025/10/31/how-do-we-rebuild-after-trump/
,e.dennikn.sk,"Česká cestovná kancelária Travel Family končí , odôvodňuje to vývojom na trhu",https://e.dennikn.sk/minuta/4942234
,brasil247.com,Efeito Lula : desemprego no Brasil atinge menor nível da história,https://www.brasil247.com:443/economia/efeito-lula-desemprego-no-brasil-atinge-menor-nivel-da-historia
,fortuneturkey.com,CEOlar da Rol Yapmayı Öğrenebilir mi ?,https://www.fortuneturkey.com/ceolar-da-rol-yapmayi-ogrenebilir-mi
,eldiariocba.com.ar,"El intendente presentó su segundo informe de gestión y prometió el acceso a 650 lotes , entre otros anuncios",http://www.eldiariocba.com.ar/locales/2025/10/31/el-intendente-presento-su-segundo-informe-de-gestion-prometio-el-acceso-650-lotes-entre-otros-anuncios-139177.html
,viva.co.id,"Sempat Diragukan Masyarakat , BI Sebut Transaksi QRIS Kini Tembus Rp 1 , 9 Kuadriliun",https://www.viva.co.id/bisnis/1858322-sempat-diragukan-masyarakat-bi-sebut-transaksi-qris-kini-tembus-rp-1-9-kuadriliun
,baophapluat.vn,Ngăn chặn người phụ nữ chuyển hơn 110 triệu đồng cho kẻ lừa đảo,https://baophapluat.vn/ngan-chan-nguoi-phu-nu-chuyen-hon-110-trieu-dong-cho-ke-lua-dao.html
,news.webindia123.com,"Groww to channel IPO proceeds into tech , brand , NBFC business expansion : CFO Ishan Bansal",https://news.webindia123.com/news/Articles/Business/20251031/4378567.html
