published_at,source,title,url
,news-medical.net,VALANX Biotech establishes Board of Directors,https://www.news-medical.net/news/20251210/VALANX-Biotech-establishes-Board-of-Directors.aspx
,yenikonya.com.tr,Dövdüğü eşinin öldüğünü zannedip olayı gizlemek için trafik kazası gibi göstermeye çalıştı,https://www.yenikonya.com.tr/guncel/dovdugu_esinin_oldugunu_zannedip_olayi_gizlemek_icin_trafik_kazasi_gibi_gostermeye_calisti-1966286
,defenseworld.net,Cerity Partners LLC Reduces Holdings in Moody Corporation $MCO,https://www.defenseworld.net/2025/12/10/cerity-partners-llc-reduces-holdings-in-moodys-corporation-mco.html
,moneymarketing.co.uk,The Morning Briefing : FCA launches new tool to fight financial crime ; Will the  triple - lock taboo  ever be broken ?,https://www.moneymarketing.co.uk/news/the-morning-briefing-fca-launches-new-tool-to-fight-financial-crime-will-the-triple-lock-taboo-ever-be-broken/
,ifamagazine.com,"Podcast # 151 : Making Sense of markets , mindsets and 2026 , with James Giblin , Fund Manager at L & G",https://ifamagazine.com/podcast-151-making-sense-of-markets-mindsets-and-2026-with-james-giblin-fund-manager-at-lg/
,thanhnien.vn,TP . HCM dành hơn 1 . 000 tỉ đồng xúc tiến thương mại,https://thanhnien.vn/tphcm-danh-hon-1000-ti-dong-xuc-tien-thuong-mai-185251210194001846.htm
,investegate.co.uk,Director / PDMR Shareholding | Company Announcement,https://www.investegate.co.uk/announcement/rns/chemring-group--chg/director-pdmr-shareholding/9288169
,techcabal.com,ClapMi secures $20k Lisk grant to launch Africa first hybrid Web2 / Web3 live competition platform,https://techcabal.com/2025/12/10/clapmi-secures-20k-lisk-grant-to-launch-africas-first-hybrid-web2-web3-live-competition-platform/
,news.cyol.com,兴趣消费 ， 点亮经济活力新燃点,http://news.cyol.com/gb/articles/2025-12/10/content_8ERBoytWyO.html
,freshplaza.com,Survey shows pineapple ranks tenth among fruit choices,https://www.freshplaza.com/north-america/article/9793329/survey-shows-pineapple-ranks-tenth-among-fruit-choices/
,themarketsdaily.com,Walleye Capital LLC Purchases New Stake in eToro Group Ltd . $ETOR,https://www.themarketsdaily.com/2025/12/10/walleye-capital-llc-purchases-new-stake-in-etoro-group-ltd-etor.html
,ifamagazine.com,Quilter Cheviot and KKR bring evergreen private markets solution to united kingdom wealth market,https://ifamagazine.com/quilter-cheviot-and-kkr-bring-evergreen-private-markets-solution-to-uk-wealth-market/
,ifamagazine.com,"Self - employed face working four years longer to fill retirement gap , as Fidelity sounds the alarm on entrepreneur pensions crisis",https://ifamagazine.com/self-employed-face-working-four-years-longer-to-fill-retirement-gap-as-fidelity-sounds-the-alarm-on-entrepreneur-pensions-crisis/
,larepublica.pe,"Precio del dólar hoy en Perú , miércoles 10 de diciembre 2025 : cotización de compra y venta , según BCR y tasa de cambio | Dólares a soles | Ocoña | Dólar bloomberg | atmp | Precio del dólar",https://larepublica.pe:443/economia/precio-del-dolar/2025/12/10/precio-del-dolar-hoy-en-peru-miercoles-10-de-diciembre-2025-cotizacion-de-compra-y-venta-segun-bcr-y-tasa-de-cambio-dolares-a-soles-ocona-dolar-bloomberg-atmp-613845
,punto-informatico.it,OpenAI e Anthropic vogliono standardizzare gli agenti AI,https://www.punto-informatico.it/openai-anthropic-standardizzare-agenti-ai/
,orf.at,Demokratie Monitor : Schlechte Werte für politisches System,https://orf.at/stories/3413982/
,aldianews.com,The Cultural Battle Over AI - Generated Music,https://aldianews.com/en/culture/music/voices-dont-exist
,jornada.com.mx,La Jornada : Sorprende repunte de inflación en noviembre : 3 . 8 % anual,https://www.jornada.com.mx/2025/12/10/economia/017n3eco
,cantechletter.com,Code Blue Announces Strategic Expansion into North America,https://www.cantechletter.com/newswires/code-blue-announces-strategic-expansion-into-north-america/
,m.kauno.diena.lt,Vyriausybė patvirtino programos įgyvendinimo priemonių planą,https://m.kauno.diena.lt/naujienos/lietuva/politika/vyriausybe-patvirtino-programos-igyvendinimo-priemoniu-plana-1732664
,yahoo.com,Smotrich approves nearly hundreds of housing units in multiple West Bank settlements,https://www.yahoo.com/news/articles/smotrich-approves-nearly-hundreds-housing-132222824.html
,realtid.se,Historiskt rekord för silver kan vara farligt,https://www.realtid.se/bors-finans/makro/historisk-rekord-for-silver-det-kan-vara-farligt/
,jornalagora.com.br,Idosos com renda até R$ 406 receberão R$ 1 . 627 do governo Lula,https://www.jornalagora.com.br/idosos-com-renda-ate-r-406-receberao-r-1-627-do-governo-lula/
,bizcommunity.com,Famous Brands enters Malaysia with Steers and Debonairs combo,https://www.bizcommunity.com/article/famous-brands-enters-malaysia-with-steers-and-debonairs-combo-394358a
,ryt9.com,ACT จับมือ กทม . เอาจริงปิดช่องโกง ตั้งเป้  กรุงเทพฯ,https://www.ryt9.com/s/iq02/12772545
,investegate.co.uk,Form 8 ( DD ) - Qualcomm Inc | Company Announcement,https://www.investegate.co.uk/announcement/rns/alphawave-ip-group--awe/form-8-dd-qualcomm-inc/9288184
,themarketsdaily.com,Quanta Services ( NYSE : PWR ) Shares Unloaded Rep . April McClain Delaney,https://www.themarketsdaily.com/2025/12/10/quanta-services-nysepwr-shares-unloaded-rep-april-mcclain-delaney.html
,themarketsdaily.com,WINTON GROUP Ltd Trims Position in Trane Technologies plc $TT,https://www.themarketsdaily.com/2025/12/10/winton-group-ltd-trims-position-in-trane-technologies-plc-tt.html
,fokus.se,Skåpmat i Strängnäs,https://www.fokus.se/aktuellt/skapmat-i-strangnas/
,lafranceagricole.fr,La filière française des semences et plants reste compétitive,https://www.lafranceagricole.fr/semences/article/891360/la-filiere-francaise-des-semences-et-plants-reste-competitive
,time.mk,Time . ai,https://time.mk/ai/02418be792/mk/
,tech.ifeng.com,三星 Galaxy Z TriFold 真机上手 ： 能揣兜的电脑,https://tech.ifeng.com/c/8oyVMwuHzhw
,cronica.com.py,Revelaciones crean dudas sobre ¡ urnas electrónicas !,https://www.cronica.com.py/2025/12/10/revelaciones-crean-dudas-sobre-urnas-electronicas/
,auto.24tv.ua,"Новий китаський бренд Scoox показав доволі цікавий чи то мотоцикл , чи то скутер Zero X7",https://auto.24tv.ua/kytaitsi_stvoryly_dyvovyzhnyi_elektroskuter_yakyi_povidomliaie_vlasnyka_pro_svoie_vykradennia_n68299
,express.co.uk,Labour MPs  banned from pub after business rates bombshell,https://www.express.co.uk/news/uk/2144630/labour-mps-banned-pubs-business
,thestar.com.my,"Putin meets Indonesia Prabowo to discuss military and energy ties , wheat exports",https://www.thestar.com.my/aseanplus/aseanplus-news/2025/12/10/putin-meets-indonesia039s-prabowo-to-discuss-military-and-energy-ties-wheat-exports
,respublika.lt,"Japonija paneigė , kad atmeta ES planus dėl įšaldyto Rusijos turto panaudojimo",https://www.respublika.lt/lt/naujienos/pasaulis/pasaulio_politika/japonija-paneige-kad-atmeta-es-planus-del-isaldyto-rusijos-turto-panaudojimo/
,realtid.se,Trump ger Nvidia grönt ljus – men Kina tvekar,https://www.realtid.se/it-tech/trump-ger-nvidia-gront-ljus-men-kina-tvekar/
,zazoom.it,Primo weekend di shopping natalizio venditi stabili o in crescita per tre commercianti su quattro,https://www.zazoom.it/2025-12-10/primo-weekend-di-shopping-natalizio-venditi-stabili-o-in-crescita-per-tre-commercianti-su-quattro/18292768/
,nashvilleherald.com,Signal Advance ( OTCID : SIGL ) Converts Rare 3 - month U . S . Patent Victory for Analog Guard ( R ) into Rapidly Expanding Global IP Portfolio - As Quantum Threats Escalate Amid Large - Scale Collaborations,http://www.nashvilleherald.com/news/278747275/signal-advance-otcid-sigl-converts-rare-3-month-us-patent-victory-for-analog-guardr-into-rapidly-expanding-global-ip-portfolio-as-quantum-threats-escalate-amid-large-scale-collaborations
,chietitoday.it,Unazienda di Vasto tra le migliori realtà in cui i dipendenti sono felici di lavorare,https://www.chietitoday.it/attualita/azienda-vasto-migliori-realta-dipendenti-felici-lavorare.html
,faktor.ba,"Amidžić traži smjenu Krnjića jer je opet oborio pravilnik UIO , ne spominje ko je blokirao odluku o raspodjeli prihoda",https://faktor.ba/bosna-i-hercegovina/aktuelno/amidzic-trazi-smjenu-krnjica-jer-je-opet-oborio-pravilnik-uio-ne-spominje-ko-je-blokirao-odluku-o-raspodjeli-prihoda/238934
,wellandtribune.ca,"NL selling off American booze , donating up to $1 million to help food banks as demand soars",https://www.wellandtribune.ca/news/canada/nl-selling-off-american-booze-donating-up-to-1-million-to-help-food-banks-as/article_72daa879-63f4-528d-a2ab-93de168d5584.html
,opinion.people.com.cn,人民财评 ： Go ！ 购 ！ 够 ！ 中国游  的独特魅力 -- 观点 -- 人民网,http://opinion.people.com.cn/n1/2025/1210/c434878-40621494.html
,lapresse.it,"Irene Pivetti , condanna a 4 anni confermata in appello",https://www.lapresse.it/cronaca/2025/12/10/milano-confermata-in-appello-condanna-a-4-anni-per-irene-pivetti/
,soldionline.it,Asta BOT annuale ( scadenza dicembre 2026 ): i risultati,https://www.soldionline.it/notizie/obbligazioni-italia/bot-annuale-IT0005684888-rendimento-asta-dicembre-2025
,baomoi.com,CEO Ford cảnh báo châu Âu đang  bán tương lai  cho xe Trung Quốc,https://baomoi.com/ceo-ford-canh-bao-chau-au-dang-ban-tuong-lai-cho-xe-trung-quoc-c53976159.epi
,borsaitaliana.it,"Natixis IM : Fed , dara  priorita  ai prezzi o al lavoro ? - PAROLA AL MERCATO",https://www.borsaitaliana.it/borsa/notizie/radiocor/finanza/dettaglio/natixis-im-fed-dara--priorita--ai-prezzi-o-al-lavoro-parola-al-mercato-nRC_10122025_1402_415792546.html
,glas-slavonije.hr,"Građevinski zakoni : Oporba traži povlačenje , HDZ tvrdi da su u interesu građana",https://www.glas-slavonije.hr/novosti/hrvatska/2025/12/10/gradevinski-zakoni-oporba-trazi-povlacenje-hdz-tvrdi-da-su-u-interesu-gradana-735046/
,themarketsdaily.com,"Genworth Financial , Inc . $GNW Position Increased by WINTON GROUP Ltd",https://www.themarketsdaily.com/2025/12/10/genworth-financial-inc-gnw-position-increased-by-winton-group-ltd.html
,donews.com,一朵  山茶花  卖出10个亿 ！ 贵妇  们用的林清轩 ， 要冲击IPO了 - DoNews专栏,https://www.donews.com/article/detail/5332/93942.html
,finanznachrichten.de,Syntholene Energy Corp : Syntholene Energy Announces Completion of Reverse Takeover,https://www.finanznachrichten.de/nachrichten-2025-12/67197730-syntholene-energy-corp-syntholene-energy-announces-completion-of-reverse-takeover-296.htm
,clickorlando.com,December is a great time to buy a new car and this is why,https://www.clickorlando.com/business/2025/12/10/december-is-a-great-time-to-buy-a-new-car-and-this-is-why/
,seneweb.com,"Dette cachée : Des  pratiques inhabituelles , voici comment ... | Seneweb",http://seneweb.com/fr/news/Economie/dette-cachee-des-pratiques-inhabituelles-voici-comment-le-gouvernement-de-macky-sall-procedait-jeune-afrique_n_476994.html
,fixygen.ua,Золоті резерви Узбекистану встановили новий рекорд понад $61 мільярд,https://www.fixygen.ua/news/20251210/zoloti-rezervi-uzbekistanu-vstanovili-noviy-rekord-ponad-61-milyard.html
,finanznachrichten.de,MÄRKTE EUROPA / Warten auf Fed - Entscheidung - Dt . Börse im Minus,https://www.finanznachrichten.de/nachrichten-2025-12/67197595-maerkte-europa-warten-auf-fed-entscheidung-dt-boerse-im-minus-015.htm
,antena3.com,"Netflix y Paramount , enfrentadas por Warner Bros . Discovery en una disputa multimillonaria",https://www.antena3.com/objetivotv/television/netflix-paramount-enfrentadas-warner-bros-discovery-disputa-multimillonaria_20251210693944e66f86fb0fe9ef38c4.html
,abc7.com,"NFL Week 15 latest buzz , questions , news and fantasy tips",https://abc7.com/post/nfl-week-15-latest-buzz-questions-news-fantasy-tips/18271232/
,lamanchelibre.fr,Coutances . LUnion des commerçants est prête pour les fêtes de fin dannée,https://www.lamanchelibre.fr/actualite-1203680-coutances-l-union-des-commercants-est-prete-pour-les-fetes-de-fin-d-annee
,pakobserver.net,"Allied Bank , MCB Bank , Hafiz Sweets among 95 sealed in Lahore",https://pakobserver.net/allied-bank-mcb-bank-hafiz-sweets-among-95-sealed-in-lahore/
,startupcafe.ro,Pachetul 2 de măsuri : Undă verde de la CCR pentru noile majorări de taxe și impozite . Principalele modificări de la 1 ianuarie 2026,https://startupcafe.ro/pachetul-2-de-masuri-unda-verde-de-la-ccr-pentru-noile-majorari-de-taxe-si-impozite-principalele-modificari-de-la-1-ianuarie-2026-91320
,varna24.bg,След близо 4 часа бурни дебати : Парламентът насрочи гласуването на вота на недоверие,https://www.varna24.bg/novini/Bylgaria/Sled-blizo-4-chasa-burni-debati-Parlamentut-nasrochi-glasuvaneto-na-vota-na-nedoverie-2816282
,es.euronews.com,Un estudio muestra el uso creciente de IA para tareas productivas y aprendizaje,https://es.euronews.com/next/2025/12/10/mayoria-utiliza-agentes-ia-mejorar-productividad-aprender-segun-perplexity
,merkur.de,Gerichtsentscheid macht Makler - Verträge ungültig : Kunden können Geld zurückfordern,http://www.merkur.de/verbraucher/gerichtsentscheid-macht-makler-vertraege-ungueltig-kunden-koennen-geld-zurueckfordern-zr-94077650.html
,journaldugeek.com,On a appris de nos erreurs  : Kaze quitte Crunchyroll Manga et reprend son nom ( cest une bonne nouvelle pour tout le monde ),https://www.journaldugeek.com/2025/12/10/on-a-appris-de-nos-erreurs-kaze-quitte-crunchyroll-manga-et-reprend-son-nom-cest-une-bonne-nouvelle-pour-tout-le-monde/
,laregione.ch,"Sempre più laureati in disoccupazione : « Se avete dubbi , scegliete lapprendistato »",http://www.laregione.ch/tio/svizzera/1889610/sempre-piu-laureati-in-disoccupazione-se-avete-dubbi-scegliete-l-apprendistato
,tr.euronews.com,Perplexity : Çoğu kişi üretkenlik ve öğrenme için yapay zekâ ajanları kullanıyor,https://tr.euronews.com/next/2025/12/10/perplexity-cogu-kisi-uretkenlik-ve-ogrenme-icin-yapay-zeka-ajanlari-kullaniyor
,click2houston.com,Paramount says China Tencent withdrew from its Warner Bros bid to avert national security issues,https://www.click2houston.com/entertainment/2025/12/10/chinas-tencent-quits-paramounts-bid-for-warner-bros-to-avert-national-security-questions/
,reporterherald.com,"Federal Reserve likely to cut rates , but what about future cuts ?",https://www.reporterherald.com/2025/12/10/federal-reserve-rates-decision/
,thesheepsite.com,Toplu Ulaşım Zammı Mecliste Kabul Edildi !,https://www.thesheepsite.com/toplu-ulasim-zammi-mecliste-kabul-edildi/
,enca.com,"Stocks in retreat as traders eye Fed decision , tech earnings",https://www.enca.com/business/stocks-retreat-traders-eye-fed-decision-tech-earnings
,themarketsdaily.com,"WINTON GROUP Ltd Acquires Shares of 12 , 400 Teleflex Incorporated $TFX",https://www.themarketsdaily.com/2025/12/10/winton-group-ltd-acquires-shares-of-12400-teleflex-incorporated-tfx.html
,finanznachrichten.de,Battery Mineral Resources Corp . Announces Proposed Shares for Debt Transaction,https://www.finanznachrichten.de/nachrichten-2025-12/67197727-battery-mineral-resources-corp-announces-proposed-shares-for-debt-transaction-296.htm
,thenewslens.com,當人類連 「 狗屁工作 」 都沒得做 ： 問題不在AI ， 而是誰能拿走AI帶來的錢 ？ - TNL The News Lens 關鍵評論網,https://www.thenewslens.com/article/261925
,kauno.diena.lt,Ruginienė apie kritusius reitingus : dirbu ne dėl jų,https://kauno.diena.lt/naujienos/lietuva/politika/ruginiene-apie-kritusius-reitingus-dirbu-ne-del-ju-1732672
,tamindir.com,"2027 Kia Seltos Tanıtıldı ! Daha Büyk , Daha Gl",https://www.tamindir.com/haber/2027-kia-seltos-ozellikleri_102638/
,finance.yahoo.com,Is BigBear . ai Stock a Buy Now ?,https://finance.yahoo.com/news/bigbear-ai-stock-buy-now-132000907.html
,digi24.ro,Ce spun economiștii despre înghețarea salariului minim . Avertismente pentru anul viitor,https://www.digi24.ro/digieconomic/consumer/ce-spun-economistii-despre-inghetarea-salariului-minim-avertismente-pentru-anul-viitor-78249
,thestar.com.my,Chin Hin sells 44 . 12mil shares in Signature International for RM59 . 99mil,https://www.thestar.com.my/business/business-news/2025/12/10/chin-hin-sells-4412mil-shares-in-signature-international-for-rm5999mil
,blic.rs,Er Srbija proširuje flotu : Stigao novi Embraer E - 195 na Aerodrom Nikola Tesla,https://www.blic.rs/biznis/vesti/er-srbija-prosiruje-flotu-stigao-novi-embraer-e-195-na-aerodrom-nikola-tesla/yklct12
,xalqcebhesi.az,ADB Azərbaycanla bağlı iqtisadi artım və inflyasiya gözləntilərini açıqlayıb,https://www.xalqcebhesi.az/news/economy/234594.html
,leggo.it,"Famiglia nel bosco , Flavio Briatore vuole pagare i lavori di ristrutturazione della casa . E spunta lidea di riunire il nucleo a Natale",https://www.leggo.it/italia/cronache/10_dicembre_2025_famiglia_bosco_briatore_paga_lavori_casa-9237446.html
,aktiencheck.de,PCB Bancorp Aktie : Institutionelle steigen ein (),https://www.aktiencheck.de/news/Artikel-PCB_Bancorp_Aktie_Institutionelle_steigen-19291121
,ashleycountyledger.com,French special forces helped Benin after attempted coup : military,https://www.ashleycountyledger.com/news/national/french-special-forces-helped-benin-after-attempted-coup-military/article_c79db014-27eb-5037-8a68-eac6b60b4675.html
,kompas.com,BPOM Temukan 13 Kosmetik Menyesatkan dengan Klaim Memperbaiki Fungsi Vital Pria,https://www.kompas.com/jawa-barat/read/2025/12/10/201500788/bpom-temukan-13-kosmetik-menyesatkan-dengan-klaim-memperbaiki-fungsi
,elperiodico.com.do,Gigantes del Cibao incorporan a Fernando Abad | Elperiodico . com . do,https://elperiodico.com.do/2025/12/10/gigantes-del-cibao-refuerzan-su-bullpen-con-abad-y-cordero-en-cambio-multiple/
,stiripesurse.ro,Israelul își consolidează coloniile din Cisiordania - Guvernul de la Ierusalim a aprobat definitiv 764 de locuințe în trei așezări,https://www.stiripesurse.ro/israelul-isi-consolideaza-coloniile-din-cisiordania-guvernul-de-la-ierusalim-a-aprobat-definitiv-764-de-locuinte-in-trei-asezari_3839074
,digi24.ro,Profesorii protestează în Piața Victoriei : „ Demnitatea nu se negociază . Sindicatele cer demiterea ministrului Daniel David,https://www.digi24.ro/stiri/actualitate/educatie/profesorii-protesteaza-in-piata-victoriei-demnitatea-nu-se-negociaza-sindicatele-cer-demiterea-ministrului-daniel-david-3540515
,nin.rs,Kvalitet mleka pod lupom : Šta je utvrdila vanredna inspekcijska kontrola,https://www.nin.rs/drustvo/vesti/97713/kvalitet-mleka-pod-lupom-sta-je-utvrdila-vanredna-inspekcijska-kontrola
,focus-news.net,"Икономисти : При амбицията разходите да се задържат над 40 % от БВП , повишаването на данъците става неизбежно",https://www.focus-news.net/novini/Bylgaria/Ikonomisti-Pri-ambiciyata-razhodite-da-se-zadurzhat-nad-40-ot-BVP-povish-2816306
,middleeastmonitor.com,Iraq removes Hezbollah and Houthis from terror asset - freeze list after  administrative error  – Middle East Monitor,https://www.middleeastmonitor.com/20251210-iraq-removes-hezbollah-and-houthis-from-terror-asset-freeze-list-after-administrative-error/
,abladvisor.com,Runway Growth Capital Adds McCarthy as Managing Director - News,https://www.abladvisor.com/news/42049/runway-growth-capital-adds-mccarthy-as-managing-director
,finanznachrichten.de,Hazeltree Finds Consumer Shorts Hit New Highs ; Software & Services Back in the Crosshairs,https://www.finanznachrichten.de/nachrichten-2025-12/67197684-hazeltree-finds-consumer-shorts-hit-new-highs-software-services-back-in-the-crosshairs-004.htm
,tamindir.com,vivodan Çok Ucuz Telefon Geliyor ! 8 GB RAM ve Dahası,https://www.tamindir.com/haber/vivo-t5x-sertifika-aldi_102637/
,click2houston.com,Why Gov . Greg Abbott wants to let taxpayers decide whether cities can raise or cut taxes,https://www.click2houston.com/news/texas/2025/12/10/why-gov-greg-abbott-wants-to-let-taxpayers-decide-whether-cities-can-raise-or-cut-taxes/
,eldestapeweb.com,Los refuerzos que busca Boca hoy en el mercado de pases 2026 : posibles altas y rumores,https://www.eldestapeweb.com/deportes/boca-juniors/los-refuerzos-que-busca-boca-hoy-posibles-altas-y-rumores-20251210103017
,lrytas.lt,"Lrytas – žinios , kurios šviečia . Atsinaujinome , kad šviestume dar ryškiau",https://www.lrytas.lt/verslas/rinkos-pulsas/2025/12/10/news/po-siaubingos-zmogzudystes-kaune-nt-agenturos-reakcija-ivede-nauja-taisykle-40561215/comments
,finanzen.ch,Overweight - Analyse : Barclays Capital bewertet Deutsche Börse - Aktie,https://www.finanzen.ch/nachrichten/aktien/overweight-analyse-barclays-capital-bewertet-deutsche-boerse-aktie-1035632874
,vetogate.com,البنك المركزي : ارتفاع معدل التضخم الأساسي إلى 12 . 5 % في نوفمبر 2025,https://www.vetogate.com/5551185
,digi24.ro,"Guvernul a aprobat noul cadru de colaborare cu OMV Petrom . Redevențele cresc cu 40 %, iar compania renunță la litigii",https://www.digi24.ro/stiri/economie/guvernul-a-aprobat-noul-cadru-de-colaborare-cu-omv-petrom-redeventele-cresc-cu-40-iar-compania-renunta-la-litigii-3540495
,thanhnien.vn,10 ô tô bán chạy nhất Việt Nam tháng 11 . 2025 : VinFast làm chủ cuộc đua,https://thanhnien.vn/10-o-to-ban-chay-nhat-viet-nam-thang-112025-vinfast-lam-chu-cuoc-dua-18525121015223147.htm
,yenikonya.com.tr,Yenilikçi girişimlerde öne çıkan sektörler belli oldu,https://www.yenikonya.com.tr/ekonomi/yenilikci_girisimlerde_one_cikan_sektorler_belli_oldu-1966291
,express.co.uk,Fox News halted for breaking Donald Trump alert as viewers slam  hoax  claim,https://www.express.co.uk/showbiz/tv-radio/2144669/fox-news-halted-donald-trump-alert-hoax
,hna.de,"Supermarkt - Kunde findet Maggi - Produkt , dann bleibt ihm die Spucke weg – „ Danke , ich geh jetzt ins Kloster",http://www.hna.de/verbraucher/supermarkt-kunde-findet-maggi-produkt-dann-bleibt-ihm-die-spucke-weg-danke-ich-geh-jetzt-ins-kloster-94077676.html
,investor.bg,Трейдърите вече очакват ЕЦБ да вдигне лихвите през 2026 г .,https://www.investor.bg/a/539-banki-i-zastrahovateli/423501-treydarite-veche-ochakvat-etsb-da-vdigne-lihvite-prez-2026-g
,finance.yahoo.com,Morning Minute : JPMorgan Says No Crypto Winter,https://finance.yahoo.com/news/morning-minute-jpmorgan-says-no-133318963.html
,imparcialoaxaca.mx,Capacitan en Nochixtlán sobre uso seguro de Gas LP - El Imparcial de Oaxaca,https://imparcialoaxaca.mx/los-municipios/capacitan-en-nochixtlan-sobre-uso-seguro-de-gas-lp/
,laregione.ch,"Dopo una fase di stallo , riprende lattività delle IPO",https://www.laregione.ch/svizzera/svizzera/1889742/borsa-ipo-miliardi-dollari-societa
,lacapital.com.ar,Qué hizo Tapia en el medio del aplazamiento del sorteo de los torneos y los allanamientos,https://www.lacapital.com.ar/ovacion/que-hizo-tapia-el-medio-del-aplazamiento-del-sorteo-los-torneos-y-los-allanamientos-n10234225.html
,badische-zeitung.de,Unternehmer Achim Wiehle tritt bei der OB - Wahl in Freiburg an,https://www.badische-zeitung.de/unternehmer-achim-wiehle-tritt-bei-der-ob-wahl-in-freiburg-an?commentID=a8f16ea9-7e7f-430d-b920-d6ea409fdd53
,163.com,祥源系  理财兑付危机背后 ， 爆雷前夕仍豪掷22亿入主海昌海洋公园 ！ 旗下上市公司一边收购 ， 一边抵押融资|房地产,https://www.163.com/dy/article/KGERQL520530KP1K.html
,trend.az,Tajikistan seeks expanded financing for Rogun hydropower at Riyadh forum,https://www.trend.az/business/4128359.html
,finance.people.com.cn,财政部将开展2025年到期续作特别国债发行 -- 经济 · 科技 -- 人民网,http://finance.people.com.cn/n1/2025/1210/c1004-40621671.html
,bursa.ro,PPC va aduce energia sărbătorilor de iarnă în Bucureşti,https://www.bursa.ro/ppc-va-aduce-energia-sarbatorilor-de-iarna-in-bucuresti-67298758
,freshplaza.com,Milestone : 40 years of Vallarta Supermarkets,https://www.freshplaza.com/north-america/article/9793288/milestone-40-years-of-vallarta-supermarkets/
,theitem.com,"Federal Reserve likely to cut rates , may signal just one more reduction next year","http://www.theitem.com/stories/federal-reserve-likely-to-cut-rates-may-signal-just-one-more-reduction-next-year,437220"
,cphpost.dk,"Global institutions upbeat about China economic resilience , growth potential",https://cphpost.dk/2025-12-10/opinion-2/global-institutions-upbeat-about-chinas-economic-resilience-growth-potential/
,eleconomista.es,La CNMV anuncia 31 medidas para agilizar y simplificar trámites en la supervisión,https://www.eleconomista.es/mercados-cotizaciones/noticias/13684320/12/25/la-cnmv-anuncia-31-medidas-para-agilizar-y-simplificar-tramites-en-la-supervision.html
,freshplaza.com,"Export - to - local ratio , opposite of desired in early grape campaign",https://www.freshplaza.com/north-america/article/9793144/export-to-local-ratio-opposite-of-desired-in-early-grape-campaign/
,finanznachrichten.de,"Sannabis S . A . S .: Sannabis , Inc . Director Meets with Colombia Minister of Labor to Expand Weaving Dreams of Freedom Hemp Program for Inmates",https://www.finanznachrichten.de/nachrichten-2025-12/67197720-sannabis-s-a-s-sannabis-inc-director-meets-with-colombia-s-minister-of-labor-to-expand-weaving-dreams-of-freedom-hemp-program-for-inmates-200.htm
,newratings.de,newratings . de,https://www.newratings.de/du/main/company_headline.m?nid=19291131
