published_at,source,title,url
,dailypolitical.com,"Tesla , Inc . $TSLA Shares Sold by Foster Victor Wealth Advisors LLC",https://www.dailypolitical.com/2025/09/25/tesla-inc-tsla-shares-sold-by-foster-victor-wealth-advisors-llc.html
,thedrinksbusiness.com,It us versus the red trouser brigade  - The Drinks Business,https://www.thedrinksbusiness.com/2025/09/its-us-versus-the-red-trouser-brigade/
,arabnet5.com,سعر الدولار في البنوك اليوم الخميس 25 سبتمبر,https://www.arabnet5.com/news/%D3%DA%D1-%C7%E1%CF%E6%E1%C7%D1-%DD%ED-%C7%E1%C8%E4%E6%DF-%C7%E1%ED%E6%E3-%C7%E1%CE%E3%ED%D3-25-%D3%C8%CA%E3%C8%D1-575592
,news.fznews.com.cn,台江区党建引领基层治理暨新就业群体党建工作活动举行 _ 福州 _ 新闻频道 _ 福州新闻网,https://news.fznews.com.cn/taijiang/20250925/eZN2Spk6bw.shtml
,meteoweb.eu,"Energia , fotovoltaico : ENEA studia film plastici per pannelli più efficienti e durevoli",https://www.meteoweb.eu/2025/09/energia-fotovoltaico-enea-studia-film-plastici-per-pannelli-piu-efficienti-e-durevoli/1001841827/
,semana.com,Preocupante dato en cuentas territoriales : en cuatro de cada diez municipios ha caído el recaudo del predial . ¿ De cuánto fue la disminución ?,https://www.semana.com/economia/articulo/preocupante-dato-en-cuentas-territoriales-en-cuatro-de-cada-diez-municipios-ha-caido-el-recaudo-del-predial-de-cuanto-fue-la-disminucion/202514/
,kmintys.lt,SEIMAS PATVIRTINO 20 - OSIOS VYRIAUSYBĖS PROGRAMĄ,https://kmintys.lt/2025/09/25/seimas-patvirtino-20-osios-vyriausybes-programa/
,dailystar.co.uk,Starbucks to sack hundreds of staff and close stores in major $1bn restructure,https://www.dailystar.co.uk/news/world-news/starbucks-sack-hundreds-staff-close-35964817
,samsunhaber.tc,Kimbotlar ! Khloe Kardashian ve Kris Jenner ( bu 100 bin dolarlık faceliftten sonra ) eşleşen cilt - sıkıca Nikeskims Etkinliği,https://www.samsunhaber.tc/eglence/30637/kimbotlar-khloe-kardashian-ve-kris-jenner-bu-100-bin-dolarlik-faceliftten-sonra-eslesen-cilt-sikica-nikeskims-etkinligi/
,australiannews.net,"iotaMotion Surpasses 1 , 000 Clinical Procedures Performed with iotaSOFT -- Defining a New Era in Cochlear Implant Surgery",http://www.australiannews.net/news/278600137/iotamotion-surpasses-1000-clinical-procedures-performed-with-iotasoft-defining-a-new-era-in-cochlear-implant-surgery
,baijiahao.baidu.com,CBMIF2025丨为何是常德 ？,https://baijiahao.baidu.com/s?id=1844224457102148752
,teleborsa.it,"Manovra , Sileoni :  Tassa extraprofitti banche verrebbe pagata dai clienti",https://www.teleborsa.it/News/2025/09/25/manovra-sileoni-tassa-extraprofitti-banche-verrebbe-pagata-dai-clienti-159.html
,interfax.ru,Поправки о продлении мер защиты эндаументов при санкциях до 2029 года принят в I чтении,https://www.interfax.ru/business/1049289
,trojmiasto.pl,Dlaczego warto wybrać Polski Uniwersytet Wirtualny ? 20 lat doświadczenia w e - learningu,https://www.trojmiasto.pl/wiadomosci/Dlaczego-warto-wybrac-Polski-Uniwersytet-Wirtualny-20-lat-doswiadczenia-w-e-learningu-n208591.html
,repubblica.it,"Consumi , agosto chiude con un debole +1 % a valore nonostante le vacanze",https://www.repubblica.it/economia/rapporti/osserva-italia/mercati/2025/09/25/news/consumi_agosto_chiude_con_un_debole_1_a_valore_nonostante_le_vacanze-424869946/
,openpr.de,GenoHotels Baunatal und Forsbach erneut unter den besten Tagungshotels Deutschlands ausgezeichnet,https://www.openpr.de/news/1292651/GenoHotels-Baunatal-und-Forsbach-erneut-unter-den-besten-Tagungshotels-Deutschlands-ausgezeichnet.html
,laosnews.net,"LTIMindtree Launches BlueVerse RightAction for Faster , Safer , and Compliant Enterprise AI",http://www.laosnews.net/news/278599935/ltimindtree-launches-blueverse-rightaction-for-faster-safer-and-compliant-enterprise-ai
,eluniverso.com,Irene Torres : La aceleración de la ignorancia | Columnistas | Opinión,https://www.eluniverso.com/opinion/columnistas/la-aceleracion-de-la-ignorancia-nota/
,portfolio.hu,Valami nagy dolog készül az united states és Kína között,https://www.portfolio.hu/gazdasag/20250925/valami-nagy-dolog-keszul-az-usa-es-kina-kozott-788804
,valorlocal.com.ar,"La ANSES estableció un aumento de 1 , 88 % para las jubilaciones",https://www.valorlocal.com.ar/25/09/2025/la-anses-establecio-un-aumento-de-188-para-las-jubilaciones/
,ghanaweb.com,"0 . 25 oz gold coin selling at GH¢12 , 563 . 89",https://www.ghanaweb.com/GhanaHomePage/business/0-25-oz-gold-coin-selling-at-GH-12-563-89-2002250
,arabianbusiness.com,"Saudi Arabia freezes rent increases in Riyadh for 5 years - Arabian Business : Latest News on the Middle East , Real Estate , Finance , and More",https://www.arabianbusiness.com/industries/real-estate/saudi-arabia-freezes-rent-increases-in-riyadh-for-5-years
,eltiempo.com,"Tragedia en Barranquilla : ya van 11 muertos y varias personas en UCI por consumo de licor adulterado en el mercado , avanzas las investigaciones",https://www.eltiempo.com/colombia/barranquilla/tragedia-en-barranquilla-ya-van-11-muertos-y-varias-personas-en-uci-por-consumo-de-licor-adulterado-en-el-mercado-avanzas-las-investigaciones-3493946
,nasional.kompas.com,Pimpinan DPR ke Bandung Barat Usai Korban Keracunan MBG Tembus 1 . 333 Orang,https://nasional.kompas.com/read/2025/09/25/20164691/pimpinan-dpr-ke-bandung-barat-usai-korban-keracunan-mbg-tembus-1333-orang
,1059thebrew.iheart.com,"Popular  Eatertainment  Chain Faces Closures , Layoffs Amid Bankruptcy",https://1059thebrew.iheart.com/content/2025-09-25-popular-eatertainment-chain-faces-closures-layoffs-amid-bankruptcy/
,finance.yahoo.com,"Ethereum Price Breaks Below $4 , 000 – Is a Deeper Correction Ahead ?",https://finance.yahoo.com/news/ethereum-price-breaks-below-4-131537433.html
,dailypolitical.com,Aspire Capital Advisors LLC Has $3 . 86 Million Stock Holdings in Schwab US Broad Market ETF $SCHB,https://www.dailypolitical.com/2025/09/25/aspire-capital-advisors-llc-has-3-86-million-stock-holdings-in-schwab-us-broad-market-etf-schb.html
,biztoc.com,How To Put $100 In Your Retirement Fund Each Month With Kimberly - Clark Stock,https://biztoc.com/x/3922c56ce7edbe9a
,strategy-business.com,Brand Zealots : Realizing the Full Value of Emotional Brand Loyalty,https://www.strategy-business.com/article/13741
,biztoc.com,Corn Closes Lower Despite More Export Business,https://biztoc.com/x/b4ba49dab27b885a
,evarazdin.hr,"Foto –  Zlatna kuna  ove godine ponovno odlazi u ruke Knauf Insulation , a još su nagrađeni i Burai Software i ATINEL",https://evarazdin.hr/gospodarstvo/foto-zlatna-kuna-ove-godine-ponovno-odlazi-u-ruke-knauf-insulation-a-jos-su-nagradeni-i-burai-software-i-atinel-420372/
,moneyvox.fr,Retraites des fonctionnaires de lEtat : lidée dune caisse autonome,https://www.moneyvox.fr/retraite/actualites/105214/retraites-des-fonctionnaires-de-etat-idee-une-caisse-autonome
,stern.de,Autos : Stellenabbau bei Bosch trifft Homburg –  Bittere Nachricht,https://www.stern.de/gesellschaft/regional/rheinland-pfalz-saarland/autos--stellenabbau-bei-bosch-trifft-homburg----bittere-nachricht--36080218.html
,eldia.com.do,"Condenan a cinco años de prisión a Nicolas Sarkozy , expresidenta de Francia",https://eldia.com.do/condenan-a-cinco-anos-de-prision-a-nicolas-sarkozy-expresidenta-de-francia/
,hna.de,„ Zeiten haben sich geändert : Frankenberg bekommt Katastrophenschutzlager,https://www.hna.de/lokales/frankenberg/frankenberg-eder-ort305273/zeiten-haben-sich-geaendert-frankenberg-bekommt-katastrophenschutzlager-93954416.html
,elpais.com.uy,"Mapfre , la mayor multinacional aseguradora en Latinoamérica",https://www.elpais.com.uy/negocios/empresas/mapfre-la-mayor-multinacional-aseguradora-en-latinoamerica
,finance.yahoo.com,Analyst Says Meta Platforms ( META ) is One of the Best AI Stocks to Buy Now,https://finance.yahoo.com/news/analyst-says-meta-platforms-meta-131433677.html
,internazionale.it,Le quote del cobalto,https://www.internazionale.it/magazine/2025/09/25/le-quote-del-cobalto
,virgilio.it,Una Ferrari così non si vede certo tutti i giorni : versione Mansory 12Cilindri,https://www.virgilio.it/motori/auto/ferrari-12cilindri-mansory/296159/
,ghanaweb.com,Why water bills remain unchanged,https://www.ghanaweb.com/GhanaHomePage/business/Why-water-bills-remain-unchanged-2002227
,dostor.org,سعر الدولار اليوم الخميس 25 سبتمبر 2025 ببداية التعاملات,https://www.dostor.org/5234014
,akm.ru,АРРФР завершило первое климатическое стресс - тестирование банковского сектора Казахстана за 2024 год,https://www.akm.ru/news/arrfr_zavershilo_pervoe_klimaticheskoe_stress_testirovanie_bankovskogo_sektora_kazakhstana_za_2024_g/
,finanznachrichten.de,Laser Thermal Launches FASTR : A New Era in Precision Thermal Metrology,https://www.finanznachrichten.de/nachrichten-2025-09/66536020-laser-thermal-launches-fastr-a-new-era-in-precision-thermal-metrology-200.htm
,manilatimes.net,VESTIAIRE COLLECTIVE RELEASES FIRST MENSWEAR RESALE REPORT AS PART OF ITS MEN CATEGORY LAUNCH,https://www.manilatimes.net/2025/09/25/tmt-newswire/pr-newswire/vestiaire-collective-releases-first-menswear-resale-report-as-part-of-its-mens-category-launch/2190476
,cnnindonesia.com,Yamaha Klaim TKDN Xmax Hampir 100 Persen,https://www.cnnindonesia.com/otomotif/20250925181633-595-1277775/yamaha-klaim-tkdn-xmax-hampir-100-persen
,diariosur.es,La venta de vivienda de segunda mano se frena en Málaga mientras la nueva sigue disparada,https://www.diariosur.es/economia/vivienda/venta-vivienda-segunda-mano-frena-malaga-20250925130304-nt.html
,derrynow.com,New initiative launched to tackle drink spiking in Belfast,https://www.derrynow.com/news/northern-ireland/1903232/new-initiative-launched-to-tackle-drink-spiking-in-belfast.html
,boerse-online.de,"BÖRSE ONLINE – Seit 1987 unterstützt BÖRSE ONLINE jede Woche Anleger bei ihren Investment - Entscheidungen . Zentrale Themen der Berichterstattung sind fundamentale Markt - und Aktienanalysen , Charttechnik , Handelsstrategien sowie verschiedene Trad...",https://www.boerse-online.de/dpa-afx/eqs-dd-simona-aktiengesellschaft-deutsch-472853.html
,australiannews.net,Binance Launches The Blockchain 100 Award to Honor Top Creators Driving Blockchain Innovation,http://www.australiannews.net/news/278599810/binance-launches-the-blockchain-100-award-to-honor-top-creators-driving-blockchain-innovation
,haqqin.az,"Американская Xsolla открывает в Баку мировой R & D - хаб - Интервью с Крисом Хьюишом , президентом Xsolla",https://haqqin.az/news/361152
,arabnews.com,What a  Zucman tax  might mean for France,https://www.arabnews.com/node/2616687
,ilsole24ore.com,"Borsa , Cucinelli giù e sospesa da contrattazioni dopo accuse su attività in Russia",https://www.ilsole24ore.com/art/borsa-brunello-cucinelli-49percento-sospese-contrattazioni-attesa-nota-AHOvfcpC
,lavozdeasturias.es,Duro Felguera sube más de un 30 % en Bolsa a la espera de presentar su plan de viabilidad al juzgado asturiano,https://www.lavozdeasturias.es/noticia/asturias/2025/09/25/duro-felguera-sube-30-bolsa-espera-presentar-plan-viabilidad-juzgado-asturiano/00031758791011187982292.htm
,apfdigital.com.ar,Prematuro fin de la quita de retenciones : las exportaciones del agro ya alcanzaron el cupo de u$s7 . 000 millones,https://www.apfdigital.com.ar/noticias/2025/09/25/438657-prematuro-fin-de-la-quita-de-retenciones-las-exportaciones-del-agro-ya-alcanzaron-el-cupo-de-us7000-millones
,economx.hu,"Összeszedte magát a Wizz Air , csillagos ötös volt az idei nyara",https://www.economx.hu/gazdasag/wizz-air-nyar-fenntarthatosag-rekord-ukrajna.816673.html
,baomoi.com,"Chứng khoán ngày mai , 26 - 9 : Cơ hội giải ngân cổ phiếu thu hút dòng tiền",https://baomoi.com/chung-khoan-ngay-mai-26-9-co-hoi-giai-ngan-co-phieu-thu-hut-dong-tien-c53328695.epi
,valorlocal.com.ar,Se realiza la 21° Jornada de la Industria,https://www.valorlocal.com.ar/25/09/2025/se-realiza-la-21-jornada-de-la-industria/
,manilatimes.net,CareCloud Unveils Marketware as Strategic Growth Solution for Hospitals,https://www.manilatimes.net/2025/09/25/tmt-newswire/globenewswire/carecloud-unveils-marketware-as-strategic-growth-solution-for-hospitals/2190505
,alternatives-economiques.fr,Mettre la réforme des retraites sur pause naurait pas dimpact sur le budget 2026,https://www.alternatives-economiques.fr/mettre-reforme-retraites-pause-naurait-dimpact-budget-2/00116339
,dailypolitical.com,Palumbo Wealth Management LLC Increases Stock Position in Tractor Supply Company $TSCO,https://www.dailypolitical.com/2025/09/25/palumbo-wealth-management-llc-increases-stock-position-in-tractor-supply-company-tsco.html
,nld.com.vn,Cựu Tổng thống Pháp Nicolas Sarkozy nhận án tù 5 năm,https://nld.com.vn/cuu-tong-thong-phap-nicolas-sarkozy-nhan-an-tu-5-nam-196250925193307951.htm
,finanznachrichten.de,New Exante Report Urges Family Offices To Rethink Risk,https://www.finanznachrichten.de/nachrichten-2025-09/66535978-new-exante-report-urges-family-offices-to-rethink-risk-008.htm
,biztoc.com,Analyst Explains Why She Buying Deckers ( DECK ) Amid  Great Global Opportunities,https://biztoc.com/x/c051a4ad20339fda
,techxplore.com,These rural Minnesota towns were clean energy skeptics : Now theyre installing solar,https://techxplore.com/news/2025-09-rural-minnesota-towns-energy-skeptics.html
,udn.com,當大家都擔心美股AI太貴之際 有個產業正在默默崛起 | 股市要聞 | 股市,https://udn.com/news/story/7251/9029898
,energy-storage.news,"NCPA , Aypa Power agree offtake for 400MW San Bernardino BESS",https://www.energy-storage.news/ncpa-and-aypa-power-negotiate-offtake-for-400mw-san-bernardino-bess-includes-attractive-us12-71-kw-month-pricing/
,t3n.de,Update auf One UI 8 : Diese Galaxy - Smartphones können Android 16 schon laden,https://t3n.de/news/oneui-8-galaxy-modelle-update-android-16-1687034/
,ladepeche.fr,Colombie - Britannique : itinéraires choisis pour un road trip inoubliable,https://www.ladepeche.fr/2025/09/25/colombie-britannique-itineraires-choisis-pour-un-road-trip-inoubliable-12952921.php
,birminghammail.co.uk,Nationwide issues announcement  effective from Wednesday  for all customers,https://www.birminghammail.co.uk/news/cost-of-living/nationwide-issues-announcement-effective-wednesday-32550827
,vneconomy.vn,FDI Việt Nam 8 tháng : Tăng trưởng mạnh mẽ và triển vọng,https://vneconomy.vn/thu-hut-fdi-8-thang-tiep-tuc-dien-bien-tich-cuc.htm
,civonline.it,"Realme GT 8 Pro , in arrivo il flagship con Snapdragon 8",https://www.civonline.it/italia-e-mondo/realme-gt-8-pro-in-arrivo-il-flagship-con-snapdragon-8-y3he31gi
,vneconomy.vn,Phát triển làng nghề - VnEconomy,https://vneconomy.vn/lang-nghe-viet-tu-hoi-sinh-den-khat-vong-xanh-so-va-vuon-xa-hon.htm
,diariodelaltoaragon.es,La CNMV autoriza la nueva oferta de BBVA sobre Sabadell y amplía el plazo hasta el 10 de octubre,https://www.diariodelaltoaragon.es/noticias/actualidad/2025/09/25/la-cnmv-autoriza-la-nueva-oferta-de-bbva-sobre-sabadell-y-amplia-el-plazo-hasta-el-10-de-octubre-1856693-daa.html
,laosnews.net,Foodsure Machines - India Most Trusted Manufacturer of Makhana Processing & Mayonnaise - Making Machines,http://www.laosnews.net/news/278600125/foodsure-machines-india-most-trusted-manufacturer-of-makhana-processing-mayonnaise-making-machines
,hackneygazette.co.uk,Plan a winter escape and save with Ambassador cruise offer,https://www.hackneygazette.co.uk/offers/25493758.plan-winter-escape-save-ambassadors-cruise-offer/
,gazetaexpress.com,"Përfituan 17 . 000 euro duke u marrë para klientëve për biletat dhe akomodimet , arrestohet pronari i agjencisë turistike",https://www.gazetaexpress.com/perfituan-17-000-euro-duke-u-marre-para-klienteve-per-biletat-dhe-akomodimet-arrestohet-pronari-i-agjencise-turistike/
,gala.de,Prinzessin Luisa Maria von Belgien zieht überraschend in die united states,https://www.gala.de/royals/allgemein/prinzessin-luisa-maria-von-belgien-zieht-ueberraschend-in-die-usa-24458722.html
,n.yam.com,中衛中心35週年推動 「 體系 」 有成 協助台灣產業供應鏈創新 強化韌性迎向永續,https://n.yam.com/Article/20250925942422
,scottishlegal.com,Man who struck motorway barrier ordered to pay maintenance contractor just over £8k for repairs,https://www.scottishlegal.com/articles/man-who-struck-motorway-barrier-ordered-to-pay-maintenance-contractor-just-over-ps8k-for-repairs
,calcuttanews.net,SIDBI launches model of cluster development through Development of Industry Associations scheme,http://www.calcuttanews.net/news/278599952/sidbi-launches-model-of-cluster-development-through-development-of-industry-associations-scheme
,vneconomy.vn,Xu hướng tiêu dùng xanh : Cơ hội cho doanh nghiệp,https://vneconomy.vn/xu-huong-tieu-dung-xanh-mo-ra-canh-cua-lon-cho-nha-san-xuat.htm
,thedrinksbusiness.com,Why has Chapel Down scrapped plans for a £32m winery ?,https://www.thedrinksbusiness.com/2025/09/english-wine-is-booming-so-why-has-chapel-down-scrapped-plans-for-a-32m-winery/
,6park.com,对华依赖 ! 13天闹剧结束 : 波兰认怂恢复中欧班列,https://www.6park.com/view/news/747406.html
,blic.rs,"Turistički forum Srbije na Zlatiboru u znaku održivih transformacija : Priliv od turizma od 1 , 578 milijardi evra",https://www.blic.rs/biznis/privreda/turisticki-forum-srbije-na-zlatiboru-u-znaku-odrzivih-transformacija-priliv-od/bjypzgz
,deutschlandfunk.de,Krise der Autobranche - Zulieferer Bosch will weitere 13 . 000 Stellen streichen - vor allem deutsche Standorte betroffen,https://www.deutschlandfunk.de/zulieferer-bosch-will-weitere-13-000-stellen-streichen-vor-allem-deutsche-standorte-betroffen-100.html
,rhein-zeitung.de,Konflikte im Weltall : 35 Milliarden für deutsche « Sicherheitsarchitektur » im All - Politik,https://www.rhein-zeitung.de/deutschland-welt/politik/35-milliarden-fuer-deutsche-sicherheitsarchitektur-im-all_arid-4071267.html
,miragenews.com,Von Der Leyen Bolsters EU Ties at UN Assembly in NYC,https://www.miragenews.com/von-der-leyen-bolsters-eu-ties-at-un-assembly-1540875/
,lanouvelle.net,De nouvelles installations mieux adaptées aux besoins de lAssociation pour lintégration sociale - La Nouvelle Union et LAvenir de l  Érable,https://www.lanouvelle.net/faits-divers/de-nouvelles-installations-mieux-adaptees-aux-besoins-de-lassociation-pour-lintegration-sociale/
,baijiahao.baidu.com,再陷网络域名纠纷 ？ 一博主称被始祖鸟拖欠3万元域名费未给,https://baijiahao.baidu.com/s?id=1844241695696541672
,futures.cnfol.com,棕榈油市场观察 ： 外围利好提振 ， 连涨两日站稳4400林吉特关口 _ 期市动态 _ 期货 _ 中金在线,http://futures.cnfol.com/qishidongtai/20250925/31673634.shtml
,arabnews.com,"Saudi Arabia , OIC officials discuss labor issues in Baku",https://www.arabnews.com/node/2616690/saudi-arabia
,blog.wenxuecity.com,即将分崩离析的美国 （ 2 . 2 ）： 牵绳弄政犹太人 - 博客,https://blog.wenxuecity.com/myblog/46175/202509/19847.html
,africanbusinessreview.co.za,"Emily Willis Net Worth 2025 : Career , Health & Life Story - africanbusinessreview . co . za",https://www.africanbusinessreview.co.za/emily-willis-net-worth/
,dnews.gr,"Στην πώληση του 5 , 09 % της AKTOR Group προχώρησε ο Σωκράτης Κόκκαλης – Το καθαρό όφελος της αποεπένδυσης",https://www.dnews.gr/eidhseis/business-news/547535/stin-polisi-tou-5-09-tis-aktor-group-proxorise-o-sokratis-kokkalis-to-katharo-ofelos-tis-apoependysis
,cnnindonesia.com,KPK Buka Peluang Pakai Pasal TPPU di Kasus Kuota Haji Kemenag,https://www.cnnindonesia.com/nasional/20250925192824-12-1277805/kpk-buka-peluang-pakai-pasal-tppu-di-kasus-kuota-haji-kemenag
,propakistani.pk,FBR Debunks Social Media Rumors : No Changes Made to Tax Return Form 2025,https://propakistani.pk/2025/09/25/fbr-debunks-social-media-rumors-no-changes-made-to-tax-return-form-2025/
,taz.de,Kostenxplosion bei Gefängnisbau : Großknast wird zur Dauerbaustelle,https://taz.de/Kostenxplosion-bei-Gefaengnisbau/!6103668/
,24heures.ch,"Achat à l  étranger : les Suisses ont dépensé 9 , 2 milliards en 2025",https://www.24heures.ch/achat-a-letranger-les-suisses-ont-depense-9-2-milliards-en-2025-740965041126
,hwupgrade.it,Huawei Watch GT 6 e GT 6 Pro già in sconto su Amazon : promo con FreeBuds inclusi e confronto con GT 5,https://www.hwupgrade.it/news/wearables/huawei-watch-gt-6-e-gt-6-pro-gia-in-sconto-su-amazon-promo-con-freebuds-inclusi-e-confronto-con-gt-5_143987.html
,pbagora.com.br,A falta de saúde econômica do Brasil,https://www.pbagora.com.br/noticia/paraiba/a-falta-de-saude-economica-do-brasil/
,humanite.fr,Papa Trump vole au secours de Javier Milei et du Peso qui dégringole - Le billet de Maurice Ulrich - 25 septembre 2025,https://www.humanite.fr/en-debat/argentine/papa-trump-vole-au-secours-de-javier-milei-et-du-peso-qui-degringole
,postandcourier.com,Breeze lines up 1st international flight from Charleston,https://www.postandcourier.com/business/tourism/breeze-airways-charleston-international-cancun-flight/article_3b4711b3-7505-47f8-907c-2c59f85fa782.html
,insurancebusinessmag.com,The AI edge : businesses harness new tech to combat cyber threats,https://www.insurancebusinessmag.com/au/news/cyber/the-ai-edge-businesses-harness-new-tech-to-combat-cyber-threats-550913.aspx
,vneconomy.vn,"Khi tiền tự động sinh lời , người Việt ngày càng tối ưu dòng tiền cùng tài chính thông minh",https://vneconomy.vn/khi-tien-tu-dong-sinh-loi-nguoi-viet-ngay-cang-toi-uu-dong-tien-cung-tai-chinh-thong-minh.htm
,elconfidencial.com,"Hipotecas baratas , exenciones fiscales ... Un plan europeo para el problema de la vivienda",https://www.elconfidencial.com/inmobiliario/residencial/2025-09-25/vivienda-crisis-parlamento-europeo-informe_4216062/
,mix931fm.com,Smart Texas Tips to Protect Your Inheritance and Savings,https://mix931fm.com/how-texans-lose-their-inheritance-in-just-5-years/
,gala.de,Carla Bruni : Erste Worte nach Verurteilung von Nicolas Sarkozy,https://www.gala.de/stars/news/carla-bruni--erste-worte-nach-verurteilung-von-nicolas-sarkozy-24459066.html
,samsunhaber.tc,James Cameron Lights Pandora Ablaze yeni zorlanmalı  Avatar : Ateş ve Ash  Fragman,https://www.samsunhaber.tc/eglence/30628/james-cameron-lights-pandora-ablaze-yeni-zorlanmali-avatar-ates-ve-ash-fragman/
,diyarbakirsoz.com,"KAN BAĞIŞINDA BULUNDU , DUYARLILIK ÇAĞRISI YAPTI",https://www.diyarbakirsoz.com/diyarbakir/kan-bagisinda-bulundu-duyarlilik-cagrisi-yapti-560900
,dailypolitical.com,"LeConte Wealth Management LLC Buys New Position in Robinhood Markets , Inc . $HOOD",https://www.dailypolitical.com/2025/09/25/leconte-wealth-management-llc-buys-new-position-in-robinhood-markets-inc-hood.html
,tribunnews.com,Oknum Prajurit TNI yang Diduga Pukul Staf Artis Zaskia Mecca Ditahan di Denpom Jaya 1 / Cijantung,https://www.tribunnews.com/metropolitan/7733607/oknum-prajurit-tni-yang-diduga-pukul-staf-artis-zaskia-mecca-ditahan-di-denpom-jaya-1cijantung
,saude.ig.com.br,Guerreira não é mais um elogio para nós mulheres,https://saude.ig.com.br/colunas/carla-brandao/2025-09-25/guerreira-nao-e-mais-um-elogio-para-nos-mulheres.html
,cantechletter.com,EDC and INA announce CAD$825 million strategic partnership to expand Canada - Indonesia investment opportunities,https://www.cantechletter.com/newswires/edc-and-ina-announce-cad825-million-strategic-partnership-to-expand-canada-indonesia-investment-opportunities/
,internazionale.it,Il futuro nelle alghe,https://www.internazionale.it/magazine/svenja-beller/2025/09/25/il-futuro-nelle-alghe
,setn.com,興富發南台灣讓利戰開打 ！ 台南新推案3字頭搶市 Q4三大案總銷478億 | 房產 | 三立新聞網 SETN . COM,https://www.setn.com/News.aspx?NewsID=1725761
,thecourier.com.au,2026 Toyota LandCruiser Hybrid review : Quick drive,https://www.thecourier.com.au/story/9075126/2026-toyota-landcruiser-hybrid-review-quick-drive/
,thoibaotaichinhvietnam.vn,Thứ trưởng Bộ Tài chính Cao Anh Tuấn là Ủy viên Ban Chỉ đạo Đổi mới và Phát triển doanh nghiệp,https://thoibaotaichinhvietnam.vn/thu-truong-bo-tai-chinh-cao-anh-tuan-la-uy-vien-ban-chi-dao-doi-moi-va-phat-trien-doanh-nghiep-183861.html
,minutouno.com,INDEC da a conocer este jueves el dato de pobreza : ¿ baja del 35 por ciento ?,https://www.minutouno.com/economia/indec-da-conocer-este-jueves-el-dato-pobreza-baja-del-35-ciento-n6194731
,dailypolitical.com,Penn Davis Mcfarland Inc . Has $17 . 77 Million Stock Position in Las Vegas Sands Corp . $LVS,https://www.dailypolitical.com/2025/09/25/penn-davis-mcfarland-inc-has-17-77-million-stock-position-in-las-vegas-sands-corp-lvs.html
,wsbradio.com,"He the budget scorekeeper for Congress . Lately , it been a tough job",https://www.wsbradio.com/news/hes-budget/4AVQX3WXRJFTNM2NNTK7KJGIEI/
,atvlive.tv,Fifi me deklaratë të fortë : Njerëzit janë lodhur me muzikë bastarde,https://atvlive.tv/fifi-me-deklarate-te-forte-njerezit-jane-lodhur-me-muzike-bastarde/
,journaldemontreal.com,"« La guerre de surenchère , ça na plus de sens !» : Ils distribuent des lettres dans lespoir de trouver une maison",https://www.journaldemontreal.com/2025/09/25/surchauffe-immobiliere--ils-distribuent-des-lettres-dans-lespoir-de-trouver-une-maison
,standaard.be,Franse ex - president Sarkozy moet naar cel na veroordeling tot vijf jaar :  Dit is een schandaal,https://www.standaard.be/buitenland/franse-ex-president-sarkozy-moet-naar-cel-na-veroordeling-tot-vijf-jaar-dit-is-een-schandaal/92873328.html
