published_at,source,title,url
,culture.southcn.com,国庆假期第二日 ， 广东4A级及以上景区接待游客461 . 5万人次 _ 南方网,https://culture.southcn.com/node_b02a77b893/86956475c9.shtml
,cranestodaymagazine.com,Wolffkran united kingdom leadership changes - Cranes Today,https://www.cranestodaymagazine.com/news/wolffkran-uk-leadership-changes/
,lecourrier.vn,Côte dIvoire : le prix du cacao fixé à un niveau record,https://lecourrier.vn/cote-divoire-le-prix-du-cacao-fixe-a-un-niveau-record/1292092.html
,newjerseytelegraph.com,Konica Minolta Inspires the Next Generation of Print Innovators with Advanced Embellishment Technology,http://www.newjerseytelegraph.com/news/278613728/konica-minolta-inspires-the-next-generation-of-print-innovators-with-advanced-embellishment-technology
,vnexpress.net,Bốn hướng làm chủ công nghệ chiến lược Việt Nam,https://vnexpress.net/bon-huong-lam-chu-cong-nghe-chien-luoc-viet-nam-4946546.html
,investegate.co.uk,Holding ( s ) in Company | Company Announcement,https://www.investegate.co.uk/announcement/rns/just-group--just/holding-s-in-company/9146943
,propertyweek.com,New towns : how will the government deliver on its grand plans ?,https://www.propertyweek.com/analysis/new-towns-how-will-the-government-deliver-on-its-grand-plans
,spravy.pozri.sk,"Pellegrini odlieta na pracovnú cestu do Talianska , navštívi Miláno a Janov",https://spravy.pozri.sk/clanok/pellegrini-odlieta-na-pracovnu-cestu-do-talianska-navstivi-milano-a-janov/1601842
,gva.be,"Italiaanse politie valt binnen op tentoonstelling van Dalí , waar 21 werken vervalsingen blijken te zijn",https://www.gva.be/buitenland/italiaanse-politie-valt-binnen-op-tentoonstelling-van-dali-waar-21-werken-vervalsingen-blijken-te-zijn/94604013.html
,dailypolitical.com,Parker - Hannifin Corporation $PH Shares Purchased by ASR Vermogensbeheer N . V .,https://www.dailypolitical.com/2025/10/02/parker-hannifin-corporation-ph-shares-purchased-by-asr-vermogensbeheer-n-v.html
,elperiodicomediterraneo.com,CARBÓN TRUMP | EEUU trata de resucitar el carbón como fuente de energía con 625 millones de dólares,https://www.elperiodicomediterraneo.com/medio-ambiente/2025/10/02/eeuu-trata-resucitar-carbon-fuente-122195141.html
,interfax.ru,Uniper закрывает одно из своих газохранилищ объемом 1 млрд куб . м,https://www.interfax.ru/business/1050501
,diariopanorama.com,El infierno astral del Gobierno - Diario Panorama,https://www.diariopanorama.com/noticia/530578/infierno-astral-gobierno
,stockbiz.vn,Chưa từng có : Mỹ thử nghiệm phát 12 . 000 USD tiền số mỗi người để hỗ trợ người thu nhập thấp,https://stockbiz.vn/tin-tuc/chua-tung-co-my-thu-nghiem-phat-12000-usd-tien-so-moi-nguoi-de-ho-tro-nguoi-thu-nhap-thap/35776279
,pr-inside.com,APOZ is Getting Ready for the Very First Space Capsule Home Production ...,https://www.pr-inside.com/apoz-is-getting-ready-for-the-very-first-space-capsule-home-production-r5140583.htm
,diariodenavarra.es,Un experto advierte sobre los modelos que más problemas causan :  No compres estos coches,https://www.diariodenavarra.es/noticias/vivir/motor/2025/10/02/experto-advierte-sobre-modelos-problemas-causan-no-compres-coches-662309-3194.html
,economictimes.indiatimes.com,"Grey Anatomy  Season 22 : When the new season coming to Netflix ? Check date , cast , plot , and other details",https://economictimes.indiatimes.com/news/new-updates/greys-anatomy-season-22-when-the-new-season-coming-to-netflix-check-date-cast-plot-and-other-details/articleshow/124274395.cms
,etfdailynews.com,Sage Rhino Capital LLC Cuts Holdings in JPMorgan Chase & Co . $JPM,https://www.etfdailynews.com/2025/10/02/sage-rhino-capital-llc-cuts-holdings-in-jpmorgan-chase-co-jpm/
,163.com,3600亿港元 ，「 中国金王 」 陈景河港交所敲锣 ！,https://www.163.com/dy/article/KAT48PI00511UULO.html
,en.tempo.co,Danantara Affirms Patriot Bonds Participation Is Fully Voluntary,https://en.tempo.co/read/2053803/danantara-affirms-patriot-bonds-participation-is-fully-voluntary
,scottishhousingnews.com,Richard Meade : SFHA influence means Housing Bill will strengthen homelessness prevention efforts,https://www.scottishhousingnews.com/articles/richard-meade-sfhas-influence-means-housing-bill-will-strengthen-homelessness-prevention-efforts
,europapress.es,Bruselas avisa del riesgo de que el  botón de apagado  de Tesla y BYD esté en EEUU o China en vez de Europa,https://www.europapress.es/motor/sector-00644/noticia-bruselas-avisa-riesgo-boton-apagado-tesla-byd-eeuu-china-vez-europa-20251002143815.html
,biztoc.com,"Even As A Free Man , Ross Ulbricht Still Under Fire",https://biztoc.com/x/749c872356e32f51
,elperiodicomediterraneo.com,Calachica : el  beach club  de Cádiz donde saborear atún rojo de almadraba,https://www.elperiodicomediterraneo.com/ocio/gastronomia/2025/10/02/calachica-restaurante-cadiz-atun-rojo-almadraba-122197369.html
,europapress.es,Ayuntamiento de Burgos bonificará un 75 % del coste de instalaciones deportivas,https://www.europapress.es/castilla-y-leon/noticia-ayuntamiento-burgos-bonificara-75-coste-instalaciones-deportivas-20251002132128.html
,rp.pl,Większość Polaków oczekuje promocji w sklepach,https://www.rp.pl/handel/art43112791-sklepy-pod-sciana-musi-byc-taniej
,defenseworld.net,Financial Enhancement Group LLC Sells 252 Shares of NVIDIA Corporation $NVDA,https://www.defenseworld.net/2025/10/02/financial-enhancement-group-llc-sells-252-shares-of-nvidia-corporation-nvda.html
,puranoticia.pnt.cl,Ministro de Hacienda culpa al Congreso por incumplimiento de regla fiscal :  No aprobó leyes,https://puranoticia.pnt.cl/nacional/ministro-de-hacienda-culpa-al-congreso-por-incumplimiento-de-regla-fiscal
,expressandstar.com,"Sedgley Ladies Walk clinic and library  safe for the time being , says Dudley MP Sonia Kumar",https://www.expressandstar.com/news/local-hubs/dudley/sedgley/2025/10/02/sedgleys-ladies-walk-clinic-and-library-safe-for-the-time-being-says-dudley-mp-sonia-kumar/
,eenadu.net,Chandrababu : ఆర్థికంగా ఎదిగినా మూలాల్ని మరువొద్దు : సీఎం చంద్రబాబు,https://www.eenadu.net/telugu-news/districts/amaravati-krishna-cm-chandrababu-participated-in-khadi-santha-program/6/125180784
,akm.ru,ГАП « Ресурс » В . Наурузова поставила на индийский рынок 50 тыс . т подсолнечного масла,https://www.akm.ru/news/gap_resurs_v_nauruzova_postavila_na_indiyskiy_rynok_50_tys_t_podsolnechnogo_masla/
,stockbiz.vn,"Tung hàng trăm tỷ  gom  cổ phiếu Việt Nam trong phiên giảm điểm , tự doanh CTCK săn lùng mã nào nhiều nhất ?",https://stockbiz.vn/tin-tuc/tung-hang-tram-ty-gom-co-phieu-viet-nam-trong-phien-giam-diem-tu-doanh-ctck-san-lung-ma-nao-nhieu-nhat/35776135
,meinbezirk.at,"Astens Ortschef geht in Ruhestand :  Aufhören , wenn es am schönsten ist",https://www.meinbezirk.at/enns/c-politik/aufhoeren-wenn-es-am-schoensten-ist_a7678993
,dailypolitical.com,Ewa LLC Buys 26 Shares of Intuit Inc . $INTU,https://www.dailypolitical.com/2025/10/02/ewa-llc-buys-26-shares-of-intuit-inc-intu.html
,liputan6.com,"Resmi Berdiri , Bank Syariah Nasional Luncurkan Nama dan Logo Baru",https://www.liputan6.com/bisnis/read/6174606/resmi-berdiri-bank-syariah-nasional-luncurkan-nama-dan-logo-baru
,yahoo.com,"US memo to colleges proposes terms on ideology , foreign enrollment for federal funds",https://www.yahoo.com/news/articles/us-memo-colleges-proposes-terms-125150130.html
,dailypolitical.com,"Kennebec Savings Bank Has $128 , 000 Holdings in IDEXX Laboratories , Inc . $IDXX",https://www.dailypolitical.com/2025/10/02/kennebec-savings-bank-has-128000-holdings-in-idexx-laboratories-inc-idxx.html
,g1.globo.com,Dona do ChatGPT se torna a maior startup do mundo,https://g1.globo.com/inovacao/noticia/2025/10/02/dona-do-chatgpt-e-avaliada-em-us-500-bilhoes-e-se-torna-a-maior-startup-do-mundo-dizem-agencias.ghtml
,ole.com.ar,Inter de Porto Alegre empató en el segundo partido de Ramón Díaz,https://www.ole.com.ar/futbol-internacional/america/ramon-diaz-inter-porto-alegre-empate-corinthians_0_bIYUkDSM7T.html
,naslovi.net,"Lažne dojave o bombama u mnogim školama u Srbiji , policija na terenu , u pojedinim otkazana nastava",https://naslovi.net/2025-10-02/rtv/lazne-dojave-o-bombama-u-mnogim-skolama-u-srbiji-policija-na-terenu-u-pojedinim-otkazana-nastava/40589276
,tempo.co,"Semen Baturaja : Industri Kelebihan Suplai , Asosiasi Proyeksikan hingga 2030",https://www.tempo.co/ekonomi/semen-baturaja-industri-kelebihan-suplai-asosiasi-proyeksikan-hingga-2030-2075654
,pr-inside.com,Ondas Places Initial Order for Wasp Attritable Drones from Rift Dynamics ...,https://www.pr-inside.com/ondas-places-initial-order-for-wasp-attritable-drones-from-rift-dynamics-r5140574.htm
,pr-inside.com,Konica Minolta Inspires the Next Generation of Print Innovators with ...,https://www.pr-inside.com/konica-minolta-inspires-the-next-generation-of-print-innovators-with-r5140591.htm
,biztoc.com,Secondary stock sale pegs OpenAI valuation at $500 billion,https://biztoc.com/x/6b681ccc227f9617
,nos.nl,"Wonen in vakantiehuisjes  onuitvoerbaar  door huurtoeslag , waarschuwt Dienst Toeslagen",https://nos.nl/artikel/2584887-wonen-in-vakantiehuisjes-onuitvoerbaar-door-huurtoeslag-waarschuwt-dienst-toeslagen
,defenseworld.net,NVIDIA Corporation $NVDA Shares Sold by Seascape Capital Management,https://www.defenseworld.net/2025/10/02/nvidia-corporation-nvda-shares-sold-by-seascape-capital-management.html
,zeit.de,Elektroauto - Hersteller : Ende der US - Elektroprämie bringt Tesla Verkaufsrekord,https://www.zeit.de/news/2025-10/02/ende-der-us-elektropraemie-bringt-tesla-verkaufsrekord
,ziare.com,"Contractul pentru achiziția corvetei ușoare din Turcia va fi semnat în luna noiembrie , spune ministrul Apărării :  Va veni şi un sistem de rachete american",https://ziare.com/mapn/corveta-turcia-semnare-contract-sistem-rachete-sua-1967852
,vnexpress.net,Nhà đồng sáng lập xuất hiện không  cứu  nổi giá Pi Network,https://vnexpress.net/nha-dong-sang-lap-xuat-hien-khong-cuu-noi-gia-pi-network-4946478.html
,borehamwoodtimes.co.uk,"Scrapping landmark legislation risks future jobs , says Tory ex - climate chief",https://www.borehamwoodtimes.co.uk/news/national/25512080.scrapping-landmark-legislation-risks-future-jobs-says-tory-ex-climate-chief/
,themarketsdaily.com,"Greenleaf Trust Sells 146 Shares of Quanta Services , Inc . $PWR",https://www.themarketsdaily.com/2025/10/02/greenleaf-trust-sells-146-shares-of-quanta-services-inc-pwr.html
,clarin.com,Boom de consumo de huevos en Argentina : se transformó en el segundo alimento más importante en la dieta y avanzan en un nuevo envase,https://www.clarin.com/rural/boom-consumo-huevos-argentina-transformo-segundo-alimento-importante-dieta-avanzan-nuevo-envase_0_aPwg0SOcyf.html
,nuevodiarioweb.com.ar,Otro mensaje de EEUU  salva  a Milei en un día que se perfilaba complicado,https://www.nuevodiarioweb.com.ar/politica/otro-mensaje-de-eeuu-salva-a-milei-en-un-dia-que-se-perfilaba-complicado.htm
,01net.com,"Tout juste dévoilé , le Roborock Qrevo Curv 2 Pro révolutionne le ménage",https://www.01net.com/actualites/tout-juste-devoile-le-roborock-qrevo-curv-2-pro-revolutionne-le-menage.html
,nyunews.com,How an NYU alum is filling NYC Erewhon - sized hole - Washington Square News,https://nyunews.com/culture/food/2025/10/02/meadow-lane-sammy-nussdorf/
,en.tempo.co,"Minister Purbaya : Govt to Run Random Inspections on Customs , Excise Green Lane",https://en.tempo.co/read/2053618/minister-purbaya-govt-to-run-random-inspections-on-customs-excise-green-lane
,newjerseytelegraph.com,ReElement Technologies Provides Update on Significant Expansion of Rare Earth and Critical Mineral Refining Capacity at Marion Supersite,http://www.newjerseytelegraph.com/news/278613682/reelement-technologies-provides-update-on-significant-expansion-of-rare-earth-and-critical-mineral-refining-capacity-at-marion-supersite
,accesswdun.com,"Berkshire Hathaway to pay $9 . 7 billion for OxyChem , potentially Buffett last big deal",https://accesswdun.com/ap_article/berkshire-hathaway-to-pay-9-7-billion-for-oxychem-potentially-buffetts-last-big-deal
,interfax.ru,EP Group Кржетинского выйдет из сталелитейного бизнеса Thyssenkrupp,https://www.interfax.ru/business/1050504
,kn-online.de,Warum Eckernförde auf sein neues Kino verzichten muss,https://www.kn-online.de/lokales/rendsburg-eckernfoerde/warum-eckernfoerde-auf-sein-neues-kino-verzichten-muss-MD5N2OGTPBHKPBETPQR62SY5ME.html
,irishmirror.ie,Shoppers rave over Next  lovely and comfy  wide leg jeans - and theyre less than €40,https://www.irishmirror.ie/lifestyle/shoppers-rave-over-nexts-lovely-36003458
,ta3.com,"Obce platia cenu za úspory štátu . Starostovia budú škrtať a prepúšťať , a to sa dotkne nás všetkých",https://www.ta3.com/clanok/1014243/obce-platia-cenu-za-uspory-statu-starostovia-budu-skrtat-a-prepustat-a-to-sa-dotkne-nas-vsetkych
,onvista.de,Aktien Frankfurt : Dax steigt kräftig und nähert sich Rekordhoch,https://www.onvista.de/news/2025/10-02-aktien-frankfurt-dax-steigt-kraeftig-und-naehert-sich-rekordhoch-0-10-26435895
,en.vietnamplus.vn,Vietnam joins Namdo International Culinary Expo in RoK province,https://en.vietnamplus.vn/vietnam-attends-namdo-international-culinary-expo-in-rok-province-post329671.vnp
,163.com,都在喊没钱 ， 钱到底去哪儿了 ？ 这4个真相扎心了,https://www.163.com/dy/article/KAT3KE6S0553AF6B.html
,ots.at,Zehetner gibt Einblicke in Tourismus - Strategie  Vision T,https://www.ots.at/presseaussendung/OTS_20251002_OTS0151/zehetner-gibt-einblicke-in-tourismus-strategie-vision-t
,defenseworld.net,NVIDIA Corporation $NVDA Holdings Increased by Legacy Capital Group California Inc .,https://www.defenseworld.net/2025/10/02/nvidia-corporation-nvda-holdings-increased-by-legacy-capital-group-california-inc.html
,vecer.com,V Maribor prihaja srbski patriarh Porfirije :  To je velik in zgodovinski dan za Mariborčane,https://vecer.com/maribor/aktualno/v-maribor-prihaja-srbski-patriarh-porfirije-to-je-velik-in-zgodovinski-dan-za-mariborcane-10393770
,wataugademocrat.com,Watauga County Health Inspections,https://www.wataugademocrat.com/main_street/watauga-county-health-inspections/article_27e925ea-581c-46bb-8a51-3762f1fccf52.html
,funkytaurusmedia.com,Funky Taurus Media - Music Photo Agency & Products,https://www.funkytaurusmedia.com/shop_content.php?coID=2&XTCsid=kq6evovvugfk3bnflqchl66261
,kurier.at,Rektor abberufen und angezeigt : Was ist los an der Pädagogischen Hochschule NÖ ?,https://kurier.at/chronik/niederoesterreich/rektor-paedagogische-hochschule-noe-erwin-rauscher/403089586
,divyamarathi.bhaskar.com,"Car Sales Surge 45 % In September : Tata Motors Becomes Second Largest Car Seller , Beats Hyundai And Mahindra | कमी GSTव उत्सवी ऑफर्समुळे कार विक्रीत 45 % वाढ : टाटाने सर्वाधिक 9 , 191 EV विकल्या , ह्युंदाई - महिंद्राला मागे टाकत दुसऱ्या क्रमांकावर",https://divyamarathi.bhaskar.com/tech-auto/auto/news/tata-motors-beats-hyundai-mahindra-second-largest-car-seller-september-sales-45-surge-136070399.html
,foxbusiness.com,Experts predict minimal market impact from new government shutdown,https://www.foxbusiness.com/markets/government-shutdown-begins-analysts-say-markets-historically-weather-disruptions-well
,themarketsdaily.com,"Woodward Diversified Capital LLC Has $506 , 000 Holdings in iShares Gold Trust $IAU",https://www.themarketsdaily.com/2025/10/02/woodward-diversified-capital-llc-has-506000-holdings-in-ishares-gold-trust-iau.html
,pr-inside.com,E - Cite Motors ( VAPR ) Eliminates Over 3 . 3 Million Potentially Dilutive ...,https://www.pr-inside.com/e-cite-motors-vapr-eliminates-over-3-3-million-potentially-dilutive-r5140589.htm
,pr-inside.com,Affiliate of Pacific Avenue Capital Partners Completes the Acquisition ...,https://www.pr-inside.com/affiliate-of-pacific-avenue-capital-partners-completes-the-acquisition-r5140580.htm
,cnbc.com,Report shows hiring at lowest since 2009 as economists turn to alternative data during shutdown blackout,https://www.cnbc.com/2025/10/02/report-shows-hiring-at-lowest-since-2009-as-economists-turn-to-alternative-data-during-shutdown-blackout.html
,correiodopovo.com.br,"Pode haver impacto negativo no PIB dos EUA por conta do shutdown , diz secretário do Tesouro",https://www.correiodopovo.com.br/not%c3%adcias/mundo/pode-haver-impacto-negativo-no-pib-dos-eua-por-conta-do-shutdown-diz-secretario-do-tesouro-1.1654482
,themarketsdaily.com,Schwab US Dividend Equity ETF $SCHD Shares Acquired by TPG Advisors LLC,https://www.themarketsdaily.com/2025/10/02/schwab-us-dividend-equity-etf-schd-shares-acquired-by-tpg-advisors-llc.html
,gentedigital.es,CCOO dice que si no cambia el modelo productivo seguirá  la inestable y cíclica dinámica  del mercado laboral regional,http://www.gentedigital.es/santander/noticia/4165181/ccoo-dice-que-si-no-cambia-el-modelo-productivo-seguira-la-inestable-y-ciclica-dinamica-del-mercado-laboral-regional/
,stockbiz.vn,Bệ phóng cho logistics và thương mại điện tử Việt Nam vươn ra thế giới,https://stockbiz.vn/tin-tuc/be-phong-cho-logistics-va-thuong-mai-dien-tu-viet-nam-vuon-ra-the-gioi/35776412
,stockbiz.vn,Bất động sản Việt Nam đang chứng kiến sự xuất hiện trở lại của một thế hệ Việt kiều,https://stockbiz.vn/tin-tuc/bat-dong-san-viet-nam-dang-chung-kien-su-xuat-hien-tro-lai-cua-mot-the-he-viet-kieu/35776377
,diariopanorama.com,"Milei defendió a Espert , rechazó las críticas de Cavallo y comparó a Scott Bessent con Messi",https://www.diariopanorama.com/noticia/530587/milei-defendio-espert-rechazo-criticas-cavallo-comparo-scott-bessent-messi
,themarketsdaily.com,iShares 1 - 3 Year Treasury Bond ETF $SHY Shares Sold by Clarity Financial LLC,https://www.themarketsdaily.com/2025/10/02/ishares-1-3-year-treasury-bond-etf-shy-shares-sold-by-clarity-financial-llc.html
,bin.ua,"Нафта перейшла до зниження , Brent подешевшала до $65 за барель",https://bin.ua/news/economics/oilandgas/341719-nafta-perejshla-do-znizhennya-brent-podeshevshala.html
,tickerreport.com,Brookmont Capital Management Sells 136 Shares of Diageo plc $DEO,https://www.tickerreport.com/banking-finance/13177662/brookmont-capital-management-sells-136-shares-of-diageo-plc-deo.html
,ots.at,Europa im Aufbruch - Bits & Pretzels 2025 setzt starkes Zeichen für Gründergeist und Zusammenhalt,https://www.ots.at/presseaussendung/OTS_20251002_OTS0155/europa-im-aufbruch-bits-pretzels-2025-setzt-starkes-zeichen-fuer-gruendergeist-und-zusammenhalt
,stockbiz.vn,Tiến sĩ Nguyễn Hiền Phương được bổ nhiệm làm Tổng Giám đốc Vietnamobile,https://stockbiz.vn/tin-tuc/tien-si-nguyen-hien-phuong-duoc-bo-nhiem-lam-tong-giam-doc-vietnamobile/35776189
,lanzadigital.com,"Junta y agentes sociales abordan 89 propuestas sobre capital humano para  Castilla - La Mancha , Horizonte 2030",https://www.lanzadigital.com/castilla-la-mancha/junta-y-agentes-sociales-abordan-89-propuestas-sobre-capital-humano-para-castilla-la-mancha-horizonte-2030/
,www.welt.de,"Immendingen, Baden-WüBerg, Germany",https://www.welt.de/motor/news/article68de72818016f8118e2fa860/neuer-mercedes-lichtkanal.html
,www.lrt.lt,"Budapest, Budapest, Hungary",https://www.lrt.lt/naujienos/muzika/680/2699432/duetas-kyla-vejas-surengs-koncertu-tura-gros-lietuvoje-lenkijoje-ir-vengrijoje
,www.leparisien.fr,"Paris, France (General), France",https://www.leparisien.fr/www.leparisien.fr/guide-shopping/bon-plan/lenceinte-connectee-amazon-echo-spot-a-moitie-prix-aujourdhui-02-10-2025-TWIK6RTNTVDJLLDFBJRFQKSMHY.php
,www.telepolis.de,Turkey,https://www.telepolis.de/features/Paukenschlag-Trump-gibt-Zieldaten-frei-Ukraine-darf-tief-in-Russland-zuschlagen-10708553.html
,www.telepolis.de,Ukraine,https://www.telepolis.de/features/Paukenschlag-Trump-gibt-Zieldaten-frei-Ukraine-darf-tief-in-Russland-zuschlagen-10708553.html
,www.telepolis.de,Germany,https://www.telepolis.de/features/Paukenschlag-Trump-gibt-Zieldaten-frei-Ukraine-darf-tief-in-Russland-zuschlagen-10708553.html
,www.telepolis.de,"New Delhi, Delhi, India",https://www.telepolis.de/features/Paukenschlag-Trump-gibt-Zieldaten-frei-Ukraine-darf-tief-in-Russland-zuschlagen-10708553.html
,www.telepolis.de,"Kiev, Ukraine (General), Ukraine",https://www.telepolis.de/features/Paukenschlag-Trump-gibt-Zieldaten-frei-Ukraine-darf-tief-in-Russland-zuschlagen-10708553.html
,www.telepolis.de,Russia,https://www.telepolis.de/features/Paukenschlag-Trump-gibt-Zieldaten-frei-Ukraine-darf-tief-in-Russland-zuschlagen-10708553.html
,www.telepolis.de,"Moscow, Moskva, Russia",https://www.telepolis.de/features/Paukenschlag-Trump-gibt-Zieldaten-frei-Ukraine-darf-tief-in-Russland-zuschlagen-10708553.html
,www.telepolis.de,"Kremlin, Moskva, Russia",https://www.telepolis.de/features/Paukenschlag-Trump-gibt-Zieldaten-frei-Ukraine-darf-tief-in-Russland-zuschlagen-10708553.html
,www.telepolis.de,India,https://www.telepolis.de/features/Paukenschlag-Trump-gibt-Zieldaten-frei-Ukraine-darf-tief-in-Russland-zuschlagen-10708553.html
,www.telepolis.de,"Washington, Washington, United States",https://www.telepolis.de/features/Paukenschlag-Trump-gibt-Zieldaten-frei-Ukraine-darf-tief-in-Russland-zuschlagen-10708553.html
,www.inewsgr.com,"Heraklion, Perifereia Kritis, Greece",https://www.inewsgr.com/362/se-exelixi-fotia-sto-irakleio--ichise-to-112-gia-etoimotita.htm
,telegrafi.com,Japan,https://telegrafi.com/dubai-vendos-rekord-boteror-per-filxhanin-me-te-shtrenjte-te-kafese/
,www.nigeriasun.com,"Vienna, Wien, Austria",http://www.nigeriasun.com/news/278613500/austria-launches-africa-strategy-with-focus-on-economy-migration
,www.nigeriasun.com,Austria,http://www.nigeriasun.com/news/278613500/austria-launches-africa-strategy-with-focus-on-economy-migration
,www.usinenouvelle.com:443,"Rhne, RhôAlpes, France",https://www.usinenouvelle.com:443/article/fini-la-chine-les-droits-de-douane-europeens-font-revenir-la-vanilline-de-syensqo-dans-le-rhone.N2238703
,www.usinenouvelle.com:443,"Louisiana, United States",https://www.usinenouvelle.com:443/article/fini-la-chine-les-droits-de-douane-europeens-font-revenir-la-vanilline-de-syensqo-dans-le-rhone.N2238703
,www.usinenouvelle.com:443,Belgium,https://www.usinenouvelle.com:443/article/fini-la-chine-les-droits-de-douane-europeens-font-revenir-la-vanilline-de-syensqo-dans-le-rhone.N2238703
,www.usinenouvelle.com:443,China,https://www.usinenouvelle.com:443/article/fini-la-chine-les-droits-de-douane-europeens-font-revenir-la-vanilline-de-syensqo-dans-le-rhone.N2238703
,www.parisguardian.com,France,http://www.parisguardian.com/news/278613405/transoft-solutions-receives-airap-accreditation
,www.parisguardian.com,"Le Vivier, Bretagne, France",http://www.parisguardian.com/news/278613405/transoft-solutions-receives-airap-accreditation
,www.ravennanotizie.it,Italy,https://www.ravennanotizie.it/evento/al-mercato-coperto-di-ravenna-torna-la-rassegna-letteraria-storie-e-persone-con-ritratti-al-femminile/
,www.ravennanotizie.it,Spain,https://www.ravennanotizie.it/evento/al-mercato-coperto-di-ravenna-torna-la-rassegna-letteraria-storie-e-persone-con-ritratti-al-femminile/
,baomoi.com,Vietnam,https://baomoi.com/da-chi-tra-hon-357-ty-dong-bao-hiem-khac-phuc-hau-qua-bao-so-10-c53390043.epi
,moravskoslezsky.denik.cz,"Havirov, Moravskoslezský, Czech Republic",https://moravskoslezsky.denik.cz/zpravy_region/ostrava-vitkovice-jih-heimstaden-nabidka-odkup-byty-odprodej-202.html
,moravskoslezsky.denik.cz,"Ostrava, Moravskoslezský, Czech Republic",https://moravskoslezsky.denik.cz/zpravy_region/ostrava-vitkovice-jih-heimstaden-nabidka-odkup-byty-odprodej-202.html
,moravskoslezsky.denik.cz,"Poruba, Moravskoslezský, Czech Republic",https://moravskoslezsky.denik.cz/zpravy_region/ostrava-vitkovice-jih-heimstaden-nabidka-odkup-byty-odprodej-202.html
,www.infomoney.com.br,Brazil,https://www.infomoney.com.br/politica/18-deputados-nao-votaram-pela-isencao-de-ir-ate-r-5-mil-veja-quem-estava-ausente/
,pda.tula.kp.ru,"Saint Petersburg, Sankt-Peterburg, Russia",https://pda.tula.kp.ru/daily/27724/5151274/
,www.globenewswire.com,Canada,https://www.globenewswire.com/news-release/2025/10/02/3160417/0/en/MOBIA-Named-Dell-Technologies-Trailblazer-Partner-of-the-Year.html
,www.lelezard.com,"Quebec, Quebec, Canada",https://www.lelezard.com/communique-21958986.html
,www.lrt.lt,"Warsaw, (Pl67), Poland",https://www.lrt.lt/ru/novosti/17/2698379/gribauskaite-putin-budet-idti-po-puti-voiny-do-kontsa-svoego-sushchestvovaniia
,www.infolibre.es,"Valencia, Carabobo, Venezuela",https://www.infolibre.es/politica/minuto-directo-internacional-urgente-espana-politica_6_2072986_1042625.html
,www.infolibre.es,"Madrid, Madrid, Spain",https://www.infolibre.es/politica/minuto-directo-internacional-urgente-espana-politica_6_2072986_1042625.html
,english.wafa.ps,Israel,https://english.wafa.ps/Pages/Details/161969
,bnn-news.com,Denmark,https://bnn-news.com/shadow-fleet-captain-and-first-officer-arrested-in-france-272635
,www.laverdad.es,"Region De Murcia, Murcia, Spain",https://www.laverdad.es/murcia/comunidad-continua-supremo-batalla-legal-reparto-menores-20251002134531-nt.html
,www.thelocal.ch,Switzerland,https://www.thelocal.ch/20251002/7-percent-swiss-health-insurance-costs-could-rise-more-than-announced-rate
