published_at,source,title,url
,guiamuriae.com.br,Mercado Play : A nova plataforma com centenas de filmes grátis que você precisa conhecer,http://www.guiamuriae.com.br/noticias/mundo/mercado-play-a-nova-plataforma-com-centenas-de-filmes-gratis-que-voce-precisa-conhecer/
,schwaebische-post.de,EU verschenkt Putins Schatz – Russland bereitet erniedrigende Reaktion vor,http://www.schwaebische-post.de/welt/wirtschaft/eu-ukraine-putins-schatz-russland-bereitet-erniedrigende-reaktion-vor-geld-zr-93966859.html
,fredericksburg.com,AOL shuts down its dial - up internet service,https://fredericksburg.com/life-entertainment/nation-world/technology/article_16399f72-61e8-594a-862c-2a7b0837e13b.html
,globenewswire.com,Sunrise Granted Patent for Silicon - Carbon Composite Anode,https://www.globenewswire.com/news-release/2025/10/02/3160442/0/en/Sunrise-Granted-Patent-for-Silicon-Carbon-Composite-Anode-Material-Securing-Key-Technology-for-Solid-State-Batteries.html
,foxbusiness.com,"2026 brings major 401k catch - up changes for workers earning over $145 , 000",https://www.foxbusiness.com/fox-news-opinion/youre-50-older-you-might-about-lose-big-tax-break
,tamindir.com,Vodafone RedBox Tarifeleri ve Fiyatları ( 2025 ),https://www.tamindir.com/blog/vodafone-redbox-tarifeleri-fiyatlari_74866/
,965therock.com,What Makes The Abilene Gun & Knife Show A Must - Visit ?,https://965therock.com/ixp/114/p/texas-gun-show-october/
,ynaija.com,"TECNO Shines at the 2025 Marketing Edge Awards , Clinches Two Prestigious Honors",https://ynaija.com/tecno-shines-at-the-2025-marketing-edge-awards-clinches-two-prestigious-honors/
,english.elpais.com,Migrant caravans no longer want to go to the United States,https://english.elpais.com/international/2025-10-02/migrant-caravans-no-longer-want-to-go-to-the-united-states.html
,tickerreport.com,Kennebec Savings Bank Increases Holdings in Schwab U . S . Large - Cap Value ETF $SCHV,https://www.tickerreport.com/banking-finance/13177656/kennebec-savings-bank-increases-holdings-in-schwab-u-s-large-cap-value-etf-schv.html
,finanznachrichten.de,"Brookmount Explorations , Inc .: Brookmount Gold Announces Agreement Eliminating Stock Conversions Resulting from Convertible Debt and Repricing of Reg . A Offering",https://www.finanznachrichten.de/nachrichten-2025-10/66601921-brookmount-explorations-inc-brookmount-gold-announces-agreement-eliminating-stock-conversions-resulting-from-convertible-debt-and-repricing-of-reg-200.htm
,dazebaonews.it,Italia hub strategico per la ricerca e le cure,https://dazebaonews.it/scienze-tecnologie/177604-italia-hub-strategico-per-la-ricerca-e-le-cure.html
,ec.ltn.com.tw,花蓮堰塞湖災後復建 經長 ： 保障地方安全與用水無虞,https://ec.ltn.com.tw/article/breakingnews/5198805
,stockbiz.vn,"Không thua kém các  anh cả  Đông Nam Á , Campuchia đã có dàn xe điện đáng nể , tăng trưởng thần kỳ 620 %",https://stockbiz.vn/tin-tuc/khong-thua-kem-cac-anh-ca-dong-nam-a-campuchia-da-co-dan-xe-dien-dang-ne-tang-truong-than-ky-620/35776319
,argaam.com,هيئة المنافسة : عقوبات على منشآت تواطأت في عطاءات حكومية وتغريمها 17 . 3 مليون ريال,https://www.argaam.com/ar/article/articledetail/id/1847215
,dailypolitical.com,SPDR Portfolio S & P 500 Value ETF $SPYV Shares Purchased by Vicus Capital,https://www.dailypolitical.com/2025/10/02/spdr-portfolio-sp-500-value-etf-spyv-shares-purchased-by-vicus-capital.html
,fanatik.com.tr,Konyasporu bekleyen yoğun fikstür ! - Fanatik Gazetesi Futbol Haberleri,https://www.fanatik.com.tr/konyaspor/konyasporu-bekleyen-yogun-fikstur-2596240
,zi-de-zi.ro,"Înființarea Consiliului consultativ pentru mediul de afaceri și educație la Târgu Mureș , salutată de RBL Mureș - Stiri din Mures , Stiri Targu mures",https://www.zi-de-zi.ro/2025/10/02/infiintarea-consiliului-consultativ-pentru-mediul-de-afaceri-si-educatie-la-targu-mures-salutata-de-rbl-mures/
,lne.es,Arranca el derribo de la antigua escuela de adultos : este es el plan municipal para el solar del centro de la Pola,https://www.lne.es/siero/2025/10/02/arranca-derribo-antigua-escuela-adultos-122198170.html
,blog.wenxuecity.com,我的世界 （ 14 ）-- 动物是人类最好的朋友 - 博客,https://blog.wenxuecity.com/myblog/79953/202510/499.html
,metalinfo.ru,"Портфель финансирования жилой недвижимости Сбера с начала года прирос на 24 % и составляет 6 , 6 трлн руб .",https://www.metalinfo.ru/ru/news/177145
,finance.eastmoney.com,10月2日晚间央视新闻联播要闻集锦 _ 东方财富网,https://finance.eastmoney.com/a/202510023528174331.html
,defenseworld.net,NIKE ( NYSE : NKE ) Rating Increased to Buy at DZ Bank,https://www.defenseworld.net/2025/10/02/nike-nysenke-rating-increased-to-buy-at-dz-bank.html
,elfinanciero.com.mx,Aprende del fracaso antes de que duela más,https://www.elfinanciero.com.mx/opinion/alberto-tovar/2025/10/02/aprende-del-fracaso-antes-de-que-duela-mas/
,expressandstar.com,First Drive : The Citroen C5 Aircross is a comfortable and efficient all - round package,https://www.expressandstar.com/news/motors/2025/10/02/first-drive-the-citroen-c5-aircross-is-a-comfortable-and-efficient-all-round-package/
,etfdailynews.com,Sound Income Strategies LLC Acquires 463 Shares of Constellation Brands Inc $STZ,https://www.etfdailynews.com/2025/10/02/sound-income-strategies-llc-acquires-463-shares-of-constellation-brands-inc-stz/
,etfdailynews.com,Alphabet Inc . $GOOGL is West Branch Capital LLC 6th Largest Position,https://www.etfdailynews.com/2025/10/02/alphabet-inc-googl-is-west-branch-capital-llcs-6th-largest-position/
,strettoweb.com,"Reggio Calabria , 76 condanne nel processo  Eureka  su  ndrangheta e narcotraffico internazionale",https://www.strettoweb.com/2025/10/reggio-calabria-76-condanne-nel-processo-eureka-su-ndrangheta-e-narcotraffico-internazionale/1972112/
,biztoc.com,"Crypto Markets Today : Bitcoin Breaks $119K as Altcoins Surge , Traders Eye Record Highs",https://biztoc.com/x/de746508d8906deb
,dailypolitical.com,"SimpliFi Inc . Purchases 1 , 168 Shares of iShares California Muni Bond ETF $CMF",https://www.dailypolitical.com/2025/10/02/simplifi-inc-purchases-1168-shares-of-ishares-california-muni-bond-etf-cmf.html
,trapanioggi.it,"Vicenda Glo e Asacom . Dal comune di Trapani e dagli altri del Distretto D50  nessun rinvio , nessuna sottrazione di responsabilità",https://trapanioggi.it/vicenda-glo-e-asacom-dal-comune-di-trapani-e-dagli-altri-del-distretto-d50-nessun-rinvio-nessuna-sottrazione-di-responsabilita/
,spravy.pozri.sk,"Chladné počasie prinieslo sneženie a 5 okresov malo výstrahu , ale čoskoro môže byť aj 22 stupňov",https://spravy.pozri.sk/clanok/chladne-pocasie-prinieslo-snezenie-a-5-okresov-malo-vystrahu-ale-coskoro-moze-byt-aj-22-stupnov/1601849
,scottishhousingnews.com,David Gibb : Why the Housing Bill doesnt sound the death knell for the PRS,https://www.scottishhousingnews.com/articles/david-gibb-why-the-housing-bill-doesnt-sound-the-death-knell-for-the-prs
,163.com,从17岁辍学到身家 90 亿 ， 他靠  降维打击  逆袭成顶流|晨光文具|陈湖雄|中性笔|笔头,https://www.163.com/news/article/KAT4L78M00019B3E.html
,oncevatan.com.tr,Süper Ligde 8 . haftanın perdesi yarın açılacak,https://www.oncevatan.com.tr/super-ligde-8-haftanin-perdesi-yarin-acilacak
,proactiveinvestors.co.uk,Hercules shares rise on record results outlook,https://www.proactiveinvestors.co.uk/companies/news/1079589/hercules-shares-rise-on-record-results-outlook-1079589.html
,tonyskansascity.com,Kansas City Streetcar Shares New Rules For Toy Train Right Of Way,https://www.tonyskansascity.com/2025/10/kansas-city-streetcar-shares-new-rules.html
,timesandstar.co.uk,Convicted terrorist sent back to jail for consorting with Syrian asylum seekers,https://www.timesandstar.co.uk/news/national/25512428.convicted-terrorist-sent-back-jail-consorting-syrian-asylum-seekers/
,foxbusiness.com,Nearly 20 % of US homes for sale saw price cuts in September,https://www.foxbusiness.com/real-estate/nearly-1-5-american-homes-slash-prices-as-buyers-gain-upper-hand-shifting-market
,morgenpost.de,Mileis Kettensäge ? Amthor packt lieber die Bohrmaschine aus,https://www.morgenpost.de/wirtschaft/article410138563/mileis-kettensaege-amthor-packt-lieber-die-bohrmaschine-aus.html
,senado.leg.br,"Governo e mercado divergem em números da economia , aponta nota técnica",https://www12.senado.leg.br/noticias/materias/2025/10/02/governo-e-mercado-divergem-em-numeros-da-economia-aponta-nota-tecnica
,money.udn.com,"台積電1 , 600元前哨站 鉅額交易驚見1 , 450元新天價 | 市場焦點 | 證券",https://money.udn.com/money/story/5607/9046658
,finanznachrichten.de,XRP Prognose : Knackt Ripple jetzt diese bullische Marke ?,https://www.finanznachrichten.de/nachrichten-2025-10/66601920-xrp-prognose-knackt-ripple-jetzt-diese-bullische-marke-303.htm
,pcgames.de,Nirgendwo günstiger : Amazon serviert den Tefal OptiGrill zum aktuellen Bestpreis,https://www.pcgames.de/Kueche-Hardware-280303/News/tefal-optigrill-bei-amazon-guenstig-im-angebot-1483436/
,market.bisnis.com,"PREMIUM WRAP - UP : Daya Tarik SSIA , SIDO , DOID , hingga Emiten Sawit ( AALI )",https://market.bisnis.com/read/20251002/7/1916990/premium-wrap-up-daya-tarik-ssia-sido-doid-hingga-emiten-sawit-aali
,floridanewswire.com,"Industrial Manufacturing Sees 27 . 8 % Jump in Renovation Projects , Proving Strong Investment Momentum into Fall 2025 | National News",https://floridanewswire.com/industrial-manufacturing-sees-27-8-jump-in-renovation-projects-proving-strong-investment-momentum-into-fall-2025-national-news/
,tickerreport.com,Woodward Diversified Capital LLC Makes New Investment in Cummins Inc . $CMI,https://www.tickerreport.com/banking-finance/13177665/woodward-diversified-capital-llc-makes-new-investment-in-cummins-inc-cmi.html
,news18.com,Even Warren Buffett Has Accepted ...: Robert Kiyosaki Warns Investors Of Major Shock Ahead,https://www.news18.com/business/markets/even-warren-buffett-has-accepted-robert-kiyosaki-warns-investors-of-major-shock-ahead-ws-kl-9610500.html
,caribbeanherald.com,Evolve Bank & Trust Appoints Alex Johnston Head of Open Banking,http://www.caribbeanherald.com/news/278613640/evolve-bank-trust-appoints-alex-johnston-head-of-open-banking
,punjabkesari.in,बैंक अब शेयरों पर एक करोड़ और IPO पर 25 लाख तक लोन दे सकेंगेः RBI प्रस्ताव - banks will be able to offer more loans with the rbi increasing,https://www.punjabkesari.in/business/news/banks-will-be-able-to-offer-more-loans-with-the-rbi-increasing-2222396
,comicbook.com,PlayStation Plus Subscribers Worried Price Increase Is Coming Soon,https://comicbook.com/gaming/news/playstation-plus-subscribers-worried-price-increase-is-coming-soon/
,diariopanorama.com,Aerolíneas Argentinas ofreció un 20 % de descuento en vuelos nacionales para la temporada de verano,https://www.diariopanorama.com/noticia/530592/aerolineas-argentinas-ofrecio-20porciento-descuento-vuelos-nacionales-para-temporada-verano
,argaam.com,ارتفاع إجمالي إنفاق المستهلكين إلى 133 . 5 مليار ريال ( +10 %) في أغسطس 2025,https://www.argaam.com/ar/article/articledetail/id/1847166
,dailypolitical.com,"Clarity Financial LLC Has $414 , 000 Stock Holdings in Schlumberger Limited $SLB",https://www.dailypolitical.com/2025/10/02/clarity-financial-llc-has-414000-stock-holdings-in-schlumberger-limited-slb.html
,irishnews.com,Newry pharmaceutical boss quits after just two years,https://www.irishnews.com/news/business/newry-pharmaceutical-boss-quits-after-just-two-years-2KX3ACY6NBDUPDSZWSFIWBELVY/
,spectator.co.uk,Build baby build  is not a housing strategy,https://www.spectator.co.uk/article/build-baby-build-is-not-a-housing-strategy/
,mediacongo.net,15e édition du Forum Europe - Africa Investment : le FPI plaide pour lindustrialisation de la RDC - mediacongo . net,https://www.mediacongo.net/publireportage-reportage-155722_15e_edition_du_forum_europe_africa_investment_le_fpi_plaide_pour_l_industrialisation_de_la_rdc.html
,ceutaldia.com,"27 millones para luchar contra el paro :  Los planes de empleo no son la solución , pero sí una ayuda",https://www.ceutaldia.com/articulo/politica/27-millones-luchar-paro-planes-empleo-son-solucion-ayuda/20251002125341301429.html
,tradingsat.com,"Nanobiotix : Sa solution veut améliorer la radiothérapie des cancers avec des nanoparticules , Nanobiotix flambe de 500 % depuis le début de lannée",https://www.tradingsat.com/nanobiotix-FR0011341205/actualites/nanobiotix-sa-solution-veut-ameliorer-la-radiotherapie-des-cancers-avec-des-nanoparticules-nanobiotix-flambe-de-500-depuis-le-debut-de-l-annee-1147627.html
,tradingsat.com,Rheinmetall enregistre une commande de 60 MEUR dans l  électromobilité,https://www.tradingsat.com/actualites/informations-societes/rheinmetall-enregistre-une-commande-de-60-meur-dans-l-electromobilite-1147630.html
,163.com,景区  1元午餐 ， 用诚意拉近与游客距离|旅游|用餐|经济型酒店 _ 网易订阅,https://www.163.com/dy/article/KAT557JL0512D3VJ.html
,zr.ru,Эти версии Toyota Camry и Skoda Octavia стали самыми популярными в РФ,https://www.zr.ru/content/news/973231-ehti-versii-toyota-camry-i-skod/
,haberler.com,"Gaziantep , Eylülde İhracatını Yüzde 5 , 5 Artırdı",https://www.haberler.com/ekonomi/gaziantep-eylul-de-ihracatini-yuzde-5-5-artirdi-19110226-haberi/
,schwaebische-post.de,Belgien warnt vor Merz - Plan für russisches Vermögen,http://www.schwaebische-post.de/welt/politik/belgien-warnt-vor-merz-plan-fuer-russisches-vermoegen-zr-93967058.html
,elnortedecastilla.es,"David Taberna y José Gabriel Mújica , director y exdirector , respectivamente , de El Diario Vasco , V Encuentro de Periodismo Miguel Delibes : « En la época de ETA , la prioridad era hacer el periódico todos los días pero , sobre todo , sobrevivir y...",https://www.elnortedecastilla.es/valladolid/epoca-eta-prioridad-era-periodico-dias-sobre-20251002145230-nt.html
,di.se,Tesla lyfter i förhandeln – levererade fler bilar än väntat,https://www.di.se/live/tesla-lyfter-i-forhandeln-levererade-fler-bilar-an-vantat/
,jagran.com,"अगले साल की शुरुआत में लॉन्च हो सकता है Apple का किफायती iPhone 17e , जानें डिटेल - Apple iPhone 17e launch timeline and price and all other latest leaks",https://www.jagran.com/technology/tech-news-apple-iphone-17e-launch-timeline-and-price-and-all-other-latest-leaks-24067772.html
,en.tempo.co,"Indonesian Customs Recorded 2 , 478 Violations January - September , Illegal Cigarettes Dominate",https://en.tempo.co/read/2053831/indonesian-customs-recorded-2478-violations-january-september-illegal-cigarettes-dominate
,govconwire.com,Travis Hite Takes on Chief Data Officer Role at Astrion,https://www.govconwire.com/articles/astrion-chief-data-officer-travis-hite-appointment
,expert.ru,Продажи новых автомобилей в РФ с начала года упали на 25 %,http://expert.ru/news/prodazhi-novykh-avtomobiley-v-rf-s-nachala-goda-upali-na-25/
,dlahandlu.pl,Gigant zamknął 4 hale w Polsce . Apel w sprawie setek pracowników,"https://www.dlahandlu.pl/detal-hurt/gigant-zamknal-4-hale-w-polsce-apel-w-sprawie-setek-pracownikow,161065.html"
,dallasnews.com,"Chili cancels longtime Skillet Queso , replacing it with new Dallas - made dip",https://www.dallasnews.com/food/restaurant-news/2025/10/02/why-chilis-removed-nostalgic-skillet-queso/
,dnn.de,Dresden : Herbstferien in der Region mit Nachtwanderungen und Kreativworkshops,https://www.dnn.de/lokales/dresden/dresden-herbstferien-in-der-region-mit-nachtwanderungen-und-kreativworkshops-B5RTAIIYTFC6RH3IHHV5OW3YQA.html
,realitateamedia.ro,CMI Urban va administra noua Piaţă Centrală - Realitatea Media,https://www.realitateamedia.ro/cmi-urban-va-administra-noua-piata-centrala/
,thewalrus.ca,How Canada Squandered Its Drone Lead,https://thewalrus.ca/how-canada-squandered-its-drone-lead/
,leconomiste.com,Les télécoms dopent le RNPG des sociétés cotées à Casablanca au S1 - 2025,https://www.leconomiste.com/flash-infos/les-telecoms-dopent-le-rnpg-des-societes-cotees-a-casablanca-au-s1-2025/
,defenseworld.net,Sentinel Pension Advisors LLC Boosts Stock Holdings in NVIDIA Corporation $NVDA,https://www.defenseworld.net/2025/10/02/sentinel-pension-advisors-llc-boosts-stock-holdings-in-nvidia-corporation-nvda.html
,diariopanorama.com,River y Racing se juegan la vida en Rosario por un lugar en semifinales de Copa Argentina,https://www.diariopanorama.com/noticia/530589/river-racing-se-juegan-vida-rosario-lugar-semifinales-copa-argentina
,24tv.ua,Galaxy S26 Plus повертається – Samsung реагує на провал продажів Galaxy S25 Edge,https://24tv.ua/tech/galaxy-s26-plus-povertayetsya-samsung-reaguye-proval-prodazhiv_n2926121
,comicbook.com,FromSoftware Xbox Exclusive RPG Is a Fantastic Game That No One Played,https://comicbook.com/gaming/news/fromsoftwares-xbox-exclusive-rpg-is-a-fantastic-game-that-no-ones-played/
,news.webindia123.com,Railways registers impressive occupancy in Mizoram ; boost in frieght operations from Nagaland,https://news.webindia123.com/news/Articles/India/20251002/4368101.html
,news18.com,Centre Orders Probe After Wintrack Halts India Operations Over Customs Harassment,https://www.news18.com/india/centre-orders-probe-after-wintrack-halts-india-operations-over-customs-harassment-ws-l-9610424.html
,tradingsat.com,"Stellantis : Grâce à un premier frémissement de ses ventes aux États - Unis , Stellantis décolle en Bourse",https://www.tradingsat.com/stellantis-NL00150001Q9/actualites/stellantis-grace-a-un-premier-fremissement-de-ses-ventes-aux-etats-unis-stellantis-decolle-en-bourse-1147622.html
,meed.com,MEED | PIF - led consortium to acquire Electronic Arts,https://www.meed.com:443/pif-led-consortium-to-acquire-electronic-arts
,wkms.org,From Madagascar to Morocco : Gen Z protests shake Africa,https://www.wkms.org/npr-news/2025-10-02/from-madagascar-to-morocco-gen-z-protests-shake-africa
,etfdailynews.com,"Sound Income Strategies LLC Raises Stock Holdings in Marriott International , Inc . $MAR",https://www.etfdailynews.com/2025/10/02/sound-income-strategies-llc-raises-stock-holdings-in-marriott-international-inc-mar/
,finanznachrichten.de,Correction - Genflow Biosciences PLC Announces Issue of Equity,https://www.finanznachrichten.de/nachrichten-2025-10/66601924-correction-genflow-biosciences-plc-announces-issue-of-equity-200.htm
,northbaynipissing.com,Almaguin tourism targets autumn visitors with new campaign,https://www.northbaynipissing.com/things-to-do/choose-your-own-adventure-ontarios-almaguin-targets-autumn-visitors-with-new-campaign-that-includes-fall/article_3fabc865-3c17-5ecb-9190-24f4532ce3e4.html
,genovatoday.it,Amt : a quanto ammonta il debito e cosa farà il Comune,https://www.genovatoday.it/politica/amt-quanto-ammonta-debito-cosa-fara-comune.html
,mobilizujeme.cz,Překrásné LEGO kytky jsou teď za nejnižší cenu . Češi je často kupují za mnohem víc,https://mobilizujeme.cz/clanky/prekrasne-lego-kytky-jsou-ted-za-nejnizsi-cenu-cesi-je-casto-kupuji-za-mnohem-vic
,argaam.com,فيتش تتوقع تجاوز حجم الأصول المدارة لدى مؤسسات السوق المالية السعودية 400 مليار دولار في 2026,https://www.argaam.com/ar/article/articledetail/id/1847158
,portageonline.com,"Security may be increased at Manitoba constituency offices after fires and vandalism - PortageOnline . com - Local news , Weather , Sports , Free Classifieds and Job Listings",https://www.portageonline.com/articles/security-may-be-increased-at-manitoba-constituency-offices-after-fires-and-vandalism
,fanatik.com.tr,Galatasaray - Beşiktaş derbisinin hakemi belli oldu ! TFF resmen açıkladı - Fanatik Gazetesi Galatasaray ( GS ) Haberleri,https://www.fanatik.com.tr/galatasaray/galatasaray-besiktas-derbisinin-hakemi-belli-oldu-tff-resmen-acikladi-2596229
,tickerreport.com,Brookmont Capital Management Sells 246 Shares of Accenture PLC $ACN,https://www.tickerreport.com/banking-finance/13177658/brookmont-capital-management-sells-246-shares-of-accenture-plc-acn.html
,defenseworld.net,"CarMax , Inc . $KMX Shares Sold by Public Employees Retirement System of Ohio",https://www.defenseworld.net/2025/10/02/carmax-inc-kmx-shares-sold-by-public-employees-retirement-system-of-ohio.html
,antaranews.com,"Respons Menkeu , Bahlil tegaskan data subsidi LPG masih dimatangkan",https://www.antaranews.com/berita/5149853/respons-menkeu-bahlil-tegaskan-data-subsidi-lpg-masih-dimatangkan
,globenewswire.com,STMicroelectronics : Tobii et STMicroelectronics lancent la,https://www.globenewswire.com/news-release/2025/10/02/3160438/0/fr/STMicroelectronics-Tobii-et-STMicroelectronics-lancent-la-fabrication-en-s%C3%A9rie-d-une-technologie-de-d%C3%A9tection-int%C3%A9rieure-r%C3%A9volutionnaire.html
,foodbev.com,Baumer expands packaging tech range with new CorrBox Evo solution,https://www.foodbev.com/news/baumer-expands-packaging-tech-range-with-new-corrbox-evo-solution
,cesky.radio.cz,Cibulák z Dubí slaví 140 let . Granátová jablka lidem připomínaly cibuli,https://cesky.radio.cz/cibulak-z-dubi-slavi-140-let-granatova-jablka-lidem-pripominaly-cibuli-8864469
,technologyreview.com,"The Download : RIP EV tax credits , and OpenAI new valuation",https://www.technologyreview.com/2025/10/02/1124684/the-download-rip-ev-tax-credits-and-openais-new-valuation/
,themarketsdaily.com,Parsons Capital Management Inc . RI Lowers Position in Oracle Corporation $ORCL,https://www.themarketsdaily.com/2025/10/02/parsons-capital-management-inc-ri-lowers-position-in-oracle-corporation-orcl.html
,toronto.com,Water / Fall Festival returns to Toronto this weekend,https://www.toronto.com/things-to-do/torontos-new-waterfront-festival-to-include-night-market-and-union-station-art-crawl-this-weekend/article_c98772ae-3838-5bce-b1b7-e823c9149b86.html
,am.com.mx,Gobierno gasta 61 % más en pagos de intereses que en obras,https://www.am.com.mx/nacional/2025/10/2/gobierno-gasta-61-mas-en-pagos-de-intereses-que-en-obras-753780.html
,dailypolitical.com,SPDR Portfolio S & P 500 Value ETF $SPYV Shares Sold by Pure Financial Advisors LLC,https://www.dailypolitical.com/2025/10/02/spdr-portfolio-sp-500-value-etf-spyv-shares-sold-by-pure-financial-advisors-llc.html
,zi-de-zi.ro,"Declarație politică :  Azomureș , un combinat strategic ce trebuie salvat prin asumarea statului român  - Stiri din Mures , Stiri Targu mures",https://www.zi-de-zi.ro/2025/10/02/declaratie-politica-azomures-un-combinat-strategic-ce-trebuie-salvat-prin-asumarea-statului-roman/
,justmedia.ru,"Пара пенсионеров из Екатеринбурга продала квартиру , чтобы отдать мошенникам 11 , 5 млн рублей",https://www.justmedia.ru/news/events/para-pensionerov-iz-yekaterinburga-prodala-kvartiru-chtoby-otdat-moshennikam-115-mln-rubley
,newjerseytelegraph.com,Greene Concepts Brings Premium Be Water ( TM ) to Homes Nationwide at Affordable Prices,http://www.newjerseytelegraph.com/news/278613615/greene-concepts-brings-premium-be-watertm-to-homes-nationwide-at-affordable-prices
,vietnamplus.vn,WHO kêu gọi đầu tư để chống lại siêu vi khuẩn kháng thuốc,https://www.vietnamplus.vn/who-can-tang-cuong-dau-tu-giai-quyet-tinh-trang-sieu-vi-khuan-khang-khang-sinh-post1067677.vnp
,eurointegration.com.ua,У G7 домовились посилити тиск на експорт нафти РФ – зокрема говорять про тарифи,https://www.eurointegration.com.ua/news/2025/10/2/7221511/
,dlahandlu.pl,Śmieciówka na jeden dzień . Rzeczywistość 30 - latków w branżach  kreatywnych,"https://www.dlahandlu.pl/raporty-i-analizy/smieciowka-na-jeden-dzien-rzeczywistosc-30-latkow-w-branzach-kreatywnych,161954.html"
,bursadabugun.com,Bursalı beyaz et devine rekor ceza !,https://www.bursadabugun.com/haber/bursali-beyaz-et-devine-rekor-ceza-1849333.html
,thisisoxfordshire.co.uk,"Boots : Almost £2k stolen from Wallingford store , Oxfordshire",https://www.thisisoxfordshire.co.uk/news/25512536.boots-almost-2k-stolen-wallingford-store-oxfordshire/
,themarketsdaily.com,Warren Street Wealth Advisors LLC Boosts Stock Holdings in Palantir Technologies Inc . $PLTR,https://www.themarketsdaily.com/2025/10/02/warren-street-wealth-advisors-llc-boosts-stock-holdings-in-palantir-technologies-inc-pltr.html
,etfdailynews.com,Sound Income Strategies LLC Increases Stake in Exelon Corporation $EXC,https://www.etfdailynews.com/2025/10/02/sound-income-strategies-llc-increases-stake-in-exelon-corporation-exc/
,finanznachrichten.de,Dividendenperle Evonik : Die nächsten Insiderkäufe,https://www.finanznachrichten.de/nachrichten-2025-10/66601925-dividendenperle-evonik-die-naechsten-insiderkaeufe-124.htm
,propertyweek.com,BPF launches purpose - built student accommodation board,https://www.propertyweek.com/news/the-bpf-launches-student-accommodation-board
,elperiodicomediterraneo.com,SUBIDA NUEVO AÑO | Tabla de la cuantía de las pensiones en 2026 : cuánto cobrarás según tu tipo de prestación,https://www.elperiodicomediterraneo.com/economia/2025/10/02/tabla-cuantia-pensiones-2026-sueldo-cantidad-euros-subida-dv-122193359.html
,tickerreport.com,Pure Financial Advisors LLC Trims Holdings in Schwab US Large - Cap ETF $SCHX,https://www.tickerreport.com/banking-finance/13177675/pure-financial-advisors-llc-trims-holdings-in-schwab-us-large-cap-etf-schx.html
