published_at,source,title,url
,srilankasource.com,CBSE Pariksha Pre - Board Papers Redefine Board Exam Preparation -- Rachna Sagar Latest Launch,http://www.srilankasource.com/news/278736895/cbse-pariksha-pre-board-papers-redefine-board-exam-preparation-rachna-sagar-latest-launch
,tickerreport.com,"Optimize Financial Inc Invests $436 , 000 in Oklo Inc . $OKLO",https://www.tickerreport.com/banking-finance/13280536/optimize-financial-inc-invests-436000-in-oklo-inc-oklo.html
,abcbourse.com,Rio Tinto valide une étape majeure avec la 1ère production de cuivre issue de sa,https://www.abcbourse.com/marches/newsContent/681931
,itbear.com.cn,第五代骁龙8至尊版 ： 3nm工艺赋能 12款旗舰开启移动体验新纪元 - 业界动态 - ITBear科技资讯,https://www.itbear.com.cn/html/2025-12/1040187.html
,kacu.org,"In an era of rising prices , computers have gotten cheaper . ( And why that may end )",https://www.kacu.org/2025-12-04/in-an-era-of-rising-prices-computers-have-gotten-cheaper-and-why-that-may-end
,lamarseillaise.fr,LOccitanie en bonne position sur le numérique,https://www.lamarseillaise.fr/economie/l-occitanie-en-bonne-position-sur-le-numerique-CP19254143
,abcbourse.com,BAT veut salléger au capital dITC Hotels en Inde,https://www.abcbourse.com/marches/newsContent/681946
,estadao.com.br,Qual o melhor tahine ?,https://www.estadao.com.br/paladar/comida/qual-o-melhor-tahine/
,rttnews.com,"Science Applications International Corporation Q3 Profit Decreases , But Beats Estimates",https://www.rttnews.com/3601097/science-applications-international-corporation-q3-profit-decreases-but-beats-estimates.aspx
,quatrorodas.abril.com.br,"Criador dos Evoque e Velar , Gerry McGovern deixa a Jaguar Land Rover",https://quatrorodas.abril.com.br/noticias/criador-dos-evoque-e-velar-gerry-mcgovern-deixa-a-jaguar-land-rover/
,eltiempo.pe,Extorsión en el Complejo de Mercados de Piura : mafias acosan a los comerciantes y ambulantes,https://eltiempo.pe/local/extorsion-en-el-complejo-de-mercados-de-piura-mafias-acosan-a-los-comerciantes-y-ambulantes/
,inewsgr.com,Geely EX5 από πόσο ;,https://www.inewsgr.com/332/Geely-EX5-apo-poso.htm
,ta3.com,Kam smeruje trh s nehnuteľnosťami ?,https://www.ta3.com/relacia/1023365/kam-smeruje-trh-s-nehnutelnostami
,tickerreport.com,Eli Lilly and Company $LLY Holdings Cut by Kennedy Capital Management LLC,https://www.tickerreport.com/banking-finance/13280535/eli-lilly-and-company-lly-holdings-cut-by-kennedy-capital-management-llc.html
,moneycontrol.com,"Birla Estates enters Greater Noida market as co - developer in Rs 1 , 600 - crore housing project with Sikka Group",https://www.moneycontrol.com/news/business/real-estate/birla-estates-enters-greater-noida-market-as-co-developer-in-rs-1-600-crore-housing-project-with-sikka-group-13711017.html
,africanmanager.com,Adoption dun article additionnel relatif au repos biologique dans le secteur de la pêche,https://africanmanager.com/adoption-dun-article-additionnel-relatif-au-repos-biologique-dans-le-secteur-de-la-peche/
,manilatimes.net,CloudEagle . ai Announces Integration with Netskope to Deliver Unified SaaS Security and Cost Optimization,https://www.manilatimes.net/2025/12/04/tmt-newswire/globenewswire/cloudeagleai-announces-integration-with-netskope-to-deliver-unified-saas-security-and-cost-optimization/2237065
,dailypolitical.com,Thor Industries ( NYSE : THO ) Updates FY 2026 Earnings Guidance,https://www.dailypolitical.com/2025/12/04/thor-industries-nysetho-updates-fy-2026-earnings-guidance.html
,az-online.de,Digitale Alternativen – Muss es immer WhatsApp oder Facebook sein ?,http://www.az-online.de/ratgeber/digital/digitale-alternativen-muss-es-immer-whatsapp-oder-facebook-sein-zr-94068815.html
,abcbourse.com,"Le secteur automobile grimpe en Bourse , BofA se dit optimiste sur ses perspectiv",https://www.abcbourse.com/marches/newsContent/681932
,businessnews.gr,Οδηγίες για τις μετακινήσεις αιγοπροβάτων ενόψει της εορταστικής περιόδου,https://www.businessnews.gr/ellada/item/324753-odigies-gia-tis-metakiniseis-aigoprovaton-enopsei-tis-eortastikis-periodou
,finance.yahoo.com,Abercrombie & Fitch Co . ( ANF ): A Bull Case Theory,https://finance.yahoo.com/news/abercrombie-fitch-co-anf-bull-132004858.html
,arp.org.py,Lanzan plataforma digital para comercializar productos de la agricultura familiar,https://www.arp.org.py/index.php?option=com_content&view=article&id=4461:lanzan-plataforma-digital-para-comercializar-productos-de-la-agricultura-familiar&catid=16&Itemid=116
,163.com,《 阿凡达3 》 天崩开局 ， 内地预测票房仅20亿 ， 顶级吸金IP要垮了吗,https://www.163.com/dy/article/KFVBBOTG0517CAC0.html
,laosnews.net,ICSI Proposes Principle - Based Approach To Address Climate Change,http://www.laosnews.net/news/278737015/icsi-proposes-principle-based-approach-to-address-climate-change
,dailypolitical.com,Metcash Limited ( ASX : MTS ) Announces Interim Dividend of $0 . 09,https://www.dailypolitical.com/2025/12/04/metcash-limited-asxmts-announces-interim-dividend-of-0-09.html
,bestmediainfo.com,"Print ad space rises 3 % in Jan - Sep 2025 , driven by education and auto sectors : TAM AdEx",https://bestmediainfo.com/insights/print-ad-space-rises-3-in-jan-sep-2025-driven-by-education-and-auto-sectors-tam-adex-10881330
,wlrn.org,From TikTok to AI Art : Algorithms are splintering pop culture,https://www.wlrn.org/arts-culture/2025-12-04/art-ai-tiktok-algorithms-pop-culture
,tio.ch,Stretta sui salari federali : il Nazionale riduce ladeguamento al rincaro al minimo,http://www.tio.ch/svizzera/politica/1888412/rincaro-consiglio-nazionale-compensazione-salari
,abcbourse.com,Rio Tinto présente une stratégie resserrée pour doper ses rendements,https://www.abcbourse.com/marches/newsContent/681934
,thesaigontimes.vn,"Tăng giá xăng từ 15 giờ hôm nay , E5 RON92 lên 19 . 822 đồng , RON95 - III 20 . 460 đồng / lít",https://thesaigontimes.vn/tang-gia-xang-tu-15-gio-hom-nay-e5-ron92-len-19-822-dong-ron95-iii-20-460-dong-lit/
,latele.ch,Ignazio Cassis veut une OSCE pragmatique et agile en présidence suisse,https://latele.ch/articles/ignazio-cassis-veut-une-osce-plus-pragmatique-et-plus-agile
,proactiveinvestors.co.uk,Valereum targets wider investor base with OTC listing,https://www.proactiveinvestors.co.uk/companies/news/1083777/valereum-targets-wider-investor-base-with-otc-listing-1083777.html
,t-online.de,Thailand hebt Verkaufsverbot für Alkohol am Nachmittag auf,https://www.t-online.de/leben/reisen/id_101029604/thailand-hebt-verkaufsverbot-fuer-alkohol-am-nachmittag-auf.html
,vademec.ru,Семаглутид Novo Nordisk не подтвердил ожидаемого эффекта при терапии болезни Альцгеймера,https://www.vademec.ru/news/2025/12/04/semaglutid-novo-nordisk-ne-podtverdil-ozhidaemogo-effekta-pri-terapii-bolezni-altsgeymera/
,24heures.ch,Budget 2026 : le National réduit la compensation du renchérissement,https://www.24heures.ch/budget-2026-le-national-reduit-la-compensation-du-rencherissement-117567135290
,cand.com.vn,Công cụ pháp lý mạnh mẽ bảo vệ không gian mạng - Báo Công an nhân dân điện tử,https://cand.com.vn/Cong-nghe/cong-cu-phap-ly-manh-me-bao-ve-khong-gian-mang-i790095/
,sabah.com.tr,"Yurt dışında yerleşik kişilerden 71 , 9 milyon dolarlık hisse alımı",https://www.sabah.com.tr/ekonomi/yurt-disinda-yerlesik-kisilerden-719-milyon-dolarlik-hisse-alimi-7477305
,regionews.at,Niederösterreich : Martina Fischer ist neue Kindergarteninspektorin für den westlichen Teil des Bezirks Amstetten,https://www.regionews.at/newsdetail/Martina_Fischer_ist_neue_Kindergarteninspektorin_fuer_den_westlichen_Teil_des_Bezirks_Amstetten-666899
,latele.ch,Budget 2026 : tensions au Conseil national sur dépenses et recettes,https://latele.ch/articles/les-fonctionnaires-devront-faire-un-effort-estime-le-national
,kacu.org,U . S . health care is broken . Here are 3 ways it getting worse,https://www.kacu.org/2025-12-04/u-s-health-care-is-broken-here-are-3-ways-its-getting-worse
,finansial.bisnis.com,"Terdampak PSAK 117 , ACPI Pelajari Desain Ulang produk Multi - Year",https://finansial.bisnis.com/read/20251204/215/1931382/terdampak-psak-117-acpi-pelajari-desain-ulang-produk-multi-year
,eeo.com.cn,中国太保携长江养老助力2025上海马拉松完美收官 - 经济观察网 － 专业财经新闻网站,http://www.eeo.com.cn/2025/1204/770956.shtml
,cand.com.vn,Triệt xóa đường dây lừa đảo hàng nghìn tỷ đồng hoạt động xuyên quốc gia - Báo Công an Nhân dân điện tử,https://cand.com.vn/Ban-tin-113/triet-xoa-duong-day-lua-dao-hang-nghin-ty-dong-hoat-dong-xuyen-quoc-gia-i790105/
,petrotimes.vn,Những người nghèo nhưng rất … giàu,https://petrotimes.vn/nhung-nguoi-ngheo-nhung-rat-giau-735390.html
,az-online.de,Ausschuss fordert von Bondi vollständige Offenlegung der Epstein - Informationen,http://www.az-online.de/politik/ausschuss-fordert-von-bondi-vollstaendige-offenlegung-der-epstein-informationen-zr-94068324.html
,hn24.hnonline.sk,HNonline . sk - Rakúska ekonomika v treťom kvartáli medziročne vzrástla,https://hn24.hnonline.sk/hn24/96248984-rakuska-ekonomika-v-tretom-kvartali-medzirocne-vzrastla
,bbc.com,Edinburgh visitor levy to fund almost 500 affordable homes,https://www.bbc.com/news/articles/c2k4q274eppo
,manilatimes.net,Neuphoria Responds to Lynx1 Revised Indication of Interest at a Reduced Price and Premium,https://www.manilatimes.net/2025/12/04/tmt-newswire/globenewswire/neuphoria-responds-to-lynx1s-revised-indication-of-interest-at-a-reduced-price-and-premium/2237101
,baodautu.vn,Quảng Trị có thêm 3 cảng biển được áp dụng thị thực điện tử ( e - visa ),https://baodautu.vn/quang-tri-co-them-3-cang-bien-duoc-ap-dung-thi-thuc-dien-tu-e-visa-d451059.html
,indiainfoline.com,NIFTY In November 2025 Gives Positive of 1 . 87 %,https://www.indiainfoline.com/blog/nifty-in-november-2025
,proactiveinvestors.co.uk,Burry Tesla big short,https://www.proactiveinvestors.co.uk/companies/news/1083560/burry-s-tesla-big-short-1083560.html
,biztoc.com,Solana ETFs See Record Outflow as 21Share TSOL Bleeds $42M,https://biztoc.com/x/1599228b5eb6458e
,adnkronos.com,Marano ( Confindustria Radio Tv ) contro Big tech :  Non investono sul territorio . E ora costruiscono auto senza radio,https://www.adnkronos.com/spettacoli/marano-confindustria-radio-tv-contro-big-tech-non-investono-sul-territorio-e-ora-costruiscono-auto-senza-radio_6hysl7CImtnY6nZl4yP8Sh
,jatim.viva.co.id,"DHL Buka Surabaya Gateway and Service Centre , Ekspor ke ASEAN Cukup Sehari",https://jatim.viva.co.id/gaya-hidup/23176-dhl-buka-surabaya-gateway-and-service-centre-ekspor-ke-asean-cukup-sehari
,optics.org,Defense and aerospace continues to drive G & H momentum,https://optics.org/news/16/12/3
,star.com.tr,Baykar ve ASELSAN glerini birleþtirdi ! Mavi Vatan  ýn yeni süper güc hayran býrakt,https://www.star.com.tr/savunma/baykar-ve-aselsan-guclerini-birlestirdi-mavi-vatanin-yeni-super-gucu-hayran-birakti-haber-1981473/
,haberler.com,"CHPli Genç :  Tüik Rakamları Ne Derse Desin , Gerçek Enflasyon Mutfakta Yazıyor . Asgari Ücret En Az 39 Bin TL Olmalıdır",http://www.haberler.com/guncel/chp-li-genc-tuik-rakamlari-ne-derse-desin-gercek-19323241-haberi/
,insidebitcoins.com,"Strategy Is Bracing For A Bear Market , CryptoQuant Says",https://insidebitcoins.com/news/strategys-bitcoin-buying-collapse-shows-michael-saylor-bracing-for-bear-market-cryptoquant
,laosnews.net,QualityKiosk Named a Leader in Everest Group Quality Engineering ( QE ) Specialist Services PEAK Matrix Assessment 2025,http://www.laosnews.net/news/278736971/qualitykiosk-named-a-leader-in-everest-group-quality-engineering-qe-specialist-services-peak-matrix-assessment-2025
,delcotimes.com,Delco CID achieves accreditation honor,https://www.delcotimes.com/2025/12/04/delaware-county-criminal-investigation-division-achieves-accreditation-honor/
,haberler.com,Bayraktar TB3 SİHA ve Albatros - S KİDAdan başarılı müşterek harekat,http://www.haberler.com/ekonomi/baykar-ve-aselsan-dan-mavi-vatan-da-basarili-test-19323238-haberi/
,europafm.ro,"România în Direct , live din Câmpina . Cine trebuie să demisioneze după dezastrul de la Paltinu ? : Europa FM",https://www.europafm.ro/romania-in-direct-live-din-campina-cine-trebuie-sa-demisioneze-dupa-dezastrul-de-la-paltinu/
,ziare.com,"Liderii UE se așteaptă la trădare din partea SUA , arată o discuție divulgată de presă . „ Nu putem lăsa Ucraina și pe Volodimir singuri cu tipii ăștia",https://ziare.com/razboi-ucraina/liderii-ue-tradare-sua-aparare-zelenski-1980596
,thedailystar.net,Liberty Drink House Chattogram vintage falooda shop thrills generations | Discover Liberty Falooda New Market – Chattogram iconic 1964 dessert haven | Best falooda in Chattogram : why Liberty Drink House remains a beloved heritage spot | Taste nostal...,https://www.thedailystar.net/life-living/food-recipes/news/step-back-time-classic-falooda-liberty-drink-house-4050516
,hkcd.com,「 國家憲法日 」 座談會舉行 全場默哀1分鐘悼念大埔宏福苑火災罹難者,https://www.hkcd.com/hkcdweb/content/2025/12/04/content_8728907.html
,thedailystar.net,Exports fall for fourth consecutive month,https://www.thedailystar.net/business/news/exports-fall-fourth-consecutive-month-4050526
,infranken.de,Die beliebtesten Kreisligaclubs in Franken,https://www.infranken.de/lk/franken/beliebtesten-kreisligaclubs-in-franken-umfrage-ehrenamt-jugendarbeit-gemeinschaft-art-6286314
,just-drinks.com,Industry defends corner as San Francisco lodges UPF lawsuit,https://www.just-drinks.com/news/industry-defends-corner-as-san-francisco-lodges-upf-lawsuit/
,dagensps.se,Alla pilar uppåt vid uranproducentens börsdebut,https://www.dagensps.se/bors-finans/ravaror/alla-pilar-uppat-vid-uranproducentens-borsdebut/
,acidadeon.com,Refis Campinas 2025 : prazo para negociar dívidas termina na próxima semana,https://www.acidadeon.com/campinas/economia/refis-campinas-2025-prazo-para-negociar-dividas-termina-na-proxima-semana/
,greentechlead.com,Global Electric Vehicle Installed Base to Reach 116 mn in 2026 - Gartner,https://greentechlead.com/electric-vehicle/global-electric-vehicle-installed-base-to-reach-116-mn-in-2026-gartner-51542
,baochinhphu.vn,"Phó Thủ tướng Phạm Thị Thanh Trà yêu cầu rà soát kỹ phương pháp đánh giá cán bộ , công chức",https://baochinhphu.vn/pho-thu-tuong-pham-thi-thanh-tra-yeu-cau-ra-soat-ky-phuong-phap-danh-gia-can-bo-cong-chuc-102251204193719263.htm
,tgrthaber.com,TOGG T10F ve T10X için beklenen toplam satış rakamı açıklandı : Hedef oldukça büyük,https://www.tgrthaber.com/otomobil/togg-t10f-ve-t10x-icin-beklenen-toplam-satis-rakami-aciklandi-hedef-oldukca-buyuk-3268332
,diariosigloxxi.com,Iberia se expande en Asia con un acuerdo de código compartido con China Southern,https://www.diariosigloxxi.com/texto-s/mostrar/629389/iberia-expande-asia-acuerdo-codigo-compartido-china-southern
,dnn.de,EU - Kommission geht gegen Meta vor : Zugang für KI - Anbieter bei WhatsApp unzulässig ?,https://www.dnn.de/wirtschaft/eu-kommission-geht-gegen-meta-vor-zugang-fuer-ki-anbieter-bei-whatsapp-unzulaessig-GDXNNURQEJBB7HYEDA6M55QVUE.html
,bucurestifm.ro,"Crăciun de poveste la Teatrul Ion Creangă : MagicTIC aduce spectacole , ateliere și întâlniri cu Moș Crăciun - Radio Bucuresti FM - Radio Muzica Live Online",https://www.bucurestifm.ro/2025/12/04/craciun-de-poveste-la-teatrul-ion-creanga-magictic-aduce-spectacole-ateliere-si-intalniri-cu-mos-craciun/
,manilatimes.net,Useme Releases New Report Showing European Freelancers Are Becoming U . S . Companie Secret Growth Engine with Poland Leading the Talent Boom,https://www.manilatimes.net/2025/12/04/tmt-newswire/globenewswire/useme-releases-new-report-showing-european-freelancers-are-becoming-us-companies-secret-growth-engine-with-poland-leading-the-talent-boom/2237074
,abcbourse.com,Paramount Skydance relève les frais de rupture dans son offre dacquisition de W,https://www.abcbourse.com/marches/newsContent/681949
,qds.it,"Offerte di lavoro 4 dicembre 2025 , posizioni aperte in Sicilia",https://qds.it/offerte-di-lavoro-4-dicembre-2025-posizioni-aperte/
,blackseanews.net,BlackSeaNews | Сотрудники СГБ и финансовой полиции Грузии нагрянули в батумский нефтетерминал,https://www.blackseanews.net/read/238204
,baodautu.vn,[ Ảnh ] Vinh danh các doanh nghiệp đoạt giải Cuộc Bình chọn Doanh nghiệp niêm yết ( VLCA ) 2025,https://baodautu.vn/anh-vinh-danh-cac-doanh-nghiep-doat-giai-cuoc-binh-chon-doanh-nghiep-niem-yet-vlca-2025-d450954.html
,merdeka.com,"9 Ide Kebun Sayur Minimalis di Belakang Rumah , Modal Mulai Rp 300 Ribu",https://www.merdeka.com/gaya/9-ide-kebun-sayur-minimalis-di-belakang-rumah-modal-mulai-rp-300-ribu-503614-mvk.html
,marketscreener.com,Textron : Pace Technology Launches Enhanced Speed Control,https://www.marketscreener.com/news/textron-pace-technology-launches-enhanced-speed-control-ce7d51dfdf88f627
,diariosigloxxi.com,Alemania apoya el uso de activos rusos congelados por la UE para dar financiación a Ucrania,https://www.diariosigloxxi.com/texto-ep/mostrar/20251204130643/alemania-apoya-activos-rusos-congelados-ue-dar-financiacion-ucrania
,phunutoday.vn,"Từ 1 / 1 / 2026 : 3 tuổi vào Đại Vận 3 năm , quý nhân mở đường , Thần Tài ưu ái , Làm Lớn Thắng Lớn",https://phunutoday.vn/tu-1-1-2026-3-tuoi-vao-dai-van-3-nam-quy-nhan-mo-duong-than-tai-uu-ai-lam-lon-thang-lon-d478431.html
,theconversation.com,"Facing myriad global pressures , Iran intensifies outreach to African partners for critical needs",https://theconversation.com/facing-myriad-global-pressures-iran-intensifies-outreach-to-african-partners-for-critical-needs-270603
,huffingtonpost.it,Le cannoniere spuntate - HuffPost Italia,https://www.huffingtonpost.it/blog/2025/12/04/news/le_cannoniere_spuntate-20654837/
,di.se,VM för ostmakare – experimenten som ska ge medaljer,https://www.di.se/nyheter/medaljdrommar-pa-ost-vm-experiment-ska-ge-nya-vinnare/
,remszeitung.de,Die geheimnisvollsten Lost Places in Berlin,https://www.remszeitung.de/reise/die-geheimnisvollsten-lost-places-in-berlin-S5ED3NYFENAINML72PDQ6GNGYE.html
,elfinanciero.com.mx,Golpe de estado,https://www.elfinanciero.com.mx/opinion/guillermo-knochenhauer/2025/12/04/golpe-de-estado/
,publicradiotulsa.org,There no 911 for u : inside America elite urban search and rescue teams,https://www.publicradiotulsa.org/npr-national-news/2025-12-04/theres-no-911-for-us-inside-americas-elite-urban-search-and-rescue-teams
,delo.ua,Український ринок металобрухту стане дефіцитним у 2026 році – ЗМІ Delo . ua,https://delo.ua/business/ukrayinskii-rinok-metalobruxtu-stane-deficitnim-u-2026-roci-zmi-456414/
,typosthes.gr,Άγρια επίθεση στη Θάσο : 55χρονος κυνήγησε και μαχαίρωσε την πρώην σύζυγό του,https://www.typosthes.gr/koinonia/411540_agria-epithesi-sti-thaso-55hronos-kynigise-kai-mahairose-tin-proin-syzygo-toy
,zazoom.it,Ischia lottizzazione abusiva | sigilli al noto resort 8 indagati,https://www.zazoom.it/2025-12-04/ischia-lottizzazione-abusiva-sigilli-al-noto-resort-8-indagati/18258200/
,srilankasource.com,"Rosy Blue and Kashikey Invest 1000 Crore to Scale QWEEN , India First Self - Discovery Experiential Jewellery Brand",http://www.srilankasource.com/news/278736945/rosy-blue-and-kashikey-invest-1000-crore-to-scale-qween-india-first-self-discovery-experiential-jewellery-brand
,tickerreport.com,"349 , 615 Shares in Alumis Inc . $ALMS Bought by Stonepine Capital Management LLC",https://www.tickerreport.com/banking-finance/13280546/349615-shares-in-alumis-inc-alms-bought-by-stonepine-capital-management-llc.html
,borsaitaliana.it,La Bank of England lancia uno stress test su private equity e private credit,https://www.borsaitaliana.it/borsa/notizie/teleborsa/finanza/la-bank-of-england-lancia-uno-stress-test-su-private-equity-e-private-credit-105_2025-12-04_TLB.html
,nieuws.nl,Brussel onderzoekt Meta om misbruik marktpositie AI op WhatsApp,https://nieuws.nl/economie/brussel-onderzoekt-meta-om-misbruik-marktpositie-ai-op-whatsapp
,leccesette.it,Blitz tra Bari e Lecce : sequestrati 14mila litri di olio,https://www.leccesette.it/news/15191150086/blitz-tra-bari-e-lecce-sequestrati-14mila-litri-di-olio
,delo.ua,Мінекономіки рекордно розширило перелік техніки з компенсацією 15 %: додано 340 …,https://delo.ua/news/minekonomiki-rekordno-rozsirilo-perelik-texniki-z-kompensacijeyu-15-dodano-340-naimenuvan-456434/
,manilatimes.net,Zanskar Reveals  Big Blind  - The Discovery of the First Blind Geothermal System in the U . S . by Industry in Over 30 Years,https://www.manilatimes.net/2025/12/04/tmt-newswire/globenewswire/zanskar-reveals-big-blind-the-discovery-of-the-first-blind-geothermal-system-in-the-us-by-industry-in-over-30-years/2237090
,yicai.com,人民币汇率短期  破7  概率大 ， 潜在  结汇潮  影响有多大,https://www.yicai.com/news/102941887.html
,jaysjournal.com,Blue Jays fans should roll their eyes at this Dodgers prediction,https://jaysjournal.com/blue-jays-fans-should-roll-their-eyes-at-this-dodgers-prediction-01kbgg3bz2zv
,moto.motorionline.com,"Mercato Moto Italia 2025 : Dati di Novembre , Calo Immatricolazioni e Analisi Scooter , Moto ed Elettriche",https://moto.motorionline.com/mercato-moto-italia-2025-novembre-in-calo-per-le-due-ruote-145/
,businessden.com,SouthState Bank planning $3M remodel of downtown office,https://businessden.com/2025/12/04/southstate-bank-planning-3m-remodel-of-downtown-office/
,gamerant.com,Call of Duty Reveals Patch Notes for Big Black Ops 7 and Warzone Season 1 Update,https://gamerant.com/call-of-duty-black-ops-7-warzone-season-1-update-patch-notes/
,thesaigontimes.vn,Sacombank nâng cấp dịch vụ eCombo - giải pháp tài khoản trọn gói linh hoạ dành cho doanh nghiệp,https://thesaigontimes.vn/sacombank-nang-cap-dich-vu-ecombo-giai-phap-tai-khoan-tron-goi-linh-hoa-danh-cho-doanh-nghiep/
,ixbt.com,Обзор Dreame Z10 Station – тесты вертикального пылесоса на полу и ковре / Техника для дома / iXBT Live,https://www.ixbt.com/live/chome/obzor-dreame-z10-station-testy-vertikalnogo-pylesosa-na-polu-i-kovre.html
,liputan6.com,"Bos Danantara Minta Keringanan Pajak BUMN , Menkeu Purbaya Siap Kasih Buat Konsolidasi",https://www.liputan6.com/bisnis/read/6229229/bos-danantara-minta-keringanan-pajak-bumn-menkeu-purbaya-siap-kasih-buat-konsolidasi
,trthaber.com,Toggun yıl sonu hedefi 90 bin,https://www.trthaber.com/haber/ekonomi/toggun-yil-sonu-hedefi-90-bin-927802.html
,kobieta.wp.pl,"Kobiety , które czują mocniej . 7 . edycja ogólnopolskiej kampanii  W kobiecym interesie",https://kobieta.wp.pl/kobiety-ktore-czuja-mocniej-7-edycja-ogolnopolskiej-kampanii-w-kobiecym-interesie-7228818298067904a
,eldia.com.do,El papel de los bancos y los ciclos financieros frente a las dos crisis mundiales .,https://eldia.com.do/el-papel-de-los-bancos-y-los-ciclos-financieros-frente-a-las-dos-crisis-mundiales/
,comingsoon.net,Scarlett Johansson Reflects on Disney Lawsuit Over Black Widow,https://www.comingsoon.net/movies/news/2070397-scarlett-johansson-black-widow-disney-lawsuit-40-million
,manilatimes.net,Precipio Identifies Unauthorized Access to Isolated Storage ; No Operational Impact,https://www.manilatimes.net/2025/12/04/tmt-newswire/globenewswire/precipio-identifies-unauthorized-access-to-isolated-storage-no-operational-impact/2237071
,sabah.com.tr,"65 yaş , engelli aylığı , evde bakım 2026 zammı kalem kalem hesaplandı !",https://www.sabah.com.tr/ekonomi/65-yas-engelli-ayligi-evde-bakim-2026-zammi-kalem-kalem-hesaplandi-uzman-isim-rakam-verdi-7477309
,navbharattimes.indiatimes.com,"Silver ETF : 11 महीने में 100 % से ज्यादा रिटर्न , सिल्वर ईटीएफ ने कराई जबरदस्त कमाई , एक्सपर्ट ने बताया अब क्या करें निवेशक",https://navbharattimes.indiatimes.com/business/personal-finance/savings-and-investments/silver-etf-over-100-percent-return-in-the-current-calendar-year-so-far-know-what-investors-should-do-now/articleshow/125767119.cms
,laosnews.net,Co - creator of Counter - Strike Minh Le Headlined Moscow International Game Week,http://www.laosnews.net/news/278736881/co-creator-of-counter-strike-minh-le-headlined-moscow-international-game-week
,watfordobserver.co.uk,Southall to gain new Indian vegetarian restaurant,https://www.watfordobserver.co.uk/leisure/25667641.southall-gain-new-indian-vegetarian-restaurant/
,dnn.de,Städteranking : Mainz ist dynamischste Großstadt Deutschlands – Berlin fällt zurück,https://www.dnn.de/wirtschaft/staedteranking-mainz-ist-dynamischste-grossstadt-deutschlands-berlin-faellt-zurueck-OHSPK5WJQFB7TOHA6UUIZ2VEJ4.html
,biztoc.com,Is Old Dominion Freight Line Stock Underperforming the Nasdaq ?,https://biztoc.com/x/6cd6e1495d42fb35
,kommersant.ru,"Тренды подарков 2025 : что дарят тем , у кого всё есть",https://www.kommersant.ru/doc/8251379
,manilatimes.net,ViroMissile Appoints Mark Bertagnolli as Chief Operating Officer,https://www.manilatimes.net/2025/12/04/tmt-newswire/globenewswire/viromissile-appoints-mark-bertagnolli-as-chief-operating-officer/2237077
