published_at,source,title,url
2025-08-24T04:29:52.000000Z,business.hatenastaff.com,オンラインセミナー「オウンドメディアのペルソナ設定とカスタマージャーニーの作り方」を開催します（2025年4月9日）,https://www.hatena.ne.jp/ownedmedia/article/seminar_250409
2025-08-24T04:29:52.000000Z,business.hatenastaff.com,オンラインセミナー「オウンドメディアの始め方」を開催します（2025年4月23日）,https://www.hatena.ne.jp/ownedmedia/article/seminar_250423
2025-08-24T04:29:52.000000Z,business.hatenastaff.com,Looker Studioで追加できる表・グラフの使い方を実例で解説。用途に合わせデータを可視化しよう,https://www.hatena.ne.jp/ownedmedia/article/2025/04/25/lookerstudiograph
2025-08-24T04:29:52.000000Z,business.hatenastaff.com,生成AIの活用でオウンドメディア運用の効率化を実現。ソフトバンク、LIFULL担当者が登壇したはてな主催オウンドメディアセミナーレポート【後編】,https://www.hatena.ne.jp/ownedmedia/article/2025/03/13/seminar250129report2
2025-08-24T04:29:52.000000Z,business.hatenastaff.com,Looker Studio×オウンドメディアの使い方。レポート設定方法や計算フィールドの活用例などを紹介【後編】（文・小川卓）,https://www.hatena.ne.jp/ownedmedia/article/2025/03/27/ogawatakulookerstudio
2025-08-24T04:29:52.000000Z,business.hatenastaff.com,オンラインセミナー「オウンドメディアのペルソナ設定とカスタマージャーニーの作り方」を開催します（2025年7月9日）,https://www.hatena.ne.jp/ownedmedia/article/seminar_250709
2025-08-24T04:29:52.000000Z,business.hatenastaff.com,オンラインセミナー「オウンドメディアの始め方」を開催します（2025年7月23日）,https://www.hatena.ne.jp/ownedmedia/article/seminar_250723
2025-08-24T04:29:52.000000Z,business.hatenastaff.com,成果をどう数値化する？ オウンドメディアの間接効果をGA4で計測するための方法（文・小川卓）,https://www.hatena.ne.jp/ownedmedia/article/2025/05/23/ogawatakuga4kouka
2025-08-24T04:29:52.000000Z,business.hatenastaff.com,四季報写経ウーマンに学ぶ「インプットの鉄則」記事ほか、はてなのコンテンツ制作事例を紹介【2025年6月編】,https://www.hatena.ne.jp/ownedmedia/article/2025/06/30/173000
2025-08-24T04:22:16.000000Z,this.kiji.is,パラサイクリングで杉浦が世界新 女子1キロ、全日本選手権,https://news.jp/i/1332198707049267758
2025-08-24T04:22:16.000000Z,this.kiji.is,李大統領、議連会長の菅氏と面会 日韓、経済や文化交流拡大で一致,https://news.jp/i/1332199612718924162
2025-08-24T04:19:50.000000Z,vedomosti.ru,Для пенсионеров предложили ввести льготный проезд по всей России,https://www.vedomosti.ru/society/news/2025/08/24/1133754-dlya-pensionerov
2025-08-24T04:15:16.000000Z,inv.synchack.com,SyncHack.com絵空事,https://inv.synchack.com/feeds/2868357881059915732/comments/default
2025-08-24T04:13:17.000000Z,economictimes.indiatimes.com,'Battle of the Fins': Solar-powered cars begin race through Australian outback,https://economictimes.indiatimes.com/industry/renewables/battle-of-the-fins-solar-powered-cars-begin-race-through-australian-outback/videoshow/123480343.cms
2025-08-24T04:12:24.000000Z,laxinvest.blogspot.com,債券ETF的隱藏真相,http://www.blogger.com/feeds/5942568277233109422/posts/default/1218313983384888152
2025-08-24T04:09:46.000000Z,thesundaily.my,Melaka rekod pelaburan RM855.63 juta suku pertama 2025,https://thesun.my/cerita/berita/melaka-rekod-pelaburan-rm85563-juta-suku-pertama-2025-FH14750445
2025-08-24T04:09:09.000000Z,kibinago7777.blogspot.com,株主優待と高配当株を買い続ける株式投資ブログ,https://kibinago7777.blogspot.com/feeds/782812004028797781/comments/default
2025-08-24T04:09:09.000000Z,kibinago7777.blogspot.com,株主優待と高配当株を買い続ける株式投資ブログ,https://kibinago7777.blogspot.com/feeds/2299621195911635433/comments/default
2025-08-24T04:09:09.000000Z,ktdisk.hatenablog.com,トランプ政権の“汚れ役”？ヴァンス副大統領と司法の綱引き,https://ktdisk.hatenablog.com/entry/2025/02/16/010407
2025-08-24T04:08:01.000000Z,kaz-ataka.hatenablog.com,Between Neuroscience and Marketing,https://kaz-ataka.hatenablog.com/entry/2023/12/23/132444
2025-08-24T04:06:47.000000Z,medium.com,Building a Timed Tetris Game with 50 Bosses Using React — My Fun AI-Assisted Experiment,https://medium.com/@mayanknarula96/building-a-timed-tetris-game-with-50-bosses-using-react-my-fun-ai-assisted-experiment-f03507616b90
2025-08-24T04:06:38.000000Z,hkstockinvestment.blogspot.com,偉哥投資手札,http://hkstockinvestment.blogspot.com/feeds/5568962122764235265/comments/default
2025-08-24T04:06:31.000000Z,thesundaily.my,India-ASEAN cultural harmony event highlights deep regional ties,https://thesun.my/malaysia-news/india-asean-cultural-harmony-event-highlights-deep-regional-ties-AH14750426
2025-08-24T04:03:32.000000Z,medium.com,"Stop Following Your Passion, Build Skills First!",https://medium.com/@shenoy.shashwath/stop-following-your-passion-build-skills-first-6530b6c4c11c
