published_at,source,title,url
,manilatimes.net,NETSOL Chosen by Sonic Automotive to Power Next - Gen Digital Retail Experience,https://www.manilatimes.net/2025/08/26/tmt-newswire/globenewswire/netsol-chosen-by-sonic-automotive-to-power-next-gen-digital-retail-experience/2173935
,jjxw.cn,濂溪区市场监管局开展新能源汽车充电桩价格全覆盖监督检查 保障市民  绿色出行 - 九江新闻网,https://www.jjxw.cn/article/2025/08/26/724162.html
,thebusinessdesk.com,Tech firm secures two contracts across Birmingham and Manchester,https://www.thebusinessdesk.com/westmidlands/news/2101596-tech-firm-secures-two-contracts-across-birmingham-and-manchester/
,northsomersettimes.co.uk,"Tesco , Sainsbury , Asda food prices jump to 18 - month high",https://www.northsomersettimes.co.uk/news/25416423.tesco-sainsburys-asda-food-prices-jump-18-month-high/
,tass.ru,"Доля иностранных инвестиций в российские ОФЗ в июле снизилась до 3 , 8 %",https://tass.ru/ekonomika/24876743
,m.tech.china.com,2025年十大上海高端网站建设排行榜 ， 最新测评精选网站建设公司推荐 _ 中华网,https://m.tech.china.com/redian/2025/0826/082025_1720857.html
,ynet.co.il,הפתרון למשבר אבטחת בתי הספר : קיצוץ רוחבי של 285 מיליון שקל,https://www.ynet.co.il/economy/article/byxmfqiteg
,cna.com.tw,外資賣超逾145億 提款台新金 、 布局華邦電聯電 | 證券,https://www.cna.com.tw/news/afe/202508260345.aspx
,elpuntavui.cat,Nova línia dajuts dOncolliga Girona centrats en la qualitat de vida,http://www.elpuntavui.cat/societat/article/5-societat/2569042-nova-linia-d-ajuts-d-oncolliga-girona-centrats-en-la-qualitat-de-vida.html
,apr.org,"20 years after Hurricane Katrina , the Lower Ninth Ward in New Orleans still lags behind",https://www.apr.org/2025-08-26/20-years-after-hurricane-katrina-the-lower-ninth-ward-in-new-orleans-still-lags-behind
,biztoc.com,"Trump Firing Of Lisa Cook Could Hand Him A Rare FOMC Majority That Could Block  Regional Fed Presidents From Being Reappointed , Says Craig Shapiro",https://biztoc.com/x/c7f39991f6afd9e4
,haberekspres.com.tr,Denizli Ticaret Odası  ndan Yatırımcılara Özel Eğitim Semineri - Haber Ekspres - İzmir Haberleri - Son Dakika Haberleri,https://www.haberekspres.com.tr/denizli-ticaret-odasindan-yatirimcilara-ozel-egitim-semineri
,wnp.pl,PGE ogłosiła przetarg na budowę kolejnej elektrowni gazowej,"https://www.wnp.pl/energia/pge-oglosila-przetarg-na-budowe-kolejnej-elektrowni-gazowej,977517.html"
,wnp.pl,Szwedzki startup fintechowy złożył wniosek o przeprowadzenie IPO,"https://www.wnp.pl/rynki/klarna-z-wnioskiem-o-przeprowadzenie-ipo-to-kolejny-raz-kiedy-firma-chce-wejsc-na-gielde,977560.html"
,tiemposur.com.ar,El Precio del Oro Aumenta Ligera Pero Constante,https://www.tiemposur.com.ar/info-general/el-precio-del-oro-aumenta-ligera-pero-constante
,prnewswire.com,Axxess Partners With Social Media Energy to Help Clients Expand Their Online Presence,https://www.prnewswire.com/news-releases/axxess-partners-with-social-media-energy-to-help-clients-expand-their-online-presence-302537695.html
,orissadiary.com,Kinetic Green signs MOU with IIFL Samasta Finance to accelerate EV adoption across urban and rural markets in India,https://orissadiary.com/kinetic-green-signs-mou-with-iifl-samasta-finance-to-accelerate-ev-adoption-across-urban-and-rural-markets-in-india/
,eveshamjournal.co.uk,Poundland to run out of money in days with jobs at risk,https://www.eveshamjournal.co.uk/news/national/uk-today/25416779.poundland-run-money-days-jobs-risk/
,investors.com,Tesla Stock Nears Buy Point But EV Business In China Is Still Under Pressure,https://www.investors.com/news/tesla-stock-nears-buy-point-but-ev-business-in-china-is-still-under-pressure/
,fokus.se,Mats A Nilsson :  Sveriges maktelit är en klubb för inbördes berikning,https://www.fokus.se/opinion/sveriges-maktelit-ar-en-klubb-for-inbordes-berikning/
,dailypolitical.com,Epoch Investment Partners Inc . Has $70 Million Position in Dell Technologies Inc . $DELL,https://www.dailypolitical.com/2025/08/26/epoch-investment-partners-inc-has-70-million-position-in-dell-technologies-inc-dell.html
,tass.ru,Минфин 27 августа проведет аукционы по размещению ОФЗ двух выпусков,https://tass.ru/ekonomika/24876783
,obozrevatel.com,Цена Nissan Kicks 2026 оказалась низкой - сколько стоит Ниссан Кикс 2 поколения,https://www.obozrevatel.com/avto-oboz/spetsialistyi-rasskazali-pro-samyij-deshevyij-krossover-nissan-foto.htm
,europapress.es,"Málaga capital afianza su conexión con EEUU , tercer emisor internacional de viajeros en julio",https://www.europapress.es/andalucia/malaga-00356/noticia-malaga-capital-afianza-conexion-eeuu-tercer-emisor-internacional-viajeros-julio-20250826121048.html
,ianslive.in,"CIBIL receives over 22 lakh complaints in 2024 - 25 , 5 . 8 lakh due to its errors",https://ianslive.in/cibil-receives-over-22-lakh-complaints-in-2024-25-58-lakh-due-to-its-errors--20250826183658
,metro.batampos.co.id,"Warga Keluhkan Kenaikan PBB , Bapenda Batam Jelaskan Penyebabnya",https://metro.batampos.co.id/warga-keluhkan-kenaikan-pbb-bapenda-batam-jelaskan-penyebabnya/
,goettinger-tageblatt.de,Deutsche Autobranche streicht über 50 . 000 Jobs in einem Jahr,https://www.goettinger-tageblatt.de/wirtschaft/deutsche-autobranche-streicht-ueber-50-000-jobs-in-einem-jahr-F2VZJA6DMFPEHB5CJ5LBEHRBTM.html
,manilatimes.net,Spirit Blockchain Capital Provides Update on Recent Filings and Trading Activity,https://www.manilatimes.net/2025/08/26/tmt-newswire/globenewswire/spirit-blockchain-capital-provides-update-on-recent-filings-and-trading-activity/2173937
,prnewswire.co.uk,Moa develops groundbreaking category of crop protection ; signs partnership deal with Gowan,https://www.prnewswire.co.uk/news-releases/moa-develops-groundbreaking-category-of-crop-protection-signs-partnership-deal-with-gowan-302537625.html
,chip.pl,"Chiny będą czerpać energię prosto z nieba . Latająca elektrownia , jakiej się nie spodziewałeś",https://www.chip.pl/artykul/chiny-latajaca-elektrownia-sterowiec-generatory-s1500
,fakti.bg,"Ивайло Мирчев : Това управление вече е опасно , излизаме на протест на 3 септември ᐉ Новини от Fakti . bg - България",https://fakti.bg/bulgaria/996079-ivailo-mirchev-tova-upravlenie-veche-e-opasno-izlizame-na-protest-na-3-septemvri
,leadership.ng,"Weve Crushed Corruption In Forex Market , Says Tinubu",https://leadership.ng/weve-crushed-corruption-in-forex-market-says-tinubu/
,finanznachrichten.de,Hemostemix Inc .: Hemostemix Boots on the Ground in Florida,https://www.finanznachrichten.de/nachrichten-2025-08/66273178-hemostemix-inc-hemostemix-s-boots-on-the-ground-in-florida-296.htm
,wutc.org,How plants and fungi trade resources without a brain,https://www.wutc.org/2025-08-26/how-plants-and-fungi-trade-resources-without-a-brain
,diarioviregion.cl,CEAF expone resultados de investigación en conferencias que convocaron a la industria de la cereza,https://diarioviregion.cl/noticias/34232-ceaf-expone-resultados-de-investigacion-en-conferencias-que-convocaron-a-la-industria-de-la-cereza%20title=
,eldestapeweb.com,Primer ministro francés Bayrou se someterá a voto de confianza por sus planes presupuestarios,https://www.eldestapeweb.com/informacion-general/francia/primer-ministro-frances-bayrou-se-sometera-a-voto-de-confianza-por-sus-planes-presupuestarios-2025825123251
,gda.com,"Los veinticincomil pesistas uruguayos , ¿ qué características tienen y en qué sectores se concentran ?",https://gda.com/detalle-de-la-noticia/?article=5847516
,biztoc.com,Ondas Holdings Receives a $2 . 7 Million Purchase Order for Its Iron Drone Raider System,https://biztoc.com/x/f1460022742de1ea
,klops.ru,"Cредний размер льготной ипотеки в Калининградской области вырос на 5 , 6 % за месяц",https://klops.ru/kaliningrad/2025-08-26/364859-credniy-razmer-lgotnoy-ipoteki-v-kaliningradskoy-oblasti-vyros-na-5-6-za-mesyats
,finanzen.net,Trading Idee : S & P 500 - Saisonaler Kursrückgang wahrscheinlich,https://www.finanzen.net/nachricht/zertifikate/trading-idee-trading-idee-s-p-500-saisonaler-kursrueckgang-wahrscheinlich-14764558
,halesowennews.co.uk,Households set to learn energy bills to rise by around 1 % in October – forecast,https://www.halesowennews.co.uk/news/national/25416047.households-set-learn-energy-bills-rise-around-1-october---forecast/
,news-medical.net,An insurer agreed to cover her surgery . A politician nudge got the bills paid .,https://www.news-medical.net/news/20250826/An-insurer-agreed-to-cover-her-surgery-A-politiciane28099s-nudge-got-the-bills-paid.aspx
,aljazeera.com,Will Trump latest attack on the Fed erode central bank independence ? | Donald Trump News,https://www.aljazeera.com/economy/2025/8/26/will-trumps-latest-attack-on-the-fed-erode-central-banks-independence
,channelnewsasia.com,Timbre responds to criticism of its management of Yishun Park Hawker Centre,https://www.channelnewsasia.com/singapore/yishun-park-hawker-centre-timbre-kf-seetoh-rentals-cctv-5315101
,indiagazette.com,Orris Group Entertainland Becomes the New Launchpad for Leading Brands in New Gurugram,http://www.indiagazette.com/news/278533819/orris-group-entertainland-becomes-the-new-launchpad-for-leading-brands-in-new-gurugram
,cafef.vn,"VND tiếp tục mất giá trong tháng 8 , áp lực tỷ giá có thể đến từ tình trạng găm giữ USD khi NHNN đang thực hiện nới lỏng chính sách tiền tệ",https://cafef.vn/vnd-tiep-tuc-mat-gia-trong-thang-8-ap-luc-ty-gia-co-the-den-tu-tinh-trang-gam-giu-usd-khi-nhnn-dang-thuc-hien-noi-long-chinh-sach-tien-te-188250826151401489.chn
,globenewswire.com,Fifty1 Labs Partners with LUNR Aerospace to Pioneer,https://www.globenewswire.com/news-release/2025/08/26/3139341/0/en/Fifty1-Labs-Partners-with-LUNR-Aerospace-to-Pioneer-AI-Driven-Drug-Repurposing-for-Space-Medicine-Strategic-Collaboration-Aims-to-Harness-AI-and-Orbital-Access-to-Revolutionize-Ast.html
,oe24.at,AMS - Chef Kopf fordert Reform bei Mindestsicherung,https://www.oe24.at/oesterreich/politik/ams-chef-kopf-fordert-reform-bei-mindestsicherung/646093603
,newspim.com,"뉴욕증시 프리뷰 , 트럼프 쿡 이사 해임 · 장기채 금리 상승에 주가 선물 하락 … 엔비디아 · AMD · 에코스타↑ VS 테슬라↓",https://www.newspim.com/news/view/20250826001046
,baovanhoa.vn,Cơ hội kiến tạo kỷ nguyên mới cho du lịch Đà Nẵng sau sáp nhập,https://baovanhoa.vn/du-lich/co-hoi-kien-tao-ky-nguyen-moi-cho-du-lich-da-nang-sau-sap-nhap-164014.html
,laverdad.es,Trump aumenta la presión sobre la Reserva Federal con el despido de la gobernadora Lisa Cook,https://www.laverdad.es/internacional/eeuu/trump-aumenta-presion-sobre-reserva-federal-despido-20250826071725-ntrc.html
,nbcnews.com,The CDC quietly scaled back a surveillance program for foodborne illnesses,https://www.nbcnews.com/health/health-news/cdc-quietly-scaled-back-surveillance-program-foodborne-illnesses-rcna227089
,163.com,【 世界说 】 从稳健运营35年到只能维持60天  美国小企业正陷入为关税买单的  生存战  |政府|特朗普,https://www.163.com/dy/article/K7TFETRK0514R9KE.html
,navbharattimes.indiatimes.com,"Baahubali The Epic Teaser , बाहुबली : द एपिक  का टीजर रिलीज , फिर थिएटर्स में जादू बिखेरने आ रही राजामौली की फिल्म , दोनों पार्ट का मजा एकसाथ - baahubali the epic teaser out starring prabhas rana daggubati ss rajamouli film release date 31st october ...",https://navbharattimes.indiatimes.com/entertainment/south-movie/baahubali-the-epic-teaser-out-starring-prabhas-rana-daggubati-ss-rajamouli-film-release-date-31st-october-2025/articleshow/123526558.cms
,kompas.com,"Kurang Minum Air Bisa Bikin Stres Makin Parah , Ini Penjelasannya",https://www.kompas.com/sains/read/2025/08/26/201946023/kurang-minum-air-bisa-bikin-stres-makin-parah-ini-penjelasannya
,firstonline.info,"Francia , governo sullorlo della crisi : Bayrou chiede la fiducia , socialisti ago della bilancia",https://www.firstonline.info/francia-governo-sullorlo-della-crisi-bayrou-chiede-la-fiducia-socialisti-ago-della-bilancia/
,orissadiary.com,Centre revises Wheat Stock limit till 31st March 2026,https://orissadiary.com/centre-revises-wheat-stock-limit-till-31st-march-2026/
,163.com,禾川科技披露人形机器人进展 ： 核心部件具备量产能力 ， 已发布2款本体并获订单,https://www.163.com/dy/article/K7TSH6MH0519DFFO.html
,kouvolansanomat.fi,Orpo kommentoi Stubbin linjaa Palestiinasta : Presidentillä oikeus kertoa mielipiteensä – Purra yhtyy Orpon kantaan,https://www.kouvolansanomat.fi/uutissuomalainen/8795946
,theportugalnews.com,Portugal Luxury Property Market : Beyond Golden Visa Requirements,https://theportugalnews.com/news/2025-08-26/portugals-luxury-property-market-beyond-golden-visa-requirements/604467
,euro-petrole.com,Shearwater GeoServices - Shearwater awarded two - month OBN survey ...,https://www.euro-petrole.com/shearwater-awarded-two-month-obn-survey-in-angola-n-i-28895
,cio.com,Winning over IT value skeptics : CIO job No . 1,https://www.cio.com/article/4044011/winning-over-it-value-skeptics-cio-job-no-1.html
,milano.repubblica.it,"Lodi , scoppia bomboletta di spray al peperoncino in una borsa : evacuato il Pronto soccorso",https://milano.repubblica.it/cronaca/2025/08/26/news/lodi_scoppia_bomboletta_spray_peperoncino_pronto_soccorso-424808662/
,citnews.com.cn,重新认识Keep ： 港股AI应用板块的  启明星 _ 中文科技资讯,http://www.citnews.com.cn/news/206482
,thetimes-tribune.com,"Wall Street steadies , global markets sink as Trump escalates Fed feud",https://www.thetimes-tribune.com/2025/08/26/wall-street-trump-fed-feud/
,ritmmsk.ru,Как чехословацкая Jawa вернулась к жизни в Индии : невероятная история культового мотоцикла,https://ritmmsk.ru/interesnoe/kak-chehoslovatskaya-jawa-vernulas-k-zhizni-v-indii-neveroyatnaya-istoriya-kultovogo-mototsikla/
,k.sina.com.cn,20万内最强智驾SUV ？ 尚界H5以  全能无短板  重塑市场标杆 - 新浪汽车,https://k.sina.com.cn/article_1219921942_48b6881602701jp2m.html
,metro.batampos.co.id,Polda Kepri Pastikan Harga Beras Stabil di Bawah HET,https://metro.batampos.co.id/polda-kepri-pastikan-harga-beras-stabil-di-bawah-het/
,non14.net,لعدم تسديد الديون .. العراق يخسر 600 ميغاواط من الكهرباء التركية,http://www.non14.net/180224
,topky.sk,MIMORIADNY ONLINE Svetoví lídri obvinili ruského prezidenta : Putin sa vyhýba schôdzke s ukrajinským prezidentom,https://www.topky.sk/cl/11/3121857/MIMORIADNY-ONLINE-Svetovi-lidri-obvinili-ruskeho-prezidenta--Putin-sa-vyhyba-schodzke-s-ukrajinskym-prezidentom
,u-f.ru,Oettinger : Пивоварение Германии катится к закату,https://u-f.ru/news/economics/u19761/2025/08/26/401637
,baomoi.com,Thành phố Cần Thơ thúc đẩy hợp tác với các doanh nghiệp Thái Lan,https://baomoi.com/thanh-pho-can-tho-thuc-day-hop-tac-voi-cac-doanh-nghiep-thai-lan-c53091941.epi
,rfglobalnet.com,USB Real - Time Spectrum Analyzers Conquer HamRadio,https://www.rfglobalnet.com/doc/usb-real-time-spectrum-analyzers-conquer-hamradio-0001
,etoday.co.kr,"최휘영 장관  APEC 문화산업고위급대화 , 문화협력 이끌어가는 출발점",https://www.etoday.co.kr/news/view/2500409
,oe24.at,Eurospar in der Vorgartenstraße in Wien 2 nach Umbau neu eröffnet,https://www.oe24.at/businesslive/eurospar-in-der-vorgartenstrasse-in-wien-2-nach-umbau-neu-eroeffnet/646104361
,finanza.lastampa.it,"USA , indice case FHFA giugno - 0 , 2 % m / m +2 , 6 % a / a",https://finanza.lastampa.it/News/2025/08/26/usa-indice-case-fhfa-giugno-0-2percento-m-m-+2-6percento-a-a/MTAzXzIwMjUtMDgtMjZfVExC
,hea.china.com,美国投资移民首选 ： 和中移民WellTrend的专业服务 _ 中华网,https://hea.china.com/articles/20250826/202508261720854.html
,ladepeche.fr,"Marché gourmand nocturne : succès populaire , gastronomie locale et ambiance mexicaine festive au cœur de LIsle - Jourdain",https://www.ladepeche.fr/2025/08/26/marche-gourmand-nocturne-succes-populaire-gastronomie-locale-et-ambiance-mexicaine-festive-au-coeur-de-lisle-jourdain-12893988.php
,internethaber.com,Beşiktaş Belediyesi Kültür ve Sosyal İşleri Müdürlüğü  ne yönelik iddianame kabul edildi,https://www.internethaber.com/besiktas-belediyesi-kultur-ve-sosyal-isleri-mudurlugune-yonelik-iddianame-kabul-edildi-2409884h.htm
,money.udn.com,遠東銀現增新股定價敲定 ！ 每股11 . 06元 較市價約打八折 | 金融脈動 | 金融,https://money.udn.com/money/story/5613/8964725
,biztoc.com,Zoom Stock is Up Big on Huge Free Cash Flow - Has ZM Stock Peaked ?,https://biztoc.com/x/47a641571406c907
,merkur.de,Vom Erdinger Supermarkt - Alarm gestoppt,https://www.merkur.de/lokales/erding/erding-ort28651/vom-erdinger-supermarkt-alarm-gestoppt-93901401.html
,kocaeligazetesi.com.tr,"AKPli Ergelenden ihale iddialarna yanıt : Emeğimle , evime ekmek götürüyorum ! - Kocaeli Gazetesi",https://www.kocaeligazetesi.com.tr/haber/26124097/akpli-ergelenden-ihale-iddialarna-yanit-emegimle-evime-ekmek-goturuyorum
,techcabal.com,Lagos Venture Finance Summit 2025 : Catalysing Africa next venture wave,https://techcabal.com/2025/08/26/vencapital/
,excite.co.jp,貯金は不要 ？ 桐谷さんが語る ！ 驚きのお金管理術 ( 2025年8月26日 ),https://www.excite.co.jp/news/article/Allabout_506006_135440/
,biztoc.com,"Eli Lilly Scores Another Weight - Loss Win ; Viking , Novo Stocks Slump",https://biztoc.com/x/c6a373a076fe8eb8
,index.hr,Nike predstavio tenisice koje mijenjaju izgled u mraku,https://www.index.hr/shopping/clanak/nike-predstavio-tenisice-koje-mijenjaju-izgled-u-mraku/2703490.aspx
,kingsofkauffman.com,Predicting what the Royals extending two vital parts of their core could look like,https://kingsofkauffman.com/predicting-what-the-royals-extending-two-vital-parts-of-their-core-could-look-like-01k3h4b756yd
,hartfordbusiness.com,Blumenthal : Trump decision to halt offshore wind project is  insane,https://hartfordbusiness.com/article/blumenthal-trump-decision-to-halt-offshore-wind-project-is-insane/
,corrienteshoy.com,Pedro Rosemblat imitó el  queremos preguntar  de Lanata ante el inmenso escándalo de corrupción del gobierno de Milei,https://www.corrienteshoy.com/nacionales/pedro-rosemblat-imito-el-queremos-preguntar-de-lanata-ante-el-inmenso-escandalo-de-corrupcion-del-gobierno-de-milei.htm
,newsway.co.kr,"BNK금융그룹 , 카자흐스탄에 은행법인 설립",https://newsway.co.kr/news/view?ud=2025082618402806762
,firstonline.info,"Borsa , banche in profondo rosso in Europa : crollano le big francesi , effetto contagio sullItalia . A Milano Unicredit , Mps e Mediobanca le peggiori",https://www.firstonline.info/borsa-banche-in-profondo-rosso-in-europa-crollano-le-big-francesi-effetto-contagio-sullitalia-a-milano-unicredit-mps-e-mediobanca-le-peggiori/
,wnp.pl,Japoński koncern motoryzacyjny stawia na Indie . Zainwestuje miliardy dolarów,"https://www.wnp.pl/przemysl/japonski-koncern-motoryzacyjny-stawia-na-indie-w-ciagu-5-lat-zainwestuje-w-tym-kraju-8-mld-dolarow,977537.html"
,boerse-express.com,Börse Express - Bayer Aktie : Gefangen im Stillstand,https://www.boerse-express.com/news/articles/bayer-aktie-gefangen-im-stillstand-820063
,medyatava.com,Zincir markette kasalar dolusu domates pe dökldü : Yaşlı kadın topladı ! O görntüler tepki çekti,https://www.medyatava.com/yasam/zincir-markette-kasalar-dolusu-domates-cope-dokuldu-yasli-kadin-topladi-o-goruntuler-tepki-cekti-437541
,cna.com.tw,7月國銀房貸逾放月增1 . 46億 金管會 ： 管控仍屬良好 | 產經,https://www.cna.com.tw/news/afe/202508260340.aspx
,vosgesmatin.fr,Santé . Vernis à ongles  : pourquoi certains vont être interdits à partir du 1er septembre,https://www.vosgesmatin.fr/sante/2025/08/26/vernis-a-ongles-pourquoi-certains-vont-etre-interdits-a-partir-du-1er-septembre
,chinatimes.com,女星曝房市 「 有感降價 」！ 揭看屋3關鍵 揪1狀況 ： 有錢也難救 - 娛樂,https://www.chinatimes.com/realtimenews/20250826003114-260404?ctrack=mo_star_headl_p010
,nottinghampost.com,Investigation into death of Nottingham man whose family say pleas were  ignored,https://www.nottinghampost.com/news/nottingham-news/investigation-death-nottingham-man-whose-10453078
,thebusinessdesk.com,People : Shipster ; Realm ; Warden ; Corn Exchange ; Ardent,https://www.thebusinessdesk.com/northwest/news/2157593-people-realm-warden-corn-exchange/
,kxel.com,Trump says he firing Fed Reserve Board Governor Lisa Cook,https://kxel.com/2025/08/26/trump-says-hes-firing-fed-reserve-board-governor-lisa-cook/
,krcu.org,The most illegal search : Judges push back against D . C . criminal charges,https://www.krcu.org/2025-08-26/the-most-illegal-search-judges-push-back-against-d-c-criminal-charges
,biztoc.com,Coca - Cola failed coffee investment faces uncertain future as sale rumors brew,https://biztoc.com/x/ee62ee3019b2b104
,eadt.co.uk,Man charged with manslaughter after Bury St Edmunds assault | East Anglian Daily Times,https://www.eadt.co.uk/news/25417115.man-charged-manslaughter-bury-st-edmunds-assault/
,retailtimes.co.uk,VoucherCodes . co . uk : recession spending isnt what you think,https://retailtimes.co.uk/vouchercodes-co-uk-recession-spending-isnt-what-you-think/
,canalrural.com.br,Moratória da soja desafia a soberania jurídica do Brasil,https://www.canalrural.com.br/opiniao-noticias/moratoria-da-soja-desafia-a-soberania-juridica-do-brasil/
,variety.com,AT & T to Buy Wireless Spectrum From EchoStar for $23 Billion in Cash,https://variety.com/2025/tv/news/att-acquires-spectrum-deal-echostar-23-billion-1236498541/
,it-online.co.za,Senior Project Manager at Datonomy Solutions - Western Cape Cape Town,https://it-online.co.za/2025/08/25/senior-project-manager-at-datonomy-solutions-western-cape-cape-town-7/
,valeursactuelles.com,François Bayrou : les raisons de la colère,https://www.valeursactuelles.com/clubvaleurs/economie/francois-bayrou-les-raisons-de-la-colere
,m.tech.china.com,2025医美消费观察 ： 74 . 4 % 受访者对自身容貌满意度高 四成需求聚焦皮肤改善 _ 中华网,https://m.tech.china.com/redian/2025/0826/082025_1720863.html
,ec.ltn.com.tw,華為被爆採用台積電5奈米技術 「 這款 」 晶片曝,https://ec.ltn.com.tw/article/breakingnews/5157393
,gda.com,De cuánto es la AUH en septiembre 2025 | GDA – Grupo de Diarios América,https://gda.com/detalle-de-la-noticia/?article=5847382
,hvg.hu,"Itthon : Az árból úgy tűnik , mégis támogatja az állam a szociális petesejtfagyasztást",https://hvg.hu/itthon/20250826_Az-arbol-ugy-tunik-megis-tamogatja-az-allam-a-szocialis-petesejtfagyasztast
,biztoc.com,"BofA Lowers PT on Snap From $10 to $9 . 50 , Keeps Neutral Rating",https://biztoc.com/x/e9e49fae3ee3b7b3
,alternet.org,Inside Trump downfall and the thing that will finally do him in,https://www.alternet.org/trumps-downfall/
,cafef.vn,Ba ngân hàng Việt vừa được S & P nâng hạng tín nhiệm,https://cafef.vn/ba-ngan-hang-viet-vua-duoc-sp-nang-hang-tin-nhiem-1882508261303568.chn
,dailypolitical.com,Metrics Income Opportunities Trust ( MOT ) to Issue Interim Dividend of $0 . 01 on September 7th,https://www.dailypolitical.com/2025/08/26/metrics-income-opportunities-trust-mot-to-issue-interim-dividend-of-0-01-on-september-7th.html
,retailtimes.co.uk,Global student housing operator Yugo finds Gen Z overspending driven by AI marketing,https://retailtimes.co.uk/global-student-housing-operator-yugo-finds-gen-z-overspending-driven-by-ai-marketing/
,marketscreener.com,"The Internet New Punching Bag : Fiverr Unveils Garry , the Unhinged AI Character Taking on Internet Culture from the Nicki Minaj Stiletto Challenge to WNBA Mayhem",https://www.marketscreener.com/news/the-interneta-s-new-punching-bag-fiverr-unveils-garry-the-unhinged-ai-character-taking-on-interne-ce7c50d9da8bf624
,merkur.de,Kostenexplosion bei Rente und Bürgergeld : So teuer ist der Sozialhaushalt wirklich,https://www.merkur.de/wirtschaft/kostenexplosion-bei-rente-und-buergergeld-so-teuer-ist-der-sozialhaushalt-wirklich-zr-93901413.html
,dialessandria.it,"Giansanti  La nuova Pac non ci soddisfa , è mancato un confronto",https://www.dialessandria.it/featured/giansanti-la-nuova-pac-non-ci-soddisfa-e-mancato-un-confronto/229925.html
,sloveniatimes.com,The Slovenia Times,https://sloveniatimes.com/44569/linklogis-releases-2025-interim-results-accelerating-global-digital-asset-and-stablecoin-deployment
,dailypolitical.com,Talaria Asset Management Pty Ltd Has $46 . 10 Million Stock Position in Newmont Corporation $NEM,https://www.dailypolitical.com/2025/08/26/talaria-asset-management-pty-ltd-has-46-10-million-stock-position-in-newmont-corporation-nem.html
,thanhnien.vn,Giá vàng giảm sau thông tin xóa bỏ độc quyền vàng miếng,https://thanhnien.vn/gia-vang-giam-sau-thong-tin-xoa-bo-doc-quyen-vang-mieng-185250826195659797.htm
,corrierecomunicazioni.it,"IoT cellulare , il mercato varrà 30 miliardi nel 2030",https://www.corrierecomunicazioni.it/industria-4-0/iot/iot-cellulare-il-mercato-varra-30-miliardi-nel-2030-ma-le-telco-devono-investire-sulle-api/
