published_at,source,title,url
,brief.pl,"SYSTEM COCA - COLA I GLOVO ŁĄCZĄ SIŁY , BY POMÓC POTRZEBUJĄCYM W RAMACH AKCJI „ CZAS WEZWAĆ POSIŁKI",https://brief.pl/system-coca-cola-i-glovo-lacza-sily-by-pomoc-potrzebujacym-w-ramach-akcji-czas-wezwac-posilki/
,finanzasdigital.com,Venezuela planea reducir la quema y venteo de gas natural en 71 %,https://finanzasdigital.com/venezuela-reducir-quema-venteo-gas/
,fox56.com,Kimberly - Clark buying Tylenol maker Kenvue in $48 . 7 billion deal,https://fox56.com/news/nation-world/kimberly-clark-buying-tylenol-maker-kenvue-in-487-billion-deal-shareholders-health-goods-cash-stock-business-irving-texas
,eldiarionuevodia.com.ar,Cyber Monday : 7 consejos para aprovechar descuentos en celulares y notebooks,https://www.eldiarionuevodia.com.ar/nacionales/cyber-monday-7-consejos-para-aprovechar-descuentos-en-celulares-y-notebooks/
,ansa.it,"Confcommercio festeggia 80 anni ,  salviamo negozi , cuore città  - Notizie",https://www.ansa.it/piemonte/notizie/2025/11/03/confcommercio-festeggia-80-anni-salviamo-negozi-cuore-citta_e2dd8fb8-8114-4d5f-ac89-af996ddada61.html
,marketscreener.com,Pinnacle West : Q3 Earnings Snapshot | MarketScreener,https://www.marketscreener.com/news/pinnacle-west-q3-earnings-snapshot-ce7d5cd9dc8df624
,gazeta-shqip.com,BONUSI i fundvitit / A do përfitojnë invalidët ? Ministri : Kjo kërkon ...,https://gazeta-shqip.com/interesi-publik/bonusi-i-fundvitit-a-do-perfitojne-invalidet-ministri-kjo-kerkon/
,pinkvilla.com,"HYBE India marks first step in country , launches official social media accounts with special BTS - related follow",https://www.pinkvilla.com/entertainment/hybe-india-marks-first-step-in-country-launches-official-social-media-accounts-with-special-bts-related-follow-1398175
,insidermonkey.com,MACOM Technology Solutions ( MTSI ) Fell Despite Reporting Strong Results,https://www.insidermonkey.com/blog/macom-technology-solutions-mtsi-fell-despite-reporting-strong-results-1639126/
,trinidadtimes.com,"FundApps and SteelEye Merge to Create a Unified , End - to - End Global Regulatory Compliance Platform",http://www.trinidadtimes.com/news/278671711/fundapps-and-steeleye-merge-to-create-a-unified-end-to-end-global-regulatory-compliance-platform
,hellenicshippingnews.com,Why Rio Chinese investor may be ready to barter | Hellenic Shipping News Worldwide,https://www.hellenicshippingnews.com/why-rios-chinese-investor-may-be-ready-to-barter/
,dnoticias.pt,Rui Marques distribui pelouros e garante que não faz auditoria,https://www.dnoticias.pt/2025/11/3/469030-rui-marques-distribui-pelouros-e-garante-que-nao-faz-auditoria/
,trend.az,"Azerbaijan set to debut at Caspian Sea commission , bringing homegrown research",https://www.trend.az/azerbaijan/society/4112506.html
,thisismoney.co.uk,Manufacturing sheds jobs for 12 months in a row as firms squeezed by Rachel Reeve last Budget - and worry about the next one,https://www.thisismoney.co.uk/money/markets/article-15252713/Manufacturing-sheds-jobs-12-months-row-firms-squeezed-Rachel-Reeves-Budget-worry-one.html
,tynmagazine.com,"Tenaris Inicia Segundo Tramo por USD 600 millones de su Programa de Recompra de Acciones por USD 1 , 200 millones",https://tynmagazine.com/tenaris-inicia-segundo-tramo-por-usd-600-millones-de-su-programa-de-recompra-de-acciones-por-usd-1200-millones/
,globenewswire.com,HSBC Continental Europe : Pre Stabilisation Notice,https://www.globenewswire.com/news-release/2025/11/03/3179250/0/en/HSBC-Continental-Europe-Pre-Stabilisation-Notice.html
,demokrata.hu,Milliárdos károkat okozna a sorkatonaság – szakértők figyelmeztetik a Tisza Pártot,https://demokrata.hu/magyarorszag/milliardos-karokat-okozna-a-sorkatonasag-szakertok-figyelmeztetik-a-tisza-partot-1084314/
,marketscreener.com,NewcelX Provides Business and Strategic Roadmap Update Following Closing of Merger with NLS Pharmaceutics Ltd .,https://www.marketscreener.com/news/newcelx-provides-business-and-strategic-roadmap-update-following-closing-of-merger-with-nls-pharmace-ce7d5cd9dc8df72d
,haberler.com,Altını olanlar dikkat : Uzman ismin öngördüğü rakam inanılmaz,http://www.haberler.com/ekonomi/altini-olanlar-dikkat-altin-icin-ongorulen-rakam-19214763-haberi/
,nhipcaudautu.vn,Mondelez Kinh Đô Việt Nam bổ nhiệm Tổng giám đốc mới,https://nhipcaudautu.vn/su-kien-doanh-nghiep/mondelez-kinh-do-viet-nam-bo-nhiem-tong-giam-doc-moi-3363745/
,mediafax.ro,"Românii pot cumpăra peste 1 , 5 milioane de produse și servicii la cel mai mic preț din an de Black Friday la eMAG . În premieră , se vând și abonamente la energie sub cea mai bună ofertă",https://www.mediafax.ro/economic/romanii-pot-cumpara-peste-15-milioane-de-produse-si-servicii-la-cel-mai-mic-pret-din-an-de-black-friday-la-emag-in-premiera-se-vand-si-abonamente-la-energie-sub-cea-mai-buna-oferta-23635956
,variety.com,Animation ! at Ventana Sur Unveils 14 Projects,https://variety.com/2025/film/global/animation-ventana-sur-cesar-cabral-german-acuna-1236568283/
,baomoi.com,Tịch thu 20 bao tải chứa hàng nghìn quần áo cũ không rõ nguồn gốc,https://baomoi.com/tich-thu-20-bao-tai-chua-hang-nghin-quan-ao-cu-khong-ro-nguon-goc-c53661847.epi
,parkiet.com,Atende : wyniki za III kwartał słabsze od oczekiwań . Strata Atende w III kwartale 2025,https://www.parkiet.com/technologie/art43278291-atende-rozczarowalo-bedzie-poprawa
,goettinger-tageblatt.de,Ibrahim Traoré in Burkina Faso : Ein neuer Che Guevara – oder Putins Marionette in Westafrika ?,https://www.goettinger-tageblatt.de/politik/ibrahim-traore-in-burkina-faso-ein-neuer-che-guevara-oder-putins-marionette-in-westafrika-TF6HZUIXXZGFHJNAUOJ7XJLCM4.html
,stock-world.de,Bloom Energy Aktie : Aufschwung spürbar !,https://www.stock-world.de/bloom-energy-aktie-aufschwung-spuerbar/
,travelbizmonitor.com,"Flyadeal to launch India flights in 2026 - TravelBiz Monitor : India travel news , travel trends , tourism",https://travelbizmonitor.com/top-stories/flyadeal-to-launch-india-flights-in-2026/
,hellenicshippingnews.com,"The EU clarifies on the 18th sanctions package : Reliance to gain , STAR to lose | Hellenic Shipping News Worldwide",https://www.hellenicshippingnews.com/the-eu-clarifies-on-the-18th-sanctions-package-reliance-to-gain-star-to-lose/
,acritica.com,Sine Manaus oferta 282 vagas de emprego em diversas áreas nesta segunda - feira ( 3 ),https://www.acritica.com/manaus/sine-manaus-oferta-282-vagas-de-emprego-em-diversas-areas-nesta-segunda-feira-3-1.387753
,hellenicshippingnews.com,Xeneta Weekly Ocean Container Shipping Market Update : Average Rates Moved Sideways,https://www.hellenicshippingnews.com/xeneta-weekly-ocean-container-shipping-market-update-average-rates-moved-sideways/
,agerpres.ro,"Piața de Home & Deco din România : GODPLAY IMPEX SRL Lansează Brico Casa , o Platformă Dedicată Soluțiilor Integrate pentru Cămin",https://agerpres.ro/ots/piata-de-home-deco-din-romania-godplay-impex-srl-lanseaza-brico-casa-o-platforma-dedicata-solutiilor--658587
,guampdn.com,"US government seeks $7M forfeiture from Michael Marasigan , 2 other Hafa Adai Bingo fraud convicts",https://www.guampdn.com/news/us-government-seeks-7m-forfeiture-from-michael-marasigan-2-other-hafa-adai-bingo-fraud-convicts/article_31e4bfd7-bb25-4922-b416-00aaf56046be.html
,samtiden.nu,Linn Johansson : Anders Lindberg är i sig en fadäs,https://samtiden.nu/2025/11/linn-johansson-anders-lindberg-ar-i-sig-en-fadas/
,interempresas.net,El mercado europeo del parquet se estabiliza tras tocar fondo en 2024,https://www.interempresas.net/pavimentos-revestimientos/612850-El-mercado-europeo-del-parquet-se-estabiliza-tras-tocar-fondo-en-2024.html
,sinmordaza.com,Comenzó una nueva edición del CyberMonday,https://sinmordaza.com/noticia/482772-comenzo-una-nueva-edicion-del-cybermonday.html
,sichuan.scol.com.cn,2025世界显示产业创新发展大会在成都开幕 王晓晖出席开幕式 施小琳致辞 _ 四川在线,https://sichuan.scol.com.cn/gcdt/202511/83149013.html
,informacion.es,CASO KOLDO - ÁBALOS : El juez del Supremo destaca la relevancia de la confesión de Aldama porque no es  autoexculpatoria  y asume  su propia responsabilidad,https://www.informacion.es/nacional/2025/11/03/juez-supremo-destaca-relevancia-confesion-123309073.html
,pratahkal.com,बैंकिंग सेक्टर में बड़ा धमाका ; सिर्फ 4 पब्लिक सेक्टर बैंक रह जाएंगे सक्रिय ? | Big bang in the banking sector ; will only 4 public sector banks remain active ?,https://www.pratahkal.com/bussiness/big-bang-in-the-banking-sector-will-only-4-public-sector-banks-remain-active-1537357
,zazoom.it,Addio a Loriano Bagnoli limprenditore che fece nascere Sammontana,https://www.zazoom.it/2025-11-03/addio-a-loriano-bagnoli-limprenditore-che-fece-nascere-sammontana/18062634/
,liputan6.com,"Purbaya Siapkan Cukai Khusus untuk Rokok Ilegal , Berapa Tarifnya ?",https://www.liputan6.com/bisnis/read/6202331/purbaya-siapkan-cukai-khusus-untuk-rokok-ilegal-berapa-tarifnya
,ecoaltomolise.net,"Bancomat fatto esplodere , il sindaco : « La sicurezza non può essere uno slogan , servono risorse »",https://ecoaltomolise.net/bancomat-fatto-esplodere-il-sindaco-la-sicurezza-non-puo-essere-uno-slogan-servono-risorse/
,24hlive.it,"Guadagno Deliveroo Senza Partita IVA : Limiti , Tasse e Contratto Rider 2025",https://www.24hlive.it/quanto-posso-guadagnare-con-deliveroo-senza-partita-iva/
,wbjournal.com,From the Editor : WBJ launches data - rich INSIGHTS special edition,https://wbjournal.com/article/from-the-editor-wbj-launches-data-rich-insights-special-edition/
,insidermonkey.com,Should You Hold Haemonetics Corporation ( HAE )?,https://www.insidermonkey.com/blog/should-you-hold-haemonetics-corporation-hae-1639124/
,iodonna.it,"Sostituire , smaltire , risparmiare : al via il bonus elettrodomestici %",https://www.iodonna.it/attualita/famiglia-e-lavoro/2025/11/03/al-via-il-bonus-elettrodomestici-allinsegna-della-sostenibilita/
,pressnetwork.de,valuteo auf der Solar Solutions : Photovoltaik Investments,https://pressnetwork.de/valuteo-auf-der-solar-solutions-photovoltaik-investments/
,burkina24.com,Forte mobilisation citoyenne : Plus de 5 Millions de FCFA Collectés pour Faso mêbo,https://burkina24.com/2025/11/03/forte-mobilisation-citoyenne-plus-de-5-millions-de-fcfa-collectes-pour-faso-mebo/
,pratahkal.com,"अंता उपचुनाव की तैयारियां तेज़ प्रशिक्षण कार्यक्रम तय , मनरेगा श्रमिकों को मिलेगा मतदान दिवस पर अवकाश , 9 से 11 नवम्बर तक रहेगा सूखा दिवस | Preparations for the Anta by - election are in full swing – training programs are finalized , MNREGA workers w...",https://www.pratahkal.com/rajasthan/preparations-for-the-anta-by-election-are-in-full-swing-training-programs-are-finalized-mnrega-workers-will-get-a-holiday-on-polling-day-and-a-dry-day-will-be-observed-from-november-9th-to-11th-1537358
,farodevigo.es,La historia de Enric con Reincorpora,https://www.farodevigo.es/ideas/Fundacion-laCaixa-vida-despues-carcel/
,insidermonkey.com,Analyst on AbbVie ( ABBV ):  Stay Long  - Insider Monkey,https://www.insidermonkey.com/blog/analyst-on-abbvie-abbv-stay-long-1638454/
,insidermonkey.com,Analyst Says She  Suspiciou About  Sustainability  of Apple ( AAPL ) Stock Uptrend – Here Why,https://www.insidermonkey.com/blog/analyst-says-shes-suspicious-about-sustainability-of-apple-aapl-stock-uptrend-heres-why-1638456/
,insidermonkey.com,Analyst Says Microsoft ( MSFT ) at  Intersection  of Software and AI,https://www.insidermonkey.com/blog/analyst-says-microsoft-msft-at-intersection-of-software-and-ai-1638483/
,ildenaro.it,"Ecomondo , da domani a Rimini la fiera internazionale della green economy con 47 aziende campane",https://www.ildenaro.it/ecomondo-da-domani-a-rimini-la-fiera-internazionale-della-green-economy-con-47-aziende-campane/
,informacion.es,El precio del alquiler da un pequeño respiro en Alicante : esto es lo que ha subido en el último año,https://www.informacion.es/economia/2025/11/03/precio-alquiler-da-pequeno-respiro-alicante-123309954.html
,insidermonkey.com,Here How the Acquisition Favored James Hardie Industries ( JHX ),https://www.insidermonkey.com/blog/heres-how-the-acquisition-favored-james-hardie-industries-jhx-1639142/
,elfagr.org,أسعار السمك البلطي والبوري اليوم الاثنين 3 - 11 - 2025 في محافظة قنا,https://www.elfagr.org/5245665
,zonebourse.com,Le FTSE 100 britannique progresse légèrement au début dune semaine chargée en résultats et décision sur les taux de la BoE,https://www.zonebourse.com/actualite-bourse/le-ftse-100-britannique-progresse-legerement-au-debut-d-une-semaine-chargee-en-resultats-et-decision-ce7d5cd9dc88f327
,tribecacitizen.com,Tribeca Citizen | Friedmans has switched concepts at Independence Plaza,https://tribecacitizen.com/2025/11/03/friedmans-has-switched-concepts-at-independence-plaza/
,elcorreo.com,La Euroliga obliga al Asvel a subir el sueldo a sus jugadores,https://www.elcorreo.com/baskonia/euroliga-obliga-asvel-subir-sueldo-jugadores-limite-financiero-impagos-20251103124926-nt.html
,economictimes.indiatimes.com,Pine Labs CEO says IPO size trimmed as investors decided to sell less at price band,https://economictimes.indiatimes.com/markets/ipos/fpos/pine-labs-ceo-says-ipo-size-trimmed-as-investors-decided-to-sell-less-at-price-band/articleshow/125059504.cms
,openpr.com,"U . S . Medical Fiber Optics Market Trends , Investment",https://www.openpr.com/news/4251344/u-s-medical-fiber-optics-market-trends-investment
,zazoom.it,Rottweiler sequestrato | il padrone lo incitava ad aggredire,https://www.zazoom.it/2025-11-03/rottweiler-sequestrato-il-padrone-lo-incitava-ad-aggredire/18062670/
,rp.pl,PMI dla polskiego przemysłu w trendzie w górę . Na danych jest jednak niepokojąca rysa,https://www.rp.pl/dane-gospodarcze/art43278021-pmi-dla-polskiego-przemyslu-pnie-sie-w-gore-najwyzszy-wynik-od-pol-roku
,wbjournal.com,Are more skyscrapers coming to Worcester ?,https://wbjournal.com/article/are-more-skyscrapers-coming-to-worcester/
,b92.net,U ovoj državi EU ima najmanje žena na rukovodećim pozicijama,https://www.b92.net/biz/svet/vesti/178302/u-ovoj-drzavi-eu-ima-najmanje-zena-na-rukovodecim-pozicijama/vest
,tynmagazine.com,Alphabet venderá €3 . 000 millones en bonos para financiar expansión en IA,https://tynmagazine.com/alphabet-vendera-e3-000-millones-en-bonos-para-financiar-expansion-en-ia/
,guncelgazete.com,Bu çarşıda sadece kadınların el emekleri satılıyor,https://www.guncelgazete.com/gundem/bu-carsida-sadece-kadinlarin-el-emekleri-satiliyor-58940
,insidermonkey.com,Mixed Analyst Views on Maplebear Inc . ( CART ) as Pricing Trends Shift,https://www.insidermonkey.com/blog/mixed-analyst-views-on-maplebear-inc-cart-as-pricing-trends-shift-1639119/
,diariosigloxxi.com,"El precio de la luz baja mañana un 40 % hasta los 49 , 44 euros por MWh",https://www.diariosigloxxi.com/texto-s/mostrar/623927/precio-luz-baja-manana-40-hasta-4944-euros-mwh
,elektroniknet.de,Cybersecurity mit Arm TrustZone als Basis,https://www.elektroniknet.de/embedded/entwicklungstools/cybersecurity-mit-arm-trustzone-als-basis.228320.html
,energyglobal.com,NeXtWind opens Germany energy transition to international lenders,https://www.energyglobal.com/wind/03112025/nextwind-opens-germanys-energy-transition-to-international-lenders/
,rttnews.com,WHO Issues Guidance To Address Drastic Global Health Financing Cuts,https://www.rttnews.com/story.aspx?Id=3589571
,brf.be,Schon 20 . 000 kg Marihuana dieses Jahr im Hafen von Antwerpen sichergestellt,https://brf.be/national/2021360/
,aktiencheck.de,Lumen Aktie : Kampf um die Wende ! () | aktiencheck . de,https://www.aktiencheck.de/analysen/Artikel-Lumen_Aktie_Kampf_um_Wende-19171333
,hellenicshippingnews.com,GMS Week 44 – HALLOWEEN NOVEMBER ? | Hellenic Shipping News Worldwide,https://www.hellenicshippingnews.com/gms-week-44-halloween-november/
,diaridegirona.cat,GENT GRAN RIPOLLÈS | El Ripollès impulsa una prova pilot per oferir atenció hospitalària a domicili a gent gran,https://www.diaridegirona.cat/comarques/2025/11/03/ripolles-impulsa-prova-pilot-per-123308783.html
,xx.sdnews.com.cn,2025年培育钻定制品牌榜出炉 ！ 6大TOP品牌工艺与口碑深度全解析,http://xx.sdnews.com.cn/xx/202511/t20251103_4597800.htm
,globenewswire.com,"Molina Healthcare , Inc . Sued for Securities Law Violations",https://www.globenewswire.com/news-release/2025/11/03/3179255/0/en/Molina-Healthcare-Inc-Sued-for-Securities-Law-Violations-Contact-the-DJS-Law-Group-to-Discuss-Your-Rights-MOH.html
,news.finance.ua,Безкоштовні поїздки до 3000 км : як працюватиме нова програма « Укрзалізниці » Finance . ua,https://news.finance.ua/ua/bezkoshtovni-poizdky-do-3000-km-yak-pracyuvatyme-nova-prohrama-ukrzaliznyci
,eska.pl,Bagi walczył z uzależnieniem po rozstaniu . Opowiedział o najcięższym okresie życia,https://www.eska.pl/rozrywka/hotplota/bagi-walczyl-z-uzaleznieniem-po-rozstaniu-opowiedzial-o-najciezszym-okresie-zycia-aa-ZA5N-AQQM-Kor8.html
,biztoc.com,This Inexpensive Tesla Rival Is Quietly Gaining Ground Key Ranking Suggests A Major Breakout Could Be Imminent,https://biztoc.com/x/78b8fb13013499d3
,diariosigloxxi.com,El viaje interior de Frank Díaz : de la fama infantil a la plenitud en el arte,https://www.diariosigloxxi.com/texto-diario/mostrar/5565414/viaje-interior-frank-diaz-fama-infantil-plenitud-arte
,russian.rt.com,Bloomberg : НПЗ КНР отказываются от закупок нефти из России на фоне санкций США,https://russian.rt.com/world/news/1554480-npz-knr-otkaz-neft-rossiya
,jornalpequeno.com.br,Mais de 2 milhões de maranhenses podem pagar as dívidas com até 99 % de desconto,https://jornalpequeno.com.br/2025/11/03/mais-de-2-milhoes-de-maranhenses-podem-pagar-as-dividas-com-ate-99-de-desconto/
,centralwesterndaily.com.au,2026 BYD Sealion 8 review : Quick drive,https://www.centralwesterndaily.com.au/story/9103647/2026-byd-sealion-8-review-quick-drive/
,buffalonews.com,African Heritage Food Co - op coming to Fruit Belt in Buffalo,https://buffalonews.com/news/local/business/development/article_33350044-4294-49a4-ac5a-72e822cf4ba4.html
,northweststar.com.au,Inspirational Tasmanians vie for 2026 Australian of the Year | The North West Star,https://www.northweststar.com.au/story/9101671/inspirational-tasmanians-vie-for-2026-australian-of-the-year/
,zaobao.com.sg,我国10月制造业PMI跌至50 连续三个月位于扩张区间,https://www.zaobao.com.sg/finance/singapore/story20251103-7760853
,hellenicshippingnews.com,LNG Tanker Market Moved Higher Last Week | Hellenic Shipping News Worldwide,https://www.hellenicshippingnews.com/lng-tanker-market-moved-higher-last-week/
,ildenaro.it,"Moneta , disuguaglianze e ricerca : la Sie riunisce a Napoli 700 studiosi da tutto il mondo",https://www.ildenaro.it/moneta-disuguaglianze-e-ricerca-la-sie-riunisce-a-napoli-700-studiosi-da-tutto-il-mondo/
,inewsgr.com,"Ανδρουλάκης κατά Τσίπρα : Το ΠΑΣΟΚ δεν είναι κόμμα one man show , με πεφωτισμένη ηγεσία που τη στηρίζει η διαπλοκή",https://www.inewsgr.com/184/androulakis-kata-tsipra-to-pasok-den-einai-ena-komma-one-man-show-me-pefotismeni-igesia-pou-ti-stirizei-i-diaploki.htm
,noitv.it,"Porcari , new entry in giunta : Madalina Elena Golea è la nuova assessora",https://www.noitv.it/2025/11/porcari-new-entry-in-giunta-madalina-elena-golea-e-la-nuova-assessora-707249/
,connectradio.fm,Police Investigating Trailer Theft – Connect FM | Local News Radio,https://www.connectradio.fm/news/police-investigating-trailer-theft/
,bunburymail.com.au,Inspirational Tasmanians vie for 2026 Australian of the Year | Bunbury Mail,https://www.bunburymail.com.au/story/9101671/inspirational-tasmanians-vie-for-2026-australian-of-the-year/
,wallstreet-online.de,Precision BioSciences Aktie ( DTIL ) | Aktienkurs » US74019P2074,https://www.wallstreet-online.de/aktien/us74019p2074-precision-biosciences-aktie
,respublika.lt,Respublika - Naujienų ir žinių portalas,"https://www.respublika.lt/lt/naujienos/lietuva/kitos-lietuvos-zinios/finansu-ministerija-investuoja-25-mln-euru-i-giraites-ginkluotes-gamykla/,coments.1"
,news.finance.ua,"Нафта продовжує зростати після того , як ОПЕК+ призупинила збільшення видобутку у 1 кварталі Finance . ua",https://news.finance.ua/ua/nafta-prodovzhuye-zrostaty-pislya-toho-yak-opek-pryzupynyla-zbil-shennya-vydobutku-u-1-kvartali
,portal.lviv.ua,"Британія дала Україні більше ракет Storm Shadow для ударів по Росії , – ЗМІ",https://portal.lviv.ua/news/2025/11/03/brytaniia-dala-ukraini-bilshe-raket-storm-shadow-dlia-udariv-po-rosii-zmi
,openpr.com,Live Streaming Games Market Is Booming So Rapidly,https://www.openpr.com/news/4251333/live-streaming-games-market-is-booming-so-rapidly-trovo
,www.monitorulexpres.ro,Romania,https://www.monitorulexpres.ro/2025/11/03/tripticul-de-balet-clasic-paquita-pas-de-quatre-don-quijote-premiera-la-opera-brasov/
,www.monitorulexpres.ro,"San Francisco, California, United States",https://www.monitorulexpres.ro/2025/11/03/tripticul-de-balet-clasic-paquita-pas-de-quatre-don-quijote-premiera-la-opera-brasov/
,www.milanofinanza.it,Italy,https://www.milanofinanza.it/news/tecnologia-in-italia-mercato-ict-oltre-i-44-miliardi-grazie-ad-ai-e-cloud-in-ue-comparto-da-quasi-700-202511031115231928
,news.yam.md,Moldova,https://news.yam.md/ro/story/18058808
,news.yam.md,Afghanistan,https://news.yam.md/ro/story/18058808
,www.iha.com.tr,Turkey,https://www.iha.com.tr/ankara-haberleri/bakan-tekin-45-farkli-ulkede-2-bin-785-bursiyerimiz-var-325689554
,www.elchubut.com.ar,Germany,https://www.elchubut.com.ar/carta-del-lector/2025-11-3-9-50-0-europa-dividida-ante-la-energia-nuclear-ii
,www.elchubut.com.ar,Lithuania,https://www.elchubut.com.ar/carta-del-lector/2025-11-3-9-50-0-europa-dividida-ante-la-energia-nuclear-ii
,www.finanznachrichten.de,"Munich, Bayern, Germany",https://www.finanznachrichten.de/nachrichten-2025-10/66832684-vodafone-kauft-cloud-service-anbieter-skaylink-016.htm
,ain.ua,Ukraine,https://ain.ua/2025/11/03/netflix-rozgliadaje-mozlivist-pridbannia-warner-bros-discovery-reuters/
,ain.ua,"New York, United States",https://ain.ua/2025/11/03/netflix-rozgliadaje-mozlivist-pridbannia-warner-bros-discovery-reuters/
,www.yahoo.com,"Alexandria, Al Iskandariyah, Egypt",https://www.yahoo.com/news/articles/why-tuesday-elections-could-democrats-120001368.html
,www.yahoo.com,Mexico,https://www.yahoo.com/news/articles/why-tuesday-elections-could-democrats-120001368.html
,www.yahoo.com,"Arizona, United States",https://www.yahoo.com/news/articles/why-tuesday-elections-could-democrats-120001368.html
,tradearabia.com:443,"Dubai, Dubayy, United Arab Emirates",https://tradearabia.com:443/News/329984/Dar-Global-project-pipeline-reaches-$19bn
,tradearabia.com:443,Saudi Arabia,https://tradearabia.com:443/News/329984/Dar-Global-project-pipeline-reaches-$19bn
,tradearabia.com:443,"London, London, City Of, United Kingdom",https://tradearabia.com:443/News/329984/Dar-Global-project-pipeline-reaches-$19bn
,tradearabia.com:443,"Jeddah, Makkah, Saudi Arabia",https://tradearabia.com:443/News/329984/Dar-Global-project-pipeline-reaches-$19bn
,nesn.com,"Texas, United States",https://nesn.com/2025/11/red-sox-free-agency-rumors-al-rival-will-pass-on-all-star-slugger/
,finance.sina.com.cn,Switzerland,https://finance.sina.com.cn/tech/roll/2025-11-03/doc-infwcvcm0790927.shtml
,finance.sina.com.cn,Taiwan,https://finance.sina.com.cn/tech/roll/2025-11-03/doc-infwcvcm0790927.shtml
,www.kwit.org,Japan,https://www.kwit.org/2025-11-03/gender-inequality-accelerates-japans-rural-depopulation
,hoy.com.do,"Caracas, Distrito Federal, Venezuela",https://hoy.com.do/trinidad-y-tobago-se-alinea-con-ee-uu-contra-el-narcotrafico/
,hoy.com.do,Venezuela,https://hoy.com.do/trinidad-y-tobago-se-alinea-con-ee-uu-contra-el-narcotrafico/
,news.webindia123.com,"Karnataka, Karnataka, India",https://news.webindia123.com/news/Articles/Business/20251103/4379556.html
,news.webindia123.com,"Haryana, Haryana, India",https://news.webindia123.com/news/Articles/Business/20251103/4379556.html
,news.webindia123.com,"Tamil Nadu, Tamil Nadu, India",https://news.webindia123.com/news/Articles/Business/20251103/4379556.html
,www.wnp.pl,China,"https://www.wnp.pl/energia/chiny-uderzaja-w-rosje-tego-kreml-sie-nie-spodziewal,1000446.html"
,www.wnp.pl,"Kremlin, Moskva, Russia","https://www.wnp.pl/energia/chiny-uderzaja-w-rosje-tego-kreml-sie-nie-spodziewal,1000446.html"
,www.wnp.pl,Russia,"https://www.wnp.pl/energia/chiny-uderzaja-w-rosje-tego-kreml-sie-nie-spodziewal,1000446.html"
,www.wnp.pl,"Moscow, Moskva, Russia","https://www.wnp.pl/energia/chiny-uderzaja-w-rosje-tego-kreml-sie-nie-spodziewal,1000446.html"
,www.wnp.pl,United Kingdom,"https://www.wnp.pl/energia/chiny-uderzaja-w-rosje-tego-kreml-sie-nie-spodziewal,1000446.html"
,www.businessnews.gr,Spain,https://www.businessnews.gr/kosmos/item/322264-ispania-dikastis-zitise-tin-parapompi-se-diki-proin-ypourgoy-tis-kyvernisis-santseth-gia-diafthoras
,www.yahoo.com,"Connecticut, United States",https://www.yahoo.com/news/articles/washington-residents-want-better-cell-110019004.html
,www.yahoo.com,"New Preston, Connecticut, United States",https://www.yahoo.com/news/articles/washington-residents-want-better-cell-110019004.html
