published_at,source,title,url
,rbc.ua,"Курс долара НБУ на 20 жовтня зріс до 41 , 73 гривень",https://www.rbc.ua/rus/news/nbu-znovu-pidvishchiv-kurs-dolara-pislya-1760704194.html
,folha.uol.com.br,Dólar e Bolsa hoje ( 17 ); acompanhe as cotaes - 17 / 10 / 2025 - Mercado,https://www1.folha.uol.com.br/mercado/2025/10/dolar-abre-estavel-em-dia-de-agenda-economica-esvaziada.shtml
,benzinga.com,"Top 2 Industrials Stocks That May Collapse This Quarter - Cadre Hldgs ( NYSE : CDRE ), Paranovus Entertainment ( NASDAQ : PAVS )",https://www.benzinga.com/trading-ideas/short-ideas/25/10/48273377/top-2-industrials-stocks-that-may-collapse-this-quarter
,automedia.mk,БМВ го престигна Лексус како најпродавана луксузна марка во САД,https://automedia.mk/objavi/bmw-pred-lexus-toyota-pazar-sad-q3-25/
,kerkida.net,Θύρα 1 / Πλησιάζει ξανά η ώρα για την τζούρα που στερούμαστε ...,https://www.kerkida.net/eidiseis/a-katigoria/apollonas/thyra-1plisiazei-xana-i-ora-gia-tin-tzoyra-poy-steroymaste
,wnp.pl,"MF : Nowe urządzenie RTG w lubelskiej KAS , które usprawni odprawy w Koroszczynie","https://www.wnp.pl/rynki/mf-nowe-urzadzenie-rtg-w-lubelskiej-kas-ktore-usprawni-odprawy-w-koroszczynie,995462.html"
,elconfidencial.com,La banca de inversión da más potencial a BBVA tras el no a la opa y confía en Sabadell en solitario,https://www.elconfidencial.com/empresas/2025-10-17/cotizacion-bbva-sabadell-potencial-perspectivas-banca-inversion-opa_4230021/
,forbes.com,What Happening With Datadog Stock ?,https://www.forbes.com/sites/greatspeculations/2025/10/17/whats-happening-with-datadog-stock/
,ekriti.gr,Στέγαση : Αποτυχία για το « Σπίτι μου 2 » και « Ενεργειακή Αναβάθμιση » – Στο 30 % και στο 13 % η απορρόφηση,https://www.ekriti.gr/oikonomia/stegasi-apotyhia-gia-to-spiti-moy-2-kai-energeiaki-anabathmisi-sto-30-kai-sto-13-i-aporrofisi
,hoy.com.py,"Diario HOY | Cuarenta viviendas afectadas por temporal en Ayolas , declaran emergencia",https://www.hoy.com.py/nacionales/2025/10/17/cuarenta-viviendas-afectadas-por-temporal-en-ayolas-declaran-emergencia
,newratings.de,newratings . de,https://www.newratings.de/du/main/company_headline.m?nid=19116185
,kwongwah.com.my,霹电讯公会1111晚宴 会员商界同业齐庆23周年光华日报 | 1910年创刊 创新每一天生活,https://www.kwongwah.com.my/20251017/%E9%9C%B9%E7%94%B5%E8%AE%AF%E5%85%AC%E4%BC%9A1111%E6%99%9A%E5%AE%B4-%E4%BC%9A%E5%91%98%E5%95%86%E7%95%8C%E5%90%8C%E4%B8%9A%E9%BD%90%E5%BA%8623%E5%91%A8%E5%B9%B4/
,dailytimes.com.pk,IMF pushes Pakistan to raise taxes on solar and internet services,https://dailytimes.com.pk/1385319/imf-pushes-pakistan-to-raise-taxes-on-solar-and-internet-services/
,mediapost.com,"DoubleVerify Further Integrates Into Microsoft Advertising , Authenticates Measurement",https://www.mediapost.com/publications/article/409977/doubleverify-further-integrates-into-microsoft-adv.html
,webwire.com,BBVA to Accelerate Shareholder Remuneration Following the Lapse of its Offer for Banco Sabadell,https://www.webwire.com/ViewPressRel.asp?aId=345418
,liputan6.com,"Dinamika Pasar Berubah , Emiten Asuransi Butuh Proses Transaksi Lebih Aman",https://www.liputan6.com/saham/read/6188275/dinamika-pasar-berubah-emiten-asuransi-butuh-proses-transaksi-lebih-aman
,etnews.com,"삼성家 세모녀 , 삼성전자 주식 1 . 7조원 처분",https://www.etnews.com/20251017000395
,diariovasco.com,"La recaudación acumulada en Gipuzkoa aumenta un 9 , 7 % hasta septiembre en relación con el año anterior",https://www.diariovasco.com/economia/fiscalidad/recaudacion-acumulada-gipuzkoa-aumenta-septiembre-relacion-ano-20251017151530-nt.html
,nordbayern.de,"4 , 8 Sterne : Überragend bewerteter Bosch - Akkuschrauber 18V EasyDrill mit 2x Akku hier top - günstig",https://www.nordbayern.de/schnaeppchen/4-8-sterne-uberragend-bewerteter-bosch-akkuschrauber-18v-easydrill-mit-2x-akku-hier-top-gunstig-1.14871372
,bankier.pl,Afera Polnordu . Giertych : Zadośćuczynienie powinni zapłacić mi Ziobro i Święczkowski,https://www.bankier.pl/wiadomosc/Afera-Polnordu-Giertych-Zadoscuczynienie-powinni-zaplacic-mi-Ziobro-i-Swieczkowski-9026364.html
,bankier.pl,Kalendarz ekonomiczny 20 - 26 . 10 . 2025 : Worek statystyk z polskiej gospodarki i opóźniona inflacja w united states,https://www.bankier.pl/wiadomosc/Kalendarz-ekonomiczny-20-26-10-2025-Worek-statystyk-z-polskiej-gospodarki-i-opozniona-inflacja-w-USA-9026314.html
,mikrometoxos.gr,"Eurostat : Στο 1 , 8 % επιβεβαιώνεται ο πληθωρισμός για την Ελλάδα – Στο 2 , 2 % στην Ευρωζώνη",https://www.mikrometoxos.gr/eurostat-sto-18-epivevaionetai-o-plithorismos-gia-tin-ellada-sto-22-stin-evrozoni/
,n.yam.com,再創奇蹟 ！ 台灣隨行杯使用率可能創下世界第一最新調查 ： 76 % 消費者使用隨行杯,https://n.yam.com/Article/20251017682963
,kn-online.de,Geflügelpest : Kreis Nordfriesland ordnet Aufstallung an,https://www.kn-online.de/schleswig-holstein/gefluegelpest-kreis-nordfriesland-ordnet-aufstallung-an-RYLRXUJS3QYXBOOVYW6GEM2JEI.html
,dailymail.co.uk,Drugs death map of Britain : Use our interactive tool to see where YOUR county ranks,https://www.dailymail.co.uk/health/article-15201745/Drugs-death-map-Britain-Use-interactive-tool-county-ranks.html
,t-online.de,Bremens Superreiche : Neue Liste zeigt Altbekannte – und große Verluste,https://www.t-online.de/region/bremen/id_100960610/bremens-superreiche-neue-liste-zeigt-altbekannte-und-grosse-verluste.html
,finanznachrichten.de,"Opening Bell : Bitcoin , Robinhood , JPMorgan , Zions Bancorp ., Western Alliance , Eli Lilly , PayPal ...",https://www.finanznachrichten.de/nachrichten-2025-10/66727010-opening-bell-bitcoin-robinhood-jpmorgan-zions-bancorp-western-alliance-eli-lilly-paypal-124.htm
,english.radio.cz,Fishermen begin harvest of Rožmberk lake,https://english.radio.cz/fishermen-begin-harvest-rozmberk-lake-8866060
,cambodiantimes.com,Wind : The Energy of the Future ... Witness the Force that Drives it !,http://www.cambodiantimes.com/news/278641997/wind-the-energy-of-the-future-witness-the-force-that-drives-it
,yeniduzen.com,"Adayların nerede , saat kaçta oy kullanacağı açıklandı",https://www.yeniduzen.com/adaylarin-nerede-saat-kacta-oy-kullanacagi-aciklandi-187878h.htm
,wnp.pl,"Nie tylko polski rząd szuka dodatkowych pieniędzy w bankach . „ Ci , którzy mają więcej , muszą dać więcej","https://www.wnp.pl/rynki/wloski-rzad-siega-po-zyski-bankow-i-ubezpieczycieli-skorzystac-ma-na-tym-klasa-srednia,995447.html"
,slobodnadalmacija.hr,"Slobodna Dalmacija - Slovenci uvode božićnicu za sve , hoće li i Hrvatska ? Umirovljenike čeka poseban dodatak , doznali smo koliko će iznositi",https://slobodnadalmacija.hr/vijesti/hrvatska/slovenci-uvode-bozicnicu-za-sve-hoce-li-i-hrvatska-umirovljenike-ceka-poseban-dodatak-doznali-smo-koliko-ce-iznositi-1510856
,dnevnik.rs,ЕР СРБИЈА УВОДИ ЕРБАС А220 - 300 Проширена сарадња са Ер Балтиком,https://www.dnevnik.rs/vesti/drustvo/er-srbija-uvodi-erbas-a220-300-prosirena-saradnja-sa-er-baltikom-2025-10-17
,baochinhphu.vn,"Chủ tịch Quốc hội Trần Thanh Mẫn gặp mặt nữ đại biểu Quốc hội , nữ lãnh đạo thuộc Đảng ủy Quốc hội",https://baochinhphu.vn/chu-tich-quoc-hoi-tran-thanh-man-gap-mat-nu-dai-bieu-quoc-hoi-nu-lanh-dao-thuoc-dang-uy-quoc-hoi-102251017194123381.htm
,pinkvilla.com,Pradeep Ranganathan net worth : How much does Dragon actor earn per movie ?,https://www.pinkvilla.com/entertainment/south/pradeep-ranganathan-net-worth-how-much-does-dragon-actor-earn-per-movie-1397786
,24hod.sk,24hod . sk - Počítače,https://www.24hod.sk/2025-10-17/34/pocitace/
,cna.com.tw,北韓 、 越南成BFA正式會員 山中正竹任洲際副會長 | 運動,https://www.cna.com.tw:443/news/aspt/202510170315.aspx
,theage.com.au,St Kilda stalwart Topolino late - night pizza ovens face closing time on Fitzroy Street,https://www.theage.com.au/business/companies/st-kilda-stalwart-s-late-night-pizza-ovens-face-closing-time-20251016-p5n30x.html
,aol.co.uk,How the murder of an ice - cream seller from Florida embodies a hidden war on the West Bank,https://www.aol.co.uk/articles/murder-ice-cream-seller-florida-102153475.html
,baochinhphu.vn,"Chỉ đạo , điều hành của Chính phủ , Thủ tướng Chính phủ ngày 17 / 10 / 2025",https://baochinhphu.vn/chi-dao-dieu-hanh-cua-chinh-phu-thu-tuong-chinh-phu-ngay-17-10-2025-102251017194721447.htm
,haberradikal.com,"ABD Kulak Tıkaçları Pazar Payı Raporu , 2032  ye Kadar – Haber Radikal",http://www.haberradikal.com/2025/10/17/abd-kulak-tikaclari-pazar-payi-raporu-2032ye-kadar-3/
,konya.net.tr,Türkiye ve Arnavutluk İş Dünyası Tiranda Bir Araya Geldi – Konya Haber,https://konya.net.tr/turkiye-ve-arnavutluk-is-dunyasi-tiranda-bir-araya-geldi/
,market.bisnis.com,"Asing Net Buy Borong Saham BBCA , EMAS , Cs Saat IHSG Jeblok ke Bawah 8 . 000",https://market.bisnis.com/read/20251017/7/1921310/asing-net-buy-borong-saham-bbca-emas-cs-saat-ihsg-jeblok-ke-bawah-8000
,vita.it,Lotta al cambiamento climatico : i venti maggiori produttori di fonti fossili tirano il freno,https://www.vita.it/lotta-al-cambiamento-climatico-i-venti-maggiori-produttori-di-fonti-fossili-tirano-il-freno/
,manilatimes.net,Vocodia Holdings Corp . and Scale Agile Solutions Announce Letter of Intent for Strategic Asset Acquisition,https://www.manilatimes.net/2025/10/17/tmt-newswire/globenewswire/vocodia-holdings-corp-and-scale-agile-solutions-announce-letter-of-intent-for-strategic-asset-acquisition/2203084
,benzinga.com,Trump Says China Tariffs  Wont Stand  But Bitcoin Crashes 5 % Anyway,https://www.benzinga.com/crypto/cryptocurrency/25/10/48272924/trump-says-china-tariffs-wont-stand-but-bitcoin-crashes-5-anyway
,livemint.com,"Only 12 states , UTs bat for payment security to boost e - bus operations",https://www.livemint.com/news/only-12-states-uts-bat-for-payment-security-to-boost-e-bus-operations-11760689954014.html
,livemint.com,"Delhi - NCR witnesses massive traffic jam amid Diwali , police say  staff deployed to maximum  | Watch videos",https://www.livemint.com/news/india/delhincr-witnesses-massive-traffic-jam-amid-diwali-police-say-staff-deployed-to-maximum-11760703619460.html
,manilatimes.net,Coinbase Asset Management & iTrustCapital Partner on Bitcoin Yield Strategy for IRAs,https://www.manilatimes.net/2025/10/17/tmt-newswire/globenewswire/coinbase-asset-management-itrustcapital-partner-on-bitcoin-yield-strategy-for-iras/2203078
,hoy.com.py,Diario HOY | Ofrecen cerca de 240 empleos de verano hoy en San Bernardino,https://www.hoy.com.py/nacionales/2025/10/17/ofrecen-cerca-de-180-empleos-de-verano-hoy-en-san-bernardino
,delo.si,"Desetletje pozneje se kriza umirja , nekaj smo se celo naučili",https://www.delo.si/novice/svet/desetletje-pozneje-se-kriza-umirja-nekaj-smo-se-celo-naucili
,sozcu.com.tr,Piyasadan şaşırtan faiz beklentisi,https://www.sozcu.com.tr/piyasadan-sasirtan-faiz-beklentisi-p247945
,jornaldebrasilia.com.br,Rio united states laboratório portátil para identificar bebidas falsificadas,https://jornaldebrasilia.com.br/noticias/brasil/rio-usa-laboratorio-portatil-para-identificar-bebidas-falsificadas/
,antaranews.com,Airlangga : RI jadi  bright spot  di tengah ketidakpastian global,https://www.antaranews.com/berita/5181885/airlangga-ri-jadi-bright-spot-di-tengah-ketidakpastian-global
,hkcd.com,RCEP成員國世界遺產地合作聯盟黃山啟航,https://www.hkcd.com/hkcdweb/content/2025/10/17/content_8719575.html
,cambodiantimes.com,KASTA PIPES Diwali ad -- A tribute to India timeless spirit of unity and resilience,http://www.cambodiantimes.com/news/278641999/kasta-pipes-diwali-ad-a-tribute-to-india-timeless-spirit-of-unity-and-resilience
,nordbayern.de,Walter Wigand ist tot : Doku über Penny Markt machte ihn zur Legende im Netz,https://www.nordbayern.de/panorama/virale-doku-machte-ihn-zur-legende-im-netz-penny-markt-darsteller-im-alter-von-69-jahren-gestorben-1.14871239
,moto.pl,Komfort i spokój na lata . Tak kupuje się samochód używany w programie Audi Select : plus,"https://moto.pl/NSI_Moto/0,198758.html"
,klaipeda.diena.lt,"Kitąmet elektros perdavimo kainos riba mažės , skirstymo – augs : kaip tai atsilieps vartotojams",https://klaipeda.diena.lt/naujienos/verslas/ekonomika/kitamet-elektros-perdavimo-kainos-riba-mazes-skirstymo-augs-kaip-tai-atsilieps-vartotojams-1724906
,news.de,Verkaufsoffener Sonntag am 19 . 10 . 2025 in Ettlingen : Alle Termine und Informationen zur Sonntagsöffnung auf einen Blick,https://www.news.de/lokales/857624602/verkaufsoffener-sonntag-in-ettlingen-in-karlsruhe-am-19-10-2025-naechste-termine-und-oeffnungszeiten-fuer-sonntagsoeffnung-welche-staedte-in-bw-haben-aktuell-verkaufsoffen/1/
,manilatimes.net,SparkRWA Expands AI Applications to Empower the Global Green Economy and Drive Sustainable Innovation,https://www.manilatimes.net/2025/10/17/tmt-newswire/pr-newswire/sparkrwa-expands-ai-applications-to-empower-the-global-green-economy-and-drive-sustainable-innovation/2203100
,eenadu.net,Investments : రిస్క్ ఉన్నా మంచి రాబడి అందించగలిగే పెట్టుబడులివే ..,https://www.eenadu.net/telugu-news/business/high-risk-high-return-investments/0103/125190643
,fltimes.com,FRIDAY CONVERSATION WITH ... Allen Williams,https://www.fltimes.com/news/friday-conversation-with-allen-williams/article_8001b32c-0a5d-4bce-8c15-4fadcc304b13.html
,time.mk,Time Aнализа,https://time.mk/ai/ab8dc8c943/mk/
,lanouvellerepublique.fr,Le chaos politique en France na pas deffet repoussoir pour les investisseurs,https://www.lanouvellerepublique.fr/a-la-une/le-chaos-politique-en-france-n-a-pas-d-effet-repoussoir-pour-les-investisseurs-1760703374
,inewsgr.com,"« Πικρός » ο καφές : Άνοδος ύψους 52 , 45 % σε σχέση με πέρυσι",https://www.inewsgr.com/379/pikros-o-kafes-anodos-ypsous-5245-se-schesi-me-perysi.htm
,wnp.pl,Nagły zwrot akcji ws . zakupu śląskiego lotniska . Do akcji wkroczyła Warszawa,"https://www.wnp.pl/logistyka/warszawa-wlacza-sie-w-proces-zakupu-slaskiego-lotniska-oferta-na-stole,995323.html"
,cfi.net.cn,[ HK ] 红星美凯龙 ( 01528 ): 红星美凯龙家居集团股份有限公司关於持股5 % 以上股东及其一致行动人权益变动触及1 % 刻度进展公告 - CFi . CN 中财网,http://www.cfi.net.cn/p20251017002494.html
,tomshardware.com,TSMC moves up 2nm production plans in Arizona CEO also hints at further site expansion beyond $165 billion commitment,https://www.tomshardware.com/tech-industry/tsmc-moves-up-2nm-production-plans-in-arizona-ceo-also-hints-at-further-site-expansion-beyond-usd165-billion-commitment
,haberradikal.com,"Isıtma Ekipmanları Pazar Payı Raporu , 2032  ye Kadar – Haber Radikal",http://www.haberradikal.com/2025/10/17/isitma-ekipmanlari-pazar-payi-raporu-2032ye-kadar-3/
,wnp.pl,Imperium Solorza drży w posadach . Miliarder odwołany z kolejnej spółki,"https://www.wnp.pl/rynki/zygmunt-solorz-odwolany-z-kolejnej-spolki-walka-o-imperium-miliardera-trwa,995414.html"
,hurhaber.com,Çocuğunu yerde defalarca darbeden baba tutuklandı,https://www.hurhaber.com/3-sayfa-haberleri/cocugunu-yerde-defalarca-darbeden-baba-tutuklandi-485270
,nbd.com.cn,美股三大指数齐跌 ； 美国两家银行相继  爆雷 ， 大型银行股普跌 ； 甲骨文称已签下650亿美元订单 ， AI云毛利率可达35 %【 美股盘前 】,https://www.nbd.com.cn/articles/2025-10-17/4095872.html
,wallstreet-online.de,WOCHENAUSBLICK : Krisengeschüttelte Dax - Anleger blicken auf US - Preisdaten,https://www.wallstreet-online.de/nachricht/20044275-wochenausblick-krisengeschuettelte-dax-anleger-blicken-us-preisdaten
,investireoggi.it,"Borsa europea per mercato dei capitali , Merz sfida Wall Street",https://www.investireoggi.it/borsa-europea-mercato-capitali-merz-sfida-a-wall-street/
,hoy.com.do,La tasa del dólar de este viernes 17 de octubre del 2025,https://hoy.com.do/tasa-del-dolar-de-este-viernes-17-de-octubre-del-2025/
,theconversation.com,Who invented jollof rice ? Senegal beats Ghana and Nigeria to the title,https://theconversation.com/who-invented-jollof-rice-senegal-beats-ghana-and-nigeria-to-the-title-197352
,nin.rs,Studenti koji pešače iz Novog Pazara nastavili put od Raške do Baljevca,https://www.nin.rs/drustvo/vesti/92198/studenti-koji-pesace-iz-novog-pazara-nastavili-put-od-raske-do-baljevca
,reporterherald.com,"Things to do in the Loveland area on Friday , Oct . 17 : Theater , art , music , Halloween events",https://www.reporterherald.com/2025/10/17/things-to-do-in-the-loveland-area-on-oct-17-theater-art-music-halloween-events/
,lvz.de,Baumpflanz - Challenge rund um Oschatz : Darf man überall pflanzen ?,https://www.lvz.de/lokales/nordsachsen/oschatz/baumpflanz-challenge-rund-um-oschatz-darf-man-ueberall-pflanzen-6WFVFPA7LJFEFGE47I2TWIJUB4.html
,smh.com.au,Rich - lister puts prime Sydney CBD parking spots up for grabs in Kent Street,https://www.smh.com.au/business/the-economy/rich-lister-puts-prime-sydney-cbd-parking-spots-up-for-grabs-20251017-p5n39n.html
,haberradikal.com,"Kablo Üfleme Ekipmanları Pazar Payı Raporu , 2032  ye Kadar – Haber Radikal",http://www.haberradikal.com/2025/10/17/kablo-ufleme-ekipmanlari-pazar-payi-raporu-2032ye-kadar-3/
,canoncitydailyrecord.com,Inspectors find blood - caked surgical tools at University of Colorado Hospital,https://www.canoncitydailyrecord.com/2025/10/17/uchealth-university-colorado-hospital-inspections-sterilization/
,istanbulhaber.com.tr,Burcu Köksaldan  İlk açıklama  geldi !,https://www.istanbulhaber.com.tr/burcu-koksaldan-ilk-aciklama-geldi-haber-2320385.htm
,indianexpress.com,Medicine became poison – and our healthcare and regulatory systems failed,https://indianexpress.com/article/opinion/columns/cough-syrup-medical-negligence-medicine-indian-syrups-10312857/
,askanews.it,"Debutta  EFI Fine Wines , hub internazionale del grande vino italiano",https://askanews.it/2025/10/17/debutta-efi-fine-wines-hub-internazionale-del-grande-vino-italiano/
,wnp.pl,"Sejm : Opozycja przeciw nowelizacji ustawy , która zwalania z CIT fundusze spoza UE i EOG","https://www.wnp.pl/rynki/sejm-opozycja-przeciw-nowelizacji-ustawy-ktora-zwalania-z-cit-fundusze-spoza-ue-i-eog,995430.html"
,stcatharinesstandard.ca,Why people with autism are struggling to find and keep work,https://www.stcatharinesstandard.ca/news/ontario/he-was-called-a-punk-during-a-job-interview-for-avoiding-eye-contact-why-people/article_46b72c74-65f4-5e06-aaaa-c473c35eecdf.html
,domain-b.com,Coca - Cola Weighs $1 Billion IPO for Indian Bottling Arm,https://www.domain-b.com/finance/finance-general/coca-cola-weighs-1-billion-ipo-for-indian-bottling-arm
,dostor.org,سعر اليورو الآن الجمعة 17 أكتوبر 2025 .. تحديث لحظي للأسعار,https://www.dostor.org/5267933
,haberradikal.com,"Plazma Yüzey İşleme Ekipmanları Pazar Payı Raporu , 2032  ye Kadar – Haber Radikal",http://www.haberradikal.com/2025/10/17/plazma-yuzey-isleme-ekipmanlari-pazar-payi-raporu-2032ye-kadar-3/
,fnnews.com,트럼프  시진핑 2주내 만날 것 … 100 % 관세는 지속 불가능 ( 상보 ),https://www.fnnews.com/news/202510172136388716
,nbd.com.cn,A股绿色周报｜11家上市公司暴露环境风险 城发环境控股公司被罚44 . 8万元,https://www.nbd.com.cn/articles/2025-10-17/4095873.html
,silverbirdtv.com,Breaking : Fire Guts Shops In Kano Market,https://silverbirdtv.com/breaking-fire-guts-shops-in-kano-market/
,cio.com,The CIO as orchestrator : From running systems to building ecosystems,https://www.cio.com/article/4074028/the-cio-as-orchestrator-from-running-systems-to-building-ecosystems.html
,motorionline.com,Nuova BMW i3 : puro piacere di guida e autonomia da 800 Km per la berlina elettrica in arrivo nel 2026 [ RENDER ],https://www.motorionline.com/nuova-bmw-i3-puro-piacere-di-guida-e-autonomia-da-800-km-per-la-berlina-elettrica-in-arrivo-nel-2026-render/
,haberler.com,Hafta Sonu Hava Durumu : Yağışlı Hava Etkili Olacak,http://www.haberler.com/guncel/hafta-sonu-hava-durumu-yagisli-hava-etkili-olacak-19158514-haberi/
,24tv.ua,"51 лимон у monobank - що можна виграти , призовий фонд розіграшу в Моно",https://24tv.ua/trends24/51-limon-u-monobank-shho-mozhna-vigrati-prizoviy-fond-rozigrashu-v-mono_n2935270
,askanews.it,"Bankitalia conferma Pil 2025 a +0 , 6 %, lima 2026 a +0 , 6 %, 2027 +0 , 7 %",https://askanews.it/2025/10/17/bankitalia-conferma-pil-2025-a-06-lima-2026-a-06-2027-07/
,virginislandsnewsonline.com,Some OTs receive greater security assistance from region than united kingdom - Premier,https://www.virginislandsnewsonline.com/en/news/some-ots-receive-greater-security-assistance-from-region-than-uk-premier/
,mikrometoxos.gr,CrediaBank : Μνημόνιο Συνεργασίας με το Κέντρο UNESCO του ΑΠΘ για τη βιώσιμη διαχείριση των υδάτινων πόρων,https://www.mikrometoxos.gr/crediabank-mnimonio-synergasias-me-to-kentro-unesco-tou-apth-gia-ti-viosimi-diacheirisi-ton-ydatinon-poron/
,kenh14.vn,Chị đại showbiz  Naomi Campbell biển thủ 145 tỷ tiền từ thiện để ... ăn chơi !,https://kenh14.vn/1-chi-dai-showbiz-bien-thu-145-ty-tien-tu-thien-de-an-choi-215251017163555403.chn
,singaporestar.com,TSMC is accelerating its Arizona expansion plans ; keep investing in Taiwan,http://www.singaporestar.com/news/278641985/tsmc-is-accelerating-its-arizona-expansion-plans-keep-investing-in-taiwan
,europasur.es,Comprar una casa en Algeciras o en La Línea : dónde es más caro vivir y cuánto han subido los precios en 2025,https://www.europasur.es/campo-de-gibraltar/comprar-casa-algeciras-la-linea-precios-2025_0_2005021666.html
,ekonomi.bisnis.com,Antam Dukung Rencana Pemerintah Perkuat Pasokan Emas Nasional Lewat DMO,https://ekonomi.bisnis.com/read/20251017/44/1921311/antam-dukung-rencana-pemerintah-perkuat-pasokan-emas-nasional-lewat-dmo
,world.qianlong.com,雅万高铁为区域互联互通注入新活力,https://world.qianlong.com/2025/1017/8568452.shtml
,folha.uol.com.br,Como funciona a cadeia criminosa do latrocínio em SP - 17 / 10 / 2025 - Cotidiano,https://www1.folha.uol.com.br/cotidiano/2025/10/entenda-como-atuavam-assaltantes-e-receptadores-de-celulares-e-joias-em-sp.shtml
,wiov.com,"FRIDAY , OCTOBER 17 , 2025",https://www.wiov.com/2025/10/17/friday-october-17-2025/
,motorionline.com,Stellantis : Guido Bevilacqua nominato responsabile Veicoli Commerciali per lItalia,https://www.motorionline.com/stellantis-guido-bevilacqua-nominato-responsabile-veicoli-commerciali-per-litalia/
,elfinancierocr.com,Del bostezo al bono : cómo la gamificación transforma la capacitación en las empresas de Costa Rica,https://www.elfinancierocr.com/estilo-de-vida/del-bostezo-al-bono-como-la-gamificacion/XPW2ALHRWBFFPBAMJTGTMARY3I/story/
,news.webindia123.com,Why this Dhanteras is the Perfect Time to Apply for a Home Loan,https://news.webindia123.com/news/Articles/Business/20251017/4373784.html
,haberaktuel.com,Baek Sehee 35 Yaşında Hayatını Kaybetti,https://www.haberaktuel.com/baek-sehee-35-yasinda-hayatini-kaybetti-3361242
,ziuadevest.ro,"„ Învață să salvezi o viață , duminică , în centrul Timișoarei",https://www.ziuadevest.ro/invata-sa-salvezi-o-viata-duminica-in-centrul-timisoarei/
,kingstonthisweek.com,Petawawa Ramble kicks off with Pumpkin Folk Contest winners | Kingston / Frontenac This Week,https://www.kingstonthisweek.com:443/news/petawawa-ramble-kicks-off-with-pumpkin-folk-contest-winners
,bongdaplus.vn,Top 5 ông chủ giàu nhất Premier League : MU còn xếp sau Newcastle,https://bongdaplus.vn/ngoai-hang-anh/top-5-ong-chu-giau-nhat-premier-league-mu-con-xep-sau-newcastle-4836882510.html
,moto.pl,Oto najcenniejsze marki samochodowe świata . Najdroższa wyprzedziła Coca - Cole i McDonalda,"https://moto.pl/MotoPL/7,175394,32330711,oto-najcenniejsze-marki-samochodowe-swiata-najdrozsza-wyprzedzila.html"
,kwongwah.com.my,华裔子弟被制度化排除在政府大学之外 魏家祥 ： 大马华人面临教育危机光华日报 | 1910年创刊 创新每一天生活,https://www.kwongwah.com.my/20251017/%E5%8D%8E%E8%A3%94%E5%AD%90%E5%BC%9F%E8%A2%AB%E5%88%B6%E5%BA%A6%E5%8C%96%E6%8E%92%E9%99%A4%E5%9C%A8%E6%94%BF%E5%BA%9C%E5%A4%A7%E5%AD%A6%E4%B9%8B%E5%A4%96-%E9%AD%8F%E5%AE%B6%E7%A5%A5%EF%BC%9A%E5%A4%A7/
,benzinga.com,Nasdaq Token Gamble - Nasdaq ( NASDAQ : NDAQ ),https://www.benzinga.com/Opinion/25/10/48272949/nasdaqs-token-gamble
,motorcyclenews.com,Expert guide to used Suzuki SV motorcycles,https://www.motorcyclenews.com/advice/used-bikes/suzuki-sv-range/
,wnp.pl,Te kwestie najbardziej nurtują górników z PGG . Odpowiedzi na najczęściej zadawane pytania,"https://www.wnp.pl/energia/te-kwestie-najbardziej-nurtuja-gornikow-z-pgg-odpowiedzi-na-najczesciej-zadawane-pytania,995410.html"
,congan.com.vn,Khi ngân hàng  mở cửa  để khách hàng giao dịch ngoại tệ ngay trên phương tiện trực tuyến,http://congan.com.vn/thi-truong/ngan-hang/khi-ngan-hang-mo-cua-de-khach-hang-giao-dich-ngoai-te-ngay-tren-phuong-tien-truc-tuyen_184510.html
,manilatimes.net,Dolphin Liberty 600 by Maytronics Named to TIME List of the Best Inventions of 2025,https://www.manilatimes.net/2025/10/17/tmt-newswire/globenewswire/dolphin-liberty-600-by-maytronics-named-to-times-list-of-the-best-inventions-of-2025/2203091
