published_at,source,title,url
,dsnews.ua,"Як Група компаній  Октава  інвестує в довкілля , музику і людський капітал DSnews . ua",https://www.dsnews.ua/ukr/economics/garmoniyne-vidnovlennya-yak-oktava-kapital-investuye-v-dovkillya-muziku-i-lyudskiy-kapital-31102025-530732
,maszol.ro,A legfelsőbb bíróság kimondta : a COVID - oltás károsultjai beperelhetik az államot,https://maszol.ro/belfold/A-legfelsobb-birosag-kimondta-a-COVID-oltas-karosultjai-beperelhetik-az-allamot
,tokfm.pl,Inflacja zaskoczyła ekonomistów . Czy RPP obniży stopy ?,https://www.tokfm.pl/gospodarka/inflacja-zaskoczyla-ekonomistow-czy-rpp-obnizy-stopy
,arezzonotizie.it,"Sicurezza ponti , gallerie e infrastrutture . Ad Arezzo due seminari in anteprima nazionale",https://www.arezzonotizie.it/attualita/sicurezza-ponti-gallerie-seminari-arezzo-ingegneri.html
,boredpanda.com,Where Pamela Anderson Net Worth Stands After Decades Of Reinvention,https://www.boredpanda.com/pamela-anderson-net-worth/
,elfinancierocr.com,El negocio del miedo : Por qué el cine de terror es la inversión más rentable de Hollywood,https://www.elfinancierocr.com/estilo-de-vida/el-negocio-del-miedo-por-que-el-cine-de-terror-es/M3HZDZP7KFGO7BVFKTFGWLZFTY/story/
,themarketsdaily.com,Procter & Gamble Company ( The ) $PG Stake Raised by Amplius Wealth Advisors LLC,https://www.themarketsdaily.com/2025/10/31/procter-gamble-company-the-pg-stake-raised-by-amplius-wealth-advisors-llc.html
,singaporestar.com,"Thailand First MINISO LAND Store Opens , Bringing Experiential IP - based Store Design to Bangkok",http://www.singaporestar.com/news/278666294/thailand-first-miniso-land-store-opens-bringing-experiential-ip-based-store-design-to-bangkok
,kwongwah.com.my,槟警捣毁贩毒集团逮7人 起获市值340万摇头丸粉末光华日报 | 1910年创刊 创新每一天生活,https://www.kwongwah.com.my/20251031/%E6%A7%9F%E8%AD%A6%E6%8D%A3%E6%AF%81%E8%B4%A9%E6%AF%92%E9%9B%86%E5%9B%A2%E9%80%AE7%E4%BA%BA-%E8%B5%B7%E8%8E%B7%E5%B8%82%E5%80%BC340%E4%B8%87%E6%91%87%E5%A4%B4%E4%B8%B8%E7%B2%89%E6%9C%AB/
,yeniakit.com.tr,Elektrik faturalarında yeni dönem ! 1 Ocaktan itibaren …,https://www.yeniakit.com.tr/haber/elektrik-faturalarinda-yeni-donem-1-ocaktan-itibaren-1962243.html
,portalspozywczy.pl,Tusk i Domański zadowoleni z poziomu inflacji .  Cieszy spadek dynamiki cen żywności,"https://www.portalspozywczy.pl/technologie/wiadomosci/tusk-i-domanski-zadowoleni-z-poziomu-inflacji-cieszy-spadek-dynamiki-cen-zywnosci,282284.html"
,storm.mg,富壽投資本質創投近7 . 5億 估10年報酬率逾200 % | 陳怡慈 | 新聞,https://www.storm.mg/article/11077996
,163.com,微众银行AI学术研究再添新成果 ， 九项技术创新连续获顶会顶刊发表,https://www.163.com/dy/article/KD7QJC1905198NMR.html
,meridiananotizie.it,"A Brescia Domani Lavoro , opportunità per chi cerca impiego o vuole crescere",https://www.meridiananotizie.it/2025/10/primo-piano/cronaca/lavoro/a-brescia-domani-lavoro-opportunita-per-chi-cerca-impiego-o-vuole-crescere/
,hkcd.com,十五運會火炬傳遞廣州站68位火炬手和傳遞線路公布,https://www.hkcd.com/hkcdweb/content/2025/10/31/content_8722282.html
,aktiencheck.de,UnitedHealth wieder auf dem absteigenden Ast – Cigna crasht nach Warnung (),https://www.aktiencheck.de/analysen/Artikel-UnitedHealth_wieder_auf_absteigenden_Ast_Cigna_crasht_Warnung-19165093
,manilatimes.net,Micropolis to Showcase AI Security Solutions at ADNOC Workshop on November 10th,https://www.manilatimes.net/2025/10/31/tmt-newswire/globenewswire/micropolis-to-showcase-ai-security-solutions-at-adnoc-workshop-on-november-10th/2213185
,abcbourse.com,Chevron pénalisé par la baisse des prix du pétrole,https://www.abcbourse.com/marches/newsContent/679062
,trend.at,Inflation liegt in Österreich konstant bei 4 Prozent,https://www.trend.at/konjunktur/inflation-liegt-in-oesterreich-konstant-bei-4-prozent
,toutelatele.ouest-france.fr,"Élise Lucet à la peine , la claque des audiences sur France 2",https://toutelatele.ouest-france.fr/elise-lucet-a-la-peine-la-claque-des-audiences-sur-france-2-180633
,baomoi.com,Chủ tịch nước Lương Cường gặp các lãnh đạo APEC,https://baomoi.com/chu-tich-nuoc-luong-cuong-gap-cac-lanh-dao-apec-c53640206.epi
,freepressjournal.in,"GAIL Q2 Profit Falls 18 Per Cent To ₹2 , 823 Crore On Petrochemical Margin Pressure ; Revenue Rises To ₹35 , 031 Crore",https://www.freepressjournal.in/business/gail-q2-profit-falls-18-per-cent-to-2823-crore-on-petrochemical-margin-pressure-revenue-rises-to-35031-crore
,rg.ru,JAC готовится представить в России новый минивэн RF8,https://rg.ru/2025/10/31/jac-gotovitsia-predstavit-v-rf-novyj-miniven-rf8-avto-sniali-na-foto.html
,163.com,淘宝闪购发布新品牌  淘宝便利店 ， 投入20亿共建闪购仓生态丨破局双11|零售|全品类|电商平台,https://www.163.com/dy/article/KD7QHVNJ0514D3UH.html
,trends.knack.be,"De portemonnee van Jonas Vermeulen :  Als crypto morgen verdwijnt , verlies ik 3 procent van mijn vermogen  ( Trends )",https://trends.knack.be/geld/de-portemonnee-van-jonas-vermeulen-als-crypto-morgen-verdwijnt-verlies-ik-3-procent-van-mijn-vermogen/
,zonebourse.com,Wall Street : Apple et Amazon rassurent au sortir dune semaine tumultueuse,https://www.zonebourse.com/actualite-bourse/wall-street-apple-et-amazon-rassurent-au-sortir-d-une-semaine-tumultueuse-ce7d5cdbd180f221
,zvw.de,Kanu des Manitu ? Kulturstaatssekretär will mehr Blockbuster - Baden - Württemberg,https://www.zvw.de/baden-w%C3%BCrttemberg/kanu-des-manitu-kulturstaatssekret%C3%A4r-will-mehr-blockbuster_arid-1016016
,publituris.pt,Programa de verão 2026 do Grupo Lufthansa com mais de 14 . 000 conexões semanais,https://www.publituris.pt/2025/10/31/programa-verao-2026-do-grupo-lufthansa-com-mais-de-14-000-conexoes-semanais
,modena2000.it,Truffa nel fotovoltaico da 80 milioni . Sequestrato il sito web societario,https://www.modena2000.it/2025/10/31/truffa-nel-fotovoltaico-da-80-milioni-sequestrato-il-sito-web-societario/
,zonebourse.com,"La présidente de la Fed de Dallas , Lorie Logan , soppose à une nouvelle baisse des taux en décembre",https://www.zonebourse.com/actualite-bourse/la-presidente-de-la-fed-de-dallas-lorie-logan-s-oppose-a-une-nouvelle-baisse-des-taux-en-decembre-ce7d5cdbd18efe26
,investopedia.com,"Dow Jones Today : Stock Futures Rise After Amazon , Apple Results ; Indexes on Track for Weekly , Monthly Gains",https://www.investopedia.com/dow-jones-today-10312025-11840932
,boersennews.de,S & P 500 Meilenstein : Amazon - Zahlen sichern die Rekord - Rallye,https://www.boersennews.de/nachrichten/artikel/boersennews/s-und-p-500-meilenstein-amazon-zahlen-sichern-die-rekord-rallye/4936290/
,trends.knack.be,Beursupdate : rode koersen in Brussel,https://trends.knack.be/beleggen/beursnieuws/beursupdate-rode-koersen-in-brussel-4/
,catanzaroinforma.it,"Catanzaro , inaugurati i nuovi uffici della Polizia Giudiziaria",https://www.catanzaroinforma.it/cronaca/2025/10/31/catanzaro-inaugurati-i-nuovi-uffici-della-polizia-giudiziaria/391797/
,businessghana.com,Govt keen on developing agribusiness sector Minister,http://www.businessghana.com/site/news/Business/337398/Govt-keen-on-developing-agribusiness-sector-%E2%80%94-Minister
,news.webindia123.com,Gulf Oil International Ltd and AMW Global Enter into a Major Licensing Partnership to Launch Gulf Auto Products Across Asia and Middle East,https://news.webindia123.com/news/Articles/Business/20251031/4378569.html
,themarketsdaily.com,AMG National Trust Bank Increases Stake in Vanguard S & P 500 ETF $VOO,https://www.themarketsdaily.com/2025/10/31/amg-national-trust-bank-increases-stake-in-vanguard-sp-500-etf-voo.html
,boursorama.com,"Exxon dépasse les attentes au T3 , réduit sa prévision de dépenses dinvestissement - 31 / 10 / 2025 à 13 : 42",https://www.boursorama.com/bourse/actualites/exxon-depasse-les-attentes-au-t3-reduit-sa-prevision-de-depenses-d-investissement-0b94f5f3f9228f1721c75a308f0998fa
,themarketsdaily.com,Amplius Wealth Advisors LLC Purchases New Position in ASML Holding N . V . $ASML,https://www.themarketsdaily.com/2025/10/31/amplius-wealth-advisors-llc-purchases-new-position-in-asml-holding-n-v-asml.html
,marketscreener.com,"Transcript : Newell Brands Inc ., Q3 2025 Earnings Call , Oct 31 , 2025",https://www.marketscreener.com/news/transcript-newell-brands-inc-q3-2025-earnings-call-oct-31-2025-ce7d5cdbd180f723
,themarketsdaily.com,Putney Financial Group LLC Sells 193 Shares of Lockheed Martin Corporation $LMT,https://www.themarketsdaily.com/2025/10/31/putney-financial-group-llc-sells-193-shares-of-lockheed-martin-corporation-lmt.html
,memleket.com.tr,İmece Usulü Burs : Bilecikli Kadınlar Üniversite Öğrencilerini Okutuyor,https://www.memleket.com.tr/imece-usulu-burs-bilecikli-kadinlar-universite-ogrencilerini-okutuyor-2348695h.htm
,edition.cnn.com,This burrito is everything you need to know about America economy,https://edition.cnn.com/2025/10/31/business/k-shaped-economy
,stcn.com,百川能源跨界投资具身智能机器人领域 子公司拟2 . 15亿元取得西安中科光电22 . 86 % 股权,http://www.stcn.com/article/detail/3473874.html
,indianexpress.com,"UPSC Key - 31st Oct 2025 : Trump – Xi pause trade war , ASEAN Summit , New CPI",https://indianexpress.com/article/upsc-current-affairs/upsc-key-trump-xi-pause-trade-war-asean-summit-and-new-cpi-10338083/
,themarketsdaily.com,Home Improvement Stocks To Follow Now – October 28th,https://www.themarketsdaily.com/2025/10/31/home-improvement-stocks-to-follow-now-october-28th.html
,uniindia.com,"Heavy rain & snow lash North Bengal and Sikkim ; flights , travel plans disrupted",https://uniindia.com/news/east/weather-north-bengal-sikkim-rain/3628042.html
,manilatimes.net,AB Akola Group notification on the Annual information for the Audited Financial Year 2024 / 2025,https://www.manilatimes.net/2025/10/31/tmt-newswire/globenewswire/ab-akola-groups-notification-on-the-annual-information-for-the-audited-financial-year-20242025/2213194
,trend.az,ExxonMobil updates on 3Q2025 financial performance amid record production levels,https://www.trend.az/business/4111582.html
,brasil247.com,"Juros altos ameaçam crédito da classe média e inviabilizam financiamento imobiliário , diz ministro",https://www.brasil247.com:443/economia/juros-altos-ameacam-credito-da-classe-media-e-inviabilizam-financiamento-imobiliario-diz-ministro
,trend.at,Kreditwachstum beschert Erste Group mehr Gewinn,https://www.trend.at/news/kreditwachstum-beschert-erste-group-mehr-gewinn
,yahoo.com,Germany Merz calls steel summit to find solutions for ailing sector,https://www.yahoo.com/news/articles/germanys-merz-calls-steel-summit-130722965.html
,bikebiz.com,The top 5 jobs in the bike trade this week – 31st October,https://bikebiz.com/the-top-5-jobs-in-the-bike-trade-this-week-31st-october/
,transfermarkt.at,"| Vereinsführung , Stadion & Finanzen - Real Madrid - Forum | Seite 48",https://www.transfermarkt.at/-vereinsfuhrung-stadion-amp-amp-finanzen/thread/forum/630/thread_id/49/page/48
,arabianbusiness.com,"Dubai property sales hit 50 , 000 in Q3 as population passes 4m",https://www.arabianbusiness.com/industries/real-estate/dubai-property-sales-hit-50000-in-q3-as-population-passes-4m
,gigwise.com,Best Crypto Exchanges in the US in 2025,https://www.gigwise.com/best-crypto-exchanges-in-the-us-in-2025/
,singaporestar.com,"Global Times : Financial Street Forum concludes in Beijing , spotlighting financial cooperation , high - quality development",http://www.singaporestar.com/news/278666310/global-times-financial-street-forum-concludes-in-beijing-spotlighting-financial-cooperation-high-quality-development
,belegger.nl,AEX doet toch weer stapje terug,https://www.belegger.nl/Nieuws/838979/AEX-doet-toch-weer-stapje-terug.aspx
,tatar-inform.ru,В Татарстане продажи новых машин упали на 26 % за год – « Автостат »,https://www.tatar-inform.ru/news/s-nacala-goda-v-tatarstane-kupili-bolee-40-tys-novyx-masin-6005110
,modena2000.it,"Sciopero nazionale contro lapplicazione del ccnl Anaste , lassessora Conti riceve le rappresentanze sindacali",https://www.modena2000.it/2025/10/31/sciopero-nazionale-contro-lapplicazione-del-ccnl-anaste-lassessora-conti-riceve-le-rappresentanze-sindacali/
,dsnews.ua,Дані Мінфіну : держборг України перевищив 8 трильйонів гривень DSnews . ua,https://www.dsnews.ua/ukr/economics/dani-mininu-derzhborg-ukrajini-perevishchiv-8-trilyoniv-griven-31102025-531311
,alternatives-economiques.fr,Surtaxe des grandes entreprises  : que vaut lautre concession du gouvernement aux socialistes  ?,https://www.alternatives-economiques.fr/surtaxe-grandes-entreprises-vaut-lautre-concession-gouvernement-a/00116811
,news.webindia123.com,Congress used voter lists to target Sikhs : Hardeep Puri calls 1984 anti - Sikh violence  cold - blooded,https://news.webindia123.com/news/Articles/India/20251031/4378562.html
,kauno.diena.lt,"MRU Sūduvos akademija – universitetas , kuris renkasi būti arčiau tavęs",https://kauno.diena.lt/naujienos/kaunas/miesto-pulsas/mru-suduvos-akademija-universitetas-kuris-renkasi-buti-arciau-taves-1726857
,financial-news.co.uk,InvidiaTrade impulsa su ecosistema con inteligencia artificial y automatización para traders de nueva generación,https://www.financial-news.co.uk/invidiatrade-impulsa-su-ecosistema-con-inteligencia-artificial-y-automatizacion-para-traders-de-nueva-generacion/
,singaporestar.com,Darkivore CTI & DRP Solution for Critical Sectors - Achieves Australian Data Sovereignty Compliance,http://www.singaporestar.com/news/278666666/darkivore-cti-drp-solution-for-critical-sectors-achieves-australian-data-sovereignty-compliance
,laosnews.net,Crompton Launches India First Smart Chimney with AirIQ Tech - Sylvaire & AQNova Series that Adapt to Kitchen Air Quality,http://www.laosnews.net/news/278666409/crompton-launches-india-first-smart-chimney-with-airiq-tech-sylvaire-aqnova-series-that-adapt-to-kitchen-air-quality
,montrosepress.com,DMEA schedules hearing to consider increase to rate tariff,https://www.montrosepress.com/news/dmea-schedules-hearing-to-consider-increase-to-rate-tariff/article_86c09b3a-ec85-409a-9b40-8b30f63f8e7e.html
,lechodelaval.ca,,https://www.lechodelaval.ca/actualites-nationale/l%E2%80%99economie-canadienne-s%E2%80%99est-contractee-de-03--en-aout/33993
,sibenski.slobodnadalmacija.hr,Šibenski - Baranović i Šintić o poskupljenju vode :  Gdje je tu raskošnost talenta u vođenju ovoga grada ?,https://sibenski.slobodnadalmacija.hr/sibenik/sibenik-i-zupanija/sibenik/baranovic-i-sintic-o-poskupljenju-vode-apos-gdje-je-tu-raskosnost-talenta-u-vodenju-ovoga-grada-apos-1514309
,ghanaweb.com,Ghana must strengthen fundamentals to attract more foreign investment,https://www.ghanaweb.com/GhanaHomePage/business/Ghana-must-strengthen-fundamentals-to-attract-more-foreign-investment-Grant-Webber-2007497
,abcbourse.com,Safran signe un accord avec Ethiopian Airlines pour la solution Cassiopée Alpha,https://www.abcbourse.com/marches/newsContent/679053
,chinanewscloud.com,盛益晉好能源與 GROWATT 聯合亮相 2025台灣國際智慧能源週,https://chinanewscloud.com/post/%E7%9B%9B%E7%9B%8A%E6%99%89%E5%A5%BD%E8%83%BD%E6%BA%90%E8%88%87-GROWATT-%E8%81%AF%E5%90%88%E4%BA%AE%E7%9B%B8-2025%E5%8F%B0%E7%81%A3%E5%9C%8B%E9%9A%9B%E6%99%BA%E6%85%A7%E8%83%BD%E6%BA%90%E9%80%B1
,abcbourse.com,Linde dévoile une hausse de ses revenus et de son bénéfice au troisième trimestr,https://www.abcbourse.com/marches/newsContent/679058
,ilfattoquotidiano.it,Mobilità militare UE : 500 progetti e 17 miliardi dal 2028 per il riarmo | Il Fatto Quotidiano,https://www.ilfattoquotidiano.it/2025/10/31/mobilita-militare-riarmo-europeo-euiss-notizie/8179769/
,yahoo.com,It always been hard to make it as an artist in America – and it becoming only harder,https://www.yahoo.com/news/articles/always-hard-artist-america-becoming-124355100.html
,forsal.pl,"Polska gospodarka w liczbach . GUS ujawnia , ile osób zarabia w kraju","https://forsal.pl/gospodarka/bezrobocie/artykuly/10570853,polska-gospodarka-w-liczbach-gus-ujawnia-ile-osob-zarabia-w-kraju.html"
,kaiedabanri.jp,高市内閣の誕生と臨時国会の論点,https://kaiedabanri.jp/essay/seikei-10/
,foxnews.com,Biden clemency recipient charged in Nebraska shooting months after release,https://www.foxnews.com/us/biden-clemency-con-tied-downtown-shooting-months-after-early-release-now-faces-federal-charge
,udaipurkiran.com,TRAI September 2025 Report | Udaipur Kiran,https://udaipurkiran.com/tag/trai-september-2025-report/
,nile.eg,قناة النيل للأخبار | البورصة المصرية تربح 184 مليار جنيه خلال تعاملات أكتوبر,https://www.nile.eg/%D8%A7%D9%84%D8%A8%D9%88%D8%B1%D8%B5%D8%A9-%D8%A7%D9%84%D9%85%D8%B5%D8%B1%D9%8A%D8%A9-%D8%AA%D8%B1%D8%A8%D8%AD-184-%D9%85%D9%84%D9%8A%D8%A7%D8%B1-%D8%AC%D9%86%D9%8A%D9%87-%D8%AE%D9%84%D8%A7%D9%84
,biz.heraldcorp.com,"오세훈  10 · 15 부동산 대책 이후 현장 걱정 많아 … 서울시 권한 , 중앙서 가져가면 국토부 감당 못 해",https://biz.heraldcorp.com/article/10606447
,pragativadi.com,Harshvardhan Rane Urges Fans to Stop Comparing His Role With Ahaan Panday in Saiyaara - Pragativadi I Latest Odisha News in English I Breaking News,https://pragativadi.com/harshvardhan-rane-urges-fans-to-stop-comparing-his-role-with-ahaan-pandays-in-saiyaara/
,glasistre.hr,Monte Giro povodom blagdana Svih svetih,https://www.glasistre.hr/pula/2025/10/31/monte-giro-povodom-blagdana-svih-svetih-1031338
,yeniakit.com.tr,Akıllı telefon satışları canlandı : Yeni isimler öne çıkıyor,https://www.yeniakit.com.tr/haber/akilli-telefon-satislari-canlandi-yeni-isimler-one-cikiyor-1962244.html
,boursorama.com,"Wall Street vue en hausse , lEurope recule avec linflation et les résultats dentreprise - 31 / 10 / 2025 à 13 : 43",https://www.boursorama.com/bourse/actualites/wall-street-vue-en-hausse-l-europe-recule-avec-l-inflation-et-les-resultats-d-entreprise-25aff3f57c77e3285d58e97f2dbc70f2
,tvsette.net,GdiF BENEVENTO : SEQUESTRATI CIRCA 143 . 000 ARTICOLI NON CONFORMI AGLI STANDARD DI SICUREZZA .,https://www.tvsette.net/gdif-benevento-sequestrati-circa-143-000-articoli-non-conformi-agli-standard-di-sicurezza/
,air-journal.fr,Turkish Airlines  : un prêt stratégique de 412 millions de dollars par Bank of China pour doubler sa flotte dici 2033,https://www.air-journal.fr/2025-10-31-turkish-airlines-un-pret-strategique-de-412-millions-de-dollars-par-bank-of-china-pour-doubler-sa-flotte-dici-2033-5266907.html
,magyarhirlap.hu,Tiltott injekció miatt nyomoz a KR NNI,https://www.magyarhirlap.hu/bunugy/20251031-tiltott-injekcio-miatt-nyomoz-a-kr-nni
,kinhtedothi.vn,Ukraine cần nguồn hỗ trợ lớn chưa từng có để vượt qua thử thách,https://kinhtedothi.vn/ukraine-can-nguon-ho-tro-lon-chua-tung-co-de-vuot-qua-thu-thach.893822.html
,indianexpress.com,Cash - starved Gaza struggles to rebuild as banks reopen without money :  You just do paperwork and leave  | World News,https://indianexpress.com/article/world/cash-starved-gaza-struggles-to-rebuild-as-banks-reopen-without-money-you-just-do-paperwork-and-leave-10337923/
,veja.abril.com.br,SobeDesce : do Nubank ao Gmail,https://veja.abril.com.br/brasil/sobedesce-2968/
,epochtimes.de,Audi vervielfacht Gewinn – doch die Rechnung trügt,https://www.epochtimes.de/wirtschaft/audi-vervielfacht-gewinn-doch-die-rechnung-truegt-a5289321.html
,portalspozywczy.pl,Lidl rośnie . Przejmuje 19 sklepów Auchan i 8 stacji paliw,"https://www.portalspozywczy.pl/handel/wiadomosci/lidl-rosnie-przejmuje-19-sklepow-auchan-i-8-stacji-paliw,282295.html"
,zazoom.it,Controlli per Halloween sequestrati 120mila prodotti in un negozio,https://www.zazoom.it/2025-10-31/controlli-per-halloween-sequestrati-120mila-prodotti-in-un-negozio/18047840/
,tokfm.pl,Płacą nawet 116 tys . zł . Poszukiwani pracownicy na sezon zimowy,https://www.tokfm.pl/gospodarka/placa-nawet-116-tys-zl-poszukiwani-pracownicy-na-sezon-zimowy
,163.com,4岁男童药店打针后不幸去世 ， 20多天前刚过生日 ， 当地 ： 相关人员已被控制,https://www.163.com/dy/article/KD7ILUGF053469LG.html
,www.advanced-television.com,"Sofia, Sofiya-Grad, Bulgaria",https://www.advanced-television.com/2025/10/31/endurosat-raises-104m-from-google-and-others/
,elpais.com,"Catalunya, Spain (General), Spain",https://elpais.com/sorteos/2025-10-31/la-grossa-de-la-castanyada-sorteo-del-viernes-31-de-octubre.html
,www.wsaz.com,"Virginia, United States",https://www.wsaz.com/2025/10/31/officials-celebrate-completion-us-460-corridor/
,www.laopinioncoruna.es,Honduras,https://www.laopinioncoruna.es/ocio/2025/10/31/lydia-lozano-regresa-viernes-ingreso-hospitalario-marido-publicacion-polemicas-fotos-llorando-123227264.html
,news.ltn.com.tw,Japan,https://news.ltn.com.tw/news/life/breakingnews/5230550
,news.ltn.com.tw,Taiwan,https://news.ltn.com.tw/news/life/breakingnews/5230550
,www.hoy.es,Sweden,https://www.hoy.es/nacional/juez-indicios-investigar-supuesta-entrega-bolsas-dinero-20251031135000-ntrc.html
,re-port.ru:443,Russia,https://re-port.ru:443/pressreleases/publichno-pravovoi_kompanii_roskadastr-3_goda/
,www.armidaleexpress.com.au,United Kingdom,https://www.armidaleexpress.com.au/story/9102162/2026-suzuki-e-vitara-review-quick-drive/
,www.armidaleexpress.com.au,Australia,https://www.armidaleexpress.com.au/story/9102162/2026-suzuki-e-vitara-review-quick-drive/
,oglobo.globo.com,Brazil,https://oglobo.globo.com/brasil/noticia/2025/10/31/apenas-24percent-das-cidades-brasileiras-tem-estrutura-especifica-para-promover-politicas-de-igualdade-racial-diz-ibge.ghtml
,city-countyobserver.com,"Indiana, United States",https://city-countyobserver.com/centerpoint-energy-foundation-announces-5-million-community-fund-to-support-southwestern-indiana-customers-and-local-economic-development/
,www.tportal.hr,"Knin, Å Ibensko-Kniniska, Croatia",https://www.tportal.hr/vijesti/clanak/nedostaje-nam-7000-odgojitelja-za-vise-od-30-posto-djece-nema-mjesta-u-vrticima-20251031
,www.tportal.hr,"Zagreb, Zagreb, Grad, Croatia",https://www.tportal.hr/vijesti/clanak/nedostaje-nam-7000-odgojitelja-za-vise-od-30-posto-djece-nema-mjesta-u-vrticima-20251031
,koran-jakarta.com,Indonesia,https://koran-jakarta.com/2025-10-31/ekspor-mulai-kehabisan-tenaga-ekonom-wanti-wanti-surplus-perdagangan-september-menyempit
,koran-jakarta.com,"Jakarta, Jakarta Raya, Indonesia",https://koran-jakarta.com/2025-10-31/ekspor-mulai-kehabisan-tenaga-ekonom-wanti-wanti-surplus-perdagangan-september-menyempit
,koran-jakarta.com,"Semarang, Jawa Tengah, Indonesia",https://koran-jakarta.com/2025-10-31/ekspor-mulai-kehabisan-tenaga-ekonom-wanti-wanti-surplus-perdagangan-september-menyempit
,koran-jakarta.com,Germany,https://koran-jakarta.com/2025-10-31/ekspor-mulai-kehabisan-tenaga-ekonom-wanti-wanti-surplus-perdagangan-september-menyempit
,www.bluewin.ch,"Bern, Bern, Switzerland",https://www.bluewin.ch/it/attualita/borsa-economia/sciopero-lavoratori-edili-dopo-il-ticino-oggi-tocca-a-berna-2942384.html
,www.bluewin.ch,"Zurich, ZüSz, Switzerland",https://www.bluewin.ch/it/attualita/borsa-economia/sciopero-lavoratori-edili-dopo-il-ticino-oggi-tocca-a-berna-2942384.html
,www.bluewin.ch,Switzerland,https://www.bluewin.ch/it/attualita/borsa-economia/sciopero-lavoratori-edili-dopo-il-ticino-oggi-tocca-a-berna-2942384.html
,forex.cnfol.com,"Tokyo, Tokyo, Japan",http://forex.cnfol.com/jingjiyaowen/20251031/31756995.shtml
,www.dailysabah.com,France,https://www.dailysabah.com/arts/cinema/ai-cant-replace-humanity-in-storytelling-us-filmmaker-linklater
,www.malagahoy.es,Spain,https://www.malagahoy.es/malaga/detienen-malaga-sospechoso-banda-traficaba-cigarrillos_0_2005134828.html
,www.topagrar.com,China,https://www.topagrar.com/markt/news/us-sojabohnen-mit-steilem-anstieg-20019549.html
,www.manilatimes.net,"Manila, Manila, Philippines",https://www.manilatimes.net/2025/10/31/tmt-newswire/globenewswire/flsmidth-announces-changes-among-employee-elected-board-members/2213156
,www.manilatimes.net,Denmark,https://www.manilatimes.net/2025/10/31/tmt-newswire/globenewswire/flsmidth-announces-changes-among-employee-elected-board-members/2213156
,www.wgcu.org,"Orlando International Airport, Florida, United States",https://www.wgcu.org/2025-10-31/a-judge-to-weigh-in-on-snap-benefits-and-trump-wants-to-resume-nuclear-testing
,www.wgcu.org,"Florida, United States",https://www.wgcu.org/2025-10-31/a-judge-to-weigh-in-on-snap-benefits-and-trump-wants-to-resume-nuclear-testing
,www.lajornadadeoriente.com.mx,"Puebla, Puebla, Mexico",https://www.lajornadadeoriente.com.mx/puebla/renuevan-centro-de-atencion-al-visitante-en-puebla-tras-siete-administraciones-sin-intervencion/
,gda.com,Colombia,https://gda.com/detalle-de-la-noticia/?article=5905458
,www.dainiktribuneonline.com,"Rohtak, Haryana, India",https://www.dainiktribuneonline.com/news/explainers/why-was-the-anti-encroachment-drive-necessary-in-rohtak/
,www.jornada.com.mx,Mexico,https://www.jornada.com.mx/2025/10/31/capital/033n3cap
,www.jornada.com.mx,"Mexico City, Distrito Federal, Mexico",https://www.jornada.com.mx/2025/10/31/capital/033n3cap
,www.gx94radio.com,Canada,https://www.gx94radio.com/2025/10/31/carney-says-meeting-with-xi-marks-turning-point-in-canada-china-relationship/
,www.gx94radio.com,"Gyeongju, Kyongsang-Bukto, South Korea",https://www.gx94radio.com/2025/10/31/carney-says-meeting-with-xi-marks-turning-point-in-canada-china-relationship/
,www.thegazette.com,"Coralville, Iowa, United States",https://www.thegazette.com/guest-columnists/city-staff-does-a-great-job/
