published_at,source,title,url
,jujuyaldia.com.ar,Los precios de los combustibles aumentaron 40 % en 2025,https://www.jujuyaldia.com.ar/2025/12/29/los-precios-de-los-combustibles-aumentaron-40-en-2025/
,market.bisnis.com,"Emas Terkoreksi Usai Cetak Rekor , Tren Bullish Diprediksi Terjaga pada 2026",https://market.bisnis.com/read/20251229/235/1940294/emas-terkoreksi-usai-cetak-rekor-tren-bullish-diprediksi-terjaga-pada-2026
,civonline.it,"Piazza Regina Margherita , conto alla rovescia per il taglio dei lecci",https://www.civonline.it/cronaca/piazza-regina-margherita-conto-alla-rovescia-per-il-taglio-dei-lecci-wvoh8d2v
,stockbiz.vn,Kỳ hạn 10 năm tiếp tục chiếm ưu thế trên thị trường trái phiếu chính phủ,https://stockbiz.vn/tin-tuc/ky-han-10-nam-tiep-tuc-chiem-uu-the-tren-thi-truong-trai-phieu-chinh-phu/37537592
,nigeriasun.com,ENOC Group advances critical energy infrastructure in East Africa,http://www.nigeriasun.com/news/278780786/enoc-group-advances-critical-energy-infrastructure-in-east-africa
,time.mk,Time . ai,https://time.mk/ai/8a4b7cd2ea/mk/
,diepresse.com,"OeNB - Gouverneur Kocher fordert Umdenken zu Mercosur : „ Können es uns nicht leisten , auf eine solche Chance zu verzichten  – DiePresse . com",https://www.diepresse.com/20436927/oenb-gouverneur-kocher-fordert-umdenken-zu-mercosur-koennen-es-uns-auf
,echolive.ie,ALDI Ireland announces reduction to the price of butter,https://www.echolive.ie/nationalnews/arid-41767046.html
,openpr.com,How Shared Work Environments Help Build Professional Networks,https://www.openpr.com/news/4331167/how-shared-work-environments-help-build-professional-networks
,manilatimes.net,MedBright AI Investments Inc . Announces Name Change and Amended Investment Policy,https://www.manilatimes.net/2025/12/29/tmt-newswire/globenewswire/medbright-ai-investments-inc-announces-name-change-and-amended-investment-policy/2250422
,stern.de,Arbeit : Gewerkschaftsbund : Mehr Mindestlohn für 159 . 000 Beschäftigte,https://www.stern.de/gesellschaft/regional/hamburg-schleswig-holstein/arbeit--gewerkschaftsbund--mehr-mindestlohn-fuer-159-000-beschaeftigte-36997532.html
,finanznachrichten.de,Nevada Organic Phosphate Inc .: Nevada Organic Phosphate Announces OTCQB Listing,https://www.finanznachrichten.de/nachrichten-2025-12/67322462-nevada-organic-phosphate-inc-nevada-organic-phosphate-announces-otcqb-listing-296.htm
,finance.sina.com.cn,业内第一家 ！ 华为乾崑车云获CCRC车联网安全领域最高等级认证,https://finance.sina.com.cn/tech/discovery/2025-12-29/doc-inhenmhn4763986.shtml
,dialogos.com.cy,"Αύξηση 5 , 6 % στις πωλήσεις πετρελαιοειδών τον Νοέμβριο στην Κύπρο",https://dialogos.com.cy/ayxisi-56-stis-poliseis-petrelaioeidon-ton-noemvrio-stin-kypro/
,4investors.de,Tesla : Experten sehen bedingtes Aufwärtspotenzial,https://www.4investors.de/nachrichten/boerse.php?sektion=stock&ID=187542
,ilmessaggero.it,"Auto , aumentano i prezzi : tra assicurazione e bollo fino a 4 . 500 euro allanno . Peggio per i diesel dal 2026",https://www.ilmessaggero.it/economia/news/auto_aumenti_prezzi_assicurazione_bollo_4_500_euro_anno_costa_piu_diesel_2026_cosa_cambia-9269190.html
,caleaeuropeana.ro,Plățile PNRR din Sănătate au crescut cu 240 % în semestrul II din 2025 . Ministrul Alexandru Rogobete : Încrederea se construiește,https://www.caleaeuropeana.ro/platile-pnrr-din-sanatate-au-crescut-cu-240-in-semestrul-ii-din-2025-ministrul-alexandru-rogobete-increderea-se-construieste/
,dailyecho.co.uk,Full list of united kingdom retailers that closed stores in 2025,https://www.dailyecho.co.uk/news/25726844.full-list-uk-retailers-closed-stores-2025/
,finance.yahoo.com,GE Vernova Q4 2025 Earnings : What to Expect,https://finance.yahoo.com/news/ge-vernovas-q4-2025-earnings-102203236.html
,arriyadiyah.com,ثأر شخصي يهدد أحلام أرسنال | صحيفة الرياضية,https://arriyadiyah.com/881476/%D8%AB%D8%A3%D8%B1-%D8%B4%D8%AE%D8%B5%D9%8A-%D9%8A%D9%87%D8%AF%D8%AF-%D8%A3%D8%AD%D9%84%D8%A7%D9%85-%D8%A3%D8%B1%D8%B3%D9%86%D8%A7%D9%84
,cpr.org,How to recession - proof your finances,https://www.cpr.org/2025/12/29/how-to-recession-proof-your-finances/
,elintransigente.com,Allanan el Banco Central por irregularidades con el dólar durante el Gobierno de Alberto Fernández,https://elintransigente.com/2025/12/allanan-el-banco-central-por-irregularidades-con-el-dolar-durante-el-gobierno-de-alberto-fernandez/
,haberport.com,Bilecikte Yılbaşı Etkinlikleri Yalovadaki Olay Nedeniyle İptal,https://www.haberport.com/yasam/bilecik-te-yilbasi-etkinlikleri-yalova-daki-olay-nedeniyle-iptal-310130h
,askanews.it,"IntesaSp , Francesca Nieddu Chief Compliance , Mauro Senati Chief Risk",https://askanews.it/2025/12/29/intesasp-francesca-nieddu-chief-compliance-mauro-senati-chief-risk/
,finanznachrichten.de,Tesla : Neue Kaufstudie - Kursziel 500 Dollar,https://www.finanznachrichten.de/nachrichten-2025-12/67322461-tesla-neue-kaufstudie-kursziel-500-dollar-124.htm
,memurlar.net,DEAÞ  n Ankara Yapýlanmasý Soruþturmasýnda 8 pheli Tutukland,https://www.memurlar.net/haber/1155760/deas-in-ankara-yapilanmasi-sorusturmasinda-8-supheli-tutuklandi.html
,volksstimme.de,Supermärkte in Flammen : Großbrand in Zehdenick – zwei Jugendliche unter Tatverdacht,https://www.volksstimme.de/panorama/grossbrand-in-zehdenick-zwei-jugendliche-unter-tatverdacht-4172823
,praca.egospodarka.pl,Praca Grafik / Graficzka - oferty pracy Szczecin - FORUM TURYSTYKI REGIONÓW,"https://www.praca.egospodarka.pl/oferty-pracy/zachodniopomorskie/grafik-graficzka,69383237.html"
,vetogate.com,وزارة العمل تعلن صرف 1 . 5 مليون جنيه لأسرة ضحية حادث عمل بجنوب سيناء,https://www.vetogate.com/5563025
,jewishworldreview.com,The Supreme Court might actually simplify campaign finance,https://jewishworldreview.com/1225/carter122925.php
,punjabkesari.in,"Pension की No Tension , एक निवेश , जिंदगी भर कमाई , जानें क्या है खास योजना - no tension about your pension one investment lifelong income",https://www.punjabkesari.in/business/news/no-tension-about-your-pension-one-investment-lifelong-income-2268582
,noe.orf.at,Eltern - Kind - Pass ab Oktober elektronisch,https://noe.orf.at/stories/3335619/
,focus.ua,Прорицательница « увидела » смерть одного из мировых лидеров в 2026 году,https://focus.ua/worldfun/738556-proricatelnica-uvidela-smert-odnogo-iz-mirovyh-liderov-v-2026-godu
,ec.ltn.com.tw,台積電美廠巨大挑戰將至 美媒示警 ： 三星棄4奈米全力推進2奈米趕上,https://ec.ltn.com.tw/article/breakingnews/5293473
,albawaba.com,التداول الآلي مع Bitget : كيف تساعدك بوتات التداول على إدارة السوق بذكاء أكبر,https://www.albawaba.com/ar/business/%D8%A7%D9%84%D8%AA%D8%AF%D8%A7%D9%88%D9%84-%D8%A7%D9%84%D8%A2%D9%84%D9%8A-%D9%85%D8%B9-bitget-%D9%83%D9%8A%D9%81-%D8%AA%D8%B3%D8%A7%D8%B9%D8%AF%D9%83-%D8%A8%D9%88%D8%AA%D8%A7%D8%AA-1619471
,goldseiten.de,Apollo Silver Announces $2 . 5 Million Upsize to Previously Announced Financing to Allow for Insider Participation,https://www.goldseiten.de/artikel/683583--Apollo-Silver-Announces-2.5-Million-Upsize-to-Previously-Announced-Financing-to-Allow-for-Insider-Participation.html
,haberturk.com,Tokatta çiftçilere eğitim verildi - Tokat Haberleri,https://www.haberturk.com/tokat-haberleri/40107113-tokatta-ciftcilere-egitim-verildi
,theadvocate.com,Here my list of best Cuban sandwiches in Baton Rouge LA | Food / Restaurants,https://www.theadvocate.com/baton_rouge/entertainment_life/food_restaurants/cuban-sandwich-tour-in-baton-rouge/article_f209debd-ce36-4b31-8bb1-acf36dbbe2fd.html
,lrt.lt,VERT : „ Litgrid  toliau pirks balansavimo paslaugas iš „ Energy cells,https://www.lrt.lt/naujienos/verslas/4/2790147/vert-litgrid-toliau-pirks-balansavimo-paslaugas-is-energy-cells
,163.com,870万罚款创三年之最 ， 重庆农商行零售根基还稳吗 ？,https://www.163.com/dy/article/KHVOROL20519II4K.html
,vetogate.com,مصر للطيران تطلق خطًا جويًا جديدًا إلى ڤينيسيا اعتبارًا من يونيو 2026,https://www.vetogate.com/5563012
,openpr.com,United States Acrylic Monomer Market 2031,https://www.openpr.com/news/4331145/united-states-acrylic-monomer-market-2031-growth-drivers
,forbes.ro,"Ilie Găgeatu , General Manager Mars Wrigley România : „ Pe termen lung , piața din România reprezintă o oportunitate excelentă pentru industria FMCG",https://www.forbes.ro/ilie-gageatu-general-manager-mars-wrigley-romania-pe-termen-lung-piata-din-romania-reprezinta-o-oportunitate-excelenta-pentru-industria-fmcg-480867
,haberler.com,Girdiği markette raftaki şişeleri kırdı,https://www.haberler.com/3-sayfa/alkollu-kadin-markette-siseleri-kirdi-adli-kontrolle-serbest-birakildi-19404100-haberi/
,finance.sina.com.cn,DDR5 、 HBM等芯片已全面暴涨 仅剩DDR3 、 SLC及NOR三种还在洼地,https://finance.sina.com.cn/tech/roll/2025-12-29/doc-inhenrqi0028214.shtml
,regio7.cat,Una Nit Viva excepcional per la pluja tanca amb més de 700 visitants,https://www.regio7.cat/bages/2025/12/29/nit-viva-excepcional-per-pluja-125224918.html
,kosmo.com.my,"Dulu  rider , sekarang mampu beri hantaran Mazda 3 kepada isteri",https://www.kosmo.com.my/2025/12/29/dulu-rider-sekarang-mampu-beri-hantaran-mazda-3-kepada-isteri/
,news.qq.com,云南威信县一天制止8起滥办酒席 ， 官方 ： 陈说危害 ， 狠刹借机敛财之风 _ 腾讯新闻,https://news.qq.com/rain/a/20251229A06SEF00
,manilatimes.net,LC Sign Scales Bespoke Signage Manufacturing Through Project - Driven Excellence,https://www.manilatimes.net/2025/12/29/tmt-newswire/globenewswire/lc-sign-scales-bespoke-signage-manufacturing-through-project-driven-excellence/2250418
,erewashsound.com,Erewash MP Adam takes to the airwaves for seasonal guest appearance,https://www.erewashsound.com/news/borough-wide/erewash-mp-adam-takes-to-the-airwaves-for-seasonal-guest-appearance/
,forbes.ro,"Answear , creștere a veniturilor de peste 17 la sută în primele 3 trimestre din 2025",https://www.forbes.ro/answear-crestere-a-veniturilor-de-peste-17-la-suta-in-primele-3-trimestre-din-2025-480844
,jpnn.com,"BNI Siapkan Relaksasi Kredit untuk Debitur Terdampak Bencana di Sumatra , Ini Skemanya",https://www.jpnn.com/news/bni-siapkan-relaksasi-kredit-untuk-debitur-terdampak-bencana-di-sumatra-ini-skemanya
,zdnet.co.kr,"가온그룹 , 5성급 호텔에 서비스 로봇 공급",https://zdnet.co.kr/view/?no=20251229222726
,novinite.com,Euro Day Concerns : Rising Prices and Coin Shortages Worry Bulgarian Businesses - Novinite . com,https://www.novinite.com/articles/236154/Euro+Day+Concerns:+Rising+Prices+and+Coin+Shortages+Worry+Bulgarian+Businesses
,montereyherald.com,Best Blue Diamond cookware,https://www.montereyherald.com/2025/12/28/best-blue-diamond-cookware/
,dnevnik.rs,"ПРЕДСЕДНИЦА ВИОЛЕТА ОЦОКОЉИЋ НАЈАВИЛА РЕКОРДАН БУЏЕТ ОПШТИНЕ КОВИН Више од 3 , 3 милијарде динара за развој , школе , културу и инфраструктуру",https://www.dnevnik.rs/vojvodina/banat/predsednica-opstine-violeta-ocokoljic-najavila-rekordan-budzet-opstine-kovin-vise-od-3-3-milijarde-dinara-za-razvoj-skole-kulturu-infrastrukturu-2025-12-29
,leggioggi.it,"TFR , i coefficienti di rivalutazione di novembre 2025 . Le tabelle",https://www.leggioggi.it/tfr-coefficienti-di-rivalutazione-2025-tabelle/
,arberia.tv,"Çmimi i produkteve të konsumit rritet 12 – 15 %, AKB : Rritja e çmimit të energjisë po dëmton bizneset dhe investimet – Arbëria TV",https://arberia.tv/cmimi-i-produkteve-te-konsumit-rritet-12-15-akb-rritja-e-cmimit-te-energjise-po-demton-bizneset-dhe-investimet/
,finance.yahoo.com,Banks Are Unanimously Bearish On Oil – Is It The Contrarian Opportunity For 2026 ?,https://finance.yahoo.com/news/banks-unanimously-bearish-oil-contrarian-133117783.html
,palermomania.it,Giro di boa . Riflessioni per non smarrirsi in una navigazione complicata  di Giovanni Burtone,https://www.palermomania.it/news/libri/giro-di-boa-riflessioni-per-non-smarrirsi-in-una-navigazione-complicata-di-giovanni-burtone-135385.html
,israelherald.com,Bargain hunting rises while returns dip after Christmas rush,http://www.israelherald.com/news/278777519/bargain-hunting-rises-while-returns-dip-after-christmas-rush
,zazoom.it,Milan ecco un altro colpo in attacco | Lo prenderebbero domattina Era a San Siro,https://www.zazoom.it/2025-12-29/milan-ecco-un-altro-colpo-in-attacco-lo-prenderebbero-domattina-era-a-san-siro/18384324/
,moneylife.in,ED Raids on UAE - Based Fugitive Money Laundering Network links to IPO - bound Apollo Green Energy as accomplice,https://moneylife.in/article/ed-raids-on-uaebased-fugitives-money-laundering-network-links-to-ipobound-apollo-green-energys-as-accomplice/79242.html
,lapresse.it,"Stipendi in sanità , lentità dei divari tra Nord e Sud",https://www.lapresse.it/salute/2025/12/29/stipendi-in-sanita-lentita-dei-divari-tra-nord-e-sud/
,vol.at,Household Energy : These Were the Biggest Price Drivers in November,https://www.vol.at/household-energy-these-were-the-biggest-price-drivers-in-november/9893903
,zf.ro,"Care au fost „ secretele  Transgaz în 2025 , an în care acţiunile companiei de ...",https://www.zf.ro/burse-fonduri-mutuale/care-au-fost-secretele-transgaz-in-2025-an-in-care-actiunile-22995519
,hna.de,Weihnachtsmarkt - Besucher erhält rare 1 - Euro - Münze als Wechselgeld – „ Füll einen Lotto - Schein aus,https://www.hna.de/verbraucher/weihnachtsmarkt-besucher-erhaelt-rare-euro-muenze-als-wechselgeld-fuell-einen-lotto-schein-aus-94101778.html
,giga.de,Gaming - Monitor für unter 120 Euro : MediaMarkt haut Acer - Bestseller zum Sparpreis raus,https://www.giga.de/tech/gaming-monitor-fuer-unter-120-euro-mediamarkt-haut-acer-bestseller-zum-sparpreis-raus--01K22V7CFTWMDN351TP8PTH5KA
,haberler.com,Samsunda yılbaşı öncesi alkollü içki satış noktaları denetlendi,http://www.haberler.com/guncel/samsun-da-yilbasi-ocesi-kacak-ve-sahte-alkollu-icki-denetimleri-19404074-haberi/
,cursdeguvernare.ro,Bulgaria trece la moneda euro de la 1 ianuarie - jumătate din populație se teme de creșterea prețurilor,https://cursdeguvernare.ro/bulgaria-trece-la-moneda-euro-de-la-1-ianuarie-jumatate-din-populatie-se-teme-de-cresterea-preturilor-banii-gri-sunt-albiti.html
,zdnet.co.kr,"화해 , 인플루언서 공동구매 서비스  크리에이터 마켓  출시 - ZDNet korea",https://zdnet.co.kr/view/?no=20251229222011
,ori.hangzhou.com.cn,2025年杭州民生实事项目  成绩单  出炉,https://ori.hangzhou.com.cn/ornews/content/2025-12/29/content_9153006.htm
,deraktionaer.de,"Kupfer mit neuem Rekord – BHP , Rio Tinto & Co profitieren",https://www.deraktionaer.de/artikel/aktien/kupfer-mit-neuem-rekord-bhp-rio-tinto-co-profitieren-20392717.html
,barryanddistrictnews.co.uk,Full list of united kingdom retailers that closed stores in 2025 | Barry And District News,https://www.barryanddistrictnews.co.uk/news/national/uk-today/25726252.full-list-uk-retailers-closed-stores-2025/
,manilatimes.net,"Branded Legacy , Inc . Announces Successful Retirement of Legacy Convertible Debt as New Management Focuses on Balance Sheet Optimization and OTC Yield Sign Removal",https://www.manilatimes.net/2025/12/29/tmt-newswire/globenewswire/branded-legacy-inc-announces-successful-retirement-of-legacy-convertible-debt-as-new-management-focuses-on-balance-sheet-optimization-and-otc-yield-sign-removal/2250455
,dnaberita.com,"BPK Serahkan LHP Semester II 2025 , Bobby Nasution Harapkan Sinkronisasi Program dan Kebutuhan Masyarakat",https://dnaberita.com/bpk-serahkan-lhp-semester-ii-2025-bobby-nasution-harapkan-sinkronisasi-program-dan-kebutuhan-masyarakat/
,deraktionaer.de,Vonovia : Das spricht 2026 für ( k ) ein Comeback,https://www.deraktionaer.de/artikel/aktien/vonovia-das-spricht-2026-fuer-kein-comeback-20392721.html
,askanews.it,"Confcooperativa : a Capodanno spesa cresce , ma solo per inflazione",https://askanews.it/2025/12/29/confcooperativa-a-capodanno-spesa-cresce-ma-solo-per-inflazione/
,cna.com.tw,牛耳藝術2025節目多元 逾20萬觀眾走入音樂殿堂 | 文化,https://www.cna.com.tw:443/news/acul/202512290291.aspx
,lacronicabadajoz.com,El GOBIERNO EXTREMADURA BALANCE INVERSIONES | Gobierno hace balance en Extremadura : más de 7 . 300 millones de euros en inversiones refuerzan las políticas sociales,https://www.lacronicabadajoz.com/extremadura/2025/12/29/gobierno-balance-extremadura-7-300-125223832.html
,manilatimes.net,"Tron Inc . Secures $18 Million Strategic Investment from Justin Sun , Founder of the TRON Blockchain",https://www.manilatimes.net/2025/12/29/tmt-newswire/globenewswire/tron-inc-secures-18-million-strategic-investment-from-justin-sun-founder-of-the-tron-blockchain/2250457
,praca.egospodarka.pl,Praca Technik farmaceutyczny / Techniczka farmaceutyczna - oferty pracy dostarczone przez Grupa Nowa Farmacja Sp . z o . o .,"https://www.praca.egospodarka.pl/oferty-pracy/grupa-nowa-farmacja-sp-z-o-o/technik-farmaceutyczny-techniczka-farmaceutyczna,69383250.html"
,volksstimme.de,Kaulitz - Brüder emotional wie nie : Dieses Treffen war ihr Jahreshighlight 2025,https://www.volksstimme.de/lokal/wolmirstedt/tokio-hotel-kaulitz-tom-bill-klassentreffen-highlight-2025-podcast-jugendliebe-4167604
,ansa.it,"2 , 5miliardi di euro per il cenone di Capodanno - Fiere e Eventi",https://www.ansa.it/canale_terraegusto/notizie/fiere_eventi/2025/12/29/confcooperative-25miliardi-di-euro-per-il-cenone-di-capodanno_ccdf90cb-26ec-4324-9939-c5957c519cd1.html
,teatronaturale.it,Aiuto allo stoccaggio privato per lolio di oliva tunisino,https://www.teatronaturale.it/tracce/mondo/46840-aiuto-allo-stoccaggio-privato-per-l-olio-di-oliva-tunisino.htm
,manilatimes.net,374Water Appoints Charles Weiser to Board of Directors,https://www.manilatimes.net/2025/12/29/tmt-newswire/globenewswire/374water-appoints-charles-weiser-to-board-of-directors/2250462
,openpr.com,Information Technology Operations Analytics ( ITOA ) Market,https://www.openpr.com/news/4331146/information-technology-operations-analytics-itoa-market
,forbes.ro,Mauricio Mesa Gomez ( Cordia Romania & Spania ): „ Vom începe în curând dezvoltarea unor proiecte noi în București,https://www.forbes.ro/mauricio-mesa-gomez-cordia-romania-spania-vom-incepe-in-curand-dezvoltarea-unor-proiecte-noi-in-bucuresti-480781
,coindesk.com,Sberbank issues Russia first bitcoin - backed loan in pilot deal,https://www.coindesk.com/business/2025/12/29/sberbank-issues-russia-s-first-crypto-backed-loan-to-bitcoin-miner-intelion-data
,emirates247.com,Your savings arent disappearing . Theyre quietly turning into dust . - Business - Corporate - Emirates24,https://www.emirates247.com/business/corporate/your-savings-aren-t-disappearing-they-re-quietly-turning-into-dust-2025-12-29-1.743278
,telegrafi.com,Fondi Pensional mbyll vitin me mbi 300 milionë euro kthim nga investimet,https://telegrafi.com/fondi-pensional-mbyll-vitin-me-mbi-300-milione-euro-kthim-nga-investimet/
,fool.com,Ranking the Best  Magnificent Seven  Stocks to Buy for 2026 . Here My No . 3,https://www.fool.com/investing/2025/12/29/ranking-the-best-magnificent-seven-stocks-to-buy-3/
,forbes.ro,Lindab Group își vinde operațiunile din România și finalizează retragerea din Profile Systems în Europa de Est,https://www.forbes.ro/lindab-group-isi-vinde-operatiunile-din-romania-si-finalizeaza-retragerea-din-profile-systems-in-europa-de-est-480795
,euro-petrole.com,Woodside Energy - Woodside and BOTAS finalise long - term ...,https://www.euro-petrole.com/woodside-and-botas-finalise-long-term-lng-supply-agreement-n-i-29475
,ultimosegundo.ig.com.br,O movimento da Unilever que reposiciona o poder do marketing,https://ultimosegundo.ig.com.br/colunas/ideia-e-meio/2025-12-29/o-movimento-da-unilever-que-reposiciona-o-poder-do-marketing.html
,adnkronos.com,La Moneta dellAnno 2025 è quella dedicata ai 160 anni delle Capitanerie di Porto,https://www.adnkronos.com/economia/la-moneta-dellanno-2025-e-quella-dedicata-ai-160-anni-delle-capitanerie-di-porto_42cnK896NsEYHrTqLTER3N
,stockbiz.vn,"Chứng khoán phái sinh ngày 29 / 12 : Sắc xanh phủ rộng , thận trọng khi mốc 2 . 000 điểm cận kề",https://stockbiz.vn/tin-tuc/chung-khoan-phai-sinh-ngay-2912-sac-xanh-phu-rong-than-trong-khi-moc-2000-diem-can-ke/37537603
,schwaebische-post.de,Vape - Verbot ? Umweltminister will Einweg - E - Zigaretten verbieten – „ Können explodieren,http://www.schwaebische-post.de/welt/politik/vape-verbot-umweltminister-schneider-will-einweg-zigaretten-verbieten-koennen-explodieren-zr-94101762.html
,palermomania.it,Piazza Leoni senza segnaletica orizzontale dopo i lavori : lappello dei Comitati civici Palermo per la sicurezza stradale,https://www.palermomania.it/news/la-parola-alla-citta/piazza-leoni-senza-segnaletica-orizzontale-dopo-i-lavori-lappello-dei-comitati-civici-palermo-per-la-sicurezza-stradale-135423.html
,bursahakimiyet.com.tr,Endonezyada huzurevi faciası ! Yangında 16 kişi hayatını kaybetti,https://www.bursahakimiyet.com.tr/dunya/endonezya-da-huzurevi-faciasi-yanginda-16-kisi-hayatini-kaybetti-1556991
,163.com,苏宁系38家公司重整进展 ： 经过三次延期后 ， 草案获得通过,https://www.163.com/dy/article/KHVP7HE30514R9P4.html
,sun-sentinel.com,Brightline seeks to raise $100 million from lenders ; Fort Lauderdale garage placed up for sale,https://www.sun-sentinel.com/2025/12/29/brightline-seeks-to-raise-100-million-from-lenders-fort-lauderdale-garage-placed-up-for-sale/
,tspr.org,Electric vehicles had a bumpy road in 2025 and one pleasant surprise,https://www.tspr.org/npr-news/2025-12-29/electric-vehicles-had-a-bumpy-road-in-2025-and-one-pleasant-surprise
,aspenpublicradio.org,"For those who help the poor , 2025 goes down as a year of chaos",https://www.aspenpublicradio.org/2025-12-29/for-those-who-help-the-poor-2025-goes-down-as-a-year-of-chaos
,finance.ifeng.com,雷军低调期 ， 兄弟林斌在小米套现140亿,https://finance.ifeng.com/c/8pUCKyUOYdS
,express.co.uk,Pensions under attack as 3 . 3 m to be caught in Rachel Reeves tax trap | Personal Finance | Finance,https://www.express.co.uk/finance/personalfinance/2151273/pensions-rachel-reeves-tax
,finanznachrichten.de,The Board of Directors of SciBase resolves on a previously communicated rights issue of shares of approximately SEK 83 million,https://www.finanznachrichten.de/nachrichten-2025-12/67322302-the-board-of-directors-of-scibase-resolves-on-a-previously-communicated-rights-issue-of-shares-of-approximately-sek-83-million-008.htm
,chennaionline.com,2025 Most - Loved Tech Devices  – Chennaionline,https://www.chennaionline.com/technology/2025s-most-loved-tech-devices/
,freitag.de,„ Lidl macht uns kaputt : Wie sich Angestellte gegen den Discounter wehren der Freitag,https://www.freitag.de/autoren/joscha-frahm/lidl-macht-uns-kaputt-wie-sich-angestellte-gegen-den-discounter-wehren
,auto.economictimes.indiatimes.com,"Hyundai Palisade Sales Set to Exceed 200 , 000 as Hybrid Popularity Soars , ETAuto",https://auto.economictimes.indiatimes.com/news/passenger-vehicle/hyundai-palisade-global-sales-set-to-cross-200000-mark-as-hybrid-demand-soars/126230054
,ekonomiaonline.com,"Çmimi i produkteve të konsumit rritet 12 – 15 %, AKB : Rritja e çmimit të energjisë po dëmton bizneset dhe investimet",https://ekonomiaonline.com/cmimi-i-produkteve-te-konsumit-rritet-12-15-akb-rritja-e-cmimit-te-energjise-po-demton-bizneset-dhe-investimet/
,punto-informatico.it,Fujifilm ha presentato una cartuccia a nastro magnetico da 40 TB,https://www.punto-informatico.it/fujifilm-cartuccia-nastro-magnetico-40-tb/
,itnewsafrica.com,"Ethiopia Telecom Data Prices Under Scrutiny as Operators Adjust Tariffs - IT News Africa | Business Technology , Telecoms and Startup News",https://www.itnewsafrica.com/2025/12/ethiopia-telecom-data-prices-under-scrutiny-as-operators-adjust-tariffs/
,calcionews24.com,"Mercato Milan , spunta il Fenerbahce : contatto con il rossonero Nkunku ! Ecco la proposta iniziale",https://www.calcionews24.com/mercato-milan-idea-nkunku-fenerbahce-tedesco/
,punto-informatico.it,Il 2026 porterà inflazione e un nuovo compenso per copia privata,https://www.punto-informatico.it/il-2026-portera-inflazione-e-un-nuovo-compenso-per-copia-privata/
,4investors.de,Defama : Akquisition in Bayern,https://www.4investors.de/nachrichten/boerse.php?sektion=stock&ID=187544
,ilgiornaledivicenza.it,Consigliere comunale di Thiene difende Hannoun sui social : è polemica . Fdi : « Revocare la delega »,https://www.ilgiornaledivicenza.it/territorio-vicentino/thiene/consigliere-comunale-di-thiene-difende-hannoun-sui-social-la-replica-di-fdi-revocare-la-delega-1.12884620
,dantri.com.vn,"Không để cán bộ  mần thinh , chỉ lo quan hệ tốt để được đề bạt",https://dantri.com.vn/noi-vu/khong-de-can-bo-man-thinh-chi-lo-quan-he-tot-de-duoc-de-bat-20251229193947988.htm
,fnp.de,Böller - Alarm für Hunde und Katzen : So übersteht Ihr Haustier Silvester,http://www.fnp.de/frankfurt/silvester-haustiere-boeller-hunde-katzen-tipps-feuerwerk-frankfurt-expertin-94100736.html
,forbes.ro,"Vlad Ciuburciu , Director General Vascar : „ Incertitudinile geopolitice vor continua să afecteze economia globală",https://www.forbes.ro/vlad-ciuburciu-director-general-vascar-incertitudinile-geopolitice-vor-continua-sa-afecteze-economia-globala-480863
