published_at,source,title,url
,chinanationalnews.com,Mobileye Leads ADAS Show 2026 at the Launch of India First Dedicated ADAS Test City in Pune,https://www.chinanationalnews.com/news/279076746/mobileye-leads-adas-show-2026-at-the-launch-of-india-first-dedicated-adas-test-city-in-pune
,businessday.co.za,Lamola defends foreign policy as parties clash over Dirco budget,https://www.businessday.co.za/news/2026-05-26-lamola-defends-foreign-policy-as-parties-clash-over-dirco-budget/
,indiagazette.com,Could Iran cut off the worlds internet access,http://www.indiagazette.com/news/279077911/could-iran-cut-off-the-worlds-internet-access
,pr-inside.com,"Bronstein , Gewirtz & Grossman , LLC Is Investigating Arm Holdings plc ...",https://www.pr-inside.com/bronstein-gewirtz-grossman-llc-is-investigating-arm-holdings-plc-r5187993.htm
,interfax.com.ua,НКЕК пропонує спрямувати 35 МГц у діапазоні 2600 МГц для розвитку мобільного зв  язку,https://interfax.com.ua/news/telecom/1171203.html
,pr-inside.com,"Bronstein , Gewirtz & Grossman , LLC Is Investigating Black Rock Coffee ...",https://www.pr-inside.com/bronstein-gewirtz-grossman-llc-is-investigating-black-rock-coffee-r5187994.htm
,local3news.com,CommonSpirit in Ringgold receives nearly $1M for tech upgrades,https://www.local3news.com/local-news/commonspirit-in-ringgold-receives-nearly-1m-for-tech-upgrades/article_f0a0d235-1cff-41e3-bcd0-10d0819511bc.html
,rocklandtimes.com,RZM Fine Arts and Antiques Inc : Ask the Appraiser,https://rocklandtimes.com/2026/05/26/rzm-fine-arts-and-antiques-inc-ask-the-appraiser-36/
,elcorreo.com,Más de 180 pequeños bailarines se reunirán el sábado en Portugalete,https://www.elcorreo.com/bizkaia/margen-izquierda/180-pequenos-bailarines-reuniran-sabado-portugalete-20260526183137-nt.html
,dnoticias.pt,Paula Margarido nota que pólos de emprego optimizam insero profissional,https://www.dnoticias.pt/2026/5/26/493299-paula-margarido-nota-que-polos-de-emprego-optimizam-insercao-profissional/
,businessday.co.za,Reserve Bank leading indicator signals uptick in economic activity,https://www.businessday.co.za/economy/2026-05-26-reserve-banks-leading-indicator-signals-uptick-in-economic-activity/
,tagesschau.de,Aufräumen nach dem russischen Großangriff auf Kiew,https://www.tagesschau.de/ausland/europa/ukraine-nach-angriffen-100.html
,n.yam.com,《 屍速禁區 》 掀韓國喪屍片新熱潮 全智賢 、 池昌旭聯手挑戰進化感染者,https://n.yam.com/Article/20260527772989
,pr-inside.com,"Bronstein , Gewirtz & Grossman , LLC Is Investigating Prestige Consumer ...",https://www.pr-inside.com/bronstein-gewirtz-grossman-llc-is-investigating-prestige-consumer-r5187992.htm
,nordbayern.de,"Vergiss den Gartenstuhl : Amazon kontert Aldi & Lidl mit dem neuen Sitz - Trend für 23 , 74 Euro",https://www.nordbayern.de/schnaeppchen/vergiss-den-gartenstuhl-amazon-kontert-aldi-lidl-mit-dem-neuen-sitz-trend-fur-23-74-euro-1.15130075
,itbear.com.cn,马斯克亮出xAI新招 ： Grok Build登场 ， V9蓄势待发角逐AI编程战场 - 业界动态 - ITBear科技资讯,https://www.itbear.com.cn/html/2026-05/1361219.html
,zazoom.it,Moretto | Il Milan ha incontrato Iraola a Londra Il retroscena di una settimana fa …,https://www.zazoom.it/2026-05-26/moretto-il-milan-ha-incontrato-iraola-a-londra-il-retroscena-di-una-settimana-fa/19255707/
,zazoom.it,Lincontro con Italiano è andato bene è lui la prima scelta del Napoli Pedullà,https://www.zazoom.it/2026-05-26/lincontro-con-italiano-e-andato-bene-e-lui-la-prima-scelta-del-napoli-pedulla/19255759/
,yardbarker.com,Met Freddy Peralta gets real on trade rumors,https://www.yardbarker.com/mlb/articles/mets_freddy_peralta_gets_real_on_trade_rumors/s1_13132_43884616
,n.yam.com,寒舍餐旅股東會通過每股配發2 . 58元現金股利,https://n.yam.com/Article/20260527680526
,interfax.com.ua,"Київстар  придбав 6 СЕС на 105 МВт за $80 , 8 млн",https://interfax.com.ua/news/telecom/1171204.html
,myedmondsnews.com,How WA controversial cap on rent hikes has been enforced one year later,https://myedmondsnews.com/2026/05/how-was-controversial-cap-on-rent-hikes-has-been-enforced-one-year-later/
,freshfruitportal.com,Mangos México wants to transform the sector and drive international growth,https://www.freshfruitportal.com/news/2026/05/26/mangos-mexico/
,portfolio.hu,Komoly drágulás jöhet a horvát boltokban,https://www.portfolio.hu/gazdasag/20260526/komoly-dragulas-johet-a-horvat-boltokban-839166
,orlandoweekly.com,The  union avoidance  industry is worth $1 . 7 billion . Florida union busters are cashing in .,https://www.orlandoweekly.com/news/labor/the-union-avoidance-industry-is-worth-1-7-billion-florida-union-busters-are-cashing-in/
,hsbnoticias.com,Mastercard lanza en Colombia una tarjeta exclusiva con beneficios de alto nivel,https://www.hsbnoticias.com/mastercard-lanza-en-colombia-una-tarjeta-exclusiva-con-beneficios-de-alto-nivel/
,hkcd.com,【 投行視野 】 財政重心轉向AI與民生 基建年代逐步退場,https://www.hkcd.com/hkcdweb/content/2026/05/26/content_8756829.html
,chinanationalnews.com,fischer Strengthens Production in Asia : New Production Sites in India and China,https://www.chinanationalnews.com/news/279077305/fischer-strengthens-production-in-asia-new-production-sites-in-india-and-china
,n.yam.com,尹衍樑豪宅代表作 潤泰松濤苑單價270萬坐穩中正區最頂豪宅,https://n.yam.com/Article/20260527901296
,pulzo.com,Conductores en vilo por nueva ley que les quitaría la licencia de conducción,https://www.pulzo.com/carros/conductores-vilo-nueva-ley-que-les-quitaria-licencia-conduccion-PP5193650A
,memeburn.com,Smartphones Reshape South Africa iGaming Map as Online Revenue Hits R52bn,https://memeburn.com/smartphones-reshape-south-africas-igaming-map-as-online-revenue-hits-r52bn/
,larepublica.co,El déficit por cuenta corriente de Brasil fue mayor de lo previsto en abril de este año,https://www.larepublica.co/globoeconomia/el-deficit-por-cuenta-corriente-de-brasil-fue-mayor-de-lo-previsto-en-abril-de-este-ano-4400693
,vietnamnet.vn,"Bàn giao đúng lễ hội pháo hoa , cư dân Sun Ponte Residence đón đặc quyền hiếm có",https://vietnamnet.vn/ban-giao-dung-le-hoi-phao-hoa-cu-dan-sun-ponte-residence-don-dac-quyen-hiem-co-2519604.html
,thebusinessdesk.com,Aquaculture tech business scales up production with manufacturing partner,https://www.thebusinessdesk.com/westmidlands/news/2112199-aquaculture-tech-business-scales-up-production-with-manufacturing-partner/
,correiobraziliense.com.br,"Zema :  Quem votar em Flávio , entrega a eleio para Lula",https://www.correiobraziliense.com.br/politica/2026/05/7427914-zema-quem-votar-em-flavio-entrega-a-eleicao-para-lula.html
,wiwo.de,180 . 000 Euro als Einstiegsgehalt ? „ Langfristig spielt das keine Rolle,https://www.wiwo.de/unternehmen/dienstleister/180.000-euro-als-einstiegsgehalt-langfristig-spielt-das-keine-rolle/100227193.html
,thebusinessdesk.com,New office hub planned for Nottingham Lace Market,https://www.thebusinessdesk.com/eastmidlands/news/2110880-new-office-hub-planned-for-nottingham%E2%80%99s-lace-market/
,londonmercury.com,"Gold seen consolidating near term before resuming uptrend on West Asia worries , stronger USD : Report",http://www.londonmercury.com/news/279077843/gold-seen-consolidating-near-term-before-resuming-uptrend-on-west-asia-worries-stronger-usd-report
,itbear.com.cn,油价重压燃油车 ， 合资新能源转型加速 ， 能否在中国市场破局突围 ？- 业界动态 - ITBear科技资讯,https://www.itbear.com.cn/html/2026-05/1361201.html
,index.hr,"Poljska će proizvoditi projektile za Patriote , Amerika odobrila .  Bili su skeptični",https://www.index.hr/vijesti/clanak/poljska-dobila-zeleno-svjetlo-od-amerike-za-proizvodnju-projektila-patriot/2796190.aspx
,pr-inside.com,Join Clinch Resource Exclusive Live Investor Webinar and Q & A Session ...,https://www.pr-inside.com/join-clinch-resources-exclusive-live-investor-webinar-and-q-a-session-r5188007.htm
,hkcd.com,馬斯克大發戰爭財 星鏈戰時收費暴漲5倍 IPO前夕狂谷收入,https://www.hkcd.com/hkcdweb/content/2026/05/26/content_8756831.html
,sakshi.com,పెట్రోల్ ధరలు రూ . 10 పెరగాల్సింది !,https://www.sakshi.com/telugu-news/business/fuel-prices-could-have-risen-rs-10-earlier-says-nirmala-sitharaman-2798150
,actualidad.rt.com,El precio de la guerra : la gasolina se dispara en todo EE . UU . ¿ Qué sigue ?,https://actualidad.rt.com/actualidad/607138-precio-guerra-gasolina-dispara-eeuu-que-sigue
,lesnumeriques.com,"Vols France – Marrakech : comparer Transavia , easyJet et Ryanair pour un city break en 2026",https://www.lesnumeriques.com/loisirs/vols-france-marrakech-comparer-transavia-easyjet-et-ryanair-pour-un-city-break-en-2026-na256493.html
,interior-news.com,B . C . minimum wage set to rise to $18 . 25 per hour on June 1,https://interior-news.com/2026/05/26/b-c-s-minimum-wage-set-to-rise-to-18-25-per-hour-on-june-1/
,lokmat.com,Lava Shark 2 5G : अवघ्या १२ हजारांत भरमसाठ फीचर्स असलेला  मेड इन इंडिया  स्मार्टफोन लॉन्च !,https://www.lokmat.com/tech/lava-launches-budget-shark-2-5g-smartphone-with-6000mah-battery-and-120hz-display-a-a1012/
,tickerreport.com,Cartesian Therapeutics ( NASDAQ : RNAC ) Price Target Lowered to $40 . 00 at Needham & Company LLC,https://www.tickerreport.com/banking-finance/13454047/cartesian-therapeutics-nasdaqrnac-price-target-lowered-to-40-00-at-needham-company-llc.html
,sofokleous10.gr,Στην κορυφή της παγκόσμιας ναυτιλίας η Ελλάδα με 5 . 800 πλοία,https://sofokleous10.gr/2026/05/26/%CF%83%CF%84%CE%B7%CE%BD-%CE%BA%CE%BF%CF%81%CF%85%CF%86%CE%AE-%CF%84%CE%B7%CF%82-%CF%80%CE%B1%CE%B3%CE%BA%CF%8C%CF%83%CE%BC%CE%B9%CE%B1%CF%82-%CE%BD%CE%B1%CF%85%CF%84%CE%B9%CE%BB%CE%AF%CE%B1%CF%82/
,larepublica.co,"La gestora , Tina Vandersteel , que ganó con Venezuela cuando nadie quería entrar",https://www.larepublica.co/globoeconomia/la-gestora-tina-vandersteel-que-gano-con-venezuela-cuando-nadie-queria-entrar-4400795
,finanznachrichten.de,EQS - News : H2APEX Group SCA : H2APEX veröffentlicht Finanzzahlen für das erste Quartal 2026 und bestätigt Prognose,https://www.finanznachrichten.de/nachrichten-2026-05/68597729-eqs-news-h2apex-group-sca-h2apex-veroeffentlicht-finanzzahlen-fuer-das-erste-quartal-2026-und-bestaetigt-prognose-022.htm
,excelsior.com.mx,Ahrefs lanza el agente de IA  Agent A  para la nueva era del marketing,https://www.excelsior.com.mx/tecnologia/ahrefs-lanza-agente-ia-agent-para-nueva-era-marketing
,sakshi.com,బక్రీద్‌పై కన్ఫ్యూజన్ .. మే 28న స్టాక్ మార్కెట్లకు సెలవా ?,https://www.sakshi.com/telugu-news/business/markets-shut-or-open-bakrid-know-details-here-2798131
,dna.fr,"Brumath . Contesté , victime de soucis financiers , le projet de zone de loisirs est abandonné",https://www.dna.fr/culture-loisirs/2026/05/26/prevue-pour-cette-annee-la-zone-de-loisirs-ne-verra-finalement-pas-le-jour
,t3.com,Jaeger - LeCoultre unveils a range of new Reverso models – and they look stunning,https://www.t3.com/luxury/watches/jaeger-lecoultre-unveils-a-range-of-new-reverso-models-and-they-look-stunning
,haberradikal.com,"Uydu Okyanus Gözetimi Pazarı En Son Sektör Boyutu , Büyümesi , Payı , Talebi , Trendleri , Rekabet Ortamı ve 2034  ye Kadar Tahminler – Haber Radikal",http://www.haberradikal.com/2026/05/26/uydu-okyanus-gozetimi-pazari-en-son-sektor-boyutu-buyumesi-payi-talebi-trendleri-rekabet-ortami-ve-2034ye-kadar-tahminler/
,tickerreport.com,First Trust Nasdaq Artificial Intelligence and Robotics ETF ( NASDAQ : ROBT ) Sets New 12 - Month High – Here Why,https://www.tickerreport.com/banking-finance/13454048/first-trust-nasdaq-artificial-intelligence-and-robotics-etf-nasdaqrobt-sets-new-12-month-high-heres-why.html
,breitbart.com,Exclusive Sen . Tom Cotton Targets Cybersecurity Risks of Medical Devices Made in China,https://www.breitbart.com/politics/2026/05/26/exclusive-sen-tom-cotton-targets-cybersecurity-risks-of-medical-devices-made-in-china/
,sofokleous10.gr,Wall Street : Τεχνολογία και γεωπολιτικές προσδοκίες « εκτοξεύουν » τις μετοχές,https://sofokleous10.gr/2026/05/26/wall-street-%CF%84%CE%B5%CF%87%CE%BD%CE%BF%CE%BB%CE%BF%CE%B3%CE%AF%CE%B1-%CE%BA%CE%B1%CE%B9-%CE%B3%CE%B5%CF%89%CF%80%CE%BF%CE%BB%CE%B9%CF%84%CE%B9%CE%BA%CE%AD%CF%82-%CF%80%CF%81%CE%BF%CF%83%CE%B4/
,aktiencheck.de,EQS - DD : HelloFresh SE ( deutsch ) () | aktiencheck . de,https://www.aktiencheck.de/analysen/Artikel-EQS_DD_HelloFresh_SE_deutsch-19795359
,haberradikal.com,"Avrupa Termoplastik Poliüretan Pazarı En Son Sektör Boyutu , Büyümesi , Payı , Talebi , Trendleri , Rekabet Ortamı ve 2034  ye Kadar Tahminler – Haber Radikal",http://www.haberradikal.com/2026/05/26/avrupa-termoplastik-poliuretan-pazari-en-son-sektor-boyutu-buyumesi-payi-talebi-trendleri-rekabet-ortami-ve-2034ye-kadar-tahminler/
,tribuna.ro,"ACS Champions încheie sezonul pe locul al patrulea la primul turneul final al Campionatului Naţional U17 . Echipa a doua , pe podium",https://www.tribuna.ro/acs-champions-incheie-sezonul-pe-locul-al-patrulea-la-primul-turneul-final-al-campionatului-national-u17-echipa-a-doua-pe-podium/
,tecmundo.com.br,Não é gratuita : diretor da Uber diz que gastos com IA estão ficando difíceis de justificar,https://www.tecmundo.com.br/mercado/413408-nao-e-gratuita-diretor-da-uber-diz-que-gastos-com-ia-estao-ficando-dificeis-de-justificar.htm
,hkcd.com,深圳 「 十五五 」 規劃綱要正式發布 1800字詳述全面深化與港澳緊密務實合作,https://www.hkcd.com/hkcdweb/content/2026/05/26/content_8756833.html
,haberradikal.com,"Montan Mumu Pazarı En Son Sektör Boyutu , Büyümesi , Payı , Talebi , Trendleri , Rekabet Ortamı ve 2034  ye Kadar Tahminler – Haber Radikal",http://www.haberradikal.com/2026/05/26/montan-mumu-pazari-en-son-sektor-boyutu-buyumesi-payi-talebi-trendleri-rekabet-ortami-ve-2034ye-kadar-tahminler/
,haberler.com,"Ferrari ilk elektrikli aracını tanıttı , hisse senetleri değer kaybetti",https://www.haberler.com/teknoloji/ferrari-nin-ilk-elektrikli-araci-luce-ye-tepki-yagmuru-19885832-haberi/
,advanced-television.com,Spain awards new DTT channel to Siete consortium,https://www.advanced-television.com/2026/05/26/spain-awards-new-dtt-channel-to-siete-consortium/
,businessday.co.za,Ferrari shares slide as investors question new electric Luce,https://www.businessday.co.za/motoring/2026-05-26-ferrari-shares-slide-as-investors-question-new-electric-luce/
,antaranews.com,Kemenkum tuntaskan Laporan Keuangan 2025 sesuai tenggat waktu,https://www.antaranews.com/berita/5584037/kemenkum-tuntaskan-laporan-keuangan-2025-sesuai-tenggat-waktu
,indianewengland.com,Texas AG Sues Chinese - Owned Firm Over Alleged H - 1B Visa Scam,https://indianewengland.com/texas-ag-sues-chinese-owned-firm-over-alleged-h-1b-visa-scam/
,manilatimes.net,"618  shopping festival goes all - in on AI , generating fresh consumption growth",https://www.manilatimes.net/2026/05/27/business/foreign-business/618-shopping-festival-goes-all-in-on-ai-generating-fresh-consumption-growth/2351549
,palpalindia.com,"क्रीज - फ्री डिस्प्ले के साथ एप्पल ला सकता है फोल्डेबल iPhone Ultra , कीमत 2 लाख रुपये से ऊपर होने की चर्चा",https://www.palpalindia.com/2026/05/26/mobile-Apple-foldable-iPhone-Ultra-crease-free-display-iPhone-18-series-new-foldable-smartphone-launch-price.html
,sonoticias.com.br,Pedido de vista adia votao da PEC do fim da escala 6X1,https://www.sonoticias.com.br/politica/pedido-de-vista-adia-votacao-da-pec-do-fim-da-escala-6x1/
,romfordrecorder.co.uk,North Street Romford flooding  traumatic  for shops,https://www.romfordrecorder.co.uk/news/26138152.north-street-romford-flooding-traumatic-shops/
,bankingnews.gr,"Σκληραίνει τη στάση της η ΕΚΤ : Θα κάνουμε ό , τι χρειαστεί για την επιστροφή του πληθωρισμού στο 2 %, διαμηνύει Γάλλος τραπεζίτης",https://www.bankingnews.gr/diethni/articles/877666/sklirainei-ti-stasi-tis-i-ekt-tha-kanoume-o-ti-xreiastei-gia-tin-epistrofi-tou-plithorismoy-sto-2-diaminyei-gallos-trapezitis%20title=
,delo.ua,Як ESG трансформує бізнес і чому це важливо для України Delo . ua,https://delo.ua/business/yak-esg-transformuje-biznes-i-comu-ce-vazlivo-dlya-ukrayini-466267/
,bruneinews.net,TVS Motor Company Ranked No . 1 Globally for Shareholder Value Creation in  Durable Consumer Good by WirtschaftsWoche And Boston Consulting Group,http://www.bruneinews.net/news/279077784/tvs-motor-company-ranked-no-1-globally-for-shareholder-value-creation-in-durable-consumer-goods-by-wirtschaftswoche-and-boston-consulting-group
,rmc.bfmtv.com,Fièrement américain  mais conçu en Asie : le lancement très controversé du  Trump Phone,https://rmc.bfmtv.com/actualites/tech/fierement-americain-mais-concu-en-asie-le-lancement-tres-controverse-du-trump-phone_AV-202605260629.html
,portafolio.co,"Aeropuertos de Colombia movilizaron 19 , 6 millones de pasajeros en los primeros cuatro meses de 2026",https://www.portafolio.co/economia/regiones/aeropuertos-de-colombia-movilizaron-19-6-millones-de-pasajeros-en-los-primeros-cuatro-meses-de-494770
,bworldonline.com,Office market shows early - year resilience Colliers - BusinessWorld Online,https://www.bworldonline.com/property/2026/05/26/751888/office-market-shows-early-year-resilience-colliers/
,islands.com,The Country With The World Shortest Coastline Is An Enchanting Mediterranean Escape With Jaw - Dropping Beaches,https://www.islands.com/2180476/monaco-country-shortest-coastlines-scenic-beaches-mediterranean-escape/
,nrc.nl,"AI bedreigt nu ook het financiële stelsel , waarschuwen Planbureau en toezichthouders",https://www.nrc.nl/nieuws/2026/05/26/de-risicos-van-ai-bedreigen-ook-het-financiele-stelsel-waarschuwen-planbureau-en-toezichthouders-a4928644
,artemis.bm,"RenRe saw stronger reinsurance demand ahead of mid - year renewals , CUO Marra",https://www.artemis.bm/news/renre-saw-stronger-reinsurance-demand-ahead-of-mid-year-renewals-cuo-marra/
,timescall.com,Millions cant cover an emergency expense . Here how to handle one – Longmont Times - Call,https://www.timescall.com/2026/05/26/how-to-cover-emergency-expense/
,b92.net,"Svi komentari - Letnji kampovi u Novom Pazaru : Više od 400 dece upoznava Srbiju , jezik i tradiciju",https://www.b92.net/svi-komentari/236597
,manilatimes.net,Alibaba International PicCopilot Partners with Google Ads to Boost E - Commerce ROI,https://www.manilatimes.net/2026/05/27/tmt-newswire/pr-newswire/alibaba-international-s-piccopilot-partners-with-google-ads-to-boost-e-commerce-roi/2352013
,gr.euronews.com,"Το πετρέλαιο στα 100 δολάρια , αγορές σε αστάθεια καθώς παγώνουν συνομιλίες ΗΠΑ – Ιράν",https://gr.euronews.com/2026/05/26/oil-steadies-at-100-and-markets-remain-volatile-as-us-iran-talks-stall
,bruneinews.net,"Panipat MSMEs Cut Emissions , Unlock Savings in FMC - Led Decarbonisation Initiative",http://www.bruneinews.net/news/279077191/panipat-msmes-cut-emissions-unlock-savings-in-fmc-led-decarbonisation-initiative
,toutelatele.ouest-france.fr,Chicago Fire  : changement acté pour la série,https://toutelatele.ouest-france.fr/chicago-fire-changement-acte-pour-la-serie-186737
,merkur.de,Betrugsgefahr bei Panini - Stickern : Worauf WM - Fans bei den Klebebildern achten müssen,https://www.merkur.de/verbraucher/betrugsgefahr-bei-panini-stickern-worauf-wm-fans-bei-den-klebebildern-achten-muessen-zr-94323256.html
,merkur.de,Taiwan überholt Indien : Wie ein Chipfabrikant das kleine Land zur Börsenmacht macht,https://www.merkur.de/wirtschaft/taiwan-ueberholt-indien-wie-ein-chipfabrikant-das-kleine-land-zur-boersenmacht-macht-zr-94323226.html
,theboltonnews.co.uk,"Pensioners , renters and low - income families to get free home upgrades",https://www.theboltonnews.co.uk/news/26140548.pensioners-renters-low-income-families-get-free-home-upgrades/
,virginislandsnewsonline.com,Same - sex marriage to be discussed during constitutional negotiations - VI Premier,https://www.virginislandsnewsonline.com/en/news/same-sex-marriage-to-be-discussed-during-constitutional-negotiations-vi-premier
,meinbezirk.at,Betrüger im Bezirk Horn : Falscher UNO - Arzt täuscht Pensionistin und kassiert 9 . 000 Euro,https://www.meinbezirk.at/horn/c-lokales/falscher-uno-arzt-taeuscht-pensionistin-und-kassiert-9000-euro_a8659487
,floridatrend.com,Florida Trend Health Care,https://www.floridatrend.com/healthcare/2026/05/26/florida-trend-health-care/
,bruneinews.net,TREESCAPES 2026 by CIFOR - ICRAF and ICAR Marks the First South Asian Congress Focused Exclusively on Agroforestry and Trees Outside Forests,http://www.bruneinews.net/news/279076615/treescapes-2026-by-cifor-icraf-and-icar-marks-the-first-south-asian-congress-focused-exclusively-on-agroforestry-and-trees-outside-forests
,zazoom.it,Salute 26 esperti alla UE | Serve distinzione tra sigarette e smoke - free,https://www.zazoom.it/2026-05-26/salute-26-esperti-alla-ue-serve-distinzione-tra-sigarette-e-smoke-free/19255624/
,navabharat.com,रुपया 44 पैसे टूटा,https://navabharat.com/?p=478304
,jp.ibtimes.com,Asuene expands ASUENE for SSBJ disclosure work,https://jp.ibtimes.com/asuene-expands-asuene-ssbj-disclosure-work-101172
,finance.yahoo.com,Gold forecast and tracker : Here where prices could land in 2026,https://finance.yahoo.com/personal-finance/investing/article/gold-forecast-and-tracker-heres-where-prices-could-land-in-2026-130000950.html
,haber61.net,Trabzonspor U19 Takımı şampiyonluk kupasını kaldırdı,https://www.haber61.net/trabzonspor/trabzonspor-u19-takimi-sampiyonluk-kupasini-kaldirdi-h633532.html
,bruneinews.net,RBI Holds Repo Rate at 5 . 25 Percent : Realty Sector Sees Stability Anchoring Demand,http://www.bruneinews.net/news/279077360/rbi-holds-repo-rate-at-525-percent-realty-sector-sees-stability-anchoring-demand
,hoydiariodelmagdalena.com.co,Avanza la reproducción en cautiverio de la Lisa,https://hoydiariodelmagdalena.com.co/1292812/avanza-la-reproduccion-en-cautiverio-de-la-lisa/
,timescall.com,"Democrats feud over stock trading , sharpen Trump anti - corruption case",https://www.timescall.com/2026/05/26/democrats-stock-trading-trump-anti-corruption-case/
,finance.yahoo.com,Trump Iran Signals Send Oil Markets Into Chaos,https://finance.yahoo.com/sectors/energy/articles/trump-iran-signals-send-oil-152300070.html
,europapress.es,Reordenación de las terrazas en la Plaza Mayor de Valladolid : Se prohíben las mamparas y ocupar los soportales,https://www.europapress.es/castilla-y-leon/noticia-reordenacion-terrazas-plaza-mayor-valladolid-prohiben-mamparas-ocupar-soportales-20260526140110.html
,farmer.pl,Rząd uderza w magazyny energii . Miliony Polaków mogą o nich zapomnieć,"https://www.farmer.pl/energia/oze/rzad-uderza-w-magazyny-energii-miliony-polakow-moga-o-nich-zapomniec,177906.html"
,biz.cnews.ru,« MTC Web Services » и BIMIT запускают стратегическое партнерство для цифровизации бизнеса,https://biz.cnews.ru/news/line/2026-05-26_mtc_web_services_i_bimit_zapuskayut
,gazetaexpress.com,"Internet partially restored in Iran , watchdog says",https://www.gazetaexpress.com/en/Internet-partially-restored-in-Iran--watchdog-says/
,readme.readmedia.com,2026 Iowa State Fair Farmers Market and Kids Makers Market Applications Open,http://readme.readmedia.com/2026-Iowa-State-Fair-Farmers-Market-and-Kids-Makers-Market-Applications-Open/21467459
,bruneinews.net,China poverty alleviation model offers pathway to economic development : expert,http://www.bruneinews.net/news/279076380/china-poverty-alleviation-model-offers-pathway-to-economic-development-expert
,prabhasakshi.com,india will never forget what happened in front of modi the big game begins - Prabhasakshi latest news in hindi,https://www.prabhasakshi.com/national/india-will-never-forget-what-happened-in-front-of-modi-the-big-game-begins
,esdiario.com,Paco Nez aprieta a Page : la llave para acabar con Sánchez la tiene el presidente de Castilla - La Mancha,https://www.esdiario.com/castilla-la-mancha/260526/188807/paco-nunez-aprieta-a-page-la-llave-para-acabar-con-sanchez-la-tiene-el-presidente-de-castilla-la-mancha.html
,stockbiz.vn,"Chuyên gia :  Hỗ trợ chuyển đổi vàng để mua nhà , chủ đầu tư mới là bên chịu rủi ro , người mua luôn an toàn , có lợi",https://stockbiz.vn/tin-tuc/chuyen-gia-ho-tro-chuyen-doi-vang-de-mua-nha-chu-dau-tu-moi-la-ben-chiu-rui-ro-nguoi-mua-luon-an-toan-co-loi/40159643
,gonews.it,La Toscana porta le sue eccellenze agroalimentari a Varsavia,https://www.gonews.it/2026/05/26/la-toscana-porta-le-sue-eccellenze-agroalimentari-a-varsavia/
,delo.ua,ЗСУ отримали майже пів мільйона безпілотників та техніки через DOT - Chain Defence,https://delo.ua/news/zbroya-v-odin-klik-viiskovi-otrimali-maize-piv-miliona-bpla-ta-texniki-cerez-marketpleis-zbroyi-466338/
