title,title_en,source,url,published_at,language,section
Aurobindo arm CuraTeQ gets Brazil regulator ANVISA nod for Hyderabad biosimilars facility | Hyderabad News,Aurobindo arm CuraTeQ gets Brazil regulator ANVISA nod for Hyderabad biosimilars facility | Hyderabad News,timesofindia.indiatimes.com,https://timesofindia.indiatimes.com/city/hyderabad/aurobindo-arm-curateq-gets-brazil-regulator-anvisa-nod-for-hyderabad-biosimilars-facility/articleshow/132538984.cms,,English,Other
"John Deere Explains Compact Wheel Loader Features , Technology , and Buying Tips","John Deere Explains Compact Wheel Loader Features , Technology , and Buying Tips",constructionequipment.com,https://www.constructionequipment.com/earthmoving/wheel-loaders/article/55391806/john-deere-explains-compact-wheel-loader-features-technology-and-buying-tips,,English,Other
Zindigi and nsave Partner to Bring a Revolutionary Remittance Experience for Pakistan Freelancers,Zindigi and nsave Partner to Bring a Revolutionary Remittance Experience for Pakistan Freelancers,propakistani.pk,https://propakistani.pk/2026/07/21/zindigi-and-nsave-partner-to-bring-a-revolutionary-remittance-experience-for-pakistans-freelancers/,,English,Other
Паливна криза у Росії - в уряді країни зробили заяву,Fuel crisis in Russia - the country's government made a statement,24tv.ua,https://24tv.ua/economy/palivna-kriza-rosiyi-uryadi-krayini-zrobili-zayavu_n3109574,,Ukrainian,Other
The Nashville Ledger,The Nashville Ledger,tnledger.com,http://www.tnledger.com/editorial/Article.aspx?id=205719,,English,Other
TISA週年開戶數達19 . 7萬戶 金管會持續爭取租稅優惠 - 財經,"TISA anniversary account openings reach 197,000, FSC continues to strive for tax incentives - Finance",news.cts.com.tw,https://news.cts.com.tw/cna/money/202607/202607213058174.html,,Chinese,Other
"Maqedonia dhe India kanë shumë për ti ofruar njëra - tjetrës si vende , thanë Siljanovska - Davkova dhe Murmu – Portalb","Macedonia and India have much to offer each other as countries, said Siljanovska-Davkova and Murmu - Portalb",portalb.mk,https://portalb.mk/maqedonia-dhe-india-kane-shume-per-ti-ofruar-njera-tjetres-si-vende-thane-siljanovska-davkova-dhe-murmu/,,Albanian,Other
Holding ( s ) in Company | Company Announcement,Holding ( s ) in Company | Company Announcement,investegate.co.uk,https://www.investegate.co.uk/announcement/rns/bytes-technology-group--byit/holding-s-in-company/9680345,,English,Other
Le modèle open source Kimi perturbe Wall Street et enflamme la sphère technologique,The open source model Kimi disrupts Wall Street and ignites the tech sphere,fredzone.org,https://www.fredzone.org/le-modele-open-source-kimi-perturbe-wall-street-et-enflamme-la-sphere-technologique/,,French,AI & Technology
Dramma shock durante lescursione : cade per 200 metri e muore,Shock drama during excursion: falls 200 meters and dies,trentotoday.it,https://www.trentotoday.it/cronaca/turista-tedesca-morta-val-passiria-21-luglio.html,,Italian,Other
Los bancos de la eurozona endurecen sus condiciones para conceder hipotecas y créditos a empresas,Eurozone banks tighten conditions for granting mortgages and loans to businesses,larazon.es,https://www.larazon.es/economia/bancos-eurozona-endurecen-sus-condiciones-conceder-hipotecas-creditos-empresas_202607216a5f7c0a303ca6202cc38387.html,,Spanish,Other
精选 | 夜盘盘前要闻汇总 7月21日 周二 _ 东方财富网,Featured | Night session pre-market news summary July 21 Tuesday _ East Money,finance.eastmoney.com,https://finance.eastmoney.com/a/202607213815803287.html,,Chinese,Other
Adapei : une centaine de personnes handicapées vont senvoler en parapente,Adapei: about a hundred disabled people will go paragliding,ladepeche.fr,https://www.ladepeche.fr/2026/07/21/adapei-une-centaine-de-personnes-handicapees-vont-senvoler-en-parapente-13477693.php,,French,Other
Dutch solar producer DSG deploys Powernaut across 350 MW portfolio as grid congestion drives smarter renewable operations,Dutch solar producer DSG deploys Powernaut across 350 MW portfolio as grid congestion drives smarter renewable operations,renewableenergymagazine.com,https://www.renewableenergymagazine.com/pv_solar/dutch-solar-producer-dsg-deploys-powernaut-across-20260721,,English,Energy
سوريا تستقبل 3 . 5 ملايين زائر خلال 6 أشهر .. من أين قدموا ؟,Syria receives 3.5 million visitors in 6 months.. Where did they come from?,aljazeera.net,https://www.aljazeera.net/news/2026/7/21/%D8%B3%D9%88%D8%B1%D9%8A%D8%A7-%D8%AA%D8%B3%D8%AA%D9%82%D8%A8%D9%84-3-5-%D9%85%D9%84%D8%A7%D9%8A%D9%8A%D9%86-%D8%B2%D8%A7%D8%A6%D8%B1-%D8%AE%D9%84%D8%A7%D9%84-6-%D8%A3%D8%B4%D9%87%D8%B1-%D9%85%D9%86,,Arabic,Other
Războiul total pe taxe continuă la Washington . Trump fentează justiția și pregătește noi tarife pentru 60 de țări,Total tax war continues in Washington. Trump feints justice and prepares new tariffs for 60 countries,ziare.com,https://ziare.com/taxe-trump/razboiul-total-taxe-continua-washington-2025482,,Romanian,Geopolitics
"Amid nurse shortage , a university rolls out the welcome mat for men","Amid nurse shortage , a university rolls out the welcome mat for men",ypradio.org,https://www.ypradio.org/npr-news/2026-07-21/amid-nurse-shortage-a-university-rolls-out-the-welcome-mat-for-men,,English,Other
Mediaset anuncia el fichaje de Josep Pedrerol y  El chiringuito,Mediaset announces the signing of Josep Pedrerol and El chiringuito,eldiadecordoba.es,https://www.eldiadecordoba.es/television/mediaset-anuncia-fichaje-josep-pedrerol_0_2007547102.html,,Spanish,Other
"Gender pensions gap in the LGPS start earlier , engage better","Gender pensions gap in the LGPS start earlier , engage better",actuarialpost.co.uk,https://www.actuarialpost.co.uk/article/gender-pensions-gap-in-the-lgps-start-earlier---engage-better-26946.htm,,English,Other
Acusa Canadá violación al T - MEC con nuevos aranceles de Trump,Canada accuses violation of T-MEC with Trump's new tariffs,globalmedia.mx,https://www.globalmedia.mx/articles/acusa_canada_violacion_al_t_mec_con_nuevos_aranceles_de_trump,,Spanish,Other
Motor Listrik Nasional Berpeluang Hidupkan Industri Dalam Negeri,National Electric Motorcycle Has Opportunity to Revive Domestic Industry,ekbis.harianjogja.com,https://ekbis.harianjogja.com/r-1264358/motor-listrik-nasional-berpeluang-hidupkan-industri-dalam-negeri,,Indonesian,Other
Revolut to challenge Australia Big Four banks – The Irish Times,Revolut to challenge Australia Big Four banks – The Irish Times,irishtimes.com,https://www.irishtimes.com/business/2026/07/21/revolut-to-challenge-australias-big-four-banks/,,English,Other
Carro para aplicativo : o que calcular antes de financiar pensando em renda,Car for ride-hailing: what to calculate before financing with income in mind,clickgratis.com.br,https://www.clickgratis.com.br/carros/carro-para-aplicativo-calcular-antes-de-financiar/,,Portuguese,Other
Končanje drugega tira znižalo prihodke cementarne Alpacem,Completion of the second track reduced revenues of cement plant Alpacem,delo.si,https://www.delo.si/gospodarstvo/novice/koncanje-drugega-tira-znizalo-prihodke-cementarne-alpacem,,Slovenian,Other
"Catat 5 . 000 Transaksi QRIS Selama Festival Kuliner Banua 2026 , Ini Bagi UMKM","Record 5,000 QRIS Transactions During Banua Culinary Festival 2026, Here's for MSMEs",banjarmasin.tribunnews.com,https://banjarmasin.tribunnews.com/bisnis/1369280/catat-5000-transaksi-qris-selama-festival-kuliner-banua-2026-ini-bagi-umkm,,Indonesian,Other
"AI stocks gather more strength , even as Brent oil price tops $90","AI stocks gather more strength , even as Brent oil price tops $90",mymotherlode.com,https://mymotherlode.com/news/national/11004773/wall-street-points-toward-gains-as-ai-focused-companies-recover-some-of-last-weeks-losses.html,,English,AI & Technology
Central de Vacaciones reclama un reparto « equilibrado » de responsabilidades en la Ley de Viajes Combinados,Central de Vacaciones demands a 'balanced' distribution of responsibilities in the Package Travel Law,cronicadecantabria.com,https://cronicadecantabria.com/cr/central-de-vacaciones-reclama-un-reparto-equilibrado-de-responsabilidades-en-la-ley-de-viajes-combinados/,,Spanish,Other
Großbritannien : Die Haushaltslage bremst Andy Burnhams Neustart aus,Great Britain: The budget situation slows down Andy Burnham's restart,handelsblatt.com,https://www.handelsblatt.com/politik/international/grossbritannien-die-haushaltslage-bremst-andy-burnhams-neustart-aus/100241545.html,,German,Macro & Policy
Scumpire la pompă din august : ANRE include în prețul carburanților și costul stocurilor de urgență,Price hike at the pump from August: ANRE includes in fuel prices the cost of emergency stocks,news.yam.md,https://news.yam.md/ro/story/45919306,,Romanian,Other
明石歩道橋事故から25年 慰霊碑 「 想の像 」 の前で犠牲者に祈り 遺族や市民ら 、 再発防止を誓う,"25 years since the Akashi pedestrian bridge accident, praying for victims in front of the memorial 'Sou no Zou', bereaved families and citizens vow to prevent recurrence",kobe-np.co.jp,https://www.kobe-np.co.jp/news/society/202607/0020617796.shtml,,Japanese,Other
خروقات بمليارات الدنانير واستثناءات بلا جدوى .. تفاصيل تقرير ديوان الرقابة المالية 2025 – كتابات,Violations worth billions of dinars and useless exceptions.. Details of the 2025 Financial Audit Bureau report - Kitabat,kitabat.com,https://kitabat.com/news/%D8%AE%D8%B1%D9%88%D9%82%D8%A7%D8%AA-%D8%A8%D9%85%D9%84%D9%8A%D8%A7%D8%B1%D8%A7%D8%AA-%D8%A7%D9%84%D8%AF%D9%86%D8%A7%D9%86%D9%8A%D8%B1-%D9%88%D8%A7%D8%B3%D8%AA%D8%AB%D9%86%D8%A7%D8%A1%D8%A7%D8%AA/,,Arabic,Other
Miami women who met international lovers during the World Cup,Miami women who met international lovers during the World Cup,miaminewtimes.com,https://www.miaminewtimes.com/arts-culture/miami-women-who-met-international-lovers-during-the-world-cup-40567733/,,English,Other
Mahesh Babu : వారణాసి తర్వాత మహేష్ ఎవరితో ..?,"Mahesh Babu: After Varanasi, with whom will Mahesh..?",vaartha.com,https://vaartha.com/entertainment/after-varanasi-who-is-mahesh-choice/746446/,,Telugu,Other
Fabrizia Capriati nominata General Manager di Hdemy Group,Fabrizia Capriati appointed General Manager of Hdemy Group,engage.it,https://www.engage.it/brand-e-aziende/fabrizia-capriati-nominata-general-manager-di-hdemy-group.aspx,,Italian,Other
"Ondas Holdings Aktie : DZYNE - Deal für 875 , 8 Millionen ()",Ondas Holdings Stock: DZYNE - Deal for 875.8 million (),aktiencheck.de,https://www.aktiencheck.de/news/Artikel-Ondas_Holdings_Aktie_DZYNE_Deal_fuer_875_8_Millionen-19949187,,German,Other
"Anggaran Rehab - Rekon Mulai Didistribusikan , Kasatgas Tito Pastikan Percepatan Pascabencana Sumatera","Rehab-Recon Budget Begins to be Distributed, Task Force Head Tito Ensures Acceleration of Post-Disaster Sumatra",jawapos.com,https://www.jawapos.com/nasional/2607210405/anggaran-rehab-rekon-mulai-didistribusikan-kasatgas-tito-pastikan-percepatan-pascabencana-sumatera,,Indonesian,Macro & Policy
"DCENT Launches DCENT S , a Card - Format Hardware Wallet with a Dedicated Backup Card","DCENT Launches DCENT S , a Card - Format Hardware Wallet with a Dedicated Backup Card",manilatimes.net,https://www.manilatimes.net/2026/07/21/tmt-newswire/globenewswire/dcent-launches-dcent-s-a-card-format-hardware-wallet-with-a-dedicated-backup-card/2388660,,English,Other
Así puedes llevarte una vivienda de obra nueva valorada en 180 . 000 euros por solo 10 euros,"This is how you can get a new-build home valued at 180,000 euros for only 10 euros",larazon.es,https://www.larazon.es/sociedad/asi-puedes-llevarte-vivienda-obra-nueva-valorada-180000-euros-solo-10-euros_202607216a5f8300e3eb0b64aa4bb796.html,,Spanish,Other
Un anno dopo il caso dei messaggi | Raoul Bova torna a parlare,One year after the messages case | Raoul Bova speaks again,zazoom.it,https://www.zazoom.it/2026-07-21/un-anno-dopo-il-caso-dei-messaggi-raoul-bova-torna-a-parlare/19486112/,,Italian,Other
国家队  600亿增持中国股票 ！ 涌入这三大方向→,National team 60 billion increases holdings of Chinese stocks! Flooding into these three directions →,baijiahao.baidu.com,https://baijiahao.baidu.com/s?id=1871329652115272886,,Chinese,Other
"BREAKING . Acţiunile OMV Petrom şi Romgaz cresc puternic şi saltă toată Bursa la maxime istorice la o zi după ce platforma Neptun Deep , centrul proiectului fanion al energiei , a fost fixată în Marea Neagră . „ Tot ce se tranzacţionează pe cele două...","BREAKING. OMV Petrom and Romgaz shares rise strongly and lift the entire Stock Exchange to historic highs one day after the Neptun Deep platform, the center of the flagship energy project, was fixed in the Black Sea. 'Everything that is traded on the two...'",zfcorporate.ro,https://www.zfcorporate.ro/zf-ro/burse-fonduri-mutuale/breaking-actiunile-omv-petrom-romgaz-cresc-puternic-salta-toata-23199633,,Romanian,Other
האייפון היקר אי פעם ? כל מה שידוע על האייפון 18 פרו,The most expensive iPhone ever? Everything known about the iPhone 18 Pro,ynet.co.il,https://www.ynet.co.il/digital/technews/article/rj8lu034gg,,Hebrew,Other
How can strippers and sex workers secure housing in Miami ?,How can strippers and sex workers secure housing in Miami ?,miaminewtimes.com,https://www.miaminewtimes.com/arts-culture/how-do-sex-workers-get-apartments-in-miami-40567682/,,English,Other
2026 高端纯单洗滚筒洗衣机横评榜单 ： 护色净洗全能标杆 - 热点资讯 - ITBear科技资讯,2026 High-end pure single-wash drum washing machine comparison list: Color protection and clean washing all-around benchmark - Hot News - ITBear Tech News,itbear.com.cn,https://www.itbear.com.cn/html/2026-07/1457133.html,,Chinese,Other
"Khairiah Hanya Berharap Harga Telur Stabil , Begini Kondisi Harganya","Khairiah Only Hopes Egg Prices Stable, Here's the Price Condition",banjarmasin.tribunnews.com,https://banjarmasin.tribunnews.com/bisnis/1369285/khairiah-hanya-berharap-harga-telur-stabil-begini-kondisi-harganya,,Indonesian,Other
"Resmob Polres Banjar Ringkus Pencuri Baterai BTS , Pelaku Beraksi Pakai Mobil","Banjar Police Resmob Arrests BTS Battery Thief, Perpetrator Acted Using Car",banjarmasin.tribunnews.com,https://banjarmasin.tribunnews.com/kalsel/1369287/resmob-polres-banjar-ringkus-pencuri-baterai-bts-pelaku-beraksi-pakai-mobil,,Indonesian,Other
Paramount / Warner Bros .   : un juge américain bloque la mégafusion à 111 milliards,Paramount / Warner Bros.: a US judge blocks the mega-merger at 111 billion,lesnumeriques.com,https://www.lesnumeriques.com/cine-svod/paramount-warner-bros-un-juge-americain-bloque-la-megafusion-a-111-milliards-n259522.html,,French,Other
Emerging Growth Research Releases Flash Report on First Phosphate ; Reiterates Buy Rating and C$4 . 94 Price Target Following Recent Share Price Weakness,Emerging Growth Research Releases Flash Report on First Phosphate ; Reiterates Buy Rating and C$4 . 94 Price Target Following Recent Share Price Weakness,hawaiitelegraph.com,http://www.hawaiitelegraph.com/news/279201163/emerging-growth-research-releases-flash-report-on-first-phosphate-reiterates-buy-rating-and-c494-price-target-following-recent-share-price-weakness,,English,Other
Director / PDMR Shareholding | Company Announcement,Director / PDMR Shareholding | Company Announcement,investegate.co.uk,https://www.investegate.co.uk/announcement/rns/cmc-markets--cmcx/director-pdmr-shareholding/9680441,,English,Other
"Microsoft , Mistral Expand AI Partnership With New Europe Compute Deal","Microsoft , Mistral Expand AI Partnership With New Europe Compute Deal",finanznachrichten.de,https://www.finanznachrichten.de/nachrichten-2026-07/69084203-microsoft-mistral-expand-ai-partnership-with-new-europe-compute-deal-020.htm,,English,AI & Technology
"BI dan Dekranasda Upskilling Fashion Pengrajin , Dorong Tenun & Bordir Bireuen Tembus Pasar Global","BI and Dekranasda Upskilling Fashion Craftsmen, Encouraging Bireuen Weaving & Embroidery to Penetrate Global Market",aceh.tribunnews.com,https://aceh.tribunnews.com/nanggroe/1035121/bi-dan-dekranasda-upskilling-fashion-pengrajin-dorong-tenun-bordir-bireuen-tembus-pasar-global,,Indonesian,Other
UK government scraps plans for digital ID cards after millions of Brits opposed,UK government scraps plans for digital ID cards after millions of Brits opposed,techcrunch.com,https://techcrunch.com/2026/07/21/uk-government-scraps-plans-for-digital-id-cards-after-millions-of-brits-opposed/,,English,Other
"Em evento de 50 anos no Brasil , Fiat reafirma identidade nacional e se diz aberta a parcerias","At 50-year event in Brazil, Fiat reaffirms national identity and says it is open to partnerships",correio.rac.com.br,https://correio.rac.com.br/agenciaestado/em-evento-de-50-anos-no-brasil-fiat-reafirma-identidade-nacional-e-se-diz-aberta-a-parcerias-1.1831424,,Portuguese,Other
"Criză majoră a combustibililor în Rusia : Producția de carburanți s - a prăbușit , Ucraina a scos din uz o treime din capacitatea de rafinare","Major fuel crisis in Russia: Fuel production has collapsed, Ukraine has knocked out a third of refining capacity",cursdeguvernare.ro,https://cursdeguvernare.ro/criza-combustibili-rusia-atacuri-drone-ucraina-rafinarii-rusia-exporturi-titei.html,,Romanian,Geopolitics
Take - Two Aktie : Zelnick jagt Übernahmen mit 1 Milliarde Cashflow,Take-Two Stock: Zelnick chases acquisitions with 1 billion cash flow,boerse-express.com,https://www.boerse-express.com/news/articles/take-two-aktie-zelnick-jagt-uebernahmen-mit-1-milliarde-cashflow-930598,,German,Other
Denizli Haber | Ak Partiden berberlere ziyaret,Denizli News | Visit from AK Party to barbers,denizlihaber.com,https://www.denizlihaber.com/politika/ak-partiden-berberlere-ziyaret/,,Turkish,Other
Yeniden Refahtan Özgür Özelin yeni partisine ilk yorum,First comment from Yeniden Refah on Özgür Özel's new party,yeniakit.com.tr,https://www.yeniakit.com.tr/haber/yeniden-refahtan-ozgur-ozelin-yeni-partisine-ilk-yorum-2013601.html,,Turkish,Other
Penyaluran KUR di Jatim tertinggi nasional capai Rp27 triliun,KUR Distribution in East Java highest nationally reaches Rp27 trillion,antaranews.com,https://www.antaranews.com/berita/5659513/penyaluran-kur-di-jatim-tertinggi-nasional-capai-rp27-triliun,,Indonesian,Other
中國虐狗狂魔接連施暴 ！ 火燒流浪狗 、 吉娃娃與幼犬慘遭剝皮不治 | 兩岸 ( 大陸 ) | 三立新聞網 SETN . COM,"China dog abuser repeatedly commits violence! Burning stray dogs, Chihuahua and puppy skinned and died | Cross-Strait (Mainland) | SETN News",setn.com,https://www.setn.com/news/1876259,,Chinese,Geopolitics
最高花1 . 2亿元回购股份 奥士康股价应声涨停,"Up to 120 million yuan to repurchase shares, Aoshikang stock price hits limit up",baijiahao.baidu.com,https://baijiahao.baidu.com/s?id=1871319491682129713,,Chinese,Other
Industria se desmarca del sector y da por suficientes los 400 millones de ayudas para comprar coches electrificados,Industry distances itself from the sector and considers the 400 million in aid for buying electrified cars sufficient,diariosur.es,https://www.diariosur.es/economia/industria-desmarca-sector-suficientes-400-millones-ayudas-20260721162702-ntrc.html,,Spanish,Other
UK leader Burnham gathers his Cabinet after sweeping away Starmer supporters,UK leader Burnham gathers his Cabinet after sweeping away Starmer supporters,mymotherlode.com,https://mymotherlode.com/news/world/11005137/uk-leader-burnham-gathers-his-cabinet-after-sweeping-away-starmer-supporters.html,,English,Other
"अल्फा ग्रेप का पहला मल्टी एसेट NFO लॉन्च , क्या निवेशकों के लिए बनेगा नया मौका ?","Alpha Grep's first multi-asset NFO launched, will it be a new opportunity for investors?",sharemanthan.in,https://www.sharemanthan.in/commodities/462-advice/79693-alphagrep-launches-its-first-multi-asset-nfo-will-it-create-a-new-opportunity-for-investors,,Hindi,Other
"Börsegeschichte 21 . 7 .: Semperit , Strabag , Lenzing ( Börse Geschichte ) ( BörseGeschichte )","Stock market history 21.7.: Semperit, Strabag, Lenzing (Stock Market History) (StockMarketHistory)",boerse-social.com,https://boerse-social.com/2026/07/21/borsegeschichte_217_semperit_strabag_lenzing_borse_geschichte_borsegeschichte_1,,German,Other
SKP TLYF TERA PORTFÖY BİRİNCİ SERBEST FON Borsa Dışı Repo / Ters Repo Sözleşmesi,SKP TLYF TERA PORTFÖY FIRST FREE FUND Over-the-Counter Repo / Reverse Repo Agreement,dunya.com,https://www.dunya.com/finans/borsa/kap-haberleri/6608317,,Turkish,Other
"UPSC Key - 21st July 2026 : Dengue Vaccine , Right to protest and EPF Scheme","UPSC Key - 21st July 2026 : Dengue Vaccine , Right to protest and EPF Scheme",indianexpress.com,https://indianexpress.com/article/upsc-current-affairs/upsc-key-dengue-vaccine-right-to-protest-and-epf-scheme-10797194/,,English,Other
Jó hír ! 2027 - ben újra olcsó ( bb ) lesz az SSD,Good news! In 2027 SSDs will be cheap(er) again,pcwplus.hu,https://www.pcwplus.hu/pcwlite/jo-hir-2027ben-ujra-olcsobb-lesz-az-ssd-385363.html,,Hungarian,Other
GM revoit ses prévisions 2026 à la hausse,GM revises its 2026 forecasts upwards,journalauto.com,https://journalauto.com/constructeurs/gm-revoit-ses-previsions-2026-a-la-hausse/,,French,Other
UK : Burnham places future of North Sea in the hands of London MP Miatta Fahnbulleh,UK : Burnham places future of North Sea in the hands of London MP Miatta Fahnbulleh,energy-pedia.com,https://www.energy-pedia.com/news/united-kingdom/burnham-places-future-of-north-sea-in-the-hands-of-london-mp-miatta-fahnbulleh-204677,,English,Other
EU fines AliExpress €550m over sale of illegal products in Europe,EU fines AliExpress €550m over sale of illegal products in Europe,thelocal.at,https://www.thelocal.at/20260720/eu-fines-aliexpress-e550m-over-sale-of-illegal-products-in-europe/,,English,Other
Why EUR / USD Keeps Clinging to $1 . 14 Support,Why EUR / USD Keeps Clinging to $1 . 14 Support,dailyforex.com,https://www.dailyforex.com/forex-technical-analysis/2026/07/eurusd-forex-analysis-21-july-2026/247866,,English,Other
"Al Etihad Payments , Mastercard announce first co - badged credit card","Al Etihad Payments , Mastercard announce first co - badged credit card",kenyastar.com,http://www.kenyastar.com/news/279201245/al-etihad-payments-mastercard-announce-first-co-badged-credit-card,,English,Other
AFP : Jean - Noël Barrot pledează la Reykjavik pentru negocierea aderării Islandei la UE,AFP: Jean-Noël Barrot pleads in Reykjavik for negotiating Iceland's EU accession,bursa.ro,https://www.bursa.ro/afp-jean-no%C3%ABl-barrot-pledeaza-la-reykjavik-pentru-negocierea-aderarii-islandei-la-ue-24346951,,Romanian,Other
Yunanistanda l sıcakları orman yangınlarını artırdı,Heatwaves in Greece increased forest fires,aa.com.tr,https://www.aa.com.tr/tr/dunya/yunanistanda-col-sicaklari-orman-yanginlarini-artirdi/4004809,,Turkish,Other
Trump imposes 50 % tariffs on Canadian goods,Trump imposes 50 % tariffs on Canadian goods,wvik.org,https://www.wvik.org/npr-top-stories/2026-07-21/trump-imposes-50-tariffs-on-canadian-goods,,English,Other
How India young  cockroach  movement has posed the biggest challenge to Modi in years – The Irish Times,How India young  cockroach  movement has posed the biggest challenge to Modi in years – The Irish Times,irishtimes.com,https://www.irishtimes.com/world/asia-pacific/2026/07/21/indias-young-cockroach-movement-is-the-biggest-challenge-to-modi-in-years-whats-going-on/,,English,Other
قفزة كبيرة في سوق السيارات بمصر .. المبيعات ترتفع 40 . 1 % خلال 5 أشهر,Big jump in Egypt's car market.. sales rise 40.1% in 5 months,shorouknews.com,https://www.shorouknews.com/news/view.aspx?cdate=21072026&id=df52326c-1c4b-4a98-bd01-816976f25ac0,,Arabic,Other
铜梁多部门联合开展消防安全集中夜查行动,Tongliang multiple departments jointly carry out fire safety concentrated night inspection action,cqnews.net,https://www.cqnews.net/web/content_1529239811532025856.html,,Chinese,Other
Tarifaço : setor de máquinas diz não apoiar reciprocidade e defende ampliao de programa de crédito para empresas afetadas,Tariff shock: machinery sector says it does not support reciprocity and defends expansion of credit program for affected companies,g1.globo.com,https://g1.globo.com/economia/noticia/2026/07/21/tarifaco-setor-de-maquinas-diz-nao-apoiar-reciprocidade-e-defende-ampliacao-de-programa-de-credito-para-empresas-afetadas.ghtml,,Portuguese,Macro & Policy
BMW et Mini font finalement limpasse sur le Mondial de lAuto 2026,BMW and Mini finally skip the 2026 Paris Motor Show,journalauto.com,https://journalauto.com/constructeurs/bmw-et-mini-font-finalement-limpasse-sur-le-mondial-de-lauto-2026/,,French,Other
Ocado Group announces new automated CFC | Company Announcement,Ocado Group announces new automated CFC | Company Announcement,investegate.co.uk,https://www.investegate.co.uk/announcement/rns/ocado-group--ocdo/ocado-group-announces-new-automated-cfc/9680405,,English,Other
CBN retains interest rate at 26 . 5 % amid inflation concerns – The Sun Nigeria,CBN retains interest rate at 26 . 5 % amid inflation concerns – The Sun Nigeria,thesun.ng,https://thesun.ng/cbn-retains-interest-rate-at-26-5-amid-inflation-concerns/,,English,Macro & Policy
