published_at,source,title,url
,latercera.com,El dólar anota su mayor caída diaria en un año tras la tregua en Medio Oriente y quiebra los $ 900,https://www.latercera.com/pulso/noticia/el-valor-del-dolar-el-8-de-abril-de-2026/
,leadersnet.at,Waffenruhe mit Nebenwirkungen - Wifo - Chef analysiert Iran - Krieg und warnt vor  Jojo - Effekten  » Leadersnet,"https://www.leadersnet.at/news/98962,wifo-chef-analysiert-iran-krieg-und-warnt-vor-jojo-effekten.html"
,elmundo.es,Que tu perfume no compita con tu plato o por qué es tan importante la elección de la fragancia a la hora de ir a un restaurante :  Hay que huir de cualquier aroma que sea comestible,https://www.elmundo.es/yodona/belleza/2026/04/08/69d3c2d3fdddffc5568b4584.html
,manilatimes.net,AMTD IDEA Group Announces Dividend Plan to Distribute Shares of Listed Subsidiaries,https://www.manilatimes.net/2026/04/08/tmt-newswire/pr-newswire/amtd-idea-group-announces-dividend-plan-to-distribute-shares-of-listed-subsidiaries/2316566
,digit.in,ವೇಗದ ಪ್ರೊಸೆಸರ್‌ ಇರುವ Vivo T4 Ultra ಮೊಬೈಲ್‌ ಬೆಲೆಯಲ್ಲಿ ಭರ್ಜರಿ ಇಳಿಕೆ !,https://www.digit.in/kn/news/mobile-phones/vivo-t4-ultra-now-cheaper-on-flipkart-price-and-specifications.html
,rttnews.com,Oil Prices Fall Sharply After Iran Agrees To Open Strait Of Hormuz,https://www.rttnews.com/3637534/oil-prices-fall-sharply-after-iran-agrees-to-open-strait-of-hormuz.aspx
,laprovence.com,La brocante de Villeneuve - lez - Avignon va accueillir des chineurs et collectionneurs venus de tout lhexagone,https://www.laprovence.com/article/sortie-loisirs/5605794464870414/la-brocante-de-villeneuve-lez-avignon-va-accueillir-des-chineurs-et-collectionneurs-venus-de-tout-l-hexagone
,clevelandjewishnews.com,"US , Israel and Iran agree to a 2 - week ceasefire though some attacks continue",https://www.clevelandjewishnews.com/news/world_news/us-israel-and-iran-agree-to-a-2-week-ceasefire-though-some-attacks-continue/article_a818166b-d363-5648-88a9-19af49fee771.html
,manilatimes.net,Sweed Appoints Brad Cross as Chief Revenue Officer to Accelerate Growth of Its Dispensary Operating System,https://www.manilatimes.net/2026/04/08/tmt-newswire/globenewswire/sweed-appoints-brad-cross-as-chief-revenue-officer-to-accelerate-growth-of-its-dispensary-operating-system/2316571
,mittelstandcafe.de,"Uranium Energy Corp nimmt die Produktion in Burke Hollow auf , der weltweit neuesten in Betrieb befindlichen ISR - Uranmine",https://www.mittelstandcafe.de/uranium-energy-corp-nimmt-die-produktion-in-burke-hollow-auf-der-weltweit-neuesten-in-betrieb-befindlichen-isr-uranmine-2242938.html
,theglobeandmail.com,"Thanks to AI , your resume is perfect . So is everyone else",https://www.theglobeandmail.com/investing/personal-finance/article-thanks-to-ai-your-resume-is-perfect-so-is-everyone-elses/
,fleetowner.com,Former PCS Software founders to launch ProBuilt TMS to modernize truckload operations,https://www.fleetowner.com:443/technology/news/55369288/former-pcs-software-founders-to-launch-probuilt-tms-to-modernize-truckload-operations
,times-series.co.uk,"US , Israel and Iran agree to two - week ceasefire though some attacks continue",https://www.times-series.co.uk/news/national/26003402.us-israel-iran-agree-two-week-ceasefire-though-attacks-continue/
,bestmediainfo.com,Crossbond names Ranveer Singh as brand ambassador,https://bestmediainfo.com/mediainfo/mediainfo-marketing/crossbond-names-ranveer-singh-as-brand-ambassador-11701675
,newspim.com,"[ 프로농구 ] 최종전에 결정된 순위 , 6강 PO 대진 결정 ... DB - KCC , SK - 소노",https://www.newspim.com/news/view/20260408001407
,udn.com,政府穩定物價初見效果 政院 ： 第1季CPI低於原本預估 | 財經焦點 | 產經,https://udn.com/news/story/7238/9430068
,bursa.ro,Hegseth :  SUA a obţinut o victorie decisivă împotriva Iranului,https://www.bursa.ro/hegseth-sua-a-obtinut-o-victorie-decisiva-impotriva-iranului-26458856
,mp.cnfol.com,许安丰 ： 4 . 8黄金多头崛起调整继续冲高 _ 中金在线财经号,http://mp.cnfol.com/55930/article/1775656171-142349880.html
,lanacion.cl,"Bencinas disparan inflación : IPC de marzo fue de 1 , 0 % con 1 , 4 % acumulado en el año",https://www.lanacion.cl/bencinas-disparan-inflacion-ipc-de-marzo-fue-de-10-con-14-acumulado-en-el-ano/
,interfax.com.ua,Логістика формує до 33 % собівартості хліба через зростання цін на пальне,https://interfax.com.ua/news/economic/1157757.html
,etftrends.com,State Street Paglia Highlights Firm Private Credit Suite,https://www.etftrends.com/etf-strategist-content-hub/state-streets-paglia-highlights-firms-private-credit-suite/
,liputan6.com,"Prabowo : Kalau Terjadi Perang Dunia III , Indonesia Termasuk Negara Aman",https://www.liputan6.com/news/read/6312693/prabowo-kalau-terjadi-perang-dunia-iii-indonesia-termasuk-negara-aman
,stockbiz.vn,Xung đột Trung Đông có thể thúc đẩy nhu cầu nhập khẩu gạo dự trữ,https://stockbiz.vn/tin-tuc/xung-dot-trung-dong-co-the-thuc-day-nhu-cau-nhap-khau-gao-du-tru/39375233
,tickerreport.com,Flex ( NASDAQ : FLEX ) Hits New 12 - Month High – What Next ?,https://www.tickerreport.com/banking-finance/13401684/flex-nasdaqflex-hits-new-12-month-high-whats-next.html
,clarin.com,Siguen la protesta de empresas de colectivos y los problemas para viajar : cuáles son las líneas afectadas y qué reclaman,https://www.clarin.com/ciudades/siguen-protesta-empresas-colectivos-problemas-viajar-lineas-afectadas-reclaman_0_zfUk1LDHoi.html
,lelezard.com,NioBay annonce la conclusion et le succès de ses travaux métallurgiques sur le projet Crevier,https://www.lelezard.com/communique-22179754.html
,efeagro.com,Los ganaderos y la industria láctea mantienen posiciones enfrentadas sobre los contratos firmados,https://efeagro.com/ganaderos-industria-lactea-alejan-acuerdo-complica-renegociar-contratos/
,bursa.ro,"Leonardo Badea , BNR : Modernizarea României prin integrare şi convergenţă",https://www.bursa.ro/leonardo-badea-bnr-modernizarea-romaniei-prin-integrare-si-convergenta-22358851
,newspim.com,트럼프  이란 무기 공급국에 50 % 관세 폭탄,https://www.newspim.com/news/view/20260408001408
,evropaelire.org,Kusari - Lila pret stabilizim të çmimeve të naftës,https://www.evropaelire.org/a/mimoza-kusari-cmimet-e-naftes-/33727723.html
,newkerala.com,"India Steel Output Grows 10 . 7 %, Becomes Net Exporter in FY26",https://www.newkerala.com/news/a/indian-steel-industry-clocks-robust-107-pc-growth-976.htm
,clarin.com,Biocombustibles : piden por una nueva ley en medio del alza de los combustibles por la guerra en Medio Oriente,https://www.clarin.com/rural/biocombustibles-piden-nueva-ley-medio-alza-combustibles-guerra-medio-oriente_0_E3kHysebY1.html
,vajma.info,Megdrágult a sertéshús az ortodox húsvét előtt,https://www.vajma.info/cikk/gazdasag/10688/Megdragult-a-serteshus-az-ortodox-husvet-elott.html
,kreschatic.kiev.ua,Xiaomi випустила монітор з 2K і 120 Гц : ціна та характеристики,https://kreschatic.kiev.ua/tehno/2026/04/08/xiaomi-vypustyla-byudzhetnyj-monitor-z-2k-i-120-gcz-harakterystyky-ta-czina.html
,caleaeuropeana.ro,OCDE recomandă îmbunătățirea tratamentului și îngrijirii pacienților cu sindromul post - COVID în vederea reducerii impactului economic negativ pe termen lung al pandemiei,https://www.caleaeuropeana.ro/ocde-recomanda-imbunatatirea-tratamentului-si-ingrijirii-pacientilor-cu-sindromul-post-covid-in-vederea-reducerii-impactului-economic-negativ-pe-termen-lung-al-pandemiei/
,inewsgr.com,Ο Παναθηναϊκός κέρδισε μέσα στην « καταραμένη » Βαρκελώνη μετά από … 4 . 744 ημέρες,https://www.inewsgr.com/27/o-panathinaikos-kerdise-mesa-stin-katarameni-varkeloni-meta-apo-4744-imeres.htm
,df.cl,El mercado celebra con un rally la tregua entre EEUU e Irán,https://www.df.cl/primer-click/el-mercado-celebra-con-un-rally-la-tregua-entre-eeuu-e-iran
,zazoom.it,Crisi energetica Bruxelles prende ancora tempo sulle nuove misure ma avverte,https://www.zazoom.it/2026-04-08/crisi-energetica-bruxelles-prende-ancora-tempo-sulle-nuove-misure-ma-avverte-no-ad-azioni-scoordinate/18964149/
,tecnoandroid.it,Apple e Samsung bocciate ai punteggi di riparabilità degli smartphone,https://www.tecnoandroid.it/2026/04/08/apple-e-samsung-bocciate-ai-punteggi-di-riparabilita-degli-smartphone-1858279/
,dailypolitical.com,Avenue Therapeutics ( NASDAQ : ATXI ) and Bio - Path ( NASDAQ : BPTH ) Head - To - Head Survey,https://www.dailypolitical.com/2026/04/08/avenue-therapeutics-nasdaqatxi-and-bio-path-nasdaqbpth-head-to-head-survey.html
,ziare.com,"Cât de fragil este armistițiul SUA - Iran .  Strâmtoarea Ormuz ar putea deveni o mare iraniană , iar tranzitul petrolului va sta în pixul ayatolahului",https://ziare.com/razboi-israel-iran/armistitiu-sua-iran-stramtoarea-ormuz-2005363
,dailybusiness.ro,"Onorariile avocaților din oficiu , majorate cu peste 9 % în funcție de inflație",https://www.dailybusiness.ro/actualitate/onorariile-avocatilor-din-oficiu-majorate-cu-peste-9-in-functie-de-inflatie-538386/
,berliner-zeitung.de,Frankreich plant 36 Milliarden Euro zusätzlich für Verteidigung bis 2030,https://www.berliner-zeitung.de/news/frankreich-plant-36-milliarden-euro-zusaetzlich-fuer-verteidigung-bis-2030-li.10029280
,vietgiaitri.com,Lào khai trương Nhà máy tinh luyện kim loại quý Lào Quốc tế - Thế giới,https://vietgiaitri.com/lao-khai-truong-nha-may-tinh-luyen-kim-loai-quy-lao-quoc-te-20260408i7670448/
,zf.ro,Banca Mondială a revizuit în jos estimările privind creşterea economică din 2026 a ...,https://www.zf.ro/zf-24/banca-mondiala-revizuit-jos-estimarile-privind-cresterea-economica-23118082
,lesnewseco.fr,Les Compagnies Loblaw Limitée annonce la date de publication des résultats du premier trimestre de 2026 et de lassemblée annuelle des actionnaires,https://www.lesnewseco.fr/pr/les-compagnies-loblaw-limitee-annonce-la-date-de-publication-des-resultats-du-premier-trimestre-de-2026-et-de-lassemblee-annuelle-des-actionnaires
,zaobao.com.sg,Grab推出13人工智能产品 提升用户体验,https://www.zaobao.com.sg/news/sea/story20260408-8863236
,lapresse.ca,Projets de transformation numérique | Québec veut sassocier à CGI,https://www.lapresse.ca/affaires/2026-04-08/projets-de-transformation-numerique/quebec-veut-s-associer-a-cgi.php
,elwatannews.com,قيد 14 شركة حكومية في البورصة « مؤقتا » خلال شهر,https://www.elwatannews.com/news/details/8261345
,aa.com.tr,"AB , enerji piyasalarında kısa sürede normalleşme beklemiyor",https://www.aa.com.tr/tr/ekonomi/ab-enerji-piyasalarinda-kisa-surede-normallesme-beklemiyor/3898073
,e15.cz,INVESTIČNÍ ONLINE : Novinky a analýzy pro investory,https://www.e15.cz/investice/investicni-online-navrat-cen-ropy-a-plynu-muze-trvat-i-mesice-primeri-je-zatim-ulevou-1424330
,hna.de,Iran - News : Trump deutet „ Regimewechsel  an – Merz schaltet sich ein,http://www.hna.de/politik/iran-news-trump-feiert-feuerpause-und-hormus-deal-praesident-zr-94252451.html
,banglamirrornews.com,"Bangladesh , Italy reaffirm commitment to deepen cooperation",https://banglamirrornews.com/2026/04/08/bangladesh-italy-reaffirm-commitment-to-deepen-cooperation/
,setn.com,中科擴廠帶動西台中就業動能 ! 沙鹿受惠捷運藍線與雙鐵優勢成置產焦點 | 房產 | 三立新聞網 SETN . COM,https://www.setn.com/News.aspx?NewsID=1819764
,dailypolitical.com,Jack Henry & Associates ( NASDAQ : JKHY ) vs . Draganfly ( NASDAQ : DPRO ) Financial Contrast,https://www.dailypolitical.com/2026/04/08/jack-henry-associates-nasdaqjkhy-vs-draganfly-nasdaqdpro-financial-contrast.html
,euronews.com,Why Anthropic most powerful AI model Mythos Preview is too dangerous for public release,https://www.euronews.com/next/2026/04/08/why-anthropics-most-powerful-ai-model-mythos-preview-is-too-dangerous-for-public-release
,rttnews.com,"China Railway Tielong Container Logistics Co ., Ltd Reports Climb In Full Year Profit",https://www.rttnews.com/3637588/china-railway-tielong-container-logistics-co-ltd-reports-climb-in-full-year-profit.aspx
,thetab.com,Cardiff University graduate bought £650k house in her 20s using the 50 30 20 rule,https://thetab.com/2026/04/08/cardiff-university-graduate-bought-650k-house-in-her-20s-using-the-50-30-20-rule
,index.hr,Amerikanka koja radi u Njemačkoj :  Slomilo me je kad sam doznala za zdravstveno,https://www.index.hr/magazin/clanak/amerikanka-koja-radi-u-njemackoj-slomilo-me-je-kad-sam-doznala-za-zdravstveno/2779863.aspx
,baijiahao.baidu.com,青岛OPC创业导师来了 组建40人专业导师队伍 为创业者提供免费一对一指导,https://baijiahao.baidu.com/s?id=1861912320908296485
,mittelstandcafe.de,Mittelstand trifft Politik : Betriebsbesichtigung bei Neuland setzt Zeichen für regionale Wirtschaftskraft,https://www.mittelstandcafe.de/mittelstand-trifft-politik-betriebsbesichtigung-bei-neuland-setzt-zeichen-f-r-regionale-wirtschaftskraft-2242991.html
,reggio2000.it,"Vertenza Menarini Spa di Bologna , forte attenzione per il calo delle commesse del gruppo per i possibili riflessi anche sul sito di via San Donato",https://www.reggio2000.it/2026/04/08/vertenza-menarini-spa-di-bologna-forte-attenzione-per-il-calo-delle-commesse-del-gruppo-per-i-possibili-riflessi-anche-sul-sito-di-via-san-donato/
,diariouno.com.ar,La apertura institucional generará beneficios,https://www.diariouno.com.ar/china-watch/la-apertura-institucional-generara-beneficios-n1544175
,vgoroden.ru,На конференции Data Fusion обсудили регулирование искусственного интеллекта,http://www.vgoroden.ru/novosti/na-konferencii-data-fusion-obsudili-regulirovanie-iskusstvennogo-intellekta-id429668
,theitem.com,How tax aware investing can help improve after - tax returns,"http://www.theitem.com/stories/how-tax-aware-investing-can-help-improve-after-tax-returns,441563"
,lelezard.com,Cango Inc . annonce une mise à jour opérationnelle pour mars 2026 ; optimisation stratégique de la flotte minière et amélioration de l  économie de production,https://www.lelezard.com/communique-22179386.html
,hawaiitelegraph.com,Wiley  The Black Book of Reshoring  by Douglas Brown Debuts at No . 3 on Amazon Business Bestsellers List,http://www.hawaiitelegraph.com/news/278971218/wiley-the-black-book-of-reshoring-by-douglas-brown-debuts-at-no-3-on-amazon-business-bestsellers-list
,elimparcial.com,"Quién es Larry Fink , CEO de BlackRock , y por qué se reunió con Claudia Sheinbaum por tercera ocasión",https://www.elimparcial.com/mexico/2026/04/08/quien-es-larry-fink-ceo-de-blackrock-y-por-que-se-reunio-con-claudia-sheinbaum-por-tercera-ocasion/
,nepalnational.com,"Bennett University enters online education with BBA , MBA degrees",http://www.nepalnational.com/news/278971325/bennett-university-enters-online-education-with-bba-mba-degrees
,realty.economictimes.indiatimes.com,"Prestige Estates Pre - sales : Prestige Estates Achieves Record Pre - sales of ₹30 , 024 Crore in FY26 , ETRealty",https://realty.economictimes.indiatimes.com/news/industry/prestige-estates-achieves-record-pre-sales-of-30024-crore-in-fy26/130111506
,gds.ro,Guvernul înăsprește reglementările pentru importurile de produse second - hand,https://www.gds.ro/Actualitate/2026-04-08/guvernul-inaspreste-reglementarile-pentru-importurile-de-produse-second-hand/
,qns.com,"Mamdani push to  tax the rich  could make sense for NYC , fiscal analysts say , despite Hochul opposition – QNS",https://qns.com/2026/04/millionaire-tax-mamdani-nyc/
,presse-citron.net,"Quels métiers sont les plus menacés par lIA , et lesquels le sont le moins  ? Anthropic révèle une méthode pour y répondre",https://www.presse-citron.net/quels-metiers-sont-les-plus-menaces-par-lia-et-lesquels-le-sont-le-moins-anthropic-revele-une-methode-pour-y-repondre/
,finanznachrichten.de,Persistence Market Research Pvt . Ltd .: Electric Vehicle ( EV ) Battery Management System Market to Reach US$24 . 9 Billion by 2033 Expands Amid Electrification Boom and Smart Battery Innovation,https://www.finanznachrichten.de/nachrichten-2026-04/68148916-persistence-market-research-pvt-ltd-electric-vehicle-ev-battery-management-system-market-to-reach-us-dollar-24-9-billion-by-2033-expands-amid-electrific-008.htm
,valeursactuelles.com,Pétrole : enfin lheure de vérité,https://www.valeursactuelles.com/clubvaleurs/economie/petrole-enfin-lheure-de-verite
,inewsgr.com,Καπέλο 15 . 000 δολαρίων στα Tesla Model S και Χ,https://www.inewsgr.com/255/kapelo-15000-dolarion-sta-Tesla-Model-S-kai-ch.htm
,tickerreport.com,Innovative Solutions and Support ( NASDAQ : ISSC ) & Applied Visual Sciences ( OTCMKTS : APVS ) Critical Review,https://www.tickerreport.com/banking-finance/13401689/innovative-solutions-and-support-nasdaqissc-applied-visual-sciences-otcmktsapvs-critical-review.html
,finance.eastmoney.com,道指期货暴涨1200点 ！ 霍尔木兹海峡突传重磅 ！ 特朗普发声 _ 东方财富网,https://finance.eastmoney.com/a/202604083698240061.html
,citoyens.com,Saint - Denis : le parcours de combattante dune mère pour se reloger,"https://citoyens.com/2026/saint-denis-le-parcours-de-combattante-dune-mere-pour-se-reloger,08-04-2026.html"
,kuaf.com,"U . S ., Iran agree to 2 - week ceasefire . And , Trump - backed Clay Fuller wins House race",https://www.kuaf.com/npr-news/2026-04-08/u-s-iran-agree-to-2-week-ceasefire-and-trump-backed-clay-fuller-wins-house-race
,digit.in,"Galaxy Z Fold 8 and Galaxy Z Flip 8 India launch soon : From price to specs , check all latest leaks",https://www.digit.in/news/mobile-phones/galaxy-z-fold-8-and-galaxy-z-flip-8-india-launch-soon-from-price-to-specs-check-all-latest-leaks.html
,it.euronews.com,"Raja Ravi Varma , quadro venduto a 15 , 9 milioni : nuovo record per larte indiana",https://it.euronews.com/cultura/2026/04/08/raja-ravi-varma-quadro-venduto-a-159-milioni-nuovo-record-per-larte-indiana
,pregon.com.ar,Santilli sigue con su agenda de encuentros para destrabar la agenda parlamentaria,https://www.pregon.com.ar/nota/-63280/2026/04/santilli-sigue-con-su-agenda-de-encuentros-para-destrabar-la-agenda-parlamentaria
,baomoi.com,"Chứng khoán bùng nổ , ngân hàng đầu tiên chốt chia cổ tức bằng tiền mặt năm 2026",https://baomoi.com/chung-khoan-bung-no-ngan-hang-dau-tien-chot-chia-co-tuc-bang-tien-mat-nam-2026-c54890591.epi
,wuwf.org,Rural school district financial woes a  canary in a coal mine,https://www.wuwf.org/florida-news/2026-04-08/rural-school-districts-financial-woes-a-canary-in-a-coal-mine
,theolivepress.es,EU warns Spain that tax cut on fuel to help households is  illegal,https://www.theolivepress.es/spain-news/2026/04/08/eu-warns-spain-tax-cut-fuel-surging-prices-illegal-letter/
,finanznachrichten.de,Janus Henderson Haitong Asia ex - Japan HY £ - Net Asset Value ( s ),https://www.finanznachrichten.de/nachrichten-2026-04/68148842-janus-henderson-haitong-asia-ex-japan-hy-gbp-net-asset-value-s-008.htm
,zf.ro,"Delgaz Grid , compania de distribuţie a grupului E . ON în România , a realizat anul ...",https://www.zf.ro/zf-24/delgaz-grid-compania-distributie-grupului-e-on-romania-realizat-anul-23118035
,zazoom.it,Lagente di Thiago Motta sicuro | Juventus ? Non tutti gradivano la sua presenza Cera ancora questo,https://www.zazoom.it/2026-04-08/lagente-di-thiago-motta-sicuro-juventus-non-tutti-gradivano-la-sua-presenza-cera-ancora-questo/18964172/
,finance.sina.com.cn,两人利用AI洗稿编造车企谣言被抓 ！ 捏造新能源电池风险等不实消息,https://finance.sina.com.cn/tech/discovery/2026-04-08/doc-inhtvfcw1403224.shtml
,defimedia.info,"Guerre au Moyen - Orient - Kevin Ramkaloan , CEO de Business Mauritius : « Il faut un plan national pour permettre à Maurice de rester résilient »",https://defimedia.info/guerre-au-moyen-orient-kevin-ramkaloan-ceo-de-business-mauritius-il-faut-un-plan-national-pour
,sofokleousin.gr,Η NIO Greece γίνεται Intelligent Mobility Partner του Your Directors Club,https://www.sofokleousin.gr/autoin/cars-electric/i-nio-greece-ginetai-intelligent-mobility-partner-tou-your-direct
,bignewsnetwork.com,French fashion brand confident in China market with global debut in Shanghai,http://www.bignewsnetwork.com/news/278971490/french-fashion-brand-confident-in-china-market-with-global-debut-in-shanghai
,europapress.es,Renault y sindicatos se reúnen el jueves tras algunos avances pero aún  insuficientes  para un acuerdo,https://www.europapress.es/motor/sector-00644/noticia-renault-sindicatos-reunen-jueves-algunos-avances-aun-insuficientes-acuerdo-20260408153644.html
,lelezard.com,Duck Creek lance la solution Duck Creek Reinsurance with Active Delivery pour aider les assureurs à simplifier la gestion des programmes et à renforcer le contrôle financier,https://www.lelezard.com/communique-22179271.html
,bursa.ro,Meta Estate Trust anunţă dezvoltarea unui nou activ comercial în judeţul Galaţi,https://www.bursa.ro/meta-estate-trust-anunta-dezvoltarea-unui-nou-activ-comercial-in-judetul-galati-00458850
,berliner-zeitung.de,Wegen Iran - Krieg : Australien und China wollen Zusammenarbeit bei Energie ausweiten,https://www.berliner-zeitung.de/news/wegen-iran-krieg-australien-und-china-wollen-zusammenarbeit-bei-energie-ausweiten-li.10029055
,www.latribunadealbacete.es,Iran,https://www.latribunadealbacete.es/noticia/zbc917731-cbd1-4a52-8b356f93e6e478e3/202604/trump-amenaza-a-los-paises-que-suministren-armas-a-iran
,kupang.tribunnews.com,Indonesia,https://kupang.tribunnews.com/news/957817/banyak-laporan-kasus-tenaga-kerja-wni-diimbau-waspada-tawaran-kerja-di-timor-leste
,kupang.tribunnews.com,East Timor,https://kupang.tribunnews.com/news/957817/banyak-laporan-kasus-tenaga-kerja-wni-diimbau-waspada-tawaran-kerja-di-timor-leste
,zaxid.net,"Lviv, L'vivs'ka Oblast', Ukraine",https://zaxid.net/lvivskiy_medichniy_universitet_novi_spetsialnosti_iz_2026_roku_shho_vidomo_n1634398
,klops.ru,"Moscow, Moskva, Russia",https://klops.ru/afisha/2026-04-08/381018-stress-opyt-piar-uznavaemost-kak-kaliningradskiy-brend-pobyval-na-nedele-mody-v-moskve
,www.inewsgr.com,"Red Sea, Djibouti (General), Djibouti",https://www.inewsgr.com/184/chtypithike-apo-drone-agogos-tis-saoudikis-aravias-pou-metaferei-petrelaio-apo-ton-kolpo-sti-dysi.htm
,www.inewsgr.com,Saudi Arabia,https://www.inewsgr.com/184/chtypithike-apo-drone-agogos-tis-saoudikis-aravias-pou-metaferei-petrelaio-apo-ton-kolpo-sti-dysi.htm
,m.tech.china.com,"Guangdong, Jilin, China",https://m.tech.china.com/redian/2026/0408/042026_1842028.html
,m.tech.china.com,China,https://m.tech.china.com/redian/2026/0408/042026_1842028.html
,m.tech.china.com,"Baiyun, Sichuan, China",https://m.tech.china.com/redian/2026/0408/042026_1842028.html
,m.tech.china.com,"Guangzhou, Guangdong, China",https://m.tech.china.com/redian/2026/0408/042026_1842028.html
,m.tech.china.com,"Shenzhen, Guangdong, China",https://m.tech.china.com/redian/2026/0408/042026_1842028.html
,m.tech.china.com,"Jinan, Shandong, China",https://m.tech.china.com/redian/2026/0408/042026_1842107.html
,m.tech.china.com,Malaysia,https://m.tech.china.com/redian/2026/0408/042026_1842107.html
,m.tech.china.com,India,https://m.tech.china.com/redian/2026/0408/042026_1842107.html
,quicknews-africa.net,"Abuja, Abuja Federal Capital Territory, Nigeria",https://quicknews-africa.net/citm-advocates-integrated-financial-management-system/
,quicknews-africa.net,Nigeria,https://quicknews-africa.net/citm-advocates-integrated-financial-management-system/
,www.tagesspiegel.de,Germany,https://www.tagesspiegel.de/politik/hohe-energiepreise-spd-parlamentsgeschaftsfuhrer-wirft-reiche-fehlenden-einsatz-fur-bevolkerung-vor-15446331.html
,www.elnortedecastilla.es,"Valencia, Carabobo, Venezuela",https://www.elnortedecastilla.es/economia/fiscalidad/agencia-tributaria-espera-recaudar-campana-renta-ano-20260408115506-ntrc.html
,www.plovdiv24.bg,"Plovdiv, Plovdiv, Bulgaria",https://www.plovdiv24.bg/novini/plovdiv/Na-sreshta-s-zhiteli-na-Trakiya-GERB-zayavi-razshiryavane-na-programata-za-2948488
,www.lastampa.it,Italy,https://www.lastampa.it/editoriali/lettere-e-idee/2026/04/08/news/iran_usa_tregua_vincitore-15576119/
,www.latribunadealbacete.es,"Andalusia, Spain (General), Spain",https://www.latribunadealbacete.es/noticia/z644dc738-9d99-495f-b6c9a30fc1b3df78/202604/feijoo-dimitira-si-llega-al-gobierno-y-no-baja-los-impuestos
,www.latribunadealbacete.es,"Albacete, Castilla-La Manacha, Spain",https://www.latribunadealbacete.es/noticia/z644dc738-9d99-495f-b6c9a30fc1b3df78/202604/feijoo-dimitira-si-llega-al-gobierno-y-no-baja-los-impuestos
,www.latribunadealbacete.es,Spain,https://www.latribunadealbacete.es/noticia/z644dc738-9d99-495f-b6c9a30fc1b3df78/202604/feijoo-dimitira-si-llega-al-gobierno-y-no-baja-los-impuestos
,www.castanetkamloops.net,"Kamloops, British Columbia, Canada",https://www.castanetkamloops.net/news/Kamloops/607582/Kamloops-MP-forms-economic-group-to-tackle-jobs-and-growth-challenges
,www.castanetkamloops.net,Canada,https://www.castanetkamloops.net/news/Kamloops/607582/Kamloops-MP-forms-economic-group-to-tackle-jobs-and-growth-challenges
,m.tech.china.com,"Xinxiang, Henan, China",https://m.tech.china.com/redian/2026/0408/042026_1842217.html
,m.tech.china.com,Thailand,https://m.tech.china.com/redian/2026/0408/042026_1842217.html
,www.lifo.gr,Lebanon,https://www.lifo.gr/now/world/birytos-mazika-israilina-pligmata-sto-kentro-dekades-nekroi-para-tin-ekeheiria-me-iran
,www.lifo.gr,"Beirut, Beyrouth, Lebanon",https://www.lifo.gr/now/world/birytos-mazika-israilina-pligmata-sto-kentro-dekades-nekroi-para-tin-ekeheiria-me-iran
