published_at,source,title,url
,vietgiaitri.com,Những giá trị đặc biệt đưa Huế vào top điểm đến trăng mật lãng mạn nhất thế giới,https://vietgiaitri.com/nhung-gia-tri-dac-biet-dua-hue-vao-top-diem-den-trang-mat-lang-man-nhat-the-gioi-20260304i7649097/
,agriculture.com,Projected Prices and Volatility Factors for 2026,https://www.agriculture.com/partners-projected-prices-and-volatility-factors-for-2026-11918933
,torontotelegraph.com,Zentek Announces Pilot Evaluation Program with Quality Filters Inc .,http://www.torontotelegraph.com/news/278901654/zentek-announces-pilot-evaluation-program-with-quality-filters-inc
,biobiochile.cl,El IPSA sube e intenta recuperarse de dos jornadas seguidas en rojo por la guerra en Irán | Economía,https://www.biobiochile.cl/noticias/economia/actualidad-economica/2026/03/04/el-ipsa-sube-e-intenta-recuperarse-de-dos-jornadas-seguidas-en-rojo-por-la-guerra-en-iran.shtml
,remszeitung.de,Bodenschätze unter der Marienburg ? CDU besorgt über mögliche Bohrungen am  Maxton Hall - Drehort,https://www.remszeitung.de/panorama/bodenschaetze-unter-der-marienburg-cdu-besorgt-ueber-moegliche-bohrungen-am-maxton-hall-drehort-TE5N3FJSJRE5XDJQRSAMEQA3AU.html
,macitynet.it,"Vremota , il kit 3 - in - 1 da giardiniere in offerta lampo a 49 €",https://www.macitynet.it/vremota-kit-giardiniere/
,cagliaripad.it,"Guerra Medio Oriente , conseguenze anche in Sardegna : sale il costo del carburante",https://www.cagliaripad.it/668085/guerra-medio-oriente-conseguenze-anche-in-sardegna-sale-il-costo-del-carburante/
,e15.cz,Miliardový dopravní projekt z Česka má krýt Evropská investiční banka . Zasazuje se o to EGAP,https://www.e15.cz/byznys/finance-a-bankovnictvi/miliardovy-dopravni-projekt-z-ceska-by-mohla-kryt-evropska-investicni-banka-zasazuje-se-o-to-egap-1431169
,048.ua,В Одесі 4 березня можна безкоштовно зробити скринінг надмірної маси тіла для дітей та підлітків : адреси,https://www.048.ua/news/4074970/v-odesi-4-berezna-mozna-bezkostovno-zrobiti-skrining-nadmirnoi-masi-tila-dla-ditej-ta-pidlitkiv-adresi
,weltwoche.ch,"Viel Wind , wenig Schutz : Deutschlands Energiewende strauchelt im Weltmarktsturm",https://weltwoche.ch/daily/viel-wind-wenig-schutz-deutschlands-energiewende-strauchelt-im-weltmarkt-sturm/
,fool.ca,The Top 3 Dividend Stocks Id Tell Anyone to Buy | The Motley Fool Canada,https://www.fool.ca/2026/03/03/the-top-3-dividend-stocks-id-tell-anyone-to-buy-2/
,thehindubusinessline.com,"Women taking own investment decisions hit 56 pc , finds DSP MF study",https://www.thehindubusinessline.com/news/women-taking-own-investment-decisions-hit-56-pc-finds-dsp-mf-study/article70703439.ece
,wrestlinginc.com,Matt Hardy On WWE WrestleMania 42 Ticket Slowdown :  It A Tough Sell,https://www.wrestlinginc.com/2112182/wwe-wrestlemania-42-matt-hardy-ticket-slowdown-tough-sell/
,thebftonline.com,"Real estate renaissance : Growth , drivers , and new frontiers",https://thebftonline.com/2026/03/04/real-estate-renaissance-growth-drivers-and-new-frontiers/
,business24.ro,"Accenture își extinde portofoliul prin achiziția Ookla , Downdetector și Speedtest pentru optimizarea rețelelor și analizelor în timp real",https://business24.ro/achizitie/portofoliu-achizitii-ookla-downdetector-speedtest-retele-analize-1643022
,gazetadopovo.com.br,Vorcaro mandou  quebrar os dentes  de alvo e tinha diálogo com diretores do BC,https://www.gazetadopovo.com.br/republica/vorcaro-mandou-quebrar-dentes-alvo-dialogo-diretores-bc/
,n-tv.de,Ukraine - Krieg im Liveticker : +++ 14 : 27 Russischer LNG - Tanker im Mittelmeer versunken +++,https://www.n-tv.de/politik/14-27-Russischer-LNG-Tanker-im-Mittelmeer-versunken-article23143824.html
,piatafinanciara.ro,"Industria dronelor , din perspectiva tuturor segmentelor economice care o compun",https://www.piatafinanciara.ro/industria-dronelor-din-perspectiva-tuturor-segmentelor-economice-care-o-compun/
,openpr.com,Cleanroom Apparel Market Is Going to Boom Rapidly,https://www.openpr.com/news/4412594/cleanroom-apparel-market-is-going-to-boom-rapidly-dupont-de
,benzinga.com,Why Is CoreWeave Stock Surging Wednesday ? - CoreWeave ( NASDAQ : CRWV ),https://www.benzinga.com/trading-ideas/movers/26/03/51033236/coreweave-lands-major-ai-deal-with-perplexity
,rosario3.com,"Olivares :  La recaudación , por segundo mes consecutivo en el año , ha caído en términos reales",https://www.rosario3.com/-economia-negocios-agro-/olivares-la-recaudacion-por-segundo-mes-consecutivo-en-el-ano-ha-caido-en-terminos-reales-20260304-0009.html
,morningstar.com,"Private - Sector Hiring Solid Last Month , Per ADP Data",https://www.morningstar.com/news/dow-jones/202603045339/private-sector-hiring-solid-last-month-per-adp-data
,pharostribune.com,Bill targeting low - earning college degrees clears Indiana Legislature,https://www.pharostribune.com/news/article_3e0cacc4-736d-4472-9ed1-351ded8947d5.html
,independent.com.mt,Prime Minister visits factory as snack producer expands its operations,https://www.independent.com.mt/articles/2026-03-04/local-news/Prime-Minister-visits-Tastees-factory-as-snack-producer-expands-its-operations-6736287711
,dgabc.com.br,Dólar recua em linha com exterior por alívio em petróleo e apetite por risco - 04 / 03 / 2026,https://www.dgabc.com.br/Noticia/4288531/dolar-recua-em-linha-com-exterior-por-alivio-em-petroleo-e-apetite-por-risco
,news.yam.md,Deputatul Partidului Nostru Alexandr Berlinschii anunță convocarea primei ședințe a Comisiei parlamentare pentru reintegrare,https://news.yam.md/ro/story/18735825
,themarketsdaily.com,"Teachers Retirement System of The State of Kentucky Sells 14 , 328 Shares of Cadence Bank $CADE",https://www.themarketsdaily.com/2026/03/04/teachers-retirement-system-of-the-state-of-kentucky-sells-14328-shares-of-cadence-bank-cade.html
,tass.ru,"Минфин разместил ОФЗ 26218 на 49 , 756 млрд рублей",https://tass.ru/ekonomika/26648541
,wiwo.de,Iran - Krieg : Wer soll all diese Raketen bauen ?,https://www.wiwo.de/unternehmen/industrie/iran-krieg-wer-soll-all-diese-raketen-bauen-01/100205160.html
,english.news.cn,Zimbabwe launches 2026 tobacco marketing season - Xinhua,https://english.news.cn/20260304/0206e95a53f24ab6a7c1cce4e8990e10/c.html
,newsbiella.it,"Stretto di Hormuz chiuso , non solo gas e petrolio ma anche un altro rischio : la crisi dellalluminio",https://www.newsbiella.it/2026/03/04/leggi-notizia/argomenti/ultimora/articolo/stretto-di-hormuz-chiuso-non-solo-gas-e-petrolio-ma-anche-un-altro-rischio-la-crisi-dellalluminio.html
,fr.allafrica.com,"Tunisie : Café - La crise perdure , différemment",https://fr.allafrica.com/stories/202603040334.html
,shanghainews.net,15 dead as cargo plane carrying cash crashes near Bolivia capital,http://www.shanghainews.net/news/278895153/15-dead-as-cargo-plane-carrying-cash-crashes-near-bolivia-s-capital
,business24.ro,Coaliția ar fi decis ca proiectul de buget pe 2026 să fie transmis Parlamentului abia săptămâna viitoare,https://business24.ro/economie/trimitere-parlament-buget-2026-1643027
,prokerala.com,"Polycab receives Rs 327 crore income tax demand , shares down 3 pc",https://www.prokerala.com/news/articles/a1735761.html
,businesstoday.in,"Market crash : Sensex sheds 3 , 100 pts as investors lose Rs 18 lakh cr in four sessions ; what next ?",https://www.businesstoday.in/markets/stocks/story/market-crash-sensex-sheds-3100-pts-as-investors-lose-rs-18-lakh-cr-in-four-sessions-whats-next-519109-2026-03-04
,zazoom.it,La prudenza di Bin Salman Riad dalla guerra ha tutto da guadagnare o da perdere,https://www.zazoom.it/2026-03-04/la-prudenza-di-bin-salman-riad-dalla-guerra-ha-tutto-da-guadagnare-o-da-perdere/18768027/
,nsknews.info,Бесплатный курс по промтуризму прошли 30 предприятий Новосибирска,https://nsknews.info/news/besplatnyi-kurs-po-promturizmu-prosli-30-predpriiatii-novosibirska
,house.ettoday.net,熊本 「 晶 」 浪潮 vs 東京都心老公寓 2026日本房市淘金地圖解析 | ETtoday房產雲,https://house.ettoday.net/news/3118633
,freepressjournal.in,US - Israel - Iran War And Hormuz Blockade : How India Is Tapping Its Russian  Lifeline  To Avert An Energy Crisis,https://www.freepressjournal.in/india/us-israel-iran-war-and-hormuz-blockade-how-india-is-tapping-its-russian-lifeline-to-avert-an-energy-crisis
,bikebiz.com,Eurobike 2026 Strengthens Specialist Retail with a  Retail First  Focus,https://bikebiz.com/eurobike-2026-strengthens-specialist-retail-with-a-retail-first-focus/
,marinelink.com,Strategic Marine Delivers First Supa Swath Ctvs To,https://www.marinelink.com/news/strategic-marine-delivers-first-supa-536490
,lampost.co,Pertahankan Stabilitas Harga Bahan Pokok Selama Ramadan,https://lampost.co/lampung/pertahankan-stabilitas-harga-bahan-pokok-selama-ramadan/
,zazoom.it,È un importante riconoscimento europeo per vetture [ Soluzione Cruciverba 12 lettere ],https://www.zazoom.it/soluzioni-cruciverba/definizione/2026-03-04-importante-riconoscimento-europeo-per-vetture--12-59/926816/
,finance.yahoo.com,What Are 3 Great Tech Stocks to Buy Right Now ?,https://finance.yahoo.com/news/3-great-tech-stocks-buy-135000499.html
,business24.ro,"Piațele europene resimt aversiunea față de risc și creșterea prețului gazelor , conform CFA România .",https://business24.ro/burse-europene/piata-europeana-aversiune-risc-cresterea-pret-gazelor-1643042
,agerpres.ro,Comunicat de presă - ANCOM,https://agerpres.ro/comunicate/2026/03/04/comunicat-de-presa---ancom--1534033
,news.fznews.com.cn,3月起手机要涨价 ？ 多家品牌最新回应 _ 福州 _ 新闻频道 _ 福州新闻网,https://news.fznews.com.cn/fzyw/20260304/PbxN1x0kuE.shtml
,barbadostoday.bb,Barbados adjusting $80m foreign policy with CARICOM as  strategic anchor,https://barbadostoday.bb/2026/03/04/barbados-adjusting-80m-foreign-policy-with-caricom-as-strategic-anchor/
,fakt.pl,Wycofali ze wszystkich sklepów Carrefour . Tego towaru już nie kupisz,https://www.fakt.pl/pieniadze/wycofali-ze-wszystkich-sklepow-carrefour-tego-towaru-juz-nie-kupisz/43lj5yz
,archdaily.com,Error 404 : Architectural Memory in the Age of Algorithms,https://www.archdaily.com/1038820/error-404-architectural-memory-in-the-age-of-algorithms
,ilpost.it,C  è un accordo per la vendita della Stampa,https://www.ilpost.it/2026/03/04/accordo-vendita-stampa-gedi-sae/
,eldiariodechihuahua.mx,Le falta un clavo a mi cruz,https://www.eldiariodechihuahua.mx/opinion/2026/mar/03/le-falta-un-clavo-a-mi-cruz-776423.html
,lavozdegalicia.es,"El asesinato en A Toxa de todos los mandatarios de la Unión Europea , « leitmotiv » de la nueva novela de Manel Loureiro",https://www.lavozdegalicia.es/noticia/pontevedra/2026/03/04/asesinato-toxa-mandatarios-unioneuropea-leit-motiv-nueva-novela-manel-loureiro/00031772625673624916128.htm
,shanghainews.net,Economy | NW China Xinjiang welcomes the lambing season,http://www.shanghainews.net/news/278901676/economylife-nw-china-xinjiang-welcomes-the-lambing-season
,informacion.es,Bruselas lanza su  Made in Europe : exigirá a la inversión extranjera un 30 % de productos europeos y limitará el control del capital extranjero,https://www.informacion.es/economia/2026/03/04/bruselas-lanza-made-in-europe-127550884.html
,dgabc.com.br,IBGE : 15 das 24 atividades têm altas de preços no IPP de janeiro - 04 / 03 / 2026,https://www.dgabc.com.br/Noticia/4288534/ibge-15-das-24-atividades-tem-altas-de-precos-no-ipp-de-janeiro
,pctipp.ch,Nadella verspricht KI ohne Cloud - Zwang,https://www.pctipp.ch/news/kuenstliche-intelligenz/nadella-verspricht-ki-cloud-zwang-2982124.html
,reflector.com,"With 100 days to go , World Cup faces new challenges with Iran war and Mexico violence",https://www.reflector.com/news/national/with-100-days-to-go-world-cup-faces-new-challenges-with-iran-war-and-mexico/article_e21d944c-a919-52a7-b467-d1a5fb071b47.html
,vetogate.com,أسعار سبائك النحاس اليوم الأربعاء 4 - 3 - 2026 في الأسواق,https://www.vetogate.com/5607224
,themarketsdaily.com,"Teachers Retirement System of The State of Kentucky Has $10 . 22 Million Stake in Bio - Rad Laboratories , Inc . $BIO",https://www.themarketsdaily.com/2026/03/04/teachers-retirement-system-of-the-state-of-kentucky-has-10-22-million-stake-in-bio-rad-laboratories-inc-bio.html
,meedia.de,Zoom vergibt erstmals weltweiten Mediaetat,http://meedia.de/news/beitrag/21258-zoom-vergibt-erstmals-weltweiten-mediaetat.html
,macitynet.it,Per gli sviluppatori di LibreOffice la loro interfaccia è migliore rispetto a quella di Microsoft Office,https://www.macitynet.it/libreoffice-migliore-di-office/
,marinelink.com,NYK Advances Design Of Subsea Cable - Laying Vessel,https://www.marinelink.com/news/nyk-advances-design-subsea-cablelaying-536485
,ansa.it,"Borsa : lEuropa brilla in attesa di Wall Street , Milano +1 , 4 % - Notizie",https://www.ansa.it/sito/notizie/economia/2026/03/04/borsa-leuropa-brilla-in-attesa-di-wall-street-milano-14_afbdfea6-4ef8-4a92-bbb0-8a2d6ff64341.html
,heraldk.com,중동 사태  에 원 / 달러 환율 1476 . 2원 마감 … 한달 반 만에 최고,https://heraldk.com/2026/03/03/%e2%80%98%ec%a4%91%eb%8f%99-%ec%82%ac%ed%83%9c%e2%80%99%ec%97%90-%ec%9b%90%eb%8b%ac%eb%9f%ac-%ed%99%98%ec%9c%a8-1476-2%ec%9b%90-%eb%a7%88%ea%b0%90%e2%80%a6%ed%95%9c%eb%8b%ac-%eb%b0%98-%eb%a7%8c/
,zazoom.it,Juventus | Malen sotto osservazione,https://www.zazoom.it/2026-03-04/juventus-malen-sotto-osservazione/18768188/
,rejogja.republika.co.id,Hikmah di Balik Konflik Iran – AS – Israel terhadap Perekonomian Nasional,https://rejogja.republika.co.id/berita/tbdo2a291/hikmah-di-balik-konflik-iranasisrael-terhadap-perekonomian-nasional
,zonebourse.com,"Nouveaux modèles , nouveaux canaux  : comment les ETF vont tirer profit de la révolution numérique",https://www.zonebourse.com/actualite-bourse/Nouveaux-modeles-nouveaux-canaux-comment-les-ETF-vont-tirer-profit-de-la-revolution-numerique-52598709/
,ktar.com,The Latest : Explosions heard in Tehran and Jerusalem on fifth day of war,https://ktar.com/national-news/the-latest-explosions-heard-in-tehran-and-jerusalem-on-fifth-day-of-war/5830836/
,tecnoandroid.it,Very e la sfida low cost : 200GB in 5G e bonus extra per sei mesi,https://www.tecnoandroid.it/2026/03/04/very-e-la-sfida-low-cost-200gb-in-5g-e-bonus-extra-per-sei-mesi-1791427/
,danas.rs,"U EU bez problema sa snabdevanjem naftom , ali postoji zabrinutost",https://www.danas.rs/vesti/ekonomija/u-eu-bez-problema-sa-snabdevanjem-naftom-ali-postoji-zabrinutost/
,businessonline.it,Gli effetti su alimentari e altri prodotti ( oltre energia ) in Italia per con la chiusura dello stretto di Hormuz dellIran,https://www.businessonline.it/news/gli-effetti-su-alimentari-e-altri-prodotti-oltre-energia-in-italia-per-con-la-chiusura-dello-stretto-di-hormuz-delliran_n83115.html
,haberler.com,Çınarcıkta sebze ve meyve atıkları gübreye dönüştürülüyor,https://www.haberler.com/guncel/cinarcik-ta-sebze-ve-meyve-atiklarindan-organik-gubre-uretimi-19624004-haberi/
,eldiariodechihuahua.mx,- Toca la puerta guerra  La Línea - Los Cabrera,https://www.eldiariodechihuahua.mx/opinion/2026/mar/03/toca-la-puerta-guerra-la-linea-los-cabrera-776421.html
,esaimaa.fi,Pministerin mielestä ihmisten mielikuvat sotepalveluista eivät vastaa todellisuutta – oppositiosta podettiin myöthäpe,https://www.esaimaa.fi/uutissuomalainen/9274293
,thebftonline.com,"Consumers deserve performance , not promises",https://thebftonline.com/2026/03/04/consumers-deserve-performance-not-promises/
,cosmopolitan.com,"Futuro Zeta , i ventenni stanno cambiando il mondo",https://www.cosmopolitan.com/it/lifecoach/a70405987/genz-politica-mondo-rivoluzione/
,prnewswire.com,Ninja Kidz Action Parks Announces Strategic Acquisition of Flight Adventure Park to Expand Next - Generation Family Entertainment,http://www.prnewswire.com/news-releases/ninja-kidz-action-parks-announces-strategic-acquisition-of-flight-adventure-park-to-expand-next-generation-family-entertainment-302703439.html
,heraldo.es,La Inteligencia Artificial pronostica que Zaragoza será una de las ciudades donde más suba el alquiler en 2026,https://www.heraldo.es/noticias/aragon/zaragoza/2026/03/04/inteligencia-artificial-pronostica-zaragoza-ciudades-donde-mas-suba-alquiler-2026-1891269.html
,openpr.com,Blood Glucose Monitoring Devices Market Is Going to Boom Rapidly,https://www.openpr.com/news/4412596/blood-glucose-monitoring-devices-market-is-going-to-boom-rapidly
,vietgiaitri.com,UAE lên tiếng về đồn đoán tham gia không kích Iran sau khi hứng chịu hơn 1 . 000 tên lửa và UAV,https://vietgiaitri.com/uae-len-tieng-ve-don-doan-tham-gia-khong-kich-iran-sau-khi-hung-chiu-hon-1000-ten-lua-va-uav-20260304i7649110/
,fontanka.ru,Академик РАН о причинах экологического кризиса в Азовском море - 4 марта 2026,https://www.fontanka.ru/2026/03/04/76294649/
,morningstar.com,How Income Investors Can Avoid Dividend Traps in 2026,https://www.morningstar.com/stocks/how-income-investors-can-avoid-dividend-traps-2026
,finanznachrichten.de,"Artificial Intelligence Technology Solutions , Inc .: AITX RAD Channel Partner Expands Detection to Guard Response Ecosystem",https://www.finanznachrichten.de/nachrichten-2026-03/67854356-artificial-intelligence-technology-solutions-inc-aitx-s-rad-channel-partner-expands-detection-to-guard-response-ecosystem-296.htm
