published_at,source,title,url
,haber.mynet.com,Ankara Valiliğinden kuvvetli rüzgar ve fırtına uyarısı !,https://haber.mynet.com/ankara-valiligi-nden-kuvvetli-ruzgar-ve-firtina-uyarisi-110107265963
,risingbd.com,লঞ্চ হলো পালসার সিরিজের ২ বাইকের নতুন আপডেট,https://www.risingbd.com/moto-corner/news/635318
,dailypolitical.com,"Venturi Wealth Management LLC Sells 294 , 757 Shares of iShares MSCI Emerging Markets Min Vol Factor ETF $EEMV",https://www.dailypolitical.com/2026/01/10/venturi-wealth-management-llc-sells-294757-shares-of-ishares-msci-emerging-markets-min-vol-factor-etf-eemv.html
,f-b.no,"Fredrikstad sentrum , Gårdeiersamarbeidet | Fredrikstad sentrum er i utvikling , ikke i utarming",https://www.f-b.no/fredrikstad-sentrum-er-i-utvikling-ikke-i-utarming/o/5-59-3798378
,mallorcadiario.com,Aena defiende subidas de tasas aeroportuarias menores del 6 por ciento hasta 2031,https://www.mallorcadiario.com/aena-defiende-subidas-tasas-por-debajo-del-6-por-ciento-hasta-2031
,energia.rp.pl,Prezes ExxonMobil : Wenezuela nie nadaje się do inwestycji,https://energia.rp.pl/ropa/art43616881-exxonmobil-odrzuca-plan-trumpa-nie-chce-wracac-do-wenezueli
,english.news.cn,Ethiopia eyes expanded coffee value - addition to boost export earning - Xinhua,https://english.news.cn/20260110/e5d80ebfd9f144a28cc7e122ddc1453e/c.html
,dailysignal.com,The Four Most Troubling Issues Share a Common Denominator,https://www.dailysignal.com/2026/01/10/victor-davis-hanson-the-common-denominator-of-the-issues-troubling-me-most/
,riasv.ru,АТБ та McDonald : лідери за витратами клієнтів monobank,https://riasv.ru/ekonomika/2026/01/10/atb-ta-mcdonalds-lideri-za-vitratami-kliientiv-monobank/
,tagesspiegel.de,Schneekanonen - Pionier Georg Eisath im Gespräch : „ Wir bauen euch was Besseres – für die Hälfte,https://www.tagesspiegel.de/gesellschaft/reise/schneekanonen-pionier-georg-eisath-im-gesprach-wir-bauen-euch-was-besseres--fur-die-halfte--15108430.html
,economictimes.indiatimes.com,India well - positioned to be most dynamic REIT market globally : Vestian,https://economictimes.indiatimes.com/industry/services/property-/-cstruction/india-well-positioned-to-be-most-dynamic-reit-market-globally-vestian/articleshow/126451523.cms
,comicbook.com,Terminator Fans Shouldnt Skip This New Shooter,https://comicbook.com/gaming/feature/terminator-fans-shouldnt-skip-this-new-shooter/
,ticinonews.ch,"Valanga in Valle dAosta , sciatore travolto a Pila",https://www.ticinonews.ch/estero/valanga-in-valle-daosta-sciatore-travolto-a-pila-423982
,tickerreport.com,"Woodward Diversified Capital LLC Grows Stock Position in Meta Platforms , Inc . $META",https://www.tickerreport.com/banking-finance/13312803/woodward-diversified-capital-llc-grows-stock-position-in-meta-platforms-inc-meta.html
,webpronews.com,Spangle AI Raises $15M Series A for AI - Driven E - Commerce Platforms,https://www.webpronews.com/spangle-ai-raises-15m-series-a-for-ai-driven-e-commerce-platforms/
,arede.info,Portal aRede fecha 2025 com a liderança de audiência no interior do PR,https://arede.info/ponta-grossa/620199/portal-arede-fecha-2025-com-a-lideranca-de-audiencia-no-interior-do-pr
,topontiki.gr,Η αναδρομή Μητσοτάκη και το μήνυμα για την Ελλάδα του 2030 : « Οι πολίτες θα μας εμπιστευτούν το 2027 »,https://www.topontiki.gr/2026/01/10/i-anadromi-mitsotaki-ke-to-minima-gia-tin-ellada-tou-2030-i-polites-tha-mas-empisteftoun-to-2027/
,tickerreport.com,"Sumitomo Mitsui DS Asset Management Company Ltd Has $28 . 04 Million Holdings in Uber Technologies , Inc . $UBER",https://www.tickerreport.com/banking-finance/13312804/sumitomo-mitsui-ds-asset-management-company-ltd-has-28-04-million-holdings-in-uber-technologies-inc-uber.html
,dailypolitical.com,"Sonoma Allocations LLC Invests $613 , 000 in NextEra Energy , Inc . $NEE",https://www.dailypolitical.com/2026/01/10/sonoma-allocations-llc-invests-613000-in-nextera-energy-inc-nee.html
,lacapital.com.ar,Cóccaro a Newells : un Zorro con goles a Central y chispazos con un canalla,https://www.lacapital.com.ar/ovacion/coccaro-newells-un-zorro-goles-central-y-chispazos-un-canalla-n10239207.html
,livelaw.in,Landlord Being  Best Judge  Of His Needs Doesnt Dispense With Proof Of Genuine Need For Tenant Eviction : Delhi High Court,https://www.livelaw.in/high-court/delhi-high-court/landlord-being-best-judge-of-his-needs-doesnt-dispense-with-proof-of-genuine-need-for-tenants-eviction-delhi-high-court-518364
,kaos911.com,2秒懂 !!,https://www.kaos911.com/html/48c799315.html
,elboletin.com,Récord histórico del precio de la vivienda de segunda mano : se dispara un 20 % en 2025,https://www.elboletin.com/record-historico-del-precio-de-la-vivienda-de-segunda-mano-se-dispara-un-20-en-2025/
,shorouknews.com,خبراء : التضخم يتجه للتراجع إلى 8 – 10 % خلال 2026 مع خفض متوقع للفائدة,https://www.shorouknews.com/news/view.aspx?cdate=10012026&id=d3643bdd-7acf-4c26-9ae3-d7621ac8227e
,slashgear.com,The Cheapest Time Of Year To Buy An iPad Isnt Necessarily Black Friday Or Cyber Monday,https://www.slashgear.com/2069174/cheapest-time-of-year-buy-apple-products/
,cuartopoder.mx,"Avanzan jornadas de paz en Guerrero , destaca Rodríguez",https://www.cuartopoder.mx/nacional/avanzan-jornadas-de-paz-en-guerrero-destaca-rodriguez/563300
,naslovi.net,"( VIDEO ) Zavejano Prijepolje : Za par sati napadalo oko 25 centimetara snega , automobili se otežano kreću - Povezane vesti",https://naslovi.net/tema/2437631
,baomoi.com,TP . Hồ Chí Minh phải đi đầu về số hóa dữ liệu đất đai,https://baomoi.com/tp-ho-chi-minh-phai-di-dau-ve-so-hoa-du-lieu-dat-dai-c54223679.epi
,thehindubusinessline.com,Moody changes Shriram Finance rating outlook to positive from stable post MUFG deal,https://www.thehindubusinessline.com/money-and-banking/moodys-changes-shriram-finance-rating-outlook-to-positive-from-stable-post-mufg-deal/article70494517.ece
,elboletin.com,"El Ibex 35 avanza un 0 , 9 % semanal y consolida los 17 . 649 puntos",https://www.elboletin.com/el-ibex-35-avanza-un-09-semanal-y-consolida-los-17-649-puntos/
,elboletin.com,El Ibex 35 pierde los 17 . 600 puntos en una sesión marcada por la tensión geopolítica,https://www.elboletin.com/el-ibex-35-pierde-los-17-600-puntos-en-una-sesion-marcada-por-la-tension-geopolitica/
,elfinancierocr.com,El rebote de la moda en Costa Rica : gasto real en ropa y calzado crece un 29 % tras años de declive,https://www.elfinancierocr.com/negocios/el-rebote-de-la-moda-en-costa-rica-gasto-real-en/VBRTPLE5WZFW5H3COHFAITHP24/story/
,themarketsdaily.com,Oregon Public Employees Retirement Fund Has $11 . 68 Million Holdings in Lockheed Martin Corporation $LMT,https://www.themarketsdaily.com/2026/01/10/oregon-public-employees-retirement-fund-has-11-68-million-holdings-in-lockheed-martin-corporation-lmt.html
,wfdd.org,"2026 looks ominous for media , from Hollywood to journalism",https://www.wfdd.org/national/2026-01-10/2026-looks-ominous-for-media-from-hollywood-to-journalism
,abc.es,El PSCL propone la creación de un consorcio autonómico de vivienda y suelo con ayuntamientos y diputaciones,https://www.abc.es/espana/castilla-leon/pscl-propone-creacion-consorcio-autonomico-vivienda-suelo-20260110140451-nt.html
,dailypolitical.com,Torq Resources ( CVE : TORQ ) Trading Up 36 . 8 % – Here Why,https://www.dailypolitical.com/2026/01/10/torq-resources-cvetorq-trading-up-36-8-heres-why.html
,dostor.org,سعر الدولار في البنوك المصرية اليوم السبت 10 يناير 2026 .. تحديث,https://www.dostor.org/5375513
,elboletin.com,"El Ibex 35 se desmarca de Europa y rebota un 0 , 23 % apoyado en banca y defensa",https://www.elboletin.com/el-ibex-35-se-desmarca-de-europa-y-rebota-un-023-apoyado-en-banca-y-defensa/
,themarketsdaily.com,"Sonoma Allocations LLC Buys Shares of 3 , 119 Applied Materials , Inc . $AMAT",https://www.themarketsdaily.com/2026/01/10/sonoma-allocations-llc-buys-shares-of-3119-applied-materials-inc-amat.html
,elboletin.com,Wall Street cierra mixta : la tecnología cae y la defensa sube por el plan militar de Trump,https://www.elboletin.com/wall-street-cierra-mixta-la-tecnologia-cae-y-la-defensa-sube-por-el-plan-militar-de-trump/
,mallorcadiario.com,"Baleares , líder en matriculaciones de embarcaciones de recreo en 2025",https://www.mallorcadiario.com/baleares-liderando-matriculaciones-embarcaciones-recreo-2025
,news.ifeng.com,条条炸裂 ！ 马斯克最新3小时访谈震撼全球 （ 完整视频+全文 ）,https://news.ifeng.com/c/8pnr8DCbjig
,slashgear.com,5 Handy Milwaukee Gadgets To Upgrade Your Garage,https://www.slashgear.com/2069527/handy-milwaukee-gadgets-to-upgrade-garage/
,banglanews24.today,14 জানুয়ারিতে সামাজিক নিরাপত্তা প্রদান : আপনি কি একটি চেক পাবেন ? যোগ্যতা জানুন,https://banglanews24.today/2026/01/10/14-%E0%A6%9C%E0%A6%BE%E0%A6%A8%E0%A7%81%E0%A6%AF%E0%A6%BC%E0%A6%BE%E0%A6%B0%E0%A6%BF%E0%A6%A4%E0%A7%87-%E0%A6%B8%E0%A6%BE%E0%A6%AE%E0%A6%BE%E0%A6%9C%E0%A6%BF%E0%A6%95-%E0%A6%A8%E0%A6%BF%E0%A6%B0/
,kunc.org,PHOTOS : Laundry is a chore but there a beauty and serenity in the way it hangs out,https://www.kunc.org/npr-news/2026-01-10/photos-laundry-is-a-chore-but-theres-a-beauty-and-serenity-in-the-way-it-hangs-out
,energia.rp.pl,"Powrót united states do Wenezueli ? Ropa kusi , ryzyko odstrasza",https://energia.rp.pl/ropa/art43616991-trump-gotowy-na-naftowy-biznes-w-wenezueli-ile-ropy-czeka-na-amerykanskie-koncerny
,samaa.tv,"Pakistan , Indonesia sign agreement to boost trade , economic ties",https://www.samaa.tv/2087344425-pakistan-indonesia-sign-agreement-to-boost-trade-economic-ties
,vaartha.com,TG : ఈనెల 12న రెండు కొత్త పథకాలు అమలు,https://vaartha.com/telangana/tg-two-new-schemes-to-be-implemented-on-the-12th-of-this-month/624849/
,jpnn.com,"Aset Pengguna di OKX Terus Tumbuh , Likuiditas Tetap Kuat",https://www.jpnn.com/news/aset-pengguna-di-okx-terus-tumbuh-likuiditas-tetap-kuat
,westernpeople.ie,Mayo motor dealers enjoyed buoyant 2025 - Life,https://www.westernpeople.ie/life/mayo-motor-dealers-enjoyed-buoyant-2025_arid-83137.html
,clarin.com,Las aventuras de Donald Trump y un déficit fiscal de película : hasta el infinito y más allá,https://www.clarin.com/economia/aventuras-donald-trump-deficit-fiscal-pelicula-infinito-alla_0_RFb8Thpvqk.html
,foxbusiness.com,DISH alleged fraud in FCC spectrum auction faces Biden DOJ dismissal bid,https://www.foxbusiness.com/fox-news-opinion/mike-davis-billion-dollar-alleged-fraud-case-biden-doj-tried-bury
,elboletin.com,"El Ibex 35 cede un 0 , 2 % al mediodía y se aferra a los 17 . 600 puntos",https://www.elboletin.com/el-ibex-35-cede-un-02-al-mediodia-y-se-aferra-a-los-17-600-puntos/
,kaos911.com,( 2分钟科普下 )!,https://www.kaos911.com/html/73a799290.html
,kienthuc.net.vn,5 loại cây  hút  vận may nên trồng trước nhà dịp năm mới,https://kienthuc.net.vn/5-loai-cay-hut-van-may-nen-trong-truoc-nha-dip-nam-moi-post1598540.html
,borsaitaliana.it,"T . Rowe Price : lIA entra in una nuova fase , dallentusiasmo ai risultati concreti - PAROLA AL MERCATO",https://www.borsaitaliana.it/borsa/notizie/radiocor/finanza/dettaglio/t-rowe-price-l-ia-entra-in-una-nuova-fase-dall-entusiasmo-ai-risultati-concreti-parola-al-mercato-nRC_10012026_1354_286160371.html
,wnp.pl,Europejski kraj znalazł się na rozdrożu . Może wpaść w ramiona Rosji,"https://www.wnp.pl/bezpieczenstwo/europejski-kraj-znalazl-sie-na-rozdrozu-moze-wpasc-w-ramiona-rosji,1016468.html"
,mallorcadiario.com,Los taxistas piden al Govern que frustre la concesión de 10 . 000 licencias de VTC,https://www.mallorcadiario.com/taxistas-piden-govern-que-frustre-concesion-10-000-licencias-vtc-baleares
,abc.es,"Sale la venta un palacio en el centro de Sevilla que parece sacado de la serie de  Los Bridgerton : tiene piscina , seis plantas y cuesta más de cuatro millones de euros",https://www.abc.es/sevilla/economia/inmobiliario/sale-venta-palacio-centro-sevilla-parece-sacado-20260110124100-nts.html
,dailypolitical.com,"1 , 546 Shares in iShares S & P 100 ETF $OEF Bought by Sonoma Allocations LLC",https://www.dailypolitical.com/2026/01/10/1546-shares-in-ishares-sp-100-etf-oef-bought-by-sonoma-allocations-llc.html
,themarketsdaily.com,Dios Exploration ( CVE : DOS ) Shares Up 40 % – Here What Happened,https://www.themarketsdaily.com/2026/01/10/dios-exploration-cvedos-shares-up-40-heres-what-happened.html
,topagrar.com,Aldi erhöht Eierpreise um 25 %,https://www.topagrar.com/gefluegel/aldi-nord-erhoht-eierpreise-um-25-a-20021903.html
,elboletin.com,El Gobierno plantea aumentar la cesión del IRPF y el IVA a las CCAA en la nueva financiación,https://www.elboletin.com/el-gobierno-plantea-aumentar-la-cesion-del-irpf-y-el-iva-a-las-ccaa-en-la-nueva-financiacion/
,teknoblog.com,Tesla Model Y Standard ve Standard Long Range Avrupa ve Kanadada,https://www.teknoblog.com/tesla-model-y-standard-ve-standard-long-range-avrupa-ve-kanada-da/
,sapo.pt,Moreirense : « Não gosto de me encostar aos pontos que já somei ...»,https://sapo.pt/artigo/moreirense-nao-gosto-de-me-encostar-aos-pontos-que-ja-somei-69624f55ab728f90f0603aa6
,themarketsdaily.com,Dimensional U . S . Targeted Value ETF ( NYSEARCA : DFAT ) Reaches New 52 - Week High – Still a Buy ?,https://www.themarketsdaily.com/2026/01/10/dimensional-u-s-targeted-value-etf-nysearcadfat-reaches-new-52-week-high-still-a-buy.html
,themarketsdaily.com,Parnassus Investments LLC Has $93 . 69 Million Stake in CME Group Inc . $CME,https://www.themarketsdaily.com/2026/01/10/parnassus-investments-llc-has-93-69-million-stake-in-cme-group-inc-cme.html
,newstribune.com,US intercepts fifth sanctioned oil tanker | Jefferson City News Tribune,https://www.newstribune.com/news/2026/jan/10/us-intercepts-fifth-sanctioned-oil-tanker/
,jatim.jpnn.com,"Kerap Lukai Korban , Jambret Spesialis Ibu - Ibu di Kota Batu Akhirnya Tertangkap",https://jatim.jpnn.com/kriminal/42517/kerap-lukai-korban-jambret-spesialis-ibu-ibu-di-kota-batu-akhirnya-tertangkap
,openpr.de,Umsatzrückgang – haderst Du noch oder trainierst Deinen Vertrieb ?,https://www.openpr.de/news/1300543/Umsatzrueckgang-haderst-Du-noch-oder-trainierst-Deinen-Vertrieb.html
,finance.yahoo.com,"If a Stock Market Crash Is Coming in 2026 , There 1 Smart Move for Investors to Make Right Now",https://finance.yahoo.com/news/stock-market-crash-coming-2026-132000971.html
,todomercadoweb.es,Tensión en el Tottenham : comunicado de la afición :  Se percibe un bajón de ambición,https://www.todomercadoweb.es/futbol-internacional/tension-en-el-tottenham-comunicado-de-la-aficion-se-percibe-un-bajon-de-ambicion-534498
,montesclaros.com,"Acordo com o Mercosul , com assinatura no dia 17 , vai abrir um mercado de 450 milhões de consumidores europeus aos produtos brasileiros , como carne e etanol",http://montesclaros.com/noticias.asp?codigo=117162
,20minutos.es,Los agricultores catalanes y gallegos cortan las autovías en protesta por el acuerdo con Mercosur,https://www.20minutos.es/nacional/los-agricultores-catalanes-gallegos-cortan-las-autovias-protesta-por-acuerdo-con-mercosur_6919449_0.html
,wallstreet-online.de,Sapporo Holdings Aktie ( SBW ) | Aktienkurs » JP3320800000,https://www.wallstreet-online.de/aktien/sapporo-holdings-aktie
,dailypolitical.com,Sonoma Allocations LLC Purchases Shares of 606 BlackRock $BLK,https://www.dailypolitical.com/2026/01/10/sonoma-allocations-llc-purchases-shares-of-606-blackrock-blk.html
,elboletin.com,"El Ibex 35 arranca el Día de Reyes con una subida del 0 , 30 % pendiente de Venezuela",https://www.elboletin.com/el-ibex-35-arranca-el-dia-de-reyes-con-una-subida-del-030-pendiente-de-venezuela/
,baomoi.com,CEO Apple Tim Cook nhận thù lao bao nhiêu trong năm 2025 ?,https://baomoi.com/ceo-apple-tim-cook-nhan-thu-lao-bao-nhieu-trong-nam-2025-c54223740.epi
,castanetkamloops.net,We dont have the water : Keremeos water capacity raises questions with meeting B . C . housing requirements,https://www.castanetkamloops.net/news/Penticton/592907/We-don-t-have-the-water-Keremeos-water-capacity-raises-questions-with-meeting-B-C-housing-requirements
,elboletin.com,La subida salarial pactada en convenios supera la inflación en 2025,https://www.elboletin.com/la-subida-salarial-pactada-en-convenios-supera-la-inflacion-en-2025/
,liputan6.com,"Worcas Bangun Kantor di Bali , Bakal Jadi Bangunan Termewah di Nusa Dua",https://www.liputan6.com/bisnis/read/6254735/worcas-bangun-kantor-di-bali-bakal-jadi-bangunan-termewah-di-nusa-dua
,mallorcadiario.com,"Hacienda propone ceder a las CCAA el 55 por ciento del IRPF y el 56 , 5 por ciento del IVA",https://www.mallorcadiario.com/cambios-financiacion-autonomica-hacienda-irpf-iva
,tickerreport.com,ATI ( NYSE : ATI ) Reaches New 52 - Week High – Should You Buy ?,https://www.tickerreport.com/banking-finance/13312793/ati-nyseati-reaches-new-52-week-high-should-you-buy.html
,dailypolitical.com,Vanguard FTSE Europe ETF $VGK Shares Purchased by Tanager Wealth Management LLP,https://www.dailypolitical.com/2026/01/10/vanguard-ftse-europe-etf-vgk-shares-purchased-by-tanager-wealth-management-llp.html
,elboletin.com,Bank of America vaticina que el BCE acabe con los recortes de tipos con una bajada en marzo,https://www.elboletin.com/bank-of-america-vaticina-que-el-bce-acabe-con-los-recortes-de-tipos-con-una-bajada-en-marzo/
,bbv-net.de,Trödelmärkte 2026 in Dorsten : Alle Termine und der 2 . Kumpelmarkt,https://www.bbv-net.de/dorsten/troedelmaerkte-2026-in-dorsten-alle-termine-und-der-2-kumpelmarkt-w982423-6000258018/
,diariolibre.com,Consejos para disfrutar de un 2026 libre de deudas,https://www.diariolibre.com/revista/buena-vida/2026/01/10/consejos-para-disfrutar-de-un-2026-libre-de-deudas/3399695
,kaos911.com,7秒懂 !!,https://www.kaos911.com/html/44e799319.html
,dailynews.com,The most expensive clause in your commercial lease isnt the rent – Daily News,https://www.dailynews.com/2026/01/10/the-most-expensive-clause-in-your-commercial-lease-isnt-the-rent/
,elboletin.com,"Las ayudas públicas bajan en España al 0 , 83 % del PIB en 2023 , según la CNMC",https://www.elboletin.com/las-ayudas-publicas-bajan-en-espana-al-083-del-pib-en-2023-segun-la-cnmc/
,elboletin.com,El Sentix y los dividendos centran la agenda financiera de la jornada,https://www.elboletin.com/el-sentix-y-los-dividendos-centran-la-agenda-financiera-de-la-jornada/
,ndr.de,Landtagswahl MV : CDU - Landeschef Peters tritt als Spitzenkandidat an,"https://www.ndr.de/nachrichten/mecklenburg-vorpommern/landtagswahl-mv-cdu-landeschef-peters-tritt-als-spitzenkandidat-an,cdu-462.html"
,moneycab.com,USA : Michigan - Konsumklima legt kräftig zu - Venezuela - Angriff kaum reflektiert,https://www.moneycab.com/international/usa-michigan-konsumklima-legt-kraeftig-zu-venezuela-angriff-kaum-reflektiert/
,cambridgetimes.ca,"Health Canada , CFIA Recalls January 2026",https://www.cambridgetimes.ca/news/canada-ontario-recalls-food-product-jan-9/article_98069711-3184-5da8-9b5f-fd10cfc7db7a.html
,liputan6.com,"Yen Jepang Menguat , Belanja Barang Mewah Cartier Dkk Langsung Turun",https://www.liputan6.com/bisnis/read/6254264/yen-jepang-menguat-belanja-barang-mewah-cartier-dkk-langsung-turun
,dailypolitical.com,Venturi Wealth Management LLC Has $17 . 61 Million Stock Position in Eli Lilly and Company $LLY,https://www.dailypolitical.com/2026/01/10/venturi-wealth-management-llc-has-17-61-million-stock-position-in-eli-lilly-and-company-lly.html
,deccanchronicle.com,Telangana Aims to Emerge as Global Innovation Capital : Sridhar Babu,https://www.deccanchronicle.com/southern-states/telangana/telangana-aims-to-emerge-as-global-innovation-capital-sridhar-babu-1929611
,elboletin.com,China frena los pedidos de chips H200 de Nvidia pese a la alta demanda,https://www.elboletin.com/china-frena-los-pedidos-de-chips-h200-de-nvidia-pese-a-la-alta-demanda/
,samaa.tv,PM Shehbaz takes notice of export decline,https://www.samaa.tv/2087344417-pm-shehbaz-takes-notice-of-export-decline
,themarketsdaily.com,Alphabet ( NASDAQ : GOOGL ) Sets New 1 - Year High – Here What Happened,https://www.themarketsdaily.com/2026/01/10/alphabet-nasdaqgoogl-sets-new-1-year-high-heres-what-happened.html
,elboletin.com,"El IPC de China repunta al 0 , 8 % en diciembre y marca su mayor alza desde febrero de 2023",https://www.elboletin.com/el-ipc-de-china-repunta-al-08-en-diciembre-y-marca-su-mayor-alza-desde-febrero-de-2023/
,lospiffero.com,"Bergesio ( Lega ), senza garanzie per agroalimentare no Mercosur",https://www.lospiffero.com/ls_article.php?id=94943
,schwaebische.de,Spritpreise : Warum Tanken teurer und teurer wird,https://www.schwaebische.de/wirtschaft/warum-tanken-teurer-und-teurer-wird-4248822
,finanznachrichten.de,Michael Saylor : Bitcoin Volatilität ist der Preis für langfristige Dominanz,https://www.finanznachrichten.de/nachrichten-2026-01/67402778-michael-saylor-bitcoin-volatilitaet-ist-der-preis-fuer-langfristige-dominanz-303.htm
,tickerreport.com,"Kesler Norman & Wride LLC Sells 3 , 258 Shares of RTX Corporation $RTX",https://www.tickerreport.com/banking-finance/13312798/kesler-norman-wride-llc-sells-3258-shares-of-rtx-corporation-rtx.html
,capitalnews.com.br,Acordo Mercosul – União Europeia cria maior zona de livre comércio do mundo | Notícias de Campo Grande e MS,https://www.capitalnews.com.br/politica-e-poder/politica/acordo-mercosuluniao-europeia-cria-maior-zona-de-livre-comercio-do-mundo/434052
,seekingalpha.com,Robotics arise as key new market in tech sector : BNP Paribas ( NVDA : NASDAQ ),https://seekingalpha.com/news/4538110-robotics-arise-as-key-new-market-in-tech-sector-bnp-paribas
,leprogres.fr,Saint - Étienne . Le supermarché Colruyt de la Rivière baissera le rideau définitivement le 24 février,https://www.leprogres.fr/economie/2026/01/10/le-supermarche-colruyt-de-la-riviere-baissera-le-rideau-definitivement-le-24-fevrier
,vetogate.com,قبل إقامته غدًا ، تفاصيل مزاد حكومي ضخم لبيع مركبات النيابات يناير 2026,https://www.vetogate.com/5570504
,dailypolitical.com,Kraken Robotics ( CVE : PNG ) Hits New 12 - Month High – Time to Buy ?,https://www.dailypolitical.com/2026/01/10/kraken-robotics-cvepng-hits-new-12-month-high-time-to-buy.html
,lokmat.com,"२ . ८५ लाख रुपये पगार , ७५ लाखांचं कर्ज आणि २ कोटी रुपयांचं नुकसान ; F & O ट्रेडिंगची  त्याची  भयानक कहाणी",https://www.lokmat.com/business/stock-market/salary-of-rs-2-85-lakh-loan-of-rs-75-lakh-and-loss-of-rs-2-crore-investors-horror-story-of-f-and-o-trading-a-a720/
,desiblitz.com,How Anjel Chakma Killing Puts Spotlight on Racism in India,https://www.desiblitz.com/content/how-anjel-chakmas-killing-puts-spotlight-on-racism-in-india
,bbv-net.de,Chaos auf Schienen und Straßen : Fernverkehr bleibt löchrig,https://www.bbv-net.de/regionales/sturmtief-elli-unfaelle-glaette-schnee-bahn-strassen-w1131055-6000472497/
,news247.gr,10 χρόνια χωρίς τον David Bowie : Πού ήσασταν και πώς νιώσατε όταν μάθατε ότι πέθανε ;,https://www.news247.gr/magazine/culture/10-xronia-xoris-ton-david-bowie-pou-isastan-kai-pos-niosate-otan-mathate-oti-pethane/
,ghanamma.com,Ofori Atta US visa was revoked in July 2025,https://www.ghanamma.com/2026/01/10/ofori-attas-us-visa-was-revoked-in-july-2025/
,irishmirror.ie,Irish farmers take part in rolling protest against Mercosur deal,https://www.irishmirror.ie/news/irish-news/irish-farmers-gather-athlone-major-36529963
,economictimes.indiatimes.com,"Earned Income Tax Credit Refund : The earned Income Tax credit : What it is , who qualifies , and why it matters at tax time",https://economictimes.indiatimes.com/news/international/us/the-earned-income-tax-credit-what-it-is-who-qualifies-and-why-it-matters-at-tax-time/articleshow/126452563.cms
,galatasaray.org,Kupa aşkına herkes salona !,https://www.galatasaray.org/haber/basketbol/kadin-basketbol/kupa-askina-herkes-salona/59271
,themarketsdaily.com,FT Cboe Vest U . S . Equity Moderate Buffer ETF – July $GJUL Shares Acquired by ORG Partners LLC,https://www.themarketsdaily.com/2026/01/10/ft-cboe-vest-u-s-equity-moderate-buffer-etf-july-gjul-shares-acquired-by-org-partners-llc.html
,tempo.co,OJK : Love Scam Jadi Tren Kejahatan Finansial Digital Global,https://www.tempo.co/hukum/ojk-love-scam-jadi-tren-kejahatan-finansial-digital-global-2106061
,finance.sina.com.cn,全球  追星 ！ 我国新增超20万颗申请 ， 马斯克也有大消息|卫星 _ 新浪财经 _ 新浪网,https://finance.sina.com.cn/stock/zqgd/2026-01-10/doc-inhfvsup8708903.shtml
,finance.sina.com.cn,小米17 Air早期模具偷跑 ： 神似双摄版iPhone Air 薄至5 . 5mm,https://finance.sina.com.cn/tech/roll/2026-01-10/doc-inhfvsuk9301315.shtml
,kreisbote.de,Britische Regierung warnt Bürger vor Urlaub in Alpen - Land – auch Deutschland steht auf Liste,http://www.kreisbote.de/welt/britische-regierung-warnt-buerger-vor-urlaub-in-alpen-land-auch-deutschland-steht-auf-liste-zr-94116798.html
,madridiario.es,La Comunidad sale del Consorcio de Casa Árabe alegando dudas sobre su gestión,https://www.madridiario.es/comunidad-madrid-sale-consorciio-casa-arabe-alegando-dudas-gestion
