published_at,source,title,url
,lexpress.fr,Les meilleurs sommiers : comparatif 2026 – LExpress,https://www.lexpress.fr/guide-shopping/meilleur-sommier-GNSNGW6W3JGR7MTT624LGXJORE/
,danas.rs,"Maskirani pred građane , pred huliganima bez fantomki : Zašto Žandarmerija ne sakriva lica kada obezbeđuje utakmice , a to radi na protestima ?",https://www.danas.rs/vesti/drustvo/zandarmerija-fantomke-protest-obezbedjenje-utakmice/
,money.pl,Hybrydowa Toyota Aygo X za prawie 120 tys . zł . Zaskakuje zużyciem paliwa,https://www.money.pl/mobility/hybrydowa-toyota-aygo-x-za-prawie-120-tys-zl-zaskakuje-zuzyciem-paliwa-7284741966866464a.html
,economiadigital.es,El  soplo  de José Elías que le ha costado a Gerard Piqué una multa de 200 . 000 euros,https://www.economiadigital.es/empresas/soplo-jose-elias-ha-costado-gerard-pique-multa-200-000-euros.html
,kacu.org,Oregon most unexpected gubernatorial candidate ? A pencil with a point,https://www.kacu.org/2026-05-11/oregons-most-unexpected-gubernatorial-candidate-a-pencil-with-a-point
,bristolpost.co.uk,Trendy New - York coffee brand to open on Park Street this weekend,https://www.bristolpost.co.uk/whats-on/food-drink/trendy-new-york-coffee-brand-10959786
,tv21.tv,"Procesi i Berlinit , Maqedonia harmonizon tregun me BE - në ! Durmishi : Maqedonia e Veriut model rajonal për masat e punësimit",https://tv21.tv/procesi-i-berlinit-maqedonia-harmonizon-tregun-me-be-ne-durmishi-maqedonia-e-veriut-model-rajonal-per-masat-e-punesimit/
,ebizlatam.com,El fin del plazo fijo : ¿ hacia dónde va el dinero de los argentinos en 2026 ?,https://ebizlatam.com/el-fin-del-plazo-fijo-hacia-donde-va-el-dinero-de-los-argentinos-en-2026/
,wamda.com,Hakeem Health raises $1 . 65 million backed by Merak Capital,https://www.wamda.com/2026/05/hakeem-health-raises-1-65-million-backed-merak-capital
,thailandnews.net,I feel good cinema is all about intention : National Award - winning director Sudhanshu Saria on launching young filmmakers,http://www.thailandnews.net/news/279044479/i-feel-good-cinema-is-all-about-intention-national-award-winning-director-sudhanshu-saria-on-launching-young-filmmakers
,op-online.de,Frauen bekommen 34 Prozent weniger Rente als Männer . Was dahintersteckt .,http://www.op-online.de/wirtschaft/frauen-bekommen-34-prozent-weniger-rente-als-maenner-was-dahintersteckt-zr-94302417.html
,la-croix.com,LEurope aurait tout à gagner dune réconciliation mémorielle avec lAfrique,https://www.la-croix.com/a-vif/l-europe-aurait-tout-a-gagner-dune-reconciliation-memorielle-avec-lafrique-20260511
,local10.com,The Latest : Trump rejects Iran latest response to ceasefire proposal ahead of his trip to China,https://www.local10.com/news/2026/05/11/the-latest-trump-rejects-irans-latest-response-to-ceasefire-proposal-ahead-of-his-trip-to-china/
,notiziediprato.it,Vernio riscopre le sue radici : migliaia di persone allAntica Fiera di San Giuseppe,https://www.notiziediprato.it/attualita/vernio-riscopre-le-sue-radici-migliaia-di-persone-allantica-fiera-di-san-giuseppe/
,finance.yahoo.com,"BOAT is soaring over the Strait of Hormuz blockade , but will it last ?",https://finance.yahoo.com/markets/stocks/articles/boat-soaring-over-strait-hormuz-153833416.html
,hidrocalidodigital.com,La Entidad Cierra Abril Tablas En Empleo | Periodico Hidrocalido Digital,https://www.hidrocalidodigital.com/cierra-abril-tablas-en-empleo/
,cnnindonesia.com,Bos OJK Buka Suara Jelang Pengumuman MSCI Selasa Besok,https://www.cnnindonesia.com/ekonomi/20260511220906-92-1357639/bos-ojk-buka-suara-jelang-pengumuman-msci-selasa-besok
,today.it,Electrolux dimezza la produzione e annuncia 1700 licenziamenti ( su 4mila addetti ),https://www.today.it/economia/electrolux-chiude-licenziamenti.html
,perfil.com,"Una a una , las últimas promociones de bancos y billeteras en el Hot Sale 2026 : 24 cuotas y descuentos de hasta 50 %",https://www.perfil.com/noticias/economia/una-a-una-las-ultimas-promociones-de-bancos-y-billeteras-en-el-hot-sale-2026-24-cuotas-y-descuentos-de-hasta-50-a40.phtml
,tucsonpost.com,Portugal sees strong complementarity with India as EU - India FTA nears completion : Joao Rui Ferreira,http://www.tucsonpost.com/news/279044516/portugal-sees-strong-complementarity-with-india-as-eu-india-fta-nears-completion-joao-rui-ferreira
,g1.globo.com,Entregador é feito refém e van com 91 mercadorias é roubada em Delta,https://g1.globo.com/mg/triangulo-mineiro/noticia/2026/05/11/entregador-do-mercado-livre-e-feito-refem-e-tem-van-com-91-mercadorias-roubada-em-mg.ghtml
,b92.net,Realizovana obuka pripadnika Mađarske vojske u Centru ABHO u Kruševcu,https://www.b92.net/lokal/krusevac/drustvo/232456/realizovana-obuka-pripadnika-madjarske-vojske-u-centru-abho-u-krusevcu/vest
,hkcna.hk,香港醫療展開幕 樂齡 、 AI醫療創新展商增 | 頭條,https://www.hkcna.hk/docDetail.jsp?id=101316461&channel=2803
,it-business.de,Herausforderndes Geschäft mit Komponenten und Peripherie,https://www.it-business.de/herausforderndes-geschaeft-mit-komponenten-und-peripherie-a-89badd21cab830795bd5e1eda9d59010/
,ilfattonisseno.it,"Scuola , sottoscritto il rinnovo del contratto per i dirigenti scolastici",https://www.ilfattonisseno.it/2026/05/scuola-sottoscritto-il-rinnovo-del-contratto-per-i-dirigenti-scolastici/
,cadena3.com,Demócratas se oponen a la propuesta de $1 . 000 millones para salón en Casa Blanca,https://www.cadena3.com/noticia/mundo/democratas-se-oponen-a-la-propuesta-de-1000-millones-para-salon-en-casa-blanca_550117
,dostor.org,سعر العملات اليوم الاثنين 11 - 5 - 2026 في ختام التعاملات,https://www.dostor.org/5550006
,conexaoto.com.br,Banco Central monitora guerra no Oriente Médio para definir próximos passos da Selic,https://conexaoto.com.br/2026/05/11/banco-central-monitora-guerra-no-oriente-medio-para-definir-proximos-passos-da-selic
,iprofesional.com,"Inflación CABA bajó a 2 , 5 por ciento y llevó alivio a comerciantes y consumidores",https://www.iprofesional.com/economia/454501-inflacion-caba-bajo-a-25-por-ciento-y-llevo-alivio-a-comerciantes-y-consumidores
,mdzol.com,"Banco Columbia confirmó la compra la cartera de depósitos , préstamos y sucursales de Efectivo Sí",https://www.mdzol.com/dinero/banco-columbia-confirmo-la-compra-la-cartera-depositos-prestamos-y-sucursales-efectivo-si-n1517569
,ole.com.ar,Joao Cancelo y la marca europea que ni Messi consiguió,https://www.ole.com.ar/futbol-internacional/espana/cancelo-barcelona-realmadrid-messi_0_Ht2qknre1Y.html
,reflector.com,Davidovich Stone Law Group Reports Rising Demand for Landlord Legal Counsel,https://www.reflector.com/news/national/davidovich-stone-law-group-reports-rising-demand-for-landlord-legal-counsel/article_c2353a14-69eb-5877-80d8-ba8490eb6cce.html
,paperjam.lu,Cinq milliards de baisse dimpôts depuis 2024,https://paperjam.lu/article/5-milliards-de-baisses-dimpot-depuis-2024
,op-online.de,Zink aus Industrieabgasen : Selbst das abgelegenste Meer ist nicht mehr unberührt,http://www.op-online.de/welt/zink-aus-industrieabgasen-selbst-das-abgelegenste-meer-ist-nicht-mehr-unberuehrt-zr-94301535.html
,ukrinform.ua,Укренерго просить переглянути тариф на передачу електроенергії,https://www.ukrinform.ua/rubric-economy/4122101-ukrenergo-prosit-pereglanuti-tarif-na-peredacu-elektroenergii.html
,iefimerida.gr,Ποια είναι η εταιρεία « Blackstone » που εξαγοράζει την Skroutz - Τι αλλάζει,https://www.iefimerida.gr/oikonomia/blackstone-skroutz
,news8000.com,"Oil prices rise after Trump rejects Iran latest peace proposal , but US stocks hold steady",https://www.news8000.com/news/politics/national-politics/oil-prices-rise-after-trump-rejects-irans-latest-peace-proposal-but-us-stocks-hold-steady/article_20273207-2a45-5e9c-bcc1-534a24f46fca.html
,economiadigital.es,Mutua Madrileña toma el control total de Seguros del Estado y su filial de Vida en Colombia,https://www.economiadigital.es/empresas/mutua-madrilena-toma-control-colombia.html
,kgou.org,"It not shameful , it savvy : The shoppers redefining how to save money on groceries",https://www.kgou.org/business-and-economy/2026-05-11/its-not-shameful-its-savvy-the-shoppers-redefining-how-to-save-money-on-groceries
,finance.yahoo.com,PTC Inc . ( PTC ) Inc Touted As A Firm That At The Heart Of America Industrial Revolution,https://finance.yahoo.com/markets/stocks/articles/ptc-inc-ptc-inc-touted-151812986.html
,yicai.com,上海主题乐园再上新 ， 国内首个航空科幻IP在临港启动,https://www.yicai.com/news/103175597.html
,larepublica.pe,"MEF aún no define cómo destrabar más de 12 . 000 obras paralizadas en Perú , advierte gremio de construcción",https://larepublica.pe/economia/2026/05/11/mef-aun-no-define-como-destrabar-mas-de-12000-obras-paralizadas-en-peru-advierte-gremio-de-construccion-hnews-284581
,romaniapress.com,Romania : Sphera Franchise Group to bring wagamama restaurants to Romania,https://www.romaniapress.com/news=193178
,aif.ru,Росатом готов дать новому руководству Венгрии ответы по проекту « Пакш - 2 »,https://aif.ru/money/company/rosatom-gotov-dat-novomu-rukovodstvu-vengrii-otvety-po-proektu-paksh-2
,leaderlive.co.uk,MP backs down from Labour leadership bid as Starmer vows to prove doubters wrong,https://www.leaderlive.co.uk/news/national/26095530.mp-backs-labour-leadership-bid-starmer-vows-prove-doubters-wrong/
,european-coatings.com,H . B . Fuller unveils aerospace manufacturing centre of excellence in united states,https://www.european-coatings.com/news/h-b-fuller-unveils-aerospace-manufacturing-centre-of-excellence-in-usa/
,ocregister.com,Trump - Xi summit in China comes with high stakes for Taiwan,https://www.ocregister.com/2026/05/11/trump-xi-summit-taiwan/
,dorzeczy.pl,Zakaz działalności kryptowalut . Kowalski uderza w PiS,https://dorzeczy.pl/opinie/885547/zakaz-dzialalnosci-kryptowalut-kowalski-uderza-w-pis.html
,dagospia.com,Li mortacci di trump e di chi lha votato e sostenuto ! - a causa della guerra in medioriente ...,https://www.dagospia.com/politica/li-mortacci-trump-l-ha-votato-sostenuto-causa-guerra-in-medioriente-473698
,forex.cnfol.com,美伊僵局与油价飙升夹击 ， 美联储6月加息概率升至60 %_ 汇市观察 _ 外汇 _ 中金在线,http://forex.cnfol.com/jingjiyaowen/20260511/32215802.shtml
,romaniapress.com,Romania : Pharmaceutical Group Dona Reaches RON3 . 7B Revenue In 2025,https://www.romaniapress.com/news=193207
,soyacincau.com,MVNO Vibe Mobile taps on U Mobile for 5G services,https://soyacincau.com/2026/05/11/u-mobile-adds-vibe-mobile-as-latest-mvno-partner-for-5g-services/
,economytoday.sigmalive.com,Wall Street : Στάση αναμονής στις αγορές μετά το « όχι » Τραμπ στο Ιράν,https://economytoday.sigmalive.com/wall-street-stasi-anamonis-stis-agores-meta-to-oxi-tramp-sto-iran/
,europacalcio.it,Leao può lasciare il Milan : Napoli e Roma osservano attente,https://www.europacalcio.it/leao-puo-lasciare-il-milan-napoli-e-roma-osservano-attente-368932/
,tanea.gr,Oι αυξήσεις στις τιμές των λιπασμάτων και των αγροεφοδίων πονοκέφαλος για τους παραγωγούς,https://www.tanea.gr/print/2026/05/11/economy/oi-ayksiseis-stis-times-ton-lipasmaton-kai-crton-agroefodion-ponokefalos-gia-tous-paragogous/
,joplinglobe.com,Renee Denton named market president for Missouri / Kansas market for Freeman,https://www.joplinglobe.com/news/renee-denton-named-market-president-for-missouri-kansas-market-for-freeman/article_6b0a9d87-a67f-415d-b5b6-0e9f359c7ad1.html
,vesti.az,Volkswagen и Renault доминируют на автомобильном рынке Европы,https://vesti.az/v-mire/volkswagen-i-renault-dominiruyut-na-avtomobilnom-rynke-evropy-593689
,mortgagesolutions.co.uk,Together appoints Anderson as chief strategy officer and prices second public MBS,https://www.mortgagesolutions.co.uk/specialist-lending/commercial-finance/2026/05/11/together-appoints-anderson-as-chief-strategy-officer-and-prices-second-public-mbs/
,em.com.br,"Kakay e outros advogados deixam defesa de Ciro Nogueira , alvo da PF",http://www.em.com.br/politica/2026/05/7416709-kakay-e-outros-advogados-deixam-defesa-de-ciro-nogueira-alvo-da-pf.html
,lapsi.al,Dua Lipa në betejë ligjore me Samsung,https://lapsi.al/2026/05/11/dua-lipa-ne-beteje-ligjore-me-samsung/
,canoncitydailyrecord.com,Got a bonus at work ? Here what to do first – Canon City Daily Record,https://www.canoncitydailyrecord.com/2026/05/11/got-a-bonus-at-work-heres-what-to-do-first/
,money.pl,Nie otwierajcie drzwi dla chińskich aut . Przemysł z united states apeluje do Trumpa,https://www.money.pl/gospodarka/nie-otwierajcie-drzwi-dla-chinskich-aut-przemysl-z-usa-apeluje-do-trumpa-7284748347746368a.html
,aktiencheck.de,EQS - News : RingConn Gen 3 Smart Ring öffnet für Vorbestellungen : Integriert Erkenntnisse aus der Gefmedizin in bequeme Alltagskleidung ( deutsch ) (),https://www.aktiencheck.de/news/Artikel-EQS_News_RingConn_Gen_3_Smart_Ring_oeffnet_fuer_Vorbestellungen_Integriert_Erkenntnisse_aus_Gefaessmedizin_bequeme_Alltagskleidung_deutsch-19748611
,riviera24.it,"Finanziamenti per le elezioni , Anima :  Piena fiducia nella magistratura",https://www.riviera24.it/2026/05/finanziamenti-elezioni-anima-piena-fiducia-nella-magistratura-962556
,wenxuecity.com,Costco新品炸鸡柳条爆红 ， 美国网友疯狂讨论,https://www.wenxuecity.com/news/2026/05/11/126645455.html
,24tv.ua,"Налог на посылки с Temu и AliExpress - перспектива введения НДС , вырастут ли цены на Тему",https://24tv.ua/business/ru/nalog-na-posylki-s-temu-i-aliexpress-perspektiva-vvedenija-nds-vyrastut-li-ceny-na-temu_n3065897
,lesaffaires.com,Bourse : Wall Street ouvre prudente,https://www.lesaffaires.com/bourse/revue-des-marches/bourse-wall-street-lundi-11-mai/
,sienafree.it,Chianti Lovers Week del Consorzio Chianti Colli Senesi,https://sienafree.it/180968-chianti-lovers-week-del-consorzio-chianti-colli-senesi
,finance.yahoo.com,Gold and Silver Deliveries Escalate – A Warning for Currencies ?,https://finance.yahoo.com/markets/commodities/articles/gold-silver-deliveries-escalate-warning-153643792.html
,dailypolitical.com,Star Bulk Carriers ( NASDAQ : SBLK ) Sets New 52 - Week High – Here What Happened,https://www.dailypolitical.com/2026/05/11/star-bulk-carriers-nasdaqsblk-sets-new-52-week-high-heres-what-happened.html
,edaily.co.kr,월가 베테랑 야데니  기업 실적 놀라워 … S & P500 8000 넘는다,https://www.edaily.co.kr/News/Read?newsId=05867926645447936&mediaCodeNo=257
,diariodesevilla.es,Dardo de Monchi al Sevilla FC :  Voy al lugar donde me han mostrado su cariño desde el minuto uno,https://www.diariodesevilla.es/sevillafc/dardo-monchi-sevilla-fc-firmar-espanyol-lugar-carino-minuto_0_2006741052.html
,pronedra.ru,Мировая переработка нефти может упасть на 20 % к 2035 году,https://pronedra.ru/pererabotka-nefti-pojdet-na-spad-k-2035-godu-sokrashhenie-mozhet-sostavit-20-817636.html
,israelherald.com,When titans talk : Whats at stake for Trumps China visit,http://www.israelherald.com/news/279044332/when-titans-talk-whats-at-stake-for-trumps-china-visit
,newsbeast.gr,"Δημοσκόπηση Opinion Poll : Ισχυρό χαρτί για την κυβέρνηση η εξωτερική πολιτική – Τι λένε οι πολίτες για Τουρκία , Πούτιν , Νετανιάχου",https://www.newsbeast.gr/politiki/arthro/13089731/opinion-poll-ischyro-charti-gia-tin-kyvernisi-i-exoteriki-politiki-ti-lene-oi-polites-gia-tourkia-symmachies-poutin-netaniachou
,rtl.nl,Winstmarges pomphouders schieten hard op en neer sinds oorlog in Iran,https://www.rtl.nl/nieuws/economie/artikel/5600323/winstmarges-pomphouders-hard-op-en-neer-door-hoge-olieprijs
,thewrap.com,Baywatch  Reboot Will Premiere on Fox in January,https://www.thewrap.com/media-platforms/tv/fox-baywatch-premiere-the-interrogator-marriage-market/
,index.hr,Jakovina uzvratio Tadiću :  Zašto su ustaše i četnici zajedno odlazili u istom smjeru ?,https://www.index.hr/vijesti/clanak/jakovina-uzvratio-tadicu-zasto-su-ustase-i-cetnici-zajedno-odlazili-u-istom-smjeru/2790951.aspx?index_tid=1017706&index_ref=naslovnica_vijesti_najnovije_d
,lrytas.lt,Karas Irane padėjo susikrauti milijardinius pelnus : štai kurioms kompanijoms jis yra naudingiausias,https://www.lrytas.lt/verslas/rinkos-pulsas/2026/05/11/news/karas-irane-padejo-susikrauti-milijardinius-pelnus-stai-kurioms-kompanijoms-jis-yra-naudingiausias-42347025/
,insurancejournal.com,Shein Accuses Temu of  Industrial Scale  Copyright Breaches in united kingdom Legal Battle,https://www.insurancejournal.com/news/international/2026/05/11/869342.htm
,diariodesevilla.es,"Sevilla , en el top 10 de las ciudades con el mercado inmobiliario más saturado : Los precios crecen en todos los barrios",https://www.diariodesevilla.es/sevilla/sevilla-top-10-ciudades-mercado-imobiliario-saturado-precios_0_2006740662.html
,tribunnews.com,"Iran Tercekik , Warga Diimbau Hemat BBM dan Listrik Gegara Blokade AS",https://www.tribunnews.com/internasional/7828303/iran-tercekik-warga-diimbau-hemat-bbm-dan-listrik-gegara-blokade-as
,canoncitydailyrecord.com,Younger Americans more pessimistic than older ones on job market : poll,https://www.canoncitydailyrecord.com/2026/05/11/job-market-poll/
,chathamdailynews.ca,Even $125K income not enough to comfortably buy average London home,https://www.chathamdailynews.ca/news/even-125k-income-not-enough-to-comfortably-buy-average-london-home/wcm/f834aaac-e4de-4f5c-b17e-bd0b1c50488e
,egyptindependent.com,Saudi Arabia oil giant gets boost from higher crude prices,https://www.egyptindependent.com/saudis-arabias-oil-giant-gets-boost-from-higher-crude-prices/
,finance.yahoo.com,Teradyne ( TER ) Could Be In The Next Phase Of AI Investing,https://finance.yahoo.com/markets/stocks/articles/teradyne-ter-could-next-phase-152537923.html
,cafebiz.vn,Thứ quả rừng từng rẻ như cho nay giá vọt lên 350 . 000đ / kg :  Đệ nhất gia vị  được dân sành ăn săn lùng,https://cafebiz.vn/thu-qua-rung-tung-re-nhu-cho-nay-gia-vot-len-350000d-kg-de-nhat-gia-vi-duoc-dan-sanh-an-san-lung-176260511210306095.chn
,haber61.net,Trabzonspor - Gençlerbirliği maçının biletleri satışa çıkıyor,https://www.haber61.net/trabzonspor/son-dakika-trabzonspor-genclerbirligi-macinin-biletleri-satisa-cikiyor-h631996.html
,ara.cat,El Govern constitueix el patronat del primer centre de xips avançats de Catalunya,https://www.ara.cat/economia/tecnologia/govern-constitueix-patronat-centre-xips-avancats-catalunya_1_5733617.html
,sinmordaza.com,Santa Fe fortalece su perfil industrial y logístico frente al auge minero,https://sinmordaza.com/noticia/504784-santa-fe-fortalece-su-perfil-industrial-y-logistico-frente-al-auge-minero.html
,andaluciainformacion.es,Por Andalucía aplicará la Ley de Precios Justos para garantizar precios justos en el campo,https://www.andaluciainformacion.es/articulo/elecciones-andalucia-17-mayo/andalucia-aplicara-ley-precios-justos-garantizar-precios-justos-campo/202605111712213257487.html
,perfil.com,Un municipio de Japón subsidia el uso de apps de citas,https://www.perfil.com/noticias/internacional/un-municipio-de-japon-subsidia-el-uso-de-apps-de-citas-modof.phtml
,lrt.lt,Skrydžių taisyklių pokyčiai : ką reikia žinoti keliaujant ?,https://www.lrt.lt/naujienos/verslas/4/2922323/skrydziu-taisykliu-pokyciai-ka-reikia-zinoti-keliaujant
,dailybusiness.ro,Parlamentul European aprobă măsuri pentru femeile antreprenor din mediul rural . Acces mai ușor la finanțare și recunoașterea muncii în ferme,https://www.dailybusiness.ro/actualitate/parlamentul-european-aproba-masuri-pentru-femeile-antreprenor-din-mediul-rural-acces-mai-usor-la-finantare-si-recunoasterea-muncii-in-ferme-540746/
,money.pl,BGK będzie musiał przekazywać wolne środki do MF . Jest podpis prezydenta,https://www.money.pl/finanse/bgk-bedzie-musial-przekazywac-wolne-srodki-do-mf-jest-podpis-prezydenta-7284786346940448a.html
,dailypolitical.com,Truist Financial Increases Olin ( NYSE : OLN ) Price Target to $26 . 00,https://www.dailypolitical.com/2026/05/11/truist-financial-increases-olin-nyseoln-price-target-to-26-00.html
,cafebiz.vn,Con phố bị  bỏ quên  giữa trung tâm Hải Phòng,https://cafebiz.vn/con-pho-bi-bo-quen-giua-trung-tam-hai-phong-176260511192651393.chn
,edaily.co.kr,"메이저 양분하는 셰플러 · 매킬로이 , PGA 챔피언십은 누가 품을까",https://www.edaily.co.kr/News/Read?newsId=01082406645448264&mediaCodeNo=257
,businessworld.in,The Brand Is Currently Delivering 56 % Year - on - year Growth,https://www.businessworld.in/article/the-brand-is-currently-delivering-56-year-on-year-growth-606278
,op-online.de,Jobcenter - Mitarbeiter schildern Alltag beim Bürgergeld : „ Macht uns sprachlos,http://www.op-online.de/verbraucher/jobcenter-mitarbeiter-schildern-alltag-beim-buergergeld-macht-uns-sprachlos-zr-94302335.html
,it.euronews.com,Starmer vuole  la Gran Bretagna al centro dellEuropa  per rimontare nei sondaggi,https://it.euronews.com/my-europe/2026/05/11/starmer-vuole-la-gran-bretagna-al-centro-delleuropa-per-rimontare-nei-sondaggi
,turku.fi,Kaupunginhallitus käsitteli 11 . 5 . osavuosikatsausta ja raitiotiehankkeen arviointiraportin selvitystä,https://www.turku.fi/ajankohtaista/kaupunginhallitus-kasitteli-115-osavuosikatsausta-ja-raitiotiehankkeen
,energyandcapital.com,"The $6 , 000 Case for Gold Still Holds … Here Why",https://www.energyandcapital.com/the-6000-case-for-gold-still-holds-heres-why/
,businessworld.in,Cyient Semiconductors Enters GaN Power Chip Market With Navitas Technology,https://www.businessworld.in/article/cyient-semiconductors-enters-gan-power-chip-market-with-navitas-technology-606323
,money.pl,"30 zespołów negocjacyjnych w akcji . Ujawniają , co się dzieje ws . SAFE",https://www.money.pl/gospodarka/30-zespolow-negocjacyjnych-w-akcji-ujawniaja-co-sie-dzieje-ws-safe-7284730942613536a.html
,mobilesyrup.com,ASUS Zenbook A14 now available in Canada,https://mobilesyrup.com/2026/05/11/asus-zenbook-a14-now-available-in-canada/
,boursorama.com,Moyen - Orient : les marchés en repli stratégique en labsence daccord - 11 / 05 / 2026 à 16 : 22,https://www.boursorama.com/bourse/actualites/moyen-orient-les-marches-en-repli-strategique-en-l-absence-d-accord-ba303b5e26d3ad32971f80e8f537638b
,miningmx.com,Barrick launches $3bn buyback ahead of spin - off,https://www.miningmx.com/top-story/65231-barrick-launches-3bn-buyback-ahead-of-spin-off/
,finanznachrichten.de,"Wall Street im Rekordrausch : DAX , Nasdaq , Öl , Silber , Bitcoin & Einzelaktien im großen Wochencheck",https://www.finanznachrichten.de/nachrichten-2026-05/68459217-wall-street-im-rekordrausch-dax-nasdaq-oel-silber-bitcoin-einzelaktien-im-grossen-wochencheck-268.htm
,lapauseinfo.fr,Ma maison a pris +100 % de valeur en 2 ans : 9 petits travaux que tout le monde peut faire,https://lapauseinfo.fr/ma-maison-a-pris-100-de-valeur-en-2-ans-9-petits-travaux-que-tout-le-monde-peut-faire/
,bangka.tribunnews.com,"Target PDAM Tirta Bangka di 2026 , Pendapatan Tembus Rp7 Miliar dan Rencana Bangun AMDK",https://bangka.tribunnews.com/lokal/1684195/target-pdam-tirta-bangka-di-2026-pendapatan-tembus-rp7-miliar-dan-rencana-bangun-amdk
,eldestapeweb.com,"Inflación de abril en CABA : a días del dato del INDEC , así dio en Ciudad el IPC",https://www.eldestapeweb.com/economia/la-inflacion-portena-arrojo-un-2-5-en-abril-y-acumulo-un-11-6-en-cuatro-meses-2026511113718
,mdzol.com,"La inflación en la Ciudad de Buenos Aires desaceleró hasta el 2 , 5 %",https://www.mdzol.com/dinero/la-inflacion-la-ciudad-buenos-aires-desacelero-el-25-n1517589
,paperjam.lu,LIrlande veut rejoindre laccord Benelux sur les diplômes,https://paperjam.lu/article/lirlande-veut-rejoindre-laccord-benelux-sur-les-diplomes
,motoryzacja.interia.pl,Zapasy ropy na świecie spadają . Możliwy wzrost cen paliw - Motoryzacja w INTERIA . PL,"https://motoryzacja.interia.pl/wiadomosci/news-rezerwy-ropy-topnieja-w-rekordowym-tempie-kierowcy-odczuja-t,nId,23476068"
,tradingsat.com,Wall Street : Wall Street se cherche une tendance après six semaines consécutives de gains,https://www.tradingsat.com/actualites/marches-financiers/wall-street-wall-street-se-cherche-une-tendance-apres-six-semaines-consecutives-de-gains-1162566.html
,163.com,OPPO Find X10 Pro Max还在AB测试 ， 网友 ： 摇摆不定的旗舰 ！,https://www.163.com/dy/article/KSMCQFJE05503WTT.html
,24tv.ua,Новый Apple Vision Pro придется ждать годами – Apple сменила приоритеты,https://24tv.ua/tech/ru/novyj-apple-vision-pro-pridetsja-zhdat-godami-apple-smenila-prioritety_n3065921
,mdzol.com,Rehabilitación kinesiológica de PAMI : quiénes pueden acceder y qué se necesita,https://www.mdzol.com/sociedad/rehabilitacion-kinesiologica-pami-quienes-pueden-acceder-y-que-se-necesita-n1517555
,larepublica.pe,Familiar de un comerciante en Santa Anita intentó robar caja fuerte con S / 100 . 000 : fue detenido junto a otros sujetos,https://larepublica.pe/sociedad/2026/05/11/familiar-de-un-comerciante-en-santa-anita-intento-robar-caja-fuerte-con-s100000-fue-detenido-junto-a-otros-sujetos-962709
