title,title_en,source,url,published_at,language,section
截至去年末中国独角兽企业达376家 总量稳步扩容,"As of the end of last year, China had 376 unicorn companies with the total steadily expanding",baijiahao.baidu.com,https://baijiahao.baidu.com/s?id=1870922218767073002,,Chinese,Other
10万块买近5米大六座 ？ 星光L上市 ， 把  不可能  变成选择题 - 新浪汽车,"100,000 yuan for a nearly 5-meter large 6-seater? Starlight L launched, turning the impossible into a choice - Sina Auto",k.sina.com.cn,https://k.sina.com.cn/article_1095802822_41509fc602701c5o2.html,,Chinese,Other
Frigerio anunció un seguro multirriesgo destinado a la producción de maíz,Frigerio announced multi-risk insurance for corn production,diarioelargentino.com,https://diarioelargentino.com/provincia/frigerio-anuncio-un-seguro-multirriesgo-destinado-a-la-produccion-de-maiz.htm,,Spanish,Other
美籲全球抗極左恐怖主義 盧比歐會後宣布簽證限制 - 國際,"U.S. calls on world to fight far-left terrorism, Rubio announces visa restrictions after meeting - International",news.cts.com.tw,https://news.cts.com.tw/cna/international/202607/202607173056396.html,,Chinese,Other
Halderman update : Ag real estate market shows signs of softening,Halderman update: Ag real estate market shows signs of softening,agrinews-pubs.com,https://www.agrinews-pubs.com/business/2026/07/16/halderman-update-ag-real-estate-market-shows-signs-of-softening/,,English,Other
AI股跌美股下挫 投顧 ： 關注法說後台積電股價 | 證券,"AI stocks fall, U.S. stocks drop; investment advisor: watch TSMC stock price after earnings call | Securities",cna.com.tw,https://www.cna.com.tw:443/news/afe/202607170027.aspx,,Chinese,Earnings & Guidance
三部门部署加快推进海水淡化产业高质量发展,Three departments deploy to accelerate high-quality development of the seawater desalination industry,dangjian.cn,http://www.dangjian.cn/djyw/2026/07/17/detail_202607177835329.html,,Chinese,Other
Colo Colo y los millones que debe ofrecer para firmar a Vozinha,Colo Colo and the millions it must offer to sign Vozinha,redgol.cl,https://redgol.cl/colocolo/cuanto-dinero-sueldo-ofrece-colo-colo-vozinha-fichaje-libre-inter-miami,,Spanish,Other
Restorani na obali poluprazni .  To se vidi . Mislili smo da ovako možemo vječno,Restaurants on the coast half empty. It shows. We thought we could go on like this forever,index.hr,https://www.index.hr/vijesti/clanak/restorani-na-obali-poluprazni-to-se-vidi-mislili-smo-da-ovako-mozemo-vjecno/2813856.aspx?index_ref=homepage_comment_box_d&commentId=11575723,,Croatian,Other
一天上市7款车 ： 大家嘴上说不愿卷 ， 脚却不愿停,"Seven cars launched in one day: everyone says they don't want to compete, but their feet won't stop",finance.ifeng.com,https://finance.ifeng.com/c/8upKDreEs6X,,Chinese,Other
10万级唯一大六座SUV ， 星光L上市10 . 98万起,"The only large 6-seater SUV in the 100,000-class, Starlight L launched from 109,800 yuan",k.sina.com.cn,https://k.sina.com.cn/article_5151738923_133114c2b02701r6mu.html,,Chinese,Other
直击WAIC ： 机器人  干活 ， 智能体  用脑 ， AI加速迈向物理世界 _ 新浪财经 _ 新浪网,"Live from WAIC: Robots 'work', intelligent agents 'think', AI accelerates into the physical world _ Sina Finance _ Sina.com",finance.sina.com.cn,https://finance.sina.com.cn/jjxw/2026-07-17/doc-iniianxh4114049.shtml,,Chinese,AI & Technology
Telix Completes Patient Enrollment in TLX591 - Px ( Illuccix ) Japan Phase 3 Study,Telix Completes Patient Enrollment in TLX591-Px (Illuccix) Japan Phase 3 Study,vietnamtribune.com,http://www.vietnamtribune.com/news/279192331/telix-completes-patient-enrollment-in-tlx591-px-illuccix-japan-phase-3-study,,English,Other
津台产业对接擦出新火花,Tianjin-Taiwan industrial matchmaking sparks new opportunities,baijiahao.baidu.com,https://baijiahao.baidu.com/s?id=1870921808228913381,,Chinese,Geopolitics
"Dazi united states , Brasile stima impatto su export per 7 , 4 miliardi di dollari - America Latina","U.S. tariffs, Brazil estimates impact on exports of 7.4 billion dollars - Latin America",ansa.it,https://www.ansa.it/sito/notizie/mondo/americalatina/2026/07/17/dazi-usa-brasile-stima-impatto-su-export-per-74-miliardi-di-dollari_148be52c-3b67-4f3d-8a54-d87438c8617c.html,,Italian,Other
Dans la Somme avec Remi Cardon,In the Somme with Remi Cardon,publicsenat.fr,https://www.publicsenat.fr/emission/manger-cest-voter/dans-la-somme-avec-remi-cardon-e3,,French,Other
Ronald Sanabria sought to make tourism more sustainable,Ronald Sanabria sought to make tourism more sustainable,news.mongabay.com,https://news.mongabay.com/2026/07/ronald-sanabria-sought-to-make-tourism-more-sustainable/,,English,Other
Экс - главу модельного агентства Elite Мари вновь обвинили в изнасилованиях,Ex-head of Elite model agency Marie accused of rape again,news.mail.ru,https://news.mail.ru/society/71662120/,,Russian,Other
Deudas empujan renuncias : empleados con mal crédito triplican riesgo de irse,Debts push resignations: employees with bad credit triple their risk of leaving,publimetro.com.mx,https://www.publimetro.com.mx/noticias/2026/07/16/deudas-empujan-renuncias-empleados-con-mal-credito-triplican-riesgo-de-irse/,,Spanish,Other
Energichef : Situationen i Hormuzstrædet truer forsyningssikkerheden,Energy chief: Situation in the Strait of Hormuz threatens supply security,bt.dk,https://www.bt.dk/udland/energichef-situationen-i-hormuzstraedet-truer-forsyningssikkerheden,,Danish,Energy
El Obispo de Jujuy alertó sobre las adicciones : Hay un caso de consumo casa de por medio,The Bishop of Jujuy warned about addictions: There is a case of consumption in every other house,jujuyalmomento.com,https://www.jujuyalmomento.com/obispo-jujuy/el-obispo-jujuy-alerto-las-adicciones-hay-un-caso-consumo-casa-medio-n204594,,Spanish,Other
PYMNTS | Citadel Securities Takes $400 Million Stake in Crypto . com,PYMNTS | Citadel Securities Takes $400 Million Stake in Crypto.com,pymnts.com,https://www.pymnts.com/cryptocurrency/2026/citadel-securities-takes-400-million-dollar-stake-cryptocom/,,English,Other
台股開盤 ／ 台積電跌85元拖累 ！ 大盤開盤重挫逾1700點 AI股全面倒地 | 財經,"Taiwan stock market opens/TSMC drops 85 yuan dragging it down! Market opens with a plunge of over 1700 points, AI stocks all fall | Finance",setn.com,https://www.setn.com/news/1873853,,Chinese,AI & Technology
TCL电子 ： 拟收购TCL空调,TCL Electronics: intends to acquire TCL Air Conditioner,finance.ifeng.com,https://finance.ifeng.com/c/8upCPq0cvw6,,Chinese,Other
"Kris Jenner net worth 2026 : How the Kardashian  Momager  built a USD 170 million empire , from businesses to reality TV success","Kris Jenner net worth 2026: How the Kardashian 'Momager' built a USD 170 million empire, from businesses to reality TV success",timesofindia.indiatimes.com,https://timesofindia.indiatimes.com/entertainment/english/hollywood/news/kris-jenner-net-worth-2026-how-the-kardashian-momager-built-a-usd-170-million-empire-from-businesses-to-reality-tv-success/articleshow/132450381.cms,,English,Other
Workers face fresh cost of living squeeze says new report | Clacton and Frinton Gazette,Workers face fresh cost of living squeeze says new report | Clacton and Frinton Gazette,clactonandfrintongazette.co.uk,https://www.clactonandfrintongazette.co.uk/news/national/uk-today/26285169.workers-face-fresh-cost-living-squeeze-says-new-report/,,English,Other
"Banco Bilbao Viscaya Argentaria Maps Growth Risks as Spain , Mexico and Turkey Diverge","Banco Bilbao Viscaya Argentaria Maps Growth Risks as Spain, Mexico and Turkey Diverge",finance.yahoo.com,https://finance.yahoo.com/economy/articles/banco-bilbao-viscaya-argentaria-maps-010217605.html,,English,Other
Esquecimento deixa de ser normal diante de sinais que exigem avaliao médica,Forgetfulness is no longer normal in the face of signs that require medical evaluation,acritica.com,https://www.acritica.com/saude/esquecimento-deixa-de-ser-normal-diante-de-sinais-que-exigem-avaliac-o-medica-1.410005,,Portuguese,Other
Constellation Software Inc . Announces Conference Call to Discuss Second Quarter Results,Constellation Software Inc. Announces Conference Call to Discuss Second Quarter Results,itnewsonline.com,https://www.itnewsonline.com/GlobeNewswire/Constellation-Software-Inc.-Announces-Conference-Call-to-Discuss-Second-Quarter-Results/126659,,English,Other
Jon Coupal : Prop . 13 richly funds local governments while protecting taxpayers,Jon Coupal: Prop. 13 richly funds local governments while protecting taxpayers,dailybulletin.com,https://www.dailybulletin.com/2026/07/16/jon-coupal-prop-13-richly-funds-local-governments-while-protecting-taxpayers/,,English,Other
"Vinitaly and the City mette radici in Calabria : la conferma di Sibari , lesordio di Reggio","Vinitaly and the City takes root in Calabria: confirmation of Sibari, the debut of Reggio",quotidianodelsud.it,https://www.quotidianodelsud.it/calabria/societa-e-cultura/liniziativa/2026/07/16/vinitaly-and-the-city-mette-radici-in-calabria-la-conferma-di-sibari-lesordio-di-reggio,,Italian,Other
华夏中证科创创业人工智能ETF ( 588510 ) 已连续4日获得资金净申购 ， 区间净流入额2558 . 78万元,"China AMC SSE STAR Market Innovation and Entrepreneurship AI ETF (588510) has seen net capital inflows for 4 consecutive days, with a net inflow of 25.5878 million yuan during the period",finance.sina.com.cn,https://finance.sina.com.cn/money/fund/aiassistant/etfshzj/2026-07-17/doc-iniianxk1276636.shtml,,Chinese,AI & Technology
"Dua Tahun Kaki Dirantai di Kamar Lembab , JSC Dinsos Jatim Evakuasi Remaja ODGJ","Two Years Chained by the Foot in a Damp Room, East Java Social Service JSC Evacuates Teenager with Mental Disorder",beritajatim.com,https://beritajatim.com/dua-tahun-kaki-dirantai-di-kamar-lembab-jsc-dinsos-jatim-evakuasi-remaja-odgj,,Indonesian,Other
Nutrien Announces Release Dates for Second Quarter 2026 Results and Conference Call,Nutrien Announces Release Dates for Second Quarter 2026 Results and Conference Call,montrealgazette.com,https://montrealgazette.com/press-releases/business-wire/nutrien-announces-release-dates-for-second-quarter-2026-results-and-conference-call/,,English,Other
7月16日华安中证科创创业人工智能ETF ( 588470 ) 获净申购576 . 18万元 ， 位居当日股票ETF净流入排名293 / 1268,"On July 16, HuaAn SSE STAR Market Innovation and Entrepreneurship AI ETF (588470) received a net subscription of 5.7618 million yuan, ranking 293/1268 in net inflows of stock ETFs for the day",finance.sina.com.cn,https://finance.sina.com.cn/money/fund/aiassistant/etfshzj/2026-07-17/doc-iniianxm8052681.shtml,,Chinese,AI & Technology
"After years of false claims on voting , Trump to give an address on election integrity","After years of false claims on voting, Trump to give an address on election integrity",wxpr.org,https://www.wxpr.org/2026-07-16/after-years-of-false-claims-on-voting-trump-to-give-an-address-on-election-integrity,,English,Geopolitics
Union Bank of India ( BOM : 532477 ) Q1 2027 Earnings Call Highlights : Record Profit and Strategic ...,Union Bank of India (BOM: 532477) Q1 2027 Earnings Call Highlights: Record Profit and Strategic ...,finance.yahoo.com,https://finance.yahoo.com/markets/stocks/articles/union-bank-india-bom-532477-010132956.html,,English,Earnings & Guidance
En Colo Colo le abren las puertas del Monumental a Vozinha,In Colo Colo they open the doors of the Monumental to Vozinha,redgol.cl,https://redgol.cl/colocolo/ex-colo-colo-le-abre-las-puertas-del-monumental-a-vozinha-como-marketing-me-parece-muy-bueno,,Spanish,Other
"Albany County Sheriff , Laramie Police To Help Out During CFD","Albany County Sheriff, Laramie Police To Help Out During CFD",kingfm.com,https://kingfm.com/ixp/99/p/frontier-days-law-enforcement-planning/,,English,Other
Sếp Viettel :  Chúng tôi mất 11 năm đi xin cơ chế tiền lương đặc thù,Viettel boss: We spent 11 years asking for a special salary mechanism,baomoi.com,https://baomoi.com/sep-viettel-chung-toi-mat-11-nam-di-xin-co-che-tien-luong-dac-thu-c55633023.epi,,Vietnamese,Other
Trump to address election security in primetime speech,Trump to address election security in primetime speech,wvtm13.com,https://www.wvtm13.com/article/trump-to-address-election-security-in-primetime-speech/72829380,,English,Geopolitics
"Petrolio , il crollo del trimestre visto dal trader : volatilità , segnali tecnici e la trappola dei rimbalzi","Oil, the quarterly crash seen by the trader: volatility, technical signals and the rebound trap",radiortm.it,https://www.radiortm.it/2026/07/16/petrolio-il-crollo-del-trimestre-visto-dal-trader-volatilita-segnali-tecnici-e-la-trappola-dei-rimbalzi/,,Italian,Energy
"Breaking news live updates , July 17 :  Will release evidence of foreign interference in US election : Trump in address to nation","Breaking news live updates, July 17: Will release evidence of foreign interference in US election: Trump in address to nation",timesofindia.indiatimes.com,https://timesofindia.indiatimes.com/india/breaking-news-live-updates-july-17/liveblog/132450243.cms,,English,Geopolitics
Mamdani ripped over  freak show  news conference where eviction was declared a form of  violence,Mamdani ripped over 'freak show' news conference where eviction was declared a form of 'violence',yahoo.com,https://www.yahoo.com/news/politics/articles/mamdani-ripped-over-freak-show-193907694.html,,English,Other
Trump teleprompter operator faces investigation over Kalshi bets on White House statements,Trump teleprompter operator faces investigation over Kalshi bets on White House statements,shacknews.com,https://www.shacknews.com/article/150051/trump-teleprompter-operator-kalshi-predictive-market-white-house,,English,Other
한 달간 7조원 빨아들인  삼전닉스  레버리지 ... 금융위 보완책 통할까 - 경제ㅣ한국일보,'Samjeonnix' leverage absorbs 7 trillion won in a month... Will the Financial Services Commission's supplementary measures work? - Economy | Hankook Ilbo,hankookilbo.com,https://www.hankookilbo.com/news/article/A2026071709050003060,,Korean,Other
"Rilis 800 Juta Saham , HATM Siap Gelar Private Placement","Releasing 800 Million Shares, HATM Ready to Hold Private Placement",insight.kontan.co.id,https://insight.kontan.co.id/news/rilis-800-juta-saham-hatm-siap-gelar-private-placement,,Indonesian,Other
美國俄州AI數據中心崛起 台灣AI伺服器合作潛力大 | 產經,"AI data centers rise in Ohio, U.S.; great potential for cooperation with Taiwan AI servers | Industry & Economy",cna.com.tw,https://www.cna.com.tw:443/news/afe/202607170018.aspx,,Chinese,AI & Technology
Autoridades estadounidenses anuncian nueva política de restricción de visas,U.S. authorities announce new visa restriction policy,sandiegored.com,https://www.sandiegored.com/noticia/autoridades-estadounidenses-anuncian-nueva-politica-de-restriccion-de-visas/,,Spanish,Other
SpaceX Aktie : Flight 13 am Donnerstag um 18 : 45 Uhr,SpaceX Stock: Flight 13 on Thursday at 18:45,stock-world.de,https://www.stock-world.de/spacex-aktie-flight-13-am-donnerstag-um-1845-uhr/,,German,Other
Non - party - endorsed candidates surpass competitors in cash for US Senate primaries,Non-party-endorsed candidates surpass competitors in cash for US Senate primaries,wctrib.com,https://www.wctrib.com/news/minnesota/non-party-endorsed-candidates-surpass-competitors-in-cash-for-us-senate-primaries,,English,Other
Ο Τραμπ απευθύνεται στο έθνος : Τι αναμένεται να πει στο διάγγελμα του – Δείτε live,Trump addresses the nation: What he is expected to say in his address – Watch live,newsbeast.gr,https://www.newsbeast.gr/world/arthro/13241205/o-trab-apefthynetai-sto-ethnos-ti-anamenetai-na-pei-sto-diangelma-tou-deite-live,,Greek,Other
李强同柬埔寨首相洪玛奈会谈,Li Qiang holds talks with Cambodian Prime Minister Hun Manet,dangjian.cn,http://www.dangjian.cn/djyw/2026/07/17/detail_202607177835338.html,,Chinese,Other
Kasama Mo Mangarap : New GCash Stories film celebrates second chances with lawyer Sheila Gomez,Kasama Mo Mangarap: New GCash Stories film celebrates second chances with lawyer Sheila Gomez,philstar.com,https://www.philstar.com/lifestyle/business-life/2026/07/17/2542580/kasama-mo-mangarap-new-gcash-stories-film-celebrates-second-chances-lawyer-sheila-gomez,,English,Other
"Membunuh  Industri Hasil Tembakau ,  Indonesia Bukan Lab Agenda Global","Killing the Tobacco Industry, Indonesia is Not a Lab for the Global Agenda",kaltim.tribunnews.com,https://kaltim.tribunnews.com/opini/1157177/membunuh-industri-hasil-tembakauindonesia-bukan-lab-agenda-global,,Indonesian,Other
Circuito audiovisual fortalece acesso à cultura em Borba com atividades gratuitas,Audiovisual circuit strengthens access to culture in Borba with free activities,acritica.com,https://www.acritica.com/entretenimento/circuito-audiovisual-fortalece-acesso-a-cultura-em-borba-com-atividades-gratuitas-1.410039,,Portuguese,Other
TSMC Just Announced Fantastic News for Nvidia Shareholders,TSMC Just Announced Fantastic News for Nvidia Shareholders,fool.com,https://www.fool.com/investing/2026/07/16/tsmc-just-announced-fantastic-news-for-nvidia-shar/?source=iedfolrf0000001,,English,Semiconductors
Australia backs new AI office as tech leaders urge standards,Australia backs new AI office as tech leaders urge standards,channellife.com.au,https://channellife.com.au/story/australia-backs-new-ai-office-as-tech-leaders-urge-standards,,English,AI & Technology
Три причины тренда на поступление в колледж : почему школьники выпускаются после 9 класса,Three reasons for the trend of enrolling in college: why students graduate after 9th grade,news.mail.ru,https://news.mail.ru/society/71662150/,,Russian,Other
Trump teleprompter operator on unpaid leave for alleged prediction market bets on Trump speeches,Trump teleprompter operator on unpaid leave for alleged prediction market bets on Trump speeches,wtop.com,https://wtop.com/white-house/2026/07/trumps-teleprompter-operator-on-unpaid-leave-for-alleged-prediction-market-bets-on-trump-speeches/,,English,Other
"Hãy theo đuổi ước mơ của bạn ,  vũ trụ sẽ lắng nghe  những trái tim ngoan cường","Follow your dreams, 'the universe will listen' to resilient hearts",baomoi.com,https://baomoi.com/hay-theo-duoi-uoc-mo-cua-ban-vu-tru-se-lang-nghe-nhung-trai-tim-ngoan-cuong-c55633060.epi,,Vietnamese,Other
Experts detail issues Springfield must grapple with as housing plan takes shape,Experts detail issues Springfield must grapple with as housing plan takes shape,wamc.org,https://www.wamc.org/news/2026-07-16/springfield-grapples-with-housing-plan-issues,,English,Other
PYMNTS | 1Password Brings Secure Credential Access to Claude,PYMNTS | 1Password Brings Secure Credential Access to Claude,pymnts.com,https://www.pymnts.com/news/artificial-intelligence/2026/1password-and-anthropic-bring-secure-credential-access-to-claude/,,English,AI & Technology
"Fano dei Cesari , indotto da 1 , 8 milioni : « Il 54 % del pubblico da fuori regione »","Fano dei Cesari, induced impact of 1.8 million: «54% of the audience from outside the region»",corriereadriatico.it,https://www.corriereadriatico.it/pesaro/fano_cesari_indotto_da_1_8_milioni_54_pubblico_da_fuori_regione_turismo-9655446.html,,Italian,Other
"【 Gat X 】 假投 , 資提領不出 挽回損失資金 - 5455f632 的部落格","[Gat X] Fake investment, unable to withdraw funds, recover lost money - 5455f632's blog",blog.udn.com,https://blog.udn.com:443/5455f632/191398802,,Chinese,Other
"Lagenda sorties du 17 au 23 juillet 2026  : Caledonia +687 , fêtes à Ponérihouen ou Ouégoa , et Nuit du Conservatoire","The agenda of events from July 17 to 23, 2026: Caledonia+687, festivals in Ponérihouen or Ouégoa, and Conservatory Night",la1ere.franceinfo.fr,https://la1ere.franceinfo.fr/nouvellecaledonie/l-agenda-sorties-du-17-au-23-juillet-2026-caledonia-687-fetes-a-ponerihouen-ou-ouegoa-et-nuit-du-conservatoire-1719730.html,,French,Other
Communiqué du Conseil des ministres du jeudi 16 juillet 2026,"Press release from the Council of Ministers of Thursday, July 16, 2026",pressafrik.com,https://www.pressafrik.com/Communique-du-Conseil-des-ministres-du-jeudi-16-juillet-2026_a308423.html,,French,Other
Nasdaq tumbles 387 points as Trump steps up military strikes on Iran,Nasdaq tumbles 387 points as Trump steps up military strikes on Iran,nashvilleherald.com,http://www.nashvilleherald.com/news/279192153/nasdaq-tumbles-387-points-as-trump-steps-up-military-strikes-on-iran,,English,Geopolitics
"Vinitaly and the city Sibari 2026 , il 17 luglio lincontro Ismea","Vinitaly and the city Sibari 2026, July 17 the Ismea meeting",quotidianodelsud.it,https://www.quotidianodelsud.it/calabria/cosenza/societa-e-cultura/la-manifestazione/2026/07/16/vinitaly-and-the-city-sibari-2026-il-17-luglio-lincontro-ismea,,Italian,Other
ServiceNow Aktie : Bewährungsprobe voraus,ServiceNow Stock: Test ahead,stock-world.de,https://www.stock-world.de/servicenow-aktie-bewaehrungsprobe-voraus/,,German,Other
หมดสิทธิซื้อคืน  รอยัลออคิด  บลจ . วรรณ สั่งส่งมอบใน 30 วัน เดินหน้าประมูลใหม่,"No right to buy back 'Royal Orchid', One Asset Management orders delivery within 30 days, proceeds with new auction",bangkokbiznews.com,https://www.bangkokbiznews.com/finance/stock/1243454,,Thai,Other
"Potenzial , das zu heben ist : Migration und Integration als Schlüssel",Potential to be tapped: Migration and integration as a key,sn.at,https://www.sn.at/leben/karriere/potenzial-das-zu-heben-ist-migration-und-integration-als-schluessel-art-659430,,German,Other
Caterpillar Aktie : Ex - Dividende am 20 . Juli,Caterpillar Stock: Ex-dividend on July 20,stock-world.de,https://www.stock-world.de/caterpillar-aktie-ex-dividende-am-20-juli/,,German,Earnings & Guidance
Netflix ( NFLX ) spent $4 . 7 billion buying back its stock in Q2 2026,Netflix (NFLX) spent $4.7 billion buying back its stock in Q2 2026,shacknews.com,https://www.shacknews.com/article/150048/netflix-nflx-q2-2026-stock-buyback,,English,Other
Forum of Labour Market Ministers met in Halifax to discuss shared priorities,Forum of Labour Market Ministers met in Halifax to discuss shared priorities,montrealgazette.com,https://montrealgazette.com/press-releases/pr-newswire/forum-of-labour-market-ministers-met-in-halifax-to-discuss-shared-priorities/,,English,Other
¿ Qué dice la sentencia del Tribunal de Justicia de la UE sobre la ley de amnistía ?,What does the ruling of the EU Court of Justice on the amnesty law say?,hoy.com.do,https://hoy.com.do/el-mundo/estados-unidos/dice-sentencia-tribunal-justicia-ue-sobre-ley-amnistia_1095233.html,,Spanish,Other
"Bupati Jombang Minta Infrastruktur Pendukung Muktamar ke - 35 NU Dikebut , Jalan dan PJU Jadi Prioritas","Jombang Regent Asks for Supporting Infrastructure for the 35th NU Congress to be Accelerated, Roads and Street Lighting Become Priorities",beritajatim.com,https://beritajatim.com/bupati-jombang-minta-infrastruktur-pendukung-muktamar-ke-35-nu-dikebut-jalan-dan-pju-jadi-prioritas,,Indonesian,Other
California COMPETE Act : A return to the era of  worthy men  antitrust – Daily Bulletin,California COMPETE Act: A return to the era of 'worthy men' antitrust – Daily Bulletin,dailybulletin.com,https://www.dailybulletin.com/2026/07/16/californias-compete-act-a-return-to-the-era-of-worthy-men-antitrust/,,English,Other
Super Duper Market : il nuovo evento dedicato al design vintage in arrivo ad Alzano Lombardo,Super Duper Market: the new event dedicated to vintage design coming to Alzano Lombardo,lavocedivenezia.it,https://www.lavocedivenezia.it/super-duper-market-il-nuovo-evento-dedicato-al-design-vintage-in-arrivo-ad-alzano-lombardo/,,Italian,Other
688308 ， 业绩最高预增540倍,"688308, highest performance expected to increase by 540 times",finance.ifeng.com,https://finance.ifeng.com/c/8upEEuqtoCs,,Chinese,Other
Petrokimia Gresik Salurkan 600 Paket Sembako untuk Warga dan Pengemudi Ojol,Petrokimia Gresik Distributes 600 Food Packages to Residents and Motorcycle Taxi Drivers,surabaya.tribunnews.com,https://surabaya.tribunnews.com/surabaya-metro/1944581/petrokimia-gresik-salurkan-600-paket-sembako-untuk-warga-dan-pengemudi-ojol,,Indonesian,Other
"İnanca , düşünceye ve eyleme ahlâkî bir nefes üflemeye çalışan bilge : Taha Abdurrahman","The sage trying to breathe an ethical breath into faith, thought, and action: Taha Abdurrahman",yenisafak.com,http://www.yenisafak.com/yazarlar/mahmut-ay/inanca-dusunceye-ve-eyleme-ahlaki-bir-nefes-uflemeye-calisan-bilge-taha-abdurrahman-4840947,,Turkish,Other
"Delcy Rodríguez  nessun accordo per larresto di Maduro , mi ha colto di sorpresa  - America Latina","Delcy Rodríguez: no agreement for Maduro's arrest, it caught me by surprise - Latin America",ansa.it,https://www.ansa.it/sito/notizie/mondo/americalatina/2026/07/17/delcy-rodriguez-nessun-accordo-per-larresto-di-maduro-mi-ha-colto-di-sorpresa_dcc930b2-d1ac-452c-988e-35d8b3dbd092.html,,Italian,Other
习近平总书记在上海考察纪实,On-the-spot record of General Secretary Xi Jinping's inspection tour in Shanghai,news.sina.com.cn,https://news.sina.com.cn/c/xl/2026-07-17/doc-iniiahrk4228371.shtml,,Chinese,Other
