published_at,source,title,url
,manilatimes.net,Shareholders vote in favor of all proposals by the Board at Idorsia Annual General Meeting 2026,https://www.manilatimes.net/2026/05/06/tmt-newswire/globenewswire/shareholders-vote-in-favor-of-all-proposals-by-the-board-at-idorsias-annual-general-meeting-2026/2337430
,baomoi.com,Hội đồng Vàng Thế giới : Nhiều nước bán vàng trong tháng 3,https://baomoi.com/hoi-dong-vang-the-gioi-nhieu-nuoc-ban-vang-trong-thang-3-c55096693.epi
,novosti.rs,Uživo - Rat na Bliskom istoku,https://www.novosti.rs/planeta/svet/1604291/rat-bliskom-istoku-izraelska-vojska-ima-listu-ciljeva-iranu-ukoliko-rat-nastavi-iranci-oborili-americki-dron-mkju-9a
,163.com,首付66万起住进古镇芯现房 ！ 同润新云都会小高层置业全攻略,https://www.163.com/dy/article/KS9GTM8D0552NVEU.html
,nettg.pl,Nettg | Ceny gazu w Europie w dół,https://nettg.pl/ceny-gazu-w-europie-w-dol
,leggo.it,Roma InfoMobilità,https://www.leggo.it/roma_mobilita/visite_diplomatiche_a_roma_i_provvedimenti_per_la_viabilita-271938.html
,briefingwire.com,NCoV Assay Market : Enhancing Viral Detection and Pandemic Preparedness Solutions,https://www.briefingwire.com/pr/ncov-assay-market-enhancing-viral-detection-and-pandemic-preparedness-solutions
,sbctv.gr,Ισχυρό ανοδικό περιθώριο στη μετοχή ΑΒΑΞ βλέπουν Eurobank και Πειραιώς,https://www.sbctv.gr/2026/05/%CE%B9%CF%83%CF%87%CF%85%CF%81%CF%8C-%CE%B1%CE%BD%CE%BF%CE%B4%CE%B9%CE%BA%CF%8C-%CF%80%CE%B5%CF%81%CE%B9%CE%B8%CF%8E%CF%81%CE%B9%CE%BF-%CF%83%CF%84%CE%B7-%CE%BC%CE%B5%CF%84%CE%BF%CF%87%CE%AE-%CE%B1/
,dailypolitical.com,Compass Therapeutics ( NASDAQ : CMPX ) Issues Earnings Results,https://www.dailypolitical.com/2026/05/06/compass-therapeutics-nasdaqcmpx-issues-earnings-results.html
,aceshowbiz.com,Billboard Dance Power Players Showcase Industry Evolution and Leaders,https://www.aceshowbiz.com/news/view/00257084.html
,aaj.tv,آبنائے ہرمز میں آپریشن روکنے کا اعلان : عالمی مارکیٹ میں خام تیل کی قیمتیں مزید گرگئیں - World,https://www.aaj.tv/news/30504859/significant-drop-in-crude-oil-prices-in-the-global-market
,slobodna-bosna.ba,OBVEZNICE RS NA LONDONSKOJ BERZI KUPILI AMERIČKI FONDOVI : Ministrica Vidović ne smije da otkrije koji,https://www.slobodna-bosna.ba/vijest/482367/obveznice_rs_na_londonskoj_berzi_kupili_americhki_fondovi_ministrica_vidovic_ne_smije_da_otkrije_koji.html
,briefingwire.com,In Vitro Gene Therapy Market : Expanding Research in Laboratory - Based Genetic Treatments,https://www.briefingwire.com/pr/in-vitro-gene-therapy-market-expanding-research-in-laboratory-based-genetic-treatments
,wiadomosci.radiozet.pl,Kolejna linia lotnicza drastyczne tnie siatkę połączeń . Te miasta ucierpią najbardziej,https://wiadomosci.radiozet.pl/swiat/kolejna-linia-lotnicza-drastyczne-tnie-siatke-polaczen-te-miasta-ucierpia-najbardziej
,wiadomosci.dziennik.pl,Prezydent skierował do Sejmu projekt ustawy o kryptoaktywach .  Można to załatwić od ręki,"https://wiadomosci.dziennik.pl/polityka/artykuly/11243564,prezydent-skierowal-do-sejmu-projekt-ustawy-o-kryptoaktywach-mozna-t.html"
,hariansinggalang.co.id,"Exit Meeting BPK , Pemko Padang Optimistis Raih WTP ke - 13",https://www.hariansinggalang.co.id/berita/241421/exit-meeting-bpk-pemko-padang-optimistis-raih-wtp-ke13
,hkcna.hk,五一黃金周訪港旅客按年升8 % 至119萬人次 | 電訊,https://www.hkcna.hk/docDetail.jsp?id=101312733&channel=2813
,ogirassol.com.br,Governo prepara Desenrola para trabalhadores informais e adimplentes,https://ogirassol.com.br/economia/governo-prepara-desenrola-para-trabalhadores-informais-e-adimplentes/
,sbctv.gr,Ιστορική δικαστική νίκη της Ελλάδας για τα GDP warrants στο Λονδίνο,https://www.sbctv.gr/2026/05/%CE%B9%CF%83%CF%84%CE%BF%CF%81%CE%B9%CE%BA%CE%AE-%CE%B4%CE%B9%CE%BA%CE%B1%CF%83%CF%84%CE%B9%CE%BA%CE%AE-%CE%BD%CE%AF%CE%BA%CE%B7-%CF%84%CE%B7%CF%82-%CE%B5%CE%BB%CE%BB%CE%AC%CE%B4%CE%B1%CF%82-%CE%B3/
,makassar.tribunnews.com,Prodi Agribisnis Perikanan Polipangkep Gelar Workhsop Rekonstruksi Kurikulum Berbasis OBE,https://makassar.tribunnews.com/pangkep/1836981/prodi-agribisnis-perikanan-polipangkep-gelar-workhsop-rekonstruksi-kurikulum-berbasis-obe
,news.mail.ru,Европа ищет альтернативы американским крылатым ракетам Tomahawk : какие системы есть на вооружении ЕС,https://news.mail.ru/economics/70797606/
,heute.at,"Mit 50 angesagten Labels – Design , Beauty , Genuss – neue Familien - Messe startet",https://www.heute.at/s/design-beauty-genuss-neue-familien-messe-startet-120191751
,diariodeibiza.es,EDUCACIÓN EN IBIZA : deporte y servicios centran los siete nuevos ciclos formativos de Ibiza y Formentera para el curso 2026 - 2027,https://www.diariodeibiza.es/ibiza/2026/05/06/ibiza-formentera-siete-nuevos-ciclos-formativos-129905260.html
,arabnews.com,"Closing Bell : Saudi main market closes in red at 10 , 949 points",https://www.arabnews.com/node/2642560/business-economy
,elpueblodeceuta.es,Procesa celebra el Día de Europa con actividades en el Centro Equal y la Escuela de la Construcción,https://www.elpueblodeceuta.es/sec/educacion/procesa-celebra-dia-europa-actividades_1_1169945.html
,wiadomosci.dziennik.pl,"Sikorski : Skandal , wstyd . Gdzie jest ten fejkowy , PiS - owski SAFE ?","https://wiadomosci.dziennik.pl/polityka/artykuly/11243520,sikorski-skandal-wstyd-gdzie-jest-ten-fejkowy-pis-owski-safe.html"
,mz.de,Millionenloch in Allstedt : Paradox : Hohe Steuereinnahmen sorgen für Haushaltsloch in Allstedt,https://www.mz.de/lokal/sangerhausen/paradox-hohe-steuereinnahmen-sorgen-fur-haushaltsloch-in-allstedt-4245773
,briefingwire.com,Epigenome Sequencing Market : Unlocking Insights into Gene Regulation and Disease Mechanisms,https://www.briefingwire.com/pr/epigenome-sequencing-market-unlocking-insights-into-gene-regulation-and-disease-mechanisms
,cnnturk.com,ABDde özel sektör istihdamı nisanda hızlandı - Ekonomi Haberleri,https://www.cnnturk.com/ekonomi/abdde-ozel-sektor-istihdami-nisanda-hizlandi-2424661
,hna.de,Putsch - Gefahr im Kreml ? Verhaftung von Schoigus Vertrautem bricht ungeschriebene Regeln,https://www.hna.de/politik/putsch-gefahr-im-kreml-verhaftung-von-schoigus-vertrautem-bricht-ungeschriebene-regeln-zr-94294946.html
,news.az,Brent crude drops below $98 on US - Iran peace hopes,https://news.az/news/brent-crude-drops-below-98-on-us-iran-peace-hopes
,larioja.com,Un posible acuerdo de paz entre EE UU e Irán impulsa al Ibex y tumba el precio del petróleo,https://www.larioja.com/economia/mercados/posible-acuerdo-paz-iran-impulsa-ibex-tumba-20260506143244-ntrc.html
,birminghamstar.com,Update : China holiday travel surges as visa - free arrivals rise,http://www.birminghamstar.com/news/279034009/update-china-holiday-travel-surges-as-visa-free-arrivals-rise
,mavikocaeli.com.tr,Elektrikli otomobil satışlarında Togg farkı açıyor : İşte en çok satılan elektrikli arabalar ...,https://www.mavikocaeli.com.tr/elektrikli-otomobil-satislarinda-togg-farki-aciyor-iste-en-cok-satilan-elektrikli-arabalar/241424/
,zf.ro,Vrei să lucrezi la Parlamentul European ? Acum ai ocazia : sunt disponibile 25 locuri la ...,https://www.zf.ro/zf-gen-z/vrei-sa-lucrezi-la-parlamentul-european-acum-ai-ocazia-sunt-23145553
,allafrica.com,"Kenya : Del Monte Tax , GDP Contribution Tops Sh100bn",https://allafrica.com/stories/202605060237.html
,hawaiitelegraph.com,ELEKTROS Inc . Advances Strategic Lithium Expansion and Defends Transformational EV Charging Patent Position,http://www.hawaiitelegraph.com/news/279033982/elektros-inc-advances-strategic-lithium-expansion-and-defends-transformational-ev-charging-patent-position
,adgully.com,"Bharti AXA Life Insurance reports 44 % new business premium growth at ₹1 , 069 cr in FY26",https://www.adgully.com/post/15207/bharti-axa-life-insurance-reports-44-new-business-premium-growth-at-inr1069-cr-in-fy26
,memurlar.net,Akaryakýt Fiyatlarýn Etkileyecek Geliþme : Brent Petrol Yüzde 9 Dtü !,https://www.memurlar.net/haber/1166425/akaryakit-fiyatlarini-etkileyecek-gelisme-brent-petrol-yuzde-9-dustu.html
,ziuanews.ro,Schimbare majoră pentru șoferii din UE : ITP - ul se schimbă complet . Ce controale noi apar,https://www.ziuanews.ro/stiri/schimbare-majora-pentru-oferii-din-ue-itp-ul-se-schimba-complet-ce-controale-noi-apar-1594021
,chattanoogan.com,Top Senate Stories : 2022 Court Ruling Undermines Map Rigging ; GOP Asks Trump To Pick A Map,https://www.chattanoogan.com/2026/5/6/518414/Top-Senate-Stories-2022-Court-Ruling.aspx
,finance.yahoo.com,Analysts See 24 % Upside To GE Aerospace ( GE ),https://finance.yahoo.com/markets/stocks/articles/analysts-see-24-upside-ge-143639145.html
,aktiencheck.de,Organon & Co : Deal - Abschluss für Anfang 2027 erwartet (),https://www.aktiencheck.de/analysen/Artikel-Organon_Co_Deal_Abschluss_fuer_Anfang_2027_erwartet-19736639
,prnewswire.com,Moody Downgrades Ecopetrol Global Credit Rating to Ba2 and Affirms Its Stand ‑ Alone Credit Profile at b1,https://www.prnewswire.com/news-releases/moodys-downgrades-ecopetrols-global-credit-rating-to-ba2-and-affirms-its-standalone-credit-profile-at-b1-302764309.html
,giaoducthoidai.vn,Quảng Ninh phấn đấu tổng thu ngân sách năm 2026 đạt 100 . 000 tỷ đồng,https://giaoducthoidai.vn/quang-ninh-phan-dau-tong-thu-ngan-sach-nam-2026-dat-100000-ty-dong-post776717.html
,livemint.com,Eduard Khemchan and the Hidden Risks in Modern Financial Markets,https://www.livemint.com/focus/eduard-khemchan-and-the-hidden-risks-in-modern-financial-markets-11778077353025.html
,memurlar.net,Brüksel Havayollarý  nýn 4 - 6 Haftalýk Jet Yakýtý Kaldý,https://www.memurlar.net/haber/1166606/bruksel-havayollari-nin-4-6-haftalik-jet-yakiti-kaldi.html
,seekingalpha.com,The AMD Inflection Is Here ( NASDAQ : AMD ),https://seekingalpha.com/article/4899264-amd-inflection-is-here
,notiziegeopolitiche.net,Tripodi alla riunione Commercio del G7 a Parigi : focus italiano su catene del valore dei minerali critici,https://www.notiziegeopolitiche.net/tripodi-alla-riunione-commercio-del-g7-a-parigi-focus-italiano-su-catene-del-valore-dei-minerali-critici/
,dailypolitical.com,Wells Fargo & Company Issues Positive Forecast for Thomson Reuters ( NASDAQ : TRI ) Stock Price,https://www.dailypolitical.com/2026/05/06/wells-fargo-company-issues-positive-forecast-for-thomson-reuters-nasdaqtri-stock-price.html
,capital.gr,ΟΛΠ : Συνάντηση του προέδρου Han Chao με τον Πρύτανη του Εθνικού Μετσόβιου ...,https://www.capital.gr/epixeiriseis/3989922/olp-sunantisi-tou-proedrou-han-chao-me-ton-prutani-tou-ethnikou-metsobiou-polutexneiou/
,que.es,"OpenAI lanza GPT - 5 . 5 Instant : menos errores , respuestas más cortas",https://www.que.es/2026/05/06/openai-lanza-gpt-5-5-instant-modelo-preciso/
,wallstreetcn.com,警报响起 ！ 30年期美债收益率再逼5 % 警戒线 ， 美股的狂欢还能维持多久 ？,https://wallstreetcn.com/articles/3771684
,hurriyetdailynews.com,Türkiye courts global investors with tax breaks,https://www.hurriyetdailynews.com/turkiye-courts-global-investors-with-tax-breaks-221879
,manilatimes.net,"LUXEED  I  Drive , You Enjoy  Exclusive Themed Event Concludes Successfully , Accelerating Brand Global Expansion",https://www.manilatimes.net/2026/05/06/tmt-newswire/plentisoft/luxeed-i-drive-you-enjoy-exclusive-themed-event-concludes-successfully-accelerating-brand-global-expansion/2337406
,ahaber.com.tr,Akaryakıtta yeni tablo : Eşel mobilin bütçe etkisi 600 milyar lirayı aşabilir,https://www.ahaber.com.tr/viral/galeri/tikla/akaryakitta-yeni-tablo-esel-mobilin-butce-etkisi-600-milyar-lirayi-asabilir
,investor.bg,Dow Jones нараства с близо 560 пункта в началото на сесията в Ню Йорк *,https://www.investor.bg/a/538-pazari/430225-dow-jones-narastva-s-blizo-560-punkta-v-nachaloto-na-sesiyata-v-nyu-york
,news.yam.md,Care sunt capitalele europene cele mai ecologice ?,https://news.yam.md/ro/story/24915897
,journalexpress.ca,Le Bloc réclame un plan daide pour les PME face aux tarifs américains,https://www.journalexpress.ca/regional-et-national/bloc-quebecois-reclame-plan-aide-pme-tarifs-americains-drummond/
,hawaiitelegraph.com,Educational In - Plants Earn Top ACUP+ Honors with Konica Minolta Print Technology,http://www.hawaiitelegraph.com/news/279034045/educational-in-plants-earn-top-acup-honors-with-konica-minolta-print-technology
,taz.de,"Ecuador kriminalisiert NGOs : Illegal ist , wer gegen Bergbauprojekte protestiert",https://taz.de/Kriminalisierte-NGOs-in-Ecuador/!6175134/
,finance.yahoo.com,USSF Selects Lockheed Martin Corporation ( LMT ) For Space - Based Interceptor Program,https://finance.yahoo.com/markets/stocks/articles/ussf-selects-lockheed-martin-corporation-143653195.html
,tienphong.vn,Bắt giám đốc công ty  hô biến  hóa chất công nghiệp thành giấm ăn,https://tienphong.vn/bat-giam-doc-cong-ty-ho-bien-hoa-chat-cong-nghiep-thanh-giam-an-post1841207.tpo
,cdt.ch,A Chiasso un avanzo da record ma da leggere « correttamente »,https://www.cdt.ch/news/ticino/a-chiasso-un-avanzo-da-record-ma-da-leggere-correttamente-427033
,cyprus-mail.com,AMD shares hit all - time high as AI infrastructure demand surges,https://cyprus-mail.com/2026/05/06/amd-shares-hit-all-time-high-as-ai-infrastructure-demand-surges
,manilatimes.net,Siris Completes Acquisition of TAKKION | The Manila Times,https://www.manilatimes.net/2026/05/06/tmt-newswire/globenewswire/siris-completes-acquisition-of-takkion/2337431
,elimparcial.com,México logra récord histórico de exportaciones a EU en marzo y desplaza a China del mercado norteamericano tras alcanzar el 16 . 9 % de participación,https://www.elimparcial.com/mexico/2026/05/06/mexico-logra-record-historico-de-exportaciones-a-eu-en-marzo-y-desplaza-a-china-del-mercado-norteamericano-tras-alcanzar-el-169-de-participacion/
,fas.org,"Face Recognition Performance , Bias , and the Limits of Technical Fixes",https://fas.org/publication/face-recognition-bias/
,hariansinggalang.co.id,Muchdian Muchlis : Strategi Marketing Agile Jadi Kunci IAS Raih Penghargaan BUMN 2026,https://www.hariansinggalang.co.id/berita/241437/muchdian-muchlis-strategi-marketing-agile-jadi-kunci-ias-raih-penghargaan-bumn-2026
,funds-europe.com,"CFO market gains momentum as investors seek liquidity , yield and innovation",https://funds-europe.com/cfo-market-gains-momentum-as-investors-seek-liquidity-yield-and-innovation/
,hk.news.yahoo.com,HUAWEI 全球創新發佈會前夕大爆料 ， 一眾新品搶先睇,https://hk.news.yahoo.com/huawei-%E5%85%A8%E7%90%83%E5%89%B5%E6%96%B0%E7%99%BC%E4%BD%88%E6%9C%83%E5%89%8D%E5%A4%95%E5%A4%A7%E7%88%86%E6%96%99-%E7%9C%BE%E6%96%B0%E5%93%81%E6%90%B6%E5%85%88%E7%9D%87-090430659.html
,boerse-social.com,BKS Bank bekommt Gold - Zertifizierung für Immobilie in Mattersburg,https://www.boerse-social.com/2026/05/06/bks_bank_bekommt_gold-zertifizierung_fur_immobilie_in_mattersburg
,vietnam.vnanet.vn,"Tổng Bí thư , Chủ tịch nước Tô Lâm hội đàm với Thủ tướng Ấn Độ Narendra Modi",https://vietnam.vnanet.vn/vietnamese/tin-van/tong-bi-thu-chu-tich-nuoc-to-lam-hoi-dam-voi-thu-tuong-an-do-narendra-modi-444352.html
,briefingwire.com,Cell Therapeutics Market : Advancements in Regenerative Medicine and Cellular Treatment Approache,https://www.briefingwire.com/pr/cell-therapeutics-market-advancements-in-regenerative-medicine-and-cellular-treatment-approache
,transfermarkt.at,"Fußball - Transfers , Gerüchte , Marktwerte und News",https://www.transfermarkt.at/?newsupdate=479058&time=2026-05-06_17-00
,libertaddigital.com,"Veolia registra un crecimiento del 5 , 1 % del Ebitda en el primer trimestre y confirma sus objetivos para 2026",https://www.libertaddigital.com/libremercado/negocios/2026-05-06/veolia-registra-un-crecimiento-del-5-1-por-ciento-del-ebitda-en-el-primer-trimestre-y-confirma-sus-objetivos-para-2026-1b-7400372/
,borsaitaliana.it,"Credit Mutuel AM : azionario europeo , primo trimestre tra euforia , shock e ripresa - PAROLA AL MERCATO",https://www.borsaitaliana.it/borsa/notizie/radiocor/finanza/dettaglio/credit-mutuel-am-azionario-europeo-primo-trimestre-tra-euforia-shock-e-ripresa-parola-al-mercato-nRC_06052026_1327_432390664.html
,life.ru,Основатель CNN Тед Тёрнер умер в возрасте 87 лет,https://life.ru/p/1872070
,diariodemallorca.es,GUERRA EN ORIENTE MEDIO | China pide a Irán que reabra el estrecho de Ormuz y le anima a seguir negociando un alto el fuego completo,https://www.diariodemallorca.es/internacional/2026/05/06/china-pide-iran-reabra-estrecho-ormuz-anima-seguir-negociando-alto-fuego-completo-129920399.html
,index.hr,Xiaomi lansirao novi pametni sat za 109 eura,https://www.index.hr/shopping/clanak/xiaomi-lansirao-novi-pametni-sat-za-109-eura/2789331.aspx?index_tid=1012572&index_ref=naslovnica_magazin_ostalo_d_1
,finanznachrichten.de,ROUNDUP / Aktien New York : Rekordrally geht weiter - Nahost - Hoffnung / KI - Euphorie,https://www.finanznachrichten.de/nachrichten-2026-05/68413830-roundup-aktien-new-york-rekordrally-geht-weiter-nahost-hoffnung-ki-euphorie-016.htm
,healthleadersmedia.com,CMO : Emergency and Hospital Medicine Teetering on Financial Cliff,https://www.healthleadersmedia.com:443/cmo/cmo-emergency-and-hospital-medicine-teetering-financial-cliff
,dailypolitical.com,Mizuho Issues Pessimistic Forecast for Fiserv ( NASDAQ : FISV ) Stock Price,https://www.dailypolitical.com/2026/05/06/mizuho-issues-pessimistic-forecast-for-fiserv-nasdaqfisv-stock-price.html
,aktiencheck.de,| Analysen | News | Kurse | Charts | Diskussionen,https://www.aktiencheck.de/tv/Artikel-Opening_Bell_Oel_Chevron_Carnival_AMD_Lam_Research_KLA_Applied_Materials_Micron_SanDisk_Western_Digital_Corning_Arista_Networks_Super_Micro_Computer_Disney_Uber-19736573
,investegate.co.uk,Cinovec Project Environmental Impact Assessment | Company Announcement,https://www.investegate.co.uk/announcement/rns/european-metals-holding-limited-di---emh/cinovec-project-environmental-impact-assessment/9555404
,qds.it,Bonus idrico imprese : via alle domande per ottenere la misura,https://qds.it/bonus-idrico-imprese-contributi-a-fondo-perduto-fino-al-90-partono-le-domande/
,novosti.rs,VOLONTERSKI RAD NA EKSPO 2027 VREDNUJE SE ESPB BODOVIMA Studenti mogu dobiti i do tri za angažman na predstojećoj izložbi,https://www.novosti.rs/drustvo/vesti/1604519/volonterski-rad-ekspo-2027-vrednuje-espb-bodovima-studenti-mogu-dobiti-tri-angazman-predstojecoj-izlozbi
,zazoom.it,Il metodo della coppia per pulire i soldi sporchi | 4 arresti In campo anche i cani anti - contante,https://www.zazoom.it/2026-05-06/il-metodo-della-coppia-per-pulire-i-soldi-sporchi-4-arresti-in-campo-anche-i-cani-anti-contante/19134626/
,surinenglish.com,Nerja town hall launches public consultation period on draft urban plan,https://www.surinenglish.com/malaga/axarquia/nerja-town-hall-launches-public-consultation-period-20260506111109-nt.html
,boursorama.com,"Moyen - Orient : vent doptimisme sur les marchés mondiaux avec lespoir dun accord , le pétrole plonge - 06 / 05 / 2026 à 16 : 24",https://www.boursorama.com/bourse/actualites/moyen-orient-vent-d-optimisme-sur-les-marches-mondiaux-avec-l-espoir-d-un-accord-le-petrole-plonge-286783ae4cec268b5578367877609163
,leak.pt,PS6 : Calma ! A consola portátil não vai trazer problemas a ninguém !,https://www.leak.pt/ps6-calma-a-consola-portatil-nao-vai-trazer-problemas-a-ninguem/
,cafebiz.vn,Cảnh báo nóng : Loạt sản phẩm bị thu hồi ở nước ngoài có nguy cơ ảnh hưởng người tiêu dùng Việt Nam,https://cafebiz.vn/canh-bao-nong-loat-san-pham-bi-thu-hoi-o-nuoc-ngoai-co-nguy-co-anh-huong-nguoi-tieu-dung-viet-nam-176260506105452716.chn
,finanzen.ch,Strategy mit höherem Verlust als erwartet im ersten Quartal - Aktie im Minus,https://www.finanzen.ch/nachrichten/aktien/strategy-mit-hoeherem-verlust-als-erwartet-im-ersten-quartal-aktie-im-minus-1036104898
,bnionline.net,Calls grow for probe into rising airfares on Myitkyina flights,https://www.bnionline.net/en/news/calls-grow-probe-rising-airfares-myitkyina-flights
,publishersweekly.com,Tin House Prospers at Zando,https://www.publishersweekly.com:443/pw/by-topic/industry-news/publisher-news/article/100327-tin-house-prospers-at-zando.html
,manilatimes.net,"Crypto News : Pepeto Announces $9 . 840 . 000 raised and BNB Price Prediction Points to $3 , 000 After Moscow Exchange Adds Index",https://www.manilatimes.net/2026/05/06/tmt-newswire/globenewswire/crypto-news-pepeto-announces-9840000-raised-and-bnb-price-prediction-points-to-3000-after-moscow-exchange-adds-index/2337432
,www.bordertelegraph.com,United Kingdom,https://www.bordertelegraph.com/news/26067368.scottish-funeral-awards-winners-announced-glasgow-event/
,www.heraldpalladium.com,Netherlands,https://www.heraldpalladium.com/news/national/three-evacuated-from-hantavirus-hit-cruise-ship/article_e010a7ea-1b51-59d9-9c02-9dd9a44b659a.html
,www.heraldpalladium.com,Cape Verde,https://www.heraldpalladium.com/news/national/three-evacuated-from-hantavirus-hit-cruise-ship/article_e010a7ea-1b51-59d9-9c02-9dd9a44b659a.html
,koolam.com,"Fields Pond, Maine, United States",https://koolam.com/ixp/695/p/bird-photography-maine/
,koolam.com,"Maine, United States",https://koolam.com/ixp/695/p/bird-photography-maine/
,www.boursorama.com,France,https://www.boursorama.com/actualite-economique/actualites/le-porte-avions-charles-de-gaulle-a-franchi-le-canal-de-suez-b3ad7fbf7e99cd5f1c1807bcebafe31e
,www.dutchitchannel.nl,India,https://www.dutchitchannel.nl/news/731264/cognizant-zet-in-op-ai-15-000-ontslagen-voor-nieuwe-koers
,www.thehour.com,Pakistan,https://www.thehour.com/news/world/article/china-s-top-envoy-tells-his-iranian-counterpart-a-22244194.php
,www.thehour.com,Saudi Arabia,https://www.thehour.com/news/world/article/china-s-top-envoy-tells-his-iranian-counterpart-a-22244194.php
,www.thehour.com,Iran,https://www.thehour.com/news/world/article/china-s-top-envoy-tells-his-iranian-counterpart-a-22244194.php
,www.thehour.com,"Tehran, Tehran, Iran",https://www.thehour.com/news/world/article/china-s-top-envoy-tells-his-iranian-counterpart-a-22244194.php
,news.mail.ru,Russia,https://news.mail.ru/politics/70797637/
,news.mail.ru,Armenia,https://news.mail.ru/politics/70797637/
,news.mail.ru,"Moscow, Moskva, Russia",https://news.mail.ru/politics/70797637/
,news.mail.ru,Ukraine,https://news.mail.ru/politics/70797637/
,news.mail.ru,Moldova,https://news.mail.ru/politics/70797637/
,www.larioja.com,Spain,https://www.larioja.com/la-rioja/hantavirus-doctora-riojana-eva-martinez-ochoa-20260506134716-nt.html
,iz.ru,Israel,https://iz.ru/2092180/iuliia-leonova/vo-skolko-amerike-oboshlas-operatciia-epicheskaia-iarost
,iz.ru,Kuwait,https://iz.ru/2092180/iuliia-leonova/vo-skolko-amerike-oboshlas-operatciia-epicheskaia-iarost
,iz.ru,"Washington, Washington, United States",https://iz.ru/2092180/iuliia-leonova/vo-skolko-amerike-oboshlas-operatciia-epicheskaia-iarost
,iz.ru,Qatar,https://iz.ru/2092180/iuliia-leonova/vo-skolko-amerike-oboshlas-operatciia-epicheskaia-iarost
,iz.ru,Bahrain,https://iz.ru/2092180/iuliia-leonova/vo-skolko-amerike-oboshlas-operatciia-epicheskaia-iarost
,iz.ru,"White House, District Of Columbia, United States",https://iz.ru/2092180/iuliia-leonova/vo-skolko-amerike-oboshlas-operatciia-epicheskaia-iarost
,mansethaber.com,"Samsun, Samsun, Turkey",https://mansethaber.com/siyaset/plan-butce-komisyonunda-muhalefetten-tepki-kararlar-konusulmadan-degistiriliyor
,mansethaber.com,"Antalya, Antalya, Turkey",https://mansethaber.com/siyaset/plan-butce-komisyonunda-muhalefetten-tepki-kararlar-konusulmadan-degistiriliyor
,www.timesherald.com,"Montgomery County, Pennsylvania, United States",https://www.timesherald.com/2026/05/06/a-new-5-county-economic-partnership-aims-to-bring-fresh-economic-development-to-philly-region/
,www.timesherald.com,"Pennsylvania, United States",https://www.timesherald.com/2026/05/06/a-new-5-county-economic-partnership-aims-to-bring-fresh-economic-development-to-philly-region/
,www.timesherald.com,"Delaware County, Pennsylvania, United States",https://www.timesherald.com/2026/05/06/a-new-5-county-economic-partnership-aims-to-bring-fresh-economic-development-to-philly-region/
,www.timesherald.com,"Chester County, Pennsylvania, United States",https://www.timesherald.com/2026/05/06/a-new-5-county-economic-partnership-aims-to-bring-fresh-economic-development-to-philly-region/
,www.timesherald.com,"Philadelphia, Pennsylvania, United States",https://www.timesherald.com/2026/05/06/a-new-5-county-economic-partnership-aims-to-bring-fresh-economic-development-to-philly-region/
,www.timesherald.com,"Delaware, United States",https://www.timesherald.com/2026/05/06/a-new-5-county-economic-partnership-aims-to-bring-fresh-economic-development-to-philly-region/
,www.timesherald.com,South Korea,https://www.timesherald.com/2026/05/06/a-new-5-county-economic-partnership-aims-to-bring-fresh-economic-development-to-philly-region/
,www.theguardian.com,"Hollywood, California, United States",https://www.theguardian.com/world/2026/may/06/from-eurovision-to-the-venice-biennale-culture-contests-are-struggling-to-channel-globalised-politics
,www.theguardian.com,Italy,https://www.theguardian.com/world/2026/may/06/from-eurovision-to-the-venice-biennale-culture-contests-are-struggling-to-channel-globalised-politics
,n.yam.com,"Hsinchu Industrial Park, Xinzhu Xian, Taiwan",https://n.yam.com/Article/20260506932946
,n.yam.com,"Miaoli, Miaoli Xian, Taiwan",https://n.yam.com/Article/20260506932946
