published_at,source,title,url
,themarketsdaily.com,"Tyche Wealth Partners LLC Buys 62 , 500 Shares of Cipher Mining Inc . $CIFR",https://www.themarketsdaily.com/2026/04/14/tyche-wealth-partners-llc-buys-62500-shares-of-cipher-mining-inc-cifr.html
,hea.china.com,金致机械获同仁堂 、 欧莱雅背书 ， 三维薄膜包装机口碑出众 _ 中华网,https://hea.china.com/articles/20260414/202604141847111.html
,bitlysdowssl-aws.com,La casa natal de Maradona se convierte en un comedor social,https://bitlysdowssl-aws.com/2026/04/la-casa-natal-de-maradona-se-convierte-en-un-comedor-social/
,teknoblog.com,"iPhone Fold üretimi gecikti , Apple 2026 çıkış planını koruyor",https://www.teknoblog.com/iphone-fold-uretim-gecikmesi-2026-cikis/
,haberturk.com,Cumhurbaşkanı Erdoğandan Macaristan  ın yeni lideri Magyara tebrik telefonu,https://www.haberturk.com/son-dakika-cumhurbaskani-erdogan-dan-macaristan-in-yeni-liderine-tebrik-telefonu-3877350
,dagensps.se,Wall Street - proffs : Så investerar du smartast just nu,https://www.dagensps.se/bors-finans/wall-street-proffs-sa-investerar-du-smartast-just-nu/
,baodautu.vn,Việt Nam - Australia mở rộng cơ hội hợp tác fintech,https://baodautu.vn/viet-nam---australia-mo-rong-co-hoi-hop-tac-fintech-d569791.html
,moroccoworldnews.com,Tanger Med Industrial Activity Hits $18 . 8 Billion in 2025,https://www.moroccoworldnews.com/2026/04/286977/tanger-med-industrial-activity-hits-18-8-billion-in-2025/
,edmontonsun.com,"Phil Collins , Oasis , Iron Maiden entering Rock & Roll Hall of Fame",https://edmontonsun.com/entertainment/music/2026-rock-hall-of-fame-inductees-phil-collins-iron-maiden-oasis
,kzbb.iheart.com,Popular Convenience Store To Close 645 Locations Amid Massive Makeover,https://kzbb.iheart.com/content/2026-04-14-popular-convenience-store-to-close-645-locations-amid-massive-makeover/
,gazetteseries.co.uk,Killer bragged  I stabbed him fully  after murdering student on railway tracks,https://www.gazetteseries.co.uk/news/national/26020748.killer-bragged-i-stabbed-fully-murdering-student-railway-tracks/
,birgun.net,Başaran Aksu hakkında tahliye kararı,https://www.birgun.net/haber/basaran-aksu-hakkinda-tahliye-karari-705837%20class=slide-legend-link%20target=_blank
,sanremonews.it,"William e il caso in Gran Bretagna , milioni incassati da un carcere inutilizzato",https://www.sanremonews.it/2026/04/14/leggi-notizia/argomenti/ultimora/articolo/william-e-il-caso-in-gran-bretagna-milioni-incassati-da-un-carcere-inutilizzato.html
,newsx.com,Delhi Police Crack Down On Fake Bike Parts Racket In Karol Bagh ; Two Arrested In Major Raid Operation,https://www.newsx.com/india/delhi-police-crack-down-on-fake-bike-parts-racket-in-karol-bagh-two-arrested-in-major-raid-operation-199021/
,aktuality.sk,Dovoz ocele do Európskej únie sa zníži o 47 percent . Začnú tiež platiť 50 - percentné clá pri prekročení stanovených kvót,https://www.aktuality.sk/clanok/dSxesPa/dovoz-ocele-do-europskej-unie-sa-znizi-o-47-percent-zacnu-tiez-platit-50-percentne-cla-pri-prekroceni-stanovenych-kvot/
,stiripesurse.ro,"Grupul MOL va acorda acţionarilor dividende de 241 miliarde de forinţi , afernte anului 2025",https://www.stiripesurse.ro/grupul-mol-va-acorda-actionarilor-dividende-de-241-miliarde-de-forinti-afernte-anului-2025_3877517
,ksta.de,Amazon kauft Globalstar für elf Milliarden Dollar – Satelliten - Deal soll Internet aus dem All beschleunigen,https://www.ksta.de:443/wirtschaft/amazon-kauft-globalstar-fuer-elf-milliarden-dollar-satelliten-deal-soll-internet-aus-dem-all-beschleunigen-1263457
,finance.eastmoney.com,精选 | 夜盘盘前要闻汇总 4月14日 周二 _ 东方财富网,https://finance.eastmoney.com/a/202604143704619290.html
,finance.yahoo.com,Anthropic Has Wiped Out Trillions From the Software Sector . 2 Things Can Happen Next,https://finance.yahoo.com/markets/stocks/articles/anthropic-wiped-trillions-software-sector-142000304.html
,dimokratiki.gr,Ακαδημία Κλεάνθη : Απολαυστικό το ταξίδι της Κ14 στο Λουτράκι,https://www.dimokratiki.gr/14-04-2026/akadimia-kleanthi-apolafstiko-to-taxidi-tis-k14-sto-loutraki/
,themarketsdaily.com,Head to Head Survey : REX IncomeMax Option Strategy ETF ( NASDAQ : ULTI ) vs . Konami ( OTCMKTS : KNMCY ),https://www.themarketsdaily.com/2026/04/14/head-to-head-survey-rex-incomemax-option-strategy-etf-nasdaqulti-vs-konami-otcmktsknmcy.html
,skai.gr,"Θα καταναλώσουμε λιγότερο πετρέλαιο το 2026 , για πρώτη φορά μετά την περίοδο Covid",https://www.skai.gr/news/world/tha-katanalosoume-ligotero-petrelaio-to-2026-gia-proti-fora-meta-tin-periodo-covid
,dcnews.ro,Cât a crescut rata inflației în luna martie,https://www.dcnews.ro/cat-a-crescut-rata-inflatiei-in-luna-martie_1046808.html
,wral.com,Smart ways to save and pay off debt,https://www.wral.com/consumer/5onyourside/smart-save-pay-off-debt-5oys-april-2026/
,corrieresalentino.it,"Infopoint ex Agip ,  Illegittimo vendere pacchetti . Accuse gravi in Commissione :  Bene pubblico per interessi privati",https://www.corrieresalentino.it/2026/04/infopoint-ex-agip-illegittimo-vendere-pacchetti-accuse-gravi-in-commissione-bene-pubblico-per-interessi-privati/
,evz.ro,Carburanții se ieftinesc din nou în Republica Moldova . Motorina coboară sub 33 de lei,https://evz.ro/carburantii-se-ieftinesc-din-nou-in-republica-moldova-motorina-coboara-sub-33-de-lei.html
,sot.com.al,"Shqipëria po zbrazet , Boçi godet Ramën : Samiti i diasporës fasadë për pastrimin e parave të pista të qeverisë - Sot News",https://sot.com.al/politike/shqiperia-po-zbrazet-boci-godet-edi-rama-samiti-i-diaspores-fasade-per-pastrimin-e-parave-te-pista-te-qeverise/
,ceskenoviny.cz,"Zastupitelé sjezd sudetských Němců v Brně neodmítli , ani nepodpořili",https://www.ceskenoviny.cz/zpravy/zastupitele-sjezd-sudetskych-nemcu-v-brne-neodmitli-ani-nepodporili/2812240
,digi.china.com,短剧崛起 ， 后期岗位需求暴增 ， 2026年影视后期培训关键词 ： 实战 、 督学 、 变现 _ 中华网,https://digi.china.com/articles/20260414/202604141847142.html
,nikkei.com,IMF 、 ファンド融資に警鐘 個人向け普及 ・ 借り手の債務不履行にリスク,https://www.nikkei.com/article/DGXZQOGN13B3S0T10C26A4000000/
,forbes.com,Slow Koh Samui : The Best Of Thailand Most Magical Island,https://www.forbes.com/sites/duncanmadden/2026/04/14/slow-koh-samui-the-best-of-thailands-most-magical-island/
,wkms.org,2 local TV giants merged . Then a court stepped in,https://www.wkms.org/npr-news/2026-04-14/2-local-tv-giants-merged-then-a-court-stepped-in
,vienna.at,Integrationspflicht : Koalitionspartner bei Vorgehensweise uneins,https://www.vienna.at/integrationspflicht-koalitionspartner-bei-vorgehensweise-uneins/10108802
,haberler.com,Türkiye - Hindistan Sinema İşbirliği Görüşmeleri,https://www.haberler.com/guncel/turkiye-ve-hindistan-arasinda-sinema-alaninda-19749233-haberi/
,baodautu.vn,Bộ Y tế yêu cầu bình ổn giá thuốc,https://baodautu.vn/bo-y-te-yeu-cau-binh-on-gia-thuoc-d569632.html
,mz.de,Wohnungsmarkt : Wohnungssuche beendet : Potsdams Rathauschefin zieht um,https://www.mz.de/panorama/wohnungssuche-beendet-potsdams-rathauschefin-zieht-um-4232714
,thenational.scot,John Swinney must  respect independence mandate that is not just SNP,https://www.thenational.scot/news/26020227.john-swinney-must-respect-independence-mandate-not-just-snp/
,manchestereveningnews.co.uk,Breakout - prone shoppers love  miracle  SPF that  improves skin  and doesnt trigger spots,https://www.manchestereveningnews.co.uk/news/fashion-news/breakout-prone-shoppers-love-miracle-33766692
,tech.china.com,青岛聚合韶华 ： 以多功能LED固晶机 ， 助力国产封装设备突围 _ 中华网,https://tech.china.com/articles/20260414/202604141847116.html
,tech.china.com,灵析数智 ： 以 AI GEO 重构品牌增长 ， 领跑生成式引擎优化新赛道 _ 中华网,https://tech.china.com/articles/20260414/202604141847117.html
,chathamdailynews.ca,Regional unemployment saw slight increase last month,https://www.chathamdailynews.ca/news/local-news/regional-unemployment-saw-slight-increase-last-month-remains-lowest-in-ontario
,dewereldmorgen.be,De stilte van Bredene : leven en wachten in een opvangcentrum,https://www.dewereldmorgen.be/artikel/2026/04/14/de-stilte-van-bredene-leven-en-wachten-in-een-opvangcentrum
,haqqin.az,Bakcell объявила об уходе генерального директора Клауса Мюллера,https://haqqin.az/newsarchive/381270
,fool.com,The Oil Price Rollercoaster Probably Isnt Ending Soon . 3 Moves for the Savvy Energy Investor to Make Now .,https://www.fool.com/investing/2026/04/14/the-oil-price-rollercoaster-probably-isnt-ending-s/
,lb.ua,Україна та Німеччина узгодили масштабний пакет співпраці на 4 млрд,https://lb.ua/society/2026/04/14/732635_ukrayina_nimechchina_uzgodili.html
,badische-zeitung.de,Untersuchung : Abgebrochene Ausbildung wird oft teuer,https://www.badische-zeitung.de/untersuchung-abgebrochene-ausbildung-wird-oft-teuer
,net.hr,TopGear nagrade - Kia je najbolji proizvođač godine,http://net.hr/danas/vijesti/topgear-nagrade-kia-je-najbolji-proizvodac-godine-b16f2111-37f4-11f1-936f-9600040c8f8e
,focus-news.net,500 хиляди изборни бюлетини пристигнаха в Стара Загора при засилени мерки за сигурност,https://www.focus-news.net/novini/regioni/500-hilyadi-izborni-byuletini-pristignaha-v-Stara-Zagora-pri-zasileni-merki-2951178
,mdzol.com,Luis Caputo : A partir de abril vamos a ver una desaceleración de la inflación importante,https://www.mdzol.com/dinero/luis-caputo-a-partir-abril-vamos-ver-una-desaceleracion-la-inflacion-importante-n1497263
,2paragraphs.com,Trump Ex - Secretary of State Says Hell  Unleash Even More Fury,https://2paragraphs.com/2026/04/trumps-ex-secretary-of-state-says-hell-unleash-even-more-fury/
,forbes.com,Pick Rivian Stock Over Tesla ?,https://www.forbes.com/sites/greatspeculations/2026/04/14/pick-rivian-stock-over-tesla/
,ideal.es,La guerra de Irán impacta ya en Granada con la mayor subida de precios en un mes desde Ucrania,https://www.ideal.es/granada/guerra-iran-impacta-granada-mayor-subida-precios-20260414154301-nt.html
,aktiencheck.de,Aroundtown : Neue Hoffnung durch Millionendeal ? (),https://www.aktiencheck.de/analysen/Artikel-Aroundtown_Neue_Hoffnung_durch_Millionendeal-19658917
,20min.ch,"KI in der Jobsuche : Wer sie nutzt , wird öfter zum Vorstellungsgespräch eingeladen",https://www.20min.ch/story/stellensuche-wer-ki-nutzt-wird-haeufiger-zum-bewerbungsgespraech-eingeladen-103545618
,hea.china.com,OpenSky获行业瞩目 ： 以  用户主权  重构Web3通信 ， 定义下一代连接范式 _ 中华网,https://hea.china.com/hea/xinwen/2026/0414/042026_1847135.html
,wkms.org,The labor economics of  Alien  and its lessons for inequality on Earth,https://www.wkms.org/npr-news/2026-04-14/the-labor-economics-of-alien-and-its-lessons-for-inequality-on-earth
,timesofmalta.com,Corinthia seals €74m deal for full control of Libyan luxury residential complex,https://timesofmalta.com/article/corinthia-seals-74m-deal-control-libyan-luxury-residential-complex.1126908
,ilfattoquotidiano.it,"FMI : rischio recessione globale , crescita Italia tagliata a 0 , 5 % nel 2026 - 2027",https://www.ilfattoquotidiano.it/2026/04/14/fmi-rischio-recessione-globale-crescita-italia-notizie/8355484/
,herefordtimes.com,Jeremy Clarkson addresses fears of move to South Wales,https://www.herefordtimes.com/news/26019130.jeremy-clarkson-addresses-fears-move-south-wales/
,femina.hu,Kiszivárgott a tervezet : ennyit kaphatnak kézhez a jövőben a nyugdíjba vonulók,https://femina.hu/terasz/nyugdij-tervezet-ferfiak/
,yahoo.com,"New federal figures reveal 1 in 3 US households struggle to pay energy bills , but the reality is likely even worse",https://www.yahoo.com/news/articles/federal-figures-reveal-1-3-133209034.html
,ideal.es,Alerta de los expertos en aceite de oliva : cambio de precio y problema de stock,https://www.ideal.es/economia/mi-hucha/alerta-expertos-aceite-oliva-cambio-precio-problema-20260414154737-nt.html
,therealdeal.com,"South Florida Top Real Estate Deals : Monday , April 13 , 2026",https://therealdeal.com/miami/2026/04/14/south-florida-top-real-estate-deals-monday-april-13-2026/
,larepubliquedespyrenees.fr,"Hydroélectricit : à Licq - Athérey , une plongée dans lor bleu - La République des Pyrénes . fr",https://www.larepubliquedespyrenees.fr:443/pyrenees-atlantiques/pays-basque/hydroelectricite-a-licq-atherey-une-plongee-dans-l-or-bleu-28432847.php
,net.hr,Odlaskom Orbana otvaraju se prilike ! Plenković :  Važno je da BiH uhvati vlak Europske unije,http://net.hr/danas/vijesti/odlaskom-orbana-otvaraju-se-prilike-plenkovic-vazno-je-da-bih-uhvati-vlak-europske-unije-d8b01ed5-37f3-11f1-936f-9600040c8f8e
,diena.lv,"Rīgas acs par 3 , 82 miljoniem eiro pārdos pusi Rīgas starptautiskās autoostas akciju",https://www.diena.lv/raksts/latvija/riga/_rigas-acs_-par-382-miljoniem-eiro-pardos-pusi-_rigas-starptautiskas-autoostas_-akciju-14350479
,tech.china.com,WHEE × 张杰2026鸟巢演唱会 ： 一站式解锁专业级应援物料 _ 中华网,https://tech.china.com/articles/20260414/202604141847119.html
,constructionnews.co.uk,Preparing for the worst : Is your first aid training good enough ?,https://www.constructionnews.co.uk/sections/long-reads/features/preparing-for-the-worst-is-your-first-aid-training-good-enough-14-04-2026/
,gazetteseries.co.uk,UK economic growth forecasts slashed as IMF says Iran war risks global recession,https://www.gazetteseries.co.uk/news/national/26020326.uk-economic-growth-forecasts-slashed-imf-says-iran-war-risks-global-recession/
,tuttonapoli.net,"Futuro Conte , Carratelli :  Se va via , prenderei un tecnico giovane e moderno",https://www.tuttonapoli.net/radio-tutto-napoli/futuro-conte-carratelli-se-va-via-prenderei-un-tecnico-giovane-e-moderno-642106
,ttela.se,Därför är det rätt att planera för ett fängelse i Vänersborg,https://www.ttela.se/asikt/ledare/darfor-ar-det-ratt-att-planera-for-ett-fangelse-i-vanersborg.1b90e06d-7227-435b-b5f9-bbdafdbb86af
,gorod48.ru,Домашний интернет в РФ может подорожать на 30 процентов,https://gorod48.ru/topnews/1982705/
,infooggi.it,Bancarotta fraudolenta nel Crotonese : tre imprenditori arrestati e sei società sequestrate | InfoOggi,https://www.infooggi.it/articolo/bancarotta-fraudolenta-nel-crotonese-tre-imprenditori-arrestati-e-sei-societ-sequestrate/152314
,baodautu.vn,"OKX ký thỏa thuận hợp tác chiến lược với VPBank , góp vốn vào CAEX trong tháng 4 / 2026",https://baodautu.vn/okx-ky-thoa-thuan-hop-tac-chien-luoc-voi-vpbank-gop-von-vao-caex-trong-thang-42026-d569566.html
,evz.ro,Alegerile din Ungaria ar putea debloca aderarea Republicii Moldova la UE . Negrescu cere deschiderea negocierilor pe clustere,https://evz.ro/alegerile-din-ungaria-ar-putea-debloca-aderarea-republicii-moldova-la-ue-negrescu-cere-deschiderea-negocierilor-pe-clustere.html
,zaobao.com.sg,新加坡3月份船用燃料销量增长 但油价飙升限制涨幅,https://www.zaobao.com.sg/finance/singapore/story20260414-8893803
,windowscentral.com,The new best way to land QD - OLED on a budget ?: Alienware just unveiled a new gaming monitor promising high - end specs at one seriously low price,https://www.windowscentral.com/hardware/dell/alienware-aw2726dm-qd-oled-gaming-monitor-available
,computable.nl,Object First breidt Benelux - team uit met Sales Engineer Jos Maliepaard,https://www.computable.nl/persberichten/object-first-breidt-benelux-team-uit-met-sales-engineer-jos-maliepaard/
,quicomo.it,Sul Lago di Como davanti a Laglio la spettacolare esercitazione : coltello sul traghetto e passeggeri in acqua,https://www.quicomo.it/attualita/maxi-esercitazione-lago-como-laglio-uomo-armato-traghetto-soccorsi-acqua.html
,protothema.gr,"Το 20ετες « πάγωμα » κάθε πυρηνικής δραστηριότητας ζητάει η Ουάσινγκτον από την Τεχεράνη , τι θα γίνει με τα 440 κιλά εμπλουτισμένου ουρανίου",https://www.protothema.gr/world/article/1802761/to-20etes-pagoma-kathe-purinikis-drastiriotitas-zitaei-i-ouasington-apo-tin-teherani/
,kreiszeitung.de,Russland will Irans Uran lagern – Kreml bringt sich für Deal ins Spiel,https://www.kreiszeitung.de/politik/russland-will-irans-uran-lagern-kreml-bringt-sich-fuer-deal-ins-spiel-zr-94261385.html
,poslovni.hr,Bruketa : Falit će mi  Ž  i  Ć  u logotipu . Nikola i ja puno smo toga prošli zajedno,https://www.poslovni.hr/hrvatska/bruketa-falit-ce-mi-z-i-c-u-logotipu-nikola-i-ja-puno-smo-toga-prosli-zajedno-4532455
,wsiu.org,"For young people looking to take over Illinois farms , the costs can be steep",https://www.wsiu.org/state-of-illinois/2026-04-14/for-young-people-looking-to-take-over-illinois-farms-the-costs-can-be-steep
,carmagazine.co.uk,"New Porsche 911 GT3 S / C convertible : unholy , or inspired ?",https://www.carmagazine.co.uk/car-news/first-official-pictures/porsche/911-gt3-s-c/
,wiadomosci.dziennik.pl,Oszustwo „ na mandat  KAS . Fałszywe ulotki za wycieraczkami aut . MF ostrzega,"https://wiadomosci.dziennik.pl/wydarzenia/artykuly/11232907,oszustwo-na-mandat-kas-falszywe-ulotki-za-wycieraczkami-aut-mf-ostrzega.html"
,forbes.com,The Emergence Of The Chief Revenue Officer Role,https://www.forbes.com/sites/stephendiorio/2026/04/14/the-emergence-of-the-chief-revenue-officer-role/
,tribuneonlineng.com,2026 : The most educated countries in the World,https://tribuneonlineng.com/2026-the-most-educated-countries-in-the-world/
,vienna.at,Italien prüft Auslieferung von Österreicher an Deutschland,https://www.vienna.at/italien-prueft-auslieferung-von-oesterreicher-an-deutschland/10108613
,themarketsdaily.com,Gravity Price Reaches $0 . 0039 on Top Exchanges ( G ),https://www.themarketsdaily.com/2026/04/14/gravity-price-reaches-0-0039-on-top-exchanges-g.html
,defenseworld.net,Earned Wealth Advisors LLC Has $16 . 52 Million Holdings in NVIDIA Corporation $NVDA,https://www.defenseworld.net/2026/04/14/earned-wealth-advisors-llc-has-16-52-million-holdings-in-nvidia-corporation-nvda.html
,naslovi.net,"Zabranjuju se nazivi slanina i odrezak ! Stroža pravila za hranu stižu iz EU , a jedna promena mogla bi da pogura cene nagore u Srbiji",https://naslovi.net/2026-04-14/dnevnik/zabranjuju-se-nazivi-slanina-i-odrezak-stroza-pravila-za-hranu-stizu-iz-eu-a-jedna-promena-mogla-bi-da-pogura-cene-nagore-u-srbiji/41626857
,trend.at,Bawag : Irisches Finanzinstitut nimmt Milliarden - Deal an,https://www.trend.at/unternehmen/bawag-bietet-1-62-mrd-euro-fuer-irisches-finanzinstitut-ptsb
,dunya.com,ABDde ÜFE beklentinin altında kaldı - Dünya Gazetesi,https://www.dunya.com/ekonomi/abdde-ufe-beklentinin-altinda-kaldi-haberi-821610
,fool.com,Stock Market Today ( LIVE ): Markets Return to Pre - Conflict Levels as Trump Says Iran Has Reached Out to Work Out a Deal,https://www.fool.com/investing/2026/04/14/stock-market-today-live-coverage/
,teknolojioku.com,Enerjisi bitmiyor : 7000 mAh dev bataryalı Tecno Spark 50 4G sahneye çıktı !,https://www.teknolojioku.com/mobil/enerjisi-bitmiyor-7000-mah-dev-bataryali-tecno-spark-50-4g-sahneye-cikti-69de1370c6da3e9fbc083c6f
,baodautu.vn,"Vinhomes Royal Island : Phố đảo càng đông , nhà phố càng  bật giá",https://baodautu.vn/vinhomes-royal-island-pho-dao-cang-dong-nha-pho-cang-bat-gia-d569878.html
,aif.ru,"МВФ улучшил прогноз темпов роста экономики РФ в 2026 году до 1 , 1 %",https://aif.ru/money/mvf-uluchshil-prognoz-tempov-rosta-ekonomiki-rf-v-2026-godu-do-1-1
,163.com,半场25分钟 ， 红黄牌罚时 ， 真欧超 … 德佬的脑洞有点多,https://www.163.com/dy/article/KQGOKVAL05299JMD.html
,fontanka.ru,Весенний « Маркет тут рядом » в Петербурге : благотворительная акция в поддержку людей с аутизмом - 14 апреля 2026,https://www.fontanka.ru/2026/04/14/76365417/
,abc7news.com,"NHL team offseason keys , including free agency , draft needs",https://abc7news.com/post/nhl-teams-offseason-keys-including-free-agency-draft-needs/18883798/
,themarketsdaily.com,Powerledger ( POWR ) One Day Volume Tops $3 . 63 Million,https://www.themarketsdaily.com/2026/04/14/powerledger-powr-one-day-volume-tops-3-63-million.html
,ilpiacenza.it,"Nuova sede per Padana Impianti , da più di trentanni al servizio della ristorazione di qualità",https://www.ilpiacenza.it/attualita/nuova-sede-per-padana-impianti-da-piu-di-trent-anni-al-servizio-della-ristorazione-di-qualita.html
,rp.pl,Samplowanie na prawie pastiszu . TSUE uznaje to za zgodne z prawem,https://www.rp.pl/internet-i-prawo-autorskie/art44152291-tsue-uznal-ze-samplowanie-bez-zgody-tworcy-jest-zgodne-z-prawem
,defenseworld.net,Bright Financial Advisors Inc . Purchases 991 Shares of iShares Core S & P 500 ETF $IVV,https://www.defenseworld.net/2026/04/14/bright-financial-advisors-inc-purchases-991-shares-of-ishares-core-sp-500-etf-ivv.html
,forbes.com,Why Orbital Believes Space Is The Next Frontier In The AI Revolution,https://www.forbes.com/sites/davidprosser/2026/04/14/why-orbital-believes-space-is-the-next-frontier-in-the-ai-revolution/
,udn.com,"保險資金大開閘 ！ 金管會喊3年引3 , 000億元 挺五大信賴產業 | 金融要聞 | 產經",https://udn.com/news/story/7239/9441831
,forbes.com,Answering To Customers Instead Of Shareholders,https://www.forbes.com/councils/forbesbusinesscouncil/2026/04/14/answering-to-customers-instead-of-shareholders/
,quotidianodelsud.it,"Daniele Silvestri e  Sana e robusta Costituzione , il singolo che nessuno si aspettava",https://www.quotidianodelsud.it/calabria/cosenza/spettacoli/musica/2026/04/14/daniele-silvestri-e-sana-e-robusta-costituzione-il-singolo-che-nessuno-si-aspettava
,oaxacacapital.com,ℹ Emprender un negocio en México con poco capital : ideas y pasos legales,https://oaxacacapital.com/sociedad/emprender-un-negocio-en-mexico-con-poco-capital-ideas-y-pasos-legales/
,abcnews.com,"Citing fallout from the Iran war , IMF cuts the outlook for global growth , expects higher inflation",https://abcnews.com/Business/wireStory/citing-fallout-iran-war-imf-cuts-outlook-global-132026852
,ok.co.uk,Debenhams slashes  magnificent  diamond - set watch by 95 % in limited time sale,https://www.ok.co.uk/shopping/debenhams-slashes-magnificent-diamond-set-37010200
,elmanana.com.mx,Tipo de cambio del dólar HOY 14 de abril del 2026 : Peso mexicano borra ganancias de tregua ; dólar regresa y toma liderazgo,https://www.elmanana.com.mx/nacional/2026/4/14/peso-mexicano-tropieza-ante-el-dolar-tipo-de-cambio-del-dolar-hoy-14-de-abril-del-2026-174078.html
,capradio.org,Sacramento DACA recipient ordered to travel thousands of miles for court,https://www.capradio.org/articles/2026/04/14/sacramento-daca-recipient-ordered-to-travel-thousands-of-miles-for-court/
,diariodigitalrd.com,RD se afianza como líder turístico del Caribe,https://diariodigitalrd.com/2026/04/14/rd-se-afianza-como-lider-turistico-del-caribe.html
,therealdeal.com,"New York Top Real Estate Deals : Monday , April 13 , 2026",https://therealdeal.com/new-york/2026/04/14/new-york-top-real-estate-deals-monday-april-13-2026/
,dunya.com,Küresel risk iştahı kriptoyu uçurdu : Bitcoin 74 bin doları aştı,https://www.dunya.com/finans/kripto-para/kuresel-risk-istahi-kriptoyu-ucurdu-bitcoin-74-bin-dolari-asti-haberi-821611
,isp.netscape.com,"Trump promised tax relief , but polling shows most Americans still think theyre overpaying",https://isp.netscape.com:443/news/story/0001/20260414/7c51405c441d56bcc4d5747fb587742c
,diariodeavila.es,El FMI rebaja su previsión de crecimiento mundial por la guerra,https://www.diariodeavila.es/noticia/z086d4d52-2e03-4cfe-beca0e1deb7db409/202604/el-fmi-rebaja-su-prevision-de-crecimiento-mundial-por-la-guerra
,newsbomb.gr,"Ο πλανήτης θα καταναλώσει το 2026 το λιγότερο πετρέλειο από την περίοδο του Covid , λόγω του πολέμου",https://www.newsbomb.gr/kosmos/story/1728811/o-planitis-tha-katanalosei-to-2026-to-ligotero-petreleio-apo-tin-periodo-tou-covid-logo-tou-polemou
,araratonline.com,MEDam : Turism medical în Armenia,https://www.araratonline.com/?p=99056
,dailypost.ng,Gbajabiamila lauds FCT Minister over landmark Hypercity - Carrefour deal,https://dailypost.ng/2026/04/14/gbajabiamila-lauds-fct-minister-over-landmark-hypercity-carrefour-deal/
,dominicanrepublicpost.com,"Can Pakistan juggle US - Iran mediation with Saudi defence commitments ? - Dominican Republic Post – Caribbean News , Business , Travel & Culture",https://dominicanrepublicpost.com/can-pakistan-juggle-us-iran-mediation-with-saudi-defence-commitments/
,acento.com.do,"Acoprovi alerta por inflación , permisología y alza de insumos , pero ve señales de recuperación en la construcción",https://acento.com.do/economia/acoprovi-alerta-por-inflacion-permisologia-y-alza-de-insumos-pero-ve-senales-de-recuperacion-en-la-construccion-9659348.html
,forbes.com,​Guerrilla Recruiting Has Gone Too Far,https://www.forbes.com/councils/forbesbusinesscouncil/2026/04/14/guerrilla-recruiting-has-gone-too-far/
,diena.lv,ZZS aizvien atturas no lēmuma pieņemšanas par finanšu atbalstu airBaltic,https://www.diena.lv/raksts/latvija/politika/zzs-aizvien-atturas-no-lemuma-pienemsanas-par-finansu-atbalstu-_airbaltic_-14350474
