title,title_en,source,url,published_at,language,section
El Gobierno de Aragón y el Tribunal Superior de Justicia de Aragón muestran su unidad para reclamar las once plazas judiciales previstas,The Government of Aragon and the Superior Court of Justice of Aragon show unity to demand the eleven planned judicial positions,elperiodicodearagon.com,https://www.elperiodicodearagon.com/aragon/2026/07/21/gobierno-aragon-tribunal-superior-justicia-132669506.html,,Spanish,Other
Kimi K3来了 ， 中国大模型开始给硅谷出题,"Kimi K3 is here, Chinese large models begin to set questions for Silicon Valley",baijiahao.baidu.com,https://baijiahao.baidu.com/s?id=1871232953871904671,,Chinese,Other
US military says it carrying out its 10th consecutive night of strikes on Iran,US military says it carrying out its 10th consecutive night of strikes on Iran,wibw.com,https://www.wibw.com/2026/07/20/expansion-us-strikes-iran-leads-more-retaliation-across-gulf/,,English,Geopolitics
Super El Niño threatens to pile more supply shocks on vulnerable world,Super El Niño threatens to pile more supply shocks on vulnerable world,financialpost.com,https://financialpost.com/news/super-el-nino-threatens-to-pile-supply-shocks-vulnerable-world,,English,Other
What to know about the landmark Warner Bros .  Discovery sale,What to know about the landmark Warner Bros .  Discovery sale,techcrunch.com,https://techcrunch.com/2026/07/21/warner-bros-netflix-paramount-acquisition-timeline-wbd/,,English,Other
