published_at,source,title,url
,monumental.co.cr,Cierre de Spirit Airlines : cómo afectará a los viajeros y a los precios de los vuelos - Monumental,https://www.monumental.co.cr/2026/05/02/cierre-de-spirit-airlines-como-afectara-a-los-viajeros-y-a-los-precios-de-los-vuelos/
,mikrometoxos.gr,Ηλεκτρικό ρεύμα : Οι πάροχοι κρατούν « φρένο » στις μειώσεις – Στα ίδια επίπεδα τα τιμολόγια τον Μάιο,https://www.mikrometoxos.gr/ilektriko-revma-oi-parochoi-kratoun-freno-stis-meioseis-sta-idia-epipeda-ta-timologia-ton-maio/
,b92.net,"Svi komentari - Vrednost tržišta nepokretnosti u 2025 . iznosila 8 , 1 milijardu evra : Rast od 8 , 6 odsto",https://www.b92.net/svi-komentari/229947
,esaimaa.fi,Miika Suntisen padelporukka avasi ulkokauden auringon helliessä – Lappeenrannan kesänviettopaikat täyttyivät lauantaina,https://www.esaimaa.fi/paikalliset/9421379
,newsx.com,Mehul Purohit Leads Multiphase Digital to Double Win at IDEA Awards,https://www.newsx.com/business/mehul-purohit-leads-multiphase-digital-to-double-win-at-idea-awards-208893/
,lesnumeriques.com,NordVPN vs Proton VPN : quel VPN choisir entre sécurité avancée et simplicité dutilisation ?,https://www.lesnumeriques.com/vpn/nordvpn-vs-proton-vpn-quel-vpn-choisir-entre-securite-avancee-et-simplicite-d-utilisation-a254507.html
,tech.ifeng.com,苹果悄悄砍掉丐版Mac mini ， 一个人人都要交  AI 税  的时代来了 _ 凤凰网,https://tech.ifeng.com/c/8snjTTZC49Y
,money.pl,Nie tylko na Pomorzu . Nowe Trójmiasto na mapie Polski,https://www.money.pl/gospodarka/nowe-trojmiasto-w-swietokrzyskiem-nie-chca-czekac-na-mitycznych-inwestorow-7281569825245216a.html
,wysu.org,Can Trump latest pick for surgeon general make it through confirmation ?,https://wysu.org/npr-national-news/2026-05-02/can-trumps-latest-pick-for-surgeon-general-make-it-through-confirmation
,prabhatkhabar.com,"राजा शिवाजी  का बॉक्स ऑफिस पर तूफान जारी , जानें दूसरे दिन शाम 5 बजे तक की कमाई |Raja Shivaji Box Office Collection Day 2",https://www.prabhatkhabar.com/entertainment/bollywood/raja-shivaji-box-office-collection-day-2-riteish-deshmukh-film-performance
,howtogeek.com,Set and forget  NAS setups are a myth ( and they put your data at risk ),https://www.howtogeek.com/set-it-and-forget-it-nas-setups-are-a-myth-heres-why/
,noticiasdecoimbra.pt,PCP quer aumento das pensões em 50 euros a partir de julho,https://www.noticiasdecoimbra.pt/pcp-quer-aumento-das-pensoes-em-50-euros-a-partir-de-julho/
,wcsufm.org,Trends still go from the runway to retail . A lot has changed in how they get there,https://www.wcsufm.org/2026-05-02/trends-still-go-from-the-runway-to-retail-a-lot-has-changed-in-how-they-get-there
,mangalorean.com,"Rules meant to empower , not humiliate : Naveen Patnaik writes to FM Sitharaman over Keonjhar bank case",https://www.mangalorean.com/rules-meant-to-empower-not-humiliate-naveen-patnaik-writes-to-fm-sitharaman-over-keonjhar-bank-case/
,mikrometoxos.gr,Exxon Mobil : Προειδοποίηση για νέα άνοδο στις τιμές πετρελαίου,https://www.mikrometoxos.gr/exxon-mobil-proeidopoiisi-gia-neo-kyma-anodou-stis-times-petrelaiou/
,finance.yahoo.com,"Robert Kiyosaki predicted up to 15 , 000 % upside in 3 assets , saying the  best time to get rich is approaching",https://finance.yahoo.com/markets/crypto/articles/robert-kiyosaki-predicted-15-000-120000891.html
,b92.net,"Vrednost tržišta nepokretnosti u 2025 . iznosila 8 , 1 milijardu evra : Rast od 8 , 6 odsto",https://www.b92.net/biz/moj-kvadrat/aktuelno/229947/vrednost-trzista-nepokretnosti-u-2025-iznosila-81-milijardu-evra-rast-od-86-odsto/vest
,elmanana.com.mx,Horóscopos Mhoni Vidente para HOY sábado 2 de mayo del 2026,https://www.elmanana.com.mx/escena/2026/5/2/horoscopos-mhoni-vidente-para-hoy-sabado-de-mayo-del-2026-175350.html
,kabar24.bisnis.com,Kalender Jawa Hari Ini Bulan Mei 2026 Lengkap dengan Weton dan Neptunya,https://kabar24.bisnis.com/read/20260502/79/1970844/kalender-jawa-hari-ini-bulan-mei-2026-lengkap-dengan-weton-dan-neptunya
,lesnumeriques.com,"Amazon et Nintendo se livrent une guerre commerciale depuis 20 ans , de la Wii jusqu  à la Switch 2",https://www.lesnumeriques.com/console-de-jeu/amazon-et-nintendo-se-livrent-une-guerre-commerciale-depuis-20-ans-de-la-wii-jusqu-a-la-switch-2-n255309.html
,tt.com,„ Unentgeltliche Vertretung  in FinanzOnline über 21 . 000 Mal genutzt | Tiroler Tageszeitung – Aktuelle Nachrichten auf tt . com,https://www.tt.com/artikel/30933132/unentgeltliche-vertretung-in-finanzonline-ueber-21-000-mal-genutzt
,ocregister.com,Ben Allen : A blueprint for a more resilient California and insurance system,https://www.ocregister.com/2026/05/02/ben-allen-a-blueprint-for-a-more-resilient-california-and-insurance-system/
,money.pl,"To oczywista przewaga . Szef chińskiego producenta aut mówi nam , czym chce wygrać z rywalami z Europy",https://www.money.pl/mobility/to-oczywista-przewaga-szef-chinskiego-producenta-aut-mowi-nam-czym-chce-wygrac-z-rywalami-z-europy-7280126395168768a.html
,fool.com,Amazon Just Proved It No Longer an AI Underdog,https://www.fool.com/investing/2026/05/02/amazon-just-proved-its-no-longer-an-ai-underdog/?source=iedfolrf0000001
,prabhatkhabar.com,"West Bengal Election 2026 Muslim Vote Turnout : अल्पसंख्यक बेल्ट की वोटिंग में 20 प्रतिशत तक उछाल , ये दीदी की सत्ता की गारंटी है या परिवर्तन का संकेत ?",https://www.prabhatkhabar.com/state/west-bengal/kolkata/west-bengal-election-2026-muslim-dominated-seats-voter-turnout-surge-murshidabad-malda
,listenupyall.com,Trump likes the idea of the government owning some US companies but took a pass on Spirit Airlines,https://listenupyall.com/2026/05/02/trump-likes-the-idea-of-the-government-owning-some-us-companies-but-took-a-pass-on-spirit-airlines/
,biz.heraldcorp.com,"비트코인 , 2030년까지 10배 오른다 … 돈나무 언니  의 대폭등 전망 , 왜 ?",https://biz.heraldcorp.com/article/10730133
,fool.com,Infleqtion Went Public in February -- Here Why This Cold Atom Stock Could Be a Breakout Buy,https://www.fool.com/investing/2026/05/02/infleqtion-went-public-in-february-heres-why-this/?source=iedfolrf0000001
,kreiszeitung.de,Deutsche KI - Startups : „ Wir müssen uns nicht vorm Silicon Valley verstecken,https://www.kreiszeitung.de/wirtschaft/deutsche-ki-startups-wir-muessen-uns-nicht-vorm-silicon-valley-verstecken-zr-94286597.html
,autonews.fr,La menace de Donald Trump contre les voitures européennes na presque pas de sens,https://www.autonews.fr/actualite/automobile-la-menace-de-donald-trump-de-surtaxer-les-voitures-europeennes-pourrait-faire-pschitt-145241
,wfaa.com,Several airlines offer special rates for Spirit ticketholders after carrier ceases operations,https://www.wfaa.com/article/news/nation-world/airlines-special-rates-fares-discounts-spirit-airlines-ceases-operations-cancels-flights/507-c1ab9417-18e5-418d-b751-400a937dc880
,tuoitre.vn,Bộ Công an : Dự án  Nuôi em  không có dấu hiệu của tội phạm,https://tuoitre.vn/bo-cong-an-du-an-nuoi-em-khong-co-dau-hieu-cua-toi-pham-2026040316471113.htm
,zonebourse.com,Alignement d  étoiles pour Constellium SE .,https://www.zonebourse.com/actualite-bourse/alignement-d-etoiles-pour-constellium-se-ce7f58ded888f021
,al-monitor.com,Iran military official says renewed war with US  likely,https://www.al-monitor.com/originals/2026/05/iran-military-official-says-renewed-war-us-likely
,b92.net,Vučić : Podneto više od 11 . 000 zahteva za stambene kredite za mlade,https://www.b92.net/biz/srbija/vesti/229989/vucic-podneto-vise-od-11000-zahteva-za-stambene-kredite-za-mlade/vest
,elperiodico.com,Ferran Adrià y Rigoberta Bandini brillan en una noche de estrellas,https://www.elperiodico.com/es/opinion/20260502/ferran-adria-rigoberta-bandini-brillan-129715266
,diena.lt,Trumpas paskelbė naujas sankcijas Kubos vyriausybei,https://diena.lt/naujienos/pasaulis/ekonomika-ir-politika/trumpas-paskelbe-naujas-sankcijas-kubos-vyriausybei-1754355
,ellitoral.com,Récord histórico de girasol : Argentina alcanza una producción inédita,https://www.ellitoral.com/campolitoral/girasol-produccion-exportaciones-industria_0_jMhWVyKIpy.html
,luimagazine.fr,"Bruno Le Maire : laddition était trop salée , il a préféré l  écrire – Lui Magazine",http://luimagazine.fr/culture/bruno-le-maire-laddition-etait-trop-salee-il-a-prefere-lecrire/
,dostor.org,سعر الريال السعودي أمام الجنيه المصري اليوم السبت 2 مايو 2026,https://www.dostor.org/5535277
,jornaleconomico.sapo.pt,Generali Tranquilidade abre 80 vagas para jovens em nova edio de programas de Trainees,https://jornaleconomico.sapo.pt/noticias/generali-tranquilidade-abre-80-vagas-para-jovens-em-nova-edicao-de-programas-de-trainees/
,globovision.com,Arquidiócesis de Nueva York acuerda pagar 800 millones de dólares a 1 . 300 víctimas de abuso clerical,https://www.globovision.com/internacional/55204/arquidiocesis-de-nueva-york-acuerda-pagar-800-millones-de-dolares-a-1300-victimas-de-abuso-clerical
,newsx.com,"Switched To BJP , Then FIR : Sandeep Pathak Faces Non - Bailable Cases In Punjab , BJP Calls It  Political Vendetta",https://www.newsx.com/regionals/sandeep-pathak-faces-fir-non-bailable-cases-in-punjab-bjp-calls-it-political-vendetta-bjp-aap-punjab-208733/
,informer.rs,Predsednik Vučić u Kolegijumu Informera,https://informer.rs/drustvo/vesti/1111841/predsednik-vucic-autoput-gradnja
,tribuna.com.mx,Precio del dólar HOY sábado 2 de mayo del 2026 en México : Conoce el tipo de cambio este fin de semana,https://tribuna.com.mx/espectaculos/2026/05/02/precio-del-dolar-hoy-sabado-2-de-mayo-del-2026-en-mexico-conoce-el-tipo-de-cambio-este-fin-de-semana_520134/
,newsx.com,"Indus Towers Q4 FY26 Results : Profit Rises 0 . 8 % to ₹1 , 793 Crore , Revenue Up 4 . 8 %; Declares Dividend Amid Steady Performance",https://www.newsx.com/business/indus-towers-q4-fy26-results-profit-rises-08-to-1793-crore-revenue-up-48-declares-dividend-amid-steady-performance-208803/
,kienthuc.net.vn,"3 cây cảnh bonsai giúp trấn trạch , xua tà khí , chiêu tài giữ lộc",https://kienthuc.net.vn/3-cay-canh-bonsai-giup-tran-trach-xua-ta-khi-chieu-tai-giu-loc-post1615081.html
,praca.egospodarka.pl,Praca Pracownik / Pracownica Pomocnicza na zmywak - oferty pracy dostarczone przez SmartLunch,"https://www.praca.egospodarka.pl/oferty-pracy/smartlunch/pracownik-pracownica-pomocnicza-na-zmywak,69529496.html"
,elmanana.com.mx,Dólar arranca mayo con paso firme frente al peso mexicano ; tipo de cambio HOY sábado 2 de mayo,https://www.elmanana.com.mx/nacional/2026/5/2/mayo-inicia-con-el-dolar-marcando-el-ritmo-al-peso-mexicano-tipo-de-cambio-hoy-sabado-de-mayo-de-2026-175379.html
,finance.yahoo.com,Fed Hammack says no longer appropriate to signal rate cut bias,https://finance.yahoo.com/economy/policy/articles/feds-hammack-says-no-longer-120817318.html
,praca.egospodarka.pl,Praca Magazynier ds . Części Lotniczych ( K / M ) - oferty pracy dostarczone przez LOT Aircraft Maintenance Services Sp . z o . o .,"https://www.praca.egospodarka.pl/oferty-pracy/lot-aircraft-maintenance-services-sp-z-o-o/magazynier-ds-czesci-lotniczych-k-m,69529490.html"
,praca.egospodarka.pl,Praca Serwistantka - Instalatorka / Serwisant - Instalator Urządzeń do Uzdatniania Wody - oferty pracy dostarczone przez HYDROPURE POLSKA Sp . z o . o .,"https://www.praca.egospodarka.pl/oferty-pracy/hydropure-polska-sp-z-o-o/serwistantka-instalatorka-serwisant-instalator-urzadzen-do-uzdatniania-wody,69529497.html"
,civonline.it,"Ex Carcerette , il costo dellattesa : 110mila euro per proteggere un palazzo storico che non riapre",https://www.civonline.it/news/cronaca/1346202/ex-carcerette-il-costo-dellattesa-110mila-euro-per-proteggere-un-palazzo-storico-che-non-riapre.html
,ajansspor.com,Napoliden McTominaya uzun vadeli sözleşme planı !,https://ajansspor.com/haber/napoliden-mctominaya-uzun-vadeli-sozlesme-plani-724877
,fortune.com,The American household just took an 81 % margin cut . Wall Street hasnt priced it in,https://fortune.com/2026/05/02/household-margin-compression-81-percent-wall-street-hormuz-katica-roy/
,fool.com,"While Oil Prices Skyrocketed in the First Quarter , ExxonMobil Profits Fell . Here What Happened .",https://www.fool.com/investing/2026/05/02/while-oil-prices-skyrocketed-in-the-first-quarter/?source=iedfolrf0000001
,fool.com,April Was the Best Month for the Market Since 2020 . Here What Driving It .,https://www.fool.com/investing/2026/05/02/april-best-month-for-market-since-2020/?source=iedfolrf0000001
,jornalcruzeiro.com.br,Moradias individuais crescem em Sorocaba e no Estado,https://www.jornalcruzeiro.com.br/sorocaba/noticias/2026/05/760036-moradias-individuais-crescem-em-sorocaba-e-no-estado.html
,ocregister.com,Steven Bradford : Making California insurance marketplace more affordable and reliable – Orange County Register,https://www.ocregister.com/2026/05/02/steven-bradford-making-californias-insurance-marketplace-more-affordable-and-reliable/
,ksta.de,Eskalation auf Flohmarkt : Streit um Kinderwagen endet mit Messerdrohung,https://www.ksta.de:443/panorama/eskalation-auf-flohmarkt-streit-um-kinderwagen-endet-mit-messerdrohung-1274039
,srilankasource.com,"Wall Street steady near peak as oil prices surge , then retreat",http://www.srilankasource.com/news/279022187/wall-street-steady-near-peak-as-oil-prices-surge-then-retreat
,estadao.com.br,UE apoia acordo de patentes entre montadoras e gera reao dos EUA,https://www.estadao.com.br/jornal-do-carro/ue-avaliza-acordo-de-patentes-entre-montadoras-e-provoca-reacao-dos-eua/
,k.sina.com.cn,买小车就要高配 ， 零跑T03正式上市 - 汽车频道,https://k.sina.com.cn/article_7857141524_1d4527714019022ige.html
,jpost.com,The first cataract surgery was performed using Apple Vision Pro,http://www.jpost.com/consumerism/article-894665
,cravenherald.co.uk,The Real Greek to close 9 restaurants despite rescue deal,https://www.cravenherald.co.uk/news/national/uk-today/26074109.real-greek-close-9-restaurants-despite-rescue-deal/
,fool.com,Working Past Age 62 Could Quietly Shrink Your Social Security Checks,https://www.fool.com/retirement/2026/05/02/working-past-age-62-could-quietly-shrink-your-soci/?source=iedfolrf0000001
,bahianoticias.com.br,Inflao de alimentos põe em xeque bondades eleitorais de Lula,https://www.bahianoticias.com.br/folha/noticia/390298-inflacao-de-alimentos-poe-em-xeque-bondades-eleitorais-de-lula
,elciudadanoweb.com,"Se va otra vez : Milei vuelve a viajar a Estados Unidos , ahora para conferencia en un foro creado por el rey de los bonos basura",https://elciudadanoweb.com/se-va-otra-vez-milei-vuelve-a-viajar-a-estados-unidos-ahora-para-conferencia-en-un-foro-creado-por-el-rey-de-los-bonos-basura/
,finance.yahoo.com,1 Momentum Stock Worth Your Attention and 2 We Question,https://finance.yahoo.com/markets/stocks/articles/1-momentum-stock-worth-attention-134855371.html
,163.com,苹果探路失败 ， 有品牌放弃Air迭代,https://www.163.com/dy/article/KRV2P3VK0511ADC6.html
,ocregister.com,Jane Kim : Now is the time for Disaster Insurance for All,https://www.ocregister.com/2026/05/02/jane-kim-now-is-the-time-for-disaster-insurance-for-all/
,news.day.az,Azərbaycanın qiymətli metallar bazarının həftəlik İCMALI,https://news.day.az/azerinews/1831918.html
,haberankara.com,"Keçiren Belediyesi , 3 Mayıs Türklük Gün programı düzenleyecek !",https://www.haberankara.com/kecioren-haberleri/kecioren-belediyesi-3-mayis-turkculuk-gunu-programi-duzenleyecek-314179
,eluniversal.com.co,Números de la suerte para cada signo zodiacal este 2 de mayo,https://www.eluniversal.com.co/farandula/2026/05/02/numeros-de-la-suerte-para-cada-signo-zodiacal-este-2-de-mayo/
,vermilionstandard.com,Shift into spring with these white wines | Vermilion Standard,https://www.vermilionstandard.com:443/life/food/oleksyn-shift-into-spring-with-these-white-wines
,tf1info.fr,"Pratiques cruelles , consanguinité ... Que prévoit la loi européenne pour le bien - être des chiens et des chats ?",https://www.tf1info.fr/conso/pratiques-cruelles-consanguinite-que-prevoit-la-loi-europeenne-pour-le-bien-etre-des-chiens-et-des-chats-2439363.html
,techz.vn,"Giá xăng dầu hôm nay ngày 2 / 5 : Giá xăng thế giới tiếp tục giảm ? Xăng RON95 , dầu diesel giá bao nhiêu",https://www.techz.vn/196-526-5-gia-xang-dau-hom-nay-ngay-2-5-gia-xang-the-gioi-tiep-tuc-giam-xang-ron95-dau-diesel-gia-bao-nhieu-ylt689833.html
,tuoitre.vn,Giá sầu riêng Việt ập sàn  do giá tại Trung Quốc giảm mạnh ?,https://tuoitre.vn/gia-sau-rieng-viet-sap-san-do-gia-tai-trung-quoc-giam-manh-20260502195424223.htm
,jornaldebrasilia.com.br,Corte em subveno do governo desenha mais um ano negativo para o seguro rural,https://jornaldebrasilia.com.br/noticias/economia/corte-em-subvencao-do-governo-desenha-mais-um-ano-negativo-para-o-seguro-rural/
,odatv.com,Düzenleme gündemde ... Ara tatil açıklaması,https://www.odatv.com/egitim/duzenleme-gundemde-ara-tatil-aciklamasi-120145519
,soester-anzeiger.de,CDU und SPD stimmen für Koalitionsvertrag in Rheinland - Pfalz,http://www.soester-anzeiger.de/politik/cdu-und-spd-stimmen-fuer-koalitionsvertrag-in-rheinland-pfalz-zr-94288631.html
,indianexpress.com,Inside Rashin  Palatla Mutton : A 60 - year - old food tradition in Maharashtra,https://indianexpress.com/article/pune/rashin-palatla-mutton-maharashtra-tradition-10667884/
,jornaldebrasilia.com.br,"Entre Brasil e Alemanha : esposa de Roger Wittmann , Francielli Lopes transforma experiência no varejo em estratégia no mercado imobiliário",https://jornaldebrasilia.com.br/entretenimento/katia-flavia/entre-brasil-e-alemanha-esposa-de-roger-wittmann-francielli-lopes-transforma-experiencia-no-varejo-em-estrategia-no-mercado-imobiliario/
,20minutes.fr,"Etats - Unis  : En difficulté , la compagnie low cost Spirit Airlines annule tous ses vols et stoppe son activité",https://www.20minutes.fr/monde/etats-unis/4221473-20260502-etats-unis-difficulte-compagnie-low-cost-spirit-airlines-annule-tous-vols-stoppe-activite
,viva.co.id,Industri Asuransi Percepat Transformasi Digital untuk Tingkatkan Layanan,https://www.viva.co.id/bisnis/1896044-industri-asuransi-percepat-transformasi-digital-untuk-tingkatkan-layanan
,kocaeligazetesi.com.tr,Bir uyarı da Kocaeli Valiliğinden geldi,https://www.kocaeligazetesi.com.tr/haber/27916611/bir-uyari-da-kocaeli-valiliginden-geldi
,yahoo.com,"Yemen introduced the world to coffee . Now , its coffeehouse culture is booming in the US",https://www.yahoo.com/lifestyle/articles/yemen-introduced-world-coffee-now-134705959.html
,stockbiz.vn,Internet tại Iran gần như tê liệt suốt 64 ngày liên tiếp,https://stockbiz.vn/tin-tuc/internet-tai-iran-gan-nhu-te-liet-suot-64-ngay-lien-tiep/39737244
,money.it,"La BCE sta sbagliando di nuovo . E stavolta a pagare sarà lItalia , due volte",https://www.money.it/La-BCE-sta-sbagliando-di-nuovo-E
,ratopati.com,नेपाल उद्योग वाणिज्य महासङ्घको नयाँ नेतृत्व निर्माण र नयाँ सरकारसँगको सहकार्य | Nepal first 24 - hour updated news portal,https://www.ratopati.com/story/560529/building-a-new-leadership-for-the-federation-of-nepalese-chambers-of-commerce-and-industry-and-collaborating-with-the-new-government
,acento.com.do,"Los dramas familiares que se esconden detrás de Samsung , el imperio tecnológico que comenzó como una tienda de comidas",https://acento.com.do/bbc-news-mundo/los-dramas-familiares-que-se-esconden-detras-de-samsung-el-imperio-tecnologico-que-comenzo-como-una-tienda-de-comidas-9671171.html
,lb.ua,Безпечне боргове навантаження у 2026 році : скільки кредитів може дозволити собі українець,https://lb.ua/economics/2026/05/02/736054_bezpechne_borgove_navantazhennya.html
,stockbiz.vn,Cổ phiếu giảm giá mạnh tháng 4 : Nhóm năng lượng  đuối sức,https://stockbiz.vn/tin-tuc/co-phieu-giam-gia-manh-thang-4-nhom-nang-luong-duoi-suc/39737256
,zeri.info,Kuba dënon sanksionet e reja të SHBA - së : Të paligjshme dhe abuzive,https://zeri.info/bota/621194/kuba-denon-sanksionet-e-reja-te-shba-se-te-paligjshme-dhe-abuzive/
,phonandroid.com,"216 € de remise sur le Pixel 9a chez Amazon , mais ça ne va pas durer",https://www.phonandroid.com/216-e-remise-pixel-9a-amazon-mais-ca-pas-durer.html
,eveningnews24.co.uk,Hundreds queue for new Forbidden Planet shop in Norwich,https://www.eveningnews24.co.uk/news/26073981.hundreds-queue-new-forbidden-planet-shop-norwich/
,t24.com.tr,"Trabzonsporun borcu açıklandı : Başkan Doğan , mali tabloyla ilgili çarpıcı açıklamalar yaptı","https://t24.com.tr/spor/trabzonsporun-borcu-aciklandi-baskan-dogan-mali-tabloyla-ilgili-carpici-aciklamalar-yapti,1318795"
,lanacion.com.py,La Nación / Destacan impacto en más de 250 . 000 familias con la nueva Ley de Etanol,https://www.lanacion.com.py/negocios/2026/05/02/destacan-impacto-en-mas-de-250000-familias-con-la-nueva-ley-de-etanol/
,satellitetoday.com,"HawkEye 360 Files to Go Public , Reports $99M in Revenue in 2025",https://www.satellitetoday.com/finance/2026/04/27/hawkeye-360-files-to-go-public-reports-99m-in-revenue-in-2025/
,eluniversal.com.co,La reconocida aerolínea de bajo costo que suspenderá vuelos y dejará de operar,https://www.eluniversal.com.co/mundo/2026/05/02/la-reconocida-aerolinea-de-bajo-costo-que-suspendera-vuelos-y-dejara-de-operar/
,newsx.com,"Spirit Airlines Shuts Down : Thousands Of Jobs Lost As Iran War Fuel Surge Sinks Carrier , Dealing Blow To Trump $500 Million Bailout Plan",https://www.newsx.com/world/spirit-airlines-shuts-down-thousands-of-jobs-lost-as-iran-war-fuel-surge-sinks-carrier-dealing-blow-to-trump-500-million-bailout-plan-208707/
,woman.elperiodico.com,"Se esperan colas kilométricas por el Día de la Madre en Lidl : el cepillo moldeador 5 en 1 más barato del mercado cuesta menos de 30 euros , tiene protección contra sobrecalentamiento y buenísimas reseñas",https://woman.elperiodico.com/lifestyle/esperan-colas-kilometricas-dia-madre-lidl-cepillo-moldeador-barato-30-euros-tendencia-regalo-129768849
,wlz-online.de,EU und Wirtschaft kritisieren Trumps neue Zollpläne,http://www.wlz-online.de/wirtschaft/eu-und-wirtschaft-kritisieren-trumps-neue-zollplaene-zr-94288310.html
,newsx.com,"Will Bengal Falta Vote For The Third Time ? Clashes Rock Re - Poll , BJP Demands Voting Again",https://www.newsx.com/elections/west-bengal-elections-falta-poll-day-clashes-bjp-demand-repolling-election-commission-reacts-208885/
,stockbiz.vn,VNM : Lợi nhuận quý I / 2026 của Vinamilk đạt gần 2 . 500 tỷ đồng,https://stockbiz.vn/tin-tuc/vnm-loi-nhuan-quy-i2026-cua-vinamilk-dat-gan-2500-ty-dong/39737202
,myanmarnews.net,Stocks hover near highs despite volatile oil markets,http://www.myanmarnews.net/news/279022187/stocks-hover-near-highs-despite-volatile-oil-markets
,naidunia.com,"14 साल का इंतजार होगा खत्म ! चिटफंड कंपनी KMJ की 35 कंपनियां होगी नीलाम , ₹55 करोड़ की सरकारी कीमत तय",https://www.naidunia.com/madhya-pradesh/gwalior-14-year-wait-comes-to-an-end-35-companies-belonging-to-chit-fund-firm-kmj-to-be-auctioned-8436847
,ajansspor.com,Piyasa karıştı : Beşiktaş  ın istediği futbolcuya servet talebi,https://ajansspor.com/haber/piyasa-karisti-besiktasin-istedigi-futbolcuya-servet-talebi-724870
,gazettelive.co.uk,Teesside restaurants facing closure as Premier Inn parent company announces savings plan,https://www.gazettelive.co.uk/news/teesside-news/teesside-beefeaters-brewers-fayre-closing-33878120
,indiapost.com,Spirit Airlines  winds Down  Its Operations Due To Financial Troubles ; Cancels All Flights » IndiaPost NewsPaper,https://indiapost.com/spirit-airlines-winds-down-its-operations-due-to-financial-troubles-cancels-all-flights/
,srilankasource.com,PhysicsWallah AcadFly announces scholarship pool of 2 crore for study abroad aspirants,http://www.srilankasource.com/news/279025632/physicswallah-acadfly-announces-scholarship-pool-of-2-crore-for-study-abroad-aspirants
,tecmundo.com.br,"Que fim levou o Winamp , reprodutor de mídia que fazia sucesso nos anos 2000 ?",https://www.tecmundo.com.br/internet/412796-que-fim-levou-o-winamp-reprodutor-de-midia-que-fazia-sucesso-nos-anos-2000.htm
,milenio.com,Precio del dólar HOY sábado 2 de mayo EN VIVO | Cotización al momento,https://www.milenio.com/negocios/precio-del-dolar-hoy-2-mayo-2026-a-cuanto-cotiza-en-vivo-atm
,stockbiz.vn,Nhiên liệu sinh học Dung Quất tăng công suất cho lộ trình xăng E10,https://stockbiz.vn/tin-tuc/nhien-lieu-sinh-hoc-dung-quat-tang-cong-suat-cho-lo-trinh-xang-e10/39737282
,ksta.de,SPD - Chef Klingbeil will Gering - und Mittelverdiener entlasten : Steuerreform mit Kritik,https://www.ksta.de:443/politik/spd-chef-klingbeil-will-gering-und-mittelverdiener-entlasten-steuerreform-mit-kritik-1274044
,stockbiz.vn,Thế giới kinh tế  hai tốc độ  và sự chênh lệch giàu nghèo ngày càng rõ nét,https://stockbiz.vn/tin-tuc/the-gioi-kinh-te-hai-toc-do-va-su-chenh-lech-giau-ngheo-ngay-cang-ro-net/39737286
