published_at,source,title,url
,tehachapinews.com,4 simple ways to support your brain health,https://www.tehachapinews.com/online_features/senior_living/4-simple-ways-to-support-your-brain-health/article_e5d7b575-faa9-5978-b8f1-443c9e8c9222.html
,prnewswire.com,"Lotus Domaine Fund III , LP Announces Strategic Investment Relationship with OPENVC Fund I , LP",https://www.prnewswire.com/news-releases/lotus-domaine-fund-iii-lp-announces-strategic-investment-relationship-with-openvc-fund-i-lp-302703942.html
,benzinga.com,Ross Stores Gains After Q4 Double Beat And Upbeat Outlook - Ross Stores ( NASDAQ : ROST ),https://www.benzinga.com/trading-ideas/movers/26/03/51033170/ross-stores-gains-after-q4-double-beat-and-upbeat-outlook
,hoy.es,Abascal pide a Feijóo que presente « una moción de censura urgente » para « retratar » a Sánchez,https://www.hoy.es/nacional/abascal-pide-feijoo-presente-mocion-censura-urgente-20260304144850-ntrc.html
,finance.sina.com.cn,看遍了所有的 「 AI PC 」， 原来 Mac 一直在这里｜AI 器物志,https://finance.sina.com.cn/tech/roll/2026-03-04/doc-inhpvtwm7101491.shtml
,arthosuchak.com,সামাজিক নিরাপত্তা কর্মসূচির সেবা ডিজিটাল মাধ্যম ছাড়া দেওয়া হবে না : প্রধানমন্ত্রীর উপদেষ্টা,https://www.arthosuchak.com/archives/950090/%E0%A6%B8%E0%A6%BE%E0%A6%AE%E0%A6%BE%E0%A6%9C%E0%A6%BF%E0%A6%95-%E0%A6%A8%E0%A6%BF%E0%A6%B0%E0%A6%BE%E0%A6%AA%E0%A6%A4%E0%A7%8D%E0%A6%A4%E0%A6%BE-%E0%A6%95%E0%A6%B0%E0%A7%8D%E0%A6%AE%E0%A6%B8-2/
,telegrafi.com,"Rritja e çmimit të derivateve si rrjedhojë e konfliktit në Lindje , Kusari - Lila cakton marzhën",https://telegrafi.com/rritja-e-cmimit-te-derivateve-kusari-lila-merr-vendim/
,tickerreport.com,"Teachers Retirement System of The State of Kentucky Sells 7 , 342 Shares of AstraZeneca PLC $AZN",https://www.tickerreport.com/banking-finance/13367179/teachers-retirement-system-of-the-state-of-kentucky-sells-7342-shares-of-astrazeneca-plc-azn.html
,morningstar.com,Canada Monetary Reserves Decrease $525 Million in February,https://www.morningstar.com/news/dow-jones/202603045131/canada-monetary-reserves-decrease-525-million-in-february
,huffingtonpost.it,Cronaca del nulla . Due ore ad aspettare chi accorre a commemorare Khamenei,https://www.huffingtonpost.it/politica/2026/03/04/news/cronaca_del_nulla_due_ore_ad_aspettare_chi_accorre_a_commemorare_khamenei-21347756/
,finance.yahoo.com,BHP Group Limited ( BHP ) Stock Forecasts,https://finance.yahoo.com/research/reports/ARGUS_3655_AnalystReport_1772626587000
,meedia.de,Thomy feiert sein Firmenjubiläum mit einer augenzwinkernden Crime - Serie,http://meedia.de/news/beitrag/21259-thomy-feiert-sein-firmenjubilaeum-mit-einer-augenzwinkernden-crime-serie.html
,news.fznews.com.cn,2026  闽商影响力  盛典举行 ！ 高新区企业展现大健康闽商力量 _ 福州 _ 新闻频道 _ 福州新闻网,https://news.fznews.com.cn/gaoxin/20260304/z0bMRN8L4I.shtml
,canarias7.es,Se busca estadio para la Finalissima,https://www.canarias7.es/deportes/futbol/seleccion-espanola/busca-estadio-finalissima-20260304125049-ntrc.html
,anconatoday.it,"Ancona , niente Capitale del Mare . Il titolo e un milione di euro vanno a Ravenna",https://www.anconatoday.it/attualita/capitale-del-mare-2026-ravenna-niente-ancona-nello-musumeci.html
,ilpost.it,"Un importante centro di ricerca oncologica è in vendita , ancora una volta",https://www.ilpost.it/2026/03/04/nms-nerviano-centro-ricerca-storia-vendita/
,vietgiaitri.com,"Lật giở lá số tử vi ngày 5 / 3 / 2026 : 4 con giáp khổ tận cam lai , chuẩn bị sẵn bao tải đựng tiền vì quý nhân đã gõ cửa",https://vietgiaitri.com/lat-gio-la-so-tu-vi-ngay-532026-4-con-giap-kho-tan-cam-lai-chuan-bi-san-bao-tai-dung-tien-vi-quy-nhan-da-go-cua-20260304i7649121/
,ealingtimes.co.uk,Some mortgage lenders  pause rate cut plan amid economic uncertainty,https://www.ealingtimes.co.uk/news/national/25906043.mortgage-lenders-pause-rate-cut-plans-amid-economic-uncertainty/
,finance.sina.com.cn,1克拉钻石价格已经1000多了 ： 不少消费者后悔买早了,https://finance.sina.com.cn/tech/roll/2026-03-04/doc-inhpvtwm7086841.shtml
,economictimes.indiatimes.com,"Polymarket trader : How a Polymarket trader made $500 , 000 betting on the death of Iran Ayatollah Ali Khamenei",https://economictimes.indiatimes.com/news/international/us/how-a-polymarket-trader-made-500000-betting-on-the-death-of-irans-ayatollah-ali-khamenei/articleshow/129027245.cms
,ec.ltn.com.tw,比特幣突破7萬1000美元 加密貨幣滿江紅 麻吉大哥做多勝1局,https://ec.ltn.com.tw/article/breakingnews/5359166
,openpr.com,Global Agricultural Tractors Market Set to Reach USD 119 Billion,https://www.openpr.com/news/4412597/global-agricultural-tractors-market-set-to-reach-usd-119-billion
,spanish.peopledaily.com.cn,"Tendencia positiva de la economía china se mantiene sin cambios , afirma portavoz",http://spanish.peopledaily.com.cn/n3/2026/0304/c31620-20431104.html
,plymouthherald.co.uk,Everyone with bank card told to take action before March 19,https://www.plymouthherald.co.uk/news/cost-of-living/everyone-bank-card-told-take-10847362
,borsen.dk,Hegseth : Ubåd har sænket iransk krigsskib – følg med live her,https://borsen.dk/nyheder/udland/hegseth-ubad-har-saenket-iransk-krigsskib-folg-med-live-her
,themarketsdaily.com,Navient Corporation to Issue Quarterly Dividend of $0 . 16 ( NASDAQ : NAVI ),https://www.themarketsdaily.com/2026/03/04/navient-corporation-to-issue-quarterly-dividend-of-0-16-nasdaqnavi.html
,repubblica.it,Oltre le Olimpiadi di Milano - Cortina : ecco gli eventi europei che da soli valgono il viaggio,https://www.repubblica.it/viaggi/2026/03/04/news/non_solo_olimpiadi_milano-cortina_ecco_gli_eventi_europei_che_da_soli_valgono_il_viaggio-425182066/
,business24.ro,Italia ia în calcul repornirea termocentralelor pe cărbune pentru securitatea energetică,https://business24.ro/termocentrale/italia-repornire-termocentrale-carbune-securitate-1643032
,piatafinanciara.ro,Damen Shipyards Mangalia intră în cursa pentru un investitor strategic : CITR depune oficial planul de reorganizare,https://www.piatafinanciara.ro/damen-shipyards-mangalia-intra-in-cursa-pentru-un-investitor-strategic-citr-depune-oficial-planul-de-reorganizare/
,tech.wp.pl,Gamechanger Ukraińców ? Chcą zmienić bieg dwóch wojen,"https://tech.wp.pl/gamechanger-ukraincow-chca-zmienic-bieg-dwoch-wojen,7260646722041952a"
,themarketsdaily.com,South Dakota Investment Council Lowers Stake in Western Alliance Bancorporation $WAL,https://www.themarketsdaily.com/2026/03/04/south-dakota-investment-council-lowers-stake-in-western-alliance-bancorporation-wal.html
,thebftonline.com,Wisconsin Business School dissect 24 - hour economy for youth assimilation,https://thebftonline.com/2026/03/04/wisconsin-business-school-dissect-24-hour-economy-for-youth-assimilation/
,bangkokbiznews.com,เตือนโลกเสี่ยง  Stagflation  เศรษฐกิจก็แย่ เงินเฟ้อก็พุ่ง,https://www.bangkokbiznews.com/world/economics/1223795
,morningstar.com,How to Discuss Portfolio Diversification With Different Types of Clients,https://www.morningstar.com/financial-advisors/how-discuss-portfolio-diversification-with-different-types-clients
,biobiochile.cl,CFA : errores  reiterados  en cálculos de ingresos llevaron al Gobierno a incumplir las metas fiscales | Economía,https://www.biobiochile.cl/noticias/economia/actualidad-economica/2026/03/04/cfa-errores-reiterados-en-calculos-de-ingresos-llevaron-al-gobierno-a-incumplir-las-metas-fiscales.shtml
,baomoi.com,Thời sự 24h ngày 4 / 3 / 2026 : Tổng Bí thư : Cơ sở lý luận và thực tiễn cho các quyết sách chiến lược trong giai đoạn phát triển mới,https://baomoi.com/thoi-su-24h-ngay-4-3-2026-tong-bi-thu-co-so-ly-luan-va-thuc-tien-cho-cac-quyet-sach-chien-luoc-trong-giai-doan-phat-trien-moi-c54609846.epi
,sapo.pt,"Pierrakakis :  Na Europa não falta talento , não falta poupança ; o que falta é escala para transformar economias em inovao",https://sapo.pt/artigo/pierrakakis-na-europa-nao-falta-talento-nao-falta-poupanca-o-que-falta-e-escala-para-transformar-economias-em-inovacao-69a8364fa089a2d973682e2b
,finance.sina.com.cn,委员通道｜宁德时代曾毓群 ： 将应用AI的方式加大智能制造研发投入,https://finance.sina.com.cn/jjxw/2026-03-04/doc-inhpvtwk0324887.shtml
,palermotoday.it,Come se fosse : lo spettacolo con Rosario Terranova al Teatro Jolly,https://www.palermotoday.it/eventi/spettacolo-come-se-fosse-teatro-jolly-6-8-marzo-2026.html
,alvolante.it,La Renault farà una fuoristrada ? Sarebbe la prima volta,https://www.alvolante.it/news/renault-bridger-teaser-fuoristrada-411833
,surinametimes.com,OpenAI changes deal with US military after backlash,https://www.surinametimes.com/artikel/openai-changes-deal-with-us-military-after-backlash
,theglobeandmail.com,Canada Packers posts lower fourth - quarter profit as sales edge higher,https://www.theglobeandmail.com/business/article-canada-packers-posts-lower-fourth-quarter-profit-as-sales-edge-higher/
,cars.tvbs.com.tw,Volkswagen集團傳全面降本20 %， 德國將裁員3 . 5萬人,https://cars.tvbs.com.tw/car-news/309089
,finanznachrichten.de,CoTec Holdings Corp .: CoTec Announces Acceleration of Warrants,https://www.finanznachrichten.de/nachrichten-2026-03/67854355-cotec-holdings-corp-cotec-announces-acceleration-of-warrants-200.htm
,tickerreport.com,"Teachers Retirement System of The State of Kentucky Sells 3 , 000 Shares of Tenet Healthcare Corporation $THC",https://www.tickerreport.com/banking-finance/13367192/teachers-retirement-system-of-the-state-of-kentucky-sells-3000-shares-of-tenet-healthcare-corporation-thc.html
,tickerreport.com,"Victory Capital Management Inc . Sells 113 , 919 Shares of Zoom Communications , Inc . $ZM",https://www.tickerreport.com/banking-finance/13367185/victory-capital-management-inc-sells-113919-shares-of-zoom-communications-inc-zm.html
,pasadenastarnews.com,"Wall Street is mixed , oil prices stabilize with war in Iran continuing",https://www.pasadenastarnews.com/2026/03/04/markets-us-iran-war/
,businesstoday.in,Kospi hits circuit breaker ; down 20 % from record high ; what led to the crash today,https://www.businesstoday.in/markets/stocks/story/kospi-hits-circuit-breaker-plunges-from-record-high-what-led-to-the-crash-today-519104-2026-03-04
,dostor.org,سعر الدولار اليوم الأربعاء 4 مارس 2026 في منتصف التعاملات,https://www.dostor.org/5443098
,savonanews.it,"Varazze , in Conferenza dei servizi il via libera definitivo alla nuova pista di pattinaggio in località Salice",https://www.savonanews.it/2026/03/04/leggi-notizia/argomenti/attualit/articolo/varazze-in-conferenza-dei-servizi-il-via-libera-definitivo-alla-nuova-pista-di-pattinaggio-in-local.html
,hna.de,XXL Camping - Sale bei Fritz Berger gestartet – bis zu % Rabatt,http://www.hna.de/produktempfehlung/xxl-camping-sale-bei-fritz-berger-gestartet-bis-zu-rabatt-zr-94197058.html
,torontotelegraph.com,"iFabric Corp . Announces 1 , 000 Store Expansion of Doctor Choice ( R ) Scrubs at U . S . National Retailer",http://www.torontotelegraph.com/news/278901530/ifabric-corp-announces-1000-store-expansion-of-doctor-choicer-scrubs-at-us-national-retailer
,ansa.it,Gran parte delle donne rientra al lavoro dopo la maternità a condizioni peggiori - Notizie,https://www.ansa.it/trentino/notizie/2026/03/04/gran-parte-delle-donne-rientra-al-lavoro-dopo-la-maternita-a-condizioni-peggiori_ec7029b0-65d2-462f-825c-41a25a85b8ac.html
,tickerreport.com,Monster Beverage Corporation $MNST Shares Sold by Teachers Retirement System of The State of Kentucky,https://www.tickerreport.com/banking-finance/13367183/monster-beverage-corporation-mnst-shares-sold-by-teachers-retirement-system-of-the-state-of-kentucky.html
,gazetadopovo.com.br,Dois servidores do BC são afastados por envolvimento com Vorcaro,https://www.gazetadopovo.com.br/republica/dois-servidores-bc-afastados-envolvimento-vorcaro/
,zazoom.it,Paghiamo Salerno Mobilità e i parcheggiatori per la sosta | ora basta,https://www.zazoom.it/2026-03-04/paghiamo-salerno-mobilita-e-i-parcheggiatori-per-la-sosta-ora-basta-lurlo-dei-cittadini/18768282/
,meedia.de,YOC goes Big Screen,http://meedia.de/news/beitrag/21256-yoc-goes-big-screen.html
,themarketsdaily.com,Laffer Tengler Investments Inc . Has $13 . 87 Million Position in Oracle Corporation $ORCL,https://www.themarketsdaily.com/2026/03/04/laffer-tengler-investments-inc-has-13-87-million-position-in-oracle-corporation-orcl.html
,news.fidelityhouse.eu,BenQ sfida Apple : il nuovo monitor 5K per Mac punta tutto su qualità e prezzo,https://news.fidelityhouse.eu/hi-tech/benq-sfida-apple-il-nuovo-monitor-5k-per-mac-punta-tutto-su-qualita-e-prezzo-652678.html
,sanantoniopost.com,Hormuz tensions send crude prices sharply higher,http://www.sanantoniopost.com/news/278898974/hormuz-tensions-send-crude-prices-sharply-higher
,themarketsdaily.com,"Victory Capital Management Inc . Cuts Stake in Landstar System , Inc . $LSTR",https://www.themarketsdaily.com/2026/03/04/victory-capital-management-inc-cuts-stake-in-landstar-system-inc-lstr.html
,torontotelegraph.com,Announcing the 2026 Winnipeg Consumer Choice Award Winners,http://www.torontotelegraph.com/news/278901580/announcing-the-2026-winnipeg-consumer-choice-award-winners
,motorcyclenews.com,HONDA ADV 350 ( 2023 / 23 plate ) for sale [ ref : 35455b14 ],https://www.motorcyclenews.com/bikes-for-sale/honda/adv350/35455b14-0c9a-6bad-a2a5-a3d828fbe9ab/
,businesstoday.in,"₹10 , 000 salary , ₹550 crore scam : Rapido driver bank account used in massive betting racket",https://www.businesstoday.in/latest/trends/story/rs10000-salary-rs550-crore-scam-rapido-drivers-bank-account-used-in-massive-betting-racket-519108-2026-03-04
,spanish.peopledaily.com.cn,"Industriales brasileños prevén crecimiento del PIB de 1 , 9 % en 2026 por tasas elevadas",http://spanish.peopledaily.com.cn/n3/2026/0304/c31617-20431077.html
,ilpost.it,Chi sono i greci che vogliono comprare Repubblica,https://www.ilpost.it/2025/12/12/kyriakou-greci-vendita-gedi-repubblica-chi-sono/?homepagePosition=4.1&referrerPost=3530947
,ok.co.uk,Martin Lewis recommends  really important  retirement tip,https://www.ok.co.uk/lifestyle/fitness/martin-lewis-recommends-really-important-36815473
,independent.ie,"Growth in the services sector now slowest in six months , AIB says",https://www.independent.ie/business/growth-in-the-services-sector-now-slowest-in-six-months-aib-says/a1249303093.html
,morningstar.com,Stocks Bounce After Iran War Sell - Off Deepens in Asia,https://www.morningstar.com/markets/stocks-bounce-after-iran-war-sell-off-deepens-asia
,zazoom.it,Comunicato Stampa | ViviBook | in chiusura il 1° round a 7 . 000000$ di valutazione,https://www.zazoom.it/2026-03-04/comunicato-stampa-vivibook-in-chiusura-il-1-round-a-7-000-000-di-valutazione/18768180/
,24heures.ch,Crans - Montana : le Conseil des États valide laide aux victimes,https://www.24heures.ch/crans-montana-le-conseil-des-etats-valide-laide-aux-victimes-162100648502
,standardmedia.co.ke,Reprieve for traders as court halts Gikomba market demolition,https://www.standardmedia.co.ke/crime-and-justice/article/2001542287/reprieve-for-traders-as-court-halts-gikomba-market-demolition
,profile.ru,Главные новости к 16 : 00 4 марта 2026 года,https://profile.ru/news/society/glavnye-novosti-k-16-00-4-marta-2026-goda-1830219/
,kreiszeitung.de,Bürgergeld - Reform trifft ETF - Sparer hart : Karenzzeit komplett gestrichen,http://www.kreiszeitung.de/wirtschaft/buergergeld-reform-trifft-etf-sparer-hart-karenzzeit-komplett-gestrichen-zr-94196607.html
,haberler.com,"İzmir Emekliler Platformu :  Emeklinin Maaşına Yapılan Zam , Pazara , Markete ve Faturaya Yapılan Zamlar Karşısında Yok Olmuştur",https://www.haberler.com/guncel/izmir-emekliler-platformu-emeklinin-maasina-19623696-haberi/
,tecnoandroid.it,Crescono le auto cinesi e le BEV nel primo bimestre 2026,https://www.tecnoandroid.it/2026/03/04/crescono-le-auto-cinesi-e-le-bev-nel-primo-bimestre-2026-1792818/
,tribunadonorte.com.br,"Vorcaro mantinha estrutura de intimidao de pessoas , cita ministro",https://tribunadonorte.com.br/brasil/vorcaro-mantinha-estrutura-de-intimidacao-de-pessoas-cita-ministro/
,aktiencheck.de,Norwegian Cruise Line Aktie : Neuer CEO soll jetzt die Wende einleiten ( Susquehanna Financial ),https://www.aktiencheck.de/exklusiv/Artikel-Norwegian_Cruise_Line_Aktie_Neuer_CEO_soll_jetzt_Wende_einleiten-19528331
,nicematin.com,"Attaques au Moyen - Orient  : Je devais rentrer en France mais mon vol a été annulé , comment faire  ?",https://www.nicematin.com/societe/conflits/attaques-au-moyen-orient-je-devais-rentrer-en-france-mais-mon-vol-a-ete-annule-comment-faire-10671351
,portfolio.hu,A versenyelőnyt a retailben betartható ígéreteknek hívják − Dübörög a Retail Day 2026,https://www.portfolio.hu/gazdasag/20260304/a-versenyelonyt-a-retailben-betarthato-igereteknek-hivjak-duborog-a-retail-day-2026-822174
,wvik.org,America has a housing affordability crisis . Building houses for rent can help,https://www.wvik.org/npr-top-stories/2026-03-04/america-has-a-housing-affordability-crisis-building-houses-for-rent-can-help
,themarketsdaily.com,MGIC Investment Corporation $MTG Shares Purchased by South Dakota Investment Council,https://www.themarketsdaily.com/2026/03/04/mgic-investment-corporation-mtg-shares-purchased-by-south-dakota-investment-council.html
,talouselama.fi,"Bensa jo yli 2 euroa – Asiantuntija varoittaa , mitä seuraavaksi voi tapahtua",https://www.talouselama.fi/uutiset/a/57b55983-456e-421e-beca-f3294d23e832
,dostor.org,8 قرارات جديدة لمجلس الوزراء في اجتماعه الأسبوعي برئاسة  مدبولي,https://www.dostor.org/5443184
,em.com.br,HPV : casos de câncer de colo do útero devem crescer 14 % por ano até 2028,https://www.em.com.br/bem-viver/2026/03/7367709-hpv-casos-de-cancer-de-colo-do-utero-devem-crescer-14-por-ano.html
,eldiariodechihuahua.mx,"Ormuz , el estrecho que pone a México en peligro",https://www.eldiariodechihuahua.mx/opinion/2026/mar/04/ormuz-el-estrecho-que-pone-a-mexico-en-peligro-776424.html
,dostor.org,أسعار البنزين اليوم الأربعاء .. سعر لتر 80 و92 و95 في المحطات,https://www.dostor.org/5443126
,reflector.com,Wall Street is mixed and oil prices stabilize with war in Iran entering a fifth day,https://www.reflector.com/news/national/wall-street-is-mixed-and-oil-prices-stabilize-with-war-in-iran-entering-a-fifth/article_6163f0cb-998b-5d41-87c9-340fa3f0800a.html
,tech.wp.pl,Izrael pokazał nagranie .  Zwróćcie uwagę na te detale,"https://tech.wp.pl/izrael-pokazal-nagranie-zwroccie-uwage-na-te-detale,7260678579636320a"
,fr.allafrica.com,Tunisie : Le pays à l  épreuve de la guerre de l  énergie - Attendre le choc ou bâtir limmunité économique ?,https://fr.allafrica.com/stories/202603040335.html
,tickerreport.com,"Sunrun ( NASDAQ : RUN ) CRO Paul Dickson Sells 1 , 021 Shares",https://www.tickerreport.com/banking-finance/13367190/sunrun-nasdaqrun-cro-paul-dickson-sells-1021-shares.html
,interfax.com.ua,Судитимуть директора департаменту КМДА за закупку спецавтомобілів для рятувальників із переплатою в майже 11 млн грн – прокуратура,https://interfax.com.ua/news/general/1149166.html
,news.fznews.com.cn,全省第一 ！ 福州2025年技术合同登记破万项 _ 福州 _ 新闻频道 _ 福州新闻网,https://news.fznews.com.cn/fzyw/20260304/sW361K9kGB.shtml
,proplanta.de,Die Linke fordert sofortige Maßnahmen zur Senkung der Lebensmittelpreise,https://www.proplanta.de/agrar-nachrichten/agrarpolitik/die-linke-fordert-sofortige-massnahmen-zur-senkung-der-lebensmittelpreise_article1772632502.html
,heraldk.com,"골드만삭스 CEO  중동 전쟁 충격 , 시장 반영까지 몇주 걸릴 것",https://heraldk.com/2026/03/03/%ea%b3%a8%eb%93%9c%eb%a7%8c%ec%82%ad%ec%8a%a4-ceo-%e2%80%9c%ec%a4%91%eb%8f%99-%ec%a0%84%ec%9f%81-%ec%b6%a9%ea%b2%a9-%ec%8b%9c%ec%9e%a5-%eb%b0%98%ec%98%81%ea%b9%8c%ec%a7%80-%eb%aa%87%ec%a3%bc/
,themarker.com,הרווח של בנק לאומי יכול לממן את 5 הימים הראשונים למלחמה,https://www.themarker.com/podcasts/2026-03-04/ty-article-podcast/0000019c-b8f1-df64-a59c-faf7208d0000
,dp.ru,"Цены на бриллианты 2026 : что продают , спрос , инвестиции",https://www.dp.ru:443/a/2026/03/04/romani-s-kamnjami-kto-i-zachem
,allafrica.com,Tanzania : North Unguja Entrepreneurs Urged to Turn Training Into Profits,https://allafrica.com/stories/202603040382.html
,index.hr,Stiže još jedan kulinarski TV show,https://www.index.hr/food/clanak/stize-jos-jedan-kulinarski-tv-show/2767376.aspx
,news.republika.co.id,KPK Ungkap Perusahaan Keluarga dalam Pusaran Kasus Bupati Pekalongan Fadia Arafiq,https://news.republika.co.id/berita/tbdnvo409/kpk-ungkap-perusahaan-keluarga-dalam-pusaran-kasus-bupati-pekalongan-fadia-arafiq
,plazadearmas.com.mx,El juicio a Maduro y el caso Segalmex - Plaza de Armas,https://plazadearmas.com.mx/el-juicio-a-maduro-y-el-caso-segalmex/
,prnewswire.com,"In HelloNation , Adolescent Mental Health Expert Amanda Hill Explains Therapy Costs in Noblesville , Indiana",https://www.prnewswire.com/news-releases/in-hellonation-adolescent-mental-health-expert-amanda-hill-explains-therapy-costs-in-noblesville-indiana-302703943.html
,az.trend.az,İnvestisiya şirkətlərinin dövriyyələrinə görə RENKİNQİ,https://az.trend.az/business/4160839.html
,finanza.lastampa.it,"Manifattura italiana : il 70 % delle imprese è in linea , tra innovazione e sfide oltre gli incentivi",https://finanza.lastampa.it/News/2026/03/04/manifattura-italiana-il-70percento-delle-imprese-e-in-linea-tra-innovazione-e-sfide-oltre-gli-incentivi/MTQzXzIwMjYtMDMtMDRfVExC
,linternaute.com,Les Rafale dopent les résultats de Dassault en 2025 dans un contexte  incertain,https://www.linternaute.com/actualite/depeches/9982499-les-rafale-dopent-les-resultats-de-dassault-en-2025-dans-un-contexte-incertain/
,business24.ro,Oprirea producției de GNL de către QatarEnergy evidențiază impactul asupra piețelor energetice globale,https://business24.ro/index.php?module=AmvcNews&id=1643033&tag=tag
,novosti.rs,"IRAN SAMO ŠTO NIJE POBEĐEN  Hegset : U ratu smo tek pet dana , nećemo žuriti",https://www.novosti.rs/planeta/svet/1581953/iran-samo-sto-nije-pobedjen-hegset-ratu-smo-tek-pet-dana-necemo-zuriti
,zonebourse.com,Digital Realty simplante au Portugal avec un nouveau centre de données à Lisbonne,https://www.zonebourse.com/actualite-bourse/digital-realty-s-implante-au-portugal-avec-un-nouveau-centre-de-donnees-a-lisbonne-ce7e5cd3d181f623
,tecnoandroid.it,Genesis rivoluziona lavventura con il concept X Gran Equator,https://www.tecnoandroid.it/2026/03/04/genesis-rivoluziona-lavventura-con-il-concept-x-gran-equator-1793245/
,gazetadopovo.com.br,"Grupo de Vorcaro é investigado por acessar dados da PF , MP e Interpol",https://www.gazetadopovo.com.br/republica/grupo-vorcaro-investigado-acessar-dados-pf-mp-interpol/
,arabherald.com,Middle East crisis : India reacts to a festering conflict,http://www.arabherald.com/news/278901721/middle-east-crisis-india-reacts-to-a-festering-conflict
,benzinga.com,"Top 2 Health Care Stocks That May Crash This Quarter - Arcellx ( NASDAQ : ACLX ), Anika Therapeutics ( NASDAQ : ANIK )",https://www.benzinga.com/trading-ideas/short-ideas/26/03/51033270/top-2-health-care-stocks-that-may-crash-this-quarter
,qcostarica.com,"13 , 000 kilometers away : 4 effects of the Middle East crisis on Costa Rica",https://qcostarica.com/13000-kilometers-away-4-effects-of-the-middle-east-crisis-on-costa-rica/
,baijiahao.baidu.com,守护校园在行动,https://baijiahao.baidu.com/s?id=1858694929263772259
,baomoi.com,"Dồn lực cho mục tiêu tăng trưởng cao , trong bối cảnh thế giới có nhiều bất ổn",https://baomoi.com/don-luc-cho-muc-tieu-tang-truong-cao-trong-boi-canh-the-gioi-co-nhieu-bat-on-c54609830.epi
,ettoday.net,快訊 ／ 太子集團9在押被告全交保 主嫌2人科控 | ETtoday社會新聞,https://www.ettoday.net/news/20260304/3126934.htm
,sanantoniopost.com,"Srinagar : Forest blaze engulfs Zabarwan forest belt , thick smoke covers region",http://www.sanantoniopost.com/news/278901481/srinagar-forest-blaze-engulfs-zabarwan-forest-belt-thick-smoke-covers-region
,lequebecexpress.com,Les électeurs de Burlington approuvent une augmentation dimpôt de 5 cents et dautres points du scrutin,https://www.lequebecexpress.com/les-electeurs-de-burlington-approuvent-une-augmentation-dimpot-de-5-cents-et-dautres-points-du-scrutin/
,vietgiaitri.com,"Shakira sau chia tay Piqué : Thăng hoa sự nghiệp , hẹn hò người kém 15 tuổi",https://vietgiaitri.com/shakira-sau-chia-tay-pique-thang-hoa-su-nghiep-hen-ho-nguoi-kem-15-tuoi-20260304i7649104/
,haberler.com,İstanbulda dolandırıcılık operasyonunda 64 şüpheli yakalandı,https://www.haberler.com/guncel/istanbul-da-yasa-disi-forex-dolandiriciligi-operasyonu-64-gozalti-19623974-haberi/
,dp.ru,Пятёрочка  инвестировала 1 млрд рублей в поддержку региональных франчайзи,https://www.dp.ru:443/a/2026/03/04/pjatjorochka-investirovala
,arabherald.com,"Currency notes litter ground as plane crashes in Bolivia , killing 15",http://www.arabherald.com/news/278895153/currency-notes-litter-ground-as-plane-crashes-in-bolivia-killing-15
