published_at,source,title,url
,elpais.com,El Eurogrupo y el BCE rechazan relajar las reglas de gasto público para responder a la crisis energética,https://elpais.com/economia/2026-05-22/el-eurogrupo-y-el-bce-rechazan-relajar-las-reglas-de-gasto-publico-para-responder-a-la-crisis-energetica.html
,wglt.org,Summer electric bills sizzle as the cost of cooling climbs,https://www.wglt.org/2026-05-23/summer-electric-bills-sizzle-as-the-cost-of-cooling-climbs
,screenrant.com,Disney Is Officially Rebooting One Of The Greatest Sci - Fi Franchises Of All Time,https://screenrant.com/planet-of-the-apes-next-movie-disney-reboot/
,itbear.com.cn,大众安徽两款新车上市 ！ 与众07与众06限时权益价惊喜来袭 - 数码极客 - ITBear科技资讯,https://www.itbear.com.cn/html/2026-05/1356227.html
,dostor.org,أسعار الذهب في مصر 2026 .. اتساع الفجوة بين التسعير المحلي والعالمي وسط ضغوط الدولار والفائدة,https://www.dostor.org/5568365
,kenyastar.com,UAE successfully concludes May 2026 Treasury Bond auction,http://www.kenyastar.com/news/279070882/uae-successfully-concludes-may-2026-treasury-bond-auction
,asianews.it,SRI LANKA Sallay masterminded Easter 2019 massacres,https://www.asianews.it/news-en/Sallay-masterminded-Easter-2019-massacres-65502.html
,dostor.org,بعثة البنك الدولي تشيد بمستوى التطور الهيكلي والتشغيلي في ملف الرعاية الصحية الأولية بمصر,https://www.dostor.org/5568281
,cincodias.elpais.com,El fondo Ares lanza la venta de su cartera de viviendas del Plan Vive de Ayuso,https://cincodias.elpais.com/companias/2026-05-22/el-fondo-ares-lanza-la-venta-de-su-cartera-de-viviendas-del-plan-vive-de-ayuso.html
,odatv.com,Mahfi Eğilmez piyasadaki sert dalgalanmayı değerlendirdi : Kırılganlık artıyor,https://www.odatv.com/ekonomi/mahfi-egilmez-piyasadaki-sert-dalgalanmayi-degerlendirdi-kirilganlik-artiyor-120148274
,247wallst.com,PJUL Caps Your S & P 500 Gains at 11 % While Protecting Against 40 % Crashes : The Math for Retirees,https://247wallst.com/investing/2026/05/23/pjul-caps-your-sp-500-gains-at-11-while-protecting-against-40-crashes-the-math-for-retirees/
,itbear.com.cn,中国AI投资逻辑生变 ： 垂直场景变现先行 ， 工作流与基础设施成新焦点 - 人工智能 - ITBear科技资讯,https://www.itbear.com.cn/html/2026-05/1356164.html
,myjournalcourier.com,Gas prices expected to climb during Memorial Day weekend,https://www.myjournalcourier.com/news/article/gas-prices-expected-climb-memorial-day-weekend-22266486.php
,corumhaber.net,Çorumu Samsuna bağlayacak dev projede ihale tamam - Çorum Haber Gazetesi,https://www.corumhaber.net/corumu-samsuna-baglayacak-dev-projede-ihale-tamam
,dailypolitical.com,"Guinness Asset Management LTD Has $40 . 03 Million Stake in Netflix , Inc . $NFLX",https://www.dailypolitical.com/2026/05/23/guinness-asset-management-ltd-has-40-03-million-stake-in-netflix-inc-nflx.html
,stockbiz.vn,Nông dân trồng cà phê Tây Nguyên được trả bảo hiểm vì mưa lớn,https://stockbiz.vn/tin-tuc/nong-dan-trong-ca-phe-tay-nguyen-duoc-tra-bao-hiem-vi-mua-lon/40115891
,times-standard.com,"Dan Walters | Education is vital and costs California billions , so why arent candidates for governor talking about it ? – Times - Standard",https://www.times-standard.com/2026/05/23/education-is-vital-and-costs-california-billions-so-why-arent-candidates-for-governor-talking-about-it/
,stockbiz.vn,Trường ĐH của Chủ tịch FPT Trương Gia Bình nhận tin vui từ Đức,https://stockbiz.vn/tin-tuc/truong-dh-cua-chu-tich-fpt-truong-gia-binh-nhan-tin-vui-tu-duc/40115831
,itbear.com.cn,40 . 68万元起 ， 蔚来全新ES8完成第11万台新车交付 - 商业消费 - ITBear科技资讯,https://www.itbear.com.cn/html/2026-05/1356203.html
,stockbiz.vn,Kết nối giao thương giữa các doanh nghiệp sản xuất kinh doanh nông sản,https://stockbiz.vn/tin-tuc/ket-noi-giao-thuong-giua-cac-doanh-nghiep-san-xuat-kinh-doanh-nong-san/40115863
,naslovi.net,"BLOG UŽIVO Kolone građana sa svih strana krenule ka Slaviji , na naplatnoj rampi na ulazu u Beograd more automobila : Blokiran saobraćaj na Autokomandi i kod Pravnog fakulteta",https://naslovi.net/2026-05-23/nova/blog-uzivo-kolone-gradjana-sa-svih-strana-krenule-ka-slaviji-na-naplatnoj-rampi-na-ulazu-u-beograd-more-automobila-blokiran-saobracaj-na-autokomandi-i-kod-pravnog-fakulteta/41854817
,auto.sina.com.cn,皮卡硬核混动新标杆 试驾长城炮Hi4 - T,https://auto.sina.com.cn/review/2026-05-22/detail-inhytusq8538826.shtml?oaid=00006
,express.pk,state minister traders demand easy tax scheme,https://www.express.pk/story/2814435/state-minister-traders-demand-easy-tax-scheme-2814435
,eldiarionuevodia.com.ar,Santa Cruz : qué dijo la ministra de Gobierno sobre el llamado a paritarias,https://www.eldiarionuevodia.com.ar/locales/santa-cruz-que-dijo-la-ministro-de-gobierno-sobre-el-llamado-a-paritarias-3034/
,punjabkesari.in,"रुपए की गिरावट पर बोले Piyush Goyal , वैश्विक कारकों से तय होती है विनिमय दर - piyush goyal speaks on rupee s decline exchange rates are determined",https://www.punjabkesari.in/business/news/piyush-goyal-speaks-on-rupee-s-decline-exchange-rates-are-determined-2337752
,countrylife.co.uk,"Hugh Fearnley - Whittingstall :  Nettles , grey squirrels and the occasional placenta ? Im relaxed about that",https://www.countrylife.co.uk/culture/hugh-fearnley-whittingstall-nettles-grey-squirrels-and-the-occasional-placenta-im-relaxed-about-that
,elpais.com,Barcelona - OL Lyonnes : Oslo celebra el choque de los dos gigantes en la final de la Champions,https://elpais.com/deportes/futbol/2026-05-23/barcelona-ol-lyonnes-oslo-celebra-el-choque-de-los-dos-gigantes-en-la-final-de-la-champions.html
,winfuture.de,Weekend - Deals : 16 Top - Angebote bei Media Markt und Saturn,"https://winfuture.de/news,1588721.html"
,itbear.com.cn,三星阔折叠新机钢化膜曝光 ， 尺寸配置引期待 ， 2026年发布在即 - 手机快报 - ITBear科技资讯,https://www.itbear.com.cn/html/2026-05/1356248.html
,navbharattimes.indiatimes.com,"India Fresh Gas Discovery : पश्चिम एशिया संकट के बीच भारत के हाथ लगी बड़ी कामयाबी , इस राज्‍य में गैस का नया खजाना खोज लिया",https://navbharattimes.indiatimes.com/business/business-news/fresh-gas-discovery-in-rajasthan-oil-india-unlocked-hardeep-singh-puri-announcement-india-energy-security-to-get-major-boost/articleshow/131280648.cms
,birminghammail.co.uk,New DVSA rule for drivers now in force but  does not address root problem,https://www.birminghammail.co.uk/motoring/motoring-news/new-dvsa-rule-drivers-now-33936558
,yahoo.com,Whole Foods soup recall affects NY stores over undeclared shrimp risk,https://www.yahoo.com/news/us/articles/whole-foods-soup-recall-affects-135149082.html
,week.ukrainianwall.com,"Ціни на ліки в Україні у 3 , 5 рази вищі , ніж у Європі дані 2026",https://week.ukrainianwall.com/159959-ukrajinci-platyat-za-liki-v-3-5-razi-bilshe-za-yevropeyciv-shcho-vidbuvayetsya-z-cinami-u-travni-2026
,benzinga.com,"AMC Entertainment , Nvidia , Arm Holdings And More : 5 Stocks Investors Couldnt Stop Buzzing About This Wee",https://www.benzinga.com/markets/equities/26/05/52762325/amc-entertainment-nvidia-arm-holdings-and-more-5-stocks-investors-couldnt-stop-buzzing-about-this-week
,auto.sina.com.cn,小米YU7家族重磅进化 标准版23 . 35万 GT38 . 99万起,https://auto.sina.com.cn/newcar/2026-05-22/detail-inhystez6208666.shtml?oaid=00112
,itbear.com.cn,郑州新能源汽车号牌再添新成员  豫AE  纯电号段正式投入使用 - 智能汽车 - ITBear科技资讯,https://www.itbear.com.cn/html/2026-05/1356232.html
,fakti.bg,Вече е неизбежно : Ще ударим стената ! ᐉ Новини от Fakti . bg - Мнения,https://fakti.bg/mnenia/1056321-veche-e-neizbejno-shte-udarim-stenata
,finanznachrichten.de,EQS - Adhoc : Delivery Hero SE : Delivery Hero bestätigt Kontaktaufnahme seitens Uber Technologies in Bezug auf ein mögliches Übernahmeangebot,https://www.finanznachrichten.de/nachrichten-2026-05/68579608-eqs-adhoc-delivery-hero-se-delivery-hero-bestaetigt-kontaktaufnahme-seitens-uber-technologies-in-bezug-auf-ein-moegliches-uebernahmeangebot-022.htm
,blog.udn.com,豐原金屬CNC鑽孔加工 》 微米級精密零件加工首推晶禹金屬加工 - t60d8awn58557 的部落格,https://blog.udn.com:443/t60d8awn58557/189133671
,yangtse.com,提车新方式 ： 不进4S店 ， 直奔制造一线 问界M8车主齐聚赛力斯超级工厂提车,https://www.yangtse.com/news/qiche/202605/t20260523_355631.html
,247wallst.com,"The Closed - End Fund Portfolio That Quietly Pays a 71 - Year - Old $61 , 000 a Year on $850 , 000 and Trades at a Persistent Discount",https://247wallst.com/personal-finance/2026/05/23/the-closed-end-fund-portfolio-that-quietly-pays-a-71-year-old-61000-a-year-on-850000-and-trades-at-a-persistent-discount/
,auto.sina.com.cn,昊铂S600开启预售 预售权益价18 . 89 - 20 . 89万元,https://auto.sina.com.cn/newcar/2026-05-17/detail-inhyezxf1663154.shtml?oaid=00109
,profile.ru,3711 сделок на фондовом рынке фигурируют в последнем отчете о биржевой активности Трампа,https://profile.ru/news/abroad/3711-sdelok-na-fondovom-rynke-figurirujut-v-poslednem-otchete-o-birzhevoj-aktivnosti-trampa-1863384/
,q985.fm,Win a Trip to Experience BTS Live at AT & T Stadium in Texas,https://q985.fm/bts-dallas-2026/
,agroemcampo.ig.com.br,Brasil caminha para safra recorde de café em 2026,https://agroemcampo.ig.com.br/2026/noticias/brasil-caminha-para-safra-recorde-de-cafe-em-2026/
,eldiariomontanes.es,"« Los aranceles no nos afectan , lo que golpea a Cantabria es China y el cambio tecnológico »",https://www.eldiariomontanes.es/economia/aranceles-afectan-golpea-cantabria-china-cambio-tecnologico-20260523161127-nt.html
,inewsgr.com,Αυτό είναι το superyacht του Charles Leclerc,https://www.inewsgr.com/492/afto-einai-to-superyacht-tou-Charles-Leclerc.htm
,tv2.no,« Putins jerndukke »: – De ler av oss,https://www.tv2.no/nyheter/putins-jerndukke-de-ler-av-oss/18871230/
,malverngazette.co.uk,Pope meets families of youth lost to toxic waste dumping in  Land of Fires,https://www.malverngazette.co.uk/news/national/26134073.pope-meets-families-youth-lost-toxic-waste-dumping-land-fires/
,ilmessaggero.it,"Roma , rapina nella gioielleria del centro commerciale Casal Bertone : dipendenti minacciate con una pistola , poi la fuga con il bottino",https://www.ilmessaggero.it/roma/tiburtino/rapina_centro_commerciale_casal_bertone_gioielleria_ultime_notizie-9550319.html
,berliner-zeitung.de,Heidi - Gründer erklärt : Diese KI soll Ärzten jetzt Stunden Arbeit sparen,https://www.berliner-zeitung.de:443/article/heidi-gruender-diese-ki-soll-aerzten-jetzt-stunden-arbeit-sparen-10036125
,thenationonlineng.net,"Stewardship , Not Seizure : What the Union Bank case is really about",https://thenationonlineng.net/stewardship-not-seizure-what-the-union-bank-case-is-really-about/
,romesentinel.com,"Remsen Arts Fest returns with art , cars and live music",https://www.romesentinel.com/entertainment-life/remsen-arts-fest-returns-art-cars-music/article_072be615-b9f5-4517-8a3c-05db25b67570.html
,nordkurier.de,Riesenbärenklau in Ludwigslust - Parchim : Landkreis gibt Tipps zur Bekämpfung,https://www.nordkurier.de/regional/hagenow/giftpflanze-breitet-sich-rasant-aus-behoerde-raet-zum-handeln-4593114
,berliner-zeitung.de,Studie zur EU - Agrarreform : Forscher warnen vor Strukturbruch in Ostdeutschland,https://www.berliner-zeitung.de:443/article/studie-zur-eu-agrarreform-forscher-warnen-vor-strukturbruch-in-ostdeutschland-10037964
,hea.china.com,流量妈妈圈 ， 赋能女性新成长 ： 免费助力千万宝妈打造个人IP新生态 _ 中华网,https://hea.china.com/articles/20260523/202605231876520.html
,merkur.de,Containerschule abgebaut : 102 . 000 Euro für Rückbau zur grünen Wiese,http://www.merkur.de/lokales/region-holzkirchen/holzkirchen-ort28831/containerschule-abgebaut-102-000-euro-fuer-rueckbau-zur-gruenen-wiese-94319327.html
,kilgorenewsherald.com,"There room for this to grow : Business picks up at Longview gold , silver shops thanks to skyrocketing values",https://kilgorenewsherald.com/2026/05/23/theres-room-for-this-to-grow-business-picks-up-at-longview-gold-silver-shops-thanks-to-skyrocketing-values/
,247wallst.com,"How $300 , 000 in JEPQ and JEPI Quietly Pays $24 , 000 a Year Without the MLP K - 1 Headache",https://247wallst.com/personal-finance/2026/05/23/how-300000-in-jepq-and-jepi-quietly-pays-24000-a-year-without-the-mlp-k-1-headache/
,gadget.viva.co.id,"Ugreen PB610 Resmi Hadir , Power Bank 45W 10 . 000mAh dengan Layar Pintar",https://gadget.viva.co.id/gadget/50555-ugreen-pb610-resmi-hadir-power-bank-45w-10000mah-dengan-layar-pintar
,wkzo.com,Republican defiance over  anti - weaponization  fund sets up confrontation with Trump | WKZO | Everything Kalamazoo,https://wkzo.com/2026/05/23/republican-defiance-over-anti-weaponization-fund-sets-up-confrontation-with-trump/
,sporx.com,Karate Þampiyonasý  nda Ömer Faruk Yürürden altýn madalya,https://www.sporx.com/www.sporx.com/karate-sampiyonasi-nda-omer-faruk-yurur-den-altin-madalya-SXHBQ1163541SXQ
,stockbiz.vn,Bí thư Thành ủy Hà Nội yêu cầu tăng tốc hoàn thiện giao thông trục Tây Thăng Long,https://stockbiz.vn/tin-tuc/bi-thu-thanh-uy-ha-noi-yeu-cau-tang-toc-hoan-thien-giao-thong-truc-tay-thang-long/40115884
,benzinga.com,"Bank Teller Is Drowning In $53K Of Debt , Including 4 Maxed Out Credit Cards And A 2025 Car .  Just Say You",https://www.benzinga.com/news/topics/26/05/52762426/bank-teller-is-drowning-in-53k-of-debt-including-4-maxed-out-credit-cards-and-a-2025-car-just-say-you-wanted-a-brand-new-shiny-car
,blog.udn.com,Meibit錢提不出 ？ 教你一步步處理 - 判斷標準,https://blog.udn.com:443/0c2c56a2/189133673
,auto.sina.com.cn,浑身黑科技 全新梅赛德斯 - AMG GT高性能四门跑车全球首秀,https://auto.sina.com.cn/newcar/2026-05-20/detail-inhypnui9442668.shtml?oaid=00115
,elarsenal.net,La trampa de la injerencia extranjera,https://www.elarsenal.net/la-trampa-de-la-injerencia-extranjera/
,247wallst.com,Your CDs Feel Safe . The 1 . 5 Percentage Points of Income Theyre Not Paying You Arent .,https://247wallst.com/investing/2026/05/23/your-cds-feel-safe-the-1-5-percentage-points-of-income-theyre-not-paying-you-arent/
,skai.gr,Πολιτική θύελλα στην Τουρκία : 13 συλλήψεις μετά την καθαίρεση του Οζέλ,https://www.skai.gr/news/world/politiki-thyella-stin-tourkia-13-syllipseis-meta-tin-kathairesi-tou-ozel
,pusulahaber.com.tr,"Kurban pazarının  Paşa ı 1 , 3 tonluk boğa",https://www.pusulahaber.com.tr/kurban-pazarinin-pasasi-13-tonluk-boga-1831051h.htm
,casertafocus.net,CALCIO A 5 - Notte magica a Casapesenna : il Real C5 vola in Serie C2 GUARDA LE FOTO,https://www.casertafocus.net/home/index.php?option=com_content&view=article&id=76123:grande-festa-a-casapesenna&catid=9&Itemid=131
,kenyastar.com,RBI record dividend may help govt manage rising subsidy burden amid West Asia crisis : Experts,http://www.kenyastar.com/news/279070990/rbi-record-dividend-may-help-govt-manage-rising-subsidy-burden-amid-west-asia-crisis-experts
,agroemcampo.ig.com.br,Baunilha pode valer mais que ouro ; entenda por que especiaria é tão rara,https://agroemcampo.ig.com.br/2026/noticias/baunilha-pode-valer-mais-que-ouro-e-atingir-r-6-mil-o-quilo-entenda-por-que-especiaria-e-tao-rara/
,thenationonlineng.net,"Democracy is working , says Tinubu - The Nation Newspaper",https://thenationonlineng.net/democracy-is-working-says-tinubu/
,stockbiz.vn,"Chính thức đề xuất mức giảm trừ tối đa 47 triệu đồng / năm chi phí y tế , giáo dục khi tính thuế thu nhập cá nhân",https://stockbiz.vn/tin-tuc/chinh-thuc-de-xuat-muc-giam-tru-toi-da-47-trieu-dongnam-chi-phi-y-te-giao-duc-khi-tinh-thue-thu-nhap-ca-nhan/40115834
,finance.yahoo.com,1 Stock Under $50 with Impressive Fundamentals and 2 That Underwhelm,https://finance.yahoo.com/markets/stocks/articles/1-stock-under-50-impressive-135655872.html
,laarena.com.ar,El FMI exige al Gobierno reformar el sistema jubilatorio y endurecer el ajuste,https://www.laarena.com.ar/el-pais/el-fmi-exige-al-gobierno-reformar-el-sistema-jubilatorio-y-endurecer-el-ajuste-20265231070
,wmbfnews.com,WATCH : America 250th parade in Myrtle Beach,https://www.wmbfnews.com/2026/05/23/watch-america-250-parade-myrtle-beach/
,punjabkesari.in,"LPG Sales Dip in April : दिखने लगा तनाव का असर , LPG बिक्री घटी , होटल - उद्योग सबसे ज्यादा प्रभावित - impact of stress becomes visible lpg sales decline",https://www.punjabkesari.in/business/news/impact-of-stress-becomes-visible-lpg-sales-decline-2337741
,austinglobe.com,Iranian President To Open Up Internet Access,http://www.austinglobe.com/news/279070860/iranian-president-to-open-up-internet-access
,pelop.gr,6 ελληνικοί προορισμοί για την πρώτη καλοκαιρινή απόδραση,https://pelop.gr/ellinikoi-proorismoi-proti-kalokairini-apodrasi/
,247wallst.com,"How $700 , 000 Spread Across Four Preferred Stock ETFs Generates $42 , 000 a Year Even When the Stock Market Stalls",https://247wallst.com/personal-finance/2026/05/23/how-700000-spread-across-four-preferred-stock-etfs-generates-42000-a-year-even-when-the-stock-market-stalls/
,ensonhaber.com,ABDde açıklanacak büyüme verileri bekleniyor,https://www.ensonhaber.com/abdde-aciklanacak-buyume-verileri-bekleniyor-h1536742
,polygon.com,Vampire : The Masquerade next tabletop game will have a  strong commitment to human - made work,https://www.polygon.com/vampire-the-masquerade-new-project-human-made-work/
,swr.de,Wahlkampfkosten : OB Martin Horn spendet 50 . 000 Euro an die SPD,https://www.swr.de/swraktuell/baden-wuerttemberg/freiburg/oberbuergermeister-martin-horn-freiburg-spendet-fuenfzigtausend-spd-wahlkampf-100.html
,xataka.com,Aprovechar el WC para escribir un mensaje no es nuevo : acabamos de descubrir un cuaderno medieval intacto en una letrina,https://www.xataka.com/magnet/aprovechar-wc-para-escribir-mensaje-no-nuevo-acabamos-descubrir-cuaderno-medieval-intacto-letrina
,itbear.com.cn,DeepSeek - V4 - Pro模型API价格调整 ： 2026年后延续2 . 5折优惠力度 - 人工智能 - ITBear科技资讯,https://www.itbear.com.cn/html/2026-05/1356179.html
,newsbomb.gr,Final Four : Τουριστική « ένεση » για την Αθήνα η μεγάλη διοργάνωση,https://www.newsbomb.gr/oikonomia/story/1737812/final-four-touristiki-enesi-gia-tin-athina-i-megali-diorganosi
,hngn.com,Walmart Warns About Possible Price Hikes If Fuel Costs Do Not Come Down Soon,http://www.hngn.com/articles/271312/20260522/walmart-warns-about-possible-price-hikes-if-fuel-costs-do-not-come-down-soon.htm
,bankingnews.gr,Ανατριχιαστικός Mikhalkov - Υπάρχει σχέδιο διαμελισμού της Ρωσίας σε 17 κομμάτια - Ο παγκόσμιος πόλεμος και ο ρόλος του Soros,https://www.bankingnews.gr/diethni/articles/877052/anatrixiastikos-mikhalkov-yparxei-sxedio-diamelismoy-tis-rosias-se-17-kommatia-o-pagkosmios-polemos-kai-o-rolos-tou-soros
,dostor.org,أسعار الذهب اليوم السبت 23 مايو 2026 في السوق المصري,https://www.dostor.org/5568467
,singaporestar.com,"Arctech Secures Global No . 2 in Solar Trackers for Second Consecutive Year , Retains Top Position in EMEA",http://www.singaporestar.com/news/279070836/arctech-secures-global-no-2-in-solar-trackers-for-second-consecutive-year-retains-top-position-in-emea
,informer.rs,Privatni casovi za djake prvake - Informer . rs,https://informer.rs/drustvo/vesti/1117438/privatni-casovi-prvi-razred
,ilsole24ore.com,"Banche : Barrese , le estere prime a scappare se le cose non vanno bene",https://www.ilsole24ore.com/radiocor/nRC_23.05.2026_15.42_38510385
,m.kauno.diena.lt,Mikroplastikas drabužiuose : kas nutinka juos skalbiant ?,https://m.kauno.diena.lt/naujienos/laisvalaikis-ir-kultura/mada/mikroplastikas-drabuziuose-kas-nutinka-juos-skalbiant-1757005
,gsp.ro,Liverpool pregătește transferul de 100 de milioane de euro pentru „ noul Salah  » Puștiul - minune care a explodat în Bundesliga,https://www.gsp.ro/international/campionate/liverpool-pregateste-transferul-100-de-milioane-diomande-leipzig-940466.html
,kwongwah.com.my,曹观友 ： 无论与谁合作 槟希盟都会全面备战光华日报 | 1910年创刊 创新每一天生活,https://www.kwongwah.com.my/20260523/%E6%9B%B9%E8%A7%82%E5%8F%8B%EF%BC%9A%E6%97%A0%E8%AE%BA%E4%B8%8E%E8%B0%81%E5%90%88%E4%BD%9C-%E6%A7%9F%E5%B8%8C%E7%9B%9F%E9%83%BD%E4%BC%9A%E5%85%A8%E9%9D%A2%E5%A4%87%E6%88%98/
,kobieta.wp.pl,Ile pieniędzy daje szczęście ? Ekspert wskazał konkretną kwotę,https://kobieta.wp.pl/ile-pieniedzy-daje-szczescie-ekspert-wskazal-konkretna-kwote-7288663199056961v
,planeteafrique.com,Le gouvernement nigérien veut promouvoir une nouvelle image du pays à linternational …,https://planeteafrique.com/Niger/Index.asp?affiche=News_Display.asp&articleid=15839&rub=Actualites
,lancasteronline.com,Mount Joy memorial to honor Malmedy Massacre soldiers ; here how to attend the dedication,https://lancasteronline.com/news/local/mount-joy-memorial-to-honor-malmedy-massacre-soldiers-heres-how-to-attend-the-dedication/article_5bebec24-c2b0-4b9e-bbc3-0728549b9407.html
,news.pts.org.tw,中信戰味全創開幕後最高票房 週末加藝人表演抬升票價 ｜ 公視新聞網 PNN,https://news.pts.org.tw/article/809701
,express.pk,Finance expert present model budget for next fy 2026 - 2027,https://www.express.pk/story/2814430/finance-expert-present-model-budget-for-next-fy-2026-2027-2814430
,giga.de,PS5 überhitzt ? Die besten Tipps zur Kühlung der Konsole,https://www.giga.de/games/eure-ps5-ueberhitzt-so-schuetzt-ihr-die-konsole-an-heissen-tagen--01J5QSQHT1D0BQ9H0TQCY6WMQA
,openpr.com,6 Next Cryptos To Explode as Market Calm Turns Into a Hunt,https://www.openpr.com/news/4524156/6-next-cryptos-to-explode-as-market-calm-turns-into-a-hunt
,giga.de,Xbox geht neue Wege : Leak zeigt besonderen Controller,https://www.giga.de/games/xbox-geht-neue-wege-leak-zeigt-aussergewoehnlichen-controller--01KRN84ZX8SY2YWC8Y8B7R85SE
,haber1.com,Dijital pazar yerlerinin temsilcileri Bursa iş dünyasıyla bir araya geldi,https://www.haber1.com/ekonomi/dijital-pazar-yerlerinin-temsilcileri-bursa-is-dunyasiyla-bir-araya-geldi/
,tickerreport.com,"LSV Asset Management Purchases 8 , 600 Shares of Micron Technology , Inc . $MU",https://www.tickerreport.com/banking-finance/13452094/lsv-asset-management-purchases-8600-shares-of-micron-technology-inc-mu.html
,lurer.com,"Lurer . com | Հայաստանը կարող է դառնալ Ռուսաստանի , Իրանի և Ասիայի միջև տարանցիկ հանգույց",https://lurer.com/article/732974/am
,schwaebische.de,Von Berlin nach Stuttgart : Das ist der neue Minister in Baden - Württemberg,https://www.schwaebische.de/politik/von-berlin-nach-stuttgart-das-ist-der-neue-minister-in-baden-wuerttemberg-4585143
,yorkpress.co.uk,Thor pop - up opens in Parliament Street in York - photos,https://www.yorkpress.co.uk/news/26134091.thors-pop-up-opens-parliament-street-york---photos/
,openpr.com,Best Crypto To Buy In May 2026 : Saylor Calls Rally While,https://www.openpr.com/news/4524151/best-crypto-to-buy-in-may-2026-saylor-calls-rally-while
,news.cnfol.com,全球市场 ： 美股三大指数收涨 道指续创新高 特斯拉涨近2 % 中国金龙指数跌超2 %_ 证券要闻 _ 财经 _ 中金在线,http://news.cnfol.com/zhengquanyaowen/20260523/32248691.shtml
,planeteafrique.com,Préparatifs de la 33e Assemblées annuelles dAfreximbank à Alamein  :  Le Gouverneur de la Banque Centrale d  Égypte et le Président dAfreximbank tiennent une conférence de presse,https://planeteafrique.com/Niger/index.asp?affiche=News_Display.asp&ArticleID=15721
,fool.ca,Income Investors : These Canadian Companies Are Raising Payouts Again,https://www.fool.ca/2026/05/22/income-investors-these-canadian-companies-are-raising-payouts-again-2/
,romaniatv.net,"Legea salarizării se schimbă . Avem GRILELE actualizate pe profesii . Cât vor câştiga lunar medicii , profesorii , magistraţii sau poliţiştii",https://www.romaniatv.net/legea-salarizarii-se-schimba-avem-grilele-actualizate-pe-profesii-cat-vor-castiga-lunar-medicii-profesorii-magistratii-sau-politistii_9588808.html
,thueringer-allgemeine.de,Supermarkt - Angestellte bei Raub im Kreis Nordhausen verletzt,https://www.thueringer-allgemeine.de/lokales/nordhausen/article412077722/supermarkt-angestellte-bei-raub-im-kreis-nordhausen-verletzt.html
,index.hu,Index - Kultúr - Kitálalt a Természettudományi Múzeum főigazgatója : Mára kritikussá vált a helyzet,https://index.hu/kultur/2026/05/23/bernert-zsolt-magyar-termeszettudomanyi-muzeum-foigazgato-muzeum-kultbudapest-tarr-zoltan/
,antaranews.com,Memastikan konsumen pinjol tetap terlindungi,https://www.antaranews.com/berita/5579919/memastikan-konsumen-pinjol-tetap-terlindungi
