published_at,source,title,url
,karatoa.com.bd,নাটোরের বড়াইগ্রামে পথরোধ করে টাকা ছিনতাই,https://karatoa.com.bd/article/167894
,wnp.pl,Niemcy biją na głowę nawet united states . Zbrojeniowy gigant mocno zwiększył produkcję amunicji,"https://www.wnp.pl/bezpieczenstwo/szef-zbrojeniowego-giganta-niemcy-sa-najwiekszym-producentem-amunicji-na-swiecie,1059507.html"
,dailypolitical.com,Horizon Technology Finance Corporation ( NASDAQ : HRZN ) Announces Dividend of $0 . 03,https://www.dailypolitical.com/2026/05/06/horizon-technology-finance-corporation-nasdaqhrzn-announces-dividend-of-0-03.html
,wyomingnewsnow.tv,"These pasta shapes are everywhere now , and theyre not penne | National",https://www.wyomingnewsnow.tv/news/national/these-pasta-shapes-are-everywhere-now-and-they-re-not-penne/article_5503bfe0-f57b-5c63-9541-daf1f115dde7.html
,cairoscene.com,Egyptian Exchange Benchmark EGX30 Rises 14 . 2 % in April,https://cairoscene.com/Business/Egyptian-Exchange-Benchmark-EGX30-Rises-14-2-in-April
,nettavisen.no,"Shoppingtips , Boligverdi | Boligverdi - tall for april : Bråbrems i Oslo",https://www.nettavisen.no/shoppingtips/boligverdi-tall-for-april-brabrems-i-oslo/x/5-95-3022124
,focus.de,Rentenlücke in der Mittelschicht : So groß ist sie wirklich,https://www.focus.de/finanzen/rentenluecke-in-der-mittelschicht-so-gross-ist-sie-wirklich_43a94f43-1d6e-4d9c-bf81-f5a6e4d2b053.html
,ianslive.in,Middle East war to be  biggest test  of India macro resilience : Report,https://ianslive.in/middle-east-war-to-be-biggest-test-of-indias-macro-resilience-report--20260506184406
,mansethaber.com,Murat Emir : Mutlak butlan çok partili rejimi bitirir,https://mansethaber.com/siyaset/chpli-emirden-mutlak-butlan-cikisi-cok-partili-rejim-biter
,citizensvoice.com,"CNN founder Ted Turner , a brash TV pioneer , has died at age 87",https://www.citizensvoice.com/2026/05/06/cnn-founder-ted-turner-obituary/
,dailynews.com,Southern California $2 trillion economy is bigger than Florida – Daily News,https://www.dailynews.com/2026/05/06/southern-californias-2-trillion-economy-is-bigger-than-floridas/
,telix.pl,Zmiana pracy procentuje – aż 92 % pracowników poleciłoby ją innym - Portal telekomunikacyjny Telix . pl,https://www.telix.pl/rynek/raporty-prezentacje/2026/05/zmiana-pracy-procentuje-az-92-pracownikow-poleciloby-ja-innym/
,diariodemallorca.es,"Conecta Magaluf  debatirá el futuro del sector audiovisual , a través de más de 40 actividades",https://www.diariodemallorca.es/part-forana/2026/05/06/conecta-magaluf-debatira-futuro-sector-129920468.html
,chicoer.com,Chico opens utility tax refund program for low - income residents,https://www.chicoer.com/2026/05/06/chico-opens-utility-tax-refund-program-for-low-income-residents/
,dhnet.be,"Un litre dessence à 1 € du litre dès demain , cest possible , comme le suggère Georges - Louis Bouchez ? Voici pourquoi cest hautement improbable",https://www.dhnet.be/conso/auto-moto/2026/05/06/un-litre-dessence-a-1-du-litre-des-demain-cest-possible-comme-le-suggere-georges-louis-bouchez-voici-pourquoi-cest-hautement-improbable-KMRL6MW4CFAJHB624R4RFYIX7E/
,insidenova.com,"Oil prices tumble , stocks rally on Mideast peace hopes",https://www.insidenova.com/news/national/oil-prices-tumble-stocks-rally-on-mideast-peace-hopes/article_963d5055-a207-5ecb-bc51-e44ab7840ff6.html
,hawaiitelegraph.com,Snaplii Launches Feature That Bridges AI Agents and Retailers for Safe Real - World Payments,http://www.hawaiitelegraph.com/news/279033976/snaplii-launches-feature-that-bridges-ai-agents-and-retailers-for-safe-real-world-payments
,manilatimes.net,"Atos SE Announces the Offering of Senior Secured Fixed Rate Notes Due 2031 and Senior Secured Floating Rate Notes Due 2031 , and Entry into New Revolving Credit Facility",https://www.manilatimes.net/2026/05/06/tmt-newswire/globenewswire/atos-se-announces-the-offering-of-senior-secured-fixed-rate-notes-due-2031-and-senior-secured-floating-rate-notes-due-2031-and-entry-into-new-revolving-credit-facility/2337389
,kztv10.com,State Farm accused of widespread mishandling of claims after deadly LA fires,https://www.kztv10.com/life/money/state-farm-accused-of-widespread-mishandling-of-claims-after-deadly-la-fires
,unwire.hk,AI 可以幫你俾錢了 Visa 聯手中銀香港 完成首單 AI 代理支付交易,https://unwire.hk/2026/05/06/visa-ai-agent-payment-hong-kong/life-tech/
,blog.udn.com,【 Investigasi 】 Reputasi V - ITG ( Palsu ) sangat buruk ! Jangan tertipu ulasan palsu ⚠️📢 - Sinyal Bahaya,https://blog.udn.com:443/423cb40f/188450394
,sbonline.net,Problemi u Školi nogometa Marsonia : Nezadovoljni roditelji šalju apel Gradu,https://sbonline.net/clanak/problemi-u-skoli-nogometa-marsonia-nezadovoljni-roditelji-salju-apel-gradu-223
,publico.pt,DeepSeek em negociaes para a sua primeira ronda de investimento,https://www.publico.pt/2026/05/06/enter/noticia/deepseek-negociacoes-primeira-ronda-investimento-2173730
,cafebiz.vn,Quẹt thẻ tín dụng và bí quyết xây đế chế 20 tỷ USD trong kinh doanh,https://cafebiz.vn/quet-het-han-muc-10-chiec-the-tin-dung-nguoi-dan-ong-thanh-cong-xay-de-che-20-ty-usd-doc-chieu-dan-kinh-doanh-ai-cung-can-biet-176260506201050888.chn
,briefingwire.com,Bristle Hair Brush Market Trends : Rising Demand for Natural Grooming Solutions,https://www.briefingwire.com/pr/bristle-hair-brush-market-trends-rising-demand-for-natural-grooming-solutions
,vg.hu,Stratégiai befektetés a DeepSeekbe : Peking legfontosabb alapja szállna be a kínai MI - cégbe,https://www.vg.hu/nemzetkozi-gazdasag/2026/05/deepseek-befektetes-nagy-alap-mi-kina
,mansethaber.com,Petrol fiyatlarında Hürmüz alarmı - Manşet Haber,https://mansethaber.com/enerji/petrol-piyasasinda-firtina-oncesi-sessizlik
,zazoom.it,Conto alla rovescia per OroArezzo 2026 Confartigianato orafi presente con 60 imprese associate,https://www.zazoom.it/2026-05-06/conto-alla-rovescia-per-oroarezzo-2026-confartigianato-orafi-presente-con-60-imprese-associate/19134576/
,ids.ac.uk,Progressive trade policy for inclusive growth - Institute of Development Studies,https://www.ids.ac.uk/opinions/progressive-trade-policy-for-inclusive-growth/
,zf.ro,"Primele reacţii după moţiune . Sebastian Metz , AHK România : „ Reformele asumate ...",https://www.zf.ro/eveniment/primele-reactii-dupa-motiune-sebastian-metz-ahk-romania-reformele-23145560
,dostor.org,سعر الجنيه الذهب اليوم الأربعاء 6 مايو 2026 في مصر,https://www.dostor.org/5542480
,birgun.net,"Gazeteci Hakan Tosun cinayetinde ilk duruşma görülüyor :  Tekme atmadım , dürttüm",https://www.birgun.net/haber/gazeteci-hakan-tosun-cinayetinde-ilk-durusma-goruluyor-tekme-atmadim-durttum-710666%20target=_blank
,informer.rs,Kristijan B . vozio prejak automobil za mladog vozača,https://informer.rs/hronika/vesti/1112878/kristijan-b-besna-masina-nesreca
,dire.it,In Italia lavora solo il 58 % delle madri con figli piccoli,https://www.dire.it/06-05-2026/1237625-in-italia-lavora-solo-il-58-delle-madri-con-figli-piccoli/
,t21.com.mx,La cadena de frío no se rompe sola : el costo de seguir tratándola como un tema operativo,https://t21.com.mx/la-cadena-de-frio-no-se-rompe-sola-el-costo-de-seguir-tratandola-como-un-tema-operativo/
,ipc.digital,"O mercado japonês de carros usados ​​está em expansão e deverá atingir o recorde de 5 , 3 trilhões de ienes até 2025",https://ipc.digital/le-marche-japonais-des-voitures-doccasion-setend-pour-atteindre-un-chiffre-record-de-53-billions-de-yens-en-2025/
,kios.org,"kIOS FM Local News for Wednesday , 5 / 6 / 26 | 91 . 5 KIOS - FM Omaha Public Radio",https://www.kios.org/2026-05-06/kios-fm-local-news-for-wednesday-5-6-26
,nakedcapitalism.com,Economic Management in War : Professor Michael Hudson in Discussion with Ian Proud,https://www.nakedcapitalism.com/2026/05/economic-management-in-war-professor-michael-hudson-in-discussion-with-ian-proud.html
,investegate.co.uk,Director / PDMR Shareholding | Company Announcement,https://www.investegate.co.uk/announcement/rns/asa-international-group--asai/director-pdmr-shareholding/9555445
,finanzen.net,Strategy - Aktie an der NASDAQ dennoch in Grün : Strategy weiter mit tiefroten Zahlen,https://www.finanzen.net/nachricht/aktien/zahlen-praesentiert-strategy-aktie-schwaecher-weiter-massive-verluste-bei-bitcoin-hodler-15656060
,finance.yahoo.com,"Deutsche Bank Lifts Price Target on Woodward , Inc . ( WWD ) to $470 , Maintains Buy Rating",https://finance.yahoo.com/markets/stocks/articles/deutsche-bank-lifts-price-target-143646764.html
,keyj.com,Is Abilene Losing Its Small - Town Charm Amid Rapid Growth ?,https://keyj.com/ixp/114/p/abilene-texas-growth-impact/
,investegate.co.uk,Pathwix AI Redefines Financial Clarity : Using Personal Pathfiles to Navigate Budgeting and Stock Market Entry | Company Announcement,https://www.investegate.co.uk/announcement/fnw/finance-wire-news--fnews/pathwix-ai-redefines-financial-clarity-using-/9555536
,allafrica.com,Ghana : Net Loss - the Hidden Cost of Protecting Ghana Oceans,https://allafrica.com/stories/202605060324.html
,maszol.ro,Költségvetési Tanács : a deficitcsökkentést folytató kormányra van szükség,https://maszol.ro/belfold/Koltsegvetesi-Tanacs-a-deficitcsokkentest-folytato-kormanyra-van-szukseg
,ntdtv.com,廣州一小狗撿瓶子攢了10萬元 主人談細節 （ 視頻 ）,https://www.ntdtv.com/b5/2026/05/06/a104093629.html
,loksatta.com,Indian Sailors Rescued Mumbai High Court :  जगण्यासाठी मासे खावे लागले ; अरबी समुद्रात ३ महिने अडकलेल्या ५० भारतीय खलाशांची सुटका !,https://www.loksatta.com/maharashtra/indian-sailors-rescued-arabian-sea-mumbai-high-court-humanitarian-crisis-intent-main-dc-kvg-85-5882271/
,news.mail.ru,Поставка 100 тысяч беспилотников из Турции : что известно о сделке и целях Анкары,https://news.mail.ru/society/70796036/
,insideevs.com,Honda $11B EV Factory In Canada Is Dead : Report,https://insideevs.com:443/news/795035/honda-ev-factory-canada-canceled/
,diariojunio.com.ar,"Desde Concordia , Entre Ríos exportó a Europa el primer embarque de miel sin aranceles",https://www.diariojunio.com.ar/desde-concordia-entre-rios-exporto-a-europa-el-primer-embarque-de-miel-sin-aranceles/
,briefingwire.com,Gene Editing Drug Market : Accelerating Precision Medicine with CRISPR - Based Therapies,https://www.briefingwire.com/pr/gene-editing-drug-market-accelerating-precision-medicine-with-crispr-based-therapies
,ziuanews.ro,Ceea ce vedeți este un ritual de umilire : Ei râd de tine înainte de a te sacrifica !,https://www.ziuanews.ro/stiri/ceea-ce-vede-i-este-un-ritual-de-umilire-ei-rad-de-tine-inainte-de-a-te-sacrifica-1594019
,rtvbn.com,Lopare slave Dan opštine i krsnu slavu - Đurđevdan,https://www.rtvbn.com/4091269/lopare-slave-dan-opstine-i-krsnu-slavu-djurdjevdan
,as.com,"Palace , otra vez la Serie A y los petrodólares miran a Marcelino",https://as.com/futbol/primera/palace-otra-vez-la-serie-a-y-los-petrodolares-miran-a-marcelino-f202605-n/
,telix.pl,Toncoin wzrósł o 60 % po zapowiedziach Pawła Durowa dotyczących TON - Portal telekomunikacyjny Telix . pl,https://www.telix.pl/rynek/kryptowaluty/2026/05/toncoin-wzrosl-o-60-po-zapowiedziach-pawla-durowa-dotyczacych-ton/
,livemint.com,Quote of the day by George Eliot :  The only failure a man ought to fear is failure in cleaving to ….,https://www.livemint.com/news/us-news/quote-of-the-day-by-george-eliot-the-only-failure-a-man-ought-to-fear-is-failure-in-cleaving-to-11778074172182.html
,briefingwire.com,Relaxation Redefined : Growth Trends in the Global Hammock Industry Boom,https://www.briefingwire.com/pr/relaxation-redefined-growth-trends-in-the-global-hammock-industry-boom
,tinnhanhchungkhoan.vn,Kiên quyết đưa sân bay Long Thành vào khai thác trong năm 2026,https://www.tinnhanhchungkhoan.vn/kien-quyet-dua-san-bay-long-thanh-vao-khai-thac-trong-nam-2026-post389962.html
,eastbayri.com,"Atwater - Donnelly Trio performs Sunday | EastBayRI . com - News , Opinion , Things to Do in the East Bay","http://www.eastbayri.com/stories/atwater-donnelly-trio-performs-sunday,139618"
,news.az,Saudi Arabia posts $33 . 5B budget deficit on oil revenue drop,https://news.az/news/saudi-arabia-posts-335b-budget-deficit-on-oil-revenue-drop
,perfil.com,Cómo mantener los subsidios de luz y gas en mayo,https://www.perfil.com/noticias/economia/subsidios-la-guia-definitiva-para-no-perder-el-beneficio-en-las-facturas-de-luz-y-gas-a40.phtml
,dailymail.com,"Revealed : The best culturally vibrant towns and cities to live in the united kingdom - with grand , historic venues and international cuisine",https://www.dailymail.com/travel/article-15794445/The-best-culturally-vibrant-towns-cities-live-UK-grand-historic-venues-international-cuisine.html
,prnasia.com,图灵进化亮相GITEX AI Kazakhstan ， 三款AI一体机发布 ， 总统亲临关注 - 美通社PR - Newswire,https://www.prnasia.com/lightnews/lightnews-1-77-95848.shtml
,mavikocaeli.com.tr,Tasarruf etmeli ve başarmalıyız,https://www.mavikocaeli.com.tr/yazarlar/tugrul-kirankaya/tasarruf-etmeli-ve-basarmaliyiz/3957/
,vg.hu,"A német aranytartalék hatalmas malacpersely , amelyet ideje lenne feltörni",https://www.vg.hu/nemzetkozi-gazdasag/2026/05/nemet-aranytartalek-eladas-energiavalsag
,adndigital.com.py,Paraguay recibió USD 165 millones de Itaipú en el primer cuatrimestre de 2026,https://www.adndigital.com.py/paraguay-recibio-usd-165-millones-de-itaipu-en-el-primer-cuatrimestre-de-2026/
,hnonline.sk,"AI mení trh práce , v Číne však narazila na limity pri prepúšťaní",https://hnonline.sk/style/tech/96279644-ai-meni-trh-prace-v-cine-vsak-narazila-na-limity-pri-prepustani
,jalopnik.com,Lucid Suffers A Net Loss Of $1 Billion In The First Quarter Of 2026,https://www.jalopnik.com/2166026/lucid-net-loss-1-billion-q1-2026/
,odnako.org,"Axios : US - Iran close to memorandum to end the war . Oil collapses , stock markets soar",https://www.odnako.org/axios-us-iran-close-to-memorandum-to-end-the-war-oil-collapses-stock-markets-soar/
,istoe.com.br,Lula viaja hoje para os EUA ; saiba o que esperar do reencontro com Trump,https://istoe.com.br/lula-viaja-hoje-para-os-eua-saiba-o-que-esperar-do-reencontro-com-trump
,nhregister.com,"CNN founder Ted Turner , a brash and outspoken television pioneer , has died at age 87",https://www.nhregister.com/entertainment/article/cnn-founder-ted-turner-a-brash-and-outspoken-22244681.php
,poslovni.hr,Oštar pad cijena nafte nakon naznaka da se SAD i Iran približavaju sporazumu,https://www.poslovni.hr/svijet/ostar-pad-cijena-nafte-nakon-naznaka-da-se-sad-i-iran-priblizavaju-sporazumu-4536530
,naslovi.net,Kompanija Zlatna Reka demantovala da obustavlja geološka istraživanja na Rogozni,https://naslovi.net/2026-05-06/n1-info/kompanija-zlatna-reka-demantovala-da-obustavlja-geoloska-istrazivanja-na-rogozni/41772263
,briefingwire.com,Raceanisodamine Market : Growing Applications in Antispasmodic and Gastrointestinal Treatments,https://www.briefingwire.com/pr/raceanisodamine-market-growing-applications-in-antispasmodic-and-gastrointestinal-treatments
,zazoom.it,Cassano non ha dubbi | Curtis Jones per lInter ? Sarebbe meglio di McTominay ha grande qualità,https://www.zazoom.it/2026-05-06/cassano-non-ha-dubbi-curtis-jones-per-linter-sarebbe-meglio-di-mctominay-ha-grande-qualita/19134589/
,knittingindustry.com,Texworld Paris returns for 59th edition,https://www.knittingindustry.com/texworld-paris-returns-for-59th-edition/
,larepublica.pe,"Madre de Dios : Caen 6 mineros ilegales con armamento , dragas y campamentos en la RN Tambopata",https://larepublica.pe/politica/2026/05/06/madre-de-dios-caen-6-mineros-ilegales-con-armamento-dragas-y-campamentos-en-la-rn-tambopata-mineria-ilegal-hnews-251640
,makassar.tribunnews.com,"AABI Soroti Dampak Harga Aspal dan Material Konstruksi Naik , Proyek Infrastruktur Terancam",https://makassar.tribunnews.com/makassar/1837045/aabi-soroti-dampak-harga-aspal-dan-material-konstruksi-naik-proyek-infrastruktur-terancam
,manfredonianews.it,Anticipo mercato settimanale Scaloria a lunedì 4 gennaio,https://www.manfredonianews.it/2020/12/31/anticipo-mercato-settimanale-scaloria-a-lunedi-4-gennaio/
,zf.ro,Afacerile producătorului de materiale de construcţii DAW Benţa România au crescut ...,https://www.zf.ro/companii/afacerile-producatorului-de-materiale-de-constructii-daw-benta-23144938
,handelsblatt.com,Corona - Impfstoffe : Regierung sieht Impfstoffversorgung nach BioNTech - Rückzug gesichert,https://www.handelsblatt.com/unternehmen/handel-konsumgueter/corona-impfstoffe-regierung-sieht-impfstoffversorgung-nach-biontech-rueckzug-gesichert/100222958.html
,handelsblatt.com,Pharma : So stellt sich Biontech auf,https://www.handelsblatt.com/politik/deutschland/pharma-so-stellt-sich-biontech-auf/100222961.html
,rnz.de,Nackenschlag zum Jahresstart : Gewinn von Daimler Truck um 80 Prozent eingebrochen ( Update ),"https://www.rnz.de/politik/wirtschaft-regional_artikel,-Nackenschlag-zum-Jahresstart-Gewinn-von-Daimler-Truck-um-80-Prozent-eingebrochen-Update-_arid,2291441.html"
,digitaltrends.com,Google is working on a  24 / 7 personal agent  that sounds a lot like its answer to OpenClaw,https://www.digitaltrends.com/computing/google-is-working-on-a-24-7-personal-agent-that-sounds-a-lot-like-its-answer-to-openclaw/
,borsen.dk,Huller og gammelt byggeri forlænger levetiden hos Skandinaviens største murstensproducent,https://borsen.dk:443/nyheder/baeredygtig/huller-og-gammelt-byggeri-forlaenger-levetiden-hos-skandinaviens-storste-murstensproducent
,investegate.co.uk,Result of AGM | Company Announcement,https://www.investegate.co.uk/announcement/rns/hostelworld-group--hsw/result-of-agm/9555389
,capital.gr,Η διεθνής συμβουλευτική εταιρία Leyton επεκτείνεται στην Ελλάδα με τη ...,https://www.capital.gr/epixeiriseis/3989924/i-diethnis-sumbouleutiki-etairia-leyton-epekteinetai-stin-ellada-me-ti-leyton-hellas/
,elimparcial.com,Precio del dólar  cayó  frente al peso mexicano y así cotiza el tipo de cambio este miércoles 6 de mayo,https://www.elimparcial.com/dinero/2026/05/06/precio-del-dolar-cayo-frente-al-peso-mexicano-y-asi-cotiza-el-tipo-de-cambio-este-miercoles-6-de-mayo/
,dailypolitical.com,HealthStream Q1 Earnings Call Highlights,https://www.dailypolitical.com/2026/05/06/healthstream-q1-earnings-call-highlights.html
,qds.it,"Pensioni 2027 , nuovi importi : ecco di quanto potrebbero aumentare",https://qds.it/pensioni-2027-nuovi-importi-ecco-di-quanto-aumenteranno/
,politikexpress.de,Wieder werden Arzneimittel für Kinder ausgebremst,https://www.politikexpress.de/wieder-werden-arzneimittel-f-r-kinder-ausgebremst-2249452.html
,investegate.co.uk,Results analysis from Kepler Trust Intelligence | Company Announcement,https://www.investegate.co.uk/announcement/rns/pacific-assets-trust--pac/results-analysis-from-kepler-trust-intelligence/9555364
,libertaddigital.com,Bruselas investiga si el Gobierno usó irregularmente fondos europeos para pagar pensiones,https://www.libertaddigital.com/libremercado/2026-05-06/bruselas-investiga-si-el-gobierno-uso-irregularmente-fondos-europeos-para-pagar-pensiones-1b-7400292/
,hawaiitelegraph.com,Electrovaya Announces Date for Q2 - 2026 Financial Results & Conference Call,http://www.hawaiitelegraph.com/news/279033968/electrovaya-announces-date-for-q2-2026-financial-results-conference-call
,dogruhaber.com.tr,İrandan Hürmüz Boğazı için güvenli geçiş duyurusu -,https://dogruhaber.com.tr/irandan-hurmuz-bogazi-icin-guvenli-gecis-duyurusu
,boerse-social.com,Einladung zu VBV im Diskurs :  Ohne Demokratie keine Nachhaltigkeit,https://www.boerse-social.com/2026/05/06/einladung_zu_vbv_im_diskurs_ohne_demokratie_keine_nachhaltigkeit
,livemint.com,"Bangladesh expects no  pushback from India after BJP win in West Bengal , Assam : Minister",https://www.livemint.com/news/india/bangladesh-expects-no-pushbacks-from-india-after-bjp-win-in-west-bengal-assam-minister-11778070877779.html
,163.com,250万预算买珠海新房 ？ 这份  主城优等生  榜单请收好 ， 华发天玺强势登顶 ！ |置业|物业|南湾|珠海市,https://www.163.com/dy/article/KS9G9L2V0552NVEU.html
,haberler.com,TBMM Genel Kurulu,https://www.haberler.com/politika/tbmm-genel-kurulu-19822727-haberi/
,finance.sina.com.cn,AMD CEO苏姿丰 ： 智能体正引爆人工智能周期巨大需求,https://finance.sina.com.cn/stock/usstock/c/2026-05-06/doc-inhwyqhc5686127.shtml
,dutchitchannel.nl,Dutch IT Channel - Ontslagronde bij Cognizant moet AI - transformatie financieren,https://www.dutchitchannel.nl/news/731264/cognizant-zet-in-op-ai-15-000-ontslagen-voor-nieuwe-koers
,plazadearmas.com.mx,Gobierno y Morena : Días de vértigo - Plaza de Armas,https://plazadearmas.com.mx/gobierno-y-morena-dias-de-vertigo/
,manilatimes.net,Hercules Metals Increases Previously Announced Bought Deal Financing and Concurrent Private Placement to C$31 . 5 Million,https://www.manilatimes.net/2026/05/06/tmt-newswire/globenewswire/hercules-metals-increases-previously-announced-bought-deal-financing-and-concurrent-private-placement-to-c315-million/2337384
,marketscreener.com,"US Gasoline at $5  Not Likely , Oil Analyst Schork Says",https://www.marketscreener.com/news/us-gasoline-at-5-not-likely-oil-analyst-schork-says-ce7f58d2db8bff2d
,aktiencheck.de,Klingbeil sieht Koalitionsgeburtstag  ein bisschen betrübt  (),https://www.aktiencheck.de/news/Artikel-Klingbeil_sieht_Koalitionsgeburtstag_bisschen_betruebt-19736657
,mirror.co.uk,Benefits cut claimant warned DWP that he would kill himself - a week later he was dead,https://www.mirror.co.uk/news/uk-news/benefits-cut-claimant-warned-dwp-37119223
,poslovni.hr,"Novi udar na novčanike građana : U Europi raste cijena električne energije , evo gdje je najskuplja",https://www.poslovni.hr/europska-unija/novi-udar-na-novcanike-gradana-u-europi-raste-cijena-elektricne-energije-pogledajte-gdje-je-najskuplja-4536473
,theweek.com,Morning Report - Trump Indiana revenge election,https://theweek.com/edition/theweekus-morning-report-2026-05-06-105504
,daytondailynews.com,"Dayton police , fire crews on scene of fire at former convenience store",https://www.daytondailynews.com/local/dayton-police-fire-crews-on-scene-of-fire-at-former-convenience-store/article_ba77e3e8-36f1-57b2-9ed5-739452ffe543.html
,racunalniske-novice.com,DDR5 pomnilnik z učinkom neskončnosti,https://racunalniske-novice.com/revolucionarni-ddr5-pomnilnik-z-ucinkom-neskoncnosti/
,finance.yahoo.com,TransMedics ( TMDX ) Q1 2026 Earnings Transcript,https://finance.yahoo.com/sectors/healthcare/articles/transmedics-tmdx-q1-2026-earnings-144147317.html
,prnewswire.com,IKONY MUZYKI : Julien prezentuje aukcję kultowych pamiątek rock and rolla,https://www.prnewswire.com/news-releases/ikony-muzyki-juliens-prezentuje-aukcj-kultowych-pamitek-rock-and-rolla-302764307.html
,manado.tribunnews.com,"Bupati Sitaro Chintya Kalangit Terancam Hukuman 20 Tahun Penjara , Ditahan di Rutan Malendeng",https://manado.tribunnews.com/manado/1875393/bupati-sitaro-chintya-kalangit-terancam-hukuman-20-tahun-penjara-ditahan-di-rutan-malendeng
,bangladeshsun.com,"KSCA distances itself from IPL 2026 ticket resale probe , assures full cooperation",http://www.bangladeshsun.com/news/279034049/ksca-distances-itself-from-ipl-2026-ticket-resale-probe-assures-full-cooperation
,marketscreener.com,Why investors love companies they do not understand,https://www.marketscreener.com/news/why-investors-love-companies-they-do-not-understand-ce7f58d2db8afe27
,it.euronews.com,"Lufthansa , ricavi record ma guerra in Iran e i costi del carburante pesano sullutile annuo",https://it.euronews.com/business/2026/05/06/lufthansa-ricavi-record-ma-guerra-in-iran-e-i-costi-del-carburante-pesano-sullutile-annuo
,dailypolitical.com,Andersons Q1 Earnings Call Highlights,https://www.dailypolitical.com/2026/05/06/andersons-q1-earnings-call-highlights.html
,borsaitaliana.it,"Technogym : +10 , 1 % a 237 mln ricavi I trim , +20 , 7 % business Italia",https://www.borsaitaliana.it/borsa/notizie/radiocor/finanza/dettaglio/technogym-101-a-237-mln-ricavi-i-trim-207-business-italia-nRC_06052026_1403_465418440.html
,gamerant.com,Asmongold reveals shocking detail about how much money he makes,https://gamerant.com/asmongold-income-revenue-shocking/
,boursorama.com,Wall Street ouvre en hausse avec loptimisme au Moyen - Orient et sur lIA - 06 / 05 / 2026 à 15 : 56,https://www.boursorama.com/bourse/actualites/wall-street-ouvre-en-hausse-avec-l-optimisme-au-moyen-orient-et-sur-l-ia-8df0e55dda7a3d759ea82d88ba4a3f78
,maharashtratimes.com,"MSMEs Loan ; सूक्ष्म , लघु व्यवसाय करणाऱ्यांना दिलासा ; जमीन खरेदी ते इमारतीचे बांधकाम ... बँकेकडून 50 कोटींचे कर्ज मिळणार",https://maharashtratimes.com/business/business-news/sidbi-offers-direct-loans-up-to-rupees-50-crore-to-msmes-for-land-purchase-factory-construction-machinery-and-solar-projects/articleshow/130855507.cms
,dailypolitical.com,Susquehanna Lowers Oil States International ( NYSE : OIS ) Price Target to $11 . 00,https://www.dailypolitical.com/2026/05/06/susquehanna-lowers-oil-states-international-nyseois-price-target-to-11-00.html
,rtl.hu,"„ Úgy kellett csinálni , mintha lenne verseny  – Pálfi Norbert a reklámpiac torzulásáról",https://rtl.hu/reggeli/2026/05/06/palfi-norbert-elemezte-a-reklampiac-helyzetet
