published_at,source,title,url
,denik.cz,Test ojeté Škody Octavie kombi : Rodinný hit i po letech stále válcuje konkurenci,https://www.denik.cz/autobazar/test-ojeta-skoda-octavia-kombi-3-generace-tdi.html
,thehindubusinessline.com,"RBI holds rates steady amid global inflation , growth concerns",https://www.thehindubusinessline.com/money-and-banking/rbi-holds-rates-steady-amid-global-inflation-growth-concerns/article70838630.ece
,berliner-zeitung.de,Tracking - Daten : Indiens erste iranische Öllieferung seit 7 Jahren ist wohl unterwegs,https://www.berliner-zeitung.de/news/tracking-daten-indiens-erste-iranische-oellieferung-seit-7-jahren-ist-wohl-unterwegs-berichte-li.10029210
,bursa.ro,Homplex îşi propune afaceri de 70 milioane lei în 2026,https://www.bursa.ro/homplex-isi-propune-afaceri-de-70-milioane-lei-in-2026-43358852
,wirtualnemedia.pl,Aleksandra i Michał Żebrowscy reklamują nową markę Revolut,"https://www.wirtualnemedia.pl/aleksandra-i-michal-zebrowscy-reklamuja-nowa-marke-revolut,7272661987371200a"
,news.wsu.edu,Selling the city : students elevate Vancouver tourism strategy | WSU Insider,https://news.wsu.edu/news/2026/04/08/selling-the-city-students-elevate-vancouvers-tourism-strategy/
,zonebourse.com,"Deere progresse à Wall Street , Jefferies nest plus à la vente",https://www.zonebourse.com/actualite-bourse/deere-progresse-a-wall-street-jefferies-n-est-plus-a-la-vente-ce7e50dbd98bf327
,dailybusiness.ro,"Iranul ar putea redeschide controlat Strâmtoarea Ormuz , în pragul negocierilor cu SUA",https://www.dailybusiness.ro/stiri-externe/iranul-ar-putea-redeschide-controlat-stramtoarea-ormuz-in-pragul-negocierilor-cu-sua-538408/
,kayserihaber.com.tr,"Altın yeniden zirvede ! Ateşkes bile düşüremedi , fiyatlar uçuşta …",https://www.kayserihaber.com.tr/haber/altin-yeniden-zirvede-ateskes-bile-dusuremedi-fiyatlar-ucusta-91396
,sapo.pt,Tecnologia portuguesa que united states recursos marinhos para regenerar solos é finalista de prémio internacional,https://sapo.pt/artigo/tecnologia-portuguesa-que-usa-recursos-marinhos-para-regenerar-solos-e-finalista-de-premio-internacional-69d660083ad204248c5c279b
,khabarfast.com,"यमुना स्वच्छता के लिए दिल्ली सरकार का बड़ा संकल्प ,  ग्रीन बजट  का बड़ा हिस्सा यमुना सफाई के लिए आवंटित",https://www.khabarfast.com/delhi-government-major-pledge-for-yamuna-cleanliness
,royalgazette.com,Broker report shows fall in reinsurance rates,https://www.royalgazette.com/reinsurance/business/article/20260408/broker-report-shows-fall-in-reinsurance-rates/
,hawaiitelegraph.com,SoloTruth Launches Asset Relationship Management ( ARM ) Platform for Real - Time Fixed Asset Verification,http://www.hawaiitelegraph.com/news/278971341/solotruth-launches-asset-relationship-management-arm-platform-for-real-time-fixed-asset-verification
,stockbiz.vn,"Doanh nghiệp TPHCM kiến nghị bình ổn chi phí logistics , có quỹ hỗ trợ vận chuyển",https://stockbiz.vn/tin-tuc/doanh-nghiep-tphcm-kien-nghi-binh-on-chi-phi-logistics-co-quy-ho-tro-van-chuyen/39375435
,europapress.es,El Gobierno prepara la nueva fase de liberación de reservas petrolíferas para hacerla  en el mejor momento,https://www.europapress.es/economia/energia-00341/noticia-gobierno-prepara-nueva-fase-liberacion-reservas-petroliferas-hacerla-mejor-momento-20260408153335.html
,fleetowner.com,How fleet data can help cut diesel costs and improve efficiency,https://www.fleetowner.com:443/perspectives/ideaxchange/blog/55369242/how-fleet-data-can-help-cut-diesel-costs-and-improve-efficiency
,finanzen.net,S & P 500 - Papier AMD ( Advanced Micro Devices ) - Aktie : So viel Gewinn hätte ein AMD ( Advanced Micro Devices ) - Investment von vor einem Jahr eingefahren,https://www.finanzen.net/nachricht/aktien/s-p-500-papier-amd-advanced-micro-devices-aktie-so-viel-gewinn-haette-ein-amd-advanced-micro-devices-investment-von-vor-einem-jahr-eingefahren-15599670
,kasu.org,Oil prices plunge and stocks soar after U . S . and Iran agree on ceasefire,https://www.kasu.org/business-economy/2026-04-08/oil-prices-plunge-and-stocks-soar-after-u-s-and-iran-agree-on-ceasefire
,otomotif.kompas.com,"TVS Luncurkan Kendaraan Roda Tiga Armado 200 , Harga mulai Rp 34 Jutaan",https://otomotif.kompas.com/read/2026/04/08/201200915/tvs-luncurkan-kendaraan-roda-tiga-armado-200-harga-mulai-rp-34-jutaan
,vietgiaitri.com,Cuộc sống rực rỡ của chàng trai bại não đảo Phú Quý,https://vietgiaitri.com/cuoc-song-ruc-ro-cua-chang-trai-bai-nao-dao-phu-quy-20260408i7670392/
,investinglive.com,US president Trump says will work closely with Iran amid  very productive  regime change,https://investinglive.com:443/news/us-president-trump-says-will-work-closely-with-iran-amid-very-productive-regime-change-20260408/
,gqindia.com,"The best marathon running shoes for your upcoming training block , according to GQ",https://www.gqindia.com/content/the-best-marathon-running-shoes-for-your-upcoming-training-block-according-to-gq
,q1065.fm,I - 395 On - Ramp Closure In Bangor : What Drivers Need To Know,https://q1065.fm/ixp/543/p/i395-construction-alert-maine/
,euro2day.gr,ΕΟΦ : Ανακαλείται βρεφικό γάλα Almiron Profutura 1,https://www.euro2day.gr/news/highlights/article/2345687/eof-anakaleitai-vrefiko-gala-almiron-profutura-1.html
,brasil247.com,Ibovespa atinge recorde histórico e dólar cai com cessar - fogo no Irã,https://www.brasil247.com:443/economia/ibovespa-atinge-recorde-historico-e-dolar-cai-com-cessar-fogo-no-ira
,thehindubusinessline.com,"Ahmedabad - Based Greendot Biopak Expands 100 % Bio - Based , Compostable and SUPD - Exempt Packaging Solutions for a Changing Global Regulatory Landscape",https://www.thehindubusinessline.com/brandhub/pr-release/ahmedabad-based-greendot-biopak-expands-100-bio-based-compostable-and-supd-exempt-packaging-solutions-for-a-changing-global-regulatory-landscape/article70837882.ece
,londonmercury.com,"RBI sets $85 oil benchmark for FY26 , $75 for FY27 after US - Iran ceasefire eases prices",http://www.londonmercury.com/news/278971090/rbi-sets-85-oil-benchmark-for-fy26-75-for-fy27-after-us-iran-ceasefire-eases-prices
,menorca.info,"L4 , el nuevo SUV urbano de Lepas",https://www.menorca.info/actualidad/motor-1/2026/04/07/2603969/nuevo-suv-urbano-lepas.html
,tickerreport.com,FormFactor ( NASDAQ : FORM ) Sets New 1 - Year High – Here Why,https://www.tickerreport.com/banking-finance/13401685/formfactor-nasdaqform-sets-new-1-year-high-heres-why.html
,mp.cnfol.com,老马点金 ： 8号黄金现价4805空 ， 杜绝一切马后炮 ！_ 中金在线财经号,http://mp.cnfol.com/54260/article/1775653488-142349824.html
,dailybusiness.ro,"România , printre ţările UE cu cele mai importante scăderi ale preţurilor producţiei industriale în luna februarie",https://www.dailybusiness.ro/actualitate/productiei-industriale-538416/
,vz.ru,Роспотребнадзор начал проверку крема La Roche - Posay из - за опасного состава :: Новости дня / ВЗГЛЯД,https://vz.ru/news/2026/4/8/1409199.html
,braintreeandwithamtimes.co.uk,Plans unveiled for 375 new homes on edge of Silver End | Braintree and Witham Times,https://www.braintreeandwithamtimes.co.uk/news/26003299.plans-unveiled-375-new-homes-village-near-braintree/
,kcby.com,No accountability : neighbors say Seattle isnt keeping its word near tiny home village,https://kcby.com/news/nation-world/western-washington-homeless-vote-poll-how-confident-are-you-that-the-city-of-seattle-will-adequately-address-homelessness-issues
,fr.allafrica.com,Afrique : Marché du travail - Une participation en recul au quatrième trimestre 2025,https://fr.allafrica.com/stories/202604080468.html
,cfi.net.cn,[ 预警 ] 中化岩土 ( 002542 ): 公司股票交易可能被实施退市风险警示的提示性公告 - CFi . CN 中财网,http://www.cfi.net.cn/p20260408003290.html
,nepalnational.com,"Schneider Electric hosted its biggest - ever Innovation Event , Showcased 400+ energy - tech solutions to strengthen India energy resilience",http://www.nepalnational.com/news/278971075/schneider-electric-hosted-its-biggest-ever-innovation-event-showcased-400-energy-tech-solutions-to-strengthen-india-energy-resilience
,record-bee.com,Best Deodorant for Body Odor,https://www.record-bee.com/2026/04/07/best-deodorant-for-body-odor/
,radiolombardia.it,"Marco Ferdico , lex capo ultrà dellInter , era il  terminale del narcotraffico  della  ndrangheta a Milano e in Brianza",https://www.radiolombardia.it/2026/04/08/marco-ferdico-lex-capo-ultra-dellinter-era-il-terminale-del-narcotraffico-della-ndrangheta-a-milano-e-in-brianza/
,em.com.br,Petróleo despenca após anúncio de cessar - fogo entre EUA e Irã : como isso afeta o Brasil,https://www.em.com.br/economia/2026/04/7392886-petroleo-despenca-apos-anuncio-de-cessar-fogo-entre-eua-e-ira-como-isso-afeta-o-brasil.html
,elivebrescia.tv,"Accise , Streparava :  Non basta , industria sotto pressione",https://www.elivebrescia.tv/accise-streparava-confindustria-commissione-senato/
,manilatimes.net,MetalCloak Announces Ram Month : 25 % Off All Ram Truck Parts,https://www.manilatimes.net/2026/04/08/tmt-newswire/globenewswire/metalcloak-announces-ram-month-25-off-all-ram-truck-parts/2316584
,hawaiitelegraph.com,Elektros Ignites Global EV Infrastructure Momentum Following Strategic Dialogue with Major Automotive Leader,http://www.hawaiitelegraph.com/news/278971477/elektros-ignites-global-ev-infrastructure-momentum-following-strategic-dialogue-with-major-automotive-leader
,ealingtimes.co.uk,Irish leaders condemn fuel protests as wrong and  not in the national interest,https://www.ealingtimes.co.uk/news/national/26003894.irish-leaders-condemn-fuel-protests-wrong-not-national-interest/
,finance.liga.net,Рада приняла за основу 15111 - д о цифровых платформах | Новости Украины,https://finance.liga.net/state-finance/novosti/rada-podderzhala-nalogooblozhenie-dohoda-s-tsifrovyh-platform-pervoe-chtenie
,hawaiitelegraph.com,NextTrip Partners with QSTAK to Launch Tokenized Rewards and Unlock New Revenue Opportunities,http://www.hawaiitelegraph.com/news/278971208/nexttrip-partners-with-qstak-to-launch-tokenized-rewards-and-unlock-new-revenue-opportunities
,laopiniondemurcia.es,CUERPO ARANCELES MERCOSUR | Cuerpo destaca que se han movilizado más de 5 . 500 millones por los aranceles y celebra la tregua entre EEUU e Irán,https://www.laopiniondemurcia.es/economia/2026/04/08/cuerpo-destaca-han-movilizado-5-128876211.html
,bignewsnetwork.com,China unveils large model for carbon emission accounting,http://www.bignewsnetwork.com/news/278971488/china-unveils-large-model-for-carbon-emission-accounting
,wirtualnemedia.pl,Szefowa KRRiT zawiadamia prokuraturę w sprawie TVP i Polskiego Radia,"https://www.wirtualnemedia.pl/krrit-agnieszka-glapiak-zawiadomienie-prokuratura-tvp-polskie-radio-likwidacja,7273074678360256a"
,ideal.es,España frena su avance hacia la electromovilidad según el Barómetro de Anfac,https://www.ideal.es/motor/economia/espana-frena-avance-electromovilidad-segun-barometro-anfac-20260408150444-ntrc.html
,lsm.lv,Ukrainā cīņa par finanšu krīzes novēršanu : militāro nodevu būs jāmaksā arī pēc kara beigām,https://www.lsm.lv/raksts/zinas/ekonomika/08.04.2026-ukraina-cina-par-finansu-krizes-noversanu-militaro-nodevu-bus-jamaksa-ari-pec-kara-beigam.a642095/
,dailypolitical.com,MasTec ( NYSE : MTZ ) Hits New 52 - Week High – Here Why,https://www.dailypolitical.com/2026/04/08/mastec-nysemtz-hits-new-52-week-high-heres-why.html
,baijiahao.baidu.com,洗面奶哪个牌子最好用 ， 10大男士洗面奶排名 ， 十大口碑爆款实测数据+洗感实测 ！ 解决油腻难题,https://baijiahao.baidu.com/s?id=1861865626564481723
,glavcom.ua,Оренда житла у Києві : який вигляд має квартира за 130 тис . грн з видом на Софійську площу,https://glavcom.ua/kyiv/news/orenda-zhitla-u-kijevi-jakij-vihljad-maje-kvartira-za-130-tis-hrn-z-vidom-na-sofijsku-ploshchu-1112656.html
,onvista.de,Delta ohne Jahresprognose - Treibstoff belastet Gewinn,https://www.onvista.de/news/2026/04-08-delta-ohne-jahresprognose-treibstoff-belastet-gewinn-0-10-26498434
,tickerreport.com,Invesco S & P MidCap Momentum ETF ( NYSEARCA : XMMO ) Reaches New 52 - Week High – Time to Buy ?,https://www.tickerreport.com/banking-finance/13401681/invesco-sp-midcap-momentum-etf-nysearcaxmmo-reaches-new-52-week-high-time-to-buy.html
,koha.mk,MASAT PAS PASHKËVE : Jetesa shtrenjtohet,https://koha.mk/masat-pas-pashkeve-jetesa-shtrenjtohet/
,euronews.com,European earnings preview : Who wins and who loses from the Iran war ?,https://www.euronews.com/business/2026/04/08/european-earnings-preview-who-wins-and-who-loses-from-the-iran-war
,finance.sina.com.cn,站上AI风口 ！ 功率器件掀涨价潮 ： 华润微大涨近13 %， AIDC电源需求或将爆发,https://finance.sina.com.cn/roll/2026-04-08/doc-inhtvfct6318122.shtml
,naftemporiki.gr,Wall Street : Εκτόξευση 1 . 300 μονάδων για τον Dow Jones - Σε τροχιά ιστορικής πτώσης το πετρέλαιο,https://www.naftemporiki.gr/finance/markets/2096059/wall-street-ektoxeysi-1-300-monadon-gia-ton-dow-jones-se-trochia-istorikis-ptosis-to-petrelaio/
,efinancialcareers.com,"Citadel most senior equities recruiter in London left , but it ok",https://www.efinancialcareers.com/news/eleanor-sharkey
,e15.cz,Francouzské Casino dál vězí v dluzích . Záchrana vyjde na miliardy,https://www.e15.cz/byznys/obchod-a-sluzby/kretinskeho-casino-dal-vezi-v-dluzich-zachrana-muze-vyjit-na-miliardu-eur-drobne-investory-ceka-redeni-akcii-1431975
,lesnewseco.fr,Air Canada teste un processus de règlement extrajudiciaire des différends géré par un tiers pour résoudre les cas relevant du RPPA,https://www.lesnewseco.fr/pr/air-canada-teste-un-processus-de-reglement-extrajudiciaire-des-differends-gere-par-un-tiers-pour-resoudre-les-cas-relevant-du-rppa
,peakoil.com,Analysis : How Chinese media is covering the Iran energy crisis  | Peak Oil News and Message Boards,https://peakoil.com/publicpolicy/analysis-how-chinese-media-is-covering-the-iran-energy-crisis
,wyomingnewsnow.tv,Airport dining expands beyond fast food as travelers expect better options,https://www.wyomingnewsnow.tv/news/national/airport-dining-expands-beyond-fast-food-as-travelers-expect-better-options/article_f65ce0ff-33d0-5219-8fb0-a70c4c68b8ad.html
,thehindubusinessline.com,"Construction equipment sales fall 13 per cent in FY26 on project delays , weak execution : FADA",https://www.thehindubusinessline.com/economy/construction-equipment-sales-fall-13-per-cent-in-fy26-on-project-delays-weak-execution-fada/article70838059.ece
,haberler.com,New York borsası ABD - İran ateşkesi sonrasında ralliyle açıldı,https://www.haberler.com/ekonomi/new-york-borsasi-abd-ve-iran-arasindaki-ateskesle-yukselise-gecti-19729444-haberi/
,fortuneturkey.com,"Dr . Ecz . Başbuğ Öke , Polifarmanın Yeni CEOsu Oldu",https://www.fortuneturkey.com/dr-ecz-basbug-oke-polifarmanin-yeni-ceosu-oldu
,eju.tv,Porcicultores expectantes por abrir exportación de carne,https://eju.tv/2026/04/porcicultores-expectantes-por-abrir-exportacion-de-carne/
,jogja.tribunnews.com,"Pemkab Kulon Progo Naikkan Anggaran Infrastruktur 2026 hingga 14 , 79 Persen , Jadi Rp102 , 16 Miliar",https://jogja.tribunnews.com/diy/1212295/pemkab-kulon-progo-naikkan-anggaran-infrastruktur-2026-hingga-1479-persen-jadi-rp10216-miliar
,rttnews.com,News Of U . S .- Iran Ceasefire Likely To Spark Rally On Wall Street,https://www.rttnews.com/3637573/news-of-u-s-iran-ceasefire-likely-to-spark-rally-on-wall-street.aspx
,prokerala.com,Govt increases LPG supply to industrial units in key sectors,https://www.prokerala.com/news/articles/a1748664.html
,finance.sina.com.cn,全球动荡与对AI产业的担忧助推科技红利股跑赢大盘,https://finance.sina.com.cn/stock/usstock/c/2026-04-08/doc-inhtvfcq2519042.shtml
,vajma.info,"Brüsszel : A kormányok vezessék ki az energiaválság miatt adott lakossági támogatásokat , védett árakat",https://www.vajma.info/cikk/kulfold/79501/Brusszel-A-kormanyok-vezessek-ki-az-energiavalsag-miatt-adott-lakossagi-tamogatasokat-vedett-arakat.html
,tickerreport.com,UBS Group Cuts The Goldman Sachs Group ( NYSE : GS ) Price Target to $930 . 00,https://www.tickerreport.com/banking-finance/13401676/ubs-group-cuts-the-goldman-sachs-group-nysegs-price-target-to-930-00.html
,newkerala.com,"No Coal Shortage , Stable Power Generation : Coal Ministry",https://www.newkerala.com/news/a/no-coal-shortage-country-power-generation-fully-stable-768.htm
,r101.it,Dal 28 aprile caricabatterie unico per i computer portatili,https://www.r101.it/news/fuori-onda-news/dal-28-aprile-caricabatterie-unico-per-i-computer-portatili/
,latercera.com,Banco Mundial sube la proyección del crecimiento del PIB de Chile para este año y en 2027,https://www.latercera.com/pulso/noticia/banco-mundial-sube-proyeccion-pib-economia-chile/
,cfi.net.cn,中国神华 ( 601088 ): 中国神华能源股份有限公司发行股份及支付现金购买资产并募集配套资金暨关联交易实施情况暨新增股份上市公告书摘要 - CFi . CN 中财网,http://www.cfi.net.cn/p20260408003294.html
,stcn.com,多重利好共振 ， A股中期韧性凸显 ！ 券商首席分析师 ， 最新研判,https://www.stcn.com/article/detail/3733422.html
,stockbiz.vn,Điểm tin kinh tế Việt Nam nổi bật ngày 8 / 4 / 2026,https://stockbiz.vn/tin-tuc/diem-tin-kinh-te-viet-nam-noi-bat-ngay-842026/39374978
,hawaiitelegraph.com,Devon Dissertation Symposium Launches Student - Focused Academic Support Services for Graduate Researchers,http://www.hawaiitelegraph.com/news/278971420/devon-dissertation-symposium-launches-student-focused-academic-support-services-for-graduate-researchers
,itc.ua,ВРУ проголосовала за  налог на OLX : сколько придется платить с продажи подержанных вещей,https://itc.ua/news/vru-progolosovala-za-nalog-na-olx-skolko-prydetsya-platyt-s-prodazhy-poderzhannyh-veshhej/
,stockbiz.vn,Mexico và bài toán an ninh tại thành trì của băng đảng ma túy trước World Cup 2026,https://stockbiz.vn/tin-tuc/mexico-va-bai-toan-an-ninh-tai-thanh-tri-cua-bang-dang-ma-tuy-truoc-world-cup-2026/39375506
,inewsgr.com,"Διπλωματικό « παζλ » η εκεχειρία – Oι διαφορετικές αναγνώσεις από ΗΠΑ , Ιράν και Ισραήλ",https://www.inewsgr.com/438/diplomatiko-pazl-i-ekecheiria--Oi-diaforetikes-anagnoseis-apo-ipa-iran-kai-israil.htm
,finance.eastmoney.com,量价齐升 ！ 智谱AI概念疯涨 全球Token用量加速增长 ( 附股 ) _ 东方财富网,https://finance.eastmoney.com/a/202604083698230654.html
,lanacion.cl,Tregua entre EEUU e Irán impacta en los mercados : petróleo se desplomó y las bolsas se dispararon,https://www.lanacion.cl/tregua-entre-eeuu-e-iran-impacta-en-los-mercados-petroleo-se-desplomo-y-las-bolsas-se-dispararon/
,jambi.tribunnews.com,"Saldo Kas Pemerintah di BI Tinggal Rp120 Triliun , Ekonom Beri Peringatan ke Purbaya",https://jambi.tribunnews.com/news/1193406/saldo-kas-pemerintah-di-bi-tinggal-rp120-triliun-ekonom-beri-peringatan-ke-purbaya
,royalgazette.com,Airlines grappling with rising oil prices,https://www.royalgazette.com/international-business/business/article/20260408/airlines-grappling-with-rising-oil-prices/
,euro2day.gr,"Arxis : Σχεδιάζει IPO έως $1 , 06 δισ . στις ΗΠΑ",https://www.euro2day.gr/news/world/article/2345673/arxis-shediazei-ipo-eos-106-dis-stis-hpa-.html
,constructiondive.com,"Exit Interview : Adolfson & Peterson outgoing CEO on war impacts , construction costs",https://www.constructiondive.com/news/exit-interview-jeff-hansen-adolfson-peterson-ceo/816889/
,tickerreport.com,Franklin Electric ( FELE ) and Its Competitors Critical Contrast,https://www.tickerreport.com/banking-finance/13401687/franklin-electric-fele-and-its-competitors-critical-contrast.html
,time.mk,Time . ai,https://time.mk/ai/d52855f298/mk/
,tusciaweb.eu,"Chiuso altro distributore di carburante per interdittiva antimafia , è l  11esimo",https://www.tusciaweb.eu/2026/04/chiuso-altro-distributore-carburante-interdittiva-antimafia-l11esimo/
,posttoday.com,PROSPECT REIT เพิ่มทุนครั้งที่ 3 เข้าลงทุน BFTZ 4 เชื่อมบางนา - EEC,https://www.posttoday.com/business/stockholder/740648
,dailypolitical.com,Eton Pharmaceuticals ( NASDAQ : ETON ) Hits New 1 - Year High – Time to Buy ?,https://www.dailypolitical.com/2026/04/08/eton-pharmaceuticals-nasdaqeton-hits-new-1-year-high-time-to-buy.html
,catamarcactual.com.ar,Alerta en las Universidades : paro nacional de docentes y nodocentes,https://www.catamarcactual.com.ar/educacionales/2026/4/8/alerta-en-las-universidades-paro-nacional-de-docentes-nodocentes-307844.html
,zf.ro,"Românii îşi fac tot mai multe vacanţe în Germania , unde turiştii locali au ...",https://www.zf.ro/zf-24/romanii-isi-fac-tot-multe-vacante-germania-unde-turistii-locali-au-23118154
,spacewar.com,Facts about the Strait of Hormuz since its negotiated reopening,https://www.spacewar.com/afp/260408133308.rwv8knsz.html
,lsm.lv,"Amatpersonu algu atklāšana publiskajam sektoram kā zobusāpes – rāda negribīgi , paslēpj dziļi savās interneta lapās",https://www.lsm.lv/raksts/zinas/latvija/08.04.2026-amatpersonu-algu-atklasana-publiskajam-sektoram-ka-zobusapes-rada-negribigi-paslepj-dzili-savas-interneta-lapas.a641994/
,hawaiitelegraph.com,Medical Care Technologies ( OTC Pink : MDCE ) Expands AI Monetization Strategy and Advances Pipeline of AI Applications,http://www.hawaiitelegraph.com/news/278971344/medical-care-technologies-otc-pinkmdce-expands-ai-monetization-strategy-and-advances-pipeline-of-ai-applications
,hawaiitelegraph.com,"Chilean Cobalt Corp . Continues Accelerated Drilling , Defines Initial Development Target , and Advances Engineering at NeoRe Rare Earth Project",http://www.hawaiitelegraph.com/news/278971339/chilean-cobalt-corp-continues-accelerated-drilling-defines-initial-development-target-and-advances-engineering-at-neore-rare-earth-project
,balkanweb.com,"Si ndikon armëpushimi në ekonominë shqiptare ? Preçi : Ulja e çmimit të naftës simbolike , vendet perëndimore e ulën 15 %",https://www.balkanweb.com/si-ndikon-armepushimi-ne-ekonomine-shqiptare-preci-ulja-e-cmimit-te-naftes-mbetet-simbolike-vendet-perendimore-e-kane-ulur-15/
,finanza.lastampa.it,New York : giornata negativa in Borsa per APA Corporation,https://finanza.lastampa.it/News/2026/04/08/new-york-giornata-negativa-in-borsa-per-apa-corporation/NDAzXzIwMjYtMDQtMDhfVExCLUFVVE8
,minutouno.com,Carlos Melconian habló sobre la posibilidad de una candidatura presidencial : La vocación está,https://www.minutouno.com/politica/carlos-melconian-hablo-la-posibilidad-una-candidatura-presidencial-la-vocacion-esta-n6264201
,seekingalpha.com,"CrowdStrike , Palo Alto jump on board to enhance security for AI era under Project Glasswing",https://seekingalpha.com/news/4573272-anthropics-project-glasswing-partners-with-crowdstrike-palo-alto-to-evolve-security-for-ai
,reggio2000.it,Alessia Corni e Giulia Chiminelli si aggiudicano la Borsa di Studio  Donna Ingegno  promossa dallOrdine degli Ingegneri di Modena,https://www.reggio2000.it/2026/04/08/alessia-corni-e-giulia-chiminelli-si-aggiudicano-la-borsa-di-studio-donna-ingegno-promossa-dallordine-degli-ingegneri-di-modena/
,news.cyol.com,科技赋能艺术 ， 羊城开启GETshow,http://news.cyol.com/gb/articles/2026-04/08/content_JQj0odfZyN.html
,kyivpost.com,"Skilled Worker Shortage Persists Despite Labor Supply Growth , NBU Says",https://www.kyivpost.com/post/73513
,pravda.com.ua,"Квартира за $400 тысяч , часть ЖК и BMW : журналисты исследовали имущество семьи судьи из Мукачево",https://www.pravda.com.ua/rus/news/2026/04/08/8029297/
,gazzetta.it,"Figc , la relazione di Gabriele Gravina sulla crisi del calcio italiano",https://www.gazzetta.it/Calcio/Serie-A/08-04-2026/figc-la-relazione-di-gabriele-gravina-sulla-crisi-del-calcio-italiano.shtml
,menorca.info,El plan de Semana Santa de Patricia Conde en Mallorca que puedes hacer cualquier fin de semana,https://www.menorca.info/vips/quiosco-rosa/2026/04/08/2604111/plan-semana-santa-patricia-conde-mallorca-puedes-hacer-cualquier-fin-semana.html
,index.hr,Top agent : Ovih 7 grešaka može vas vrlo skupo koštati pri kupnji nekretnine,https://www.index.hr/magazin/clanak/top-agent-ovih-7-gresaka-moze-vas-vrlo-skupo-kostati-pri-kupnji-nekretnine/2779329.aspx
,caleaeuropeana.ro,"Directorul general Unifarm , despre medicamentele inovative indispoibile în România : Există o procedură legală care salvează vieți , dar prea puțini medici o cunosc",https://www.caleaeuropeana.ro/directorul-general-unifarm-despre-medicamentele-inovative-indispoibile-in-romania-exista-o-procedura-legala-care-salveaza-vieti-dar-prea-putini-medici-o-cunosc/
,mittelstandcafe.de,DistillerSR führt die branchenweit fortschrittlichsten GenAI - Funktionen zur Extraktion von Evidenzen aus wissenschaftlicher Literatur ein,https://www.mittelstandcafe.de/distillersr-f-hrt-die-branchenweit-fortschrittlichsten-genai-funktionen-zur-extraktion-von-evidenzen-aus-wissenschaftlicher-literatur-ein-2242997.html
