published_at,source,title,url
,boursorama.com,"MARCHÉS BOURSIERS AMÉRICAINS - Wall Street marque une pause après une série de records , alors que les négociations entre les États - Unis et lIran sont au point mort - 11 / 05 / 2026 à 16 : 29",https://www.boursorama.com/bourse/actualites/marches-boursiers-americains-wall-street-marque-une-pause-apres-une-serie-de-records-alors-que-les-negociations-entre-les-etats-unis-et-l-iran-sont-au-point-mort-c33157ddd819db1203f8a6c5cfb1176a
,larepublica.pe,Sedapar no entregó agua gratuita a población vulnerable de Arequipa y devolvió S / 6 millones,https://larepublica.pe/sociedad/2026/05/11/sedapar-no-entrego-agua-gratuita-a-poblacion-vulnerable-de-arequipa-y-devolvio-s6-millones-al-ministerio-de-vivienda-855195
,elperiodicodearagon.com,Huesca abre el plazo para solicitar ayudas para la reparación de daños en edificios de viviendas,https://www.elperiodicodearagon.com/comarcas/2026/05/11/huesca-abre-plazo-solicitar-ayudas-130106408.html
,eturbonews.com,Push for number plate tourism,https://eturbonews.com/push-number-plate-tourism/
,borsaitaliana.it,Preatoni Group : trasferisce quotazione su Euronext Growth Paris,https://www.borsaitaliana.it/borsa/notizie/radiocor/finanza/dettaglio/preatoni-group-trasferisce-quotazione-su-euronext-growth-paris-nRC_11052026_1658_475173903.html
,forex.cnfol.com,日元疲软推动欧元兑日元反弹 ， 但200周期均线挡道 _ 汇市观察 _ 外汇 _ 中金在线,http://forex.cnfol.com/jingjiyaowen/20260511/32215803.shtml
,ilrestodelcarlino.it,Electrolux chiude stabilimento a Cerreto dEsi : 170 i lavoratori coinvolti .  Annunciate 8 ore di sciopero : 400 esuberi anche a Forlì,https://www.ilrestodelcarlino.it/ancona/economia/electrolux-chiude-cerreto-desi-sciopero-oa5ft5tx
,anninhthudo.vn,VietinBank tung gói ưu đãi lớn cho doanh nghiệp xuất nhập khẩu – SME Global Boost,https://anninhthudo.vn/vietinbank-tung-uu-dai-lon-danh-cho-doanh-nghiep-xuat-nhap-khau-vua-va-nho-post643331.antd
,connexionfrance.com,What exactly is a quality wine and do the experts know what consumers like ?,https://www.connexionfrance.com/magazine/what-exactly-is-a-quality-wine-and-do-the-experts-know-what-consumers-like/785355
,investor.bg,Министерството на финансите преотвори за трети път емисия 10 - годишни ДЦК,https://www.investor.bg/a/540-danatsi-i-byudzhet/430416-ministerstvoto-na-finansite-preotvori-za-treti-pat-emisiya-10-godishni-dtsk
,ilfriuli.it,"Cisl Fvg e associazioni datoriali , alleati contro il dumping contrattuale . Buco da 3 , 6 milioni per il Fvg",https://www.ilfriuli.it/economia/cisl-fvg-e-associazioni-datoriali-alleati-contro-il-dumping-contrattuale-buco-da-36-milioni-per-il-fvg/
,gabrielecaramellino.nova100.ilsole24ore.com,"In cerca di idee | Il mondo del lavoro in Italia , tra aggiornamenti legislativi , tecniche di comunicazione e AI",https://gabrielecaramellino.nova100.ilsole24ore.com/2026/05/11/il-mondo-del-lavoro-in-italia-tra-aggiornamenti-legislativi-tecniche-di-comunicazione-e-ai/
,blog.udn.com,欧易App下载 、 注册与KYC认证全流程指南 - bd8b4d30 的部落格,https://blog.udn.com:443/bd8b4d30/188545374
,jpnn.com,"E7X : SUV Listrik Pertama Audi Hasil Kerja Sama dengan SAIC , Harganya Rp 700 jutaan",https://www.jpnn.com/news/e7x-suv-listrik-pertama-audi-hasil-kerja-sama-dengan-saic-harganya-rp-700-jutaan
,aninews.in,Portugal seeks to marry tech expertise with Indian scale as FTA nears completion,https://aninews.in/news/world/asia/portugal-seeks-to-marry-tech-expertise-with-indian-scale-as-fta-nears-completion20260511194636/
,tradingsat.com,"Wall Street : Wall Street ouvre sur une note prudente , les prix du pétrole remontent",https://www.tradingsat.com/actualites/marches-financiers/wall-street-wall-street-ouvre-sur-une-note-prudente-les-prix-du-petrole-remontent-1162553.html
,dualshockers.com,Directive 8020 Review : Dark Pictures Season Two Gets Off to a Solid Start,https://www.dualshockers.com/directive-8020-review/
,thewrap.com,Fox Acquires 2 More Regular Season NFL Games,https://www.thewrap.com/media-platforms/tv/fox-2-more-nfl-games-2026/
,prokerala.com,"India , Japan agree to deepen collaboration in strategic industrial sectors",https://www.prokerala.com/news/articles/a1761569.html
,net.hr,Hrvati skeptični oko nižih cijena ove turističke sezone,https://net.hr/danas/rtl-danas/hrvati-skepticni-oko-nizih-cijena-ove-turisticke-sezone-5ec381f0-4d46-11f1-936f-9600040c8f8e
,mortgagesolutions.co.uk,Hope Capital launches bridging product ; Zephyr introduces five - year fixes – round - up,https://www.mortgagesolutions.co.uk/specialist-lending/bridging/2026/05/11/hope-capital-launches-bridging-product-zephyr-introduces-five-year-fixes-round-up/
,rondoniadinamica.com,"Prefeitura investe mais de R$ 16 , 9 milhões na construo de 4 creches na capital ; Unidades vão ampliar o atendimento à educao infantil","https://www.rondoniadinamica.com/noticias/2026/05/prefeitura-investe-mais-de-r-169-milhoes-na-construcao-de-4-creches-na-capital-unidades-vao-ampliar-o-atendimento-a-educacao-infantil,244269.shtml"
,newswire.co.nz,New Zealand sold around twenty billion dollars of public assets and has paid foreign owners more than five hundred billion since,https://newswire.co.nz/2026/05/sold-public-assets-paying-rent-forever/
,radiolombardia.it,FTI Consulting nomina Emanuele Grasso alla guida delle attività in Italia,https://www.radiolombardia.it/2026/05/11/fti-consulting-nomina-emanuele-grasso-alla-guida-delle-attivita-in-italia/
,asi.it,ASI | Al via Space Meetings Veneto : a Venezia lInvestment Forum,https://www.asi.it/2026/05/al-via-space-meetings-veneto-a-venezia-linvestment-forum/
,rts.rs,Digital Day 2026 : Када је свега превише – шта заправо заслужује пажњу ?,https://www.rts.rs/magazin/zivot/5947244/digital-day-2026-all-that-matters-dolce--gabbana-google-ryanair-konferencija.html
,conexaoto.com.br,"Dólar a R$ 4 , 89 : Mercado projeta dólar mais fraco em 2026",https://conexaoto.com.br/2026/05/11/dolar-a-r-4-89-mercado-projeta-dolar-mais-fraco-em-2026
,thetimes.com,"Collar unbuttoned , sleeves rolled up , Starmer says nothing again",https://www.thetimes.com/uk/politics/article/collar-unbuttoned-sleeves-rolled-up-starmer-says-nothing-again-95jr8vw2k
,newsghana.com.gh,The National Road Safety Authority ( NRSA ) and Its Toyota Voxy Technical Working Group Report : Observations From A Sentry Post,https://www.newsghana.com.gh/the-national-road-safety-authority-nrsa-and-its-toyota-voxy-technical-working-group-report-observations-from-a-sentry-post/
,ilsole24ore.com,"Pubblicita : Nielsen , investimenti Italia marzo +3 , 4 % ( RCO )",https://www.ilsole24ore.com/radiocor/nRC_11.05.2026_16.01_44410444
,caribbeannewsdigital.com,"El turismo acelera su recuperación global y demuestra resiliencia , según el WTTC",https://www.caribbeannewsdigital.com/es/turismo/el-turismo-acelera-su-recuperacion-global-y-demuestra-resiliencia-segun-el-wttc
,anninhthudo.vn,Bùng nổ ưu đãi lớn dành cho doanh nghiệp SME mới tại VietinBank | Báo Điện tử An ninh Thủ đô,https://anninhthudo.vn/vietinbank-tung-bung-uu-dai-chao-don-khach-hang-doanh-nghiep-sme-moi-post649334.antd
,nypost.com,Airbnb enlists Al Sharpton in fight against Mamdani short - term rental crackdown in NYC : report,https://nypost.com/2026/05/11/business/airbnb-enlists-al-sharpton-in-fight-against-mamdanis-short-term-rental-crackdown-in-nyc-report/
,focus.de,Hormus - Krise saugt weltweite Ölvorräte auf,https://www.focus.de/finanzen/hormus-krise-saugt-weltweite-oelvorraete-auf_d18cecab-67fd-4b40-bf7b-9de4079660f2.html
,forex.cnfol.com,欧元 / 美元 ： 区间震荡延续 ， 机构警示CPI前美元波动风险 _ 汇市观察 _ 外汇 _ 中金在线,http://forex.cnfol.com/jingjiyaowen/20260511/32215910.shtml
,richlandsource.com,Spring flooding provides perfect scenarios for Black Fork rescue training,https://www.richlandsource.com/2026/05/11/spring-flooding-provided-perfect-scenarios-for-black-fork-rescue-training/
,borsaitaliana.it,Sella : utile consolidato balza a 113 mln in I trim con effetto Hype,https://www.borsaitaliana.it/borsa/notizie/radiocor/finanza/dettaglio/sella-utile-consolidato-balza-a-113-mln-in-i-trim-con-effetto-hype-nRC_11052026_1609_453820233.html
,wenxuecity.com,母亲节 特别的餐馆 特别的展 | www . wenxuecity . com,https://www.wenxuecity.com/blog/202605/25182/6497.html
,liveinsurancenews.com,USAA Net Worth Grew by $6 . 3 Billion in 2025 And Half of Its 14 Million Members Are Expected to See Lower Insurance Rates in 2026 » Live Insurance News,https://www.liveinsurancenews.com/usaas-lower-insurance-rates-2026/8572211/
,handelsblatt.com,Geldanlage : Taco versus Nacho – den Märkten drohen starke Verwerfungen,https://www.handelsblatt.com/finanzen/anlagestrategie/kolumnen/geldanlage-taco-versus-nacho-den-maerkten-drohen-starke-verwerfungen/100224017.html
,jornada.com.pe,Retorno a la Experiencia Tangible y el Desafío Intelectual,https://jornada.com.pe/el-renacimiento-de-las-escape-rooms-por-que-el-escapismo-fisico-vuelve-a-ser-tendencia/
,chattanoogan.com,Taco Town 2 Has New Brainerd Location ; Torikaya Opens On Houston Street,https://www.chattanoogan.com/2026/5/11/518630/Taco-Town-2-Has-New-Brainerd-Location.aspx
,delo.si,Janša : Levica gradi politiko na zavisti,https://www.delo.si/novice/slovenija/janez-jansa-dz-sds-interventni-zakon-koalicija-vlada
,yicai.com,国产晶圆代工最大并购 ！ 中芯国际406亿元方案过会,https://www.yicai.com/news/103175809.html
,mix93.fm,"How a Data Center Derailed $240 , 000 for Affordable Housing - WKMJ",https://mix93.fm/news/2026/05/11/how-a-data-center-derailed-240000-for-affordable-housing
,newsghana.com.gh,"IFC urges Africa to address fragmentation , affordability gaps in digital evolution",https://www.newsghana.com.gh/ifc-urges-africa-to-address-fragmentation-affordability-gaps-in-digital-evolution/
,finance.yahoo.com,monday . com Q1 beat driven by enterprise customer growth and AI adoption,https://finance.yahoo.com/markets/stocks/articles/monday-com-q1-beat-driven-151900249.html
,mansethaber.com,Hantavirüs aşısı tekrar gündemde … 36 yıllık bekleyiş bitiyor mu ?,https://mansethaber.com/saglik/hantavirus-asisi-tekrar-gundemde-36-yillik-bekleyis-bitiyor-mu
,cadena3.com,"La inflación en la Ciudad de Buenos Aires en abril fue de 2 , 5 %",https://www.cadena3.com/noticia/siempre-juntos/la-inflacion-en-la-ciudad-de-buenos-aires-en-abril-fue-de-25_550077
,money.pl,Jest kolejne weto prezydenta . Karol Nawrocki ogłosił decyzję,https://www.money.pl/gospodarka/jest-kolejne-weto-prezydenta-karol-nawrocki-oglosil-decyzje-7284769362216992a.html
,tradingsat.com,Novo Nordisk profite de loptimisme des analystes,https://www.tradingsat.com/actualites/informations-societes/novo-nordisk-profite-de-l-optimisme-des-analystes-1162555.html
,mortgagesolutions.co.uk,Building momentum towards faster property transactions – Rudolf,https://www.mortgagesolutions.co.uk/better-business/business-skills/2026/05/11/building-momentum-towards-faster-property-transactions-rudolf/
,finance.yahoo.com,BWX Technologies ( BWXT ) Touted As A Big Nuclear Play,https://finance.yahoo.com/markets/stocks/articles/bwx-technologies-bwxt-touted-big-152246226.html
,raya.ps,بورصة فلسطين تفصح عن بياناتها المالية للربع الأول من العام 2026,https://www.raya.ps/news/1217311.html
,wandsworthguardian.co.uk,"Rare Edward VIII coin expected to fetch £300 , 000 at auction",https://www.wandsworthguardian.co.uk/news/national/uk-today/26096038.rare-edward-viii-coin-expected-fetch-300-000-auction/
,kompas.com,"Ma , Doain Biar Selamat : Pesan Terakhir Fiki Sebelum Disergap Bajak Laut Somalia",https://www.kompas.com/global/read/2026/05/11/222100070/ma-doain-biar-selamat--pesan-terakhir-fiki-sebelum-disergap-bajak-laut
,esmmagazine.com,Demand For Organic Food Rises In Germany Despite Inflation - BÖLW,https://www.esmmagazine.com/retail/demand-for-organic-food-rises-in-germany-despite-inflation-bolw-311695
,daytondailynews.com,GE Aerospace workforce training focuses on Dayton workers | Local,https://www.daytondailynews.com/local/what-ge-aerospace-foundation-s-multi-million-dollar-workforce-training-means-for-dayton-area/article_220f909d-36b6-5582-840a-359bcf810a9b.html
,mdzol.com,El fantasma de Macri : el llamativo furcio de Caputo al confundir el futuro presidencial de Milei con el 2019,https://www.mdzol.com/politica/el-fantasma-macri-el-llamativo-furcio-caputo-al-confundir-el-futuro-presidencial-milei-el-2019-n1517587
,ocregister.com,Why did California home - price gains shrink ?,https://www.ocregister.com/2026/05/11/why-did-california-home-price-gains-shrink/
,aydinses.com,Çorumda Seç - Al kuralını ihlal eden tezgâh kapatıldı,https://www.aydinses.com/corumda-sec-al-kuralini-ihlal-eden-tezgah-kapatildi
,benzinga.com,Bybit Mykolas Majauskas Advocates Tokenisation to Drive India $1 Trillion Fintech Economy,https://www.benzinga.com/pressreleases/26/05/52456234/bybits-mykolas-majauskas-advocates-tokenisation-to-drive-indias-1-trillion-fintech-economy
,dailybusiness.ro,"Dosarul „ 10 August . Foşti şefi ai Jandarmeriei , chemaţi pentru a fi audiaţi în premieră la Tribunalul Militar",https://www.dailybusiness.ro/actualitate/dosarul-10-august-540794/
,avrupabulteni.com,Çinde üretici enflasyonu Kovid - 19 sonrası zirveye çıktı,https://www.avrupabulteni.com/cinde-uretici-enflasyonu-kovid-19-sonrasi-zirveye-cikti/
,163.com,净利暴增400 %！ 金城银行  打爆  民营银行 ， 360做了啥 ？ |贷款|存款|信贷|净息差|资产规模,https://www.163.com/dy/article/KSMDPDNU0519MPBR.html
,ft.lk,CBSL tells CoPF no unusual activity flagged during period of NDB Rs . 13 . 2 b fraud,https://www.ft.lk/front-page/CBSL-tells-CoPF-no-unusual-activity-flagged-during-period-of-NDB-s-Rs-13-2-b-fraud/44-791738
,mdzol.com,El error financiero más común que hace que gastes más dinero sin darte cuenta,https://www.mdzol.com/tendencias/el-error-financiero-mas-comun-que-hace-que-gastes-mas-dinero-darte-cuenta-n1517669
,primorski.eu,Hrvaški minister pozval k znižanju cen v turizmu za petino,https://www.primorski.eu/se/hrvaski-minister-pozval-k-znizanju-cen-v-turizmu-za-petino-AG2181662
,theitem.com,"Young American job market optimism falls as older adults stay upbeat , new Gallup poll finds","http://www.theitem.com/stories/young-americans-job-market-optimism-falls-as-older-adults-stay-upbeat-new-gallup-poll-finds,442804"
,dan.co.me,ДАН - Spajić i Kalvinjo : Pokretanje investicija vrijednih više od 250 miliona eura,https://www.dan.co.me/vijesti/ekonomija/spajic-veliki-dan-za-crnu-goru-potpisani-ugovori-sa-eib-vrijedni-250-miliona-eura/
,yicai.com,拥抱AI 、 支持企业出海 、 参与并购业务 … 陆家嘴金融沙龙2026年第十一期热议银行低利率环境下的转型,https://www.yicai.com/news/103175966.html
,midilibre.fr,"L  étiquette a encore de beaux jours devant elle    : à Béziers , Estrabols imprime son savoir - faire depuis quatre générations",https://www.midilibre.fr/2026/05/11/letiquette-a-encore-de-beaux-jours-devant-elle-a-beziers-estrabols-imprime-son-savoir-faire-depuis-quatre-generations-13366254.php
,expansion.com,"Salud , hogar y vida , los ramos que mayor recorrido presentan en bancaseguros",https://www.expansion.com/empresas/banca/2026/05/11/6a01b873e5fdea80768b45ae.html
,denik.cz,"Valorizace ano , strop ne . Novela důchodů budí rozpaky odborů",https://www.denik.cz/ekonomika/duchody-valorizace-zamestnavani-senioru-zakon-vlada-odbory.html
,money.pl,Niemcy alarmują . Ceny gazu pójdą w górę,https://www.money.pl/gospodarka/niemcy-alarmuja-ceny-gazu-pojda-w-gore-7284750017226784a.html
,tamindir.com,TECNOdan Uygun Fiyatlı Telefon Geliyor ! AMOLED Ekranı Var,https://www.tamindir.com/haber/tecno-camon-slim-fcc-sertifikasi-sizinti_108626/
,op-online.de,Griechenland will Massentourismus bremsen,http://www.op-online.de/wirtschaft/griechenland-will-massentourismus-bremsen-zr-94302273.html
,perfil.com,El Gobierno recortó gastos por casi $3 billones en diferentes áreas,https://www.perfil.com/noticias/economia/fuerte-recorte-en-salud-el-gobierno-redujo-mas-de-63000-millones-en-programas-criticos-y-medicamentos.phtml
,elperiodicodearagon.com,La emancipación juvenil en Aragón cae a mínimos históricos mientras Zaragoza defiende su plan de ayudas,https://www.elperiodicodearagon.com/zaragoza/2026/05/11/emancipacion-juvenil-aragon-cae-minimos-130107000.html
,newsghana.com.gh,Why Ghana Lending Rates Defy Falling Policy Numbers,https://www.newsghana.com.gh/why-ghanas-lending-rates-defy-falling-policy-numbers/
,perfil.com,"Día 883 , a un mes del mundial , el Gobierno se mete adentro del arco",https://www.perfil.com/noticias/modo-fontevecchia/dia-883-a-un-mes-del-mundial-el-gobierno-se-mete-adentro-del-arco-modof.phtml
,affarsvarlden.se,Sandström : Flytta guldburen AP2 från Göteborg till Stockholm,https://www.affarsvarlden.se/artikel/sandstrom-flytta-guldburen-ap2-fran-goteborg-till-stockholm
,dailypolitical.com,Doman Building Materials Group ( TSE : DBM ) Sets New 52 - Week High – Time to Buy ?,https://www.dailypolitical.com/2026/05/11/doman-building-materials-group-tsedbm-sets-new-52-week-high-time-to-buy.html
,finance.sina.com.cn,Brookfield拟向OpenAI部署平台投资5亿美元 ， 加速AI从试点走向规模化,https://finance.sina.com.cn/stock/usstock/c/2026-05-11/doc-inhxpxxa2091860.shtml
,edaily.co.kr,하닉 팔 때 됐나 ? 목표가 300만원도 나왔는데 … 또 투자의견 하향,https://www.edaily.co.kr/News/Read?newsId=03975366645447936&mediaCodeNo=257
,vava8.com,NVIDIA失宠 华尔街疯抢硬件四雄上演CPU大反攻,https://www.vava8.com/index.php?app=index&act=view&id=44660
,pembrokeobserver.com,"Baby boom at Sandy Pines , crowds flock to wildlife centre open house",https://www.pembrokeobserver.com/news/baby-boom-at-sandy-pines-as-crowds-flock-to-wildlife-centres-mothers-day-event
,chathamdailynews.ca,Concerning : London - area unemployment rate hits 9 . 2 per cent,https://www.chathamdailynews.ca/news/local-news/londons-jobless-rate-hits-9-2-per-cent-as-job-losses-mount/wcm/97ae78b3-743d-47ff-a80c-ede1fcf9a32d
,163.com,快手计划分拆可灵 ， 融资20亿美元,https://www.163.com/tech/article/KSMEVBS400098IEO.html
,economictimes.indiatimes.com,Zerodha Nikhil Kamath suggests exploring gold - based stablecoins for India,https://economictimes.indiatimes.com/markets/stocks/news/zerodhas-nikhil-kamath-suggests-exploring-gold-based-stablecoins-for-india/articleshow/131016714.cms
,idnes.cz,"Prezident podepsal zákon , vládě umožní omezit ceny paliv",https://www.idnes.cz/zpravy/domaci/prezident-ceny-pohonnych-hmot-zakon.A260511_170341_domaci_aoc
,dorzeczy.pl,Prawnik : W świetle Konstytucji umowa SAFE jest nieważna,https://dorzeczy.pl/opinie/885568/prawnik-w-swietle-konstytucji-umowa-safe-jest-niewazna.html
,elperiodico.cat,Nissan acomiadarà 211 treballadors dels seus centres auxiliars de Catalunya,https://www.elperiodico.cat/ca/economia/20260511/nissan-acomiadaments-catalunya-treballadors-centres-zona-franca-el-prat-llobregat-129954545
,www.kreiszeitung.de,"Lower Saxony, Niedersachsen, Germany",https://www.kreiszeitung.de/lokales/bremen/normalerweise-eine-der-teuersten-tankstelle-in-niedersachsen-mit-preiskracher-fuer-diesel-94302432.html
,www.kreiszeitung.de,Germany,https://www.kreiszeitung.de/lokales/bremen/normalerweise-eine-der-teuersten-tankstelle-in-niedersachsen-mit-preiskracher-fuer-diesel-94302432.html
,kienthuc.net.vn,Vietnam,https://kienthuc.net.vn/ky-vong-dai-hoi-xi-tao-dot-pha-nang-cao-nang-luc-can-bo-mat-tran-post1616094.html
,www.chronicle.lu,Luxembourg,https://www.chronicle.lu/category/industry-associations/61141-lcgb-ogbl-skyliners-sign-1st-collective-agreement-for-230-employees
,www.constructiondive.com,Lebanon,https://www.constructiondive.com/news/lilly-invest-extra-4b-across-lebanon-indiana-manufacturing-mounjaro-zepbound/819824/
,www.constructiondive.com,"Indiana, United States",https://www.constructiondive.com/news/lilly-invest-extra-4b-across-lebanon-indiana-manufacturing-mounjaro-zepbound/819824/
,www.readingeagle.com,"Ohio, United States",https://www.readingeagle.com/2026/05/11/got-a-bonus-at-work-heres-what-to-do-first/
,www.readingeagle.com,"Grand Rapids, Michigan, United States",https://www.readingeagle.com/2026/05/11/got-a-bonus-at-work-heres-what-to-do-first/
,hotnews.ro,Norway,https://hotnews.ro/prezenta-surpriza-la-bucuresti-olena-zelenska-il-va-insoti-pe-presedintele-ucrainean-ce-are-in-program-2242602
,hotnews.ro,Denmark,https://hotnews.ro/prezenta-surpriza-la-bucuresti-olena-zelenska-il-va-insoti-pe-presedintele-ucrainean-ce-are-in-program-2242602
,hotnews.ro,Ukraine,https://hotnews.ro/prezenta-surpriza-la-bucuresti-olena-zelenska-il-va-insoti-pe-presedintele-ucrainean-ce-are-in-program-2242602
,hotnews.ro,Bulgaria,https://hotnews.ro/prezenta-surpriza-la-bucuresti-olena-zelenska-il-va-insoti-pe-presedintele-ucrainean-ce-are-in-program-2242602
,hotnews.ro,Sweden,https://hotnews.ro/prezenta-surpriza-la-bucuresti-olena-zelenska-il-va-insoti-pe-presedintele-ucrainean-ce-are-in-program-2242602
,hotnews.ro,Slovak Republic,https://hotnews.ro/prezenta-surpriza-la-bucuresti-olena-zelenska-il-va-insoti-pe-presedintele-ucrainean-ce-are-in-program-2242602
,hotnews.ro,Iceland,https://hotnews.ro/prezenta-surpriza-la-bucuresti-olena-zelenska-il-va-insoti-pe-presedintele-ucrainean-ce-are-in-program-2242602
,hotnews.ro,Hungary,https://hotnews.ro/prezenta-surpriza-la-bucuresti-olena-zelenska-il-va-insoti-pe-presedintele-ucrainean-ce-are-in-program-2242602
,hotnews.ro,Finland,https://hotnews.ro/prezenta-surpriza-la-bucuresti-olena-zelenska-il-va-insoti-pe-presedintele-ucrainean-ce-are-in-program-2242602
,hotnews.ro,Romania,https://hotnews.ro/prezenta-surpriza-la-bucuresti-olena-zelenska-il-va-insoti-pe-presedintele-ucrainean-ce-are-in-program-2242602
,www.star.com.tr,Turkey,https://www.star.com.tr/guncel/bakan-gurlekten-yasa-disi-bahis-operasyonu-aciklamasi-kirli-cark-cokertildi-haber-2015416/
,www.star.com.tr,"Gurlek, Usak, Turkey",https://www.star.com.tr/guncel/bakan-gurlekten-yasa-disi-bahis-operasyonu-aciklamasi-kirli-cark-cokertildi-haber-2015416/
,www.bozemandailychronicle.com,Israel,http://www.bozemandailychronicle.com/ap_news/international/israels-military-said-a-palestinian-family-could-bury-their-father-then-the-settlers-arrived/article_0f49aa55-17ba-5e65-b1c7-84bfc48a1f91.html
,www.bozemandailychronicle.com,"Jerusalem, Israel (General), Israel",http://www.bozemandailychronicle.com/ap_news/international/israels-military-said-a-palestinian-family-could-bury-their-father-then-the-settlers-arrived/article_0f49aa55-17ba-5e65-b1c7-84bfc48a1f91.html
,www.publico.es,"Madrid, Madrid, Spain",https://www.publico.es/politica/sumar-contrapone-gestion-hantavirus-monica-garcia-crisis-cribados-andalucia-residencias-madrid.html
,www.romaniatv.net,Greece,https://www.romaniatv.net/lidl-oferta-de-neratat-pentru-clienti-produsul-necesar-in-bucatarie-care-costa-doar-359-lei-in-saptamana-11-17-mai_9562246.html
,www.asbeiras.pt,"Leiria, Leiria, Portugal",https://www.asbeiras.pt/mau-tempo-cinemacity-leiria-reabre-a-21-de-maio-apos-mais-de-tres-meses-fechado/
,news.yam.md,"Chisinau, Chisinau, Moldova",https://news.yam.md/ro/story/26174251
,news.yam.md,"Transnistria, Moldova (General), Moldova",https://news.yam.md/ro/story/26174251
,news.yam.md,Cyprus,https://news.yam.md/ro/story/26174251
,www.eyeonannapolis.net,"Annapolis, Maryland, United States",https://www.eyeonannapolis.net/2026/05/timber-pizza-co-eyes-maryland-expansion-as-brand-heads-to-atlanta/
,www.eyeonannapolis.net,"Maryland, United States",https://www.eyeonannapolis.net/2026/05/timber-pizza-co-eyes-maryland-expansion-as-brand-heads-to-atlanta/
,www.rts.rs,"Milan, Lombardia, Italy",https://www.rts.rs/vesti/srbija-danas/5947058/na-nacionalni-dan-dobrovoljnih-davalaca-krvi---upoznajte-radoja-jeftica-iz-nisa-koji-je-144-puta-donirao-krv.html
,www.santacruzsentinel.com,"Hotel De Ville, ÎE-De-France, France",https://www.santacruzsentinel.com/2026/05/11/paris-travel/
,www.santacruzsentinel.com,Brazil,https://www.santacruzsentinel.com/2026/05/11/paris-travel/
,www.santacruzsentinel.com,"Paris, France (General), France",https://www.santacruzsentinel.com/2026/05/11/paris-travel/
,www.santacruzsentinel.com,"Saint-Augustin, Pays De La Loire, France",https://www.santacruzsentinel.com/2026/05/11/paris-travel/
,www.santacruzsentinel.com,France,https://www.santacruzsentinel.com/2026/05/11/paris-travel/
,www.santacruzsentinel.com,"Palais, RhôAlpes, France",https://www.santacruzsentinel.com/2026/05/11/paris-travel/
,www.biobiochile.cl,"Jose Maza, RegióEtropolitana, Chile",https://www.biobiochile.cl/noticias/opinion/columnas-bbcl/2026/05/11/jose-antonio-kant-o-la-critica-de-la-razon-empleada.shtml
,www.biobiochile.cl,Chile,https://www.biobiochile.cl/noticias/opinion/columnas-bbcl/2026/05/11/jose-antonio-kant-o-la-critica-de-la-razon-empleada.shtml
,protv.md,"Budapest, Budapest, Hungary",https://protv.md/international/promisiunea-facuta-de-noul-guvern-de-la-budapesta-pentru-ue-dupa-ani-la-rand-in-care-viktor-orban-a-santajat-bruxelles-ul---2758052.html
,protv.md,"Brussels, Bruxelles-Capitale, Belgium",https://protv.md/international/promisiunea-facuta-de-noul-guvern-de-la-budapesta-pentru-ue-dupa-ani-la-rand-in-care-viktor-orban-a-santajat-bruxelles-ul---2758052.html
,www.cretalive.gr,South Korea,https://www.cretalive.gr/ygeia/giati-o-hantaios-den-einai-mia-nea-covid
,www.tsa-algerie.com,Algeria,https://www.tsa-algerie.com/importations-un-document-important-passe-en-ligne-au-port-de-skikda/
