published_at,source,title,url
,finance.yahoo.com,Fairfax Financial Holdings Ltd ( FRFHF ) Posted Impressive Fundamental Performance Despite a Modest Share Pullback,https://finance.yahoo.com/news/fairfax-financial-holdings-ltd-frfhf-125834167.html
,massdevice.com,"Orchestra , Terumo terminate drug - eluting balloon distro deal",https://www.massdevice.com/orchestra-terumo-terminate-balloon-distro-deal/
,thehindu.com,Textile market in Erode sees sluggish sales after  festival rush,https://www.thehindu.com/news/cities/Coimbatore/textilemarketin-erode-seessluggishsales-after-festivalrush/article70211579.ece
,cfi.net.cn,[ 三季报 ] 长白山 ( 603099 ): 长白山旅游股份有限公司2025年第三季度报告 - CFi . CN 中财网,http://www.cfi.net.cn/p20251028008543.html
,eldiariodechihuahua.mx,Crecimiento económico dependerá de la revisión del T - MEC,https://www.eldiariodechihuahua.mx/economia/2025/oct/27/crecimiento-economico-dependera-de-la-revision-del-t-mec-743162.html
,nbd.com.cn,正邦科技前三季度营收涨超八成 ， 净利润却降逾九成 ， 近4亿元资产减值拖累业绩,https://www.nbd.com.cn/articles/2025-10-28/4114658.html
,jabar.tribunnews.com,Jeje Ritchie Ismail Langsung Kontak Dedi Mulyadi Bahas Banjir Lembang : Kewenangan Provinsi,https://jabar.tribunnews.com/metro-bandung/1152627/jeje-ritchie-ismail-langsung-kontak-dedi-mulyadi-bahas-banjir-lembang-kewenangan-provinsi
,fakty.ua,Наркоторговця у Вінниці засудили на 9 років із конфіскацією - фото,https://fakty.ua/462131-pobeditel-shkolnyh-olimpiad-po-himii-organizoval-v-vinnice-narkobiznes-na-milliony
,archdaily.com,Middle East | Tag | ArchDaily,https://www.archdaily.com/tag/middle-east/page/1
,m.kauno.diena.lt,"ŽŪM pranešė , kiek kitąmet augs šprotų ir strimelių kvota",https://m.kauno.diena.lt/naujienos/verslas/ekonomika/zum-pranese-kiek-kitamet-augs-sprotu-ir-strimeliu-kvota-1726331
,santacruzsentinel.com,East Bay hotel is foreclosed in sign of region ailing lodging market – Santa Cruz Sentinel,https://www.santacruzsentinel.com/2025/10/27/east-bay-hotel-economy-travel-covid-real-estate-property-build-loan/
,timeout.com,Som Saa : One of the Best Thai Restaurants in London Will Make a Grand Return in November,https://www.timeout.com/london/news/one-of-the-best-thai-restaurants-in-london-will-make-a-grand-return-in-november-102825
,abcnews.go.com,"Ukraine long - range strikes cut Russia oil refining capacity by 20 %, Zelenskyy says",https://abcnews.go.com/International/wireStory/ukraines-long-range-strikes-cut-russias-oil-refining-126926898
,siliconrepublic.com,What challenges and opportunities might a grad programme bring ?,https://www.siliconrepublic.com/people/decision-making-process-chemical-metal-treatment-graduate-henkel
,blikk.hu,Sok magyar autós feleslegesen fizet többet a kötelező biztosításért,https://www.blikk.hu/ferfiaknak/auto/kgfb-biztosito-valtas/sx2m1wg
,cronicadecantabria.com,"Apuestaes . net : historia , análisis y pronósticos del Mundial 2026",https://cronicadecantabria.com/cr/apuestaes-net-historia-analisis-y-pronosticos-del-mundial-2026/
,biztoc.com,Blackstone to offer senior notes,https://biztoc.com/x/714957763a6eefaf
,latribune.fr,Immobilier dentreprise : Toulouse et Montpellier grippées par lattentisme,http://www.latribune.fr/article/economie/biens-d-equipement-btp-immobilier/23257092989959/immobilier-d-entreprise-toulouse-et-montpellier-grippees-par-lattentisme
,thehindu.com,Grama sabha meetings to be held in Erode on November 1,https://www.thehindu.com/news/cities/Coimbatore/grama-sabha-meetings-to-be-held-in-erode-on-november-1/article70212088.ece
,tribunaonline.com.br,Ventos políticos são favoráveis em Colatina | Tribuna Online,https://tribunaonline.com.br/coluna/plenario/ventos-politicos-sao-favoraveis-em-colatina-279742
,zazoom.it,Cambio al vertice del supporto logistico della Marina Militare di Messina | Belfiore sostituisce Lardizzone,https://www.zazoom.it/2025-10-28/cambio-al-vertice-del-supporto-logistico-della-marina-militare-di-messina-belfiore-sostituisce-lardizzone/18027552/
,finance.ifeng.com,瞄准2035年 ！ 中国人均GDP达到中等发达国家水平 ， 意味着什么 ？,https://finance.ifeng.com/c/8npJT8q000D
,diariodenavarra.es,Conor Bikes nombra a Raúl Churruca como nuevo CEO para liderar una nueva etapa de crecimiento,https://www.diariodenavarra.es/noticias/negocios/dn-management/personas/2025/10/28/conor-bikes-nombra-raul-churruca-nuevo-ceo-liderar-nueva-etapa-crecimiento-704649-98.html
,gasiantimes.com,"US and China seek to strike a deal over rare earths , tariffs and soybeans",https://gasiantimes.com/business/2025/10/28/us-and-china-seek-to-strike-a-deal-over-rare-earths-tariffs-and-soybeans/
,cronista.com,Dólar blue HOY : ¿ a cuánto abre la cotización este martes 28 de octubre ?,https://www.cronista.com/finanzas-mercados/dolar-blue-hoy-a-cuanto-abre-la-cotizacion-este-martes-28-de-octubre/
,dailypolitical.com,"Brookwood Investment Group LLC Sells 11 , 238 Shares of General Motors Company $GM",https://www.dailypolitical.com/2025/10/28/brookwood-investment-group-llc-sells-11238-shares-of-general-motors-company-gm.html
,manilatimes.net,Formica Group Unveils Elevated Metal Collection from Homapal® for Designers Seeking Modern Versatility,https://www.manilatimes.net/2025/10/28/tmt-newswire/globenewswire/formica-group-unveils-elevated-metal-collection-from-homapal-for-designers-seeking-modern-versatility/2210194
,biztoc.com,"VW Group PowerCo shrugs off tariffs , starts construction on $7 - billion Ontario battery plant",https://biztoc.com/x/3d0d4c6312f8d5ea
,finance.sina.com.cn,显盈科技发布2025 年第三季度报告 ： 短期业绩承压 ， 经营现金流保持正向增长,https://finance.sina.com.cn/tech/roll/2025-10-28/doc-infvnhpi0999291.shtml
,cfi.net.cn,克莱特 ( 920689 ): 威海克莱特菲尔风机股份有限公司前次募集资金使用情况鉴证报告 - CFi . CN 中财网,http://www.cfi.net.cn/p20251028008517.html
,webnews.it,Soundcore P40i in offerta : qualità audio e autonomia al top a meno di 60 euro,https://www.webnews.it/soundcore-p40i-in-offerta-qualita-audio-e-autonomia-al-top-a-meno-di-60-euro/
,pressnetwork.de,"Jenseits des Minings : Wie KI unsere Körper , Märkte und Identitäten formt",https://pressnetwork.de/jenseits-des-minings-wie-ki-unsere-koerper-maerkte-und-identitaeten-formt/
,fingerlakes1.com,Rochester job market opens doors for Keuka College grads,https://www.fingerlakes1.com/2025/10/28/rochester-job-market-opens-doors-for-keuka-college-grads/
,zonebourse.com,"Regeneron Pharmaceuticals , Inc . publie ses résultats financiers du troisième trimestre et des neuf premiers mois clos au 30 septembre 2025",https://www.zonebourse.com/actualite-bourse/regeneron-pharmaceuticals-inc-publie-ses-resultats-financiers-du-troisieme-trimestre-et-des-neuf-p-ce7d5ddcdc8ff421
,index.hr,"Muškarac razmišlja o prekidu zaruka :  Ja želim djecu , a ona želi mačke",https://www.index.hr/magazin/clanak/muskarac-razmislja-o-prekidu-zaruka-ja-zelim-djecu-a-ona-zeli-macke/2724826.aspx
,laopiniondemalaga.es,ECONOMÍA PIB DE MÁLAGA | La falta de 45 . 000 viviendas y el problema de la movilidad lastran la buena marcha económica de Málaga,https://www.laopiniondemalaga.es/malaga/2025/10/28/falta-viviendas-problema-movilidad-lastran-economia-malaga-123103363.html
,finanznachrichten.de,Kupfer auf Rekordkurs : US - China - Hoffnung trifft auf Minenengpässe,https://www.finanznachrichten.de/nachrichten-2025-10/66812561-kupfer-auf-rekordkurs-us-china-hoffnung-trifft-auf-minenengpaesse-463.htm
,thestar.com,DP World Receives Ecuador Longest - Reaching Cranes as Part of $140M Major Berth Expansion,https://www.thestar.com/globenewswire/dp-world-receives-ecuador-s-longest-reaching-cranes-as-part-of-140m-major-berth-expansion/article_e12b014f-bd16-581f-81ce-b45fe64e9031.html
,isp.netscape.com,Food banks are preparing for a surge as federal food aid could be paused in the government shutdown,https://isp.netscape.com/news/story/0001/20251028/f9d6c4b6050b96c4941d4b5b212f7e90
,italiannetwork.it,"FINANZA - 4 MILIARDI INVESTIMENTI ESTERI VERSO LITALIA . INIZIATIVA MIMIT E SISTEMA INTERNAZIONALIZ - ZAZIONE ITALIA , 200 IMPRESE ITALIANE E united states , SUPPORTO AMBASCIATA ITALIANA A WASHINGTON / News / Italian Network",https://www.italiannetwork.it/news.aspx?ln=it&id=83199
,163.com,长沙这8大商场 ， 突围成  区域王 ！ |星沙|奥运|地标|梅溪湖|长沙市,https://www.163.com/dy/article/KD03EOA205158BF0.html
,g1.globo.com,"Governo quer esperar votao de projetos que limitam gastos antes de enviar propostas de alta de arrecadao , diz Haddad",https://g1.globo.com/economia/noticia/2025/10/28/governo-quer-esperar-votacao-de-projetos-que-limitam-gastos-antes-de-enviar-propostas-de-alta-de-impostos-diz-haddad.ghtml
,cars.tvbs.com.tw,DS N°8實測續航達750公里 ， 法系旗艦純電證明極限續航,https://cars.tvbs.com.tw/car-news/285611
,power-technology.com,"Coal power to peak by 2030 in China , India , and Indonesia , says CREA",https://www.power-technology.com/news/coal-power-peak-2030-crea/
,biztoc.com,"Lender seizes former San Jose store site , housing project property",https://biztoc.com/x/70b355e81f6b731c
,biztoc.com,Rated Buy at Deutsche Bank on Strength of AI - Driven Advertising Platform,https://biztoc.com/x/c6a1a8ba0157fa03
,cronicadecantabria.com,Cantabria suspende hasta fin de año todas las ferias ganaderas y endurece medidas por la Dermatosis Nodular,https://cronicadecantabria.com/cr/cantabria-suspende-hasta-fin-de-ao-todas-las-ferias-ganaderas-y-endurece-medidas-por-la-dermatosis-nodular/
,biztoc.com,Downgraded : Barclays Says AI Connectivity Shifts Away from Its UALink,https://biztoc.com/x/9ccf1fbe5b7252e6
,ideal.es,El Aeropuerto de Almería estrena una nueva ruta con Liverpool,https://www.ideal.es/almeria/almeria/aeropuerto-almeria-estrena-nueva-ruta-liverpool-20251028135009-nt.html
,allafrica.com,South Africa : Call to Protect Intellectual Property of Creatives Amid AI Revolution,https://allafrica.com/stories/202510280329.html
,bfmtv.com,"Un bitcoin ne vaudra  plus jamais  moins de 100 . 000 dollars : après l  énorme krach , les experts des cryptos sont très optimistes ( et cette semaine sera décisive )",https://www.bfmtv.com/crypto/bitcoin/un-bitcoin-ne-vaudra-plus-jamais-moins-de-100-000-dollars-apres-l-enorme-krach-les-experts-des-cryptos-sont-tres-optimistes-et-cette-semaine-sera-decisive_AN-202510280438.html
,zaobao.com.sg,凯德综合商业信托第三季净房地产收入同比增1 . 6 %,https://www.zaobao.com.sg/finance/singapore/story20251028-7731592
,biztoc.com,FHFA : US house prices up by 0 . 4 % in August,https://biztoc.com/x/02534bd15198c91c
,news.dahe.cn,新闻1+1丨690亿  国补  落地 ， 促消费如何再添新动力 ？- 大河网,https://news.dahe.cn/2025/10-28/2012668.html
,finance.sina.com.cn,从  造什么卖什么  到  要什么造什么 ， 双11家电供应链柔性升级|空调|双11,https://finance.sina.com.cn/tech/roll/2025-10-28/doc-infvnhpi1000528.shtml
,guampdn.com,Stocks retreat after Wall Street surge,https://www.guampdn.com/news/national/stocks-retreat-after-wall-street-surge/article_a81ec1ce-b7f0-5a84-83ac-0bd251609403.html
,wielerflits.nl,LOOK introduceert Keo Vision - pedalen met ingebouwde verlichting,https://www.wielerflits.nl/materiaalzone/look-introduceert-keo-vision-pedalen-met-ingebouwde-verlichting/
,nyasatimes.com,Select Financial Services urges collaboration to boost financial inclusion - Malawi Nyasa Times,https://www.nyasatimes.com/select-financial-services-urges-collaboration-to-boost-financial-inclusion/
,businessonline.it,"Aumenti Skipass 2025 - 2026 , i nuovi prezzi e tariffe delle diverse località sciistiche . E come si può risparmiare",https://www.businessonline.it/news/aumenti-skipass-2025-2026-i-nuovi-prezzi-e-tariffe-delle-diverse-localit-sciistiche-e-come-si-pu-risparmiare_n79452.html
,biztoc.com,Unitedhealth Q3 results reflect the U . S . healthcare crisis,https://biztoc.com/x/de507ba5701bcdc8
,philstar.com,itel Super 26 Ultra launches in the Philippines : Flagship features meet smart AI at an unbeatable price,https://www.philstar.com/lifestyle/gadgets/2025/10/28/2481976/itel-super-26-ultra-launches-philippines-flagship-features-meet-smart-ai-unbeatable-price
,news.harianjogja.com,"Korupsi Ekspor Limbah Sawit , Kejagung Geledah 5 Lokasi",https://news.harianjogja.com/read/2025/10/28/500/1233606/korupsi-ekspor-limbah-sawit-kejagung-geledah-5-lokasi
,english.almanar.com.lb,US Bears Responsibility for Every Drop of Blood : Hezbollah Official,https://english.almanar.com.lb/2524590
,globenewswire.com,Qued Wins 3rd Place in 2026 FreightWaves FreightTech Award,https://www.globenewswire.com/news-release/2025/10/28/3175557/0/en/Qued-Wins-3rd-Place-in-2026-FreightWaves-FreightTech-Award.html
,bursa.ro,"XTB : Alegerile din Argentina impulsionează peso - ul şi bursele , pe fondul sprijinului SUA",https://www.bursa.ro/xtb-alegerile-din-argentina-impulsioneaza-peso-ul-si-bursele-pe-fondul-sprijinului-sua-81024759
,poslovni.hr,Tehnološki gigant planira otpustiti oko 30 . 000 zaposlenika,https://www.poslovni.hr/svijet/tehnoloski-gigant-planira-otpustiti-oko-30-000-zaposlenika-4508362
,3dmgame.com,《 王者荣耀世界 》 试玩报告 ： 真正的王者世界 _ 3DM专栏,https://www.3dmgame.com/original/3745737.html
,poslovni.hr,"Hrvatska industrija zaostaje za europskim prosjekom : Koče je niska digitalizacija , manjak ulaganja i nedostatak radne snage",https://www.poslovni.hr/hrvatska/hrvatska-industrija-zaostaje-za-europskim-prosjekom-koce-je-niska-digitalizacija-manjak-ulaganja-i-nedostatak-radne-snage-4508403
,antaranews.com,Menkeu - Menhut sebut pentingnya manajemen kehutanan demi tekan karhutla,https://www.antaranews.com/berita/5204901/menkeu-menhut-sebut-pentingnya-manajemen-kehutanan-demi-tekan-karhutla
,finance.ifeng.com,4000点破了 ， 第一次涨到6124 ， 第二次5178 ， 这次 ……,https://finance.ifeng.com/c/8npEPUFUGeA
,aktiencheck.de,"Zalando Aktie : Interessant , aber spekulativ ( XTB )",https://www.aktiencheck.de/exklusiv/Artikel-Zalando_Aktie_Interessant_aber_spekulativ-19149901
,metro.co.uk,The Renter Rights Bill is now law - what it means for renters and landlords | News Politics,https://metro.co.uk/2025/10/28/renters-rights-bill-now-law-means-24546124/
,onvista.de,Georgische Führung will grte Oppositionsparteien verbieten lassen,https://www.onvista.de/news/2025/10-28-georgische-fuehrung-will-groesste-oppositionsparteien-verbieten-lassen-0-20-26443954
,biztoc.com,"Looking For Yields : Black Hills , Genuine Parts , And Agree Realty Are Consistent Moneymakers",https://biztoc.com/x/f44fc3c64dd3d138
,neuquenalinstante.com.ar,Nuevo beneficio para los contribuyentes de la ciudad | Neuquén Al Instante | Periodismo Digital en la Patagonia,https://www.neuquenalinstante.com.ar/noticias/2025/10/28/121974-nuevo-beneficio-para-los-contribuyentes-de-la-ciudad
,lrytas.lt,"Izraelis kaltina „ Hamas  pažeidus paliaubas , nes buvo grąžinti daliniai įkaito palaikai",https://www.lrytas.lt/pasaulis/konfliktai-ir-saugumas/2025/10/28/news/izraelis-kaltina-hamas-pazeidus-paliaubas-nes-buvo-grazinti-daliniai-ikaito-palaikai-40073480/
,nbd.com.cn,本轮牛市会在4000点上方停留多久 ？ 道达投资手记,https://www.nbd.com.cn/articles/2025-10-28/4114585.html
,gulte.com,"Amazon Confirms Massive Layoffs , Not 30 , 000 But ...",https://www.gulte.com/trends/379075/amazon-confirms-massive-layoffs-not-30000-but
,slobodna-bosna.ba,HVALITE ME USTA MOJA : Trump objavio fotografiju na kojoj zahvaljuje sam sebi,https://www.slobodna-bosna.ba/vijest/443202/hvalite_me_usta_moja_trump_objavio_fotografiju_na_kojoj_zahvaljuje_sam_sebi.html
,dialessandria.it,Varese : frode spagnola da 5 milioni su incentivi agli impianti fotovoltaici,https://www.dialessandria.it/attualita/scoperta-frode-di-5-milioni-su-incentivi-pubblici-agli-impianti-fotovoltaici/241819.html
,isp.netscape.com,"UPS 3Q results top Street ; gives details of turnaround efforts , including 34 , 000 job cuts",https://isp.netscape.com/pf/story/0001/20251028/85afc1c459883f41a2283c8394ce1eaf
,cfi.net.cn,克莱特 ( 920689 ): 拟聘任2025年度会计师事务所公告 - CFi . CN 中财网,http://www.cfi.net.cn/p20251028008516.html
,oferplan.diariovasco.com,1 o 2 Sesiones de Hydrafacial : Un ritual de limpieza profunda y vitalidad en Clínica Ixia por 19 . 9 € - oferta con descuento : 73 % | Ofertas en Donostia - San Sebastian y Gipuzkoa,https://oferplan.diariovasco.com/ofertas-descuentos/tratamiento-aquaderm-sesion-clinica-ixia-rp-24165.html
,biztoc.com,Federal Reserve likely to cut key rate Wednesday and may signal another cut to follow,https://biztoc.com/x/0c8f9f15810f5a96
,economictimes.indiatimes.com,Sattva makes strategic entry into GCC space with an integrated platform - GCCBase with Innovalus,https://economictimes.indiatimes.com/industry/services/property-/-cstruction/sattva-makes-strategic-entry-into-gcc-space-with-an-integrated-platform-gccbase-with-innovalus/articleshow/124874470.cms
,myanmarnews.net,Reagan Foundation steps in after Trump calls Ontario tariff ad  fake,http://www.myanmarnews.net/news/278656773/reagan-foundation-steps-in-after-trump-calls-ontario-tariff-ad-fake
,boerse-express.com,Börse Express - OMV - Aktie : Gewinnsprung erwünscht !,https://www.boerse-express.com/news/articles/omv-aktie-gewinnsprung-erwuenscht-836682
,agerpres.ro,"Mureș / Repetiția generală pentru concertul ce marchează 145 de ani de relații diplomatice româno - germane , la Festivalul  Constantin Silvestri",https://agerpres.ro/cultura-media/2025/10/28/mures-repetitia-generala-pentru-concertul-ce-marcheaza-145-de-ani-de-relatii-diplomatice-romano-germ--1497745
,biztoc.com,Should You Hold Green Brick Partners ( GRBK )?,https://biztoc.com/x/e8dd9541b74bd567
,81.cn,十四届全国人大常委会第十八次会议在京闭幕,http://www.81.cn/yw_208727/16418227.html
,weser-kurier.de,Bassum : Kunsthandwerkermarkt und verkaufsoffener Sonntag,https://www.weser-kurier.de/landkreis-diepholz/gemeinde-bassum/bassum-kunsthandwerkermarkt-und-verkaufsoffener-sonntag-doc82y1uq0080jn0t38nku
,abcnews.go.com,Big win in midterm vote for Argentina President Milei boosts markets and vindicates Trump,https://abcnews.go.com/International/wireStory/big-win-midterm-vote-argentinas-president-milei-boosts-126907657
,africanelections.org,African Elections | Tanzania Votes in General Elections,https://www.africanelections.org/news/tanzania-votes-in-general-elections-whats-at-stake/
,ipress.ua,Поїздка спецпосланця путіна до Вашингтона пройшла невдало The Telegraph,https://ipress.ua/news/poizdka_spetsposlantsya_putina_do_vashyngtona_proyshla_nevdalo__the_telegraph_378058.html
,wiadomosci.radiozet.pl,Egzaminy na prawo jazdy będą droższe . Zmiany w cennikach 2 województw,https://wiadomosci.radiozet.pl/biznes/egzaminy-na-prawo-jazdy-beda-drozsze-zmiany-w-cennikach-2-wojewodztw
,forbes.com,Trade News Takes Markets To Record,https://www.forbes.com/sites/jjkinahan/2025/10/28/trade-news-takes-markets-to-record/
,pulshr.pl,Nowe pokolenie liderów biznesu rozwija się w Akademii Humanitas,"https://www.pulshr.pl/serwis/kompetencje-a-edukacja-podyplomowa/nowe-pokolenie-liderow-biznesu-rozwija-sie-w-akademii-humanitas,115019.html"
,biztoc.com,"Been Sneaking Up , Says Jim Cramer",https://biztoc.com/x/ea5202f47af82ddf
,leducrep.com,This is my happy place : Older adult growing role in the workplace,https://www.leducrep.com:443/vitality-alberta/older-adults-growing-role-in-workplace
,www.rga.de,Italy,https://www.rga.de/reise/erstes-land-fuehrt-ski-helmpflicht-ein-das-gilt-in-italien-oesterreich-schweiz-deutschland-73ZTLCQ4CFBZBL62ZMF3COJDRU.html
,www.rga.de,Austria,https://www.rga.de/reise/erstes-land-fuehrt-ski-helmpflicht-ein-das-gilt-in-italien-oesterreich-schweiz-deutschland-73ZTLCQ4CFBZBL62ZMF3COJDRU.html
,www.habermeydan.com,Japan,https://www.habermeydan.com/dunya/abd-ile-japonya-kritik-minerallerde-is-birligi-anlasmasi-imzaladi-h176529/
,www.habermeydan.com,"Tokyo, Tokyo, Japan",https://www.habermeydan.com/dunya/abd-ile-japonya-kritik-minerallerde-is-birligi-anlasmasi-imzaladi-h176529/
,timesofmalta.com,Malta,https://timesofmalta.com/article/business-bureau-welcomes-work-programme-warns-islands-ignored.1118650
,www.elfinanciero.com.mx,Mexico,https://www.elfinanciero.com.mx/opinion/de-jefes/2025/10/28/los-retos-de-los-7-magnificos/
,special.huanbohainews.com.cn,"Anxin, Shanghai, China",https://special.huanbohainews.com.cn/2025-10/28/content_50477552.html
,special.huanbohainews.com.cn,"Hebei, Jilin, China",https://special.huanbohainews.com.cn/2025-10/28/content_50477552.html
,special.huanbohainews.com.cn,"Dingzhou, Hebei, China",https://special.huanbohainews.com.cn/2025-10/28/content_50477552.html
,special.huanbohainews.com.cn,"Beijing, Beijing, China",https://special.huanbohainews.com.cn/2025-10/28/content_50477552.html
,special.huanbohainews.com.cn,China,https://special.huanbohainews.com.cn/2025-10/28/content_50477552.html
,lequotidien.sn,Senegal,https://lequotidien.sn/ousmane-sonko-le-retour-au-populisme-dopposition/
,unn.ua,Russia,https://unn.ua/ru/news/defitsita-lekarstv-v-ukraine-ne-budet-posle-unichtozheniya-krupnogo-farmsklada-v-minzdrave-rasskazali-kak-kontroliruyut-situatsiyu-s-postavkami
,unn.ua,Ukraine,https://unn.ua/ru/news/defitsita-lekarstv-v-ukraine-ne-budet-posle-unichtozheniya-krupnogo-farmsklada-v-minzdrave-rasskazali-kak-kontroliruyut-situatsiyu-s-postavkami
,www.focus-news.net,"Toronto, Ontario, Canada",https://www.focus-news.net/novini/mejdunarodni/Bloomberg-SASht-davat-na-Germaniya-shestmesechna-otsrochka-za-aktivite-na-R-2763199
,www.focus-news.net,"Berlin, Berlin, Germany",https://www.focus-news.net/novini/mejdunarodni/Bloomberg-SASht-davat-na-Germaniya-shestmesechna-otsrochka-za-aktivite-na-R-2763199
,www.focus-news.net,Germany,https://www.focus-news.net/novini/mejdunarodni/Bloomberg-SASht-davat-na-Germaniya-shestmesechna-otsrochka-za-aktivite-na-R-2763199
,www.focus-news.net,Qatar,https://www.focus-news.net/novini/mejdunarodni/Bloomberg-SASht-davat-na-Germaniya-shestmesechna-otsrochka-za-aktivite-na-R-2763199
,www.denbighshirefreepress.co.uk,"Essex, Essex, United Kingdom",https://www.denbighshirefreepress.co.uk/news/national/25577844.housing-migrants-barracks-worth-quell-public-anger-despite-cost---no-10/
,www.denbighshirefreepress.co.uk,"Scampton, Lincolnshire, United Kingdom",https://www.denbighshirefreepress.co.uk/news/national/25577844.housing-migrants-barracks-worth-quell-public-anger-despite-cost---no-10/
,www.denbighshirefreepress.co.uk,"East Sussex, East Sussex, United Kingdom",https://www.denbighshirefreepress.co.uk/news/national/25577844.housing-migrants-barracks-worth-quell-public-anger-despite-cost---no-10/
,www.denbighshirefreepress.co.uk,"Crowborough, East Sussex, United Kingdom",https://www.denbighshirefreepress.co.uk/news/national/25577844.housing-migrants-barracks-worth-quell-public-anger-despite-cost---no-10/
,www.denbighshirefreepress.co.uk,"Wethersfield, Essex, United Kingdom",https://www.denbighshirefreepress.co.uk/news/national/25577844.housing-migrants-barracks-worth-quell-public-anger-despite-cost---no-10/
,www.denbighshirefreepress.co.uk,"Lincolnshire, Lincolnshire, United Kingdom",https://www.denbighshirefreepress.co.uk/news/national/25577844.housing-migrants-barracks-worth-quell-public-anger-despite-cost---no-10/
,lajmi.net,Bosnia-Herzegovina,https://lajmi.net/kurti-i-hakmerret-baljes-ia-shkarkon-zv-ministrin-dhe-keshilltarin/
,lajmi.net,Kosovo,https://lajmi.net/kurti-i-hakmerret-baljes-ia-shkarkon-zv-ministrin-dhe-keshilltarin/
,n.yam.com,"Taipei, T'ai-Pei, Taiwan",https://n.yam.com/Article/20251028101215
,n.yam.com,"Zhejiang, Zhejiang, China",https://n.yam.com/Article/20251028101215
,n.yam.com,"Zhenjiang, Jiangsu, China",https://n.yam.com/Article/20251028101215
,n.yam.com,Taiwan,https://n.yam.com/Article/20251028101215
,n.yam.com,"Shaoxing, Zhejiang, China",https://n.yam.com/Article/20251028101215
,rus.delfi.lv,"Belgorod, Belgorodskaya Oblast', Russia",https://rus.delfi.lv/57862/v-mire/120092989/vsu-razrushili-plotinu-belgorodskogo-vodohranilishcha-kak-eto-povliyaet-na-front
,www.georgeherald.com,"Cape Town, Western Cape, South Africa",https://www.georgeherald.com/News/Article/LifeStyle/why-iron-stores-matter-for-mental-health-202510280133
,www.georgeherald.com,South Africa,https://www.georgeherald.com/News/Article/LifeStyle/why-iron-stores-matter-for-mental-health-202510280133
,gauchazh.clicrbs.com.br,"Rio Grande Do Sul, Rio Grande Do Sul, Brazil",https://gauchazh.clicrbs.com.br/economia/noticia/2025/10/desconto-no-ipva-2026-prazo-para-receber-beneficio-termina-nesta-semana-cmh9j19r1009c014ub3o03ss1.html
,athens-times.com,"London, London, City Of, United Kingdom",https://athens-times.com/merkel-proposes-pan-european-stock-exchange-to-boost-eu-capital-markets/
,athens-times.com,"Warsaw, (Pl67), Poland",https://athens-times.com/merkel-proposes-pan-european-stock-exchange-to-boost-eu-capital-markets/
,www.zazoom.it,"Palermo, Sicilia, Italy",https://www.zazoom.it/2025-10-28/lacqua-leva-di-crescita-per-le-imprese-a-palermo-tech-day-di-unicredit-2/18027663/
,allafrica.com,Nigeria,https://allafrica.com/stories/202510280394.html
,allafrica.com,"Abuja, Abuja Federal Capital Territory, Nigeria",https://allafrica.com/stories/202510280394.html
,www.tz.de,Czech Republic,http://www.tz.de/verbraucher/nach-jahrelangem-streit-um-namen-kult-bier-kommt-endlich-nach-deutschland-zr-94009609.html
,www.divyabhaskar.co.in,India,https://www.divyabhaskar.co.in/utility/news/chatgpt-go-free-unlimited-india-offer-november-4-136275165.html
