published_at,source,title,url
,lounaeestlane.ee,Sõja ülevaade : 1343 . päev - muutusi vaid lõunarindel,https://lounaeestlane.ee/soja-ulevaade-1343-paev-muutusi-vaid-lounarindel/
,habermeydan.com,"ABD ile Japonya , kritik minerallerde iş birliği anlaşması imzaladı",https://www.habermeydan.com/dunya/abd-ile-japonya-kritik-minerallerde-is-birligi-anlasmasi-imzaladi-h176529/
,elfinanciero.com.mx,Los retos de los  7 magnífico – El Financiero,https://www.elfinanciero.com.mx/opinion/de-jefes/2025/10/28/los-retos-de-los-7-magnificos/
,cfi.net.cn,[ 三季报 ] 无锡鼎邦 ( 920931 ): 2025年三季度报告 - CFi . CN 中财网,http://www.cfi.net.cn/p20251028008888.html
,mp.cnfol.com,指数不会那么容易就跌下来 ， 切忌追高 _ 中金在线财经号,http://mp.cnfol.com/12120/article/1761654385-142083000.html
,focus.ua,Китай использует ИИ DeepSeek для своих военных разработок : в США бьют тревогу ( фото ),https://focus.ua/digital/730504-kitay-ispolzuet-ii-deepseek-dlya-svoih-voennyh-razrabotok-v-ssha-byut-trevogu-foto
,focus-news.net,Bloomberg : САЩ дават на Германия шестмесечна отсрочка за активите на  Роснефт,https://www.focus-news.net/novini/mejdunarodni/Bloomberg-SASht-davat-na-Germaniya-shestmesechna-otsrochka-za-aktivite-na-R-2763199
,sapo.pt,Onze detidos em operao policial que desmantelou rede de furtos e tráfico de droga em Aveiro,https://sapo.pt/artigo/onze-detidos-em-operacao-policial-que-desmantelou-rede-de-furtos-e-trafico-de-droga-em-aveiro-6900c69e9cfbc310cab7b069
,manilatimes.net,"Edible Garden Strengthens Midwest Operations With Expanded Production Capacity at Heartland Facility in Grand Rapids , Michigan",https://www.manilatimes.net/2025/10/28/tmt-newswire/globenewswire/edible-garden-strengthens-midwest-operations-with-expanded-production-capacity-at-heartland-facility-in-grand-rapids-michigan/2210223
,cerclefinance.com,Mercialys : BlackRock dépasse les 5 % du capital et des votes,https://www.cerclefinance.com/article/mercialys-blackrock-depasse-les-5-du-capital-et-des-votes/
,quattroruote.it,Le sfide dellintelligenza artificiale e della concorrenza asiatica a Quattroruote Next,https://www.quattroruote.it/news/eventi/2025/10/28/quattroruote_next_pirelli-_-ecco_come_affrontiamo_le_sfide_dell-intelligenza_artificiale-.html
,finanzen.net,"Trading Idee : Tesla - Rücksetzer durch , weiterer Anstieg erwartet",https://www.finanzen.net/nachricht/zertifikate/trading-idee-trading-idee-tesla-ruecksetzer-durch-weiterer-anstieg-erwartet-15132339
,dailycampus.com,Before The Planet Tips : Why we must act now alongside COP30,https://dailycampus.com/2025/10/28/before-the-planet-tips-why-we-must-act-now-alongside-cop30/
,athens-times.com,Merkz Pushes for EU - Wide Stock Exchange,https://athens-times.com/merkel-proposes-pan-european-stock-exchange-to-boost-eu-capital-markets/
,tz.de,Preis - Explosion bei beliebtem Weihnachts - Klassiker – Verbraucherschützer haben einen Verdacht,http://www.tz.de/verbraucher/preis-explosion-bei-beliebtem-weihnachts-klassiker-verbraucherschuetzer-haben-einen-verdacht-zr-94009605.html
,tz.de,Nach jahrelangem Streit um Namen : Kult - Bier kommt endlich nach Deutschland,http://www.tz.de/verbraucher/nach-jahrelangem-streit-um-namen-kult-bier-kommt-endlich-nach-deutschland-zr-94009609.html
,dailypolitical.com,Vanguard Short - Term Bond ETF $BSV Holdings Boosted by Clark Asset Management LLC,https://www.dailypolitical.com/2025/10/28/vanguard-short-term-bond-etf-bsv-holdings-boosted-by-clark-asset-management-llc.html
,morningstar.com,"U . S . Added 14 , 250 Private - Sector Jobs in Four Weeks Ended Oct . 11 , ADP Says",https://www.morningstar.com/news/dow-jones/202510286713/us-added-14250-private-sector-jobs-in-four-weeks-ended-oct-11-adp-says
,divyabhaskar.co.in,FREE ChatGPT Go : OpenAI Offers Unlimited Access for One Year in India from Nov 4 | ફ્રી ... ફ્રી ... ફ્રી ... હવે ChatGPT અનલિમિટેડ વાપરો !: ભારતમાં સબસ્ક્રિપ્શન પ્લાન એક વર્ષ માટે મફત મળશે ; 4 નવેમ્બરથી ઓફર લાગુ,https://www.divyabhaskar.co.in/utility/news/chatgpt-go-free-unlimited-india-offer-november-4-136275165.html
,orissapost.com,Learn from the Past - OrissaPOST,https://www.orissapost.com/learn-from-the-past/
,mankatofreepress.com,The Latest : Trump meets with newly elected Japanese Prime Minister Sanae Takaichi,https://www.mankatofreepress.com/news/business/the-latest-trump-meets-with-newly-elected-japanese-prime-minister-sanae-takaichi/article_3db63a3a-6d96-522a-8d9a-ab76b419104e.html
,thepigsite.com,Smithfield profit surges on strong pork demand,https://www.thepigsite.com/news/2025/10/smithfield-profit-surges-on-strong-pork-demand
,20minutos.es,Barcelona destina ocho millones hasta 2027 para mejorar el acceso de personas con discapacidad al mercado laboral,https://www.20minutos.es/cataluna/barcelona/barcelona-destina-ocho-millones-hasta-2027-para-mejorar-acceso-personas-con-discapacidad-mercado-laboral_6661904_0.html
,qds.it,"Barbagallo ( Pd ):  Tangenziale di Catania congestionata e pericolosa , proponiamo pedemontana etnea",https://qds.it/barbagallo-pd-tangenziale-catania-pedemontana-etnea-politica/
,scottishhousingnews.com,Land Reform Bill  must be workable and proportionate,https://www.scottishhousingnews.com/articles/land-reform-bill-must-be-workable-and-proportionate
,mortgagestrategy.co.uk,Aldermore hires Pendlebury as BDM for the North,https://www.mortgagestrategy.co.uk/news/aldermore-hires-pendlebury-as-bdm-for-the-north/
,georgeherald.com,Information session : Upgrading of roads in George CBD,https://www.georgeherald.com/Municipal-Notices/Article/General-Notices/information-session-upgrading-of-roads-in-george-cbd-202510281127
,amny.com,Op - Ed | Moving closer to affordable child care for NYC families,https://www.amny.com/opinion/moving-closer-affordable-child-care-nyc-families/
,reviewjournal.com,Does the Las Vegas real estate market favor buyers or sellers ? | Housing,https://www.reviewjournal.com/business/housing/is-las-vegas-in-a-buyers-or-sellers-real-estate-market-3529231/
,20minutos.es,Subastan un cromo único en el mundo firmado por Lamine Yamal : puede llegar a valer hasta 20 . 000 euros,https://www.20minutos.es/deportes/futbol/subastan-un-cromo-unico-mundo-firmado-por-lamine-yamal-puede-llegar-valer-hasta-20-000-euros_6662003_0.html
,n-tv.de,Ukraine - Krieg im Liveticker : +++ 14 : 42 Lawrow bringt Nichtangriffsgarantie für Europa ins Spiel +++,https://www.n-tv.de/politik/14-42-Lawrow-bringt-Nichtangriffsgarantie-fuer-Europa-ins-Spiel--article23143824.html
,speedweek.com,Andreas Kofler : IDM - Champion zieht es in die WM / IDM Supersport,https://www.speedweek.com/idmsst600/news/242916/Andreas-Kofler-IDM-Champion-zieht-es-in-die-WM.html
,elpais.com,Tres años más de  presupuestos de guerra : la Complutense mantendrá el 35 % de recortes para pagar el préstamo a Ayuso | Educación,https://elpais.com/educacion/2025-10-28/tres-anos-mas-en-la-uci-la-complutense-mantendra-el-35-de-recortes-para-pagar-el-prestamo-a-ayuso.html
,miragenews.com,Trump Secures Billions in Japanese Investments,https://www.miragenews.com/trump-secures-billions-in-japanese-investments-1559166/
,dailypolitical.com,Pharmaceutical Stocks To Keep An Eye On – October 25th,https://www.dailypolitical.com/2025/10/28/pharmaceutical-stocks-to-keep-an-eye-on-october-25th.html
,radiofrance.fr,Précarité énergétique  : 36 % des Français en difficulté pour payer leurs factures de gaz ou d  électricité,https://www.radiofrance.fr/franceculture/podcasts/journal-de-12h30/journal-de-12h30-du-mardi-28-octobre-2025-5530581
,house.cnfol.com,越秀地产 ( 00123 . HK ) 以11 . 94亿元竞得广州市番禺区大石街地块 _ 房产动态 _ 房产 _ 中金在线,http://house.cnfol.com/fangchanyaowen/20251028/31745159.shtml
,shiftdelete.net,TikTok için kritik hafta : Belirsizlik sona erecek mi ?,https://shiftdelete.net/tiktok-icin-kritik-hafta-belirsizlik-sona-erecek-mi
,kibrispostasi.com,"Filiz Besim : Tecrübesiz hekimler , göreve yalnız başlamamalı",https://www.kibrispostasi.com/c77-SAGLIK/n580041-filiz-besim-tecrubesiz-hekimler-goreve-yalniz-baslamamali
,bolognatoday.it,"Bologna , nuova informativa di reato per loccupazione in via Don Minzoni",https://www.bolognatoday.it/cronaca/occupazione-via-don-minzoni-informativa-procura-bologna.html
,zazoom.it,Utilizzo ribassi di gara per finanziare le varianti | più strumenti per completare opere,https://www.zazoom.it/2025-10-28/utilizzo-ribassi-di-gara-per-finanziare-le-varianti-piu-strumenti-per-completare-opere/18027678/
,timeturk.com,"İsrail , Moloz ve pün Gazzeye Dökyor !",https://www.timeturk.com/ceviri/israil-moloz-ve-copunu-gazze-ye-dokuyor-haber-1823629
,martinique.franceantilles.fr,Amazon annonce la suppression de 14 . 000 postes,https://www.martinique.franceantilles.fr/actualite/economie/amazon-annonce-la-suppression-de-14000-postes-1055571.php
,ansa.it,Sagf e Gruppo Sciatori della Finanza festeggiano con Mattarella - Notizie,https://www.ansa.it/trentino/notizie/2025/10/28/sagf-e-gruppo-sciatori-della-finanza-festeggiano-con-mattarella_2a595e1b-d72e-4787-9fbc-bebb91636bdb.html
,morningstar.com,"U . S . labor market was expanding in mid - October , new weekly ADP report shows",https://www.morningstar.com/news/marketwatch/2025102872/us-labor-market-was-expanding-in-mid-october-new-weekly-adp-report-shows
,dailystar.co.uk,HMRC sending urgent letters to landlords – unexpected tax bill could hit you,https://www.dailystar.co.uk/news/latest-news/hmrc-sending-urgent-letters-landlords-36145272
,mercado.com.ar,"Verticales , pero no neutrales : cómo la integración en la industria farmacéutica encarece los medicamentos",https://mercado.com.ar/informes-especiales/verticales-pero-no-neutrales-como-la-integracion-en-la-industria-farmaceutica-encarece-los-medicamentos/
,miragenews.com,King Gets £2 . 7m for Anti - Fungal Device Development,https://www.miragenews.com/kings-gets-2-7m-for-anti-fungal-device-1559162/
,wiadomosci.radiozet.pl,Lekarze w Polsce zarobią mniej ? Nowy pomysł resortu,https://wiadomosci.radiozet.pl/polityka/lekarze-w-polsce-zarobia-mniej-nowy-pomysl-resortu
,cfi.net.cn,中亚股份 ( 300512 ): 2025年限制性股票激励计划授予登记完成的公告 （ 新增股份 ）- CFi . CN 中财网,http://www.cfi.net.cn/p20251028008494.html
,cronista.com,Vino sin alcohol : cambia el consumo argentino y las bodegas salen a competir con nuevas etiquetas,https://www.cronista.com/apertura/empresas/menos-alcohol-los-novedosos-vinos-de-las-bodegas-locales-para-una-tendencia-que-crece/
,wgauradio.com,"Amazon cuts 14 , 000 corporate jobs",https://www.wgauradio.com/news/business/amazon-cuts-14000/CZQJ3GLTDU4Q3B5SRBHJYX3QDM/
,cfi.net.cn,味知香 ( 605089 ): 召开2025年第三季度业绩说明会 - CFi . CN 中财网,http://www.cfi.net.cn/p20251028008549.html
,economictimes.indiatimes.com,"Bitcoin price : End of the bull run ? Bitcoin could tank to $70 , 000 , says top market analyst",https://economictimes.indiatimes.com/news/international/us/end-of-the-bull-run-bitcoin-could-tank-to-70000-says-top-market-analyst/articleshow/124874365.cms
,money.kompas.com,"Tak Ikut Proyek Waste - to - Energy Danantara , TOBA Fokus Ekspansi ke Pasar Internasional",https://money.kompas.com/read/2025/10/28/202608026/tak-ikut-proyek-waste-to-energy-danantara-toba-fokus-ekspansi-ke-pasar
,winfuture.de,"Xbox - Manager : Unsere Konkurrenz ist nicht PlayStation , sondern TikTok","https://winfuture.de/news,154539.html"
,benzinga.com,"Top 2 Risk Off Stocks That May Keep You Up At Night This Month - Keurig Dr Pepper ( NASDAQ : KDP ), Paranovus Entertainment ( NASDAQ : PAVS )",https://www.benzinga.com/trading-ideas/short-ideas/25/10/48460411/top-2-risk-off-stocks-that-may-keep-you-up-at-night-this-month-2
,stern.de,Tiere : Vogelgrippe breitet sich aus – Zoo und Tierpark in Sorge,https://www.stern.de/gesellschaft/regional/berlin-brandenburg/tiere--vogelgrippe-breitet-sich-aus---zoo-und-tierpark-in-sorge-36168900.html
,ambito.com,Dólar hoy y dólar blue hoy minuto a minuto : a cuánto opera este martes 28 de octubre,https://www.ambito.com/finanzas/dolar-hoy-y-dolar-blue-hoy-minuto-minuto-cuanto-opera-este-martes-28-octubre-n6207057
,naslovi.net,Studenti krenuli biciklima iz Niša u Novi Sad na veliki protest ( video ),https://naslovi.net/2025-10-28/pravda/studenti-krenuli-biciklima-iz-nisa-u-novi-sad-na-veliki-protest-video/40762154
,dailynews.co.th,พรินซิเพิล  แนะนำ 3 กองทุน รับมือตลาดผันผวน,https://www.dailynews.co.th/news/5248514/
,livemint.com,Losing money in SIPs ? These 5 mistakes are likely draining your returns,https://www.livemint.com/market/stock-market-news/losing-money-in-sips-these-5-mistakes-are-likely-draining-your-returns-11761651927029.html
,news.harianjogja.com,"Dilaporkan Dugaan Korupsi , Begini Respons Ketua Bawaslu Rahmat Bagja",https://news.harianjogja.com/read/2025/10/28/500/1233611/dilaporkan-dugaan-korupsi-begini-respons-ketua-bawaslu-rahmat-bagja
,thedrinksbusiness.com,New report highlights  enormous value  of Austrian wine to economy,https://www.thedrinksbusiness.com/2025/10/new-report-highlights-enormous-economic-value-of-austrian-wine/
,biztoc.com,The Most Dangerous Era In History,https://biztoc.com/x/52a23e76190bc34d
,neuquenalinstante.com.ar,Neuquén registra uno de los mayores crecimientos en tráfico aéreo del país | Neuquén Al Instante,https://www.neuquenalinstante.com.ar/noticias/2025/10/28/121967-neuquen-registra-uno-de-los-mayores-crecimientos-en-trafico-aereo-del-pais
,finanzen.net,Ausblick : BASF zieht Bilanz zum abgelaufenen Quartal,https://www.finanzen.net/nachricht/aktien/experten-prognosen-ausblick-basf-zieht-bilanz-zum-abgelaufenen-quartal-15129678
,macombdaily.com,"Why sub - $30 , 000 , entry - level auto offerings are shrinking",https://www.macombdaily.com/2025/10/28/why-sub-30000-entry-level-auto-offerings-are-shrinking/
,biztoc.com,Wedbush Reiterates Outperform on Apple ( AAPL ) with $310 Target Ahead of Earnings,https://biztoc.com/x/bc5e2831a03fb56d
,finanzen.ch,EQS - Adhoc : Schaeffler AG : Schaeffler AG raises guidance for free cash flow before cash in - and outflows for M & A activities for fiscal year 2025,https://www.finanzen.ch/nachrichten/aktien/eqs-adhoc-schaffler-ag-schaffler-ag-raises-guidance-for-free-cash-flow-before-cash-in-and-outflows-for-m&a-activities-for-fiscal-year-2025-1035438995
,poslovni.hr,"U gradu sa 70 % podstanara , kandidat za gradonačelnika nudi rješenje : Zamrznut ću stanarine",https://www.poslovni.hr/svijet/u-gradu-sa-70-podstanara-kandidat-za-gradonacelnika-nudi-rjesenje-zamrznut-cu-stanarine-4508334
,acento.com.do,Los mapas que muestran por dónde viaja la droga desde América Latina hasta EE . UU . ( y cuánta llega por el Caribe ),https://acento.com.do/bbc-news-mundo/los-mapas-que-muestran-por-donde-viaja-la-droga-desde-america-latina-hasta-ee-uu-y-cuanta-llega-por-el-caribe-9570132.html
,cars.tvbs.com.tw,Kia EV4 GT偽裝車曝光 ， 400匹純電掀背蓄勢待發,https://cars.tvbs.com.tw/car-news/285563
,mladina.si,Potomci pisateljice Astrid Lindgren tožijo hrvaško podjetje,https://www.mladina.si/244477/potomci-pisateljice-astrid-lindgren-tozijo-hrvasko-podjetje/
,bitcoinmagazine.com,Human Rights Foundation Gives $1 . 1M To Bitcoin Projects,https://bitcoinmagazine.com/builders/human-rights-foundation-1b-satoshis
,haberhurriyeti.com,Ünlü gelinlik devi Oleg Cassini 14 yıl sonra Türkiyeden çekildi,https://www.haberhurriyeti.com/haber/26687605/unlu-gelinlik-devi-oleg-cassini-14-yil-sonra-turkiyeden-cekildi
,g1.globo.com,Dr . Pessoa fica inelegível após vereadores reprovarem contas,https://g1.globo.com/pi/piaui/noticia/2025/10/28/vereadores-contas-dr-pessoa.ghtml
,finance.yahoo.com,Barclays seeks CMA licence to expand into Saudi Arabia,https://finance.yahoo.com/news/barclays-seeks-cma-licence-expand-130440886.html
,marinij.com,Could Americans choose a California Democrat -- Newsom or Harris -- for president ?,https://www.marinij.com/2025/10/27/with-newsom-and-harris-considering-presidential-run-could-america-choose-a-california-democrat/
,ambito.com,Las claves de la reforma laboral que busca implementar el gobierno de Javier Milei,https://www.ambito.com/politica/las-claves-la-reforma-laboral-que-busca-implementar-el-gobierno-javier-milei-n6207064
,finance.sina.com.cn,雷曼光电2025年三季度业绩回暖 ： 归母净利润同比大增超 120 %,https://finance.sina.com.cn/tech/roll/2025-10-28/doc-infvnafm1119994.shtml
,wallstreet-online.de,Iran exportiert Kraftstoff auch auf Schienen,https://www.wallstreet-online.de/nachricht/20083258-iran-exportiert-kraftstoff-schienen
,interfax.ru,Минфин 29 октября проведет аукционы по размещению ОФЗ 26247 и 26249,https://www.interfax.ru/business/1055197
,cronicadecantabria.com,"El erizo de mar se podrá pescar en Cantabria en Liñera , Comillas , La Maruca y La Arnía",https://cronicadecantabria.com/cr/el-erizo-de-mar-se-podr-pescar-en-cantabria-en-liera-comillas-la-maruca-y-la-arna/
,poslovni.hr,Erste banka i Erste Group sa 100 milijuna eura sudjeluju u refinanciranju duga Fortenova grupe,https://www.poslovni.hr/hrvatska/erste-banka-i-erste-group-sa-100-milijuna-eura-sudjeluju-u-refinanciranju-duga-fortenova-grupe-4508380
,zonebourse.com,Royal Caribbean Cruises Ltd . publie ses résultats financiers pour le troisième trimestre et les neuf premiers mois clos au 30 septembre 2025,https://www.zonebourse.com/actualite-bourse/royal-caribbean-cruises-ltd-publie-ses-resultats-financiers-pour-le-troisieme-trimestre-et-les-neuf-ce7d5ddcdc8ff523
,setn.com,鴻勁上市前亮業績 ！ 未來2季訂單滿載 11月下旬將掛牌 | 財經 | 三立新聞網 SETN . COM,https://www.setn.com/News.aspx?NewsID=1742925
,chelmsfordweeklynews.co.uk,HMRC warning of fines ahead of October 31 taxpayer deadline,https://www.chelmsfordweeklynews.co.uk/news/national/uk-today/25577442.hmrc-warning-fines-ahead-october-31-taxpayer-deadline/
,finance.yahoo.com,Big Tech earnings will focus on AI and iPhones,https://finance.yahoo.com/news/big-techs-earnings-will-focus-on-ai-and-iphones-125717589.html
,penzcentrum.hu,"Elképesztő sorsjegy tarol Magyarországon : tolonganak érte a játékosok , 75 milliót nyert vele egy szerencsés",https://www.penzcentrum.hu/szorakozas/20251028/elkepeszto-sorsjegy-tarol-magyarorszagon-tolonganak-erte-a-jatekosok-75-milliot-nyert-vele-egy-szerencses-1187703
,androidheadlines.com,Exclusive : Google Pixel 10a Official CAD Renders & Rumors,https://www.androidheadlines.com/google-pixel-10a
,benzinga.com,"Carrier Q3 Earnings Beat Estimates : Lowers 2025 Outlook , Announces $5 Billion Share Buyback - Carrier Global ( NYSE : CARR )",https://www.benzinga.com/markets/earnings/25/10/48460493/carrier-q3-earnings-beat-estimates-lowers-2025-outlook-announces-5-billion-share-buyback
,biztoc.com,BT  considering low - cost mobile brand  as Revolut and Monzo plan launches,https://biztoc.com/x/1436cc3eb1ed371b
,cfi.net.cn,天润乳业 ( 600419 ): 新疆天润乳业股份有限公司2025年第二次临时股东大会决议 - CFi . CN 中财网,http://www.cfi.net.cn/p20251028008547.html
,livemint.com,India shrimp crisis : Can  atmanirbhar prawn scale Trump tariff wall ?,https://www.livemint.com/news/trump-tariffs-hit-indian-shrimp-exports-local-market-revival-11761643316855.html
,aktiencheck.de,Euwax Trends : Anleger blicken gespannt auf US - Zinsentscheidung (),https://www.aktiencheck.de/kolumnen/Artikel-Euwax_Trends_Anleger_blicken_gespannt_auf_US_Zinsentscheidung-19149857
,163.com,PayPal成为ChatGPT首个支付钱包 盘前一度涨超15 %,https://www.163.com/dy/article/KCVVS57S05198CJN.html
,fakty.ua,Опалювальний сезон у Києві розпочнуть 29 жовтня,https://fakty.ua/462136-zelenskij-i-klichko-skazali-kogda-v-ukraine-podadut-teplo-v-zhilye-doma
,forbes.com,"Invest $100K In These Funds , Beat Inflation For A Lifetime",https://www.forbes.com/sites/michaelfoster/2025/10/28/invest-100k-in-these-funds-beat-inflation-for-a-lifetime/
,federalna.ba,Kineski premijer : Ekonomske veze sa Pekingom alternativa Trumpovoj protekcionističkoj politici,https://www.federalna.ba/kineski-premijer-ekonomske-veze-sa-pekingom-alternativa-trumpovoj-protekcionistickoj-politici-pf8gq
,blic.rs,"Tramp prekršio protokol u Japanu : Plesao sa vojnicima , premijerka ga jurila po crvenom tepihu ( video )",https://www.blic.rs/vesti/svet/tramp-prekrsio-protokol-u-japanu-plesao-sa-vojnicima-premijerka-ga-jurila-po-crvenom/xzkbmmd
,163.com,豆包月活首超DeepSeek登顶 ， 即梦 、 可灵 、 智谱 、 Kimi集体下滑 ， AI+医疗  异军突起｜2025年三季度AI应用价值榜|飞轮|kimi|deepseek,https://www.163.com/dy/article/KD00BBB80512B07B.html
,alternet.org,Trump country prepares for  unrelenting  need at food banks as GOP shutdown continues,https://www.alternet.org/trump-shutdown-food-banks/
,biztoc.com,PYPL Surges 13 % On PayPal – OpenAI Deal : $80 Breakout Line Now In Play,https://biztoc.com/x/55286156962c3f10
,onvista.de,Rechnungshof kritisiert Wasserstoffstrategie der Regierung,https://www.onvista.de/news/2025/10-28-rechnungshof-kritisiert-wasserstoffstrategie-der-regierung-0-20-26443946
,zonebourse.com,"D . R . Horton , Inc . publie ses résultats financiers pour le quatrième trimestre clos le 30 septembre 2025",https://www.zonebourse.com/actualite-bourse/d-r-horton-inc-publie-ses-resultats-financiers-pour-le-quatrieme-trimestre-clos-le-30-septembre-2-ce7d5ddcdc8ff425
,dailypolitical.com,McKesson Corporation $MCK Shares Purchased by Solstein Capital LLC,https://www.dailypolitical.com/2025/10/28/mckesson-corporation-mck-shares-purchased-by-solstein-capital-llc.html
,finanzen.ch,DAX 40 - Titel BASF - Aktie : So viel Verlust hätte ein Investment in BASF von vor 3 Jahren bedeutet,https://www.finanzen.ch/nachrichten/aktien/dax-40-titel-basf-aktie-so-viel-verlust-haette-ein-investment-in-basf-von-vor-3-jahren-bedeutet-1035431545
,radio-monaco.com,🎯 Manger selon son ADN : révolution ou illusion ?,https://radio-monaco.com/podcast/%F0%9F%8E%AF-manger-selon-son-adn-revolution-ou-illusion/
,forbes.pl,Prenumerata „ Forbes  - Forbes Polska,https://www.forbes.pl/prenumerata-forbes/jcgvcjv
,trevisotoday.it,"Controlli anti - accattonaggio tra stazione e mercato , il giro di vite azzera i borseggi",https://www.trevisotoday.it/cronaca/treviso-mercato-controlli-polizia-28-ottobre-2025.html
,mubasher.info,أرباح  السلام العالمية  تقفز 129 . 46 % خلال 9 أشهر,https://www.mubasher.info/news/4514630/%D8%A3%D8%B1%D8%A8%D8%A7%D8%AD-%D8%A7%D9%84%D8%B3%D9%84%D8%A7%D9%85-%D8%A7%D9%84%D8%B9%D8%A7%D9%84%D9%85%D9%8A%D8%A9-%D8%AA%D9%82%D9%81%D8%B2-129-46-%D8%AE%D9%84%D8%A7%D9%84-9-%D8%A3%D8%B4%D9%87%D8%B1/
,wsbt.com,Average US household expected to spend nearly $115 on Halloween,https://wsbt.com/news/nation-world/average-us-household-expected-to-spend-nearly-115-on-halloween
,khazanah.republika.co.id,Kiai Didin Berharap DDII Perkuat Kaderisasi Dai Muda dan Dakwah Digital,https://khazanah.republika.co.id/berita/t4ufuv430/kiai-didin-berharap-ddii-perkuat-kaderisasi-dai-muda-dan-dakwah-digital
,timeout.com,The 12 Best New London Restaurant Openings in November 2025,https://www.timeout.com/london/news/the-12-best-new-london-restaurant-openings-in-november-2025-102825
,lkz.de,Prominente Frauen fordern von Merz mehr Sicherheit,"https://www.lkz.de/%c3%bcberregionales/deutschland_artikel,-prominente-frauen-fordern-von-merz-mehr-sicherheit-_arid,845331.html"
,news.de,TV - News : Quotenforscher dürfen erstmals einen Streaming - Riesen messen,https://www.news.de/tv/859067092/quotenforscher-duerfen-erstmals-einen-streaming-riesen-messen-tv-news-der-dpa-aktuell-zu-streaming-medien-und-internet/1/
,wunc.org,Washington Post  editorials omit a key disclosure : Bezo financial ties,https://www.wunc.org/2025-10-28/washington-post-editorials-omit-a-key-disclosure-bezos-financial-ties
,graphic.com.gh,"Return , contribute to Africa development - KGL Group chair to diaspora after Forbes award",https://www.graphic.com.gh/news/general-news/ghana-news-return-contribute-to-africas-development-kgl-group-chair-to-diaspora-after-forbes-award.html
,aftonbladet.se,Trafikolycka på E4 i Stockholm,https://www.aftonbladet.se/nyheter/a/Rr77qd/aftonbladet-direkt?pinnedEntry=1418056
,analisadaily.com,"Tambang Emas Martabe Raih 2 Penghargaan Subroto 2025 : Inovatif di PPM , Kontributif di PNBP",https://analisadaily.com/berita/baca/2025/10/28/1068131/tambang-emas-martabe-raih-2-penghargaan-subroto-2025-inovatif-di-ppm-kontributif-di-pnbp/
,castellinotizie.it,"Alla Giornata Nazionale Appia Unesco , per i 70 anni di Italia Nostra , presentata la relazione  Aricia : la città antica e la prima mansio della Regina Viarum  dellarcheologa Vincenti",https://www.castellinotizie.it/2025/10/28/alla-giornata-nazionale-appia-unesco-per-i-70-anni-di-italia-nostra-presentata-la-relazione-aricia-la-citta-antica-e-la-prima-mansio-della-regina-viarum-dellarcheologa-vi/
,bfmtv.com,Ça a surpris la BCE ( et pas en bien ): les banques européennes limitent leurs prêts aux entreprises qui pourtant veulent emprunter ( et particulièrement en Allemagne ),https://www.bfmtv.com/economie/entreprises/assurance-banque/ca-a-surpris-la-bce-et-pas-en-bien-les-banques-europeennes-limitent-leurs-prets-aux-entreprises-qui-pourtant-veulent-emprunter-et-particulierement-en-allemagne_AD-202510280445.html
